,User_name,Review title,Review Rating,Review date,Review_body,Movie_name
65,haildevilman,Pasolini went down swinging.,5,1 July 2007,"This was a Euro version of ""Bloodsucking Freaks."" In every way imaginable.The audacity....You folks are going to need an iron constitution and a strong stomach to take in this baby.A group of Fascists (supposedly a take on Mussolini's men) keep a group of nude teens around for torture and humiliation. Why? For kicks, what else? What they do to said jail-bait (of both genders I may add) won't be printed here. Some of you may be having a snack as you read this. But it is nasty. And I don't think the wardrobe people did much here if you get my drift.The Fascists are well dressed oldsters (also of both genders, no sexism here.) getting ready to be taken prisoner in a war. So they go out in a glory of sadism. They speak in a lot of proverbs too. It got cliché after a while. But then, no one sees flicks like this for the script.P.P. Pasolini was famous for his arty, biblical, and erotic stories. Sometimes all in the same film. But here he gets gross. If he filmed his trio, (he got murdered by a boy-toy, remember?) one can only speculate in the direction he would have gone.Worth checking if you like weird and nasty films. Those of you with weak guts, STAY AWAY.I saw a Japanese version. For once, no pixelation on the (rampant) nudity. THAT shocked me.","Salò, or the 120 Days of Sodom"
66,cinematic_aficionado,Linking sexual perversions with fascist capitalism,7,17 March 2013,"The most likely impulse is to dismiss this film as a second rate, cheap porn of bad taste. However if one indulges on that intuition and rate it simply as a viewing experience or aesthetic value, would not be doing this film much justice.A bunch of fascists kidnap 18 young persons and subject them to the most degrading sexual, mental and physical abuse. These men - through brute force - had the absolute freedom to do so and completely indulged in it. Their time in the village of orgies was spent entirely listening to arousing sexual stories, followed by living them on the young and beautiful captives.By using Marquis De Sade's homonymous novel Pasolini uses this film as a vehicle to voice his own protest at how Italy of his day was becoming the captive of a tormenting and inexorable capitalism as a result of which the children of the country were chastised.There is a sense of anarchy but this anarchy is carefully contained behind the walls of a villa. These sadists are both respectable to the outside world and refined. One moment in the movie that stands out is when one of the fascists says ""The only true anarchy is the anarchy of power"".Another effective aspect of this film is that despite conveying the most successful representation of physical cruelty in the history of cinema, the purveyors of this cruelty are depicted as laughable figures. The element of satire in the film, cannot be understated. Despite their absolute power they are nothing more than a bunch of pitiful figures.My criticism would be that it could have been made in a way that does not have a B- movie feel about it. Then again, it s possible that this was intentional as to not glamorise sadistic perverts?This unusual, unsettling and often disturbing experience deserves to be seen, provoke and be discussed as to dissect its didactic element which potentially is enormous.Kudos to Pasolini for pushing the boundaries of freedom in creative expression.","Salò, or the 120 Days of Sodom"
67,PIST-OFF,"one s**t eating scene is a shock, a million is a statistic",1,5 February 2012,"this is what passes for art? this is what passes for shocking? for something to be shocking requires one of a few horrific act surrounded on all sides by relative normalcy. wall to wall sodomy and s**t eating ceases to be offensive the way it might in a john waters film and instead makes it tedious. REALLY TEDIOUS. if the goal of this movie is to shock, why not simply offer a real life snuff film of a rape or murder? the film maker seems to want to heap gratuity upon gratuity for it's own sake, so why not go all the way? the underlying philosophy seems to be spite of the fact that most people have some sort of morals or artistic sensibility. the film maker is only bluffing at the notion that we shouldn't have these or that it is us for being hypocrites. congratulate yourself you made rape, sodomy, and coprophagous as boring as any other movie cliché.if the goal of the movie is artistic or metaphorical, i call bluff on that too. the actors had to perfect an unrealism in order to spout off most of it's absurdest script. ""it's a metaphor for fascist Italy..."" shut up. you could have set this movie on the moons of Jupiter and it's allege metaphors would have been no further stretched as far as credulity. the fact that something like this is allowed the Criterion treatment is a sad state of affairs for the guardians of high culture. that they value this, whilst they scoff at far better films betrays their monolithic bias against American films no matter what. don't waste two hours of your life on this. pornographic film at least has redeeming qualities. the same cannot be said of this.","Salò, or the 120 Days of Sodom"
68,t_atzmueller,"One can love it or hate it, but one cannot deny it's a masterpiece that has stood the test of time",9,16 November 2014,"Who still reads de Sade? My guess would be that the Marquise has preciously few readers nowadays. That doesn't mean that his works are no longer relevant or even obsolete, but as far as the literacy value goes: de Sade was a keen thinker and analyst, but no literary giant. The language, even in the best translations, is so outdated, that one would almost speak about a dead language. One must pay respect to directors like Pier Pasolini to have kept the spirit and ideas behind de Sades work alive in a contemporary form.The magic of Pasolinis film-making is, despite sticking to the original ideas of de Sade, he leaves enough space for the viewer to form his own opinions and interpretations. Some have seen ""Salo"" as Pasolinis views on fascism and the abuse of power, which may well be true considering the directors political orientation. However, when I had watched the infamous ""excrement-banquet""-scene for the first time and contemplated the victims complete lack of any resistance, I had to think straight of contemporary pop-culture, that is so readily gobbled up by an unresisting youth. Be it the latest shallow blockbuster, reality-TV, some YouTube-generated Pop-monstrosity or even right down to the nearest fast-food-joints – yes, there is plenty of Pasolinis ""special recipe"" going around and most of us are demanding a second serving without complaining. Quiet the opposite.Much vitriol has been passed over Pasolinis final film, no further must you look than this review board. Outrage and disgust seem to prevail, both at the images and the motivation of script and director. Sure, opinions are like nostrils (to put it polite): we all have them and are entitled to one. That ""Salo"" is a piece of art however, that is no opinion that is a fact. Whether the viewer feels titillated or repulsed by what they're seeing, that is completely different issue. At least I don't know the law or book that dictates that art, philosophy or intellectual discourses have to be beautiful or uplifting.Despite what your personal opinion about the director, the film or his content may be – there is no denying that it is a cinematic masterpiece and will be watched (and argued about) long, long after 90 percent of today's popcorn-cinema has disappeared into oblivion. 9/10","Salò, or the 120 Days of Sodom"
69,dfle3,More a celebration of sickness and perversion than fascist critique,1,20 June 2008,"You cannot watch this movie. No, I mean literally you cannot watch it. It's been banned in Australia (on and off). Many years ago I took the opportunity to watch this movie when it was briefly unbanned and I had heard good things about it on the original Movie Show, with David and Margaret. I think David said something along the lines that this movie was a scathing critique of Nazism or fascism or something-my response to this later.Anyway, the movie is based on a book or something by the doomed pre Revolutionary French aristocrat the Marquis de Sade (can you guess how this will turn out yet?). From the writings of de Sade, we get the term ""sadism"" (guessed yet?). Oddly, whilst browsing the ""classics"" section of a bookshop, I noticed that it contained stuff by de Sade!The movie updates the setting of the original to more contemporary times-the Mussolini era of Italian history, I think.Back to Stratton's comments on the movie-I couldn't disagree more. I found this movie to be a celebration of sickness and perversion. Sadists would like this movie, I think, but not if they baulk at murder. Masochists (named after the Dolphin de Maso...look him up) would not, as the cruelty in this movie is not consensual...no 'safety' words here, like ""God that hurts!!""-words being unutterable in some cases in this movie.Even though I don't remember too much of the context of the movie-I do recall what you would call ""the victims"" entering this environment-maybe it's some military establishment or something. And I remember some of the EXTREME cruelty perpetrated on them. There is blood in this movie and some of the scenarios are really horrible.Also memorable are the scenes of 'feasting'. Eating what? Er, I'm not talking cannibalism here...but gee, you wouldn't want to plan eating sticky date pudding afterwards!I also remember one scene-in long shot, thankfully, where I blinked before the director did...in other words, when something gory is about to happen, you don't get a cut away...you have to endure the horror, unless, like I did, you turn away in horror.Perhaps this movie is rightly banned, at least here in Australia-not a case of nanny-state meddling. Now, THIS is hardore.","Salò, or the 120 Days of Sodom"
70,hellholehorror,Harrowing,2,25 June 2018,"Poor quality sound and very dirty messy print. The transfer was not good either with film slipping and bad aspect ratio. Effects were generally pretty convincing - hope they weren't real. There was not a lot of thought or creativity involved. They just thought of the sickest things and made people do it. Most noticeable is the thought that people actually acted in this. This is impressive and bumps the score up a little. I've never seen anything like this made before it. I only watched the first half hour at normal speed, then sped it up to 1.5 speed. I got what was going on and didn't like it. This is all about humiliation, degradation and sodomy. There were also sex stories. The concept was pretty horrifying and harrowing. I didn't like it. Sick twisted and wrong - certainly not enjoyable.","Salò, or the 120 Days of Sodom"
71,moviemanMA,Nightmare Italian Style,8,10 June 2009,"The title of this movie is straight to the point. The film is about a group of Italian fascists who round up a group of young men and women, bring them to a mansion away from the rest of society, and basically do whatever their sick hearts want. There is everything from the eating of feces, walking people naked on leashes, and of course sodomy. As graphic and appalling as some of the scenes are, this film could have been a lot worse. Some of the dialogue here is excellent, bringing up some interesting conversations that have much to do with the story. It's basically a group of people who have unlimited power, playing out their twisted fantasies because they can without repercussions. Pasolini has some beautiful shots in this film as well. This is not for everyone.","Salò, or the 120 Days of Sodom"
72,futures-1,One of the roughest films you'll ever see.,8,6 June 2005,"""Salo: The 120 Days of Sodom"" (1975): Be prepared for one of the roughest films you'll ever see. This was Pasolini's last, and going by what I've seen, his vision only became bleaker and more disturbed as the years clawed along. Using the Marquis de Sade's ideas on the decadence of 18th century France, Pasolini represents Fascist Italy (1944-45). We are shown the upper class  always removed and protected from the outer world  as predators of the poor, weak, young, and less educated. A group of wealthy adults shop amongst the kidnapped older children of bourgeoisie. They choose eighteen, and steal them away to a hidden mansion, where there is no escape. There, the adults live out every twisted fantasy they've ever had or can now muster, while demeaning, raping, and torturing the youngsters. The teens react in many ways, none of which are ""pretty"". This entire film experience MUST be viewed as a symbolic, emotional ""explanation"" of what it was like to live under Nazi/Fascist rule (in this case), and how an otherwise normal, decent society could be turned into lunatics and sub-animals. Although made 30 years ago (with the usual weaker production qualities of that era), I cannot think of another work which so blatantly and painfully illustrates what those in power are capable of doing when boredom gives rein to impulse. In comparison, ""Lord of the Flies"" barely lights upon these issues, ""Pink Flamingos"" was but a tiny, kitschy springboard, and ""Schindler's List"" described a much narrower range of degradation. To this day, ""Salo: "" is banned in some countries. This is NOT a film about acting, lighting, sound, camera work, etc.. This is a film about states of mind  theirs then, ours now. P.S.: If you are interested in set design, this one is FILLED with original Cubist/Bauhaus/Futurist/Moderne furnishings, murals, and art. Spectacular. Those styles were not yet being reproduced, so Pasolini used the real thing. There is also an interesting use of a Charles Rennie MacIntosh chairwhich will alter how you see this design from here on out.","Salò, or the 120 Days of Sodom"
73,sunznc,"Dull, boring, poorly done, save your money",1,11 August 2013,"Do not waste your time on this dull, idiotic, pointless, boring film. It'd be more entertaining to watch ants marching in a line on the ground. Seriously. This is tedious stuff.First of all, the glossy stills one sees on the Internet have much more clarity than the film and are much more interesting. Those scenes in the film are brief and shown from afar. The dramatic scenes, which are very few, are over before you can register what is happening. Caligula with Malcom McDowell is far more entertaining than this and much better made. You also get a little bit of glossy, graphic porn mixed in. But this? It's just total bottom of the barrel crap. You can't get much lower than this unless you watch some 1960's low budget horror exploitation film. Even worse are the relentless and torturous references to human excrement and re-enactments of that ""event"" as it is put in the film. Trust me.....you do NOT want to see this pile of ""that event"".","Salò, or the 120 Days of Sodom"
74,Seamus2829,Sweating Cannonballs,6,3 August 2008,"This, Pier P.Pasolini's final work (and the third in the trilogy of films adapted from novels)is probably one of the hardest films you will ever be subjected to. The film, adapted from the Marquis DeSade's 'The 120 Days' is set during the final days of fascism in Italy, during 1944,when a group of Fascists take a batch of newly arrested Communist youths to a swanky house in the countryside, and subject them to four months of some of the most de humanizing,degrading forms of humiliation,torture & eventual horrific deaths that one could hope to see on screen. This film even managed to gross out Al Goldstein,publisher of Screw Magazine,resulting in his walking out on it. What makes this film more hard to watch,in contrast to some of the Italian horror films of the same era (with some pretty horrific & graphic violence)is that things like the stuff that's depicted in the film actually happened. This film (no surprise what so ever)received the X-rating in it's original release in 1975. Approach this at your own peril.","Salò, or the 120 Days of Sodom"
75,Prof-Hieronymos-Grost,A Masterclass in perversion,10,3 October 2008,"As Allied forces began their final push to control Italy, a group of Fascist leaders in Salo, Northern Italy, (the last bastion of Nazism left in Italy) who knowing their time is limited, decide to bow out with a bang. Their plan is to kidnap local boys and girls, the sons and daughters of so called Communists in the community in order to subject them to the utmost degradation while at the same time satiating their own evil vices. The four main leaders gather at a palatial country house and draw up their perverted plan down to the utmost detail. The kidnapped youths are told that they can forget being rescued as their families believe they are dead, they are here to be degraded by those in authority and that they will be punished if they look at a member of the opposite sex and that anyone resorting to any religious activity will be executed. Each day the captives and their captors gather in the great hall where one of three mature ladies of ill repute, all Madames from local brothels, each take their turn to regale them with a detailed erotic tale from her past, this is designed to get everybody sexually aroused for the coming orgies. These youths initially show some rebellious traits, but these are quickly curtailed, as they are continually subjected to degradation, humiliation, debauchery and rape, but these are some of the lesser evils inflicted on them and by the end its difficult to tell the youths from their captors, as the rapists are themselves raped while in the midst of their dastardly deed, their hedonistic transformation complete. Pasolini's most controversial film is loosely based on some equally controversial writings, Dante's Inferno and De Sade's incomplete 120 days of Sodom. The film echoes these writings and is split into three parts, The Circle of Manias, The Circle of *beep* and The Circle of Blood, with each subsequent section becoming more vile, although it's the second section, a sickening banquet, that will stand out and live long in the memories of all who lasted the pace. The final segment gathers a pace as the allied bombers become louder and the captors seek the ultimate satisfaction when all the hell of the ""Inferno"" is unleashed in a brutal final scene of sadism that is virtually a portmanteau of all the most gruesome scenes in Horror movie history, it's a scene that can leave no doubt in the viewers mind, that the captives are in the Hades/Hell of De Sade's imagination. Pasolini's film has a justified reputation as a disturbing film and despite its exploitation excesses it is a remarkably well crafted film, exquisitely filmed by long time collaborator Tonino Delli Colli (perhaps best known as Leone's DP on Buono, il brutto, il cattivo, Il,). Each stark and sterile scene seems to have been framed with a geometric fervour and the continual bombardment of harsh and disturbing visuals is juxtaposed brilliantly against the beautifully simple piano arrangements and sumptuous strings of Ennio Morricone's orchestra. Pasolini takes up the story at De Sade's request where he had left off, De Sade in his unfinished book asking the reader to finish the story themselves and this Pasolini does with gusto and glee. Pasolini had long courted controversy in his career, touching on controversial subjects, being a homosexual and also a strong anti fascist, which is ironic because his father was a hero to the fascists, as he had once saved Benito Mussolini's life. He had long been scorned by the Catholic Church because of his lifestyle and beliefs but received somewhat of a reprieve from them after his film The Gospel According St Matthew was released, which the church surprisingly praised as a fine tribute to the man, but it wasn't long before he was back on controversial topics such as Salo. Sadly Pasolini for his troubles never actually lived to see Salo's official release as he was brutally murdered before hand, by a male prostitute amidst rumours of a Mafia hit. Pasolini's homosexuality is perhaps one of the reasons the film is labelled in some circles as nothing more than arty gay porn and yet there is also plenty of heterosexual content, so it's a moot point, but there are many gay scenes within and the film as a whole and it does have a preponderance towards, nay, a continuous homage towards the buttocks and anus, which are given an exalted position at the expense of both sexes genitalia, so if one is in anyway leaning towards homophobia this film should be given a miss. The film is also noted by many critics as dull or boring, for my own part I found it riveting, as the film wastes no time in getting down to the dirty shocking deeds and continues to surprise and shock with every reel, a ""Filet de Cinema"". The film is a manifesto for perversion and evil and how under the right/wrong circumstances it could be brought out in us all.","Salò, or the 120 Days of Sodom"
76,squeezebox,"I see the point, but it's tough wallowing through the crap - literally",6,24 January 2003,"Widely considered to be the most grotesque movie ever made, this loose adaptation of De Sade's book is certainly one of the most disturbing and repulsive. While it may not be THE sickest movie ever made, it's in the running.Updating De Sade's basic story to WWII Italy, SALO tells the story of four bourgeois fascist rulers who kidnap two dozen teenage boys and girls and put them through four months of physical and psychological torture until finally butchering them after every conceivable atrocity has been exhausted. The violence is tempered by tales of sado-masochistic sex, bestiality and scatology told by a middle aged prostitute to the delight of the perverted foursome.The scenes of torture and humiliation are almost unwatchable: the kids are forced to abstain from bowel movements so their well-cooked feces can be consumed for dinner; the kids are made to walk around on all fours and eat from dog dishes; they are raped, sodomized and beaten; eyes are gouged out; tongues are ripped out; kids are eviscerated alive, etc., etc.Pasolini's intention was to create an allegory equating the fascism in Italy under Mussolini to the sadism of De Sade's darkest fantasies. It's a nicely produced film, well shot and well performed, and it certainly packs a wallop. But the movie is so outrageously disgusting that whatever points Pasolini tries to make are drowned in his own excessiveness. The film winds up a freakshow with delusions of grandeur. It has developed a vigorous cult following, but as much for its sordid subject matter and gore as its loftier aspirations.Basically, SALO is a political satire denouncing the inhumanity of fascist states led by sadistic megalomaniacs like Mussolini, Hitler and Stalin mixed with an over-the-top gross-out horror movie. It's interesting (if you have the stomach for it) and worth checking out for fans of bizarre/maverick/sick cinema. But anyone more interested in the intellectual or literary aspects will no doubt be too nauseated to have much more than a gag-reflex reaction.","Salò, or the 120 Days of Sodom"
77,gregberne11,Disgusting Doesn't Make It Art,1,8 January 2019,"This movie is disgusting. Seriously if you watch this all the way through you must be sick, if you actually like this movie there is something seriously wrong with you. It's nothing but horror-porn.","Salò, or the 120 Days of Sodom"
78,XxEthanHuntxX,Depravity Philosophy,8,11 March 2021,"Vastly inspired by both Dante and Sade, Pasolini's controversial final vision - Salò, or the 120 Days of Sodom is a stunningly real performance. It takes place in the Republic of Salo, Italy, under German Nazi rule in 1944. We meet the film's four main characters: a president, a judge, a bishop and a duke. In a pact, they start their private game, where they first by military force kidnap a large selection of young boys and girls, of which they select nine girls and nine boys, and then take them to an extravagant castle. Upon entering the house itself we hear stories of various kinds, told by whores; stories that the four overlords' sex slaves are then forced to carry out. Divided into four parts. Circle of Maniacs: shows the first prostitute's stories about sex, and preferably anal sex, and furthermore how the innocent young people are forced into various sexual acts. Circle of Shit: shows the other prostitute's stories about excrement in sexual acts, and further how the young people are forced into similar acts. Circle of Blood: shows the third prostitute's stories of torture, and how the four authorities gather those who have broken their rules and punish them.Salò tells an excessive story about one side of the human entity, ruthlessly supported by different forms of cruelty. When it comes to man, good is only a corset imposed on him by the lies of religion, society, and culture. By nature, however, humans are completely amoral; whenever the opportunity arises, they ruthlessly satisfy their desires: power, domination, cruelty and, above all, sex drive. In the film, fascists, feeling unlimited power, treat their subjects like animals. The film shows the true face of fascism. They call themselves the only true anarchists and turn their acts of violence into both a political and a philosophical stance.","Salò, or the 120 Days of Sodom"
79,mikeiskorn,Where To Being?,5,24 May 2021,"Yes, this was a shocking movie for what it was but actually didn't shock me whilst watching it. I think after watching a Serbian Film, nothing will. Perhaps I've been desensitised haha. The stories told were more alarming than the actual depraved acts!","Salò, or the 120 Days of Sodom"
