,User_name,Review title,Review Rating,Review date,Review_body,Movie_name
264,diana-sofronieva,"Lame, Base, Pretentious",3,27 April 2019,"Pale, well-dressed men with long hair go around killing beautiful scantily clad women while delighting in their beauty. They believe themselves to be deep and sensuous and the viewer is supposed to believe that too but, well, there is nothing to impart that belief: slow movement and big ego doesn't suddenly make you deep and sensuous.Perhaps an outcast teenager would enjoy this movie: Louis, 'a vampire with a human heart', tells us that he feels out of place everywhere. The oldest vampire in the world tooks a like on him: guess what, Louis is the only one who can connect the vampire world and the human world! 'You feel out of place, Louis, and this is precisely your strength, you are the only one who can bridge the vampire and the human world, you, Louis, you!' See what I did there?'We mistake our barbarism for sophistication, and our isolation for having special qualities.' The audience can now satisfy its lower instincts and delight in the cruel scenes and in the ego inflation scenes, all quite innocently, because of the fancy shmancy decor and top actors on the cast - surely this must be some quality art? No, it's not.Lame would be an understatement, but the producers clearly knew what threads to pull in order to produce a box-office hit.Why the 3 stars? 3 good things in this movie: The opening scene. Brad Pitt's clothes - really amazing, a delight to watch! Red velvet jacket's my favourite, I think. And Antonio Banderas, who somehow manages to not be horrible despite looking ridiculous with the long straigth hair and no colour on his face.",Interview with the Vampire - The Vampire Chronicles
265,Sydekick,A Decadent Almost,3,18 December 2004,"The Interview with the Vampire proved to be a movie of almosts.The plot was almost fascinating. Even the poorest actors and directors would not be able to completely kill Anne Rice's writing. Vampires are always exciting, and Rice's sensual killers...even more so. The acting was almost engaging. Brad Pitt was surprisingly suited to play the role of the morally-ambiguous Louis, and managed to pull of an acting job that belied his pretty boy reputation. Of course, he might have only seemed impressive when put beside his costar Tom Cruise, whose performance served only to cement his role as a pretty face with a gaping lack of talent. Antonio Banderas was also stunningly ill-suited to play the role of the ancient vampire Armand. (Of course, I may have only been distracted by his ankle-length hair. If so, then I can hardly be blamed.) while Kirsten Dunst gave a remarkable performance as the child vampire Claudia. Her death almost brought a tear to my eye. Almost.All in all, the movie was a fascinating waste of time. Although the cast was certainly drool-worthy, the film walked the thin line between a welcome success and a dull failure, and all-too-often stumbled. It was ridiculously overdone--almost. It was decadently vicious--almost. It would be a waste of time to watch again--that's a certainty.",Interview with the Vampire - The Vampire Chronicles
266,aprilcullen-24458,Great film but could be louder,10,16 September 2017,"I thought this movie was great. Lovable characters, great actors, fun and different personalities and backstories, and a great plot. The only real problem I had with the film was that I couldn't hear a lot of it. I had my TV turned up to 50 and still couldn't make out what they were saying. But all and all it was a great movie.",Interview with the Vampire - The Vampire Chronicles
267,pixiekitten,Mesmerizing!,8,16 July 2005,"What can I say? This was an amazing movie. A magical story, the creator has a wonderful imagination with vampires: how you become a vampire, whether vampires hate or love being what they are...Kirsten Dunst was incredible. Playing Claudia, a child vampire, she was a great actor...she must have been ten years old. A lot of the dialog was the same as in the book, which I like; I hate it when the book is completely different from the movie. Actually, some of it was different: in the book, the reporter was just a boy, probably nineteen, but in the movie...probably thirty. But that's all right. The fact is, the story was completely impressive. All in all, I loved it.",Interview with the Vampire - The Vampire Chronicles
268,Uruguay,A waste of Anne Rice's excellent novel,7,6 February 1999,"Brad Pitt and Stephen Rea (who has a supporting role) are the only ones that really fit. Kirsten doesn't seem to fulfill what Claudia's part demands when talking about her acting, but physically she's perfect (she's really pretty, like a doll!). Christian Slater passes, but... RIVER!!!! :( Tom Cruise, in spite of his efforts (which we appreciate), *can't* be Lestat, although he made us forget that he was Tom, for some moments. But the worst is yet to come: ANTONIO BANDERAS. How to start ""critizicing constructively""?... Jim Carrey would have been better as Armand. To make it clear- when you see Antonio, do you think ""he's a Botticelli angel"" (as everybody describes Armand) or ""he's a Macho Latino"" (as everybody describes Antonio)? And when you see Antonio, do you think he's 17 years old (seeming age of Armand)? Besides, Armand's the one whose reputation's most ruined here... we mean, in the novels, Armand does NOT act in the theatre, he's NOT, like, 'hysteric', he's NOT evil and he stays with Louis (for some time, because then he leaves him :( )Armand's the victim, not the 'victimary'! In short- who made the screenplay did not read the book. Highlights- Claudia's transformation scene, Dante Ferreti's artistic direction, and... Dante Ferreti's artistic direction.",Interview with the Vampire - The Vampire Chronicles
269,Jay-210,Very disappointing,4,24 March 2000,"Interview' has been a long time for me one of those movies you keep meaning to see until you finally do, years later. Now that I have, I can only express my disappointment. I don't think the slightest attempt was made to capture the romance, the passion, and the pure ambience of the story. Now I do concede, as has been said many times, that if a novel is good enough to be made into a movie, it's probably not even worth it. It's old news that the book is always better than the movie. I grant this, but much more still could have been done with it. This movie should have been an homage to the novel, but it was in fact a disgrace.However, as a film it did have some redeeming qualities. The cinematography was beautiful, the acting superb. Tom Cruise is in his element here (larger-than-life characters) and they don't get much larger than the Vampire Lestat. I cannot envision anyone else take on the role the way he did. Pitt I was surprised and impressed with, though I was doubtful at first of his being cast. Kirsten Dunst shows amazing talent. I have a common gripe  Banderas as Armand. Though, incredibly, he does some acting, he's a terrible choice for the part. And I would have liked to hear them all adopt a French accent.The ending was horrendous, the worst possible example of creative license I have ever seen, and gave an awful impression of the real story.Definitely read the books; don't bother with the movie if you're looking for more than performance. It is truly not worth it.",Interview with the Vampire - The Vampire Chronicles
270,jclem,This is one vampire movie that doesn't suck!,9,24 March 2000,"Having seen my share of vampire films in my nearly 40 years, I don't think I've ever seen one as well-done as this one.  Bram Stoker's ""Dracula"" wasn't bad, but there was far more fluff than substance.  Carpenter's ""Vampires"" was ludicrous...and ""Blade""?  Well, let's not even go there.  This film, however, gives a depth of meaning to the life of a vampire that makes the monster far less threatening and far more understandable.In this movie, we get to see what motivates them...why they do what they do and the general depths of depravity that isn't only innate to characters as vampires, but to that of humans in-general.  I found the emotions portrayed in this film as more real than in any of the aforementioned vampire-themed films.  And more, all the main actors did extremely credible jobs in their roles.  I think the only role where Cruise has even come close to what he put into Lestat was in ""A Few Good Men"".  Pitt was a bit pouty, yes, but that's his morose style anyway.Anyway, this a thinking person's film.  If you want blood, gore and body-parts all over the screen, see the films mentioned in the first paragraph.  If you want something that makes you think, watch this movie.",Interview with the Vampire - The Vampire Chronicles
271,poicaleeruantale,Anne Rice-Brilliant,10,7 April 2006,"I love Anne Rice's vampire chronicles and the character I really love is Louis. I couldn't wait to see Brad as Louis and I new I wouldn't be disappointed and I wasn't. Brad was beautiful, just as Louis is portrayed by Anne in her novel.I'm not fond of Tom Cruise and personally don't believe he's a good actor but to give him his due, he was a natural Lestat and portrayed the character wonderfully. This is the only Cruise film I like and I don't watch it for Cruise but for Brad/Louis whom I adore.Brad just gets better and better and when you know this is an earlier film for him you realize what a great actor he is.Interview was/is a very good movie and considering how hard it is to bring a novel to film, especially in this genre, I think the cast and crew did a great job and deserve a 10.I'll keep watching this over and over again!",Interview with the Vampire - The Vampire Chronicles
272,Miles-84,Initiative take on the life of a vampire - a must see!,10,5 December 2001,"When I first sat down to watch IwTV I had no idea what is was about and no expectations so I was overwhelmed by the amazing plot, direction and of course acting. Dunst shows strength and depth of emotion in her role as Claudia which I have never seen from a child actor/actress and which is often lacking in many adult performances. Dunst and Pitt portray the very ambiguous relationship between Claudia and Louie with such aptness that even after Claudia has been killed I was still changing my mind and trying to decide whether as a couple they were father and daughter, siblings or lovers. We cannot of course forget the characterisation of Lestat de Lioncourt by Tom Cruise - truly magnificent. Cruise and Pitt together offer the compelling difference in attitudes, towards the Vampire existence, of Louie and Lestat without over dramatising the characters. The characters written by Ann Rice here truly excel: Louie, grieving his dead wife and child has nothing but contempt for his new found life, power, eternal youth and sees it only as a perpetual hell of damnation; and Lestat on the other hand sees his existence as his saving from the dull and meaningless human existence and approaches everything with an optimistic outlook which is rarely disappointed but Louie starts to bring him down and Claudia appears to be the solution. That she is until she becomes ""insane"". The way the plot then twists the characters around so Louie sees reason for life with the `rebirth' of Claudia and Lestats loss of passion due to the arguments with Claudia and Louie followed by the dramatic scene of the attempted take on his life. The story stays realistic though as no one does a full 180 in personality terms however long they live so the characters are brought right back to their original mind states when Louie meets Armand and Claudia is killed and when Lestat feeds upon the interviewee. Masterful script writing on all counts. If you are a person that prefers the thrills and spills of big screen action then you may enjoy this purely from the action and gor side but for those who are intrigued by original and interesting script writing, superb acting and powerful visual effects and images to empower the previously mentioned this is the movie for you and very much the movie for me.",Interview with the Vampire - The Vampire Chronicles
273,annc1,The ultimate vampire movie,9,7 October 2010,"I first watched Interview with the Vampire some years ago and have seen it again recently. I find it a very gripping and atmospheric film with a haunting music score and an excellent script. All the actors give fine performances. I have never been a fan of Tom Cruise, but think his betrayal of Lestat was brilliant, by far the best I have ever seen him. Brad Pitt as Louis, while good, did irritate occasionally, for example, in his final scene with Armand his continuous monotone became wearisome. Kirsten Dunst also put in an exceptional performance as Claudia the child vampire. Although I have never read the book on which the film was based, I understand the portrayal of Armand by Antonio Banderas was contrary to his description in the book. I have read however, that the director Neil Jordan stated that this was because of the sexual undertones between Louis and Armand. With there already being undertones between Louis and Claudia, Jordan felt that an older Armand would be preferable. That having been said I think that Banderas turned in a captivating performance and truly conveyed a vampire that was ""powerful, beautiful and without regret"".You can keep the Twilights and New Moons etc. – this is THE vampire movie!",Interview with the Vampire - The Vampire Chronicles
274,Cris_Hdz,Elegant and attractive Vampire story,9,15 October 2020,"This is one of the most enjoyable vampire films I ever saw. It has a lot of qualities that a truly Vamp-Fan can grasp: Sensuality, Mystery, Elegance, a very good story telling, and did I say elegance?Far beyond the limits of a simply vampire film, this film encourage the drama and all the difficulties that a vampire or the way I see, an ex-human, can have after the dreamy life isn't enough to be, but then the things are utterly more than the expected, the immortality is the challenge to accept, and with it the uncertainty of living.Great performances (one of the best ""bromance"" gave by Brad Pitt and Tom Cruise) although the brightness is not over their shoulders but in the story it self: captivating and vast. For sure the best vampire recommendation that I could give.",Interview with the Vampire - The Vampire Chronicles
275,Koosler,Near-flawless,9,9 November 2018,"This is exactly what Chronicles fans should want of a screen adaptation: near-flawless, its few issues too mild to spoil plenty of great acting, superior cinematography and a script that totally captures the essence of the source material and its protagonists, leaving or changing nothing of consequence.Tom Cruise mightn't be a great actor, but he always took his job seriously, and none proves it best than this, I sincerely believe his finest performance -and Anne Rice must've agreed, given her famous turnabout on him. Lestat's complex persona is all there: mercurial, expansive, narcissistic, often cruel and, for all his fledglings cared to see, also shallow, amoral and even unwise -except when, surprisingly, he chose not to be.Brad Pitt does a good job as the brooding, often distressed Louis, but on occasion he lets affectation creep into his performance -oddly, to make the rather unnecessary point of being otherworldly. Kirsten Dunst, all of 10, portrays the mind of a woman in her 70s even more realistically than the 5 years old child she starts as. As for Banderas, I don't care that he looked too old (Armand's origins aren't explored here, so there's no need to stick to that detail). What he's asked to do -a 400 years old vampire who's ultimately far needier than those who seek him-, he does it well. Stephen Rea was the only one I really didn't like -a pity, as I like the actor a lot, but his performance was so over the top, it came across as clownish and dumb; plus, no offense, but amidst a cast of almost uniformly gorgeous people, he stood out like a sore.The production values are top-notch, from the cinematography to the decoration and effects, the music immediately establishing the eerie mood. The vampire makeup is excellent -one thing I noticed is that, despite the heavy use of contact lenses, hardly ever do you notice the awkward ""cross-eyed"" effect when these displace; they must've taken great care to avoid this.",Interview with the Vampire - The Vampire Chronicles
276,oskhen,"A magnificent drama, but not much of a horror movie.",8,4 December 2005,"The biggest problem i've got with this film is that it is obviously considered by many, for instance by the comments in the newspapers, as a horror movie. That's bullshit. It almost (if only almost) as much horror movie as, say, Lord of the Rings, where there also are some exciting part where people are killed by supernatural beings. Is that what is required to put a movie in that genre?No, its not much horror in it, but as a drama, its wonderful. It's definitely one of my favourite movies with a content that I find unusually deep, at least for Hollywood, it's looking good and most of the actors are superb, save Antonio Banderas. I don't know if he's too old, since I've never read the book, but his acting is all too unrealistic.Since so many dislike Cruise, I must only say that I think his doing a fantastic job. That man has just grown in my eyes during the years, and this is one of his greatest roles ever. By the way; the makeup on the guy is so good that I didn't recognize him the first time I saw the movie. In fact someone had to tell it to me, and I hardly believed it. Perhaps mainly because of the colour of his hair and eyebrows. That little lass is a children-actor (don't know if that's a word, but I hope you understand it) I have only seen the like of in the sixth sense. The rest of the actors are also good.One the best things with this movie is that it feels so realistic; it makes you feel that this is how it must be to be a vampire; the problems, the feelings, etc.. Somebody obviously thinks this movie is stupid and ridiculous. I only agree on that on one, and only one, single detail: the coffins. Why the heck are they sleeping in coffins for? Why don't they just have the bed in a basement without windows or something? Yeah, I know vampires, at least in Dracula, have to sleep on the earth of their homeland, but I don't remember that's a topic in the movie. And there are so many other traditions they are breaking, so...Well, that's a detail. The movie is good, beautiful, in fact. It's one of the most beautiful movies I know, with a mood throughout the whole thing that is quite unique. OK, I admit that it might be a bit boring at times, a bit too slow, but that's is on the other hand necessary - to a certain degree. This movie couldn't handle much more speed.I definitely recommend it, but don't expect very much horror. Maybe that's why some are disappointed; they expectations were not fulfilled.",Interview with the Vampire - The Vampire Chronicles
277,LovefilmsALOT,A must must see!,10,12 January 2006,"Fantastic film!I saw it about 9 years ago and I can't stop watching it now. I thought that because you had so many famous actors like Tom Cruise, Brad Pitt and Antonio Banderas etc that the film would be overwhelmed by the cast and divert away from the story. This is really isn't so. The script is rich and powerful and the actors have just intensified the storyline. There's not many effects in it which makes it even more intriguing compared to it's sister film ""Queen Of The Damned.""But if you're looking for a classic film, with fantastic gore and script worthy of the books, then I'd see this. There are many vampire flicks on the market,but this one has got to be the best vampire genre film I have ever seen. Vampire lovers?U gotta see this!!!",Interview with the Vampire - The Vampire Chronicles
278,Cher-5,unsuccessful attempt to be like the book,1,26 January 1999,"I love Anne Rice books. One should not try and transform it into a movie. When they did ""interview with the vampire"" i cringed throughout the movie wishing I never watched it. The movie never portrayed the characters faithfully and one should never try to create what Anne Rice creates from a book into a movie. Leave Anne Rice stories to imagination.",Interview with the Vampire - The Vampire Chronicles
279,steveu-2,"This dark, but human fantasy is an all-time fave",8,16 October 2001,"After renting this movie about 4-5 times, I finally bought in on sale at a grocery store and can now view it at any time. I've seen thousands of movies, but this is in my all-time top ten or so. It's hard to pinpoint exactly what it is about this dark, melodramatic fantasy that I like so much, but it's certainly carved a niche in my all-time list. I can start with the great opening and closing sequences that bookend the film and continue on to the intense performances by Tom Cruise and Brad Pitt, the brooding New Orleans and Paris landscape, the chilling musical score and on and on. I used to say I liked horror movies and I suppose I still do, somewhat ... and yes, the movie chills and thrills, but thanks to the characters and the screenplay, this is much more than a horror movie. I didn't go into this movie the first time with any particular interest in Anne Rice or anything but a curiosity. But this film has a heart, a soul, a horrible beauty, an ambiguous sexuality and many other elements that greatly intrigue me. At its heart, though, IWTV is about the heart and soul of Louie (Pitt) who lives with temptation and regret every day of his 200 years, which is something most of us can relate to. His performance, along with the spectacular ones of Cruise, Dunst and Banderas is spell-binding.",Interview with the Vampire - The Vampire Chronicles
280,EBathory,one of the best vampire movies made,10,30 May 2000,"This movie inspired me so.  No one but Tom Cruise, Brad Pitt, & Antonio Banderas could portray Lestat, Louis, & Armand respectively.  This movie abandons that long known theory of Bela Lugosi's Dracula.  A must see.",Interview with the Vampire - The Vampire Chronicles
281,ToxicChic1994,A dark tale of vamps,10,29 September 2006,"This is my favorite movie ever! Claudia and Louis in this film are my favorite vampires! Well almost, my favorite vampire is Spike from Buffy The Vampire Slayer....But ANYWAY.....Very good film! It's very dark, yet very interesting. I've never saw a movie with such emotion.The costumes are wonderfully good too.Kirsten Dunst as Claudia was wonderful! She mastered it completely! She showed emotion SO well!Brad Pitt was very very good as Louis! I love the fact that he hated himself for being a vampire. Without him, this movie wouldn't be nearly as good!And Tom Cruise,was excellent as Lestat! Every time he talked,you could just feel the creepiness in the air! All in all, This movie is a MUST watch .",Interview with the Vampire - The Vampire Chronicles
282,Makoshark11,Interview of the Vampire is one of the best vampire movies ever made.,10,4 November 2001,"""Interview with a Vampire"" is a very good movie for vampire lovers; it doesn't have the best special effects and it does have some cheesy parts in it, but it has a great story line and two of the best and well-known actor of all time in it (Brad Pitt & Tom Cruise). One interesting fact not every one knows about this movie is that Jonny Depp, another excellent actor, was asked to play the part of Lestat, Louis's maker, before Tom was.",Interview with the Vampire - The Vampire Chronicles
