,User_name,Review title,Review Rating,Review date,Review_body,Movie_name
67,adamjohns-42575,Bite Me!,7,17 August 2020,"I really like this film. The story is fantastic and so is the cast, even Tom! But Kirsten stands out in her role of Claudia, she plays the part as an adult would and that's just how a woman trapped in a child's body should be.Essentially there is no ending, but it's more about the journey itself. I think it would make a great TV series which could expand on it all, as if anything, it is a tad rushed.Beautiful costuming and sets. The world seems to look as I would expect it to and it contains my favourite Christian (Slater not Devil Worship) as well as a lot of homo-eroticism.Another one to add to my ""I can't wait to read"" pile.",Interview with the Vampire - The Vampire Chronicles
68,Reviews_of_the_Dead,Good Adaptation of an Interesting Novel,9,3 August 2019,"This was a film that I remember watching when it first hit the movie channels back in the 90's. This one I actually think I've only watched it all the way through a couple of times, but used to jump into it whenever it was on quite a few times. If it was on I've actually read this novel that it is based off of, as well as others from the series as well. The synopsis is a vampire tells his epic life story: love, betrayal, loneliness and hunger.We start here with Louis (Brad Pitt) in a room with Malloy (Christian Slater). He is a writer and this is an interview that Louis wanted to do. He reveals in the first minute or so that he is a vampire. This shocks Malloy who doesn't believe at first, but Louis shows his abilities immediately. He then starts to tell his story.It takes us back to 1791 in Louisiana. We learn that Louis lost his wife and child during childbirth. He is a deep depression and is pretty much looking for a way to die. That brings him in contact with Lestat (Tom Cruise). He gives him what he wants, but makes him an offer of a dark gift. Louis doesn't full understand what that means, but accepts. He is made into a vampire.We then see Louis seek into an even greater depression as he tries to cling to his humanity. This brings him to the decision to feed on Claudia (Kirsten Dunst). Lestat decides to turn her into a vampire, who will be forever a child. Both of them grow to see the monster that Lestat is and tried to rid themselves of him. They then flee to Europe to try to find others of their kind.They finally do in Paris, where they find vampires who are much older. One of them mimics Louis, Santiago (Stephen Rea). This leads him to Armand (Antonio Banderas), a much older vampire than Lestat. The problem is there are some rules that these vampires from America have violated and the punishment can be quite severe.Now I wanted to go a little bit vague in my review of this film, because there is a lot here. As I stated, I read the novel and this film runs 2 hours long. The interesting thing is having the writer of the novel, Anne Rice, be the one who penned the screenplay. Something that really struck me with this viewing as well, these vampires are really what Twilight was going for and failed. Rice really envisions them to be pansexual and just in love with beauty. It is interesting that they actually downplay it here as this is a theme she revisits a lot in the novel and others as well.An aspect of this story that I really love is taking a timeless creature like the vampire and actually show them living through different eras. This film has Louis as a slave owner. His slaves believe there is an evil spirit around them and they're right. This causes them to lose the plantation. We see them dealing with the plague in New Orleans, which to be honest, I didn't know it struck there. We then see them moving through Paris as well. There is interesting as the vampires that Armand and Santiago are with are decadent and being of an old world. This will move into my next point, which is why Armand falls in love with Louis.I think that having someone as depressed as Louis is great for this story. He is of a new world. He doesn't want to feed on the humans around him. He is clinging to his humanity, even though he's a vampire. He isn't of royalty like Lestat was before he was turned and he wasn't a boy lover to the rich like Armand or a child who doesn't understand like Claudia. He is from a world where he knows better and he is stuck in that mind-set. It would make sense he would seek out a human to tell his story to like he does.From here, I think I should shift to the acting of the film which I think is excellent. Pitt brings enough pain his look to really bring this role to life. He does a lot with his eyes, even though they're altered as a vampire. I could still see so much pain in them. He did a great job and you can see how good of an actor he really is. I have to say that Cruise is amazing in bringing such arrogance to Lestat. Having read other novels in the line, you realize he isn't as bad a character as he is in this novel, which is interesting. I think from the point of view of this film, it is dead on and the performance is wonderful. Dunst is so young in this film, but her performance is great. I think after she's been turned for some time, she somehow channels an older feeling through her character. Seeing the rage is quite believable. I do want to commend Rea, Banderas and the rest of the performances as well as they definitely round out the acting as well.The issue I kind of have with the film is with the pacing. I think with the amount of information that is told, the runtime is fine. I never really found myself bored. The problem I think is that the story isn't all that exciting. It is very interesting and holds your attention, but it isn't one that really is going to captivate you. It definitely isn't boring and I think the ending is solid overall.To the effects of the film, I never realize that Stan Winston was behind them. I really like the look of the vampires here. When you turn, you become the most beautiful version of yourself. I like that when they're lacking blood do they look pallid and sickly. The eyes I think are contacts, which are quite gorgeous and creepy at the same time. There is some monstrous looking moments for the vampires that I was down with. I do know there are some CGI moments in this film, but they look quite amazing. They are there when they couldn't do practical and really just enhance the experience, which I'm good with. The film is shot beautifully as well.Now with that said, this film is one that I found really good the first time that I saw it and it still holds up. I think there's a lot here with some deeper meanings with it as well. I like moving through the eras through the eyes of a vampire and seeing how they survive and it changes around them. It isn't an exciting story so keep that in mind. The acting is quite amazing though and that does carry it. The effects are really good as well, which you should expect from Winston. The soundtrack I do think fits the scenes to set the mood to the time period, but it didn't really stand out to me on its own. Overall I say this is a really good film and definitely should be viewed by horror fans and non-horror fans alike, it really is one that grounds the vampire genre in realism.",Interview with the Vampire - The Vampire Chronicles
69,Samiam3,"Maybe a worthy novel, but hardly a worthy film",5,8 August 2009,"Neil Jordan's Inverview with the Vampire strikes me as one of those films which can only be appreciated if you read the novel, which I have not. Like Kenneth Branagh's Frankenstein (which came out in the same year) this is not really a horror film, it is a glamorous Gothic drama, but not a very good one. Quite frankly it is boring, lacking in direction, and features too much dialog which is intended to be poetic or melodramatic, but instead strikes me as silly. It starts in a tiny hotel room, with a journalist played by Christian Slater. He is interviewing Louis, a dapper young fellow, who proceeds to dictate the story of how he became a vampire. It started when he met L'estad de Lioncourt in 18th century France, who offered to show him the the ways of darkness. From there the story becomes a series of strange chapters, decade after decade, century after century. If I was in Slater's shoes I would be asleep, long before Louis finished his story.One of the differences between novels and movies is the amount of story. A book can take as much time as it wants, while a movie needs to cut things down a bit for structure. It is for this reason that I am sure Interview with the Vampire is an excellent and very intriguing book. As a movie however, it is a dud.",Interview with the Vampire - The Vampire Chronicles
70,triple8,"A movie to see for the acting, costumes and special effects",7,13 November 2003,"Not being a fan of vampire movies, I didn't love tihs but I actually liked it a bit more then I expected to. I would imagine to really love this movie one has to be a sort of vampire movie fan to begin with and though I am not NOT against these types of movies I'm not into them either-if that makes ANY sense at all. Basically, this is a movie to see for these reasons: the costumes and atmosphere, special effects and very importantly the great acting-and I do mean great. Pitt and Cruise are both fabulous and unrecgnizable-both give their careeres a very large range with these performances.I also think this is a movie best seen in a group-when I saw it it was with a large group of people and we were almost kicked out of the theatre for talking so much-it's that type of movie. Definetly more of a fun movie to see then a deep memorable one.My rating is 7 of 10.",Interview with the Vampire - The Vampire Chronicles
71,Seraphion,One of the great classic modern vampire stories,7,14 March 2015,"The story nicely portrays what is it that makes a vampire story good, a desire to keep being human. Surely a story about vampires being vampires, feeding and killing every night, would be one dull and boring story. The movie makes it even better as it stayed true to the more common mythologies by keeping the most of the duration to the night, maintaining the sad and anxious mood, and providing great location settings. What noticeable is that this movie contains much of the mythological inspirations focused in other more recent vampire stories such as the Twilight saga and Let Me In, particularly about the child vampires. The acting overall is indeed great. Brad Pitt nicely depicted the lingering human emotion in a vampire. Tom Cruise succeeded in depicting the annoying vampire that keeps on pushing Louie to his emotional limit. Antonio Banderas and Kristen Dunst adds the movie with strong performances also.",Interview with the Vampire - The Vampire Chronicles
72,pc95,Great Production and Show,8,25 November 2011,"One of the better movies of the 90's, I remember really enjoying ""Interview with the Vampire"" in the theater,1994. It was extremely hyped at the time with a young Brad Pitt and Cruise in one of his better roles. Thankfully the movie holds on to a lot of what makes it entertaining and great over 17 years later now. Neil Jordan directed a stage-like performance and atmosphere complete with outstanding music, sets, and costuming backing up a devilishly good script apparent thanks to screenplay/author Anne Rice. It stands out imo as one of the best modern vampire movies made in the last 30 years. The leading actors are all enjoyable, and there's a satirical and witty look at the life and history of vampires - especially that of Louie - Brad Pitt's character, the narrator. While the ending might be a little bit hokey, the voyage of the movie easily makes up for it. Of note, Kirstin Dunst has several great scenes in her breakout role. Strongly Recommended",Interview with the Vampire - The Vampire Chronicles
73,philip_vanderveken,One of the better vampire movies,7,21 June 2005,"Vampires have always been a welcome subject for Hollywood. It has inspired many producers, writers and directors, but not everyone of them has done a very good job with it. Some of these movies weren't exactly good or very believable, making it hard for the others to find an interested public. But if you are interested in the subject and you want to see a good movie about it, than I can definitely recommend this one.The title of this movie: ""Interview with the Vampire: The Vampire Chronicles"" already reveals a lot about what you can expect from it. It tells the story of a young journalist in San Fransisco, at the present day, who follows a man through the streets and ends up in an anonymous room with him. When the journalist starts to interview the man, the stranger tells him that he is a vampire, being over 200 years old. The journalist doesn't believe him, but after the man proves it's true, he tells his story. He once was a plantation owner outside New Orleans in 1791. His wife died when giving birth to his child and he had lost all will to live, when a vampire named Lestat offered him the chance to become a vampire himself. He accepted, but soon realized that life as a vampire isn't all that great either. Then he met a little girl, Claudia, who influenced and changed the rest of his eternal life...Next to a good story, you'll also get some nice performances from the top cast that played in this movie. Tom Cruise, Brad Pitt, Antonio Banderas... all did a very nice job, each portraying a vampire with an entirely different nature, but it was the young Kirsten Dunst who surprised me the most. Even though she was only 12 at the time, she already showed what a good actress she once would be.All in all this is a movie that will be loved by all the fans of vampire movies, but even when you aren't too much a fan of this movie, I think this has plenty of good things to offer. Think for instance of the decors, the clothing, the story and the acting. It all works very well together and that's why I give this movie a 7.5/10.",Interview with the Vampire - The Vampire Chronicles
74,Lady_Targaryen,Great great great vampire movie!,9,20 October 2005,"This is my favorite vampire movie ever, and I already watched it more than 7 times! Much better and interesting than Dracula's story, Interview with the vampire is a great movie,showing a vampire called Louis telling the story of his life during the centuries, with their two companions Lestat (the vampire who made him) and Claudia,who he considers his daughter. I am a big Anne Rice's books fan, so I totally recommend to people who have enjoyed or was fascinated with this movie, to buy her books and read to know more about the character's life and sequence. This movie contains some errors and not everything is exactly like the book who it was based on, but even on this way, he totally deserves to be watched!",Interview with the Vampire - The Vampire Chronicles
75,elliotjeory,Not that great,6,11 November 2021,Could of been better if it was set in the early 20th century but it was set in the 1700s so its a boring period drama. The acting was good however.Overall not great.,Interview with the Vampire - The Vampire Chronicles
76,Muhammad_Rafeeq,VERY GOOD VAMPIRE MOVIE IN A DIFFERENT WAY OF MAKING,9,30 January 2020,"In San Francisco, the journalist Daniel Malloy (Christian Slater) interviews in a hotel room a man called Louis (Brad Pitt) that claims to be a vampire. Louis tells that he was the owner of a plantation in New Orleans and happily married with a daughter. In 1791, he grieves the loss of his wife and daughter and has no wish to live anymore. Out of the blue, he meets the vampire Lestat (Tom Cruise) that attacks him and asks Louis to choose whether her wants to die or to turn into a vampire. Louis accepts to be a vampire but is reluctant to kill humans, drinking animal blood to survive while Lestat feels pleasure in killing human. When Louis meets the girl Claudia (Kirsten Dunst), who has just lost her mother in an outbreak of plague in New Orleans, he does not resist and drinks her blood. Lestat turns Claudia into a vampire to keep Louis with him. Louis treats Claudia as a daughter while Lestat teaches her to be a killer. Years later, Claudia gives laudanum to kill Lestat and flees to Paris with Louis where they meet the vampires Armand (Antonio Banderas) and Santiago (Stephen Rea) that pose of actors in a theater with other vampires. But a tragic event changes the saga of Louis in Europe.'Interview with the Vampire: The Vampire Chronicles"" is a Gothic film that discloses the saga of Louis, a vampire initially with human soul. His grief and pain for the loss of his wife and daughter; his transformation into a vampire and relationship with the Lestat; his love for the vampire girl Claudia; his wrath for the vampires in Paris; his return to New Orleans are told in a screenplay written by the author of the novel Anne Rice and directed by Neil Jordan. The changing of behavior of the immortals Louis and Lestat along the centuries is intriguing with the bon vivant Lestat losing his interest in life and Louis questioning the meaning of many things that he has experienced. The cinematography and the art direction are amazing and the haunting music score complete this good film. My vote is eight.",Interview with the Vampire - The Vampire Chronicles
77,Muhammad_Rafeeq,( American B+ Movie) My Ratings 9/10,9,10 March 2020,"The best vampire film! A particularly fun and enticing vampire film, Interview with the Vampire really explores the depths of sorrow and loneliness one might feel if they were immortal. Brad Pitt is so empathetic and passionate, you cannot help but feel for his character. Tom Cruise is charming, but devilish. He is irresistibly fun and intriguing. Kirsten Dunst is so sweet and well ranged in this early role of hers, it's impressive. Interview with the Vampire is touching, funny, sweet, horrifying, and charming all at once. It's a well versed tale that you will not want to miss. Check it out!",Interview with the Vampire - The Vampire Chronicles
78,m-47826,Ending was very underwhelming.,7,6 June 2020,"It was too goofy (and not the way it pleasantly was throughout the movie). Only to have viewers cheer (probably) when the big star returned for the big finish. I suspect it to be a last minute reshoot, to please the audience of test screenings. It looks too 90s blockbuster, compared to the rest. That is, still very « mainstream » horror, but with drama, horror and dark humor. Cruise's Lestat is a bit cartoonish, I agree. But it works, mainly because he was young and not very manly. Pitt however, was perfectly androgynous. Only beefier. The eyes, beautiful long hair, lips and soft voice made for that « feminine » side, of his character. He was the perfect Louis. When Cruise looked like an old queen (sorry), Pitt was very believable as the newly « turned » one. Gay undertones are still very present in the movie. They don't flaunt it like in the book, but it's always implied, without too much restraints. Dynamics are pretty clear, they turn men, and feed off women. Which often transpires in Louis struggle, when he can't fully embrace it, and often rejects it. When they adopt that little girl, I guess it's the last nail on the coffin, so to speak. Little girl played by a crazy gifted at such a young age, Kirsten Dunst. I wasn't a big fan of the « Paris » segment. It tiptoed around it too much. Especially Louis and Armand relationship, that clearly was a « rebound ». It needed to dig deeper into the new dynamic between the two clan. You never believe for a second they were « close ». Granted they didn't shy away from the homoerotic undertones, but others were conveying it a controversial image. I think of the silent boy, and Louis and Lestat's reunion in 1988. Maybe it was done to shock the audience, in a very nonchalant way. But it didn't help mentalities to evolve on this matter. Slater's cameo was a nice addition, as it completely changed the tone of the movie, with that pretty average looking man, in the middle of a drop dead gorgeous trio. And he was a nice little comic relief, without trying to be. Unlike Cruise. Apart from the « Hollywood » ending, it was one of the best vampire movie to date. All themes were neatly handled and it wasn't afraid to mix genres, and be both appealing to teenagers and adults. It's like the boys band version of a vampire movie, with a good script, quality acting, surprisingly gore moments (the part where they suck blood is never glamorized) and that 90s glow that proved you could do great movies without trying too much.",Interview with the Vampire - The Vampire Chronicles
79,Howlin Wolf,Vampires never looked so good... (POTENTIAL FOR SPOILAGE.),9,17 January 2002,"... in an aesthetic sense, I mean. For whilst the production design, costumes and photography are all lavish, this is a world away from the iconic, rock star status bestowed on vamps in such previous movies as '80's teen classic ""The Lost Boys"" for instance. (Quite ironic, really, given that I've just read that Lestat becomes a rock star in the follow up: ""Queen of the Damned"") The life of these vampires is shown to be all surface glitz, hiding the inexorable loneliness they feel at being the only ones around on the earth to witness life go through all its changes. The beauty of this movie is that you can take it anyway you want though; you can see it as a character study, straightforward thriller or period piece. It is ALL of these things, in fact, bound up in one glorious whole.Allaying the fears of many an Anne Rice fanboy/girl (and even the author herself) when his casting was announced, Tom Cruise does fine in the pivotal role of Lestat de Lioncourt, an embittered, aristocratic and charismatic vampire who serves as a ghoulish guide to Louis (Brad Pitt) into the world of the undead. The common misconception is that Cruise can't act, you see, but he CAN. Unfortunately, he's just cursed with that 'idiot grin' so accurately skewered by the villain in MI:2. Still, gleaming gnashers aside, he's given many a good performance, and this is actually one of his best.The rising star that was then Brad Pitt also does fine, although some wags (like me) will no doubt simply label his character 'a miserablist g*t'. It is Kirsten Dunst who waltzes away with the acting honours here though, delivering a frighteningly mature performance at such a young age. She really does look young here, and not like the lovely lady who sets this reviewer's heart a-flutter these days. I noticed a trend amongst users before me to categorise her character Claudia as 'evil'. I don't really understand this. She just seemed to me to be quite understandably PO'd that Lestat and Louis had stolen her childhood. (or rather, prolonged it interminably.) Besides, her companions are hardly paragons of virtue themselves, are they? Even Louis caves in the end... E-mail me if you feel you can shed any light on this issue.Perennial Jordan favourite Rea also shows up. Then there's Antonio Banderas, whose character Armand doesn't really work at all. Also look out for Thandie Newton (yes, Mr Cruise's love object in the aforementioned MI:2) and Christian Slater, in a role undeserving of such a big name, which was probably only allocated to him in order to further 'up' the male totty factor.There are several lavish setpieces on display, which work splendidly thanks to the invariably good acting and magnificent sets, and it's interesting to see a characters life explored that we don't usually get much insight into, beyond the usual garlic-phobic clichés. For unadulterated horror fans, though, it's not really THAT scary; more a methodical exploration than an all out gorefest. It's all treated with the usual elegance by Jordan, who seems the perfect director to enliven Anne Rice's material because of his artistic sensibilities. So much so, in fact, that I had to abandon the exercise of reading the novel after seeing the film, because the movie had become the definitive version in my head, overshadowing everything that came from the true author's pen.It is a shame, therefore, that I have been denied an aspect of my literary education by the film, but my movie-loving faculties have been stimulated instead. A wonderful film, see it if you haven't already.",Interview with the Vampire - The Vampire Chronicles
80,michaeltrivedi,Brad Pitt vs. Tom Cruise,3,2 October 2019,"Very interesting movie. Perhaps not good, at all. And perhaps you shouldn't even see it. But for a Brad Pitt fan like me, I thought it was an exceptional viewing.A man down on his luck is throwing away his life. A vampire invite him to either death, or becoming a vampire. He chooses the life of the vampire. The two vampires then join together to learn what this new life is really about.There's really not much more of a story than that. It's a really gothic film, and dark. The acting is not very good by Brad Pitt, and it's definitely not a good movie, if even average.Watch if you want. I definitely would for Pitt.3 Stars",Interview with the Vampire - The Vampire Chronicles
