,User_name,Review title,Review Rating,Review date,Review_body,Movie_name
156,captainpass,Jocks in Wigs,6,16 July 2021,"Well, I'm late to the party. Mind you, it ain't the worst one I've been to, but I also don't understand the over-the-top love for this thing. The costumes and sets are admittedly sumptuous, in a Scorsese-type fashion. And its hard to hate New Orleans and Paris as settings for a vampire movie. However, we never lose the actors to the backdrop thanks in no small part to the scenery-chewing by Cruise (he really does give Nic Cage stiff competition in that department). Cruise's consistent intensity does play well against the sleep-walking Pitt does throughout the movie (he apparently HATED doing this film). And most defects here might have been over-looked were it not for the writing: The actors are never given much more than wooden lines from novelist-turned-scriptwriter Rice. It felt at times like a high school play with a really huge budget. Oh, and the ending blows.P. S., Cruise's wig (and Pitt's real, but Fabio-esque flowing top) is just plain silly. But I must admit that whoever made Antonio Banderas look like Gene Simmons deserves an academy award. Belatedly, of course.",Interview with the Vampire - The Vampire Chronicles
157,Amityville15,The undead are among us...,6,4 August 2014,"A vampire tells a reporter his life story, starting from when he became what he was when a vicious evil vampire cast his teeth into his neck.This film starred: Brad Pitt, Tom Cruise, Antonio Banderas, Kirsten Dunst & Christian Slater.I found Interview with the Vampire boring and don't think it is as good as what people say and what this site rates it. However this is in my opinion. This film isn't terrible but I did find it boring and not as good as I thought it was going to be. Not really recommended unless you are a massive Vampire film.***/***** Could be worse.",Interview with the Vampire - The Vampire Chronicles
158,TC-Batsy,For Those Who Like Vampires,10,31 October 2005,"Interview with the Vampire is an excellent horror movie that sheds light on the emotional and humane aspects of a vampire who is disdainful of his powerful nature to hunt down and kill mortals for their blood in order to survive. While living in New Orleans in the year 1791, Louis, the wealthy owner of a plantation encounters an attractive French vampire named Lestat who understands his desire to end his miserable life after the loss of his wife. In exchange, he must become a vampire so he can live for eternity. Lestat doesn't feel any kind of remorse when he kills people including ""evil doers"", unlike Louis who prefers to feed on rats and other animals instead of taking lives. Things take a different turn when he finds Claudia and accidentally feeds on her which causes his maker to turn this young girl into one of their kind and keep her as their loving daughter. The tormenting questions that Louis and Claudia have always been asking during these long years are: what is the cause of their nature? Why can't they change as the years progress? All these seem to bother and anger Lestat who withholds information from them, which prompts Claudia to plot his death so she and Louis can escape and find other vampires in Europe and other parts of the world. Neil Jordan and Anne Rice deserved so much credit for presenting this great novel to the big screen, as well as Tom Cruise, Kirsten Dunst, Antonio Banderas and Stephen Rea for their outstanding performances which were set in San Francisco, New Orleans and Paris.",Interview with the Vampire - The Vampire Chronicles
159,ToxicJug,Beautifully Dark,9,1 June 2021,"Interview with the Vampire is easily one of the greatest Vampire films ever made in my opinion! Incredible performances by Brad Pitt, Tom Cruise, and the rest of this perfectly put together cast are those that I certainly will not be forgetting any time soon! A unique form of storytelling that simply demanded my attention throughout this films entire 2 hour runtime, and it's incredible set designs paired with the films intelligent writing made for more of an experience than it did a viewing! The film managed to be dark and disturbing while also being beautiful and artistic. This is a common theme within the Vampire subgenre however, most tend to fall flat on this premise or something else if not that. I'm not typically one to enjoy Vampire films all that often but this one is simply perfect, the only thing that I did not enjoy about this film is how long it took me to get to throwing it on!",Interview with the Vampire - The Vampire Chronicles
160,liodavix,Confessions of a vampire,10,7 February 2019,"A wonderful movie and one of the best vampire films in history.The cast is one of the sexiest, attractive and talented, ever seen on the big screen.Brad Pitt, younger and beautiful than ever plays Louis De Pointe, a young man from Spanish Louisiana, Brad gives his character innocence and humanity, a spirit that does not stop struggling between good and evil, and whose nexus between both parts will be a sweet girl who will take almost for a daughter.Tom Cruise, immeasurable, great, terrifyingly beautiful and magnetic, his character Lestat, produces several sensations, attraction, repulsion, terror, pity especially at the end ... Tom Cruise clearly showed that it was not a pretty face anymore within the Hollywood establishment , making his character speak only with his blue and hypnotic gaze.Kirsten Dunst, being still small when she made the film, her character was not easy, but she showed an admirable maturity, managing to create a character as innocent as in turn dark and perverse, because while she loves Louis, she does not hesitate to kill Lestat, although he was willing to reconcile with her. Showing with it a tender attitude with Louis but also selfish, possessive and capricious.Antonio Banderas, the old vampire Armand, a character of the darkest and gothic, the performance of the Spanish can only be described as sublime, every gesture, every word, conveys a sense of respect and at the same time fear, loves and wishes Louis, although that it can mean its own destruction. A short, but memorable character.Christian Slater, like the journalist Daniel Molloy however is not very used, although certainly his character did not give much more, since it is about telling a past story, so that his character does not have too many options to develop. Anyway, it is not bad, this actor at that time was still popular, before falling into the abyss of self-destruction.And the rest? Neil Jordan once again created a dreamy atmosphere, dark, Gothic and Baroque at the same time, streets lost in dense fogs, the whole movie is like a sweet nightmare from which he wakes up suddenly at the end. This director already showed his ability to create dark and gothic atmospheres, always wrapped in a halo of magic and mystery, as in his famous film In the company of wolves.A story of love, of revenge, betrayal and blood, but above all of passion, of souls tortured and condemned in search of their own redemption and salvation. All with an atmosphere that amazes all the senses.I'm sorry, but I can not stop praising this cinematic delicacy, it's one of my favorites of all times and it will continue to be so. Go, yes.An unrepeatable marvel that you can not miss for anything in the world.",Interview with the Vampire - The Vampire Chronicles
161,SwalesFilm,Too boring.,1,14 June 2020,I remember it bored me in 1994 and decided to see it again only tonight. It's more boring than i remembered. Not much story for a Hollywood film.,Interview with the Vampire - The Vampire Chronicles
162,CyMaddux,Aa third dimension to vampire films - contains possible Spoiler,8,12 July 2000,"This movie has something that all the stereotypical vamp films like From Dusk Till Dawn and Fright Night lack:  A sense of substinence of what life as a vampire may be more actually like if they were to be real...Louis ( Pitt) loses a recent bride and child and wants nothing more than to end his life.  Lestat (Cruise) decides to give him the choice to be a vampire.  Of course Louis accepts and begins his descent into the immortal but hellish life of a vampire.Most of the movie deals with the lifestyles of 3 vampires, including Claudia (By Dunst) and what it is like to be one (in the view of Rice's eyes).   This is much more than your seduce and suck flick.  There are feelings here between Louis and humankind, Lestat and Claudia.Check this one out if you are looking for an interesting, unique vampire movie.*** Possible Spoiler Below***The big flaw I see in this movie is that after the Death of Lestat, he is able to come back to life by supposedly eating alligators, snakes, lizards, etc.. but he was clearly dead so I really don't see how he could have.Also, later when Lestat returns for vengence upon Claudia, he seems to look rather rough ( from the blood of reptiles)  yet after his is burned and Louis and Claudia leave him, some 80 years or so pass and the next time we see lestat he is in his same state.   If he is alive and feeding for 80 years, would he not return to his regular form???  He chomps on Slater at the end and turns back to the ol Lestat after just one victim.. Doesn't make sense8 out of 10",Interview with the Vampire - The Vampire Chronicles
163,tritisan,"great film, flawed casting",8,2 December 1999,"I read and loved the book years before the movie was made. Of course, I painted myself a pretty detailed picture of it in my head, what the characters looked like, the location and atmosphere, etc.When I heard Tom Cruise had been cast as Lestat, I felt like starting a riot on Hollywood Blvd. Blaspheme! And Brad Pitt? Yuck.But I couldn't help myself and had to see the movie all the same. And I was pleasantly surprised. The ""look"" of the film was very close to what I'd pictured, with deep shadows and saturated colors.Even more surprisingly, I enjoyed Tom's performance. He successfully embodied Louis' hedonistic, egomaniacal abandon. Brad, on the other hand, produced exactly what I'd feared: a shallow, pouty performance. I had pictured someone much taller, and more elegant. Brad is cute and all, but sophisticated he's not.And then there was Antonio as Armand. Antonio is a pretty good actor, but the book described Armand as much younger, more innocent-looking, like a choirboy. But Kirsten as Claudia was perfect, and everyone else fit the bill nicely.8 out of 10.",Interview with the Vampire - The Vampire Chronicles
164,Jinn,Beginning: Excellent. Ending: Awesome. Middle: Slept through it in my coffin.,7,15 March 2010,"Adored the beginning, HATED most of the middle; LOVED the end.Brad, and Tom were wonderful as Louis and Lestat. At first I thought Tom's face would be too familiar, but he was awesome, and the blonde hair helped :) he brought so much passion to the role and Louis, the struggling vampire, much like Carlisle Cullen's struggle at first with his vampirism in Stephenie Meyer's Twilight Saga. And so I felt for both Lestat's passion and Louis' struggle to come to terms.However, for me it went downhill when Lestat turned that child. At first I felt sorry for her, but she became such an annoying, obnoxious BRAT, she made me wanna hurl. I understand how angry she was at Lestat, but in the end he trusted her and look what she did  and then the movie got really, really boring, too long, drawn out and tedious, apart from the scenes with a decrepit looking Lestat coming rightfully so for revenge, and of course the dashing Armand. Loved the battle scene near the end with Loius and the Scythe and I was not sorry to see Little Miss Molly Dolly burnt to a cinder (finally) however I did feel for Louis. I've not read the book, but if I do, I'll read the beginning skip the middle and devour the end. That said, I think Kristen Dunst played the child (Claudia) very well. Somehow I knew Lestat would return in full and he didn't disappoint. No, he's right. He needs no introduction.So Interview with a Vampire  Part II - Enter LestatInterviewer: ""So, Lestat Now you're finally back in the game, are you planning to turn any more children?""Lestat: ""Good God no ... and the Volturi will probably get the sh!its...""",Interview with the Vampire - The Vampire Chronicles
165,fullonrobotchubby,Vampire Sociology,7,15 August 2006,"Brokeback Mountain is said to be the ultimate exam of viewers' homophobia, but before everybody that's straight heads out to test their endurance with that film, I think Interview with the Vampire is keeping the throne warm for now. There technically isn't anything sexual in Interview, but author and screenplay adapter Anne Rice does a fine job establishing the ""bisexual in nature"" sociology of the vampires and how it compares with the mortals. Goes like this: the vampires cannot be sexual (all of one's body is dead, so... use your imagination), but when they quench their thirsts for blood on their victims, male or female, the thrills they achieve are so exhilarating that the act is comparable to sex. Once the viewer understands this, with some parts of the movie, it's hard to decide whether to be disgusted or not, not with the near homosexual relationship between Tom Cruise's Lestat and Brad Pitt's Louis (which is acceptable) but with Louis' little girl companion, in a pedophiliac sense. Kirsten Dunst, who was about 11, gives (still) the best performance of her career as Claudia, an aging vampire whose physical form stays childlike. However, since Claudia becomes adult and beyond and tries to do away with Lestat so Louis can be all hers, it's hard to watch what still seems to be a child to the naked eye grow so lovelorn for an adult. Their relationship raises tons of questions, some you may not want the answers to. My favorite scenes (tie) are toward the end when Louis seeks fiery revenge on some misled vampires in the name of Claudia and the edgy dialogue and body language exchanged between Louis and Armand (Antonio Banderas, fresh off playing Tom Hanks' lover in Philadelphia) in the scene after. My beef with the movie is not homophobic by any means. I just don't like getting beat over the head repeatedly for a point to be made, and casting all ""pretty boys"" like Cruise, Pitt, Banderas, and Christian Slater as the current-day interviewer is doing just that (though it's really the only case of it). Other than Pitt, I wish the casting director would have chosen the parts by acting ability and not by shock value.",Interview with the Vampire - The Vampire Chronicles
166,rtrnt,"Provocative and bizarre, a guilty pleasure",8,13 December 2020,"Far from your typical vampire movie, this often-overlooked film about a 200-year-old vampire who comes across a curious writer is alternately engrossing, only occasionally plodding and overall quite entertaining. Performances here are quite extraordinary. Brad Pitt is extremely sympathetic in the role of Louis, an anguished but unyielding vampire who tries to come to grips with his past. Tom Cruise seems to be having the time of his life in this film as Lestat, the original vampire whom Louis first encounters in 1791 as a living human being. Kristen Dunst steals the film as the child vampire whom Louis and Lestat become guardians of.I have known about this film since it first came out. Although it certainly is not always easy to watch at first, it makes for a strange, diverting and eery film experience. Accusations of camp might arise in some instances, and that is in order. I personally don't care because this film which is now a quarter of a century old, holds up shockingly well. Highly recommended whether you love vampire films or not.",Interview with the Vampire - The Vampire Chronicles
167,DrewAlexanderR1,I assume it needs no introduction...,8,15 August 2008,"I have only recently seen this film. Going into it I was expecting to see a moderately good story about vampires. However, I was pleasantly surprised. For me it was an amazing story of emotion. Louis (Brad Pitt) is a man who mourns for his wife and baby. He seeks for a way to end his sorrow and Lestat (Tome Cruise) offers Louis a cure, but is it the right one?This was the first film I saw directed by Neil Jordan and I'm certain it won't be the last. Neil Jordan has given us something that enraptures the emotions. He has adapted the book into a film that couldn't have been made better.The duo of Brad Pitt and Tom Cruise as Louis and Lestat is nothing short of memorizing. The performances from each of them glue your eyes to the screen. These two great actors continue their filmography with roles you won't forget. Kirsten Dunst gave an impeccable performance for one so young. She was perfect for the role of Claudia. And let's not forget Antonio Benderas as Armand and Christian Slater as Daniel Malloy. Even though they had little screen time, they made their effect.Interview with the Vampire is a film that will stay with you. The emotions that come from the characters will make this movie last. The existential whitens that drive the movie are even more interesting given the immortality of the characters. It is an amazing film and should be on any avid movie lovers list.",Interview with the Vampire - The Vampire Chronicles
168,HLX1992,Vampire Story that Brought Us Three Brilliant Stars,7,14 May 2019,"Neither the literary nor the cinematic world has been in lack of the presence of those pale, blood-sucking creatures. We cannot say it for certain that this one will be the greatest among numerous other films of the same theme. However, one will be inevitably tempted to give it a higher score due to the three super movie stars that featured in it, namely Tom Cruise, Brad Pitt and Kristen Dunst.The whole film is revolving around the heart-wrenching remorse of Luis, who made the irrevocable decision of turning himself immortal. The same regret was felt by the little girl converted by him and Leatat. Throwing of tantrums seem a bit repetitive in the film, as all spectators may easily spot and get tired of during the total length of 120 minutes of the flick. The overall narration is carried out with a brilliant style, though. This, coupled with remarkable acting of our three superstars-to-be, made it a work that is worth being memorized by the film history.",Interview with the Vampire - The Vampire Chronicles
169,mozart-73268,Not Very Good,2,14 September 2020,"On the upside, the costumes and sets were outstanding. However, the movie itself was generally boring and bordered on dumb! There were long sections of dialog where the acting was not good enough to sustain it. And, I can always tell a bad movie when they throw in token nudity. Don't bother with this one.",Interview with the Vampire - The Vampire Chronicles
170,akoaytao1234,Just Okay,5,29 March 2017,"I watched this film with no preconception of what this film will be about (except for the obvious) or how good it is and I still somehow felt quite disappointed. As expected, it was a predictable Hollywood popcorn flick. It has its big stars and its pretty effects and that's about it. Though it was interesting how the gay subtext was tackled, other than that the film's script is beyond mediocre. I mean Pitt's role is not really salvageable. That character is beyond insufferable. On the other hand, Kirsten Dunst and Tom Cruise, in substantial roles, did their best to impress.Dunst left me with mixed feelings. She was impressive when she was playing as a youngster version of her role but as her character 'age', I did not see a change that I believe the character should have.Meanwhile, Tom Cruise was more impressive in his role. I mean he have the showiest role after all. It has the right amount of pizazz and motherly touch that his character imbued but it was nothing special. Overall, the film was just painfully OK and everything about leaves you wanting for more as nothing really leaves a big impression. [2.5/5]",Interview with the Vampire - The Vampire Chronicles
171,mjensen-3,The Best Vampire Movie ever created,9,17 May 2002,"Interview with a Vampire is actually one of the best films of the decade. Brad Pitt probably gave the best performance of his career. Brad showed the pain and the rage of Louis. Tom Cruise was excellent    as the handsome lonely Lestat. Antonio Banderas was scary as Armond. And Kirsten Dunst was great as Claudia, she acted like a woman in a little girls body.This film shows that Vampires aren't blood sucking animals,they have emotions and a soul. Ann Rice puts you in this world and makes you think, what if you could get a Vampire to sit and tell you the story of his life. Neil Jordan's directing was hypnotic and so was the acting. Brad and Tom should have been nominated for an Oscar and I'm glad this film got the Oscar for best original score. I love this movie and I hope it will be seen and loved by many in the future.I recommend this movie to anyone who likes Vampire films. I give it a 15 out of 10.",Interview with the Vampire - The Vampire Chronicles
172,OldRose,It'll take your breath away... Literally !,8,25 January 1999,"The transition from the first of the Vampire Chronicles was at least a partial success.  Pitt is convincing as Louis and Dunst was an absolute surprise as Claudia!  Lesser marks for Cruise as the famous Lestat, but the overall performance wasn't bad.  Banderas is always good and was no disappointment here either, in the role of the mystical Armand.  Rhea rounds out the cast of ''bad'' vampires vs. ''good'', amid beautiful and at times stunning scenery, costumes, and fantastic music.  True to the novel (roughly speaking) minus a surprise ending.  Great theme song from Guns & Roses, to boot!  Nods from both Oscar and Golden Globe (especially for Dunst) were well deserved.  Buy the video, and don't count on a sequel.  (Rating 4 stars of 5.)",Interview with the Vampire - The Vampire Chronicles
173,MrHaversham,It all works,9,24 November 2019,"Against type Tom Cruise is very good. If you love stylish vampire genre, a must see. Just wish they had done more of her books.",Interview with the Vampire - The Vampire Chronicles
174,archer191273,Nightmarish yet sad film about how eternal life and damnation is overrated and has pitfalls.,9,24 February 2019,"During the late 18th century Louis (Brad Pitt) tragically loses his wife and child. He can't take the grief of losing them so sets out to make himself the target for murder. Unfortunately it's a vampire that accepts his invitation that of the monstrous Lestat. Lestat invites Louis to accompany him in the afterlife and with regret Louis accepts and endures Lestats murderous lifestyle but unlike most vampires. Louis has carried his emotions and regret with him.
The interview comes about when a reporter (Christian Slater) stumbles across Louis path and instead of making him a meal. Louis decides to give him the story about his unnaturally long life.
This isn't a horror story but more of a biography about a vampires sad afterlife and losses. I believe despite his great looks that Brad Pitt is 1 of hollywoods best and what an amazing performance by Tom Cruise as Lestat! He doesn't nearly fit the part but pulled it off so well. Kirsten Dunst is so incredibly great aswell as Cluadia. A vampire that was made too young and despite gathering the wisdom of a middle aged lady still keeps her child form. 1 of the best child performances that I have ever seen. That's what makes this such a great movie. Each actor has put in the hard work to make their parts great in this movie and you can't help but feel such sorrow for poor Louis despite being what we see as a monster. A must see.",Interview with the Vampire - The Vampire Chronicles
175,lesdroits,"Blood, blood, blood, drinking blood, blood on teeth, blood dripping from lips.",1,19 May 2019,"Blood, blood, blood, drinking blood, blood on teeth, blood dripping from lips. Over and over and over. Perhaps there are people who enjoy watching (presumably fake) blood all over faces and gushing out of mouths and wounds and pouring into mouths. In fact, given the rating of this movie, I have to assume there are a lot. Hopefully there are some like me who find it totally sickening and repulsive. You hang in there through the first scene or two of ti, thinking there is obviously going to be much more story than there will be more blood scenes, scenes getting more blood, especially given the terrific (otherwise) cast, but the story otherwise is very thin. The spine of the movie is getting blood, drinking blood, gouging blood, seeking blood. Yum.",Interview with the Vampire - The Vampire Chronicles
176,danielmullin,This movie left me addicted to heroin,1,24 August 2021,"This movie is so awful I turned to heroin to try and clear my mind, find some peace and forget about what had happened in this horrible movie. I would wake up everyday and say ""today's the day that I don't think about how bad interview with the vampire is"" and then sure enough I would find my self think about it, so I would reach straight for the needle roll up my sleeve and inject. It's a horrible reality, but it is the truth, Interview with the Vampire left me addicted to heroin.",Interview with the Vampire - The Vampire Chronicles
