,User_name,Review title,Review Rating,Review date,Review_body,Movie_name
0,TheLittleSongbird,"A very surprising Rom-com, and one of Steve Carrell's best ever performances",9,2 October 2011,"I have nothing personal against Rom-coms, it's just that sometimes a film really surprises you in a good way or it falls flat on its face. Crazy, Stupid, Love fortunately belongs in the former category. If there was anything that lets Crazy, Stupid, Love down, it was that the film stumbles a little in the final act.Everything else however works, and the result is a surprising and hugely enjoyable Rom-com. The filming is never cheap and often stylish and pretty and the scenery is very striking. The soundtrack also compliments the film very well, as does the direction. The story is very clever too with seldom a dull part, only the final act has signs of inconsistency.For me, what lifts a Rom-com especially is the cast, the chemistry and the quality of the script. Luckily, Crazy, Stupid, Love succeeds in all three of those areas. The script is funny in a witty, droll and infectious sense, with plenty of moments to warm your heart and touch you too. The chemistry of the actors is also there and very believably done.Steve Carrell is brilliant here, while I do consider him talented with good material, I don't think he has been this good in a while. Ryan Gosling exudes charisma in his role, Julianne Moore and Emma Stone are very charming and Marisa Tomei while perhaps over-the-top is memorable.In conclusion, very surprising and really well done. 9/10 Bethany Cox","Crazy, Stupid, Love."
1,bkoganbing,Marriage in a rut,5,13 June 2018,"After a score of married years Julianne Moore announces to Steve Carrell that
she's been having an affair with co-worker Kevin Bacon.. She wants a divorce.Carrell moves out and after a few days of going to a local bar and crying in his
beer or any other intoxicant being served, Ryan Gosling takes pity on him and
starts having him change his wardrobe and attitude in a Pygmalion like fashion.
Pretty soon he's swinging Steve.Crazy Stupid Love is great up to that point. But when it gets all serious it was
losing me. Some nice performances in the supporting cast from Kevin Bacon
as a real lizard and Marisa Tomei who is Carrell's and Moore's teacher of their son Jacob Bono who
Carrell has a fling with and discovers who she is at a parent/teacher conference.Also a nice performance from Jacob Bono as their hormone exploding son.Fans of the principal cast members should like this.","Crazy, Stupid, Love."
2,SnoopyStyle,"Hilarious, Touching, Love",8,2 March 2014,"Emily Weaver (Julianne Moore) had an affair with David Lindhagen (Kevin Bacon), and she wants a divorce from Cal (Steve Carell). Meanwhile their babysitter Jessica (Analeigh Tipton) is in love with Cal, and their son Robbie (Jonah Bobo) is in love with Jessica. Jacob Palmer (Ryan Gosling) is a real ladies man, and he takes pity on Cal who's been whining about his divorce to everybody in the bar. Jacob does a make-over on Cal, but he finds himself falling for the PG-13 Hannah (Emma Stone).I love everybody and every character in this movie. Carell and Gosling have great comedic chemistry together. I love Gosling insulting Carell. I even love Julianne Moore who was cheating. Analeigh Tipton is adorable in her infatuation, and Jonah Bobo is even more adorable in his. Ryan Gosling has a great dirty dancing bit with Emma Stone, and yes Emma is adorable too. In addition, there is a great scene with supporting actress Marisa Tomei, and Liza Lapira has some great lines about Conan. The only change I would make is to use the alternate ending in the DVD.","Crazy, Stupid, Love."
3,Horst_In_Translation,Some terrible moments destroy an occasionally really solid mix of comedy and drama,4,5 March 2017,"""Crazy, Stupid, Love."" is an American movie from 2011, so it had its 5th anniversary last year. It runs for almost two hours and was directed by Ficarra/Requa, who have collaborated on quite a few projects in the last two decades. The writer is Dan Fogelman and he was mostly busy with animated films before this one here, but it may be his most famous work now. One reason for that is the cast that includes so many known names, three Oscar winners even. I will not say the names as you can check the list for yourself, but what makes this one interesting in 2017 is that Ryan Gosling and Emma Stone from ""La La Land"" play a couple in here as well. The core subject in this 120-minute movie is love and the complicated ways into and out of it. Divorce is involved, unrequited love, parental love, love that isn't really love because it's all about sex etc. So you could think that this is a decent movie to watch with your significant other. Yes and no I would say. It is without a doubt entertaining to watch from start to finish and it is easy to care for what happens next to the characters. Also the film does not take paths in terms of the unrequited love segments I mentioned earlier that would have felt unrealistic.But all it does right there, it does wrong on other occasions. For me a good comedy/drama always has to fulfill at least a basic component of realism (unless it is a fantasy film, I guess) and there were 4-5 moments when this one doesn't and the people who made this sacrificed realism for entertaining/crucial plot twists. The worst example is probably when we find out about the parents of Stone's character. Another example would be Carell's character's final speech at the school that feels really as if it takes itself way too seriously and it hurt the film. What is also crucial is how important these moments were for the movie itself and that's why it was even more devastating to see how things really went wrong there. Another example would be when the teenage girl finds the younger boy's comments at the end actually flattering after being annoyed by them throughout the entire film or when he starts talking in front of the entire school about his masturbation techniques. It is American Pie level (I mean that in a bad way) there and these moments really destroyed all the good from other scenes. It's such a shame how it turned out eventually and I cannot give this film a thumbs-up because the lowest lows are really much more significant than the highest highs (if there were any at all). Also Ryan Gosling was definitely not deserving of a Golden Globe nomination here. He is forgettable in the first half of the film and mediocre in the second. Also he is clearly supporting. Overall, a thumbs-down from me. Pretty overrated film that does not deserve to be half as popular as it actually is.","Crazy, Stupid, Love."
4,nogodnomasters,I LUV YOU JESSICA,10,18 April 2019,"Warning: Opening scene:The movie starts out funny. Steve Carrol and his wife Emily (Julianne Moore) are sitting at a restaurant. Steve asks his wife what she wants. She blurts out, "" A divorce."" On the way home Steve jumps out of the car. When they get home, the babysitter asks, ""What happened to you?"" Steve very dryly says, ""Emily said she wanted a divorce and I jumped out of the car."" Meanwhile Emily is discussing with the sitter about her child and broccoli. The sitter had walked in on the 13 year old boy while he was choking his chicken. He in turn tells the babysitter he was thinking of her. This beginning scene had me hooked...then Emma Stone comes on the screen as icing on the cake. 5 star opening scene. Oh and the 17 year old babysitter (Analeigh Tipton) has taken a liking to Steve.Steve does not take the divorce very well. He goes to a bar and pours out his grief to anyone who will listen and sometimes he talks to the thin air. He is taken in under the tutoring of pick-up artist Ryan Gosling who guarantees to make this sad sack into a lady killer. Steve does very well until he opens his mouth. When he talks he makes women want to leave the bar....with Ryan Gosling. Eventually Steve becomes a master Jedi. Kevin Bacon plays David Lindhagen, the ""other man.""The movie has many laugh out loud moments, great characters and great actors with a wonderful climax scene. From the title you should be able to figure out this is a chick flick.","Crazy, Stupid, Love."
5,kosmasp,"Not without flaws, but ...",9,5 March 2012,"There is a moment (or two), where the movie is close to lose its way or get off its track. But it's only a momentary thing that will go away almost instantly. It manages to go through the clichés without hurting itself. And while women might only be interested in Ryan Gosling (and who can blame them?), there is more to the movie than that. It is rare that a romantic comedy can be as good as this.And while other movies try to up the ante on raunchiness, this one almost goes the opposite direction and does a great job in doing so. With Carell, Gosling, Stone, Moore and Tomei you have excellent actors who can convey almost anything, if the material is right. And right it is! Even if the end feels a bit like a cheat, it gets away with it. You won't really mind ...","Crazy, Stupid, Love."
6,classicsoncall,"""I'm in"".",7,10 March 2021,"The film was like a different spin on ""The 40-Year-Old Virgin"", except in this one, Steve Carell's character is married with a family. When his wife (Julianne Moore) states she wants a divorce, he goes into a painful period of tutoring by consummate womanizer Jacob (Ryan Gosling), in order to learn how to pick up women. ""Crazy, Stupid, Love"" is a romantic comedy that raises eyebrows at times, but ultimately brings our guy Cal (Carell) full circle back to his one time high school girlfriend Emily (Moore) amid a series of rash encounters and undisclosed identities. It gets farcical at times, especially near the finale when Cal and Emily's backyard barbecue turns into a free for all when all the supporting players show up. A side story involving newly barred lawyer Hannah (Emma Stone) with Gosling's character seeks to exonerate his womanizing ways, while thirteen year old Robbie (Jonah Bobo) suffers the pangs of young love attempting to win a high school sweetheart. It's not made evident up front that Hannah has a connection to the troubled couple at the center of the story, but the astute viewer will make the connection before Jacob does. Some questionable scenes aside, the story works as an effective rom-com that ends on a positive note for all parties involved, though one might question seventeen year old Jessica's (Analeigh Tipton) parting gift to her not so secret admirer Robbie. That seemed a bit on the tasteless side.","Crazy, Stupid, Love."
7,edwagreen,"Crazy, Stupid, Love is Just That ***",7,23 June 2012,"Steve Carell is getting to be like another Hugh Grant in movies. He is constantly being put into a variety of situations with women in all of his films.I have to admit that this film is humorous when Julianne Moore,his wife, asks him for a divorce and this sets in motion a whirlwind of a comedy. Going to a bar, he learns to pick up girls from Ryan Gosling, who sheds his usual tough-guy image in films and turns in a gem of a funny performance.It just becomes a story of coincidental love with the inappropriate people, such as your son's 8th grade English teacher-Marisa Tomei and Gosling unknowingly falling for Carell's 17 year old daughter.Everything seems to come to a favorable conclusion at Carell's son's graduation. I think by then the cast themselves had graduated into maturity.","Crazy, Stupid, Love."
8,sunwarrior13,A Romcom That Is A Class Of Its Own,10,15 October 2012,"Crazy, Stupid, Love is a romantic comedy with a big heart.That is it is a refreshing change and almost a throwback to a golden era of romance. It relies on the sharp writing by Dan Fogelman and the sparkly chemistry of its cast, led by Steve Carell, Ryan Gosling, Julianne Moore, and the emerging superstar Emma Stone. John Carroll Lynch,Analeigh Tipton,Marisa Tomei and Kevin Bacon play key supporting roles.It's not that the plot is ground-breaking but it is maybe the fact, the appeal of it is that it's all too easy to relate to the characters and the story.At forty-something,straight-laced Cal Weaver is living a perfect life with the dream-good job, nice house, great kids and marriage to his high school sweetheart. But when Cal learns that his wife, Emily has cheated on him and wants a divorce, his life quickly unravels. Worse, in today's single world, Cal, who hasn't dated in decades, stands out as the epitome of being uncomfortable as a single person. Now spending his free evenings sulking alone at a local bar, the hapless Cal is taken on as wing man and protégée to handsome, thirty-something player Jacob Palmer.This is not the ultimate romantic comedy.It is one that makes you fall as hard for the characters as they do for one another while savoring their every interaction.Also,it seems fresher and less recycled than much of the movies released out there.It gets better and funnier after a labored and lumbering start, which is entirely the opposite of most Hollywood comedies.It's the interplay between the characters, the true humanity of their emotions that is long missing from many contemporary romcoms that set this film in a class of its own.","Crazy, Stupid, Love."
9,studioAT,Average comedy,2,17 January 2017,"A man's wife leaves him and he has to start over in the dating world in middle age. So far, so 'Two and a Half Men'. This actually is a comedy starring Steve Carell, that people are rediscovering now, based on the fact that it stars Emma Stone and Ryan Gosling, who have danced their way into the public's hearts via 'La La Land'.It's a decent enough film. Quite why the review on the DVD box claims it's better than 'Love Actually' I don't know, but it's amiable enough.My main problem with it is that it doesn't seem to know whether it's going for heart-warming or lewd in terms of its humour. It flits between the two and ends up being neither properly.A talented cast do their best with a so-so film.","Crazy, Stupid, Love."
10,bevo-13678,Love story,10,31 March 2020,I like the bit where he was in the bar complaining that he was cuckold,"Crazy, Stupid, Love."
11,jotix100,Breaking up is hard to do,7,11 March 2012,"Imagine Cal Weaver's surprise at the end of what appears a nice dinner at a good restaurant. For dessert, his wife Emily, undecided what to order, asks him for a divorce. Cal's world collapses right under his feet. After all, having been married to a woman for twenty five years and whom he considered his soul mate, it was not in his book. The reason for Emily's request is she has been seeing a man from her office. The Weavers are well off. They have three children, but the person most affected by the news is Robbie, a teenager going through some changes.As Cal decides to move from the house, he must find a bachelor pad for himself. Cal, who is an uncool man, must find himself a way to continue with his life, something he finds inconceivable at his age. Cal begins frequenting a singles bar. He cannot get over the suave guy he watches picking up women every night. It appears to him, the man always scores. One night, the man, Jacob, approaches Cal with a proposal: stop whining and get a life. In fact, Jacob agrees to guide Cal into uncharted territory.What follows is an almost miracle transformation of Cal. His luck with women is assured with his hew attitude. Cal scores big with Kate, a teacher, who is a sex animal. Cal cannot get his mind from Emily and the family in spite of his new social graces. We watch him going at night to tend to the garden without being seen by anyone. Robbie, his son, has a crush on Jessica, the baby sitter Emily insists in engaging. The newly found life style does not bring happiness to Cal. Unknown to him, Jacob met and fell in love with his grown up daughter Hannah, something that shocks him, knowing well about the reputation of the man. In reality, Jacob had a change of heart as he met the young woman. He is a new man, but Cal does not see it that way. It takes a lot of convincing for Cal to accept his former mentor as the boyfriend of Hannah. In fact, at Robbie's graduation from middle school the whole family comes together, as Emily realizes her mistake.A fun comedy directed by Glenn Ficarra and John Recqua, following their success with ""I Love Your Phillip Morris"". The screenplay is by Dan Fogelman. Although a bit formulaic, the film keeps moving at a great pace as the situations keep the amusement. The creators have stayed away from dwelling on Emily's deceit as well as Cal's sudden exploits, making it more real. The teenage angst of Robbie is examined in a light mood.Not being a Steve Carell's fan, one has to recognize he does a better job, helped no doubt, by the direction he was given. He is an actor that works perhaps too hard to be liked. The real performance in the picture is Ryan Gosling, usually seen in more dramatic roles. Mr. Gosling keeps getting better all the time, doing an excellent turn as the nice predator who always gets lucky. Julianne Moore has not much to do. Her relationship is not played too much. A wonderful small part for Marisa Tomei as Kate, the teacher. Emma Stone is also notable for the sweetness she brings to Jessica. Jonah Bobo and Analeigh Tipton do a nice job as Robbie and Jessica. Kevin Bacon has little to do as the home wrecker.""Crazy, Stupid, Love"" was one of the best comedies that came out in 2011.","Crazy, Stupid, Love."
12,grantss,Surprisingly good,7,22 July 2016,"Surprisingly good, especially for a romantic-comedy, as the bar is set very low in this genre. It's more the comedy than the romance that works though. Very funny, and at times a parody of rom-coms. Gets a bit silly and contrived at times but thankfully these moments don't last long. Ending is also a bit trite and unprofound, despite seeming to be heading for something big.Great performances all round. Steve Carell does his usual nerdy guy- next-door thing, Ryan Gosling is perfectly cast as the smooth operator, Emma Stone is great as his love interest. Solid work from Julianne Moore and good support from Analeigh Tipton, Kevin Bacon, Marisa Tomei and Jonah Bobo.","Crazy, Stupid, Love."
13,Calicodreamin,"Crazy, stupid, movie",5,13 March 2021,"Saw this when it first came out, and ten years later and I'm still not a fan. The characters aren't compelling, the storyline isn't exciting or interesting, and the jokes mostly don't hit.","Crazy, Stupid, Love."
14,evanston_dad,Why Should We Bother to Be Adults When We Have Kids to Do It for Us?,4,8 December 2011,"""Crazy Stupid Love"" is about 20 minutes of a terrific little romantic comedy starring Ryan Gosling and Emma Stone surrounded by another 100 minutes of borderline dreadful romantic comedy starring everybody else. Gosling and Stone just ooze charm and screen presence, and their chemistry together is so natural and infectious that I simply could not tolerate any part of the movie that shifted away from them to deal with Steve Carrell and Julianne Moore, two actors I usually like but who are stuck in a cliché, middle-aged-couple-in-midlife-crisis storyline. Add this film to the alarmingly growing list of Hollywood films in which adults have forgotten how to be adults and only remember how to be from watching and listening to their kids.""Crazy Stupid Love"" is tolerable up to a point, but by the end it's simply too long and too stupid to leave any impression other than that it was a big fat dud.Grade: C","Crazy, Stupid, Love."
15,ferguson-6,Creme Brulee or a Divorce?,7,31 July 2011,"Greetings again from the darkness. From the opening scene it is clear we aren't in for a typically lame rom-com with caricatures instead of characters and punchlines instead of feelings. Instead, this one is all about the characters and their feelings ... realistic feelings of pain, anger, hope and frustration. Now don't misunderstand. It doesn't go too deep and there is still plenty of humor in the moments.Cal (Steve Carell) and Emily (Julianne Moore) are sharing one of their many restaurant moments over the course of their long, steady marriage. Only this time, something spoils the comfort zone. Emily says she wants a divorce and later tells Cal that she had an affair with a co-worker (Kevin Bacon). What follows is as close to real life reactions as we could ever hope for in a rom-com. Cal is hurt. The kids are angry. Emily is confused. Their friends take sides.The intertwining story lines and characters are both sad and funny. We see how people react when they are attracted to others ... or not. We see how people react when they wonder if their decision was rash. We see how basically nice people try to do the right thing for themselves and others, but still mess it up sometimes.After moving out, Cal heads to a local upscale lounge that seems to be stocked with gorgeous women and only a handful of men ... every night. In real life, the line of men waiting to enter would be wrapped around the block. Still, one of the regulars is Jacob, played by Ryan Gosling. He is a thing of beauty to look at it and always quick with just the right line. His science is making women believe he cares about nothing but them. Cal is discouraged by Jacob's incredible success rate. Jacob notices Cal's negative vibe and agrees to train him. But first, the makeover ... wardrobe, haircut and conversation skills.The polar opposite effect of what you might expect from Hollywood - these nice people begin to question their direction. Cal longs for Emily. Emily still thinks about Cal, but dates her co-worker. The son (Jonah Bobo) has a crush on the older baby-sitter, who has a crush of her own. Even Jacob falls hard for new attorney Hannah (Emma Stone) who has just walked out on her wet rag boyfriend (Josh Groban) who offered her a job, rather than a ring. Oh what a tangled web we weave. And that's just the stuff I can tell you! Cal's first conquest utilizing his newly learned skills is a teacher played with full energy by the terrific Marisa Tomei. She only has a couple of scenes, but as usual, Ms. Tomei makes the most of her screen time. The baby sitter is played well by Analeigh Tipton, but it's interesting to note (in real life) she is 3 days younger than law school grad Hannah (Stone).All of the actors are top notch here. Steve Carell continues to get better ... this is a superior movie to Date Night (with Tina Fey). Julianne Moore is solid, though her character is mostly mopey. Ryan Gosling and Emma Stone are both outstanding. Gosling is none for mostly offbeat, dark independent films but shows again how easily he slides back into sex symbol. Ms. Stone is headed for super-stardom. She was really good in Easy A and has a star-making turn in the upcoming film The Help. After that, it's on to the new Spider-Man for her.Glenn Ficarra and John Requa are the co-directors and were responsible for the much less mainstream I Love You Phillip Morris, with Jim Carrey and Ewan McGregor. Surprisingly the film was written by Dan Fogelman, who is known for his script writing on the animated Cars movies.No question women will enjoy the film, but the surprise is, many men will relate to what's going on with the Steve Carell and Ryan Gosling characters. There is enough humor to keep everyone happy and enough strong writing to say this is a very good movie.","Crazy, Stupid, Love."
16,anaconda-40658,"Crazy, Stupid, Fun.",8,19 August 2015,"Crazy, Stupid, Love (2011): Dir: Glenn Ficarra, John Requa / Cast: Steve Carell, Ryan Gosling, Julianne Moore, Emma Stone, Analeigh Tipton: Here is a romantic comedy about that urge we all have that is suppose to be pleasant but it often has its hangups. No, I'm not talking about a trip to the toilet. No, I'm talking about love. Steve Carell and Julianne Moore play a married couple of many years but on this evening she desires a divorce. She has had an affair so he moves into an apartment. Unknown to them both, their son is infatuated with the babysitter. Ryan Gosling plays a young playboy who witnesses Carell's drunken rants and decides to help him change his life. This is all done with wit and observation by directors Glenn Ficarra and John Requa who touch down on situations that are common. Carell is taken from despair to repair as his new dating life takes an unexpected hilarious turn when arriving at a parent teachers meeting. He will eventually have to man up and represent the father he always wanted to be. Moore's role is more predictable but her confusion with regards to a relationship with a co-worker works best during her son's visit. Gosling goes from teaching Carell to meeting a woman who takes his expectations to blunt face value. Analeigh Tipton plays a babysitter who actually has a thing for the Carell character while the kid she babysits crushes on her. Emma Stone steals her scenes as the woman whom Gosling cannot figure out, and who ends up being a big surprise revelation during the over the top climax. This is where things get crazy and stupid until love finally renders victory. Score: 8 / 10","Crazy, Stupid, Love."
