,User_name,Review title,Review Rating,Review date,Review_body,Movie_name
158,nate-car,"wash, rinse, repeat...",3,22 July 2016,"there is an old saying- ""if you throw enough s**t at a wall, some of it will stick..."" and that is what Hollywood is doing almost constantly these days.Like accountants they calculate- ""Ryan Gosling, plus Emma Stone, plus Julianne Moore, plus Steve Carell... this movie should gross $300 million... (and it did only $143 million)"" This is an unimaginative and uninspired 'formula movie' that you will swear you have seen before, and it's easy to understand why.Carell plays an identical character to his depressed-loser from 'Little Miss Sunshine' meets his no-idea loser characters from 'the Forty Year Virgin' and 'the Office'. At this point he's just turning up and reading lines, occasionally raising or lowering his volume.Gosling has been told by the media that he is gods gift to women and is creepily vomitus in his- 'cool person does a makeover on a loser' roll (hasn't that been done to death already?).Kevin Bacon? I'm embarrassed for the guy, he's an A-list actor playing a C-list doofus supporting role? I suspect Kyra Sedgwick made him do it for losing a bet.Stone can do better than this, she was amazing in 'Birdman' and so lovable as 'Gwen Stacy' but just punches the time-card here.It has that sickly- 'every story/character is separate, but all connected with a twist by the end' template that has become so overused in all of the ""Day"" movies (Valentines, Mother's, New Year's etc.)' and every Rom-com since 'Love Actually'. It's so choreographed, your eyes will roll like a cartoon character at the predictability of this script that was obviously written with a 'scriptwriters template program' (probably the 'Love Actually' template?).This is a- 'straight to DVD' type movie, that I hope you have someone willing to make-out with while you watch, or a lot of drinks choke down this very ordinary Steve Carell joint.","Crazy, Stupid, Love."
159,jkd15-1,Very good romantic comedy,8,17 November 2012,"There are some pretty good redeeming qualities to this movie. There are some true to life scenes. Overall the movie descends just under excellent and stands just below the Descendants which was an easy 9 star flick.Ryan Gosling stands out with an excellent performance as a womanizer with style, class and a hint of humanity in his mentor ship to Carrol's character.Some scenes seem to not be right for the movie and some seem to be made to slide under a cookie cut like movie.Overall it is an above the fray movie and stands as a great watch and a worthy addition to any DVD collection.Definitely not a family movie as I wouldn't watch it with the kids due to embarrassing and adult content but I might not be adverse to a teen watching it.Enjoy!","Crazy, Stupid, Love."
160,jefflouvre-435-77367,"Love is strong, but money also talks",4,29 July 2012,"ON a literal level, the flick is about forgiveness and everlasting love in the journey of life. On an allegorical level, it's about the power of money, that is, money talks.So the wife admits to sleeping with her colleague and now wants a divorce after 22 years of marriage. The husband admits that he may have taken his foot of the gas pedal and let things slide. He goes to a high-end bar to drown his sorrows.The rich playboy, who surprisingly does not have AIDS or STDs despite his innumerable conquests, takes the loser husband under his wings and transforms him into a suave, Bond-type guy, with the help of the loser's credit card.I must now admit to readers that the main reason I got this DVD is because of Emma Stone, who is delectable, ravishing and downright fun in 'The Amazing Spider-Man'. Stone's laughter and cheery personality can melt hearts made of stone, and she gets to display her vivaciousness in a few scenes with the playboy.The two fall for each other, and not just because of their sexual attraction to each other. The playboy's pad is impressive, and he says it was bequeathed to him by his rich dad. Tell me, dear readers, would the two of them have stuck together if the guy was not filthy rich????I like Carell's easygoing, loser demeanor. Viewers will feel sympathy and tenderness towards his character.The climax is surprising, and I first thought it was smart, but I then realized that the filmmakers had deceived us by not revealing beforehand that the bubbly Stone is the daughter of the divorcing couple. The movie focuses on the couple's two other children and conveniently forgets to mention about Stone.Also, the part about the female teen who takes nude pictures of herself is unnecessary and silly.","Crazy, Stupid, Love."
161,ron-fernandez-pittsburgh,Could have been...,5,25 December 2011,"I kind of liked the movie, but it could have been so much better. Acting for this type of movie was above par, especially because of some of the convoluted aspects to the script. Must have been difficult for the actors to keep a straight face with all the shenaingans going on. SPOILER ALERT: What drove me crazy about STUPID, CRAZY, LOVE was the 'twist'. Come on now. Don't the screenwriter's read what they write? How could it be possible that the character of Ryan Gosling doesn't connect the name WEAVER with the characters of Steve Carrell and Emma Stone? How come we never see or hear of Steve and Julianne Moore talk of their grown daughter. Don't even know they had one until the big denouncemnet scene. Sloppy writing for sure. Also, how ironic is it that Steve's one-night stand with the Marisa Tomei character just happens to be one of his sons teachers!!!! Speaking of his son and that of the babysitter...that whole plot should have been nixed. Very creepy and strange. Too, bad, because this movie had potential, but someone really blew it. And what about the scene with Steve falling asleep in Ryan's naked crotch??? Very homoerotic and did not belong in this movie at all. One of the best things about the movie, however, is Marisa Tomei. Too bad she was short changed into just a cameo. The movie need more of Tomei and less convolution. Still an OK to spend 118 minutes if one has nothing else to do.","Crazy, Stupid, Love."
162,javi-y-se-acabo,Crazy Stupid Movie About Love,8,6 May 2017,"Well, this is a romantic comedy, so with that expectations I watched it. The story felt for me pretty original in this kind of movies. Cal (Steve Carell) gets very upset because his wife Emily (Julianne Moore) asks for the divorce and he is later helped by Jacob (Ryan Gosling) to rediscover his manhood so he can feel well again. Jacob also meets a girl called Hannah and falls in love with her. There is also another thread on the story with the babysitter of the sons of Cal and Emily, Jessica (Analeigh Tipton) who is taking care of Molly and Robbie who falls in love with her, but she loves another person.Well the story might look a bit full of characters but all of them get a proper screen time, enough for their stories to develop well. Steve Carell has a good chemistry with Julianne Moore and you can care about their marriage and so, and also Steve Carell and Ryan Gosling have very a good brother-friend relationship, but for me the highlights of this movie are all the moments Ryan Gosling and Emma Stone share together on screen, which are worth watching this movie. They have such a great chemistry that they feel like a real-life couple. They are so lovely together that I wish this movie had been only the story of them, because, for me it would have been perfect. The story of Steve Carell helped by Ryan Gosling is also great and funny, but what for me ruins this movie a bit is the part of Jessica and Robbie, not also because it's very unrealistic (a thirteen age boy falls in love with his seventeen year old babysitter, but she is in love with his father and takes herself nude pictures for him? C'mon screenwriters, who had this idea?). This part of the story is not also unrealistic but very odd and a bit useless. And as their plot line, also the characters of this part felt a bit flat and without any charisma. But also, it's a romantic comedy you cannot ask that much for it.This movie is a very funny romantic comedy with many hilarious moments but also other moments full of emotion and romance. I recommend you the movie if you want to be entertained for about two hours, laughing and smiling without nothing to worry about.And finally I have to add this: ""Emma Stone is the perfect blend of sexy and adorable""","Crazy, Stupid, Love."
163,jeromec-2,Not Citzen Kane but a thoughtful unexpectedly good movie,8,19 November 2011,"Crazy, Stupid, Love is a movie about 3 couples and 2 educations. It is not an ordinary comedy because people are allowed to say and do things which reflects our times and our society more than it does the wishes and dreams of a segment of our society.Couple Number One ================= Cal Weaver (Steve Carell) and Emily Weaver (Juliette Moore) are out celebrating when he asks her what she would like (thinking the answer might be something like pumpkin pie) when she announces she wants a divorce. That's quite an opening line for a ""comedy."" Because he loves her, he immediately though very reluctantly agrees. He's read all the modern truisms about separation ""If you love someone let them go."" So he lets her go. All very cold and civilized. But he doesn't respond that way; he's not civilized at all.Reliable straight arrow Cal has a response that his 13 year old son Robbie (Jonah Bobo) would understand perfectly. He goes to a bar, drinks too much, and announces to the people in the bar just how sad, hurt, unaccepting he really is. He lives the 21st century but he feels the 1950's. The Educations ============= The education is in two parts. There is Cal's education and then there is Jacob's (delightfully filled out by Ryan Gosling – a terrific actor who can do just about anything). The first one is easy. It is all fantasy. Jacob convinces Cal that there is a method to dealing with women: Right clothes, right lines, right attitude and right tone of voice; that's all it takes. Jacob is shallow, and who knows but his shallow methods might work on a certain type of woman. Cal sees it works like Alternate Medicine. People around you say one thing and Dr. Jacob another. Who's to say Jacob isn't right? So Cal is a good student. He goes from an uncertain bubbling incompetent to a clone almost as good as Jacob himself. In one of the minor sub plots, he seduces Marisa Tomei who plays her absolute best over the top recovering alcoholic who has bought into our view that sex is therapy. That is the height of Cal's career as 21st century lounge lizard. It also is a wake up call for him. He knows how shallow all of this is.The second education is that of Jacob, who discovers that for all her brilliance, Hannah, (Cal's oldest daughter played by Emma Stone) is grounded in something far better than meaningless sex. She believes in love and though she is distracted by her reaction to the cold stupidity of a coworker, she is not so blinded that she can't see where Jacob will lead her even though she thinks that's what she wants. Hannah demands underneath that frustration, that Jacob do more than get her fixed. Perhaps because some of Cal's virtue rubs off on him, Jacob realizes he must comply with her values.The Second Couple ================= This is really intended as either comedy relief or a spoof on the ""Nerd"" movies. It is the puppy love of a thirteen year old (Jonah Bobo who plays Robbie Weaver) and his baby sitter (Jessica startlingly well done by Analeigh Tipton). It is a real over the top presentation, but its not unrealistic. It is the way a young teen would act, if not over someone then something. There is commitment, there is enthusiasm, there is desire, there is single mindedness, there is the willingness to do anything it takes to succeed. And there is wisdom. He is smart enough and practical enough that Cal (who both loves and admires Robbie – a rare combination) admits out loud that sometimes Robbie scares him.In the meantime Jessica is in love with Cal. She's older but really just as inexperienced as Robbie. In our century sex knows no real boundaries (it's love that's the problem), and she's willing to take the advice of a much more knowledgeable ""older"" woman – a classmate that knows how to deal with ""older men."" Jessica accepts the advice and does what she is told. The trouble is that she cannot get up the nerve to give what she does to Cal and her parents discover it. That's when parental love comes in contract with sexual ease. Hell hath no fury like an inflamed parent.Robbie, faithful and very truthful observer that he is, gives up on her. How can he compete when a woman does not recognize him to be on the same playing field? We have just killed the 1930's and 40's notion of one girl many beaus.The Least Convincing Couple =========================== I was least convinced by Emily and Kevin Bacon. Of all the people in this movie, she learned the least. Once she was convinced how much Cal had learned, how he could cope and how much he was dedicated to the idea of her, she wanted him back. She's Harlequin at its best. What this movie did =================== The director and actors rejected any notion of anything less than a good strong marriage. With all its troubles and disadvantages it is still our best option. This movie makes any of us who are in committed marriages very uncomfortable because it is bleak and at the same time rich, powerful and yet people get to snivel, it knows its society, yet it dares to choose a value as old as the beginning chapters of Genesis. It shows our vulgarity, but chooses modesty. Like it or hate it, Crazy, Stupid Love at least has the courage to stand for something that is critical of our revolving divorce door and shallow discontent.","Crazy, Stupid, Love."
164,ingmarbeldman-753-927212,love cannot breath without pain.,8,10 July 2016,"This movie is more like an ensemble piece, in which every couple has to deal with a certain pain to become ready for love. Usually it is sugar-coated, these movies. And yes, it is not a deep- layered structure of in-depth character exposition. But somehow, between the easy script lines, there is an unusual aspect in all of these people that makes you being surprised. What aspect? Its honesty. Honest script-writing. With that comes an undeniable fun that the actors have, when portraying their characters. And their love for their character radiates on us.I have seen this movie many times and i can recommend you to be uplifted by it. We all need sometimes to be remembered that love exists. But not the fairy tale-version..... What better advise then: love cannot breath without pain...?","Crazy, Stupid, Love."
165,gregkae,"Not crazy, not love",1,13 May 2021,"I'd like to know at what point does this comedy become funny? Or romantic for it falls in the romcom category - falls flat on its disfigured face. So Julianne Moore tells Carrell she wants to divorce him, somehow he befriends a guy in a bar who is bent on showing him how to bed women and there is no more substance to the plot until the bitter end. I know there is no American comedy which is actually funny save for Woody Allen and should have steered clear but it's Ms Moore's casting which threw me off. There's no hoping.","Crazy, Stupid, Love."
166,allan-14931,Surprisingly funny terrible romantic comedy,6,15 May 2016,"Overall this is a terrible romantic comedy. But jokes and acting carries you through.The plot is really stupid, and at times very unpleasant. Some will object to the underage sex angle, some to the stalking, some to the womanizing. What I found most grating was the idea of a sex-class system, where a girl should date someone not on her class level. And the story hinges on a girl dumping a guy for not realizing he is not on her level.On the plus side though, the acting is mostly solid, and there are a lot of really funny moments scattered about. And I do like seeing a womanizer teach another without being a complete Barney Stinson copy. The ending though, Jesus... It is really bad.","Crazy, Stupid, Love."
167,ikizdevran-882-254684,"This is Crazy, This is Stupid, This is Love.",9,11 July 2018,"This is Crazy, This is Stupid, This is Love.
With its dynamic mechanism, story, acting and soundtracks, ""Crazy, Stupid Love"" is one of the best films of romantic, comedy and drama genres. It is a film of good feelings and happy thoughts. It focuses on good, bad, sad and happy parts of relationships and love. From time to time, it takes you by surprise and, from time to time, you have the feeling like you are watching your own life. ""Crazy, Stupid Love"" is a piece from everyone's life. Each and every character in the film represents a feeling, therefore, interactions of the characters are meaningful, funny and highly entertaining. There are no bad characters in the film. When you think about it, nothing bad actually happens. There are only confused adults who find themselves back after wandering around for some time. Each character wishes only happiness for the other one. The characters are the strongest point of the film. They are not very deep but they are very meaningful and their stories are carefully crafted. Conversations are great and there is not even one character who stays out of the line. When these characters fit in the well-structured design of the film, you get to see a highly entertaining production. From main characters to the supporting roles each actor and actress contribute to the film with all their enthusiasm.""Crazy, Stupid Love"" is about love. It focuses on the problems of the routines of the marriage. It focuses on the struggles about finding true love or keeping it when you find it. It teaches us to fight for your soul mate and never give up on them. We learn this piece of advice from Cal (Steve Carell) and Emily's (Julianne Moore) son Robbie (Jonah Bobo). He is 13 years old and in love with their babysitter Jessica (Analeigh Tipton) who is 17 years old. As I said ""Crazy, Stupid Love"" is about all kinds of people, love and feelings. ""Crazy, Stupid Love"" is led by Steve Carell, he is the star of the film. Julianne Moore, as his wife Emily, she is cold and distant most of the time because of the phase she is going through, but as an actress she is successful in reflecting this phase to the audience. Ryan Gosling is a brilliant actor who can play any role without difficulty. He is not only handsome, but also extremely talented. When you look at his filmography, you are going to see that he has played diverse characters. He is not one of those actors who has limited talent and plays only one certain type of role. In ""Crazy, Stupid Love"" he plays Jacob, who helps Cal find his manhood again. In the meantime, he unexpectedly falls in love with Cal's oldest daughter Hannah (Emma Stone) and things get more complicated for everyone in a very amusing way. With her little role as Kate, Marisa Tomei is playing the role of a recovering alcoholic teacher, who is passionate and sexy. Her presence in the film has a direct effect on the success of the film. I just love the way she smiles, I just love the way she talks. That being said, Kevin Bacon as David Lindhagen, plays the role of the co-worker of Emily, who slept with her. He also has a relatively small part in the film but just like Marisa Tomei, his presence manages to change the course of the film. When you look at these actors, you are going to see that, ""Crazy, Stupid Love"" is full of well known, famous actors and actresses. Even from this, we get to see that this film is based on characters. Their performances make the difference in the film. When these brilliant performances are accompanied by a delightful story, you get successful film like ""Crazy, Stupid Love"".The film opens with Cal and Emily in a restaurant, when they try to decide over a dessert, Emily says she wants a divorce. After that, Cal moves out, he starts to hang out at a bar where he meets Jacob, a highly stylish womanizer, and starts to shape himself up and fights to get his wife and life back. Cal's transformation shows us the fact that even in marriages like his, where the couple love each other, you need to change yourself. You should always renew yourself, because when a relationship falls into routine, it is very hard to recover from it. You can pretty much guess how the story is going to end, but, because of the great techniques used by the directors Glenn Ficarra and John Requa, you get a lot of surprising turnings in the story, because the directors don't reveal everything from the beginning. We get to know the characters like they are not related and this is the reason why ""Crazy, Stupid Love"" is a surprising and therefore a funny film.From soundtracks to the performances, from story to its structure, ""Crazy, Stupid Love"" is one of the best films of its genres. It is both funny and real. This story can happen to anyone, that's why ""Crazy, Stupid Love's"" level of credibility is as high as the success of the film.","Crazy, Stupid, Love."
168,Sudarshan_Pawar,A funny romantic comedy movie,8,11 March 2021,Crazy Stupid Love is new age romance comedy movie. It will definitely entertain you.,"Crazy, Stupid, Love."
169,blob-93964,Surprisingly good film.,9,5 February 2021,I loved this. Never been a Steve Carrell fan but thought he was great. Very touching and funny movie. All performances were superb. I would recommend anyone to watch this film.,"Crazy, Stupid, Love."
170,Rishav1987365,Hilarious Family Mess,10,12 April 2020,It is a very hilarious comedy story with a huge family mess to be revealed .It start with two guys who doesn't accept their fates and try to be better versions of themselves while one guys another to reality he was wrong about the things he does .The hidden messages lie that love lead to one soul true mate and that makes you a better person of themselves .,"Crazy, Stupid, Love."
171,ldquinn,Very Funny Film,6,21 December 2011,"A four star comedy, but a three star film; if you get my drift. They should have another Oscar for comedy films.A very funny movie throughout. All the characters are wonderful; as is the script. There are a couple of scenes that go on a bit longer than I felt they should; but, no to any serious detriment.This interlocking film is the ""Crash"" of comedies - multiple story lines, weaving back and forth; finally all coming together at the end (well, not quite the end) in one hilarious and somewhat slapstick, yet still poignant scene.Not ""Blues Brothers"" funny; but, I'll see it often, over the next few years, I am sure.","Crazy, Stupid, Love."
172,Miss_Xray,Are we watching the same film(??)cause no way does this deserve any over 5 stars.,3,17 August 2020,What kind of crap film is this? 45 minutes in and Im not impressed. It´s flat and uninteresting and not funny at all. They got one thing right - Stupid. Like someone said.. Interesting actors/actrecess are wasted on this film.,"Crazy, Stupid, Love."
173,richy1024,A smart insight into the middle-aged man.,7,7 October 2012,"Crazy, Stupid, Love is a poise between perfect love and the perfect heartache. Glenn Ficarra and John Requa's movie is toned with a blessing of an appealing cast and a catalogue of emotions, accompanied by a sentimental description. The narrative is smart, counteracted by the bizarre irrational, dealing with love cheats, the self-pitying and the young and the wild. Steve Carell's role exploits the confusion of the male bearing. His wife Emily (Julianne Moore) declares her unfaithfulness due to her exasperated feelings of their long serving marriage. Cal (Carell) moves out in an attempt to clear the air, or in his case languish in his broodiness, wandering how his perfect suburban marriage crushed before his very eyes. Whilst in this fragile, yet sympathetic frame of mind he takes the time visiting a lustrous modern bar where he meets lady's man Jacob (Ryan Gosling). Jacob is a people watcher, a male spectator, inviting his services to help a man revitalise his sense of masculinity in an attempt to whisk the ladies off their feet and prize a night under the covers. Cal represents the typical middle-aged male stereotype, a lack of fashion sense, appalling hairstyle and a list of terrible handbook jokes. With Jacob's tuition Cal sets out on an operation to tangle with as many women as possible in a stab back at his unlawful and dishonest wife.The film's ending cunningly weaves all our lead characters together in an unexpected round up of commotion and revealing confessions. Although we are familiar with Carell's usual role as the family sweetheart or the exile trying to bind his way into the mainstream, his usual temperament is recognised with mischievous tones that we adore him for.","Crazy, Stupid, Love."
