,User_name,Review title,Review Rating,Review date,Review_body,Movie_name
70,Stampsfightclub,Wonderfully written sharp comedy drama,8,18 January 2013,"Cal Weaver (Steve Carell) starts struggling with life when his wife of over 20 years Emily Weaver (Julianne Moore) wants a divorce. When he meets Jacob Palmer (Ryan Gosling) at a club however, he starts to look at life in a whole different way.Crazy, stupid, love is crazy. It's also diverse, humorous, contains tremendous comedy performances and is superbly written. Starting off with a wonderful scene between Moore and Craell the tone is set for a bittersweet tongue in cheek lash out loud comedy drama. This is wonderfully balanced, taking into account Cal's emotional dilemma and the conflicting decisions of his wife.Steve Carell, renowned for his more slapstick style of humour expands into a great main role in this film, playing a dramatic styled performance but giving the grown ups some great one liners. After he gets over his first hurdle there is a scene where he walks into the pub, like he is the king of the world. This is fantastic and you will be smiling, pure comic timing genius. Julianne Moore fits her role well as well, playing off the other characters with ease and necessity. But Ryan Gosling is the real star of this 2011 picture. His bravado out for himself protagonist is cocky, is arrogant is whatever negative adjective you want to use. And yet he manages to seduce every woman he sees, making him the envy of everyman and the eve candy for every woman. This film for me excels through its drama rather than the comedy. Taking into account the situations the characters find themselves involved in, the story plays out slowly, getting deep into the character's minds and expanding to deliver a pinch of comedy at the appropriate moments.In many ways the film may have exceled more if there was more screen time for Kevin Bacon and Emma Stone. The stories involving Weaver's son and his crush is rather stretched and playing off on last ditch attempts to win one another's hearts only takes the film so far without giving the viewer anymore hope.This story also contains some great observations on love and what it means for people of all ages and who should know what love is and how to go about proving your love from someone. Adding to the family and lustful dramas elsewhere with a couple of excellent plot line twists, Crazy, Stupid Love is a film you will definitely want to see.","Crazy, Stupid, Love."
71,Bob-45,"Contrived, but surprisingly believable.",7,10 December 2011,"Looking at all the plot contrivances in ""Crazy, Stupid Love,"" I can't believe I found this movie so engaging and believably. I don't much care for Steve Carell, nor did I find his character very likable or sympathetic. Julianne Moore, while a fine actress, is not one of my favorites, either. However, the ensemble cast is good, especially Ryan Gosling, Emma Stone, Analeigh Tipton, Jonah Bobo and, in an incredibly thankless role, Marisa Tomei, that I found myself carried along by this broad, sometimes farcical story.Writer Dan Fogelman's screen is so eccentric, it drew me away from obvious conclusions with snappy dialogue and directors Glenn Ficarra and John Requa make no mistakes, as even one would have caused ""Crazy, Stupid Love"" to come crashing down.Some don't understand WHY Julianne Moore cheated and HOW Steve Carell changed. The answer is that Steve Carell took his life for granted and never developed his innate romantic skills. He had to discover his dark side before finding out WHO he really is. He reveals this in his climactic speech.While production values are top-notch, they are also suitably forgettable. The important thing for me is I watched the closing credits with a smile on my face, new found admiration for Emma Stone and Marisa Tomei and discovered what a fine comedic actor Ryan Gosling can be.","Crazy, Stupid, Love."
72,jon.h.ochiai,For Your Soul Mate,10,9 August 2011,"Estranged Carl (Steve Carell) and Emily (Julianne Moore) sit in uncomfortable school chairs in the silent hallway waiting for their parent teacher conference for their eccentric son Robbie (Jonah Bobo). Carl says, ""I miss you Em."" He confesses his anger for not having the courage to fight for her, "" because you fight for your soul mates."" You fight for your soul mate. That is what distinguishes and touches your heart about ""Crazy, Stupid, Love"". Directors Glen Ficarra and John Requa in tandem narrate this hysterical and poignant portrait of life. I did not notice that Ficarra and Requa co-helmed this voyage until the end credits. In retrospect, this makes sense given the distinct narrative threads that poetically intertwine. ""Crazy, Stupid, Love"" is one the best movies of year. Julianne Moore is amazing, deserving of an Oscar Nomination. Ryan Gosling as master player and Carl's mentor, Jacob, is awesome in his bravado and reluctant compassion. Gosling too deserves a Supporting Nomination nod. Steve Carell is invisible in his understatement; though his performance as Carl is all authenticity, vulnerability, and courage. His speech at the story arc is in character, and powerfully touches your soul. He is brilliant.The transparency and fluidity of ""Crazy, Stupid, Love"" is the genius of Ficarra and Requa. They seamlessly envision the screenplay by Dan Fogelman. The innate brilliance of Fogelman is that in this world, people are smart; it's just sometimes we all do stupid things. The most courageous of us forgive. Carell and Moore have astounding chemistry. I was in awe of the scene at night where Carl sneaks into his home to garden the lawn. While their kids have ice cream in the kitchen, Emily calls Carl's cell in another room. She invents a washing machine problem to ask Carl's advice. He plays along, all the while watching Em from the lawn. What resonates is their unspoken love. As ""Crazy, Stupid, Love"" opens we witness all too familiar Carl and Emily having their scheduled dinner date, while the kids are left with the babysitter Jessica (sharp and beguiling Analeigh Tipton). Out of nowhere Em announces that she wants a divorce after 27 years. On the drive home Em also confesses an affair with co-worker David Lindhagen (Kevin Bacon). Bacon is awesome in his charming smugness. When Em refuses to shut up, Carl ejects himself from the moving car. Back home Jessica finds herself in the midst of Carl and Emily's implosion. Jessica secretly is in love with the solid Carl—why she takes the gig. Previously, to the deathly embarrassment of their son Robbie, Jessica unexpectedly witnesses 13 year-old Robbie's crush on her. For Jessica, Carl is the fantasy opportunity. For Robbie, he is perhaps alone on an island. Carl moves out of their home into an apartment. Clumsily and desperately he begins frequenting a local bar. Slick handsome master player Jacob dressed in his Dolce' suit has compassion for wallowing Carl, whose wife slept with David Linhagen. Carl begrudgingly agrees to a makeover and Jacob schools him in the art of getting with women. One tip for Carl: Never talk about yourself. Amazingly sound. In the meantime, smart and beautiful Hannah (Emma Stone) is a law student studying for the bar exam, with expectations of joining the firm where she interns. More specifically, she is holding out for marriage proposal from the firm's deadly bland attorney Richard (scarily boring Josh Groban). Hannah's friend Liz advises that she can do way better. She also warns Hannah that she has a ""PG-13 love life"". While the two are having a drink at the bar, Jacob makes a play for Hannah. Jacob is bewitched by Hannah, partial, because she seems immune to his charms. Later when Hannah's world collapses, she tracks down Jacob to ""bang"" the hot guy who hit on her. He queries, ""They still say banging?"" Emma Stone is wonderful. She is naturally self-deprecating with a big heart. When shredded Jacob takes off his shirt, Stone says, ""Come on! It's like you're photo-shopped!"" Ryan Gosling is ripped, but that is eclipsed by his amazing performance. He humanizes the transforming cad, who finds his soul mate and is completely defenseless. Gosling evokes a quiet power. When Carl tells Jacob that Hannah is too good for him, he gazes into his drink and admits, ""I know"" The cast all have their moments. Tipton is a surprise as Jessica. She captures the angst of the teen growing into a woman. Marisa Tomei is restrained comedic brilliance as Kate. Bobo as Robbie is harder to peg. At times he seems relegated to appointed jester; however, he poignantly reminds his Dad that you fight for your soul mate. Writer Fogelman culturally whips everything at us, from hysterical sexting, ""Twilight"" jokes, to even ""Dirty Dancing"". At the end one concluding narrative thread on the surface is humorous, and perhaps unintentionally creepy. Probably chalk it up to the eye of the beholder. Acknowledge and applaud Ficarra and Requa for the poignant and humorous catharsis. ""Crazy, Stupid, Love"" is all about the possibility of finding and fighting for your soul mate. Sure love can make you crazy or sometimes do stupid things. And love is the only thing that matters.","Crazy, Stupid, Love."
73,stephenchase-63504,"Funny, original, & sexy!!!!!!!!!",10,15 April 2021,"Rated PG-13 for Course Humor, Sexual Content, & Language!!!!!!!!!!!!!!!!!!!!!!!!!","Crazy, Stupid, Love."
74,Ruskington,Mid-range fodder,5,12 October 2020,"A formulaic and rather predictable rom-com that falls well short of its potential and squanders a strong cast. There are many elements of Hitch in this movie, not least with the incredibly smug, irritating characters played by Ryan Gosling and Emma Stone who make my skin crawl in every scene. The ending is not half as clever as it thinks it is and it's only the reliable Steve Carell who makes the whole experience bearable.","Crazy, Stupid, Love."
75,Danusha_Goska,"Warm, Surprising, Funny, Grown-Up. Worth Seeing",9,17 August 2011,"""Crazy Stupid Love"" is funny, warm, well-made, and grow-up. Ryan Gosling gives an Academy-Award winning performance as the lounge lizard who outdoes all lounge lizards. There are unexpected, politically incorrect, farcical moments, and at least one classic love scene that did something no other love scene I've ever seen has done. I laughed out loud and came close to crying. Emily (Julianne Moore) tells her husband, Cal (Steve Carell) that she wants a divorce. Cal begs his wife to ""stop talking."" When she keeps talking, he throws his body out of a moving car. As a woman who has tried to talk to men about serious issues, and been frustrated by their occasional inability to respond, I loved that scene. I thought I knew where this movie would go. The movie surprised me. Its biggest surprise was Ryan Gosling. Gosling has done nothing so far that made me look twice. ""The Notebook"" was one of the blandest and most forgettable movies I've ever seen, and his smaller movies tried too hard. Gosling's Jacob the Lounge Lizard is one of the funniest, sharpest, subtlest performances I've ever seen. In every smarmy smile, in every delivery of the hackneyed pickup line, ""Do you want to get out of here?"" Gosling performs a razor-edge between dead serious and flat-out parody. Jacob is both a big joke on bar bravado and an awed salute to masculinity. Gosling demands that we grant Jacob the due of an alpha male, as if he were a silverback gorilla – or Frank Sinatra – even while he invites us to laugh uproariously at him. He's Buddy Love on steroids. And, finally, we are invited to see poignancy and even some heartbreak. Even if I hated the surrounding film – and I did not – I'd watch this movie again and again just to see Gosling in it. Robbie (Jonah Bobo) has an unquenchable crush on his baby sitter. I kept waiting for the film to do something conventional with Robbie's love, but it never did – in fact it got a little weird – and I liked that. When I was that age, I was capable of that kind of love. There is a tangle of subplots that weave together into a beyond-chance farcical lawn party that made me laugh and cry at the same time. The audience watches characters have their hearts ripped out, their dreams and plans smashed – and yet has to laugh. What feels like death inside of participants' hearts looks like a screwball ballet to observers. ""Crazy Stupid Love"" includes a quiet love scene that is worthy to become a screen classic. It involves two cell phones and a pilot light. This scene poignantly salutes what real, adult love really is, at its best. Steve Carrel could not be better in this scene.","Crazy, Stupid, Love."
76,MihaiSorinToma,A average love comedy,7,2 September 2017,"Becoming a boring husband after 25 years of marriage, Cal is asked by his wife (Emily) to divorce because she cheated on him with a work colleague. From this moment, his life is about to take a dramatic turn which coincides with a new friend, Jacob. He will teach Cal how to become a real man, impressing women and asking them out in order to make his wife regret her decision. All goes according to plan but Cal isn't convinced he's doing the right thing so he slowly tries to come back together with Emily. At the same time something strange happens to Jacob. He gets ""assaulted"" by a girl with whom he falls in love and tries to become the man Cal was before the transformation.It's a puzzling story which follows dramatic changes of attitude from lots of characters throughout this picture. Despite being an interesting story, it gets boring more often than I can neglect and although it tries a lot to be funny, it doesn't actually manage most of the time. It's a good movie nevertheless but there were some moments which almost made me skip so I can't give it a better rating. Too bad!","Crazy, Stupid, Love."
77,K3nzit,"Smart, funny and sweet",8,3 January 2020,"Smart, funny and sweet - Way better than I expected!","Crazy, Stupid, Love."
78,barryrd,Great entertainment pokes fun at relationships,7,28 October 2014,"Crazy, Stupid Love is one very funny romantic comedy that pokes fun at the dating lifestyle and longtime marriages. Sub-plots involving teenage love and jilted lovers create a tangle of funny complications. While the plot is contrived, the entertainment kept me laughing. Julianne Moore, Steve Carrell, and Ryan Gosling delivered in their roles as well as Marisa Tomei and Kevin Bacon who get caught up in the family conflict. Steve Carell, as Cal, was the husband who reacted with the cold, silent treatment when his wife and lifelong love, Emily (Julianne Moore), asked for a divorce. He then embarked on a freewheeling lifestyle with advice from Jacob, self-proclaimed dating expert, played by Ryan Gosling. Marital problems lead to outside love interests that overlap families, neighbors and work associates. The middle of the movie sagged a bit but was redeemed by some very funny scenes. All in all, a family situation fraught with a maze of hilarious complications.","Crazy, Stupid, Love."
79,vostf,The perfect blend of funny and serious,8,6 October 2011,"The major achievement of Crazy, Stupid, Love is to bundle so much fun and emotion, without a dull moment, in a basically routine suburban family crisis setup. You can't say this for a whole lot of movies each year, unfortunately.It doesn't start fast, it's rather low key until you get your run through the whole exposition. But it gathers momentum, scene after scene situations become crazier while never spinning out of hand, and characters are consistent and likable all along.With such a nice movie, delivering on all counts, you should be plenty happy. Yet, if you really insist, typecast is Julianne Moore as the neurotic suburban wife (but she does it very good and with some nuance from previous assignments) and typecast is Marisa Tomei as the crazy funny spicy litmus gal. These great actresses are really underused here. For it's more a movie about the guys, understanding them and have some fun with them, but who cares about this bias as long as it works?","Crazy, Stupid, Love."
80,JohnRayPeterson,"If you take romantic comedies seriously, this one is for you.",7,11 November 2011,"As many other reviewers wrote, I was surprised by the movie. The storyline did not lead me to expect anything new and I am not a Steve Carell fan, though I've seen several of his movies, I'm sorry to say. I was going to see this with some detachment and I at least hoped something good thanks to the rest of the cast.There was the comedy I did expect to see but more than that, there is a maturity in the subject and more than a half decent script. Carell did have the best part he's ever had and that was the beginning of a good movie going experience I did not think I would have. I'm not going to go bananas and say this is an outstanding motion picture but it probably won't disappoint most of you. Those easily impressed are going to rate it higher than it deserves, but so what.The character of Cal Weaver played by Carell is not overly acted; the part of Emily Weaver played Julianne Moore makes for a perfect match on screen. The sub-plot with Jacob Palmer and Hannah Weaver, played respectively by Ryan Gosling and Emma Stone is what made the movie worth watching for me. Then when the two stories meshed into one, well that sealed it for the audience.","Crazy, Stupid, Love."
81,Christian_Dimartino,I've been in such a good mood lately.,9,27 November 2011,"It seems like I haven't seen a bad movie in a while. I usually weed them out and suffer through them, but I haven't found one in a while. I've not even been on a good movie streak. I've been on a very good movie streak. A possible best movie of the year streak. And that streak continues with Crazy Stupid Love.Crazy Stupid Love is one of those rare romantic comedies that is actually good. It's poignant, funny, engaging, and romantic, like anything Woody Allen has done. It's the 500 days of Summer of 2011. That movie blew me away. So did this one. The genre was losing touch until this one came along.The film's hero is played by Steve Carell. He is Cal Weaver. After Cal's wife Emily(Julianne Moore) asks for a divorce, he meets Jacob(Ryan Gosling) a suave smooth talker who teaches him the ways of women. Jacob is a bit of a jerk. That is, until he meets the right girl. Throw in Kevin Bacon as Emily's other man. There's also Emma Stone as a nice girl who's boyfriend won't propose. Then there's also Cal's son(Jonah Bobo) who seems to know a lot about love. He has a crush on his babysitter, who has a crush on Cal.Crazy Stupid Love is funny, sweet, romantic, and real. The performances all feel very natural. It's one of those rare romantic comedies that actually works. It's smart, sweet, and just as crazy and stupid enough for you to love it. One of the year's best.A-","Crazy, Stupid, Love."
82,MattyGibbs,Very funny,9,18 November 2012,"This is the funniest film I have seen in a long time. It's a strange film in a way as it's billed as a Rom-Com but is far edgier and much funnier than that. I am not a particularly big fan of Steve Carrel but here he excels as a man left bewildered when his wife admits to an affair. What follows is slightly surreal as he is taken under his wing by the charming Rylan Gosling and taught about how to woo women. The results are hilarious as both men change the way they think over the course of the following months. An excellent cast featuring great performances from Gosling, Julianne Moore and the impressive Emma Stone make the very funny script come to life. This is a Rom-Com that no guy can be ashamed of watching and liking and the best of it's kind since Four Weddings and a Funeral.","Crazy, Stupid, Love."
83,DonFishies,"Bittersweet, emotionally uplifting and distinctly hilarious",8,16 July 2011,"Crazy, Stupid, Love. is one of, if not the best, American romantic comedies of the past decade. This may come as a shock to some (as it surely took me aback) but there is no other way to describe it. Going into an advanced screening of the film earlier this week, I had my doubts that it would be anything outside of generic. But instead of tripe, I got one of the most unexpected surprises I have seen all year.Cal (Steve Carell) and Emily (Julianne Moore) have hit a rough patch in their long-time marriage, and Emily inadvertently announces to an entire restaurant that she wants a divorce. Down and depressed, Cal starts drinking away his sorrows at a local bar, attempting to make sense of his predicament with anyone who will listen. Jacob (Ryan Gosling), a professional bachelor, takes notice and makes it his personal mission to help Cal get over his wife, and become a new man in the process.But this is just the main plot thread of the movie. It also follows Jacob's relationship with the absolutely stunning Hannah (Emma Stone), throws in a bit of curveball with Emily being romanced by David (Kevin Bacon), and even has a bit of a focus on Cal's son Robbie (Jonah Bobo) pining over his older babysitter Jessica (Analeigh Tipton). It may sound a little packed with threads and too many characters, but Crazy, Stupid, Love. is able to navigate between each character and couple with ease. It reminded me a lot of Valentine's Day, and how its main goal was to depict how different love is for a sizable amount of couples and singletons. Except it failed miserably at it, and stood out more as an example of every rom-com stereotype you could imagine. Thankfully, Crazy, Stupid, Love. takes the higher road and breathes new life into a stale genre.While the impeccable cast is more than enough reason why the film succeeds so well in being an atypical film in the genre, it is the crew behind-the-scenes that surprises even more. The film is written by Dan Fogelman, who is best known for a string of Disney films and the atrocious Fred Claus, and is directed by Glenn Ficarra and John Requa, who wrote and directed the sadly little seen I Love You Phillip Morris and wrote the now classic Bad Santa. These three would not be the first group on men I would turn to for a film like this, but their relative lack of expertise helps propel the film to the heights it reaches. It takes darkly hilarious turns in certain instances, plays other sequences totally unconventionally, play even more out with a foreboding sense of drama the trailer merely hints at, and trumps more than its share of genre stereotypes. Weaving between the plots lines, they make the film feel unique and different from others, all while giving it an aura of authenticity. While they stumble a bit in the final act with a series of sitcom-like shockers that border on ludicrous, they manage to pull off the rare feat of actually making the audience wonder if these characters will all end up together in the end, or if they will walk their separate ways; something that is truly uncommon for this genre.Acting wise, the film delivers in spades. Carell gives one of his best performances to date as Cal, moving as swiftly as the script requires between depression and humiliation, and touching and hilarious. The film stretches his dramatic muscle more than most, and allows him to give a performance that does not rely on laughs. The expressions on his face are just devastating in some sequences, and the wonder in other scenes is ridiculously hilarious. It is a performance I hope to see him come back to again, and make even better. Gosling plays against type, and gives an absolutely hysterical performance. He shines brightly in every scene, nailing every line and mannerism, while making this scumbag of a lothario become someone to really care about. He exudes chemistry and helps make everyone else's performance better. Moore and Stone also give great performances, easily balancing the humour with the drama. They are not given nearly as much to do as the guys, but hold their own on- screen.The supporting cast does even better. Bobo is phenomenal in his role, conveying an innocence and naivety that is more mature than I thought possible. He acts like more of an adult than some of the older cast does in many instances, and gives the performance a well-rounded other young actors would be incapable of. Tipton is not nearly as good, but plays the role of a confused teenager a little better than you would imagine. Bacon does great in a small turn as does Liza Lapira as Hannah's best friend. But it is Marisa Tomei who steals the show from everyone, playing one of Cal's conquests. She is dementedly unhinged and ridiculously over-the-top, but never falters. Her performance may be one-note, but it is easily the most memorable thing about the film.If I hold anything against the film (other than the final act stumble and the oh-so convenient way one particular scene comes together), it is that it ended. I know I have harped on how unlike other typical romantic comedies Crazy, Stupid, Love. is, but there is really no other way I can rave about it. I easily could have spent more time with these characters, and pined to find out what happened to each of them after the final fade out. The incredibly unlikely pair of Ficarra and Requa has crafted a truly wonderful and hilarious film that is nothing like what you could have expected watching the trailer. It is bittersweet, and easily one of my favourite movies of the summer. And this is coming from someone who loathes almost every single romantic comedy ever conceived.8.5/10.","Crazy, Stupid, Love."
