,User_name,Review title,Review Rating,Review date,Review_body,Movie_name
236,donflush,"kitsch, sloppy, no love",1,2 September 2011,"I went to see this upon reading the cast members...Marisa Tomei, Julianne Moore, Kevin Bacon, wow. But what a waste of talent for these people, and a waste of time for me as well. The story felt very sloppy, and the characters were bland as a result. Steve Carell's role reminded me of his role in ""40-yr-old virgin"": nerdy middle-age guy with little sexual experience. Sure he managed to be funny at parts but talk about typecast! Ryan Gosling's role meant to be a muscular dandy but came off as border-line homosexual. His upper body seemed to occupy an unhealthy amount of screen time. And one scene they put Steve Carell's face right on Ryan Gosling's groin area-what the hell was that all about? Oh and the whole thing about the 17-yr-old babysitter taking naked photos of herself for Cal(Steve Carell)-what?? How's that funny? It's rather disturbing! Julianne Moore's performance was kind of generic and I couldn't take one more shot of her teary, blank stare. And I also thought their kid (Jonah Bobo) was horrid! His character was the most painful to watch, following by Emma Stone. My! What a terrible actress. The total lack of depth of the film was astounding. Please can someone tell me what's the point of the story? I mean, really. I think it was made for people that are grown up on the outside but still 8-yr-olds on the inside. For the real grown-ups, it might leave a bad taste in your mouth, so be warned.","Crazy, Stupid, Love."
237,itai-orion,Not as good as it should be yet better than it could have been,7,17 February 2017,"I am a big fan of the rare flower that is the original rom-com. Crazy,Stupid,Love is such a film, and it is remarkably well-rounded with a cast that I would easily follow into much choppier waters than these.Ryan Gosling shines as the man he naturally looks to be, Emma Stone is deliciously mature and naive at the same time. The best scenes in the film play out between these two highly-talented hotties.The mature pairing with Steve Carrel as the boring guy who's been married too long is a trope I have seen before (by him), and while well executed it is still not enough to rise above the cliché.The juniors in the film add an edge to the humor that is distinctly uncomfortable at times, and the scene where conflict is to be found (I'm being vague for spoiler reasons) is far too convenient and feels shoehorned in. Especially our main characters seem to step out of what they have been so far in order to push the plot forward. This is a brilliant film in many senses, yet lags in so many others really have trouble deciding if I like it or not - it is over- stuffed and at a run-time of two hours over-long...perhaps another viewing is merited...oh JOY!","Crazy, Stupid, Love."
238,omarramonmuniz,What movie were you watching?,3,19 December 2011,"I saw a movie that was completely unbelievable. And the unbelievability not only kept me from caring about all these characters, but I found I started to really dislike them.This is a movie about love. 95% of the movie doesn't show us why these characters fall in love--the one exception is the two minutes when ryan gosling and emma stone's characters finally socialize. Otherwise, for a movie that revolves around how we love others, we are never shown why. At least tell us why, which would be bad filmmaking, but at least it's something. But from the onset of the movie we know certain characters love other certain characters, only because they tell us that they do. Never do we know why. There's no meat added to the bones. In the movie, love is a defined thing. Not as ambiguous as it is in real life. But although it's a singular defined thing, they never define it! Secondly, these characters have no motivation to do any of the things they do. Or let me rephrase: the motivation that's offered is shotty, unbelievable. Why is ryan gosling helping steve carrell? I don't get it. Why does Steve carrell change the person that he's been for 40+ years? I don't buy it. Why does Marissa Tomei become attracted to Steve Carell, because the plot needs her to. Why does Emma Stone walk into a bar and kiss a guy who just happens to be there after a 3 minute conversation she had with him over 1 week ago? And why does she grow to hate her boyfriend? Why does the son build this huge thing, somehow lug it to a high school, cut school himself, and stand up in front of kids much older than him to profess his love? Why does the seventeen year old love an older man? To be clear, motivation is offered for most of these scenarios, but it's unbelievable. And in some cases no motivation is offered. That's bad writing. Not even in a ""it's so bad it's fun"" kinda way. It's just bad. And it makes the movie totally uninteresting.Steve Carrell attempts to save this mess with a few punchlines that do push out a chuckle and there's a funny little farce at the end of the movie (also with half-assed motivation, but you'll give it a pass). But in the hands of creatives with something interesting to say and who don't have the pressure of a major Hollywood studio backing the film, this movie could have been very good.","Crazy, Stupid, Love."
239,wichio,Romantic Classic,10,7 September 2011,"Honestly as the years pass by, we can start telling which romantic comedies have come to become romantic classics. Last time I saw one, it was ""The Holiday"", But ""Crazy stupid love"" has come to become one. Sofisticated humor, clever script writing, and great story lines, turn this movie into a must see.A funny-sensitive Steve Carrel, a dazzling Julian Moore, a manly- romantic Ryan Gossling and a smart-cute Emma Stone, make the perfect lead cast; plus a very unique supporting cast spicing it up a little, playing the children, the nanny, the best friends, and some people in between the married couple's relationship.Plus, be ready to get a few plot surprises, I assure you, you won't be expecting some of those.Although, if you're expecting to laugh your ass off, and be sitting on the edge of your seat exited about something amazing that's about to happen, you may get disappointed. Just relax, seat back, maybe prepare a few tears, hold your couple tight, and you're all set to enjoy this clever romantic comedy.","Crazy, Stupid, Love."
240,OrsonLannister,A Healthy Addition to a Sappy Genre,7,1 August 2011,"I had three reasons for originally seeing Crazy, Stupid, Love this weekend. 1. I heard bad things about Cowboys and Aliens. 2. My girlfriend said so. 3. Emma Stone is gorgeous.Fortunately, I was pleasantly surprised with the end result. The scriptwriting was clever, witty, and never stiff, while the directing was top-notch. However, no matter how you play it, this is a character story. Steve Carell plays Cal, a likable middle-aged man whose wife, Emily, (Julianne Moore) suddenly requests a divorce after 20+ years of marriage, along with an announcement that she has cheated on him. Heartbroken, Cal eventually turns to the rich womanizer Jacob (Ryan Gosling). His story of ""re-discovering his manhood"" (read: seducing women in a bar, including the wonderful Marisa Tomei) soon intersects with the story of the young, smart, and aspiring lawyer, Hannah (Emma Stone) as well as a deranged love triangle between Cal's middle schooled son, his babysitter, and Cal himself.It was refreshing to see Mr. Carell play a not COMPLETELY incompetent character for a change, and he plays it well. Needless to say, all of the actors and actresses played their parts well, but surprisingly, I was most impressed by Ryan Gosling's performance, a man who I previously viewed as pure woman's eye-candy. For the most part, the on screen relationships were honest and endearing, with the exception of the middle schooled infatuation with the babysitter (call me cynical). The ""bedroom"" scene with Hannah and Jacob is especially engaging (even though I usually hate montages). Steve's love for Emily never seemed silly, and the babysitter's crush was played out just long enough not to be tiresome.I also liked the ""twist"" (are twists allowed in romantic comedies?), which I didn't guess earlier on. The laughs were also plentiful and hearty enough without being too lowbrow/slapstick.However, I have yet to see a perfect romantic comedy, and Crazy, Stupid, Love has its share. For instance, Hannah and Jacob's relationship is squeezed in and never given time to develop. They are given one scene to fall into unconditional love for each other, and although the scene works great, the relationship feels distanced. Also, Emily's reason for divorcing Cal is never fully explained. Yes, she cheated, and he's apparently boring, but she seems to want Cal back from the moment she leaves him. I won't harp on Cal's son's wince-inducing endeavors for his love, but lets just say some of it was over-the-top. And of course, no movie in this genre escapes clichés (note to screenwriters: climax scenes of public embarrassment/expression of love where the on screen audience has no relation are NOT funny. Please stop). Finally, the first half flowed much better than the second, and guys will feel conned by the necessary Hollywood ending. All in all, I found myself laughing, smiling, and enjoying this flick much more than I thought, and that's what entertainment is all about. I recommend Crazy, Stupid, Love. Oh yeah, and there's Kevin Bacon.","Crazy, Stupid, Love."
241,totipota,"Crazy, Stupid Stupid... Stupid, Love",5,22 November 2011,"DVD rentals' friends might have noticed this new release. Although I'm not a romance flick type of guy - my opinion is that it's all downhill from the release of Before Sunrise in the genre- I wanted to watch this film. Specifically, after watching its trailer, I believed that it would make fun of the other recent chick flicks. Oh boy I was wrong, the only thing that mocks is itself. For example, a lot of similes are being used in it, one of which was about how Emma Stone's character's life resembles that of a PG-13 movie. This is a PG-13 movie so every sequence is done in that moderate way. You'll get bullcrap like the '' soul mates '' theory, preteens talking about love (a feature probably adopted by another shitty movie '' Love Actually '') and how not being steady is lowlife. Basically it's a Disney like movie with a PG-13 rating.But let's analyze its plot... There is this married couple, Steve Carell and Julianne Moore, who seems to be going through a dull time. Hence, Moore wants a divorce. Carell then stumbles upon Ryan Gosling, a player, who volunteers on teaching Carell the ways he rolls with girls. So far so good, then comes the fairy tale part that'll make teen girls moist and nostalgic. It turns out that no character in the movie is getting what they really need, which apparently is '' love '' as described in the film. Therefore, characters start behaving irrationally, '' crazy '' which is unrealistic, unreasonable and plain '' stupid ''.Its humor blows, with heavy overuse of the trending slang phrase '' Seriously? '' and other repetitive jokes. At some point, Twilight is being mentioned as a bad movie but comparing it to this it's way better. For the followers that have watched this, I want to share that I felt pity for Kevin Bacon's character. In addition, I enjoyed its soundtrack and Ryan Gosling's pugnacious moments. There is a twist in the end, that's played really bad by the screenwriters and succeeds in making you even more mad with the film. If you got nothing else to do and feel like raging in front of your TV set, this movie is for you. Let me just inform you that it gets worse as time goes by.It seriously owns in the pointless meter, along with other applesauce by scoring a five out of five.See the original post of this review here: http://tinyurl.com/ctbedb6","Crazy, Stupid, Love."
242,Carson4785,Let's get out of here,6,12 April 2021,"Steve Carrell is getting a divorce. He's typically Steve Carrell until he meets Ryan Gosling who's rich, kind of mean, and slaps Steve repeatedly into having a fashion sense and a way with women. Their chemistry is great on screen.If you can get past the rather painfully-aged womanising and general uncomfortable humour of the first half an hour, the film is an elegy to soulmates and a sweet if sometimes cringy one.After a fun twist and the ensuing brawl the plot probably could have cut straight to reconciliation. It's not horrific but the film is slightly too long as it stands and doesn't quite maintain interest all the way through. With 20 minutes to go you may find yourself wishing Gosling would come and offer you a way out of your seat...","Crazy, Stupid, Love."
243,amelbourne95-43-3421,"This is crazy, unashamedly stupid, this is love - just a shameless but hilarious portrayal of love",9,30 November 2012,"Well, it's certainly not your average romantic comedy. Like other films of similar genre, though, it was still clichéd. I wouldn't find this among the Hollywood cheese, but I wouldn't find it as a classic. It still had that small spark that let it down, which I appreciate because it wasn't major, and it didn't try too hard to be funny. In fact, this film was pretty relaxed and like people say, the unabashed humour just made it a feel-good as well as a romantic comedy. I loved the actors who played their characters, I like Steve Carell for his dry humour, Ryan Gosling was supposed to be the lady-killer who was actually quite funny, but I wasn't as attracted to him as much as the rest of the characters. As well as Emma Stone, I really enjoyed Kevin Bacon's little role – I mean, who can get more awesome than him, especially with just such an awesome name? I was right, this is a great ensemble of characters, it was extremely funny, and because of the shameless (quite) realistic portrayal of how love works, this wasn't your usual romantic comedy from Hollywood. It was crazy, unashamedly stupid, and it was certainly love.","Crazy, Stupid, Love."
244,tferjak,crazy stupid crud,1,3 November 2012,"I love my wife. Let me say it again, I love my wife. I have sat through Brokeback Mountain and I have watched The Notebook (for a trade-off for her to watch Shaun of the Dead). Tonight I willingly tried to watch Crazy Stupid Love. I have never seen a movie that was so predictable. The characters, the lines, the situations, come on! I don't watch movies to see someone's abs, or someone's chest. I watch movies to be entertained. This movie was so far from entertaining it was ridiculous. Steve Carell was enjoyable, not as much as in The 40 Year Old Virgin, but not bad. The only thing is, this type of character can only pull a film so far. It is the epitome of female fantasy. Cute young guy, older aging guy, old ex-wife, young female love interest. Where did they hope this film was going to go? It went nowhere. At least The Notebook had a story, ( however sappy), Brokeback Mountain was a cinematic marvel (kudos to Ang Lee). This movie has nothing. If I were able to rate a 0, I would have.","Crazy, Stupid, Love."
245,radamanthe,Ups the ante of idiocy,3,21 January 2016,"I had higher expectations of this movie based on the actors involved. The first part is not that bad, but it goes downhill after Steve Carell's character stops playing the miserable and cheated on husband and becomes a womanizer. This movie offers an extremely moronic view of human relationships, since Gosling's character eventually decides to stop chasing skirts after he meets Mrs. right of course and Julianne Moore's character all of a sudden wants her husband back after cheating on him (the reason for this is never spelled out, the same with why she felt the need to have sex with another guy in the first place). The icing on the cake of stupidity is the relationship between the son of the family and the nanny, that concludes with the latter offering some photos of her posing naked to the former as a means of compensating (???) for the fact that he is still very young and she is not into him. In a nutshell this movie manages to offer some of the silliest romantic clichés about adult relationships, while it piles up on the creepy factor about the teenage ones. Not a mean feat by any means!!","Crazy, Stupid, Love."
246,nitikboni,Boring....,3,22 June 2019,"The movie is very slow paced and boring.
It is over rated. I thought that i will try a romance genre this time but sorry to say this movie really sucks","Crazy, Stupid, Love."
247,Jonad-2026,"Great cast, funny lines, disturbing plot",6,27 April 2020,"This romantic comedy is worth watching if you can completely suspend disbelief and laugh at some of the lines. Treat this as more comedy than romantic.The cast includes Steve Carell, Julianne Moore, Emma Stone, Ryan Gosling, Marisa Tomei, Kevin Bacon. Lots of talent who do their best to deliver the lines. Carell and Moore are a couple in a troubled marriage. Their thirteen year old son has a mad crush on the 17 year old babysitter, who has a crush on Carell, who is separated from his cheating wife. Carell meets Gosling in a ""magic"" pickup bar where single beautiful women abound for Gosling to pick up and take home. Gosling teaches Carell some of his secrets, while Gosling meets his soul mate. Hilarity ensues.Carell and Jonah Bobo (who plays Carell's son) deliver some funny lines, which make for a few memorable scenes. The plot itself, however, is flat and unrealistic, so I found myself not caring about the characters and just waiting for the next punchline.Some complaints (with spoilers):There can exist a bar where, on a random night, the hot single women outnumber the single men, but that's not typical. Word gets out.It is in no way normal or funny for a high school age girl to try to send nude pictures to a grown man, especially a 40-something dad down the street. That's child porn. No, no, no.The 13 year old ""loves"" the babysitter, but he conducts himself like a creeping stalker. Jonah Bobo is funny at times, but his behavior is not normal.Wives who cheat on their husbands rarely get taken back. It works the other way as well, but more so for cheating wives. Infidelity is a nuclear bomb for most marriages.Where one spouse cheats on the other, don't introduce a plot line where the aggrieved spouse somehow ""caused"" it by his or her actions.Pickup artists whose priority it is to bed as many women as possible don't just become doting boyfriends and husbands. They have deep issues with connection and intimacy. I get it - the writers think that the female audience wants to believe that there are Ryan Goslings out there, just waiting to meet them and become ""good"" boyfriends. The notion that some ""magic woman"" will flip a switch and make a womanizer normal is far-fetched.","Crazy, Stupid, Love."
248,Tareq9248,It's good,7,28 March 2016,"I usually cringe through these cheesy and dramatic moments but in this movie I didn't I actually enjoyed many of them and that has to be because of the great acting and that I like these actors especially Emma stone and Steve Carrel. and the story is really well done, interesting and enjoyable with good twists. I had few laughs as well through the movie so if you like romantic comedies you like this one especially that this is not a typical love story between two persons that you know they will end up together besides the drama is really well done here. A great message is delivered through this movie as well that you will get to you without too much cringing .","Crazy, Stupid, Love."
249,beingasif,ONE OF MY COMFORT MOVIE!,9,23 May 2021,"CRAZY STUPID LOVE.. Indeed a crazy movie with a good storyline.. A notch above than a usual romantic comedy. The cinematography is fantastic, the soundtrack is sweet, the acting are great. I don't know why I found this movie so so fantastic and enjoyed a lot. I watched this movie so many times and enjoyed every single time.","Crazy, Stupid, Love."
250,Trojanic,8/10,8,19 November 2011,"There are a few ways straight off the bat that I would use to describe this film; good, funny, laid back, easy viewing and heart warming – It's the kind of movie that is great for a first date and also great to sit down to watch with the family as there is something in there for everyone- but there is one particular word that I would not use and that is; predictable. Now I'm not saying you won't guess where the film is heading as it pans out but there will definitely be a couple of surprises along the way.After finding out his wife has had an affair and wants a divorce Cal (Steve Carell) is taken under the wing of ladies man Jacob (Ryan Gosling) and shown the ropes of being a single guy again in the modern era.The cast is strong and everyone gives a solid performance but the key to this movie is in the writing, rom-coms lately have been in a bit of a slump and getting kind of boring but Crazy, Stupid, Love breaks away from the norm and shows us exactly how entertaining the genre can be when done correctly. Whilst following the usual structure of a standard rom-com and throwing some curve-balls along the way Crazy, Stupid, Love will pull in plenty of genuine laughs.VerdictIf you haven't already, go see this movie.The Late Review","Crazy, Stupid, Love."
251,D_Y_Evans,Great in parts but horribly flawed in others.,5,11 September 2013,"Crazy, Stupid, Love is almost a brilliant film, but it misses the mark so heavily on one of its main elements that is is dragged down into the mud. To it credit it does the 'Com' bit fantastically, Steve Carell plays the awkward 40-something part brilliantly, as he does whenever he is cast in this role. He is a pleasure to watch and this movie would be lost without him. Gosling is even pretty watchable, and at times funny, his character has little depth however, and the parts of the film that are emotional or romantic he fails to put any real feeling into his character. The films biggest flaw is its women, I am not one to shout the feminist agenda from the rooftops but you get the feeling the Writers had a complete contempt for the female sex. Moore sometimes emerges from these shackles and you start to emphasise with her character but mostly she is the cause of the breakup and has little on screen time with her family. Emma Stones character is simply awful, and her friend in the film played by Liza Lapira is downright sickening. If we take one thing away from this film it is that if a woman is better looking than her partner he better know it, and he better know that he is lucky to have her. It is such a pathetic and shallow view of love an relationships and it jibes so sharply with the message this film thinks its trying to communicate that it not only taints the film but destroys it. As if this wasn't bas enough Stones character for the rest of the film goes from mish-mash-crazy to completely uninvolved, its a real shame.The film still has its laugh-out-loud moments, and some great writing, but it cant recover from its fatal flaws.","Crazy, Stupid, Love."
252,lalybehappy,"Feel-good sexist movie, no surprise: Written and directed by men only.",4,21 June 2020,"What's going on with the men in this movie? Relentless and pushy. And what's going on with the women in this movie? Mindless and pushovers, like dolls.All along I was missing just one scene where any character would act like a normal person. Examples of this all only in the first introductory 20 min: Cal's son Robbie keeps on pushing to get Jessica to love him back when she has told him clearly and directly that she isn't interested in him and is even uncomfortable with him continuing. The same thing happening with Jacob and Hanna. And on the other side you have Jessica crushing on Cal, who doesn't acknowledge her advances as inappropriate at all. Then you have Jacob who is just a copy of Barney Stinson and Charly Sheen, culminating in teaching Cal sexist ways of thinking of women. Not no mention the lack of communication between Cal and his soon to be ex-wife Emily, where does the divorce come from? Why is Cal just accepting to leave his wife from one day to the next without barely acknowledging it?I tried to go through with the movie by thinking about those highly incoherent decisions as plot-tools to arrive at the improbable situations that make up interesting stories, but scene after scene the movie wasn't improving. I also tried getting in the mindset of each character, but no matter what, the scenes with cringy unrealistic reactions and sexism were one too many and unbearable, and neither the story nor the acting were enough to get me to continue watching.It looked like the movie was made to fulfill male pipe dreams and no one checked in to make sure it could get in touch with how relationships actually work or how women think and act. I went to see who was in charge of the development, and there's the explanation: no woman in directing or writing position to balance it out!This movie is saved from having a rating that is close to 1 out of 10 stars because of the occasional quality humor. However it get's a non passing rating of less than 5 out of 10 stars for being a movie that's not bearable.","Crazy, Stupid, Love."
