,User_name,Review title,Review Rating,Review date,Review_body,Movie_name
151,Neil-M09,"If you don't like the Underworld saga, avoid it",3,10 December 2016,"Kate Beckinsale as Selene, like the previous movies, is the best of the film. Theo James as David has an important role due to revelations of his past, the rest of the cast was OK, they give us a female antagonist blinded by ambition, vampires and lycans' confrontations as previous releases and the usual Selene vs. armies. The major problem with this movie was the linear script, doesn't surprises at all, the trailers show us the few highlights of the movie, leaving the public with Selene's flashbacks, betrayals and characters' discussions for their own ideals and perspectives. I tried to liked more, ignoring this flaw, but the direction was below the average too and considering the year, the CGI is bad, without much progress since the last film combined with acceptable soundtracks with sound mixing and editing as the only strong point, the movie is bad in almost every aspect. So, if you're an avid Underworld fan go to see it the contrary avoid it or wait until the movie appears on TV or Netflix.",Underworld - Blood Wars
152,MrTeaNCrumpets,Quite a let-down,4,22 February 2017,"Being a fan of the Underworld films, I was expecting a proper squeal to ""Underworld: Awakening"", however what we got was something that felt more like a spin-off than a squeal. There were several ""WTF"" moments, combined with the inconsistencies dragged the film down further. The only joy I found while watching the film was seeing a new instalment in Underworld series.",Underworld - Blood Wars
153,mjweston,Too short.,6,26 July 2020,"This film actually runs for 1 hour 16 minutes, leaving out the extensive credits and the repeated beginning from Awakening. Is that good enough? Not for me I'm afraid. Seems they're just interested in cashing in on the franchise. No more sequels please.",Underworld - Blood Wars
154,sungod64,Big mistake!,5,6 January 2017,"it was a big mistake to NOT bring Micheal back,he was very important to the story line.The reason why the story was prolonged because it was Micheal's blood or the fact that he was a hybrid that made it so interesting.The hybrid factor gave them MORE content to work with and they so how f-ed it up!The baby was a good addition but a mother and father fighting for their lives would have been even a better story.Everyone could have related to that and not be put off by feeding us kate B story lines for the past two movies.This is the last time for me,we need for the franchise to feature a NEW star to revitalize the story,maybe then the movie could make money but kate b has worn out her welcome in this franchise.",Underworld - Blood Wars
155,fragya3000,Without a doubt the worst movie I have ever seen.,1,29 January 2017,"I am a big fan of the Underworld series. I have watched every entry at least a dozen times, and own the whole collection on blu-ray. Naturally, I was comfortable assuming that would have some bearing on my enjoyment of this movie, and I could not have been more wrong. It's not even that this is just a bad Underworld movie, it is a horrendous movie all by itself. This movie has the worst plot, dialogue, acting, action, and just about everything else that I have EVER seen. My best friend and my wife, who I unfortunately took to see this monstrosity in the theater, have now banned me from picking the movies we go watch. DO NOT SEE THIS MOVIE.",Underworld - Blood Wars
156,AriLoren,Wasted Acting,3,25 July 2017,"The story line doesn't continue where it left off, which only makes you think that the role was declined to those in the last film. The storyline veers off the entire script and brings new characters to incorporate a whole new story. For that, the producer should have just created another movie instead of mutilating a great story they had going.Very disappointing.",Underworld - Blood Wars
157,stokesy1012002,Best since Evolution,9,9 July 2020,"OK so I refused to watch Blood Wars after the terrible Awakening but I've just finished watching it and I was impressed!Yes the CGI still not 100% and I do prefer the costumes over CGI and yes the fight scenes were chopped up but that's what the Americans do I'm afraid, they need to start taking notice how the Indonesians do it or get Gareth Evans to direct the next one but without Kate Beckinsale I highly doubt true fans will watch it?If another one is made then they need to reboot it only not follow it on from this one which tbh ended well. It explained Michael's death and Selene is now the most powerful she's ever been so ending it here would make sense!Shame the runtime wasn't longer than 90min 😭If you like the 1st two Underworlds then you'll love this one. Just a shame they did Awakening and it's a shame Scott Freeman didn't want to come back after Evolution because true fans wanted to see him reprise his role instead of us seeing a CGI Michael and lame story of his death which only got explained in this one which was annoying as we was always lead to believe that he was possibly still alive!!Any way this film is still a solid 8",Underworld - Blood Wars
158,patrickjames85,It was good! It exceeded my expectations based on reviews.,6,1 March 2017,"I've been a fan of the Underworld series since the 1st film, which remains the best one in the series. I was excited to hear the news that ""Blood Wars"" was coming but I was hesitant seeing that I already have a love hate relationship with the previous films in the series. When reviews started pouring in for ""Blood Wars"" I lost all interest in going to see it in theaters. I have to say that now that I've seen the film for myself it is nowhere near as bad as many reviews made it out to be, in fact it's one of the better ones in the series. I guess the biggest issue I have with ""Blood Wars"" is that the film spent too much time on a story that has already been told. The entire story the film told could've been wrapped up in 45 min and then the story of Selene & her daughter could've been wrapped up. I would've also enjoyed if the second half of the film allowed us to see how Selene would handle the role of being an elder.",Underworld - Blood Wars
159,connormacleod84,poor,3,14 March 2017,"movie was watchable, but the problem with so main pointless twists in a movie is that there not enough time spent on character development. so yes i watched the movie and after it i have no idea where the bad guy came from, why he did what he did. all we know is he killed her boyfriend.i found that the vampire women who drunk her blood and died 5mins later was a pointless time waste that could been used in the actual story.that guy she once saved who was weak. turns out he has the blood of the elders and just knowing that auto makes him have a lot of strenth it seems yer i think left big plot hole there.then it was also abit weird how easy she was beaten, as if the story writers had forgotten how strong she was after the elder blood was given to her. all because the plot demanded it. if you watch the other movies and see how fast at combat she is. then there was no way she would not seen him pull that knife out.",Underworld - Blood Wars
160,erick-palacios04,Franchise Phobia,5,23 March 2017,"I have a new disease in me, i call it Franchise phobia, you don't know what you're gonna get by watching the 4th, 5th, 6th, 7th, etc, etc ,etc, installment on a very known and very respected movie franchise. Take The Fast and the Furious for example, yeah, they are very explosive, they lie right through your face, but they are always looking the next best thing in each movie. AND lets be reasonable, you can't expect an Oscar worthy film when you are going to see the 5th or 7th film, you know they are packed with extreme bad word of dog's excrement, but WE LIKE IT. Know lets circle back to Underworld, the first two films were amazing, the 3rd not to much, but the 4th and 5th are the same dog's... you get the idea... Of course it's worth watching it because of Kate Beckinsale (MY GOOOOD), and that's worth a 4 point review and the other point it's for the entire movie, and i was really hoping for an amazing film, but left with a dog's... taste in my mouth (not you Selene of course GOOOOOOD), after that i felt like if i was sick, but not physically sick, Franchise Phobia Sick, PLEASE STOP MAKING SEQUELS THAT SUCK, YOU ARE RUINING MY CHILDHOOD. PD: Kate Beckinsale, you are the best.",Underworld - Blood Wars
161,Mystery11,Great movie and story but horribly dark to watch as it's 10% visible.,4,10 February 2017,"This movie has great story, fight scenes and actors. It deserves 8 stars. However, this movie is horribly dark the whole length. You have to stress eyes to see what's going on. Many times you can't even see who's fighting whom. Horrible lighting. Whoever thought of making this movie dark is dumb. Yes, it is vampire movie and they live in dark but that doesn't mean viewers have to suffer. We can imagine the scene is at night even with little more light. With little bit brighter scenes, this is a great movie but as is, terrible to watch. My eyes hurt after watching it as I was trying to see the entire movie squeezing my eyes to figure out what's in there. Stupid dark!",Underworld - Blood Wars
162,dhenwood,Entertaining but far too dark,7,8 June 2017,"If you like the Underworld series you will like the film. It has Kate Beckinsale in her leading role again, and interesting premise which I shall not say to avoid spoilers. Some old idea's and tropes along with some new one's to put some fresh blood in to the mix (blood....get it) ;)However the entire film is far too dark. Underworld is set in the dark world of Vampires and Lycans and is almost entirely set at night but even then it is far too dark. It is as if all the lights are off and we are expected to watch the entire film by moonlight.....or specifically obviously day for night shots coloured to look super dark. If there is another film I sincerely hope that they add more light. None of the other films have been so dimly lit.",Underworld - Blood Wars
163,flintridge0503,Didn't Quite Hit the Mark,6,5 March 2017,"What can I say, Len Wiseman's 1st two movies in the series was the best. Since then, the franchise has been declining. Production value for this new installment is lackluster, direction is missing its cue on some parts, story is below average, and some of the acting are horrendous. (Theo James being one) but I guess if you look that good, who needs acting skills right?? But it was much better than Underworld Awakening, which is arguably the worst installment of this franchise. Kate Beckinsale's back doing her thing, kicking butt! and taking names. Action sequences at times missed it's mark. Very confusingly shot, not much excitement, the build up in the second act gave us nothing climatic in the 3rd act, the only highlight was probably Lara Pulvar's character as Semira. She gave a convincing performance but she didn't have much to work with, with such a fluffy script. This would be the second worst installment to this franchise. If they decide to make another one, I hope they bring in someone who can revamp this series. There are not many vampire/werewolf movies out there. I don't want this one to go down in flames!",Underworld - Blood Wars
164,bogdanvalentinneacsa,Turn brain off and enjoy,8,13 January 2017,"Goes without saying from the rating I really enjoyed the movie. When it comes to the underworld series, I pretty much liked all of them so far (Awakening was a big meh but still OK).So lets just start by saying the obvious, if you didn't really liked any of the movies in the series so far, you will not like this.Second thing, if you really loved and are a fan of the series, you might also have some problems with the movie if you over analyze the plot, since there are some good sized plot holes when looking over the entire events that happened in the previous movies.That all being said, the movie was pretty damn fun. Great action scenes, some pretty awesome locations to shoot in and in my opinion a pretty satisfying ending if this is the last in the franchise. Again, there are some plot holes in there, but I just got straight past them and was never bored during the entire movie.",Underworld - Blood Wars
165,family-63052,Always good to see Selene back in action,9,12 February 2017,"It's been such a long time since last Underworld franchise. It's a bit disappointed to know some characters' death but all in all, it's always good to see Selene back in action. Would be great to see more of her child as well too. Will the change of director change anything? Maybe but not much to me perhaps. Movies focusing on how hard women worked, fought in search of victory and success is still as rare as it comes. And frankly, such characters, more often than not are being under-estimated. Definitely need more movies depicting the sacrifices of what people have done to maintain humanity in the world, even though we all know this has become more and more challenging.",Underworld - Blood Wars
166,info-6175,Surprising quality despite HALF the budget!,9,12 March 2017,"I'm actually quite shocked at what the studio managed to accomplish here.We have highly regarded actors making their best of a script that is too short, a budget that is too small. Yet they still manage to fit it all into a well knit movie that is entertaining, dark, gritty and as exciting as it can be in the short time that the movie lasts. I honestly cannot see any way that they could have done it better and it's a shame they didn't have more time to polish this into something great. It has a ton of potential and the world of under have had it for a long time.Considering that this have gotten half the budget from the previous movies, i would figure that this is the last of the series...",Underworld - Blood Wars
167,jadeylady96,Pretty / Boring.,4,19 February 2017,"Film is pretty and filmed good, but my god - one of the most boring films I've had to sit through with family. Would definitely not want to watch again sorry. Too confusing and pointless. I'm a big fan of lots of films and very disappointed by this. One of the main fighting scenes was frankly appalling and not to usual standard. Four stars again simply for just the good effects and filming.",Underworld - Blood Wars
168,josip555,expected so much and get almost nothing,6,12 February 2017,"First of all I'm a big fan of Underworld, I watched several times the all parts of Underworld so this review is pretty realistic you will get. So, when I first watched the trailer I thought vau, this is going to be great, I was so excited and then last night when I watched the movie, I was really disappointed. Here is why, first three parts was so great there was so much action and good old fight with power and strength between lycans and vampires and not just that, but story in the whole film was great, than the fourth part came, and it was also great movie but I just didn't like the story so much, I mean she was pregnant without even knowing it and having a birth while sleeping, and than the Michaels death in such a stupid way, oh come on. Than this blood wars, it started great, but later. What I miss most is this good old fight, with bear hands, there is so much fight with this stupid guns, there is only two fight scenes worth mention. OK we all know that vampires used guns, but not in such an amount. I was glad what there was love again between lycan and vampire, but it was so obviously that Marius was just using her to get what he wants, so it wasn't really a love. So far there was only two love between lycan and vampire and it was great, true love. So this one, third love, was fake so actually I didn't like it. Love between lycan and vampire has to be true and glories like it was before. And than in the end you find out how Michael died, he was supposed to be the stronger off them all. But no, here he died like he was nothing. So too sum up. Bad fights, fake love, and bad story. Totally ruined the underworld.",Underworld - Blood Wars
169,SilentEyes_,Worst Underworld movie,3,22 February 2017,"These movies were never made for Oscar consideration, I understand that, but the first three at least tried something. Creating some kind of mythology, war between vampires and lycans. Solid concept for the fans of these types of films that offer a bit of story and focus more on action and gore. First Underworld, released back in 2003, is pretty solid action-horror film. Sequel, Underworld: Evolution expanded the origin story for these species, while Underworld: Rise of the Lycans served as prequel, giving us idea how and why the whole grudge between vampires and lycans started. Then came 4th film, Awakening, solid concept but lame execution. Very forgettable film, even for Underworld fans. And now we have Blood Wars, 5th and worst in the franchise. Nothing in this movie works. Action, the strongest point in these types of films, was so poorly edited and is completely boring. Overall, movie is so badly directed and edited, filled with lame dialogue and shameful acting. Even the effects were not that great, with so many cringe worthy moments. Such a disaster.",Underworld - Blood Wars
170,gedasbr,Too fast,5,19 March 2017,"Have seen all Underworld movies. Nothing new. But there is something different about this movie. It was so fast, that after watching movie i could say that there was so much action, talking, different places changing and running in such a small amount of time. Everything happened so fast. Too fast.I was expecting more from this movie, as saw some reviews with quite high rankings. Movie is just for one evening if you are a fan of Underworld. If you haven't seen any other part of it, don't bother watching it. No high notes, no low notes, maybe a few good action scenes, but that's it.",Underworld - Blood Wars
171,chrisecasey,Chemistry Missing between Vamp Stars,3,30 October 2017,"Hi Readers. Yet, another Underworld story for the vampire genre. When will it ever end. Let's move on, something a little less jaded, perhaps a movie about ghosts that don't even staze their hauntees because their heads are covered in a sheet, OOps that's been done. Lots of black outfits here, although there's some contrast with the white haired members of a northern coven. Is black the new orange, or is orange the new black. Yeah, well you won't be getting much psychoanalysis in this one, except for a sidekick to Beckinsale's character who, surprise, surprise is heir unapparent to the coven's title of jester, no, lord master - I think it is. And the ensuing jealous/zealous battle for the coveted leadership of the coven gets interrupted with a subplot about lichens (not the moss, the werewolves, though they're about on the same par, to me) coming to get revenge - I think or just eliminate/exterminate their rivals (for what, I don't recall). Yeah, this one could use some real backstory, not the ""oh, the backstory is in the previous installment, and to prove that here's some clips vis a vis, the MC's delirium. Thanks, there's better horror out there, with bigger stars than Beckinsale, though not as fresh from the can or is it called DRAM, these days?",Underworld - Blood Wars
172,homeofthefalcon,Please consider...,8,4 May 2017,"First off - this is the 5 movie in a story line which for the most parts has to ""reinvent"" it self every time. This will ofcause make it all a bit ""flimsy"" - HOWEVER - It REMAINS the best series in this genre. If you like this kind of fantasy/horror/action movie - then this movie is kinda great. IT DOES clearly shine through that this movie is made on a VERY limited budget... 35mil USD is peanuts these days, and many mainstream movies use more than that on their marketing!But... Let's talk about the bad: OK we are introduced to a new ""sub breed""/coven of the vampire race... And they can apparently ""warp"" or ""blink"" around. First off - if the vampires knew how to do this, then it is VERY unlikely this wouldn't be more common. It is basically a superpower... no wait it ACTUALLY is 100% a superpower! LOL! and they under-utilize it to an insane degree in this movie too in several larger battles without any explanation as to why... Both these battles are pretty desperate - so one would think they would use any trick they have to survive the onslaught... But no...The main vampire villain is..... so damn generic and predictable that it hurts. She could have been a much more dominant character and it's actually not the fault of the actress in my view... I think she did pretty well with what she was given - so to me this rest souly on the director and the script.The end fight is really uninspired. MAJOR SPOILER! Selena rips out the lycan leaders spine like it was nothing after just having being pommeled all to hell without resisting... Apparently he never posed any threat to her after her transformation...???The good: Most of the action and effects are actually pretty close to what the big budget movies brings us - with a few exceptions. Many people talked about the ""hero landings"" of Selena in the first movie, however this one has a scene which comes fairly close to that (The one where David jumps out of the pool and splits a Lycan in half) It actually made me say ""daaaammmnnnn!"" out loud. A fairly impressive feat for a low budget movie...The keep much of the ""tacky"" feel of the former movies - which is a good thing! It would feel fake if the movie all of the sudden changed tone compared to the 4 other movies - and it succeeds very well in feeling like ""another episode"" in the franchise! It IS however CLEAR that this is meant as a ""precursor to the final chapter"" movie, so there are A LOT of unfinished story lines here... So I truly hope we get the 6th movie!I think much of the rating it has gotten in reviews is due to people not understanding that this is part of a continued story and that this movie IS made with a budget of close to what Jennifer Lawrence got paid for making passengers... If the full budget is 35 mil USD, the actual production budget is most likely close to that 20 mil mark.... which is kind of insane these days! If people want this kind of movie to exist, the CAN NOT fairly judge them as they do an Avengers movie! It is just not fair! I mean Cmon - Even Deadpool which people said had a laughably low budget had 58 mil USD... 23 mil USD more ... which as I said is probably the whole damn production budget of Blood Wars!This movie is AWESOME for what it is! It nicely bridges the 4th movie and what - if it ever gets made - will most likely be the finale. 17% at 3.8/10 on rotten tomato and those sorts of ratings are dumb as dirt. I shows how many people have been so heavily spoiled by 250mil USD budget marvel movie juggernauts that they have lost their objectivity!Is it a masterpiece? No... ofcause not! It's a horror/fantasy/action movie... DUH! LOL",Underworld - Blood Wars
173,matselby-63926,underworld blood war,7,8 March 2017,"I had to watch this one twice as first viewing I thought The movie was not cool at all.my 2nd viewing always like to see films twice see if I missed anything,what I missed was this is a v good additional movie to the franchise,Kate Beckinsale was her awesome best being the death dealer she is.don't expect much Change but there are a few surprises she gets to have a few different powers and the great coven of vampires got some good characters in it with a few twists all in all if you like these films there is not much to complain about so sit back and enjoy underworld blood wars,if like me you cant get enough of Selene dealing death to Lycans.",Underworld - Blood Wars
174,marc_goldberg,Meh movie. The saga continues.....,4,9 February 2017,"Pretty boring movie I must say. Now that I'm done watching it, I can barely remember what happened! Lol. What was the plot of the movie again? I am a fan of the underworld movies, I like Salem; her character, but it seems this series has gotten worse as it goes on. At least this and the one before.This series needs some new life! The scenes are stylish and eye appealing. Few nice CGI scenes. All in all very unmemorable movie in my opinion. But if you've watched the previous instalments before, you're probably going to watch this, so be prepared for a let down.",Underworld - Blood Wars
175,aripaceimilipseste,I never get tired of Selene.,10,23 February 2017,"I gave this movie a 10 because I saw Fifty Shades Darker yesterday and this movie today and I want to make a statement through this. Comparison aside, Blood Wars has it's faults. They obviously were left without money somewhere by the middle of the shooting. I could swear to that, because the difference between the quality of some scenes and the fast-forwarded-crudely-cut other scenes is striking. A school kid could tell the difference. What happened to the premiere or playing in movies? It's DVD out already? Weird.It also bothers me that vampires can have children...but hey, if Selene can have one then so can....SPOILER ALERT.... . . . Amalia. It is odd that it's with another vampire. At least Selene's baby was with a warm-aging-lycan-hybrid. Anyway.The plot kinda holds up and there is more sexy-depraved stuff in this one, as well as some explicit killings.But Kate Beckinsale is still the most gorgeous and also believable vampire that ever walked in the fantasy world. Her latex suit and cape and boots are still there. And that's all that matters. Oh and she kicks ass as well.",Underworld - Blood Wars
