,User_name,Review title,Review Rating,Review date,Review_body,Movie_name
71,monstermayhem32,The return of selene,7,14 January 2017,"Five years since the events of the last movie underworld awakening, Selene is a hunted fugitive by both the Lycans aka werewolves and the death dealers aka the vampires. Selene daughter eve has been placed into hiding for her own protection knowing that both enemies want her daughter blood to create more hybrids. Selene is once again paired with her ally David and his father David who speak to the vampire clan to allow her clemency for her past crimes. However Selene faces new threats including the new Lycan leader Marius and vampire Samira who wants Selene blood to make herself more powerful. I would say that what makes the film great is the fast pace and action, however I wish it had a longer running time than just 91 minutes, I also wish Michael would have had a more active role in the story.",Underworld - Blood Wars
72,srdjan_veljkovic,It's about time Kate Beckinsale forsakes her leather catsuit,4,16 December 2016,"This was never a franchise that made any sense or movies of substance or quality. But, it was an interesting take on the vampires & werewolves theme. And Kate Beckinsale looked _very_ good in her leather catsuit.But, it's getting old. All of it. The ""interesting take"" is washed up and the new things are not very interesting. Yes, our main character looks very good for her age, but, let's face it, she's supposed to be the vampire who doesn't age... it just doesn't work.It's hard to see what would be the next one. Without our main character, it wouldn't make much sense, yet it's hard to see how Kate Beckinsale could work one more time or how replacing her with some other actress would work. Of course, one can always go crazy, have some virus attack vampires and make them age, but... it's about time modern franchises learned when to say enough. ""Underworld"" can start, then it can teach ""Fast & Furious"" and hopefully others will pick it up.",Underworld - Blood Wars
73,theromanempire-1,BACK ON TRACK // 8 out of 10,8,3 December 2016,"To my surprise this was better than part 4 and was back on track as thank god the humans were left out in this movie and we are back in what we knew from first 3 movies. LYCANS vs VAMPIRS only.I will not spoil it much and I will tell you if u are a fan don't miss this movie. great action, battle scenes and twists that u never get bored.Michael and eva are not in this one but they are mentioned their fate and even Amelia plays an important role in the film now she is dead (from part 1) and also victor and marcus are mentioned and we had a lot of flashbacks from previous underworld entries.the main problem was that the plot of part 4 that the lycans wanted seline and her daughter's blood was again followed in this movie and at some point this will get u tired as also seline who dies and then comes back out of a ... miracle.A new leader rises in the lycans after Lucian's death and a new war begins.If this formula continues they have to end the series in next movie or it will get boring in future films.Unless they find new refreshing stories to tell I hope next movie will conclude the series cause for how long we will hear the lycans to want selin's blood so to get more powerful ?Anyways for now u can watch and enjoy this movie which rocks and it's much better than part 4 but not as good as parts 1,2,3.",Underworld - Blood Wars
74,Chalice_Of_Evil,"There is no beginning, there is no end, there is only the coming",7,30 November 2016,"I still remember seeing the first Underworld in the theatre and enjoying it very much, though I didn't see any of the subsequent films at the cinema, only on DVD. I re-watched them in preparation for seeing this film and, as it stands, the original's still the best, with Evolution and Rise of the Lycans vying for second and third place, alternating between the two depending on my mood, while Awakening remains my least favourite. I'm afraid Blood Wars isn't much better. Whilst the fourth film felt like it was just non-stop gory action with little to no story, this film seems to have the opposite problem. Gorehounds needn't fear, there's still some quality violence (most of which the Lycans seem to wind up on the receiving end of, like being split in half and having their spines ripped out). The main problem is the vampire politics are brought to the forefront. The other problem? Super sexy latex-clad vampire Death Dealer, Selene, feels as though she's no longer the focus of her own franchise (though at least she gets some memorable lines/moments). Let's be honest, most people come to see Kate Beckinsale rocking the black latex catsuit like nobody else can. So it remains a mystery as to why the writers appear to be slowly phasing out her character. Please note filmmakers: These films wouldn't be worth continuing without Ms. Beckinsale. Some tend to dismiss her acting ability, but she's what's held this franchise together. So it's disappointing her character is absent for what feels like long stretches. Blood Wars begins like Awakening did, with Kate's/Selene's voice-over (now with added echoing repeating what she's already said!) and clips from the previous films...though, really, if you haven't seen the others, why're you even here? Theo James's David character from Awakening has a much more expanded role this time (now fully replacing Scott Speedman's Michael as the franchise's male lead. Yes, Michael's dead. Barring some future ""We only SAID he was dead/were only pretending!"" reveal pulled out of the writers' arses, the Smurf is no more). Whether you're a fan of David or not will likely contribute to your enjoyment of the film, as he seems to take over the movie from Selene for significant portions.I'll miss the Selene/Michael relationship, but am not opposed to David's character helping Selene, though it might rub some the wrong way how his backstory/ancestry's delved into so deeply it almost feels like *he's* the film's main star. Those who paid attention to the first films will appreciate references to a certain character who had minimal screen time, yet plays an important part in this film's storyline, while everyone else will be left wondering, ""Who?"". The blood of Selene and her daughter, Eve (who's referenced aplenty but only appears in the film's closing seconds), also proves important, as there's much exchanging of said blood between different characters. Other than Selene and David, the only significant returning character is Charles Dance's Thomas. Whilst not as memorable as Bill Nighy's Viktor, an actor of his caliber lends some weight/credibility to proceedings. His relationship with his son and heretofore untold connection with a past long-dead character is given prominence. Playing well off Dance is Lara Pulver, sporting constantly changing hairstyles as Semira. They do what they can with the material they're given. Semira's character also provides a cautionary tale in why you shouldn't treat your henchman/lover like crap, as we see play out between her and Bradley James' Varga.Outlander's Tobias Menzies, as Lycan Marius, isn't given anywhere near the complexity of his character from that series, as here he's mainly just another complication in an already rather convoluted story. Nor is his relationship with vampire, Alexia, given much depth...though at least Daisy Head is quite striking, so you don't forget her character. Also memorable on account of their physical appearance are the Nordic Coven, the best of which is Lena (resembling a vampire Daenerys Targaryen). She kicks major arse with a sword and shield (apparently the Nordic Coven *do* bring swords to gun fights), plus also possesses a ""teleport"" ability of sorts. For a newcomer, Clementine Nicholson fares better with what little she's given compared to others who're given more. She also plays an important part in Selene's physical transformation (including her picking up that handy teleportation ability) to becoming 'more' than she already is...which is just as well, as poor Selene's put through the wringer this time around. It pained me seeing our heroine beaten up/knocked down more than ever, but allowed for a triumphant return, stronger/faster/better than ever...and now with white blonde highlights in her jet black hair.The last couple of films' over-reliance on CGI versus the practical effects for the Lycans of the earlier films is to the movies' detriment, as the CGI creatures just aren't as impressive (and in the case of the Marius man-wolf creature, rather laughable/dredging up bad memories of the Scorpion King from The Mummy Returns...though not quite THAT bad). Note for future movies: Refrain from going half/half, either human or full beast is the way to go. Clearly this isn't intended as the franchise's final film, but assuming another one does indeed happen, that probably *should* be the last. The earlier Underworld films weren't exactly 'high art', but they felt like they had more substance to them than these last two. Given how much time was devoted to Eve previously, it's strange she's mainly absent here (perhaps she'll play a more significant role in the next movie?). I feel the franchise lost something after delving more into the world of men, but at least this one LOOKS more like an Underworld film than Awakening did (though the music/score's sadly lacking Wedard's 'Leidenschaft'). Say what you will about Len Wiseman, but I feel these later films' direction have suffered from his absence. My main hope for the next movie? That the filmmakers remember who this franchise's star is and give Beckinsale/Selene the attention/importance/prominence she deserves.",Underworld - Blood Wars
75,ajkbiotech,A great Halloween Film,10,19 October 2021,"I well remember the first Underworld film, ages ago.And yet, this film stands quite well on its own, despite being #5 in a series.1) Kate Beckinsale looks fine in black leather and plays her part perfectly; she slays in the fighting scenes.2) the Head Vampire that played the Head Lannister in GOT is terrific in this film.3) the Lycan leader Marius, who's now famous for buggering Jaime in Highlander as a British Officer, is colossally evil.The deeper aspects of the mythology are explored & explained; there is plenty of action but also tons of exegesis.This is a fine standalone film.Also, a great Halloween film!10/10 rating!",Underworld - Blood Wars
76,Eddie_weinbauer,Like watching a vampire version of the A-team,1,11 February 2017,"The story feels very rushed,liked they've just hastefully put a script together within a certain time frame, while Kate was still available for shooting.Seem like everyone is betraying someone else within the vampire clan, in a struggle for power Strangely enough the lycans/werewolf don't seem to have no such structure problems in their camp.Another thing that really bugs me with this movie, is all the dramatic pauses. The vampires are suppose to be smart an quick on their feet, but when ever something unforeseen(for them,cause everyone in the audience will have seen it coming a mile away, all ready) They stop and freeze and have these super dramatic pauses ,as if they were acting for Oscars. Generally they just make you want kick and scream at the TVKate B and Theo James, both have this just going through the motions acting over them.And radiate very little on screen chemistry.They are suppose to be super smart but can't seem to foresee even the simplest of action from their opponents.They also introduce to many characters, that you don't really get to know properly. They are just extras with a speaking part. You don't really get a feel for them what are their motives,why are they doing what they do etc.The action was kind of bad to, either they fight in the shadow/dark, or the camera is so close that all you see are feet and arms everywhere. They should have terminated the franchise after 3",Underworld - Blood Wars
77,PetarNeo,Total disaster that never should have been made,2,10 February 2017,"If you thought this movie will start in a nice way firstly from Split which was magnificent now we have a contender for the worst film of the year. World of vampires and Lycans is taking us to battle for most precious blood of all, Eve's blood. And what a mess of a movie did Anna Foerster did for her first directorial movie followed by a horrible plot telling. From narration of movie which is annoyingly dull, to totally unrealistic CGI which wasn't used much but when it was used, oh did it look cartoon like, it was worse even from first Underworld that came out almost 15 years ago. Plot is so utterly disgusting because it keeps jumping from one action to another and from another scene to another without any explanation. It was just sad to see how film makers decided to make a movie and throw a dozen of new things and couple of characters and just ignore them and go with fighting between two sides. Even fights were not so entertaining because they were too dark and almost half of fight scenes are unable to be followed. Only Kate deserves to be followed along the movie because the rest of cast seems like they wanted to do something fun but ended doing something horrible. 0.5/4",Underworld - Blood Wars
78,Spideyfan-963-246215,Underworld: Blood Wars,4,24 January 2017,"Underworld: Blood Wars (2016) Starring: Kate Beckinsale, Theo James, Lara Pulver, Tobias Menzies, Charles Dance, Bradley James, Daisy Head, Oliver Stark, Eva Larvoire, Alicia Vela-Bailey, India Eisley, Trent Garrett, David Bowles, and Brian Caspe Directed By: Anna Foerster Review PROTECT THE BLOODLINE It's January 2017! You know what that means, more shitty horror movies! But hey this is a guilty pleasure of mine, I love the first three underworld movies, they're great films in my opinion but Awakening was an unnecessary pile of trash. They should have ended it with the prequel Rise of The Lycans. As we once again get a prologue to past events from the other four movies (much like those even worse Resident Evil Movies which doesn't even have one good film under there belt) we find Selene as an outcast being hunted down by a new Lycan leader Marius, who is looking for Selene's daughter which they don't even say her name if she even has one. He wants her blood because she's pure-blood which would make him and anyone else who drank it really powerful. The film is very short if it weren't for the fact that I liked Selene I would have forgotten I saw this movie. This one doesn't feel as cool as the last one (and the last one was awful but you could still have a good time) that would be the pacing's fault it feels so rushed that it almost wants to get it over and it has the same run time as Rise of The Lycans and that ones great. However with that being said you know what your getting when you see the trailers and the fact that it's a horror movie in January. Your getting an awful film that can be enjoyed and while it was a poorly made film I thought it was fine. This isn't my favorite in the series not even in the top three of course. But if you want to just have fun in the movies and you like horror (like I do) then go see it if you so wish. I'm giving Underworld: Blood Wars a two out of five.",Underworld - Blood Wars
79,scb_coldsteel,A drop in quality,6,2 October 2018,"Finished watching Underworld Blood Wars. I've always enjoyed the series despite them not really being great films. If you are a fan of the previous films this installment provides enough vampire badassery to not disappoint. The story is a bit convoluted though, even for a series where story has always been secondary to action. Overall a 6 out of 10.",Underworld - Blood Wars
80,jdring2007,"least favorite in the series but still has some great action; even in a lightless room, way too dark",7,4 November 2021,"I have a strong liking to this series, but this was easily the weakest installment. As if its predecessor wasn't stretched thin as it were, this movie had a basic plot that tried to be innovative by simply rehashing elements from the original, and introducing only one new thing. That said, some of the action is really entertaining, especially with the (re)introduction of swords into fights against lycans. Probably the coolest scene was the one out on the ice with the hybrid villain, partly because it was actually visible. Unfortunately so much of the flick is doused in poor lighting, and with characters who wear all black with black hair and black fur, it's a bit brutal on the eyes more often than not. A shame, too, because some of it would've been even better had I been able to see more of it. Which I imagine is one reason why they frosted Selene's tips, so you could discern her in combat more easily; also just to change it up a bit. Ultimately it offers some closure to the series while still proposing a pickup point. Fans of Beckinsale won't be disappointed; most of the characters were hit and miss for me, but I did love Charles Dance as I always do. While I did give this a generous 7 (more close to a high 6), and I gave its predecessor a 7, too, I definitely enjoyed Underworld Awakening (2012) more.",Underworld - Blood Wars
81,SpoilerAlertReviews,"Borderline spoof, super rushed.",3,28 January 2017,"Now, I'm familiar with the first two films, but I'll be honest, all that I can remember well is Kate Beckinsale in tightly cladded, black leather, looking like a hotter CatWoman, but in fact, she's a blood sucking bat woman. I didn't even know there was another two films! Rise of Lycans that was without Beckinsale (that might have something to do with it) and Awakening which did have Beckinsale. TV director and cinematographer, Anna Foerster makes this her big screen debut, but it's not a good start. It's not horrendous and is properly a good opportunity out of a bad situation, however this unfortunately puts doubts in my mind about her Source Code 2 that's in currently in development. I'm not sure what I missed but there appears to be a lot of back stabbing, characters defecting or returning for redemption. For someone who has skipped the previous two, it didn't really make much sense with the flashbacks but it's not really hard to figure out and follow. It's unfortunately a messy and poorly scripted story, drowning in borrowed elements from other films, making it awfully predictable where it tries to be clever. One scene in particular immediately reminded me the battle at Helm's Deep in LotRs Two Towers. It's very rushed and it progresses faster than their superhuman healing powers. One minute they're on a train, then they're riding horses across a snow plain to all of sudden scaling a cliffside. Just seemed utterly pointless and stupid. There are characters and story elements that get introduced but are quickly pushed to one side to make way for more plot lines or twists, the side characters especially are not developed enough. Beckinsale fits into her right leather comfortably but she isn't in the film as much as I was expecting, giving some of the story to Theo James' David. Again, because of this rushed though balanced storyline, you never feel like you're getting the full picture and being a fan of James, I believe he's capable of giving so much more. I want to see how he does on the frontline, they should give him a superhero tryout. The action was as expected, decent enough to be entertaining but the bullet dodging makes it borderline spoof; and what's with all the grunting during the dramatic stand off scenes!? David grunts cuts to Marius grunting back, David grunts some more, Marius I think sighs and grunts at the same time, only more intense. This goes on for what feels like a good thirty seconds! I didn't feel anything with the bad guys, in fact, I felt little for any of the characters. Marius, played by Tobias Menzies, wasn't really bad enough, don't know what to make of him. And Lara Pulver's Semira just appeared to be a cheap version of most of Eva Green's nasties. I can't speak for the previous sequels but the first film boasted a decent soundtrack with tracks from Bowie, A Perfect Circle and Amy Lee from Evanescence, something that's the expected from this sub-genre of movies. Michael Wandmacher composes a fitting score but nothing memorable, and all sounds very much the same throughout. It appears I don't have anything good to say about this movie, however, if I was of a younger generation of movie-goer, I might enjoy this as a brainless action fantasy flick. But I ended up laughing at a lot of it, especially the bullet dodging. It's not worthy of the big ticket price and it really doesn't urge me to watch the rest of franchise. Running Time: 5 The Cast: 6 Performance: 6 Direction: 5 Story: 2 Script: 2 Creativity: 3 Soundtrack: 3 Job Description: 2 The Extra Bonus Points: 034% 3/10",Underworld - Blood Wars
82,autisticreviewers,Autistic Reviewers Opinion Of This Movie.,6,6 December 2016,"The fifth installment of the franchise...was it worth the wait,and is it better than the previous installments? Read to find out! Selene has lost her daughter and has no idea on where to find her. A Lycan by the name of Marius (played by Tobias Menzies) is after Selene's daughter and threatens all the Vampire council. They are now under attack by Marius and his army, and Selene is the only one who can end end this! Kate Beckinsale returns and she is still doing great! The main problem with this film is that there so many plot holes and so unexplained things (which we wont go into), and the movie had so many slow points. Some scenes were pointless and could been left out. But once the film gets going and picks up the pace it really does have something great to offer. The fight/shooting scenes are excellent to say the the least! Wonderfully edited. The problem is by the end it doesn't really leave you wanting more. It just leaves you with a feeling of ""Oh, that's it?"" All in all seriousness it's Kate Beckinsale that holds this franchise of Underworld together. It's possibly the weakest one in the series, but it's not a catastrophe, and it does have lots of good scenes. Definitely for die hard fans of the series and not sure for anyone who isn't of the Underworld series. The Autistic Reviewers give this 6/10 (2.5/5 stars).",Underworld - Blood Wars
83,marc5477,Generic,3,10 February 2017,"The problem with this film is the story elements are weak and thus you are left with a long action flick. It is the same problem people have with Michael Bay. Its boring. The story is just Blade with a side of Riddick using similarly old special effects and a female lead wearing tight pants (which is also tired and overdone). Granted the entire series is not original, but at least they tried to develop characters in the past even if the love angles were terrible. This one has no development... okay I am lying, I would say the development reminded me of a 80's episode of Transformers. About 15 seconds of development, then you have action.Still its better than other garbage like Twilight or Originals and all those other teen trash shows. But I think its time to stick a fork in this series.",Underworld - Blood Wars
84,kelly-gaudreau,Acting is Good,7,18 October 2021,"I actually liked the whole Underworld thing when it first came out. By this point I find it lacks the thrills of the first. The acting keeps you going, as well as the action.",Underworld - Blood Wars
85,trey-yancy-572-763547,This continues the story but on a meandering path,6,31 May 2020,"There is not a strong story here and there are questions not well answered (such as, ""What kind of creature is the antagonist?, ""What is this otherworldly spiritual insight thing?"", and ""Why does she not explode from perspiration from wearing that outfit?"").Basically, Selene is pursued by everybody, a few threads are connected, and a portion of the audience remains in awe of how Beckinsale can maintain her svelte figure well into her forties. There is also a faint unconvincing sigh about the story continuing.If you are into the whole Underworld series, this is worth watching. Otherwise, this is just a movie. (What makes me wonder is how they could have turned this into five films while Van Helsing only had one go at ti.)",Underworld - Blood Wars
86,reeves2002,better then Awakening,7,13 January 2017,"I liked this movie way better then the last one. A lot of action and a good twist to the story involving the vampires. The main issue I had (this part is a spoiler so don't read it if you haven't seen it) is the Killing off of the Michael character. The last movie led up to his return so it was a real let down and not believable the way he died. This was badly written and a lazy & disrespectful way to remove a lead character. Holding him captive by Marius or not including him at all in this chapter would have been better. He needed to be part of this entire series. I like Kate obviously but she can't carry the whole movie. There needs to be a strong male protagonist especially with so many of the good original characters gone. The David character is OK but too young & doesn't have the same chemistry with Selene that Michael had played by Scott Speedman. It makes no sense not to include him, and the series has suffered with his absence. He needs to be brought back in some aspect for the next final movie, even if its just newly filmed flashback scenes with Eve to finish it off!",Underworld - Blood Wars
