,User_name,Review title,Review Rating,Review date,Review_body,Movie_name
68,boe_dye,A reprehensible tale,1,15 November 2020,"If anything, this movie is a cautionary tale. While the acting was good enough, the movie is as watchable in 2020 as it was in 1997. The problem lies in that it's an awful tale, filled with awful people who are morally and psychologically reprehensible.Roberts character is that party girl who you would hook up with in college, but never take home to meet your mother. Mulroney (Michael) is that guy who likes the side fling, but wants the stability that comes with a loyal and loving wife, and Diaz' Kimberly is the naive college girl who gets stuck in the midst of this twisted love / not love triangle between Roberts and Mulroney's characters.The ultimate problem with the film is that the only ones who would ultimately win out in the end are not Michael and Kimmy, but instead Micheal and Jules. Kimmy would eventually go on to resent giving up her life's ambitions and dreams to follow around Michael for however long, until they ""settle down"". However Michael, being the archtype that he is, would ultimately find satisfaction in having a periodic affair with Roberts character over the course of his marriage and relationship. It's almost a stereotypical narrative that has been told countless times over in real life. Michael knows almost nothing of Kimmy other than she is young and spunky, and reminiscent of something he used to want and perhaps be. Yet as Kimmy says to Jules: ""He puts you on a pedestal, but he puts me in his arms"". This is incredibly telling into the nature and psyche of Michael, who is ultimately an ego-maniac for pitting two woman at each other in order to figure out who actually loves him the most: the one who would go to great lengths to have him, or the the one who would forgive all of his sins and misdeeds no matter how poorly he treated her.(and would ultimately forgive his eventual mistress as well... because... well... why not she's just 'loving')In the end the only redeemable characters (I.E. the most honest) were Kimmy as the hapless, naive victim caught up in Michael and Jules' sadistic emotional game, and Rupert Everettes Gay BFF character, George.The sad part is that as far as romantic comedies go, this one is as delusional as it's real life counterparts who actually think that such a scenario would end up with a happy ending, rather than 10+ years of distrust, unhappiness, infidelity, and most likely a broken family.",My Best Friend's Wedding
69,suzy q123,Amusing and fun.,1,9 July 2001,"The music starts it off perfectly, with a cheesy funny song sung overthe credits, and then Julia Roberts charm carries the rest of the film.A pretty standard plot driven forward by the chemistry of Roberts andRupert Everett as her gay best friend. Apparently, they had betterchemistry than Roberts and anyone else, so they went back and filmed anew ending involving these two characters. I'm not faulting them, Ienjoyed it very much. Diverting fun.",My Best Friend's Wedding
70,raymond_chandler,Say a little prayer for more movies like this one.,8,31 July 2001,"Julia Roberts gets a great opportunity to showcase her talent here, and she runs with it. Some of her physical comedy bits are reminiscent of Lucille Ball. She plays a character that could come off as a real jerk, but her natural charm and self-deprecating manner are endearing. She displays real acting chops, especially in the scenes on the tourboat and in the gazebo. Cameron Diaz turns in a real star-making performance as a ditz who becomes a wildcat when threatened. Her acting in the karaoke bar is fearless and really establishes her character's personality.Rupert Everett, is, well, fantastic. He acts as Roberts' conscience, and delivers some of the funniest lines in the whole film.
This is one of the most uproariously funny mainstream Hollywood movies to come along in a long while. The script is packed with zingers, and the cast makes the most of it. At the same time, it has some genuinely poignant moments. Don't let it pass you by.",My Best Friend's Wedding
71,Rozinda,There's no accounting - why would this gorgeous woman want that immature twerp?,7,26 April 2009,"spoilers throughout........I unfortunately assumed that Julia Roberts would get her man so I was continually frustrated throughout this movie and at first very disappointed with it at the end and switched off feeling thorough cheated. But then I started to think about how lucky Julianne was to have avoided matrimony with the putative hero who is a total twerp and who in any case turned me off from the start. Pity I had expected that sugary ending or I'd have watched from the point of view of please let her get him right out of her system a.s.a.p and find someone worthy of her.The first time we meet Julianne's ""Best friend"" I thought, he doesn't measure up. He's wet and pretty silly. What does she see in him? Big disappointment if this is to be Julianne's husband eventually. How could she bear it? But I would give the casting director the benefit of the doubt and assume the guy measures up somehow. Well, he doesn't! Julianne goes through interminable heartbreaking frustration as she tries by fair means and foul to prise this jerk she so likes away from his chosen woman who's the deceptively sweet daughter of a billionaire and clearly both will harass the fiancé into doing what they want - such as force him to give up his chosen job of aimless sports commentator. It's very clear the guy isn't good enough for either girl but the parents will put up with their daughter's choice and the whole family will mould him to what they want for the daughter, whether he likes it or not. No billionaire's going to be happy with this aimless jerk as a son-in-law. The rich girl talks of abandoning her college career to bum around the country with her new husband but you can see this won't satisfy her for long. Julianne's underhand idea that the fiancée's dad should offer the bum fiancé a job he can't refuse makes the jerk fly off the handle and his fiancée placates him, but later admits she intends her future husband to work in the family business and you can see she'll ensure he does. His precious freedom as a bum is in danger but he can't see he's going to end up as a cypher. With Julianne he could have had his freedom - but he can't see that and for Julianne's future happiness thank goodness he doesn't! This jerk is going to get a tough awakening. His wife isn't the sweet malleable admiring young thing he thinks she is. Have I any pity for him? No! Julianne tries everything including introducing her gay friend George (Rupert Everett) as her boyfriend, which makes the jerk jealous - he is greedy, he wants both women under his control, is flattered to have Julianne chasing after him- and eventually Julianne tells the jerk how she loves him. Even that doesn't work, he now goes running off after his fiancée. So Julianne admits defeat, confesses her deceptions and wishes them well. I really didn't expect that and ended the movie feeling very disappointed, annoyed and feeling throughly cheated. But then I thought about it. The jerk isn't in any way worthy of Julianne. What on earth did she see in him? Thank goodness he didn't want her or she'd have been stuck in a bad marriage with this jerk who'd have soon let her down one way or another. He instilled no respect or confidence whatsoever in me. Whether the actor intended this or not, I don't know, but he hd to play a despicable character in the story. Diaz is good enough as the young girl though I couldn't possibly rate her acting in this as Oscar material. The actors completely outshining all the rest are of course Roberts and Everett, they are charismatic and splendid. The likely plot of Julianne finally seeing glamorous George is her man is averted since George is gay. The story ends with George assuring Julianne she's going to be OK and they are going to have a darn' good time together.I give this move 7 stars because of Roberts and Everett and because after reflection I agreed this is a good movie and it reached the right conclusion. I still would have liked a sugary ending (sentimental, me) or at least some sign of the right guy for Julianne turning up. It's worth seeing if you are happy with being irritated and frustrated time and again at the selfish jerk's behaviour and poor Julianne's despair, but I couldn't sit through it again because of Julianne wasting her time on the jerk and the jerk's stupidity infuriates me even though he needs to be stupid to ensure Julianne is freed of her longing for him!",My Best Friend's Wedding
72,TheProteanGirl,The Point Of This Movie Was...???,5,22 January 2019,"I'm all for a romcom/chickflick that has a nice chemistry and a good enough plot line (as romcoms/chickflick's can have...). I have watched probably all of them at this point. I'm a sucker for a stupid and cheesy story sometimes, as well with a happy ending that you watch and feel good about, but this was not one of those.Firstly, it was hard to root for Julia Roberts. She comes off as a nasty, bitter and overall self-absorbed person who only cares about herself. I know it is always like this in these movies to further the plot, but if you are in this situation in real life JUST TELL THE PERSON YOU LIKE THEM ASAP. I hate that scene in the store where Dermott meats her gay friend and she is like ""I wanna tell you something"" but then says never-mind, ugh just spill it...As for the guy, he is just so weak charactered. Like he has no backbone and besides the fact he's good looking he has nothing going for him. They try helping him with a job, with other things and he just doesn't do anything. Like her gay friend is the ONLY one with common sense who listens to her whine for hours and tried helping her. To me he seemed more a best friend than Mulroney's character who seemed a half-ass friend at best...My biggest problem with the movie though is the ending. I know some people will laugh and say it's cheesy to say this, but when they didn't end up together in the end I was like what? Isn't that the whole point of this movie? Who cares about Cameron Diaz I wanted the 2 of them, Julia Roberts and Malroney Dermott, to end up together. I mean you spent an hour showing us clips of them talking, her trying to get him, him looking at her with puppy-dog eyes all that to say they DON'T end up together??? What why?? Just for that it was a waste of my time watching this, and it pissed me off that they didn't just make it consistently what it was since the beginning of the movie, which is a chickflick to just feel warm about, see them together and thats that!",My Best Friend's Wedding
73,yuenyeeac,Not Love,6,6 May 2020,"When a couple of lovers lose their passion and slowly become friends, then all that remains is a habit, a habit of knowing each other. But once this habit is broken, what follows is not to rekindle the fire of love again, but just not to adapt. Some people think that this kind of discomfort is jealous, some people think that love still exists, and some people think it is unwilling. For the heroine, she mistakes her habit for love. Love is no longer there, so any attempt to retain is no match for the other party 's second love.",My Best Friend's Wedding
74,erinok-85232,jello,8,30 December 2020,I really liked this film. i thought it was fun and funny. it was an enjoyable watch and i recommend this film to everyone!,My Best Friend's Wedding
75,catfarmer1358,Almost Perfect,8,25 November 2018,"I have seen this movie hundreds of times. While this movie should make me happy, it kind of infuriates me.Now I'm probably going to be in the minority here but I strongly believe that Julianne and Michael should've gotten together at the end. Yes, I guess it sends a message that you can't Always get what you want, but still Kimmy was a 20 year old spoiled rich college drop out that Michael had only known for about two seconds. Julianne and Michael are both the same age and have more chemistry.I know it's just a movie but I can just about guarantee that marriage was a flop. At least we got Rupert Everett to sing a musical number out of it!",My Best Friend's Wedding
76,J-Crew,Very satisfying romantic comedy,9,13 January 2000,"Very satisfying romantic comedy. Roberts gives a brave comedic performance, extracting laughter and tears with her not-so-nice character. Well-written and surprising, with a conclusion that pleases both the audience and the characters.",My Best Friend's Wedding
77,MicheBel,My Conniving Former Friend's Treachery,3,20 January 1999,"I admit it. I really don't like Julia Roberts. That's the first problem. But in this movie, she's especially devious and despicable. Mounds have been written about it, but let me add my voice to the maelstrom: what's up with a heroine who is a scheming, lying, conniving witch? And the ingenue-du-moment, Cameron Diaz, thankfully saves the day somewhat by being cute and perky as only she can. In fact, she even makes karaoke look good. But then she rises to the occasion by showing herself to also be a witch behind that kind exterior. YUCK. I hated the whole premise of this crap. I hated the oh-so-charming gay friend who is the only one with a clue (although Rupert Everett is fun to watch, and provided the only truly enjoyable moment in the singalong). Even though there were some nice Chicago shots, overall this is a movie to skip.",My Best Friend's Wedding
78,archer191273,why the bad ratings? some people have rotten taste I guess.,9,14 October 2016,"Julia Roberts plays Julia potter. A well established food critic who's besty Michael o'neal(Dermot Mulroney) is about to get married to quirky and bubbly Kim (Cameron Diaz) and invites her to his wedding so realising she may lose her best friend (or even the man she loves). Julia plots to do every dirty little trick in the book to sabotage this relationship and win the heart of the man she loves.Julia Roberts is beautiful and funny (with an evil twist) in this warm comedy. There are some cringe worthy moments in this movie but overall I love it and Julia is perfect in this part. It has heart warming moments and Rupert Everett is great as her Gay friend. it's funny and would relate to anyone who knows what it's like to have a best friend of the opposite sex. I just don't understand why viewers ratings are so bad when this is a fun comedy with some scenes that will bring a tear to the eye. Julia is great as the jealous, deceitful and desperately in love too late maiden of honor but you just can't help but still love her. Watch for yourself and be the judge without analysing it. Just see it as a fun movie.",My Best Friend's Wedding
79,seeingbystarlight,Four Days Steal The Bridegroom.,10,30 July 2018,"Thanks so much forJulianne Potter (Julia Roberts), is a difficult food critic, who's been best friends with sports writer Michael O'Neal (Dermot Mulroney) for nine years, without realizing she's hopelessly in love with him.But when she gets a phone call from him informing her that he's getting married to the rich and lovely Kimberly Wallace (Cameron Diaz), she gets on a plane to Chicago with a covert plan to break up the wedding, and make Michael see that his place is with her.""He adored ME for nine years."" She tells her editor and friend George Downes (Rupert Everett), who
-although gay- may harbor some secret feelings for her.When she arrives in Chicago, she is greeted by the glowing Kimmy who is only too eager to make her rival her best friend, and within ten minutes of meeting Julianne asks her to be her maid of honor.And when George visits her three days later (all her schemes are failing miserably up to that point), Julianne, on impulse, claims he's her fiance.It's a lie that unleashes one of the funniest set of subplots ever conceived in a romantic comedy.Rupert Everett, and Cameron Diaz shine like new pennies in their roles.They are positively radiant, and give the movie it's light.Julia Roberts is perfect as the scheming Julianne, whose actions get increasingly more desperate -and hilarious- as the story progresses.Dermot Mulroney is very well cast as Michael.He does a good job of conveying that he loves both women, and literary leaves the audience in suspense about which one he's going to chose.Relentlessly hysterical, and charming, this is one of the freshest most original comedies I can remember seeing.The ending (which in this case makes or breaks the movie), is as terrific as it is unpredictable:You'll never see it coming, yet it'll make you want to applaud.A stunning conclusion to a first rate story.Originally, Review #153Posted On:
December 17, 2011",My Best Friend's Wedding
80,ebm123,Two best idiots ever,6,29 January 2021,"Why? Why she ever said she'll go to the wedding? Does she love to be humiliated?
And when she said to him ""marry me! choose me!"" - she does not have self-respect.
After that I didn't care about her.
The groom is no better.Performances of Cameron and Rupert are so good. If only we could get rid of Julia and her ""best friend"" in this movie, it would be 9.",My Best Friend's Wedding
81,qrt7,Better than I was expecting!,8,25 June 2001,"So much better in fact, that I was compelled to laugh and enjoy a romantic comedy.  Now for a male, that's quite something.Opinion seems to be divided, but the haters of this film seem to have half-a-dozen main gripes:1)	That Julia Roberts doesn't know whether to do comedy or melodrama.  Well, I think she needs to do both.  She's not a particularly nice character remember - quite a selfish b*tch.2)	But I want Julia to be lovely and the other one to be horrid!  Oh, and fall into the biggest cliché ever?  Get a life!  Can't you handle unconventional characterization?  That's why Jules grows up during the course of the film - normally she's a hard-nose but really can't sustain it against someone who is so nice and emotionally vulnerable!3)	The portrayal of Kimberly is sexist.  Yes, but she has squillions of dollars, so does it really matter so much?  If I had a squillion dollars, I would probably do the same!  She doesn't need to work and she knows it.4)	Dermott Mulroney was a plank.  I agree.5)	I couldn't spot the plot coming.  Well go watch a Disney movie fool!6)	 I didn't like the ending.  So?  Do you think real life always has a sugary ending?  The ending itself is reflective of the whole film.  I mean did she actually deserve to have a man?  No!  Cos she has to go through the film to grow up.  That's the point.  She's now a more mature person who will get her reward in good time.  That's the happy ending.  She's become nice and considerate.So as you can guess, I found the film bright and smart, not too mired in the woman-only scmaltz that surrounds these types of film and in fact subtly exhibited a darker side to the lead heroine that you wouldn't normally be allowed to see.Rupert Everett puts in a good performance, but the 'gay friend' thing is becoming as stereotyped as the 'high-fiving cra-zeee black man'.I would recommend this for men.  It's pretty watchable without falling into puke-inducing cliché to often.  And remember, take it at face value - 'it's just entertainment!'8.5/10.",My Best Friend's Wedding
82,chenh-73888,A movie for girl,6,17 April 2020,"In my opinion, this is a movie suitable for women. It is not suitable if men and lovers watch it together. Boys will inevitably feel guilty when watching, which may contain two feelings. One is that when he was watching, his girlfriend suddenly turned around and asked, will we be like them in the future? if it were you, how would you choose? Second, there will be such evil thoughts as ""if only two beautiful women were so crazy for me"". The wisdom and courage that Julia resolutely chose to give up after all kinds of competitions were hopeless are the most impressive.",My Best Friend's Wedding
83,mbg411,Classic Movie,9,7 July 2008,"An almost perfect movie!!! First of all, the plot. Julianne (Julia Roberts) is a successful food critic who has had this best friend named Michael (Dermot Mulroney). They promised to marry each other if neither of them found their soul mates before they turned 28. Now that Michael has met Kimmy (Cameron Diaz), Julianne resorts to the funniest and tackiest schemes to win Michael back.I don't care if it's a chick flick, I love it. Julia Roberts is at her best here! Dermot Mulroney is good as the conflicted groom. Cameron Diaz actually does a great job as a woman who knows how to keep her enemies close when she asks Julianne to be her maid of honor. But Rupert Everett (Julianne's gay friend) steals the spotlight.The movie is too love love but other than that it's so amazing.",My Best Friend's Wedding
84,iprudd,This is what happens when passion becomes friendship,5,21 April 2001,"This is an ultimately disappointing film despite good performances from all of the leads, particularly Everett. The premise is simple, Jules and Mike have a passionate affair in their college days, this then becomes 'best friendship' in no small part due to Jules commitment phobia.  One day Jules gets a call from Mike to say that he is getting married in four days and inviting her to the wedding.  At this point Jules realises just how much she really loves Mike and determines to split-up Mike and Kim. The film follows her efforts to do this. However, at every turn she is thwarted by the happy couple who get back together. The film did not end as I had anticipated which was good. However, it is difficult to sympathise with Roberts charactor, which is necessary to the story, as she lurches from hard nosed bitch to contrite best friend. There are several funny moments and Everett steals the scenes that he appears in.",My Best Friend's Wedding
85,J. Ryan,"Surprisingly, it works.",10,29 July 1999,"I saw this film in a hotel room while travelling on business.  I was bored but didn't feel like firing up my laptop to do more work.  So, I indulged.I must admit to being pleasantly surprised.  The story is not particularly complex but the execution is certainly fresh.  The addition of some photogenic and congenial characters like Robers, Everet and Diaz completes the winning formula.  I do agree with many of the other posts I read, Julia Roberts character is malicious, yet still oddly likeable. 
I am surprised that Rupert Everett did not receive an Academy nomination for Best Supporting Actor.  His screen time is somewhat limited but his performance is nonetheless priceless and a delight to watch.To summarize:  My Best Friend's Wedding a fine film that will entertain and amuse, what the insipid Nora Ephron productions (You've Got Mail and Sleepless in Seattle) only aspire to be.",My Best Friend's Wedding
86,Petunia-2,An enjoyable romp,10,26 September 1999,"Julia Roberts won America's affection with winning turns in ""Steel Magnolias"" & ""Pretty Woman"".  She proceeded to film several flops and I figured we would never see her in another good film.I guess I enjoyed My Best Friend's Wedding because of the feelings it evoked in me.  Watch the scene on the boat where Julia has to decide if she should say ""I love you"" right then & there...it made me remember a time when I really loved someone and never told him.  I found myself tearing up.  The raw emotion in Roberts' eyes during this scene was just so touching.Roberts' battled emotions throughout the film, torn between her affection for Mike (Dermot Mulroney) and her growing affection for his new fiance, Kimmy (Cameron Diaz).  I felt Roberts greatly overacted in her confrontation with Diaz, but Diaz was so believable that I soon forgot Roberts' being over the top.  Diaz was a gem and held her own with Roberts, often stealing scenes.  Perhaps Roberts knew this and might be the reason why she overdid it in this particular scene.To me, the most hilarious scenes were when Roberts became angry, especially when she telephoned George (Rupert Everett)--I laughed out loud.  Where on earth has Everett been hiding?  He is a joy to watch and his scene at the wedding rehearsal showed his gift for screwball comedy.  His reactions, to the chaos around him, are truly priceless.My husband did not enjoy this movie as much as I did, so I guess I give this a thumbs up to women viewers.",My Best Friend's Wedding
87,folkpoet80,Enchanting,8,10 December 2005,"This was one of those movies, which had everything in it. Drama, tears, outstanding humor, you name it. I almost didn't watch it after everyone I spoke with, labeled it as a ""chick-flick"". Forget about it. This is a grand movie. Probably one of the best from the 90s. If you enjoy movies that are made from the heart, you'll love it. I've seen some great movies like Somewhere in Time, Love Story and this one easily falls in the same league, at least for me. The guy with the British accent gave a great performance and did his humor outstandingly. Julia Roberts acted superb. Cameron Diaz, who I'd never see act before fulfilled her part decently. I can't digest a rating of 6.3 on IMDb. Leads me to believe how biased IMDb's ratings can be sometime. Forget about what any one says. If you like great movies with a message, Then see this one today!!",My Best Friend's Wedding
