,User_name,Review title,Review Rating,Review date,Review_body,Movie_name
31,Catherine_Grace_Zeh,Good romantic comedy that will touch you and make you feel warm inside,9,17 November 2005,"MY BEST FRIEND'S WEDDING, in my opinion, is a good romantic comedy that will touch you and make you feel warm inside. If you ask me, Julia Roberts, Dermot Mulroney, and Cameron Diaz dazzle! My favorite parts are when Julianne (Julia Roberts) chases after Michael (Dermot Mulroney) as he's chasing after Kimmy (Cameron Diaz) and when Kimmy and Julianne yell at each other in the women's restroom at Comiskey Park. One thing I hate about this movie is Cameron Diaz's singing. My friend covered his ears when she sang ""I Just Don't Know What To Do With Myself."" No offense, Cameron, but you sang better in THE MASK, albeit your singing voice was dubbed. Anytime I watch this movie, when ""I Just Don't Know What To Do With Myself,"" ""I Say A Little Prayer,"" or ""The Way You Look Tonight"" is performed, I always sing along. I also get this feeling that makes me feel good inside and makes me want to cry. In conclusion, there is a moral to this story, and that is, ""Never take your relationship with your boyfriend or girlfriend for granted.""",My Best Friend's Wedding
32,davispittman,One of my favorites of its genre,9,1 April 2017,"To me this romantic comedy/drama sets itself apart from most others of its kind. It's got a great script that has all the necessary aspects. It has scenes and lines that are truly funny, meaning that the comedy is actually effective. It also has moments of sentimental value, scenes where the drama factor comes into play. And I loved both kinds of scenes! Both the comedy and drama worked here. The romantic aspect works pretty well in this film too. The chemistry between Mulroney and Roberts worked and the chemistry between Mulroney and Diaz also seemed to work. This brings me to the cast and their performances. Of course Julia Roberts delivers on her lead performance as Jules, its no gamble to bet on Roberts to turn in a wonderful performance. Dermot Mulroney is pretty good also, in the beginning I wasn't quite sure whether he would fit the role well, but as the film progressed I quickly saw that yes he did fit it well. This was one of Cameron Diaz's first film roles, and I thought she did a very good job with her role as Kimberly Wallace, funny, bubbly and very likable. The acting was overall was good and they all lifted up the script to reach its full potential. The ending is one of my favorite endings to any movie, very touching and sentimental, and it's not the traditional romantic comedy movie ending, which in this movies case, is refreshing. I suggest this fun movie to anyone and everyone. 9/10.",My Best Friend's Wedding
33,jfgibson73,"Well made, light and breezy",7,12 August 2021,"Here is an especially tasty confection for fans of rom-coms. Julia Roberts is a towering force, but Rupert Everett and Cameron Diaz get some standout moments as well. They started with a great script and threw in a few musical numbers to come up with a great piece of entertainment. Thank goodness movies can do that sometimes.",My Best Friend's Wedding
34,triple8,Decent enough-Cameron makes the movie.,6,30 December 2004,"I think this movie is about a 6.5. Like many movies, Wedding had both positives and negatives. I liked that the main story had a bit of originality unlike a lot of romantic comedies. It was a refreshing and interesting plot. But for some reason the movie didn't really capture me until the end. I think there were a lot of moments of boredom and I liked the realistic subject matter, where two friends promise to marry, better then the actual movie, or how it was played out, itself. In spite of that, I can see where this is a movie that will definitely grow on you and I recommend a second viewing as I plan to do, have a feeling I'll like it a lot better the second time around.I didn't think Julia and Dermot's characters had ANY chemistry till the end and it seemed Julia was in almost every scene(not to take anything away from her-she did a good job with this role.) The situation-two friends promising they'll marry at a certain age-is something I dug and certain aspects were very true to life but other situations seemed hopelessly contrived and very sitcomish. I'm a bit mixed on this movie, in many ways, it's your typical romantic comedy but in a few ways it's not. I think the characters really come into their own towards the end and I'd have liked to have been as into it before that, certain scenes as mentioned were a bit contrived and dull. But how I loved Cameron in this! SPOILERS: I liked the way the movie veered off with the different type of ending and I think Julia Robert's' ""Jules"" became much more fleshed out and multi dimensional the more time went by, Ms. Roberts was very good in conveying the sadness and pain of not ending up with the man she loved. I've always liked Robert's movies, but since seeing this and 2004's Closer, I'm starting to think I've misjudged her and she has a lot more dramatic range then I initially gave her credit for. I think that this is an OK movie, but not great, had it's positives and negatives, was neither remarkable or dreadful and rates about a 6.5.",My Best Friend's Wedding
35,Spleen,The last wedding was better,6,14 December 2001,"Spoilers follow ... and actually, what happens at the end isn't all THAT obvious, so you might want to heed my warning.The premise: Julia Roberts is in love with Dermot Mulroney, who is about to marry Cameron Diaz, so she (Roberts) rushes off to disrupt the wedding by means fair or foul.  There are two complete mysteries here.  One is Julia Roberts's interest in Mulroney.  Her other friend (Rupert Everett) manages to be far more interesting, not that this is hard - so surely she realises she can do better?  Perhaps women see these things differently.  At any rate, I'm far more profoundly puzzled by the second mystery: how could Dermot Mulroney possibly even THINK of marrying the milk-and-water Cameron Diaz when Julia Roberts is an option?  This is a film where A lusts after B and B lusts after C, when you'd expect it to be the other way around.Everyone makes the wrong choice at the end, including the director. Clearly, we're meant to be wallow in Julia Roberts's tasteless amorality, such as it is, as she plans to split up a couple she doesn't want to see together - so we might as well wallow properly, by watching her succeed. Why not?  There's no particular need for Roberts and her old flame to get married afterwards.  We'd be happy enough, probably more happy, to watch her fail to get what she wants, so long as she achieves what she sets out to achieve.  -I'm not saying this is the ONLY kind of ending I'd accept.  The main problem with the actual ending is its sheer arbitrariness.  The film reminds me of the mental processes of a poor chess player (like myself) who considers all the possibilities and then plumps for whichever one he happened to think of last.The really sad thing about this film is that its director is P.J. Hogan. Hogan's previous film had been ""Muriel's Wedding"", one of the best Australian pictures of the past decade (and in my opinion, of all time). Then he went to Hollywood and made this ill-conceived thing, in a pedestrian, unremarkable fashion.  And he hasn't made anything since. (Note: I've just checked up on this.  He has another film coming out in 2002 - and anyway, it's not as if he's an old man, so perhaps no harm done.)",My Best Friend's Wedding
36,JuguAbraham,Rupert Everett and Laszlo Kovacs prop up an ordinary film,7,5 August 2001,"Everett's performance is great. He makes all others look like pygmies!Kovacs, whose Hollywood films do not reflect what he had achieved earlier in his Hungarian films, comes up with classic overhead shots of people moving like ants in office lobbies. Kovacs is a delight to watch, even in the winter of his career.",My Best Friend's Wedding
37,philip_vanderveken,"Recognizable, but too annoying",6,11 November 2004,"In a way this movie is quite recognizable to me. I also have made a deal to marry my best friend when we turn 30. She also has a boyfriend and I'm alone and yes, I do compare all girls to her. But that is as far as the similarities between the movie and my life go. No way that I would ever try to get between her and her boyfriend and certainly not when they decide to get married. Still, I loved the story and the idea behind it, but I can't say the same about the whole movie. There were so many things that ruined it for me. For instance: what was all that singing about? Is it really necessary to hear Cameron Diaz singing out of tone for more than two minutes? Do I really want to see the whole family singing a song about love, in the middle of a restaurant? There is only one answer to these questions: the fast forward-button. The same for Cameron Diaz' character. Damn, I start running, kicking and screaming for help if I ever meet a girl like that. I really don't see what is so great about an overactive, lunatic 20-year old with too much money to spend. Even though there were many things that I hated, I can't say the same about the plot. I admit that I didn't expect to see what I saw. Congratulations to the makers that they made the movie end in this way. If all the scenes that annoyed me would have been cut out, I would have loved this movie, although I don't know if much would have been left of it. Now it crossed the line too many times, annoying me just a little too often. I give it a 6/10 because of the good idea and the unexpected ending of the story, but if it hadn't annoyed me that much it would have been at least an 8 or a 9. Too bad!",My Best Friend's Wedding
38,rivertam26,A guilty pleasure,8,2 August 2020,"Ultimately I think this movie is a guilty pleasure but it's just so damn entertaining mostly in a trashy sort of way. Julia Roberts stars as a food critic who begins pining for her hunky best friend played by Dermot Mulroney (Wedding Date) after he announces his engagement to a bubbly and layered Cameron Diaz (Mask). And by pining I mean trying to destroy their wedding. All the actors are in top form here Julia Roberts is so great in against type form and Cameron Diaz is fantastically charming but it's Rupert Everett as Roberts's gay best friend who steals the show. He's charming, handsome, charasmatic and so hilarious. All in all it's a fun flick that's has a surprising emotional resonance elevated of course by it's fine cast. Despite slightly sloppy direction.Budget: $38M
Box Office: $299.3M8.5/10",My Best Friend's Wedding
39,blott2319-1,Forever and ever this movie will stay in my heart,9,13 October 2020,"There's so much that is smart, different, and genre-defying in My Best Friend's Wedding. It's definitely structured like a romantic comedy, but things don't fall into place as easily for our protagonist here. In fact, *spoilers* she's actually the only villain in the film. She is the one who is trying to ruin things and the comedy comes from the fact that we watch as all her lies and deceit come back to bite her. The plots she concocts are insane and sometimes on the borderline of illegal, but all in the name of love. The irony is that this movie takes some of the crazy stalker behavior that could be treated as romantic in a different rom-com and shows how damaging they would be in reality (particularly if the feelings were unrequited.) I think that's why I enjoy this movie so much, while I hate other films where a protagonist has to suffer. In this case, it is her own fault she winds up being embarrassed and humiliated, so I can accept that she deserves it.Across the board this cast is marvelous. The fact that they cast Julia Roberts as the protagonist is perfect, because she is well-known as a romantic lead, and we naturally assume she is meant to end up with the guy. I like that Cameron Diaz is playing a girl who is extremely likable, and one who acts a bit ditzy, but as the movie progresses we find that she isn't a complete push-over. Dermot Mulroney does a great job as a guy who is dealing with some complex thoughts and conflicted emotions. Figuring out what your heart wants is a challenge, particularly when more than one person you love is around, and I feel he shows this in his performance. The true shame of My Best Friend's Wedding is that Rupert Everett is not in it more often. He is out of the picture many times, and I always wish he was present, because he is absolutely hilarious. His comedic contributions are stellar, and even in a few remote phone calls he made me chuckle.The other thing that I adore about My Best Friend's Wedding are the musical numbers. I love that they come about in a way that makes sense organically for the story, and yet when they get going the songs often become stylized and feel like they are straight out of a traditional musical. It's toe-tapping fun, and since they are all covers of existing songs, the tunes are solid (and it makes sense that the characters would know them.) The film is a great mix of comedy with some more serious romantic moments. There are certainly aspects of the story in My Best Friend's Wedding that I can admit don't make a ton of logical sense, and the behavior of Julia Roberts's character borders on pure psychosis. That being said, in this kind of light and fun movie a little suspension of disbelief is allowed. Every time I watch My Best Friend's Wedding I find it strangely satisfying despite the fact that it doesn't end with the perfect conclusion you might want.",My Best Friend's Wedding
40,Mister-6,"The ""Wedding"" zingers....",10,8 May 2000,"For a while, I was getting concerned about the direction Julia Roberts' career was taking, after misfiring in such dismal duds as ""Mary Reilly"" and ""Michael Collins"" where she seemed so shell-shocked that her radiant smile was nowhere in sight.Thank God she rebounded for ""My Best Friend's Wedding"".  This film, while not perfect, is a shining example of what makes Julia so radiant and desirable in the right role.  And she sure gets it here.As Julianne Potter, Julia gives the same sweet, radiant glow she offered us in ""Pretty Woman"".  Seems she's fallen in love with her best friend for ages Michael O'Neal (Dermot Mulroney) - unfortunately, it's on the eve of his wedding to an effervescent, perky girl (Cameron Diaz) who does her darndest to make Julianne her best friend...as well as her maid-of-honor.  Of course, Julianne does what any right-thinking young lady would do: everything in her power to break up the wedding of the title.This is not as melodramatic as it sounds: this is, in fact, one of the brightest, smartest and all-around funniest comedies of the decade.  All the lead characters make the absolute most of their parts and revel in the glory of love, double-dealing and flat-out lying.  Along with being extremely romantic, this has to be the most cleverly-plotted love story ever: for every plot thought up by Julianne, there's a twist or foul-up that has everything to do with true love and/or blind devotion.There are great faces in the background, too.  Susan Sullivan, Philip Bosco, the great M. Emmet Walsh all lend able support and offer their own fine support.  But how can I mention them in the same paragraph without adding Rupert Everett into the fray?  As Julianne's gay editor/friend, he adds great color to all his scenes, especially at the dinner with the wedding party at the seafood restaurant (you've seen it, you know what I mean).I won't spoil anything by saying that true love wins out in the end; face it, would you WANT to see Julia Roberts as a BAD GUY?  Maybe you would, but not in a romantic comedy.  In fact, the main surprises lie in the twists and turns that lie throughout this film.  Every twist makes the story all the more interesting and (incidentally) funny.  Of course, the music makes the proceedings all the better (with a heavy assist from Dionne Warwick on two occasions).So to recap, what else can I say: if you love Julia Roberts, love stories, comedies and weddings, here's your movie.Ten stars and a copy of ""Dionne Warwick's Greatest Hits"" on CD for ""My Best Friend's Wedding"", where true love wins but true friendship comes in a close second.Keep up the good work, Julia.",My Best Friend's Wedding
41,Atreyu_II,Bitter and crude,6,2 October 2007,"""My Best Friend's Wedding"", really...Even though I don't dislike it, I can't say that I enjoy it either. This movie is intended to be a romantic comedy, but doesn't convince me because it fails.Yes, it has some humor and some funny moments (especially by Rupert Everett's character, George). However, the rest of this movie's humor ends up being ridiculous and somehow annoying. Besides, this movie isn't sweet or truly romantic for a love story.Also, the character played by Julia Roberts (Julianne or simply Jules) is pure evil, rude, jealous, selfish and greedy. Her intentions are dark. What she does is really mean: she tries to steal her best friend's bride to get him back, but she (Jules) never let him love her when he loved her.Some catchy songs can be listened in this movie, especially ""I Say a Little Prayer"". The marriage at the end is beautifully made and the final scene is comical. Rupert Everett is hilarious in this movie and I like very much Cameron Diaz's character (Kimmy Wallace) in this movie. She's enchanting, adorable, sweet and beautiful: the opposite of Jules.Overall, this is a bitter and crude movie. Not a keeper or a movie to watch over and over.",My Best Friend's Wedding
42,kenandraf,Different and Average,9,9 September 2002,"A different kind of romantic comedy where in the lead character is the ""villian"" and we see things from her point of view.The story is quite simple all in all.The production overall is average despite the great cast and acting.The comedy was poor and there are some over reaching,annoying musical scenes.More complicatd plot twists and good slapstick could have made this movie a good one like one of those classic Katherine Hepburn screwballs.Only for romantic movie fanatics who do not mind an alternative formula and big fans of the lead actors....",My Best Friend's Wedding
43,Tito-8,"Often likable, but just too silly",5,24 September 1999,"This film had a lot going for it, in particular a stand-out performance from Rupert Everett, but in the end, it was just too stupid for me to possibly recommend.  I must admit that it was generally enjoyable, but a few moments absolutely ruined this picture for me.  More specifically, I had a hard time liking this movie after the pitiful scene where everyone breaks out into song.  That is the best example of how this film occasionally stepped over the line and went from ""cute"" to ""dumb"".  This film definitely has some good moments, but overall, it's a little too annoying for my tastes.",My Best Friend's Wedding
44,TheOtherFool,Just your typical Roberts vehicle,4,3 April 2004,"There's something about Julia... I don't like. Although she played in some OK movies (Erin Brockovich and The Pelican Brief come to mind) her acting is just no good... That and the fact she plays in so many crappy romantic comedies AND the fact that everybody thinks she's pretty, while she clearly is not (come on, folks) just makes me dislike her. How she ever stole away an academy award that belonged to Ellen Burstyn I will never forget. It's just how I feel about Ms. Roberts.In My Best Friend's Wedding, it's no difference. The movie tries to be snappy, at times even a bit dark, but it doesn't work. The 'interesting' part of the movie apparently is that Roberts is playing the not to nice girl in this one. So what, that's how I always felt about her... The story's pretty lame and I couldn't care less for the characters involved. I'm sorry...There is a good sing-a-long somewhere near the end of the movie (I'm a sucker for those) and Everett steals the show in a funny role as Roberts' gay friend, but that's not enough to really make it work. 4/10 (and I'm being generous).",My Best Friend's Wedding
45,Isaac5855,"""What would Lucy do in this situation?""",8,20 July 2006,"Julia Roberts' considerable on screen charisma anchors MY BEST FRIEND'S WEDDING, a romantic comedy with a twist that may or may not have you cheering for our girl to come out on top. Roberts plays a food critic named Julianne who learns that her ex-boyfriend Michael (Dermot Mulroney) is getting married and he asks her to come to the wedding and be his ""Best Man."" Upon her arrival for the wedding festivities and meeting the bride-to-be, Kim (Cameron Diaz), Julianne decides that she wants Michael back and pulls out every dirty trick she can think of to break them up. This mission gets complicated when the fiancée asks Julianne to be her maid of honor. There are a lot of comic situations that arise from this premise, but it is a little unsettling as well because, deep down, we know that what Julianne is doing is wrong, but part of us wants her to win, whether we want to admit or not, because Roberts still manages to evoke our sympathies as Julianne especially when we learn that it is Julianne who broke off the relationship with Michael and that his new fiancée gives him everything that Julianne couldn't't...like the ability to be affectionate in public, but seeing Michael so happy ignites the Mr. Hyde in Julianne. She even asks her gay best friend, George (Rupert Everett) to pretend to be her fiancée to make Michael jealous. The scene where George tells Kim's family how he and Julianne met is hysterical. Whether or not Julianne succeeds in her mission should not be revealed here for those who haven't seen the film,but know that the film works for the most part thanks to some smart writing, a winning performance by Roberts and a scene-stealing turn by Everett as George. It's not PRETTY WOMAN, but if you accept that going in , it's a pleasant ride.",My Best Friend's Wedding
46,drewnes,"""This is my one chance at happiness. I have to be ruthless!""",7,30 May 2021,"And ruthless she was! It is odd because I feel like this is one of my favorite Julia Robert's performances, but her character is so bad (in the sense that she is almost evil). I found myself wanting her not to have anything go her way at all, but I guess that was the point of the movie. Has a lovely 90's feel to it, and Rupert Everett is definitely the MVP! I need more of his character.",My Best Friend's Wedding
47,SKG-2,Funny and winning the whole way,9,25 February 1999,"Before I get to why I really liked this, I'd like to clear something up. I've read a lot on how Rupert Everett's character is single.  He is NOT. There are two voices on the answering machine that Julia Roberts screams into in that scene (the other one is named Werner), and he says when he first comes to visit that he has to get back that evening because ""we have this thing with Werner's family back in the Hamptons.""  Just wanted to clear that up.  Anyway...I thought this movie was really funny, and while it does get serious in the second half, for the most part, that serious part doesn't bog the movie down.  And when it's funny, particularly with the ""I Say a Little Prayer"" sequence, it's hysterically funny.  I also liked how, if you didn't know any better, Julianne's actions would seem, up to a point, as if a best friend would react.  Roberts was very good, Cameron Diaz as well, being the most un-self-conscious performers I've seen in a while, and Mulroney is good. But Everett steals the movie, and I'm upset he didn't get an Oscar nomination.",My Best Friend's Wedding
