,User_name,Review title,Review Rating,Review date,Review_body,Movie_name
88,bostonlatin,Skip the first hour and watch the last 35 minutes,5,18 January 2006,"This movie resurrected Julia Roberts career, however, it is Rupert Everett that brings it some life with irony, warmth, sarcasm, and intelligence. At it's best, the film is bittersweet, not a comedy or a romantic comedy. It actually doesn't kick in until the last 30 minutes. I guessed it touched a lot of people with it's memories of lost love, doing dumb things in the name of love, and missed opportunities. Cameron Diaz who has turned into an excellent actress does a decent job with a one dimensional role. Mr. Mulroney could have been one of any 50 handsome actors with a sneer. The supporting cast is wasted. The big give away that this movie could be overwrought are the opening credits with the never ending Dusty Springfield song.",My Best Friend's Wedding
89,shevaunhodge,no! Didn't like the plot,5,3 April 2019,"Ok, so I didn't like this film because the plot is silly really. The main character that Julia Roberts plays is not likeable one bit. She is selfish and self serving and even Julia Roberts couldn't make you like the main character, so the story was doomed from the start. If Julia Roberts. Ant make the character likeable than who can? How could you suddenly decide that you love someone after 9 years of being friends with them? You ether know or you don't. The reason why the main character decided this is because the man she once had wrapped around her little finger wasn't at her beck and call anymore and wanted the character all to herself which is wrong. The way the main character tries to get her own way is also calculated and cruel which leaves the viewer having no sympathy for them. You actually end up liking the character Cameron Diaz plays because of her niaveity. Although this is probably the worst roll I have ever seen her play and it's probably the worst I have ever seen her look. So overall not really worth watching.",My Best Friend's Wedding
90,csauer,Julia is special,10,30 January 2006,Never been a big Julia Roberts fan until I saw the movie Erin Brockovich. That is a great movie. My best friend's wedding is better. I found myself rooting for Jules because I guess it's really easy to love Julia Roberts. If you lined up 100 good looking women and Julia was one of them you would stop looking the second you saw her. She just has that certain something that makes you want to take her home and take care of her. Enough about Julia. The movie is just plain fun. When Jules forces Kim to sing and she butchers the song but the crowd for some reason is kind to her really is cute. The acting is great and the omission of the F word but once makes this movie easy to tolerate. The actor who played Michael should play Elvis in some sort of way as his lip likes to sneak up just like the King's did. George was great and honest to Jules. I had to watch this movie a few times before I really enjoyed it. The wedding is not the biggie here. Getting to it is. Don't know how anyone would not like this movie. Must see!,My Best Friend's Wedding
91,Dana82,A Delightful Movie!,8,1 July 1999,"My Best Friend's Wedding is so good!  Julia Roberts and the entire cast are great, and this movie is so funny in parts! I recommend it. 7/10",My Best Friend's Wedding
92,gaby_rivas2,Unrealistic,5,28 February 2020,This movie made a stretchhhh to be a rom-com. She literally tries to sabatage her best friends wedding because shes in love with him. They used to date in college but she dumped him because shes not lovey dovey.,My Best Friend's Wedding
93,dessi_jessi,Waste of time to watch this film,1,26 June 2019,"There is something completely wrong with the storyline - a woman who wants to separate her best friend from the woman he loves? That is so wrong.
Wouldn't recommend this film to anyone.",My Best Friend's Wedding
94,saraarts,Ugh,1,7 July 1999,"I'm sorry, but aside from Plan 9 from Outer Space, which had a certain innocent redemptive charm, this may be the most stupid movie I've ever seen. My boyfriend thought it was ""cute,"" but only because he loves Julia Roberts; she reminds him of someone he's still half in love with, I think. Now, while I feel this way about Rupert Everett, even his elegance and charisma cannot salve the basic flaw of this film: that the main character is absolutely despicable, and that I cannot possibly spare a flying expletive for the fate of any of the other characters.  I would have been able to just chalk all this up to yet another disappointing film viewing experience, except for the huge amount of money and talent expended in putting together this worthless stretch of plastic and the obscene commercial success it engendered.  It's a true shame; or you could just say it's truly shameful.  I understand wanting to like anything with a favorite actor involved in it.  Likewise, I understand the pressures of coming up with something new, sure-shot, and original.  Unfortunately, while this movie made a ton of money to justify its existence, a filmed revival of perhaps a Noel Coward play with the same cast and cost would have accomplished the same fiscal result with the felicitous side benefits that the end product would have been tasteful, intelligent, and genuinely witty, and that, for just a little longer, the shallow predilections of the producers and much of the American movie-going public (who just ate this up) might have remained unexposed.",My Best Friend's Wedding
95,TigerlilyBramble_of_WillowBottom,Death by minibar!,7,17 September 2002,"Romantic comedy: Jules Potter (Julia Roberts) hasn't seen her best friend Michael (Dermont Mulroney)in months, but remembers that she made a blood promise with him that they'd marry by the time they were twenty-eight if they weren't already. Three weeks before her twenty-eighth birthday, she gets a mysterious message from him sounding desperate. So she calls him, expecting a proposal. Instead, he announces that he's met a beautiful girl, Kimmy Wallace (Cameron Diaz), and that they're getting married in five days. Jules wants to be happy...but realizes she may love him herself, and with the help of her other best friend, gay editor George Downes (Rupert Everett), sets off to break up the wedding!MY TAKE: 8.5 out of 10 This is a cute and very charming movie. It's different--with the main character being the ""bad guy"" and (spoiler) her not getting the guy--but refreshing. The casting is world-class, and the acting is wonderful. Cameron Diaz is at her best as the beautiful and hyper Kimmy, Julia Roberts is dark but great as the main character/villain, and Rupert Everett is FANTASTIC and charming as George. But my one complaint is that they made George more desirable than Michael! Throughout the movie I had no idea why Jules was crazy for this seemingly wonderful guy when the only nearly romantic part between them is when he gets the wedding ring off of her finger with saliva. But after only five minutes of watching, you'll fall in love with Rupert Everett and be sorry he's gay. I like the ending, even though it's sort of sad, and even though Mulroney's character is boring and less than cute, this is still a great rental.",My Best Friend's Wedding
96,walter-17,BUY THIS VIDEO TAPE,9,23 August 1999,"I liked everything about this movie except the ending.  I guess you can't have everything.I singing scene was GREAT!  I would buy the tape just for that.However, there was much more to this movie and I got a lot of laughs out of it.9/10",My Best Friend's Wedding
97,john_sprocket,THE Classic 90's Rom-Com,3,21 June 2016,"Julia Roberts is dangerously insane in this classic 90's rom-com. Replete with sassy gay friend and spontaneous group song numbers, you already know if you will like this movie.At the start of the story you may be inclined to see the actions of the main character as humorous antics. But as the story wears on it will become apparent that her self-centered mania seriously hurts everyone around her. Prepare to be disappointed by the male lead, whose open-mouthed stares were the height of fashion at a time when Keanu Reeves ruled the big screen. The movie ends with the antagonist laughing and dancing. Maybe because she's so pretty, no one holds her responsible for all the pain she caused or even the felonies she committed.",My Best Friend's Wedding
98,Kyle Westphal,The WORST movie of 1997,1,5 December 1998,"For a while, I thought ""Flubber"" was the worst movie of 1997. That was before I saw ""My Best Friend's Wedding"". I never cared for Julia Roberts, nor do I now. This film (like ""Babe"" [1995]) is billed as a comedy but it's not funny. Another thing about MBFW is that Julia Roberts does not in ANY way deserve Michael. She had plenty of times to say she loved him, but she didn't! In that sense, you know a film has to be awful if you're rooting for Cameron Diaz",My Best Friend's Wedding
99,scotty12,There are much better Julia Roberts films than this,5,17 April 2001,"Unfortunately not really worth watching.  A pity, because it could have been much better, with its unusual take as a non-feelgood romantic comedy.  Any romantic comedy needs more likeable characters than are on show here though. Gay George is the only really likeable one, he does have some standout lines and situations that are funny even when recounted in other IMDB comments.  The others however - dreadful.  Jules seemed not to be sure whether to be all-out cutthroat or intrinsically nice just playing at nasty.  Dermot Mulroney's character was far too boring and chauvinistic, and not charismatic enough to have believability.  And Kimmy could have been cute and likeable, but just look at her driving!  I would like to see her get banned for life (likewise from singing).  Jules behaved badly and nearly got somebody fired from their job, but that ain't even in the same league as Kimmy!  She almost killed people on the roads and carparks of Chicago, and undoubtedly would if she were allowed to continue like that.Can't recommend this, despite Everett's best endeavours.  Julia Roberts has been so much better than this in other films (most notably Erin Brockovich).",My Best Friend's Wedding
100,Kieran_Oneill,It's average,6,6 September 2020,"I don't know if I'd actually suggest this movie to anyone, It's not overly fantastical, just a feel-good movie with a below average soundtrack, not much to say about it,
watch it if you don't have a better romance movie to watch",My Best Friend's Wedding
101,rominaferraro,Awful,1,3 March 2004,"I hated it. I couldn't even focus on the plot, the characters were nauseating. Roberts' is utterly selfish, her boy friend is quite lame, and his fiancée is such a pushover that I wanted to shout at her every time I watched her. Sorry, but I cannot see the fun in an hour and a half of Julia Roberts tripping with almost any object she had near.I really hope that Hollywood will stop making movies with such awful stereotypical female characters. There are many movies with this male-driven kind of women who seem incapable of having a mind of their own. It would be great to see comedies with female characters that can be funny and smart at the same time.",My Best Friend's Wedding
102,John-76,When I first heard that Julia Roberts was playing...,8,14 September 1998,"When I first heard that Julia Roberts was playing a character that had to fight for the affections of a man, I had my doubts that it would work, after all this is ""Pretty Woman"" we're talking about.  Well not only does Julia pull it off, but you will actually feel pity for her. In a nutshell,  Julianne,  played by Julia Roberts, is best friends with Michael, played by Dermot Mulroney. When Michael decides to get married to Kimmy, played by Cameron Diaz, Julianne realizes she loves him and decides to try and break them up.Julia Roberts has never been better. Her combination of brashness and vulnerability makes the character and the comedy work. Cameron Diaz's character, Kimmy, reminding me of my girlfriend Tami, comes across as unconditionally in love with Michael. Unlike Julianne, Kimmy is not afraid to show her affections in public. Diaz plays the role with earnestness and purity. Julianne has her work cut out in trying to break this gal's hold on Michael. I was very pleased that director P. J. Hogan didn't go for the typical ""Hollywood"" ending. Since I don't want to spoil the ending for anyone, I'll just say it gave a ""good romantic comedy"" the emotional depth to make it a ""very good movie"". RATING: ***",My Best Friend's Wedding
103,YFL,"Some great moments, thanks to Everett",7,17 July 1999,"The story itself is interesting enough, but if not for the characters' variety of personalities, the story wouldn't have moved on smoothly. In general, the cast is fine. Julia Roberts as Juls manages to elicit sympathy even when she's devious, Cameron Diaz is vulnerably adorable as Kimmy, it's impossible to not like her. In the leading men section, though, the contrast is ... ! Dermot Mulroney isn't the least appealing in his role as Michael ... how could he manage to have two girls crazy over him?? In all his scenes, his execution is just dull ... worse yet, there are scenes where he and Juls connect which could've been great, unfortunately he just doesn't have what it takes.Thankfully, the film redeems itself tremendously in the form of Rupert Everett as George. It does helps that he has some of the best scenes and lines, and his finesse and charisma makes it work so well - almost too well. He steals every scene he's in with ease, and created some great moments ... most notably the infectious dining scene where he leads the whole restaurant into a catchy song, and then near the end where he has his little talk with Juls and leads her out to the dance floor.Of course, films need good scripts, and this is quite a good one. It's probably not a classic, but it still carries off everything with self-assuredness. And the ending is beautiful, with a magical touch which shows the best of friendships in a dimension which, though undeniably platonic, somehow manages to feel romantic.",My Best Friend's Wedding
104,vispateresa,"A huge disappointment from the director of ""Muriel's Wedding"".",1,16 January 2001,"As a rule, I never watch Hollywood mainstream movies, but this time I went to see this because I liked the trailer and because I was in the mood for some light-hearted fun.What's more, I knew the writer is the same of ""Muriel's Wedding"" (one of my favourite films of all times), so I had great expectations.But, alas, this film was a huge disappointment! I absolutely disliked it. The plot was boring, silly and inconsistent. Not even Rupert Everett could save this awful film. Definitely, Hollywood did no good to P.J. Hogan's work. This was so different from that little gem that was ""Muriel's Wedding"".After watching this film, I made two resolutions: never to watch another Hollywood romantic comedy and never to watch another film starring Cameron Diaz.",My Best Friend's Wedding
105,llorminerva,There will always be dancing indeed,10,12 July 2020,"Honestly, this movie was real and relatable. Liberating and a ballad to ""the one who got away"".
Even if you don't *love* Julia Roberts in this one. You don't have to.All in for endings like this.",My Best Friend's Wedding
106,alyzu,Yuck!,1,27 December 2019,"Saw this on video a few months after it was released, and I wasn't crazy about it then. Watched (some of) it again recently, and it's worse than I remembered.
Starting with the opening number, it's a pile of crud. None of the characters (except for Rupert Everett's and Philip Bosco's) have any depth or redeeming qualities. Dermot Mulroney's character expects his fiancee, who's nearly a decade younger than he is, to give up her entire life for him (and she DOES!!!!!!!). As for the main character? Well. It's a miracle she has ANY friends at all.
Skip this one. Watch Rupert Everett in ""An Ideal Husband"", instead.",My Best Friend's Wedding
107,thirteeninthecity,Julia Roberts was a star,7,31 December 2005,I love this movie! It's so funny! I love the fact how Julia Roberts kept her character so bitchy. That's what made this movie extra special. Cameron Diaz was really cute on how she acted towards Dermont Muroney. Julia made this movie happen. This and Pretty Woman were one of her best work. I love this movie so much and I always will. I remember i was five when this movie came out and my mom really wanted to see it when I wanted to see Hercules. LOL!!!!!! But I got older and understood the jokes more and fell so in love with it because of how much Jules loved Michael and she always did but never wanted to see the truth. So basically she goes out of her way to win him again. She trys so hard to sabotage the wedding. That when Kim found out it was heartbreak. Any ways I totally recommend this for y'all teens and adults to watch. Great laughs. Totally romantic.,My Best Friend's Wedding
108,jeffgintz,Absolute garbage,1,17 October 2021,"This ""film"" {air quotes} is the bottom of the barrel. Simply a train wreck on top of a car crash of a script - it is intensely boring, unbelievable, and you end up rooting against all of the three main characters. These characters are people I would not spend one minute of my time with in real life. Everything about this movie is wrong - stay away from it.",My Best Friend's Wedding
109,alexperkins-94375,Classic!!!!!,8,4 October 2018,"My all time favourite film!
I think I've watched it over a hundred times. I love Julia Roberts in this film, she stole the show. It's such a feel good film. It always puts me in a good mood. If you are feeling down watch this film,, it will brighten up your day/",My Best Friend's Wedding
110,remiller-16473,Who are you supposed to like?,4,29 September 2021,"I get it, Julia Roberts is supposed to be the one that you hate, but I didn't like any of them. George was charming but everyone else was so annoying. What they say and do makes you want to turn of the movie, and I almost did! Don't watch it if you like the actors and actresses in it, it will only make you hate them!",My Best Friend's Wedding
111,sujatasen-99958,WEDDING BELLS!,7,10 September 2020,"The name itself is very interesting .......
A romantic comedy ,it is a realistic movie which I strongly recommend for Julia Roberts fan.Also Cameron Diaz dis a charismatic role.The story is believable and also funny. It is about a woman who goes after an old boyfriend who is about to be married.She went through all kind of troubles to get him back before the marriage could take place.The Guy with the British accent gave a great performance and did humor outstandingly.It is a good watch for those whose wedding bells have already started ringing!!!",My Best Friend's Wedding
112,reelcouples,Jules Potter is way too selfish to be in a relationship with anyone.,5,18 March 2011,"This was one movie ending that we thoroughly agreed with - and not because the couple got together, but because they didn't. Jules Potter is way too selfish to be in a relationship with anyone.Jules and Michael have been friends since college, and one year they made a pact that if neither of them were married by the time they were 28 (really? Did they go to school in Utah?) they would marry each other. When Michael calls on the eve (eve eve) of Jules' birthday she assumes it's to call in his marker. When she finds out that he is instead calling to announce that he's engaged to someone else, Jules suddenly decides that he's the one for her, and spends the next three days doing everything in her power to break up the clearly happy couple.Talk about wanting what you can't have. Jules doesn't want to win Michael over; she just wants to win. Is this really how you treat your best friend? Clearly not, as Jules doesn't win the guy in the end after all. Three days of sabotage - flirting, prancing about in her underwear, trying to provoke Michael's jealousy by pretending to be engaged to her best gay friend George, attempting to humiliate Kimmy, the bride-to-be, in a karaoke bar, sending manipulative emails from Kimmy's father, and finally - confessing her newly discovered ""love"" for Michael and forcing her lips on him - are all done in vain. Just when you're wondering how much farther she'll take it, Jules finally comes to the realization that Michael's love for Kimmy cannot be swayed by her cheap antics. And in the end it's Michael and Kimmy who get married and sail off into the sunset.We shudder to think what happens when George announces he's met someone. Will she prance around him in Gucci couture? Move to Chelsea? Have a sex change operation? We think Michael, Kimmy and George need to find some new friends.www.reel-couples.com",My Best Friend's Wedding
113,Immy,"Julia's back, and in fine form",10,18 September 1998,"Anyone harboring notions that Julia Roberts is treading familiar ground with ""MBFW"" will be pleasantly surprised. Unlike past projects that had her as the centerpiece of semi-engrossing plots involving vaguely-sketched characters, this time we are afforded a smart, well defined story (helped along by award winning screenwriter Ronald Bass, who also worked on the Julia pic ""Sleeping With The Enemy"") and three-dimensional supporting players. One wonders how many times the Romantic Comedy format can be explored successfully. This film proves that with enough diverting plot elements, and a few laughs and songs thrown in for good measure, sometimes formula can be anything but formulaic.",My Best Friend's Wedding
114,kevinwu109,Julia Roberts at her BEST,8,22 July 2000,"This was a charmingly hilarious comedy-romance comparable to ""Shakespeare in love"" (though not quite as good in terms of dialogue and cleverness.) It was much better than Something about Mary. The plot is unique in that the writers had us sympathizing with one woman in the beginning, but by the end, we are definitely not on her side. Julia Roberts was great, and so was Rupert Everret and Cameron Diaz. Mulrooney (sp?) was a bit too dry. There were many memorable scenes, both hilarious and touching. It could have been a 9 if the ending was a bit different. The final scene should have been of the wedding car pulling out, and perhaps with a Julia Roberts narration.But nonetheless, see this movie for comedy, romance and little drama.
8/10",My Best Friend's Wedding
115,ivona021,"To get married, you must figure all of the following: ...",10,8 December 2003,"I loved this movie from the beginning to the end.The story is simple: two ex's-turned-good-friends vowed to get married to each other if everything else fails by the time they are a certain age. On Jules' birthday (Julia Roberts), what's-his-name calls (Dermot Mulroney), and leaves a message that he needs to urgently talk to her. Her heart suddenly starts beating although she almost forgot all about that deal for years, but she literally drops down when all he has to ask her was to be the maid of honor on his sudden wedding! She charges up, and with the support of her best friend George (Rupert Everett, wonderfully gay and handsome), she sets a goal to win the guy, Michael, from the bride in the last four days prior to wedding. But, the young, rich and beautiful bride Kimmy (Cameron Diaz) isn't naive - oh no! She fights back -- flatters Jules, plays up her phobias and sets her up for failure as much as Jules sets up her. She uses all the charm and all the info she got from Michael, since Michael still talked about Jules in awe and respect. They are both jealous at each other. *** MILD SPOILER *** They are both good fighters, with some evil turns. They have totally different stands. While Kimmy is ready to drop out from college and follow Michael around, Jules, an independent, strong-spirited, and responsible woman with career ridicules both Michael's job and Kimmy's apparent lack of ambition. Kimmy returns strike with promise of unconditional love, which totally overwhelms Michael. However, we know that Kimmy is smarter than that: she'll promise everything in a rather shallow way, knowing that sooner or later, her rich father will take care of both her as well as Michael's career, but that Michael's pride would most likely drive him away if she offered all that bluntly and immediately. *** TOTAL SPOILER *** Jules figures that out, and succumbs to dirty scheming in order to show Michael how it's all going to end up one day AFTER he's already married to Kimmy for some time. And that's where the movie makes it clear that she is the bad guy. When her scheming goes much worse then she ever wanted it to go (a fake e-mail is mistakenly really sent instead of kept in 'drafts' for Michael to see), she almost succeeds... But then, on the wedding day, it turns out that she can't win either... And all those things come clear to her... (With George's help, naturally)... That it was all about winning, that she just felt like she'll lose everything if she doesn't win this guy, that she was a chicken and never told him her true feelings until the last moment because she really didn't feel what she tripped she did... She can do better than this guy... She needs to really believe in a guy... And it's okay if she lets Kimmy win... But she can give them her blessing, and ... dance! *** END OF SPOILER *** The movie is totally hilarious at times, especially the karaoke scene, and when George comes to the rescue. Also pay attention to BOTH the leading ladies scheming --- the movie is made so that only Jules' are 1000% apparent... But don't oversee the rest! A must-see romantic comedy.",My Best Friend's Wedding
