,User_name,Review title,Review Rating,Review date,Review_body,Movie_name
99,PotassiumMan,"Spike Lee joint on Vietnam, incendiary and cathartic",8,14 June 2020,"Even if Spike Lee's unapologetically political style of filmmaking is not your cup of tea, his new film about four Vietnam veterans returning to their old battleground in search of gold that they came across on the tour of duty might be worth viewing. They are also intent on recovering the remains of their fierce commanding officer who motivated and inspired them. The story is spiked with powerful performances all around (led by an explosive Delroy Lindo) and laced with viscerally taut action sequences and a sterling soundtrack.The timeliness of the film's message couldn't be better. The rage over how black America bore a disproportionate human cost in fighting the war in Vietnam, while at the same time African-Americans struggled to reach anything approaching societal and legal equality back home is balanced by a pained but ironclad belief in the undying honor of military service and loyalty to one's country. The film also has a ""Treasure of the Sierra Madre"" feel when it tackles themes of friendship, family and hunting for gold.Although not always smooth, with an occasional narrative drift and a late undisciplined lapse into preachiness, the film has an awful lot to say about the overlap between United States foreign policy missteps and social injustice at home. Not all the main characters are given a solid introduction and backstory, but their group dynamic becomes quite clear. The actual war experience for these men is never conveyed in-depth, except in occasional flashbacks. Despite these flaws, this film has many suspenseful, poignant and hard-hitting moments. You will barely notice the running time. It's a punch in the gut, as it touches on several unpleasant truths about American history and goes down as one of Spike Lee's more challenging films. Recommended to those who are open-minded.",Da 5 Bloods
100,zac-68274,Great Storyline With Educational Power Points,7,13 June 2020,Great story with an exceptional cast. Cinematography was average and the story snails during certaIn scenes but the award worthy performance of Delroy Lindo definitely keeps this movie alive,Da 5 Bloods
101,hoernkeem,"Da 5 Bloods (2020, Spike Lee) Lee's war film is confused, chaotic and incoherent",3,19 February 2021,"Da 5 Bloods (2020, Spike Lee)
Spike Lee made a war film... sort of. Netflix continues to impress as the studio keeps getting A level talent in front of and behind the camera to keep its original content churning out. Director Spike Lee returns after his very well thought of Oscar contender 'BlacKkKlansman'. This film deals with 4 African Americans who were engaged in the war in Vietnam, and all these years later they return to not only find the remains of a long fallen comrade, but also lost gold which immediately made me think of the film 'Three Kings'. This is very different from that film though. Lee assembles a good array of black actors to play his ""bloods"" including Delroy Lindo, Clarke Peters and Isiah Whitlock, Jr.. Chadwick Boseman also appears as their long, lost fallen comrade known as Stormin' Norman. While the simple setup has the makings of a quality film this project felt very all over the place. It lacked focus and was oddly disjointed in its action and storytelling. There were times it didn't feel like a production at the level of a director such as Spike Lee who has made some of America's most pivotal films.
The story starts with four aging Vietnam vets who meet each other in Vietnam returning to that country for the first time since that war so long ago. It is a joyous reunion, and something they obviously had been planning for quite a while. Long ago in the midst of the Vietnam war these four created a special bond under the leadership of Norm, the Boseman character. They were a special unit and were tasked with securing a downed CIA plane with gold destined for the Vietnamese. During this operation Norman was killed and left behind and the gold was buried. All these years later those soldiers who were dubbed 'Da Bloods' have returned for Norman and the gold. The situation starts to turn as Lindo's character's, Paul's, son tracks them down and tags along. Combine that with running into some sort of do-gooders who are land mine activists as well as a smuggler played by Jean Reno who is looking to double cross them. In addition Paul's mental state rapidly decays. All that adds into a melting pot of a messed up situation. It becomes a chaotic free for all with the gold at the end of the rainbow for whoever survives.
I kept struggling with what kind of movie I was watching. Is it a war film? Is it a message movie? Is it a heist film of sorts? It is trying to be all these things combined with various family melodrama aspects, with just random things tossed in. The addition of the land mine activists is bizarre and is only there to serve the plot. Part of the film feels like a direct ripoff of 'Treasure of the Sierra Madre'. You mainly see it in Lindo's mental breakdown combined with a scene that has the famous ""We don't need no stinkin' badges"" line. Lee also used an interesting directorial tactic when dealing with the scenes of the Bloods in the past. Instead of having young actors playing the main characters in Vietnam or de-aging them he just inserted the older actors into those scenes. I am not sure how effective it is, but I imagine it has to be a money saver. Lindo gets the juiciest role having the most angst to dig into plus the angle with his kid combined with his steady mental degeneration over the course of the trip. Everyone else does a good to serviceable job with the best performance probably being delivered by Jonathan Majors who plays Lindo's son. This film had some decent elements but ultimately was too scatterbrained and bizarrely unfocused to capture my attention. At times the plot made little to no sense at all. I would have expected much better from a film maker the caliber of Lee.
Eric's Grade: D+",Da 5 Bloods
102,nicci1972,Good information,9,8 July 2020,"Anyone that rates this less than a 5 has no understanding the artistry of this movie. ALL movies have ""convenient coincidences"". There is always someone who know how to solve the mystery or where to find the object or which 1 book in the library that is needed. This is a plot element to move the movie along. There were several valid points made about how blacks have fought for this country where they still have to fight to be treated with civility. There is information about the sufferings of the Vietnamese peoples. There's family and friendship struggles. There are return from War struggles and a few valid points about the VA. Along with action and thrills. I am an artist, a veteran, a black and a woman. This story resonates with me. Don't watch movies as film critics because I don't think that is your occupation. Rate a movie by your heart. Of course, everyone is entitled to their own opinions. But if you are reading this and haven't watched it - give it a try - you might learn something.",Da 5 Bloods
103,horst69,No stereotype left behind,2,14 June 2020,"Spike Lee has never been considered to be a good film maker , rather more of an activist, yet this movie is still a bit too much .Too shallow, too poorly filmed, acted and edited .
Cheaply made and corny, and let's just not mention the writing .What we have here is a succession of stereotypical scenes, in which stereotypical characters do stereotypical things , in a stereotypical fashion .A hamfisted attempt at racial significance has been made and is duly noted , it just doesn't fool anyone .
As a matter of fact, the actors never manage to go beyond a silly caricature of what they are supposed to portray ; which is highlighted by a script that couldn't be less credible or more disserving to the cause it pretends to be about .",Da 5 Bloods
104,directortim2012,Delroy Lindo!,7,18 June 2020,"Delroy Lindo makes the film worth watching. There's an Oscar nomination in his future for this movie. As for the film itself, it's hit and miss. Really good, genuine moments... and other just plain bad and action cliches you see coming from a mile away.",Da 5 Bloods
105,hypestyle,"""Da 5 Bloods"" is Spike Lee's Magnum Opus",10,21 June 2020,"""Da 5 Bloods"" is an action drama highlighting a fateful reunion with a quartet of Vietnam War veterans in modern-day Vietnam. The cast is led by Delroy Lindo, Chadwick Boseman, Jonathan Majors, Isiah Whitlock, Clarke Peters and Norm Lewis.This film explores the broken promises for Black American soldiers after their war experiences. ""Miracle at St. Anna"" was one of Lee's first to tackle a story that mostly takes place well outside the United States. Given his initial pedigree as a ""New York City Stories"" auteur, this is an obvious change of pace, but it is well worth more than one viewing.Four of the veterans reunite in Ho Chi Minh City to attempt to find the remains of fallen soldier/field leader ""Stormin Norman"" (Boseman). What neither the US or Vietnam State Departments know is that the four men also plan to find a hidden trunk full of gold that was lost in a CIA plane crash in the Vietnamese Jungle back during their original tour of duty.All four surviving men have been scarred by the war to varying degrees. The most deeply disturbed is Paul (Lindo), who in the latest manifestation of his bitterness and discontent has become an unabashed supporter of President Donald Trump: this makes him the object of caustic ribbing by his buddies, but Paul is resolute: He feels absolutely cheated of his due respect and reward for his bodily and mental sacrifice: both as a soldier and as a black citizen enduring Civil Rights-era turmoil and social tumult.To varying degrees, all of Paul's friends agree: Eddie, Melvin and Otis. Paul's adult son David is a surprise, and initially unwelcome tag-along: he wants to finally find a way to bond with his long-estranged father, but Paul isn't about to make it easy.The explorations of these men provide an intriguing alternative point of view for 2020 audiences: Vietnam-based dramas have been produced for decades, but scarcely few have done a deep dive into the point of view of what Black soldiers went through, much less how they fared in the years after the war.The cinematography by Newton Thomas Sigel is top-notch. Lee's direction is assured; the visual atmosphere is alternately cool, warm or hot and intense in other parts. There are four credited writers, including original writers Paul De Meo and Danny Bilson.Some of the scenes linger longer than they should. Some of the tribute/easter-egg dialogue will be obvious to people who are familiar with certain war films or heist films. Delroy Lindo should get major acting award nominations for his performance. His Paul is a firestorm of macho belligerence and deep emotional woundedness all wound-up in a man who feels abandoned and guilty. Clark Peters should get supporting actor nominations. Maybe the conceit of using the same actors to play their younger selves is off-putting for some, but this viewer managed to get over it.Given the already 2-hour-plus running time of the film, I don't know that there was time to go deeper into the philosophy of how people of color can be used as tools of white-driven colonialism and hyper-capitalism against other people of color and indigenous communities, the influence of Black-derived pop culture in Asian countries (Motown played at nightclubs, or even modern K-Pop music) or the contemporary contexts of Black-Asian relations in the United States. Paul's confrontation with a fellow trying to sell him a chicken updates the spat between Bill Nunn's Radio Raheem and the Korean-born shopkeepers in ""Do the Right Thing"". Paul's occasional rants about ""illegals"" and the rest of the crew's attempts to calm him down is about as far as it goes.Whatever the technical faults of a director like Spike Lee, he has earned his right for due consideration in taking on a conceptually risky project. ""Da 5 Bloods"" delivers the gold, but at a cost.",Da 5 Bloods
106,EasternZZ,"Uneven films, great moments mixed with a clustered story",7,18 June 2020,"The acting is great in this movie, and there are some really moving scenes in this movie. You do get that nostalgic brother love between these guys, the plot starts off really good but it becomes way to clustered in the mid point.This film is just a little bit too long, and it is just a weird thing to have very serious drama mix with cheesy ""70's type"" action. The action scene in Vietnam looks like a B movie action from the 70's, something like Black Belt Jones.The last 40 minutes is kinda a drag, and it goes on way to long, with a final speech that is way too long.7/10",Da 5 Bloods
107,kelly-gaudreau,Ambitious,8,19 April 2021,A very ambitious film and Spike Lee should have received an Oscar nod for his directing. Delroy Lindo also should have received a Best Actor nomination.,Da 5 Bloods
108,theredsky,Da 5 Bloods Review,7,6 September 2020,"Spike Lee's latest film has a great message about PTSD and coming to terms with our past. Delroy Lindo, Clarke Peters, and Chadwick Boseman deserve major Oscar attention next year and every else does a pretty good job. The screenplay and story are all great. I appreciated the themes that Spike Lee presented and some of those themes made some scenes quite emotional. The twist towards the end of the film feels earned and makes sense and I liked how Spike Lee changed the aspect ratio for the flashbacks. I also enjoyed how they had the older versions of the characters in the flashbacks. The only issues I had with the film were pacing and special effects. The pacing feels off here and there and there are points where I feel that the film does drag. Some of the visual gunshots and blood looked pretty bad and were quite distracting at points. I also took issue with how some of the action was shot. It's hard to tell what is going on because Spike Lee isn't the greatest action director but that isn't the point of the story so it wasn't too distracting for me. I urge you to check this out when you get the chance.",Da 5 Bloods
109,andymaranam,What da?,2,13 June 2020,"A poor blend of bad acting mismatch characters with no consistency at all. Unfortunately it's all over the place and very unbelievable.
That aside, Wanna make a point reboot do the right thing, now that was a spike lee joint!",Da 5 Bloods
110,nikitalinivenko,Black Rambo,6,14 June 2020,"This movie was announced shortly after Blakkklansman came out, and I've been waiting a year-and-a-half for it; so after such a long wait, I suppose it's only to be expected that I would be somewhat let down. This is Spike's second war movie, after Miracle at St. Anna (2008) (which amid all the slog, inaccuracy, pacing issues and flaws did have good scenes), and I hoped Spike would've learned from all the criticisms of that movie and presented a more polished war picture, but no such luck. Same trappings, 'present day' framing device intercut with flashbacks, melodramatic presentation present in half his movies, beating you over the head with the same exact Spike Lee-isms (we get it, Spike, you've been making the same point over and over the last 35 years), and, as usual, Zero attempts at subtlety (the in-your-face abrasive attitude worked for Do the Right Thing and Blackkklansman, but falls flat everywhere else). Seriously, it wouldn't kill him to show some restraint. The movie is over-long as well, clocking in at an unnecessary two-and-a-half hours, when two or so would've sufficed - the set-up alone takes an hour, with some unnecessary scenes and plots crow-bar'd in there.
The few action sequences there are are pretty typical Hollywood shootouts you've seen in countless action videos, and essentially the movie tries to present itself as an anti-Rambo, while at times coming close to sorta boiling down to a black version of Rambo. The plot centers around four vets who go back to Vietnam in present day to dig up a dead friend killed in combat, and more importantly, find a cache of buried gold a la Treasure of the Sierra Madre (they find the body, but then kinda just leave it there?). The references abound, most noticeably Apocalypse Now, which he fully embraces, and Delroy Lindo's death towards the end reminds me of the ending of The Thin Red Line, though that may have been unintentional; also, that was a jarring moment that threw me off - Delroy wanders thru the jungle, comes to terms with his friends' death, then abruptly cuts to him digging his grave at Vietnamese gunpoint. I was hoping for more of an 'epic', especially given the running time, but instead it's essentially a repackaging of Miracle at St. Anna, with the same themes and all (also, a Vietcong chick on the radio telling them they're country doesn't give a damn about them, exactly like the radio Nazi chick towards the beginning of St. Anna), and it ends with a shootout in a single location while they're pinned down and injured, exactly like St. Anna. I didn't hate St. Anna, but I was hoping for a different war movie this time around. What we get is Spike stuck in his ways.",Da 5 Bloods
111,troy-daniel-bush,Worst movie I saw in 2020!,1,23 August 2020,"It took me three sittings to finish this movie, and throughout each sitting, I wanted to die. This was so cheesy, cliché, and unsubtle! And I know that subtlety isn't Spike Lee's style, but the lack of subtlety made certain things incredibly overbearing.Cheesiness:
Fists in-They did this so many times, too.Melodramatic score-Part of the score was derivative of the Platoon theme! (This is personal! Platoon is not only my favorite Vietnam movie, but one of my favorite movies of all time!)Clichés:
Uh oh! The Vietnamese girl I slept with when I was over there gave birth to my child!Estranged son followed meCrippled Vietnamese boy with a tin cup begging for changeThere are things that are presented in the most unsubtle ways possible, such as
PTSDThe war isn't over for meThe Trump supporterSomething I absolutely can't stand in movies is when music plays when there shouldn't be any music! (Looking at you Now You See Me 2!) Especially, when the music is so cheesy! Like during the scene when he finds out that the Vietnamese girl that he slept with gave birth to his child. Or when they find his hidden gun! UGHHHH! Or when they find the gold. Or when the Trump supporter has a vision of his dead leader. That scene was so painful that I had to turn off the movie and come back to it a day later.The CGI blood and gunfire looked so bad!There are five kinds of dialogue in this movie:Clichéd:
""Where did the French go during World War II!""
""We Americans saved your a**es!""
""I don't have a pot to piss in or a window to throw it out!""On the nose:
""The war never ends for some people."" (Paraphrased literally just a teeny, tiny bit.)
""I lost it all. Bad investments. Back taxes.""Unnecessary:
""We all saw what happened to him. He stepped on a landmine.""Dumb:
""I'm the motherf***er.""Nonsensical:
""You're not home. You're not home.""There was some really forced stuff in this movie, too:There just happen to be a landmine on the side of that road!Why would you tell a girl you barely know about why your own father hates you?The son goes out into the woods to do his business and then he just so happens to hit a gold piece with a shovel! Come on!There's only one thing in this movie that I like: The presence of Chadwick Boseman. That's it. I just like him. I think he's cool.",Da 5 Bloods
112,douglasmcbroom,Saigon Less Better Blues,3,8 August 2021,"I am not a fan of Spike 'I hate America but I sho' am happy to take the money and live the lifestyle' Lee. If this film did not have the cast it has, I would never have tuned in. Lee, being the limited director that he is, cannot pull off the firefight scenes, but the many homage's to other Viet Nam films ('Apocalypse Now' 'Rambo' 'Missing In Action' 'Uncommon Valor' 'The Deer Hunter' and even 'The Treasure Of The Sierra Madre') are well done.Which brings me to that cast. I have always enjoyed Delroy Lindo. He elevates even bad films.Clarke Peters and Isiah Whitlock, Jr. Are my two favorites from 'The Wire' (in fact the title of my review for the wire is ""SHEEEEEEEEEEEIT""), also referenced in this film. Whitlock is also outstanding in Bryan Cranston's limited Showtime series 'Your Honor', also reviewed by me.The character of Lindo's son, David (Jonathan Majors), I presume is meant for comedy relief and to lower the demographic, and to take an important crap, but is annoying in the extreme.Of course, it's always good to see the late Chadwick Bozeman, as it is Jean Reno.Norm Lewis (Eddie) made no impression whatsoever.Of course, we have to work through the racist BLM/CRT screenplay to get to the enjoyment of the terrific performances, as well as, the superfluous French and Scandinavian characters.The script is a lot of BLM hooey, with the very interesting twist one of the characters being a MAGA Trump supporter. Unexplained, and a huge buy-in, is why these characters have taken so long to get around to getting back to Nam and finding the gold, as well as, it appears that they have not seen each other in decades, which given their shared secret and brotherly bond, is highly unlikely. There is also no way they could have carried all of those gold bricks weighing-in at 27.4 pounds each. The whole sub-plot with the land-mine hunters was ludicrous in the extreme. The plot twists and turns are absolutely absurd. The film completely falls apart.Acting 10, Movie 3.",Da 5 Bloods
113,ilikeimdb,Da Mess; Da Length; Da Lack of Judicious Editing,6,13 September 2020,"Seems Spike Lee has caught the George Lucas disease regarding pruning back an out-of-control bush of a movie. You have a couple of main themes in this very preachy but often action-packed movie about Vietnam War Vets trying to reconcile their pasts and improve their lots in life. But there's like three-movies-in-one here and Spike Lee seems to have fired the editor who should have removed 30 minutes of drag from this often dramatic effort. Interesting but overly long, sentimental in bizarre places, preachy nearly beyond redemption.",Da 5 Bloods
114,mbrcf,It kind of works and it doesn't,7,5 September 2020,"4 African American Vietnam was veterans return to their nemesis 40 years later to collect the remains of their fallen squad leader Stormin Norm (Chadwick Boseman-Rest in Peace) and the gold stash they had hidden. As with all the films that start with an ensemble cast, some of the characters end up having a more important/interesting arc, notably Paul (Delroy Lindo in a mindblowing, out of this world performance) who is to be joined by his estranged son David (Jonathan Majors) and Otis (Clarke Peters). What will happen in this journeyis the main theme of Da 5 Blood, the latest Spike Lee joint.This film is in one word, ambitious. It tries to address many, many issues and problems with war and humanity. It's about war and its destruvtive effects on countries and people involved, it's about racial inequality and racism, it's about greed, friendship, politics, father-son relationship, regret and counting. the film basically tries to be both Apocalypse Now and The Treasure of Sierra Madre, two great films at once, and as you can imagine, the result is scattershot.The film also has many highes and lows that are hard to believe to be made by the same filmmakers in the same film. Some of the scenes are so powerful, so effective that are petrifying and going to stay with you for a while. Yet at the same time, there are lines and sequences that are so bad they are straight up funny and dull (looking at you Jean Reno). This is a kind of film that is great and powerful, but also has some major weaknesses one can not close one's eyes on them.",Da 5 Bloods
115,krunalpatel11127,Da political blood,4,13 June 2020,Good movie .long could have been 15 minutes shorter didn't like first 15 minutes that's all,Da 5 Bloods
116,steveo122,artless waste of relevent content,5,12 June 2020,A collection of CLUMSILY DIRECTED/WRITTEN clamped-together-with-staples-and-duct-tape scenes filled with actors gamely selling unbelievable as best they can but now forever tarnished by association with a bad movie by a director who could have done much better,Da 5 Bloods
117,haydenluz,Da 5 Bloods,8,15 June 2020,"Da 5 Bloods, directed, produced, and written by my dude Spike Lee, is EASILY the best film of 2020 so far! Spike just has this true act for film making, and Da 5 Bloods is a true showcase for it. He has his own incredible stylish direction, with beautiful framing work to really set the tones throughout this unpredictable narrative. Just by this piece of art Spike created, you can not only feel his pain, but also the pain from the injustice to people and returning war veterans. Spike did a really good job clearly stating his beliefs, without jamming down his one sided opinions, making it more political than it needed to be.When your actors really bond with the director, you are destined to get art like this every single time! You can tell there was absolutely no drama or anything behind the scenes, all great ideas being bounced off one another. Between Kim Coleman's casting & Spike Lee's intelligent & powerful script, these characters all stepped up to the plate, and hit a homerun! Every single character put their heart and soul into their roles, you can just feel the passion in their voices! Spike Lee crafted these beautiful emotional scenes, that just sucked you in closer to all of the characters. The chemistry between the main characters is nothing short of seamless! It feels like they were actual war buddies, with their rugid bonds, yet meaningful actions towards eachother.",Da 5 Bloods
