,User_name,Review title,Review Rating,Review date,Review_body,Movie_name
539,kreams,So unfortunate,1,20 May 2021,"Some of the actors would were 12 years old when the Vietnam war ended. Why did they decide to set the heist in present day? It would have made much more sense to set it in 2010. Why did the characters wait so long to go back? Oh, I think I know the answer... They just wanted to rag on Trump. They make their one black conservative character into a mentally disturbed villain. It could have worked just as well set in 2010 with the one republican bad-mouthing Obama, and the actors would have been believably the age to do the physical things they did.Spike Lee wants to make everything about American politics even at the expense of the Vietnamese. He doesn't even address the fact that the gold they come to get was to pay the Vietnamese soldiers, so it rightly belongs to them and their heirs. But these characters are so obsessed about how America has done them wrong, they think they are entitled to it. So much so, that they will kill the Vietnamese whose land the gold has been on for 46 years. I guess this is what Spike means by 'any means necessary' which was added to his 40 Acres and a Mule logo.It's very ironic that they steal the gold from one communist country to by donated to another communist organization.Still, it had some good moments. A good editor who could cut an hour out of this movie and make it really interesting.",Da 5 Bloods
540,dealignment,Long time Spike fan but,5,24 June 2020,This movie is the crappiest crap crap that ever capped. Retire Spike because if you can release this crap you've lost it.,Da 5 Bloods
541,dcarey1-290-541650,What s shock!,2,13 June 2020,"Simply awful.Quite unbelievable that a respected artist would release such an epic failure. Shockingly bad writing, cinematography and wooden acting.",Da 5 Bloods
542,beckstrinker,Boring political lecture,3,15 June 2020,"I almost fell asleep within the first 45 minutes and had to force myself through the rest. There are interesting facts and valuable lessons packed in this movie, but sadly that is all this movie is. Every dialogue exists only to make a political statement, there is not one line without a Cristal clear agenda. The story on the other hand falls totally flat. If this was a 90 min movie with some hints thought provocing moments it could've been great, but this way It's just a very tedious 2 and half hour lecture.",Da 5 Bloods
543,claudiogalamini,"""Disaster movie""",1,9 January 2021,"I never write reviews but this mess deserves one.
Just watch it only if you don't believe all the bad reviews. And see for yourself that they are all true to the stinkness of this mess.
Special minus points for the horrible music, completely out of sync with any scene it was played for. After 20 minutesI couldn't wait for The End.",Da 5 Bloods
544,billyliggs,Very confused,3,12 June 2020,"Very poor film by Spike Lee. A good idea spoilt with a weak scrip, muddled flash backs and cultural stereotypes.",Da 5 Bloods
545,crltsz,How is this a 6.7/10?,4,27 June 2020,The entire plot is just all over the place. Seems like it changes constantly. The directing could have been better as well. Flawed acting. Weak sound track. Really did not meet expectations at any level. Wanted to like it but it's disappointing.,Da 5 Bloods
546,mashington_riley,Masterpiece,9,7 July 2020,"Innovative mixed media fusion, genre hopping, emotionally hard hitting, gripping, relevant, informative, gutsy movie. Funny as hell too.Delroy Lindo gives a performance of a lifetime that elevates the film to classic Vietnam war film status.Mark Kermode can eat... sheeeeeeeeeeit.",Da 5 Bloods
547,kfcwarrior6661,Propaganda movie,3,11 November 2020,"Came here knowing this was a tovarichsh spike lee movie.started ok but as it follows was your typical usa climax of today,anti white narrative.all white people in this movie are either bad or weaklings.the only white woman role in this movie is the most predictable from the first appearance to the last (the entire movie is predictable from 1/3 to finish actually)
and at the end BLACK LIVES MATTER support ?? Nuff said !",Da 5 Bloods
548,fernfilms-892-271775,Pathetic.,1,7 September 2020,Actually writing this while the movie is in progress with 23 mins to go.Absolutely pathetic and waste of my time during this pandemic.I would have gained far more intelligence watching the painting that's been on my wall for the last 10 years.,Da 5 Bloods
549,danjg999,"Lol, metacritic gave this an 81/100 based on race.",7,17 June 2020,Can't even trust them anymore. They did the same thing they did with Joker and Dave Chappelle's stand up special except in reverse,Da 5 Bloods
550,GirtisHolland,Spike should refrain from war movies.,6,14 June 2020,"I've loved and adored Spike movies since his beginnings. I expected the monologues, the ""trailed"" character in a scene of crisis a la his trademarks. He brought in some of my favorite aging black actors. Ultimately, the whole story felt incoherensive. Too many random players and no connection to any of them. Spoilers:
This was written and made before all these riots, but was released at the worst time possible. It has angles of hating Trumps, American domination, black degradation during war. Everyone's emotions are in shambles right now and no one of those protestors and rioters will relate in these confused times.Performance wise...spot on. Some of the finest black actors I could ask for and why why I wanted to see this movie.Ultimately, it reminded me of Miracle at St Anna. A throw away piece. Move back to BlacKKKlanan, Inside Man or 25th Hour. There's still statements, but it's not the days where School Dayz and Do the Right Thing work anymore.",Da 5 Bloods
551,danielwmackey,Creative storytelling,8,16 June 2020,"I never understood why Spike Lee gets so much kudos, so I was eager to watch this one. This film was pretty damn good. Parts were kitschy, but it was intentional; a typical war movie this is not. Delroy Lindo was a force. I've met men just like Paul, and his performance really resonated with me. I highly recommend this movie.",Da 5 Bloods
552,philnickisson,Pure garbage,1,19 June 2020,How does this film score 6.7 overall when you look at all the reviews it didn't get a score above 4... It is pure rubbish.. Stopped watching after an hour as I just couldn't take any more.,Da 5 Bloods
553,Movielovergurra,I don't get the bad reviews,8,6 July 2020,"I just saw this movie with 0 expectations. I didn't even know it was about Vietnam when i pressed play. There aren't that many Nam movies in comparison to World War 2 and maybe that is why i liked this movie so much. I don't agree with the critics. I thought the acting was great, especially from Delroy Lindo. I don't get the bad reviews but then again, i usually love movies that the majority hate and vice versa.",Da 5 Bloods
554,goodwins-79641,I thought it was great,9,12 June 2020,"Reading other user reviews here on IMDb, it's obvious this is a pretty divisive film. People are like you ""either love or hate this movie."" The truth is, some may love it, others may hate it. But there will still be those in between. For me, I thought it was great and one of Spike Lee's best yet.The story may seem predictable and not entirely original, but the actors bring the script to life in such a lively and energetic way that you kind of don't notice the cliche plot points. There are intense scenes throughout, especially one extremely tense scene that I won't spoil, but if you've seen it, you know exactly what scene I'm referring to.Overall, ""Da 5 Bloods"" is worth watching if you're a big movie person, or if you're just a casual Netflix subscriber looking for something new to watch. It's the cast and Spike Lee's directing that bring this film to life, and I was left satisfied by the end. If you don't like it, that's okay. Film is art, and art is subjective.",Da 5 Bloods
555,shandalaney,I Just Can't. . . .,1,15 June 2020,Taking this film in felt too much like work. Two and a half hours of my life that I can never have back.,Da 5 Bloods
556,jwwitch,Lots to process,6,3 July 2020,"At times truly beautiful in every way, but jumpy, and at times incongruous. A set of personal journeys, with many metaphors, references to roots of our troubles that are hard and true. Requires patience and thinking, so it probably won't do that well.",Da 5 Bloods
557,gvjoseph,Disappointing!,2,15 June 2020,"Great concept and subject matter on exploring black veterans returning to Vietnam. However, Spike simply did not deliver! As a long time fan and supporter, this movie was very disappointing!Phenomenal cast, but the characters looked the same age in the flashbacks as they did in the present. Difficult to get pass that. Attempted to watch the entire movie, but the downward spiral of what appears to be a rushed production would not allow me to do so.",Da 5 Bloods
558,littlejimm,Alot of these reviewers are trash,9,25 June 2020,"Well made gripping movie. Most of the reviewers here unfortunately don't have a grasp on the subject matter through the lenses of black Americans growing up in the seventies. Admittedly a very small lense but those were the people the film spoke to none the less.P.s. - they were older in the flashbacks purposefully, signifying them being of the same mind as they were then despite their different lives.. to me this was obvious but that seems to have gone over your heads.",Da 5 Bloods
559,newmoney-39838,Awesome Dynamic and Poignant a Must Watch!,9,14 July 2020,"So Many Caucasian Haters Because They Can't Understand Or Care To The Black Exoerience, Silly White People!!",Da 5 Bloods
560,robertbrown-63798,A Lee film?,1,19 March 2021,"If you need to watch everything Spike Lee has done, then watch it, but he is so much more talented than this reflects.",Da 5 Bloods
561,JoePesci1,A big disappointment,4,6 September 2020,"So many lame moments throughout the movie, I can't decide whether the writing was bad or just plain lazy. They couldn't even be bothered to cast younger versions of the bloods! We're talking 50 year flashbacks using the same 60 yr old actors. Absolutely ludicrous.",Da 5 Bloods
562,jackcameron-63549,Timely and Timeless,8,13 June 2020,"Four African American veterans return to Vietnam to hunt for gold and the lost remains of their fallen leader, Stormin' Norman. From the beginning it is clear that this is no return to glory, but a story of unfinished business.The film jumps through time creating a dichotomy between what the Bloods were fighting for and what they've been left with. A very affecting scene sees them listening to Viet Cong propaganda, sympathetic to the injustice towards Black GIs. Any sense of patriotism or American glory normally found in war films is conspicuously absent. Lee instead shows the war as a complex mess, reflected in the lives of the four men.Lee's imagery of Norman is particularly powerful, as he teaches his comrades about black history, encouraging them to use the gold to advance black liberation. He is an almost mythic figure (strong parallels are drawn between his death and the assassination of MLK), and when in his company the past, ironically, feels safer for the Bloods than the present.Lee inserts real footage and photography of Black activists, soldiers and icons. While the film has moments of levity and a sense of adventure the constant presence of history reminds the audience that this is not a work of fiction. It gives a huge weight to the film; the Vietnam war becomes a single moment in a struggle hundreds of years old. The Bloods do not seek to defend America but fight for the America that does not yet exist.A timely and a timeless film. As entertaining as it is informative and emotional, bolstered by consistently strong performances. Lee directs with his usual flare and style, but with a driven sense of purpose. An inversion of the war genre, changing Vietnam from a mindless horror to an obvious injustice.",Da 5 Bloods
563,matt-24001,Run for your life!,2,21 June 2020,"I'll preface this with the fact that I love Spike Lee films, 25th Hour being one of my all time favorite movies. This however is an absolute disaster. The concept is strong and you get a glimmer of hope that it might be good.....then the first 45 minutes ends. I truly wish I would have turned it off. The movie's constant reminders of the wrongs done to African Americans completely dilutes and disrupts any rhythm the film could have gotten and makes the entire movie well.....confusing. The script is flimsy and the dialogue is childish and comical (not in a good way), but we're supposed to be entrenched in the seriousness of the topic....or topics. If you're bored and like your intelligence insulted, this is the film for you. One positive note, Delroy Lindo was excellent. What a shame his performance is wasted on such a mediocre effort.",Da 5 Bloods
564,enercolombo,A good film,7,22 January 2021,It's an interesting movie. Some script choices are very bad. It's very cool the choice of switching the ratio for the flashbacks. The main actor plays a fantastic acting. Visual effects are not great. So there are many defects but it's entertaining and the 2 hours and 30 are not heavy.,Da 5 Bloods
565,mdesandoli,Mostly awful,2,18 July 2020,"The whole story just didnt come together. The music other than a couple of songs was just inappropriate -- took me out of the story more than once. Plot holes and poorly drawn characters. Some develop a lot. Some not at all. The interstitial flashes of black heroes took me out of the story. Graphically violent war stills -- lingering on a photo of a baby with its face partially blown off. Strange directing choices and dumb story points. Drawn out on parts, hurried in others. Death of friends? Move right along. How does the black-white struggle mean anything in a foreign land where both colours killed the locals? Is that struggle a greater horror than what was perpetrated in country? Was the war just a stage for race relations? Or was the movie about the soldiers and their friendship? Or no, maybe it's about PTSD and what war does to people. Oh wait,.it's about fathers and sons and daughters.I just don't know. Just a jumbled pile of muddled stuff.",Da 5 Bloods
566,aforbush-03680,Why pigeon toes?,4,14 June 2020,"I have so many questions about what the director and the writers and actors were or were not thinking about during this film.Why pigeon toes?
He almost took a dump on the gold?
Why were the clean lambs in the middle of nowhere at a most opportune time?
Why were all the actors old in the flashbacks?
How come none of them got shot?
Why was the pistol such a trust breaker?I really wanted to enjoy this movie but then my brain got hung up on the poor dialog, the inconsistencies and the improbabilities... oh and the Surprisingly graphic gore.I can't believe I am alone in this. Spike Lee is typically a better painter than this. It feels like he was phoning this one in.",Da 5 Bloods
567,popartportroe,unfortunate mess,2,14 June 2020,"Looks like they threw everything on the wall to see what would stick..result is a mess of bits from better movies...longest two and a half hour movie that I have ever had to sit through, I need a ""Shaft Fix"" and when do you need it..""Now"".",Da 5 Bloods
568,nikand-13355,Gritty moving,10,19 June 2020,Didn't think I was going to like this film but did,Da 5 Bloods
569,jlmanc,A real JOKE!,1,3 June 2021,Just a black infomercial. A bad soap opera with a second grade plot with third rate acting. Fine if you have two hours to waste.,Da 5 Bloods
570,ardr-32942,Could... but doesn't.,4,13 June 2020,"A film about black people and the exploitation by there own country (white supremacy) during the Vietnam war.Very simplistic view of events, sometimes through references to other films and some historical facts. Not a film that i recommend. Made in a hurry i guess, looks like a good high school project.",Da 5 Bloods
571,mjeffersonbrown,4 Stars.,4,13 June 2020,Falling a long way short with this film i'm afraid.,Da 5 Bloods
572,justusc,Top Tier Caliber movie,10,18 June 2020,"Spike Lee delivers in every possible category with Da 5 Bloods. Lee perfectly explains the realism of how African-Americans were affected by the Vietnam War. He also delivers with development of the main characters.
Which leads on to the Oscar-Worthy performance by Delroy Lindo who plays Paul in the movie. His performance is emotionally charged and incredibly powerful at the same time. It would be massively disappointing if he doesn't receive and awards for this performance.
In conclusion I heavenly recommend that you watch Da 5 Bloods On Netflix. The cinematography is one of a kind, the storytelling and characters may have you in tears, but overall it is a one of if not the best movies of 2020.",Da 5 Bloods
573,jordyvermote,"6.5 here on imdb, really? Whats wrong with people today?",9,1 September 2020,"This movie was so good in my opinion, realistic and real,the real truth about racism in the vietnamise war, i don't know what's wrong with people, maybe they are scared of the truth, but this movie was really good, 9/10",Da 5 Bloods
574,brianbrickles,A timely release from the master of Black cinema,8,12 June 2020,"This film is one of the best releases this year and it couldn't have been released at a better time.Minutes into the story of the veterans' return to Nam, we are reminded of the contributions of the African Americans in past wars and the greatness of the fallen is discussed in loving tribute. The foundation for audience buy-in is laid and we begin to understand the motivations of the ensemble's quest in their search for gold long lost.I enjoyed the camaraderie between ""da 5 bloods"" and the adventure that Lee has decided to showcase here.You will not be disappointed. Watch it today!",Da 5 Bloods
575,bluj-87480,Boring,1,21 June 2020,Was hoping for more. Story line predictable. Sup par acting. Odd cuts and angles. What a let down.,Da 5 Bloods
576,twoodard-75358,Was Expecting a Nam Movie,2,15 June 2020,"This Movie is a MESS!, I assumed it would take back in the War...Nope just flashbacks, and any squad doing what they did in the war scenes would have been killed, loud, shooting guns in the air, setting up camps with bamboo chairs and making fires going swimming without security...Ok I can look past that stuff, but the way they find the Gold which is why they returned to Vietnam I just stopped caring, I loved all the Actors, but the 3rd Act is just them yelling at each other, and some action, it gets ridiculous, a horrible Spike Lee Film I REALLY wanted to like...oh and it could have been a hour shorter easily. I of course laughed how a movie about Vietnam spike Lee was able to throw afew ""Screw Trumps"" in there, good grief, let it go. You make a movie about one of the worst political oversights in a War with different Presidents and thier Staff members who made it worse, and you call out Trump, but its your movie, unfortunately it Failed...maybe next time Spike, I still have hope",Da 5 Bloods
577,markandyuie,What Garbage ... Spike's latest effort to keep the pot boiling,4,6 July 2020,"Might have been a story here, but besides bad acting, it quickly turned into a BLM version of 'The treasure of Sierra Made'. Soundtrack featured real artists, and the music of a much healthier America. Black on black violence, over money, quickly becomes the theme, and paints 'da 5' in a pretty negative light. Save yourself a couple of hours, and help someone in need... a FAR better spend of your time.",Da 5 Bloods
578,danielm-28360,Very poor movie,1,18 June 2020,"Why not make it a masterpiece? Vietnam, coloured soldiers, PTSS, quilt and greed. Enough ingredients to make a real good movie. But this was unrealistic and inconsistent. Never exciting, just a dull story. Bad comedy mixed with bad scenery and bad acting. This was a real waste of time. An episode of the A-team has better plot and acting. Really pity and a bit of a disgrace for all Vietnam veterans.",Da 5 Bloods
579,DaggerDan,Ridicolous flashbacks,2,16 June 2020,"I really saw potential with this series and was looking forward to binge it, but when 75 year old men has flashbacks and the characters are still 75 years old is just bad.",Da 5 Bloods
580,chevan-81596,Beautiful Film by Spike Lee,10,12 June 2020,"A Beautiful film by the great director which hits all cylinders and tackle various issues. This film's shooting style has Spike's trademarks all over it.The plot follows 4 Vietnam veterans who go on a quest to recover their long lost treasure they have buried for decades as well as deal with some of their demons that haunt them since the war.
The acting is top notch in this film. Delroy Lindo steals the whole show putting on a performance for the ages. Spikes direction is brilliant with unorthodox camera angles that he chooses for every shot along with his cinematographer.In Typical Spike fashion, the film deals with racism, justice, politics and various individual philosophies. This film won't be for everyone especially for certain White people who don't get these type of films.I think this is one of Spike's best yet.",Da 5 Bloods
581,bdmc-21895,Spike Lee is a national treasure.,10,13 June 2020,"Da 5 Bloods is remarkable. From it's brilliant opening montage that shows black America has been warning full blown fascism was coming for almost a century to its explosive and haunting ending it's nothing short of a beautifully shot, densely plotted, ingeniously conceived cinematic tour de force of the highest caliber. Spike Lee has quite a few made masterpieces. DO THE RIGHT THING, MALCOLM X, 25th HOUR, 4 LITTLE GIRLS, WHEN THE LEVEES BROKE, HE GOT GAME, SUMMER OF SAM. Add Da 5 Bloods to that echelon near the very top. Prepare to be blown away and get chills at how eerily this film echoes the moment in history we are witnessing at this very moment. And Delroy Lindo's tragic performance will break you. Take that President Fake Bone Spurs 🤣. 10 out of 10.",Da 5 Bloods
582,turnerfreeman-2,Spike Lee has been my favorite director since 'Do the Right Thing'...,9,12 June 2020,"...before that, Stanley Kubrick, another director with a style all his own. With 'Da 5 Bloods' Brother Lee presents all of his cinematic flourishes in spades and I love it. Love the names of each of the leads, taken from the Motown act, The Temptations (a play on aspects of the storyline perhaps?) and the near complete Marvin Gaye ""What's Going On"" Lp as background sounds. Beautifully shot and well acted, there's little for me not to like. Some may think the Black history lessons running throughout the film are a bit much, and I can dig that, but I'm glad Spike hits us, the viewers, over the head with our history. We keep seeming to forget it.",Da 5 Bloods
583,iriskw1,Violence Against Other Minority is Woke?,1,14 December 2020,"So this is supposed to be okay if Black people are killing my kind, the Asians. What's the agenda here? Minorities killing other minorities is acceptable in Hollywood? How is this considered ""woke""? Another agenda driven bs.",Da 5 Bloods
584,bloedsackmaik,Not that good as I expected,5,12 June 2020,"I actually expected a lot more here and especially after Blackkklansman. Unfortunately, I was very disappointed. I do not deny that it needs such films, what he wants to show is absolutely necessary, especially now. But unfortunately you notice at all parts of the movie that it is a Netflix movie and I try to overlook something like that, but it was too much that shows that you had no time for it or also no desire.
Everything you should learn from it and what is also historically deposited, are things you need to know. These things are the strongest parts in the movie, and they make me so benevolent with my rating. Unfortunately, a lot of potential was given away here. Since I prefer now again ""Dead Presidents"" who points to the same historical injustice, only much smarter.",Da 5 Bloods
585,annelottevonk,Wtf?,2,12 June 2020,"Really??!! This is a movie from the great Spike Lee? Wtf? I am shocked that such a respected director could make such a weak and out of place movie about such an important, relevant and interesting theme (especially at the moment)!!! 154 minutes of poor choices, weak script, terrible dialogues and horrible music. 154 minutes of my life I will never get back!!It feels like the movie was taken right out of the editing room after only 5-10 % of the work was done, just for the benefit of throwing this movie into the world at the moment when the world is discussing the major issues of racism. This poor excuse of a movie did not contribute to the discussion in any way! How did this ever land on Netflix, do they not have a quality filter??!",Da 5 Bloods
586,whelandexter,totally not worth your time,2,13 June 2020,"Awful movie. So many bits that could be great, so many cool artsy directions taken but overall a long dull mess. Pacing was all over the place, music was cool but ill suited to many scenes. The action scenes didn't make sense multiple times. The constant monologues interrupting the pace, that guys voice got super annoying towards the end. The character development was erratic at times and other times went about in crazy leaps and bounds. The plot was loopy in some areas. The entire first half of the movie couldve been cut in its entirety honestly it was practically a separate movie from the second half. Overall me and my family did not enjoy it and we are avid movie fans of all genres. This movie was just a big a$$ stretch, it really couldve done with more editing. I honestly feel any notoriety this movie will get now is because of its release time coinciding with the big BLM movements of Jun 2020.",Da 5 Bloods
587,dthelamb,Wanted to like this...,1,15 June 2020,...but nope. Was about as hollow as a movie could be.,Da 5 Bloods
