,User_name,Review title,Review Rating,Review date,Review_body,Movie_name
65,ritera1,You've Seen It Before...but That's Okay,6,10 August 2012,"It's been done. Been there, done that. But you've seen pretty ladies before and that doesn't get old.Not without merit. Money was well spent and it's paced well. Good action scenes and a lot of them. Had a good grit that I wasn't expecting.The standouts were the bad guys. He was very good and menacing and the angle of incest with the bad-girl daughter was risqué.But too much story time goes by between when the bad guy has the mask and he executes his final plan to activate it.Conan was too small, though. And growled too much. For all his clear drawbacks, I miss Schwarzenegger. He fit these big guy roles and had good screen presence. I guess it's harder and harder to find 'roids these days.",Conan the Barbarian
66,ccmiller1492,Incomprehensibly and unfairly underrated....,8,21 January 2017,"Apparently those who have not actually read and enjoyed the original Robert E. Howard stories are responsible for this film's incomprehensibly and unfairly underrated status. It's far superior to the earlier attempts and much truer to Howard's characterization. As a film it's also superior to such bloated and underwhelming projects as ""Prince of Persia"" and ""Gods of Egypt"" which were little more than boring big-screen video games with non-existent or nonsensical plots. The abundant action proceeds briskly and the film looks stunning. It's an excellent introduction to the Conan character with Jason Mamoa doing the barbarian proud. Unfortunately it's generating more fans from the DVD release than it did while during its theatrical run, which is probably going to preclude more of the Conan stories being filmed, on this scale at least.",Conan the Barbarian
67,martinrobertson300482,I'm not really into Sword and sorcery movies. But Conan seems too lead the way...,7,30 August 2011,"The Original ""Conan the barbarian"" was meant to be the beginning of a series. But for whatever reason only 2 films were ever made starring 80's action star Arnold Schwarzenegger. I don't know why they felt he was irreplaceable as the lead character (Although I like Arnold, I'm sure he was chosen for his muscles over his acting skills) seeing as the character had been around long before he ever was. This is what happened however, and so production on further ""Conan"" films stopped.Too me, it really feels like another Conan film is long over-due. The Only complaint I really have is that they chose to do a remake or reboot or whatever you want to call it when I'd off preferred them to do something different from every other franchise, and maybe just do another sequel. They'd have got away with that I think. Either way I guess this is intended to be the restart of a series they hope to get right this time, and from what I've heard, fans of the original ""Conan"" stories (who were less than thrilled by Schwarzeneggers efforts) are loving this so who am I to judge? As a stand alone movie I can honestly say that it REALLY didn't want me to be bored by it, but it kind off did get boring in parts because of its constant action and noise. The story was about as straight forward as they come, but some of the action was pretty cool and I was surprised by its violence and nudity. Not that these are good things but it made it all slightly different from other PG-13 Sword and sorcery films I've seen, and apparently reflects the style of the source material so it was all good.",Conan the Barbarian
68,ccunning-73587,At the end of the movie I was just left wanting something better.,4,10 October 2019,"A decent movie, not a very good movie, and certainly not a great movie. When I ordered this movie I believed that I was ordering the original Conan, The Barbarian, with Arnold. I watched this version with an open mind but was left wanting for several reasons. I felt the story dragged in places and changed directions a couple of times. The actors weren't that handsome/attractive. There is something about Jason Momoa's face, syphilitic birth, genetic disorder? Rachel Nichols was attractive but she is playing a princess, aren't there any glamorous actresses in hollywood anymore?!? Many scenes seemed like slap stick action. CGI dominated the movie so many scenes were little more than a Saturday morning cartoon. hollywood had to through in the PC scenes with the anti-slavery dialogue. At the end of the movie I was just left wanting something better.",Conan the Barbarian
69,Tcarts76,A entertaining remake of a really bad movie,7,27 September 2012,"OK, yes, I gave this movie an 7, and here's why. It is what it is, Conan The Barbarian. It is a new remake of an old, low budget, Arnie Schwarzenegger, James Earl Jones movie that gained fame for arnie the Bodybuilder and attracted a somewhat oddball cult following. If you have never seen the original check it out, it fell into the category of so bad that it was good.This updated version very loosely follows the original, but mostly throws it out the window. It's a fantasy movie about a barbarian, people, so I don't want to hear other reviewers ripping it to shreds for not being Oscar worthy. When you watch a ""Barbarian"" movie, expect to be entertained by swords, blood, and death, which this one has. I won't get into any plot details here, you can scroll up and read them yourself because honestly this isn't a movie that is really watched for a detailed plot.This is far more of a visual pleasure than the old movie, and much more watchable then its 1980's puke of a movie. I do think it should have included more sex and debauchery, but thats just me. Rachel Nichols is the female lead that is told that she will meet a warrior, and of course Conan is it. She looks better in every movie she has done.So everyone out there trashing this movie, saying things like HBO does it better, guess what? Game of Thrones, Rome, and Spartacus (Spartacus sucked anyway) were well thought out drama's not remakes of a horrible 1980's no budget 'barbarian' movie, so put on your thinking caps and don't be an idiot thinking you are going to get another installment of your favorite boy love fest such as The Lord of the Rings, or The Hobbit. Conan isn't going to drive you from your mom's basement, make you turn off your World of Warcraft, or make you worship at the alter of a new avatar. This one is mindless entertainment and that was what was intended.Like my reviews? Hate em? Questions, comments, want me to review a specific DVD? shoot me an e-mail at subliminal.lithium@gmail.com",Conan the Barbarian
70,AdrenalinDragon,Soulless reboot with no identity,3,29 March 2021,"This Conan reboot was pretty terrible. While I didn't think the original Conan films were all that great, they at least had a certain charm and identity to them that made them feel like their own. This new Conan the Barbarian was so indistinguishable from any recent Fantasy Action movie that honestly I wouldn't have guessed Jason Momoa was supposed to be Conan. It could have been anyone and I wouldn't even realised it was supposed to be Arnold's equivalent. He doesn't have any personality here whatsoever.There's no memorable score, most of the action is generic filled with CGI blood, it's poorly shot and edited in many spots with slo-mo, everything feels fake, and outside of some decent actors being in here and maybe a fight or two, it's forgettable. Sure it has money behind it on production values, but like I said there's nothing that distinguishes this from a weak Fantasy Blockbuster. You could tell with the original there was heart and effort put into it, but this felt soulless and a waste of time. Avoid like the plague.2.5/10.",Conan the Barbarian
71,blrnani,"Disappointing, despite low expectations",4,5 February 2018,"Things got off to a poor start with Morgan Freeman's unconvincing audio introduction and the pause for Conan's father to perform a lightning C-section on his dying mother in the midst of a violent battle.
Then it started looking up, as we see the young Conan as an impetuous anger-filled youth who is already skillful enough to take down a group of marauders all on his own. He is then given good reason to be angry, as a new invader destroys his village and leaves him in an impossible situation trying to save his father's life. the father has the wisdom to end it himself, to assuage any guilt. But there's always revenge as a motive.
Then the youth has grown into a hulk (better explained in the Arny version), yet the rage seems to have evaporated, even if the desire for revenge still drives him. Nonso Anozie is a fun character who leaves all too soon (and will be disappointed the flop is unlikely to generate the equel he deserved). Then we meet the ambiguous Rachel Nichols, who one moment is an admirable self-sufficient match for Conan and the next is behaving like a helpless screamy slasher movie victim.
Stephen Lang's villain is of Shakespearean roots, more prone to explaining his villainy than actually inspiring terror. And as for Rose McGowan's witch, it must make even the most ardent appreciators of her denunciation wonder what Weinstein saw in her in the first place (perhaps weirdness inspires weirdness).
The combined result is that, for all the action, one finds oneself not really caring much about the outcome, especially as it is clearly established that good will overcome evil (ok, so Bond always wins, but at least there are convincing obstacles in his way).
The whole thing makes me wonder what we reasonably expect from a Conan film. The Arny original is a classic, but despite nice touches and humour the three weren't exactly great movies, let's be honest. I suppose the closest to the ideal was Vin Diesel in The Chronicles of Riddick, with a great warrior who is also clever and whose qualities attract followers to the cause. If he has to be muscle bound then I suppose one thinks of Dwayne Johnson in The Scorpion King. The key is a good story that is convincingly acted (room for humour and romance optional).",Conan the Barbarian
72,jdring2007,fun enough to enjoy; don't compare to original,7,17 May 2021,"The first/original, iconic as it was technically bad, cannot be compared to. It's Arnold Schwarzenegger afterall. Ironically, as big as Momoa is NOW, in 2021, and as better of an actor as he is, he would've portrayed Conan with improvement. Nonetheless, what we get here is an enjoyable and gory sword-and-sorcery movie, with impressive (or at least very entertaining) swordsmanship, fight choreography, and the general theatrics of all of it is straightforward fun. When I first watched this movie I was very disappointed, because I tried comparing it to the original. But watching it as its own movie, it's good for what it is. Also, I love seeing Rose McGowan play an evil b...witch. Witch, yes. And, Stephen Lang never disappoints as a bad guy.",Conan the Barbarian
73,calicut110,Definitely better than I expected,5,15 May 2021,"It's not a great movie let's be clear. That said, we watched this one rainy day and were thoroughly entertained. Jason Momoa does a respectable job with a pretty weak script.",Conan the Barbarian
74,MickeyTheConstant,Pretty average,5,13 January 2019,"This had a real made for TV movie feel about it. Production values and cinematography was really poor. At times it felt like one of the old Hercules or Xena tv shows. Mania looked the part and did an ok job but the acting was pretty lame, not just by him but most of the rest of the cast. The baddies were very sub standard also. Even though the main villain was supposed to wield loads of power when he wore the mask Conan managed to beat him quite easily. It was just all very average. Arnie was loads better I am afraid. Watch the original.",Conan the Barbarian
75,larryanderson,Terrible re make.,2,8 August 2020,"Dreadful CGI nightmare of flashing images. The director said ""I head that the best horsemen came from Bulgaria."" WHAT ??? Stupidest thing I ever heard anyone say.
The man couldn't direct a backing-up garbage truck.
Don't waste your time watching this junk.",Conan the Barbarian
76,achyutaghosh,How not to make a remake,5,16 December 2011,"Back when i was a kid, a certain Mr.World with his rippling body, and stone faced persona inspired both shock and awe. When he brandished his humongous sword and swung, nothing else really stood a chance, and all you remembered at the end of each scene were those mesmerizing muscles. The choice then was pretty simple- you either worshipped Sylvester Rocky Stallone, or Arnold Conan Schwarzenegger, and i proudly belonged to the latter club. So when the movie that made him endured a remake in 2011, it naturally made me curious, and more than a tad expectant. A cult classic sword and sorcery remade with a rising action star, big budget effects instead of the campy, and of course, a million pounds of fan- expectations.But then remakes suck, right? And so did this disgrace of a movie which started to suck right from the first scene where they show Conan being birthed right in the middle of a battle. And in this genre of movies, the plot is of little consequence as they always follow the revenge theory. Conan's father and tribe is slaughtered blah blah blah...Conan wants revenge blah blah blah....lots of people die in his quest for revenge blah blah blah. What made the 1982 version a classic was, besides Arnold, the portrayal of a dark and desolate world, complete with savagery and sorcery. This one just moves from one action set piece to the other. Coming to the good part- is the action, no longer ponderous but fast, no longer basic parry and thrusts, but much more stylized and pleasing to the eye, more like a dance most fight sequences were. The violence is gruesome, but after a while, even those without a taste for blood will start to appreciate it, because frankly, this is all the movie has got. Jason Momoa played Khal Drogo with panache in Game of Thrones, and here he takes it a couple of notches higher. Arnold, for all his physical perfection never really was a natural to action, Momoa, on the other hand takes to it as a fish takes to water. There is this perennial bloodlust in his eyes, as also in the little guy who plays junior Conan in the early part of the movie. But then what maketh a star? Charisma! And since Arnold had oodles of that, Momoa had big shoes to fill in, and he turns up short. If a great hero makes an action movie enjoyable, a kickass villain makes the confrontation, and hence the movie, memorable. Sadly, Conan the Barbarian has an incompetent villain, one who couldn't even scare a cat, let alone enslave the world. Can all of us movie fans sign petitions to stop remakes? Remakes taint childhood memories. My memories are dear to me. Watch Conan the Barbarian without too much expectation, maybe you will come out with only a wince.",Conan the Barbarian
77,lovecraft231,The end result feels lukewarm,4,23 November 2011,"When it was announced that a remake/reboot of one of my favorite action movies, the John Millus sword n' sorcery classic ""Conan the Barbarian"", I was one of many that was unsure of the idea. I mean, on one hand, I think it's not the best idea, but on the other, the 82 movie is more Millus and Oliver Stone's take on ""Conan"" than it is the Robert E. Howard creation. I didn't see the movie in theaters, so now that it's on DVD and Blu-Ray, let's take a look.Opening with a prologue narrated by Morgan Freeman (okay then...), we learn that Conan was born on the battlefield. By that, I mean his father Corin (Ron Perlman) delivered a c-section on his mom during battle. Why a pregnant woman is fighting in war is beyond me, but hey. Years later, young Conan (Leo Howard) watches his village and people become destroyed, and his father killed by warlord Khalar Zym (Steven Lang) and his men.As an adult (Jason Momoa), Conan is a thief and pirate, who finds Lucius (Steven O'Donnell), who was one of Zym's men that he disfigured as a child. After getting some information out of him about the whereabouts of Zym, he finds out that he's a name known across Hyboria, and he and his daughter Marquis (Rose McGowan) are searching for the pure blood princess Tamara (Rachael Nichols) so they can bring back Zym's wife and enslave humanity. So now, Conan must save the princess and save the world in the process of his quest for vengeance.If there's anything the new ""Conan"" really gets right, it's the casting of Momoa as Conan. Simply put, he feels more like the Conan of the stories, as he's not just some brute. He's intelligent, hatches plans, has goals, and can talk fluently as well as he can go into violent rage. The action scenes are also very well done, and bloody as hell, while the sets look like the Hyborian age of the stories. Also, Perlman does fine work as Conan's father, and Lang delivers a fun (albeit scenery chewing) performance. McGowan meanwhile...she's not good, but she vamps it up so much that I kinda liked her. Finally, while it's nowhere near as great as the original, the score by Tyler Bates does it's job-I especially like the Celtic touches.Sadly, that's where the positives end. For one thing, the direction by Marcus Nispel (whose ""Friday the 13th"" remake I enjoyed) is the definition of nondescript, as little of it feels epic or fun, and lacks the edge of the original. The story meanwhile, is incredibly dumb, and feels like it was rejected by the SyFy channel, while the script is filled with holes and bad dialog (while Momoa is great, I had to cringe when he delivered lines like ""I don't want your gold-I want your head!"") The conclusion is also lacking, as it feels anticlimactic, while the rest of the performances-especially Nichols-are all pretty poor.Which leads to my biggest complaint-the movie lacks fun for the most part. Sure, the action scenes look great, and there's moments that let us know how much of a bad-ass Conan is, but as a whole, it doesn't have the adventurous, pulpy greatness of the original stories. This is a movie with a man who doesn't take any s#!t, has a code of honor, and is an all around certifiable bad motherf@@#er who gets girls, kills villains and is tougher than nails. Yet, while it has a great Conan, the story, direction and plotting feel beneath such a character. The end result feels more like a studio patch-job in which they went ""Okay, we've got a well known property, let's do make a movie with it"" without doing much and ignoring what the final product might look like.It's a real shame too, because there's some stuff I really like here, and there's a fun movie hidden somewhere. However, the end result just feels lukewarm, and isn't anywhere near as enjoyable as it should be.",Conan the Barbarian
78,Ar_Pharazon_the_golden,New ideas required,5,25 August 2011,"The problem with Conan is one most films of heroic fantasy seem to have and it's the scenario. You don't expect deep meaning or indulging in philosophical quests, but you'd think they could do more with the characters and the dialogue. Jason Momoa is good as Conan, but then again he doesn't have to do much more than hacking and slashing. The secondary characters, including the girl, are just supplementary so he can talk to someone. The villains, who should in my opinion be the most complex, aren't much better either. Stephen Lang may be a good actor but doesn't do much with Khalar Zym, even though there was some room for character development. As for Rose McGowan, I'll remember her kinky outfits, but with around 15 lines in the film, most of which are variations of the same, that's about it. Ron Pearlman seems to be the only one who can put some soul in his short, but memorable role. Other than that, the battles, landscapes and atmosphere were good, if unsurprising (except for some fallen columns in the middle of the forest - didn't someone see that this is simply non-sensical? Who put the columns there without the rest of the building - without even cutting the trees!?). What could have, despite all these, saved the film, would be a soundtrack such as the unsurpassable one for the 82 film. Even the narrator there sounded so much better. But that was the one thing you couldn't really ask for. All in all, it's certainly not a waste of time and money to watch the movie, but I just wish they bothered to work more on it - the swordfight/kinky dress/dangerous bridge formula doesn't work so well anymore.",Conan the Barbarian
79,Jonathon_Natsis,A meandering cluster of 'been there's' and 'done thats.',3,31 August 2011,"Another month, another pointless, Hollywood, cash cow remake. But this one is a little different. As is the case with most uninspired reboots, the audience leaves the cinema, agreeing almost in unison that no man or woman should have ever attempted to remake such a classic film in the first place. This is not the case for Conan The Barbarian (a remake of its 1982 namesake starring The Governator), only because the original isn't exactly considered a masterpiece in its own right. Unfortunately, that doesn't mean we ought to treat this modern adaptation with any greater leniency.Conan (Jason Momoa) was always destined to be a warrior, born on the battlefield and raised to be a skilled fighter by his father Corin (Ron Perlman). After he is forced to watch the murder of his father at the hands of Khalar Zym (Stephen Lang), we fast-forward twenty years, at which point Conan continues to seek revenge. This leads him on a perilous journey on which he must save Hyboria and seek personal restitution against the man who slaughtered his family and village.The quality of the script is almost a moot point at this stage, and I fear such a criticism is becoming a recurring theme every time I review a film of this nature. I don't need to go on about the excess of clichés and failure to use dialogue as a means of character development because, quite frankly, it's all been said before. I'll just start and end by saying it offers no food for thought, nor was it expected to.If the title of the review hasn't already given it away, I didn't enjoy Conan. But in fairness, the only aspects blockbuster films like this try to leave in the mind of the viewer are the set pieces. In that respect, the action scenes were not terrible and, at the risk of pointing out the obvious once again, you can definitely see where most of the seventy million dollar budget went. All action scenes show a decent amount of technical production and attention to detail, but they are let down by lazy camera-work, employing the old 'zoom- in-really-close-and-leave-the-audience-disoriented' trick (not unlike the style employed in fellow swords and sorcery remake Clash of the Titans). But for anyone going to see this film just for the stylised killings, you'll be pleased to hear gore is on high enough supply to garner an R rating. And trust me, it is justified.Conan The Barbarian's flaws range from minor to significant as the film progresses. For instance, Perlman makes no (or at least, minimal) effort to shed his American accent for the role of Corin, while early scenes depicting the birth of Conan and the way he fights off half a dozen seasoned warriors on his own as a teenager require a huge suspension of disbelief. Which, by the way, is the polite way of saying they make no sense. Some time later, we are treated to a 'mentor-protégé' training montage that manages to rip off Star Wars and Batman Begins in the process. I know, I of all people am often guilty of crossing the fine line between discerning adaptation and plagiarism, but the blatancy in this instance is almost laughable.As the film draws to a close, the sheer mundanity of the plot gets to the point where, in retrospect, my eyes, ears and mind have been taking in and understanding the events of each scene, but I have never truly engaged with the story. Throw in a predictable ending to finish and you've got one of the most unnecessary movies of the season, and maybe even the year.*There's nothing I love more than a bit of feedback, good or bad. So drop me a line on jnatsis@iprimus.com.au and let me know what you thought of my review.*",Conan the Barbarian
