,User_name,Review title,Review Rating,Review date,Review_body,Movie_name
226,upstreamtuna,"Not as bad as everyone says it is, but that doesn't mean it's not bad.",5,22 August 2011,"Let state a few things before I start saying things about this movie. 1: I have not read any of the books. 2: I am a big fan of the original 1982 film.Both of those being said, I can start talking about this movie.It starts off alright, with a voice over from Morgan Freeman (if they put that name drop in there, I'm sure this movie would have been more successful) telling us the background of the world we are about to enter.Now the first scene, is the scene that confused my emotions so bad that I actually almost thought this movie would be awesome. This scene is when Ron Perlman guts his wife and pulls out there son so she can see him before she dies from a wound obtained in battle. She names him Conan, and then does one of those cheesy ""turn your head to the side and stick your tongue out when you die"" moves. And then Ron Perlman holds up the most atrocious looking CGI/animatronic (I'm sure it was more CGI though) babies I have ever seen. This made me laugh SO hard. And I thought if they kept pulling cheesy stuff like that out their asses, this movie could actually be a fun time. We get more fun, as Conan is a little more grown up, and is now a young boy. Our first action scene is Young Conan fighting off growling wild- men. After that was over all I could say was, ""BADASS!""Soon after, Perlman is training Conan to fight, and we see that Conan is not yet ready. He storms off into the woods throwing a temper tantrum, and hears the sound of horses hooves. This is the evil, Khalar Zym. He invades Conan's village, looking for the last piece of a magical headpiece. He kills everyone as far as we know, except for Conan and his father. Khalar ties Perlman to a bucket of lava hanging from the ceiling, Perlman is chained to said bucket, and if he moves he dies. Khalar's daughter finds the last piece to the mask, and they storm out of the village burning the barn that Conan and his father are currently residing in. Conan is tugging desperately on the other side of the chains, to keep the fire/lava from falling on his father's head, but his father takes it upon himself to do what must be done. He pulls the bucket of scorching hot fire atop his head (kind of how Momoa killed the asshole from Game of Thrones... *wink-wink*).Nothing of much importance happens after that. We get the same-old, same-old, story line of most the straight to Sci-Fi movies. Hero: CHECK! Damsel: CHECK! Evil baddie related to hero's past: CHECK! Other baddies killed off one by one and given NO development: CHECK! Evil daughter of the main baddie: CHECK! Incomprehensibly boring action sequences: BIG CHECK!To describe what happened in the span after the first 30 minutes and before the last 30 minutes, read above. None of it is really that important.So after all the stupid stuff is over with, Conan regroups with a man that he met before, after the love interest (Tamara) is kidnapped by the main baddie, Khalar Zym. Typical. This man gets Conan into the big castle-thingy-that's-not-really-a-castle and upon arriving, we are thrust into the fun last 30 minutes (Which involves about 10 minutes of Conan fighting goons and the last lesser baddie, while trying to avoid being devoured by a huge octopus thingy, and also trying to save his ""friend"" that got him in there in the first place). After all is said and done, Conan parts ways with his ""friend"" and goes to save Tamara. He has some fun swordplay with Khalar Zym and then runs away from him. He goes to save Tamara from Rose McGowan, kills Rose McGowan, runs away from Khalar, and then confronts and kills Khalar.NOT AT ALL like the 82' version. And I'm glad they didn't try to remake that version. This one is more of a reboot.. (If you can't remember Arnold left the Conan series because he didn't want to be type-cast as the sword toting badass that he was in the Conan movies. So we got 2/3 Conan movies.. Barbarian and Destroyer, and the last one was never made.. this is most likely the reason they made the 2011 version, so they could tell the story without ruining the Arnold series).Bad acting, horrible story, and atrocious character development ruin this movie. The only good saving aspects are the lead actress Rachel Nichols, and the first and last 30 minutes... But the number one reason I don't prefer this movie, is because there is no Arnold. Not even a cameo... (which is silly, because Lionsgate distributed this film, and one of their first films ever distributed was Terminator 2. At least pay the guy who got this company off the ground his respects with a cameo!). You don't need to see this movie. Don't look for it on DVD, but if you see it on cable or HBO around this time next year, go ahead and watch it. But you really don't need to.2.5/5",Conan the Barbarian
227,manunderyourbed,Should have been all about this Leo kid.,2,16 November 2011,"I'm sorry, but Conan the Hawaiian was a sheer disappointment. I'll give it: 2 stars for Sex, 3 stars for Naked Breasts, 1 star for Blood and Guts - Lots of blood, but very little of it made any sense. 1 star for Surfer Conan - Arnold Conan would have wiped the floor with him. It was like a made for TV movie before they made really good made for TV movies. 4 stars for Kiddo Conan - If the movie was about Leo Conan, it would have rocked. That young man brought ferocity and vigor to the table that was believable. 3 stars for Scenery. Some of the landscapes were intriguing and very creative. 1 star for Plot Line. 2 stars for Dialogue. 1 star for Immersion. Verdict: 1 star. If it was 3 am and all I had to watch was Conan the Hawaiian, and two infomercials - Diaper Genie and Wesley Snipes uses Total Gym, I'd totally get into the Diaper Genie.",Conan the Barbarian
228,user-828-592263,Not enough to be Good,4,23 November 2011,"1. Don't let your kids to watch this movie, this is not a fairy tale: they will see rivers of blood and ridiculous violence almost every minute. Plus, all this is pointless in this case. It doesn't add to the brutality of the title.2. Jason Momoa is not a great choice. Conan is too soft, clean, sweet and handsome. He tries to be brutal, but it doesn't work in my opinion. 3. I don't like the word ""remake"". This is a different movie. I wouldn't compare. It is as bad/good as it is. 4. Script is a bit shallow. This could make an average TV show for a couple of seasons. Acting & directing is average as well. 5. Overall looks pretty cheap, even knowing the budget. Final thoughts: average movie, could be much much better. Many things went wrong.",Conan the Barbarian
229,acolu7,Conan The Terrible,1,21 August 2011,"First of all, before I say anything about the movie I want people to know a little bit about me. I went into this movie with an open mind wanting to see it anyway despite the horrid reviews it's been getting from critics. (I generally tend to ignore the critics especially for movies that I personally think will be worth seeing in theaters) the trailer looked pretty cool for this one, so I went in expecting at the least an awesome super gory action flick. What I got was the total opposite and a huge disappointment for me. The critics are right. Conan the Barbarian is overall an absolutely terrible movie.To be fair, the movie actually starts out with some promise showing us young Conan and a really brutal kick-ass action scene with young Conan in the beginning. After the beginning sequence though, the movie starts to fall apart rapidly. The dialog is extremely weak and uninspired. I kid you not, Conan probably says a maximum of forty words or less throughout the entire movie. Whoever wrote the script seemed like they just stopped trying and gave up after the promising beginning scenes.Another thing that I found really disappointing was that Conan himself was just not brutal enough. Only for short moments here and there he did some barbarian like things but not at all on the level that you'd expect from a movie titled ""Conan The Barbarian"" The action scenes themselves were just not filmed well at all. It was filmed using very fast paced cuts and it was very confusing to keep up with what was happening on screen. The camera always seemed to be lagging behind the action, and just when it finally catches up with Conan to see what he's doing, the bad guy is already dead. Great. The plot was a jumbled mess and the acting pretty much on every level, was completely horrendous. Personally I am a fan of Jason Momoa. After his performance as the savage Khal Drago on the hit show ""Game of Thrones"" I thought he would be absolutely perfect to portray Conan, but sadly he is very weak in this role and really adds nothing new or interesting to the character. One more thing to be mentioned is that the 3D in this movie is non-existent. (Yes I saw it in 3D and don't think I am bashing the movie just because the 3D was horrible) The sad truth is even if I saw the regular 2D film I would still think the same about it. It is just that bad of a movie. I dare to say that even 10,000 BC was better than this movie. (And that movie was terrible) At least in that movie you could tell what was happening during the action scenes. I strongly felt the urge to warn people not to waste their hard earned money on this movie. Trust me you will thank me for saving you the money. But, if you are dead-set on seeing it for yourself anyway despite what I have to say DO NOT see it in 3D it really is just an extra waste of money. Think ""Clash of The Titans"" not one thing in the entire film is 3D except for the ending credits. Avoid this film at all costs. 1/5",Conan the Barbarian
230,dunga2000,"Again, Marcus? Seriously???",4,2 May 2012,"Ladies & Gentlemen, presenting Marcus Nispel, the new master of close-but-no-cigar remakes/reboots/adaptations of cult classic horror/sci fi/fantasy flicks that didn't need to be remade..! Let's check the roster: Texas Chainsaw Massacre, Friday the 13th, Pathfinder, finally Conan. Why Marcus? Why Hollywood? Why, why, why??? Okay, the guy has a good eye. Maybe he's more of an artist than a filmmaker. The flicks do look good, credit where it's due. Maybe he's less to blame than the writers, editors &/or execs. Whatever, the track record is disappointing: tons of potential, tons of cool ideas & visuals. He just hasn't quite been able to pull it off. For my money, Conan is the biggest disappointment of the bunch. Having read and enjoyed all the original Howard books, collected quite a few of the comics during the 70s & 80s, and even enjoyed the Arnold movies (in spite of their issues), I'm a fan/quasi-expert. That in mind, gotta say it, get your stone-throwing arms warmed up: Momoa makes a good Conan -- waaaayy better than Arnold! He could be a tad bigger to truly dominate his surroundings (several of his opponents are bigger than he in the new movie), but he nails the character. The swagger, facial expressions, grace, attitude are all right out of Howard's pages. And he doesn't cry out like he's pumping iron every time he takes a hit! Arnold was truly laughable in almost every way, more Zamoran buffoon than stoic Cimmerian. Entertaining, but no Conan. Momoa holds up his end, to the extent the script allows. (He even has the good taste to be with Lisa Bonet, post-Lenny!) My only other criticism is that Momoa went on record to say that Khal Drogo would kick Conan's ass. What are you, high??? Drogo made it (almost) through one book and an infected wound; Conan survived countless injuries worse than that one, and 12 original books. Get serious, Jason... The editing here is choppy, the plotting rushed and yet meandering, and the source material forgotten and forgettable. Please, newer fans help me out: Do the central characters and places even exist in the printed Hyborian world? Call me on my mistakes here, but I don't recall major villains named Khalar Zym or Martique, a heroine named Tamara, sidekicks named Artus or Ela-Shan, evil henchman named Akhun, Ukafa or Remo. I don't even recognize most of the place names in this flick. Am I just way out-of-date with the mythology of the comics? Or did the filmmakers really just come up with this stuff out of thin air, to make a whole new story? And if so, WHY??? There's not enough already written to choose from?? Per the featurettes, this movie drew on ""eight decades of source material"" to make the best Conan story ever. If that's so, why is it so unfamiliar to us? So disappointing to the fans? What happened to the idea of the climactic rivalry between Conan and Thoth-Amon the Stygian sorcerer (forget the laughable Toth-Amon from the second film)? A few name changes and they could've worked that angle here. What about the long lists of buddies and lovers with an actual history. What about the idea of making a classic labor of love project like LOTR, instead of pushing for yet another summer blockbuster that'll probably go bust (can you say John Carter)? Guess we may as well ask why all the Greeks in Alexander had Scottish accents, huh? Arnold vs. Momoa? Momoa. Conan vs. Sonja? Conan. Conan vs. Kull (Sorbo)? Conan. Sandahl vs. Brigitte vs. Rachel vs. Olivia? Olivia, no contest! Lang vs. Jones? Jones, but good try. McGowan vs. Carrere? Carrere, weak split decision. Barbarian vs. Destroyer? Barbarian. '82 vs. 2011? Hmmm... Visually stunning, decently performed, epic fail. Well what're you gonna do? That's Hollywood in the 21st century. Think I'll go back to reading Song of Ice & Fire... Save your money, folks..!",Conan the Barbarian
231,gimlid2002,Conan The Merciless,1,7 November 2011,"Actually,It was the writing and direction that was truly merciless. Conan was really the victim here (as well as myself and anyone with an IQ above 60 who watched the movie).Truly pathetic, this movie broke my heart as a conan fan of approximately 30 years. Of course it had everything a movie needs to succeed today: poor lighting, bad cgi, unrealistic looking fighting choreography, bad acting,chase scenes and accidents of ""A-Team"" caliber, etc....Dino Delaurentis please come back and see that the next attempt at a R E Howard movie is worthy.I actually felt very depressed by what they have done to the Conan character. Truly saddened. Gimlid",Conan the Barbarian
232,wwharton4,this might be the worst movie I've ever seen,1,5 September 2012,"So if you're reading this review you've probably seen the original Conan and you are aware of what a good movie is, which sad to say, will make it very hard to enjoy this movie. I was actually offended by how bad this movie was. I think they took an 8 year old's rough draft of a movie script and put it into production. Nothing about this movie makes any sense.In the middle of a battle, people are trying to attack a collapsed pregnant woman who is fighting them off and killing people. Now I've never personally been in the middle of a battlefield, but I would think when there are grown men looking to put a sword in me, I wouldn't worry about a collapsed pregnant woman, but what do I know? Maybe battle makes you want to go on a pregnant woman killing spree. Again I can only speculate.You will then get to see Ron Perlman deliver a C section to said woman in the middle of the battlefield. So Conan was born in the heat of battle by a woman who was a fierce warrior... OK we get it.It then goes into Conan as a child and his people who love to fight and battle for no apparent reason at all. More unthought out childish clichéd story lines.Ron Perlman then gives his lovely speech about how a warrior must be fierce and strong, so of course he then tasks the kids including young Conan to race around with an egg without breaking it. Because nothing says fierce warrior like a parenting care class given to children in school.From there you get 8 year old Conan beating the crap out of 4 or 5 grown built men who make some sort of animal sound that no human could ever make. Usually something this ridiculous would be somewhat comical but I found no humor in how bad this movie was. You have to watch a little kid made of stick and bones that weighs less than hundred pounds toss around grown men and bash a guys head open into snow flakes. Again, nothing about this movie makes any sense.It was at this point I stopped watching, note I only watched the first 5 or 10 minutes. I also skipped the clichéd main plot which was retarded. How does something like this even get made? How do you even glance at it and go, ""hey this isn't worst movie I've ever seen."" It just boggles my mind.On the plus side I watched the original Conan again and that movie is awesome. You get to see how Conan progressed into becoming a warrior, his battles, his choice between love and revenge, the feel of life in a different time, and oh the sweet battles. There was rhyme and reason for just about everything to the original Conan. Even his foes were well developed and could really make you believe.",Conan the Barbarian
233,Jamie-802-978808,"Sword and sorcery is back in its element, Conan is reborn",9,26 September 2013,"A review is what ever you want it to say, the reviews for Conan are mixed, why!!??? You ask? Well to give this film a bad review is because you have no imagination and are way too serious. This is sword and sorcery in 80's style epic proportions, I loved it it gripping and over the top from the start everything it should be with the title Conan the barbarian. The people who gave this bad reviews are either little old ladies or boring egg heads with a bug to bare.Conan starts with a child born into war, who yearns for vengeance and gratification. His journey a begins with the loss of his father and takes you into a fantasy world where anything is possible.Conan is epic Saturday evening fodder, if you are a man who loves an obvious yarn, fighting, sorcery, a nasty villain and eventually gratified revenge then this is for you. If not then rent out miss Marple............",Conan the Barbarian
234,jrgmmg-833-182068,NOT a remake - but...,5,1 November 2013,"What promoted me to write on the late evening, was all the lame idiotic posts reviewing this movie and measuring it's merits by comparing this to the old Arnold flick. First off, this is NOT a remake of Arnold's ridiculous movie from 1982, but just another failed attempt to bring this literary giant to the screen. And I say ridiculous and I'll explain. I first discovered the original Conan novels some 35 years ago. Came across a paperback novel with one of those incredible Frank Frazetta paintings on the cover and was immediately hooked. Conan quickly became one of my literary favorites and I digested every single story, including those penned by L Sprague deCamp and Bjorn Nyberg. Originally written in the early 30's by Robert E. Howard, Conan's short stories first appeared in pulp fiction magazines such as Weird Tales. Howard was part of what was known as ""The Lovecraft Circle"", (a reference to the amazing horror author H.P. Lovecraft), where the authors corresponded with each other and shared ideas. If you've ever read anything by Lovecraft, let alone Howard's Conan stories, do yourself a favor, go to Amazon, and buy yourself some books. You can buy huge volumes of Conan stories in one book now.For those who thought Arnold's and Milius's adaptation of Conan was even remotely good, you've obviously never read a Conan novel. Arnold's character in his film Commando was more like Conan than the idiotic character they wrote for him in that terrible movie. I walked out of that movie completely disgusted and disappointed. It may have been an entertaining barbarian movie, but it was NOT Conan. At least the new flick tried to adhere to some of Howard's vision of the Hyborean age and Conan's young life in Cimmeria. While I sort of enjoyed Mamoa's performance, (physically he looked pretty good but I still miss the bangs) the writers still didn't capture what made Conan such a compelling character. While certain aspects of the production also looked pretty good, much better than 1982's film, it definitely made for a better barbarian sword and sorcery flick. It just didn't come close to capturing the complex character that is Conan. His code of honor, his humor, everything that made him an absolutely terrific and original character was just totally missing....again.The point is, these 2 movies have nothing in common other than the name. You people are wasting your time arguing this point and quite frankly, irritated me to the point of making me write in my own review. Nispel's movie was NOT a remake of the '82 film and any attempts at comparison is just a waste of time. In retrospect, I guess this is what fans of Burrough's must have felt when they had to endure the pitiful and embarrassing Johnny Weissmuller performances of Tarzan from the 30's and 40's. (Not to disparage Mr. Weissmuller, I'm sure he was just reading his lines and following his direction.) If you've ever read a Tarzan novel, you know exactly what I'm saying. If not, due yourself a favor and just read the first book. You'll never say ""Me Tarzan, you Jane"" again.",Conan the Barbarian
235,alimike1995,Cannot beat the original,1,8 January 2019,"Wish I could give it 0/10...absolutely shockingly bad film...There is only 1 Conan and that is Arnie...simples.Should never have been remade, waste of money 😶😱",Conan the Barbarian
236,percked,This Movie Was Exactly What I Wanted It To Be,6,13 February 2019,"This movie was exactly what I wanted it to be throughout... it's not a movie trying to seek acclaim to those overly critical go to a play at the local high school for your High Drama!!
In my opinion this movie was a tryout for the Aquaman role! Momoa's ability to move well has been honed over decades (at least since Farscape!)... There were underwater fight scenes...Movie had an Aquaman feel to it almost, just with a much smaller budget... Even the sorceress wore a costume that highly resembles Aquaman's golden chest plate...
If you like fun/adventure movies in the arena of everything from Flash Gordon to The Mummy, franchise, Resident Evil, etc, then you will enjoy this... It's not Shakespeare folks... But it's a retelling of s classic that is thousands of years older than ""to be or not to be""...",Conan the Barbarian
237,ridell-42999,Would Have Been Better Off as a PG Movie for Kids,3,6 February 2018,"Not for the legions of devoted fans who rightfully adored the original mind you, but for the studio. At least that way they could have sold it as an action packed adventure for the family. Maybe they would have come close to breaking even.
For the rest of us though, all the million dollar sets and bare breasted women in the world couldn't save this film from its flat dialogue, terrible character development, overly convenient plot vehicles (master thief who just happens to have the keys to a secret passage to the fortress, anyone?), and badly overacted character stereotypes. It took the me three tries to make it through this movie and I still gave up about 20 minutes from the end.",Conan the Barbarian
238,panzerhauser,Garbage,1,31 March 2012,"This movie should be shown to all film making students as a template on how not to waste 70 million dollars, save your time and money and buy the original on Blu Ray, for it is a long way better and has something like passion involved in the making of a legend. Schwarzenegger has plenty more ability as an actor than Jason Momoa and delivers the movie in better than two hours of enjoyable fantasy entertainment.Does Rose Macgowan look anything like a witch? She is a capable actress but sorely wasted and who knows what Stephen Lang was thinking when he signed up for this rubbish, he is a great modern character actor who has shone in recent outings but looks ridiculous and has no presence, unlike James Earl Jones in the original who was hypnotic and easily detestable.Marcus Nispel should go back to directing KFC commercials.",Conan the Barbarian
239,njb7977,Hyborian Bliss,8,27 November 2011,"OK, look. It's a movie about a crude guy out to avenge people that were important to him. If you reduce it that far, of course it's going to sound empty and trite. Casablanca was about some people trying to get out of a city. That totally doesn't do the movie justice, but it's true.If you're looking for deep drama and eyes that are a window to a yearning woman's heart, then this isn't the movie for you. If you're looking for a summer blockbuster'd faithful rendition of a beloved fantasy book series, then you're in the right place! Conan The Barbarian 2011 delivers all the black sorcery, gratuitous cleavage, swashbuckling barfights, and tear-the-meat-off-the-bone barbarism that anyone could want who actually read the books or loved the original movies in spite of themselves.I thought the camera work was fine. Was it FANTASTIC (a la The Lord of the Rings)? No. There's a reason that movie took all sorts of awards. Did it pull you into the action, and give you an idea of where the movie took place? Yes, absolutely! Was the acting poor? NO. I thought the main character was played admirably, and the supporting cast was great! I especially liked the inclusion of a heroine who could take care of herself in a fight. Very Hyborian.Expecting a movie involving a plot such as this to be Mystic River-esque is unfair to the genre. Go forth and enjoy the movie for what it is: a brief foray into a land of high adventure, where the magic is black, the creatures are always hungry, and there is always someone out there willing to kill for the answer to the riddle of steel.",Conan the Barbarian
