,User_name,Review title,Review Rating,Review date,Review_body,Movie_name
126,dbryn,What A Disgrace,1,3 January 2013,"I had heard some bad reviews of this movie, but still wanted to see it. For me I really liked the intro with young Conan; however, the story was weak, there were frequent moments of cheese, no character development at all! I'm curious as to how the writers managed to sell such an expensive movie? Aside from the terrible plot, here's what bothers me (SPOILER WARNING!): In the first few minutes Conan's mom is about to give birth after being critically wounded. She convinces her husband to slit her open so she can meet her son. The father plunges his dagger inside her, without looking, and immediately pulls out young Conan. Apparently, all the bad guys recognized that mother and father had a 'timeout' as the battle rages on around them. Kudos for dad to perform surgery so quickly... CHEESE!!!!! The handling of the swords in general. I happen to have a real samurai sword and it's quite heavy to hold parallel to the floor and I'm 6'3 and 200lbs. The samurai sword would be incredibly light compared to Conan's broad sword, who the evil daughter (5'3"", maybe 120lbs) holds by the edge of the hilt with her fingers, handing the sword to her father. I highly doubt she could actually lift the sword in one hand, let alone keep it balanced by the hilt while passing it to her father as she reached. The swords were, in general, apparently weightless throughout the production and could slice through thick heavy chain... yet when the sand golem/men hacked at Conan numerous times, landing blows, Conan didn't have a mark on him.Speaking of the sand golems/men. They rise up from the sand, they do some pretty wicked tumbling, appearing from and reappearing from the sand. I thought this was one of the best ideas in the movie... until two of them were killed by falling one story off of a scaffold... into the sand? All of a sudden they are affected by gravity and the hard sand, from which they were born? Way to ruin a cool idea.The 'chosen one' is a girl from some convent. She seems pretty pure and innocent, yet within a few minutes of meeting Conan, she is barking orders on whether or not to kill a man or not. OK, so she's a rebel ""chosen one'? Hmm, a few scenes later she is fully capable of kicking ass, stabbing and killing a handful of soldiers from the dark army horde. Fast forward an hour, and she's a helpless victim who won't shut up from screaming through the last half hour of the movie.Lack of creativity... let's see, let's give the daughter witch some claws JUST like Wolverine. Let's use an underwater serpent that rises up JUST like in Star Wars. On that note, Conan and the thief - who was acquired to help break into the palace... yet conveniently seemed to have a set of keys for everything? - are walking through a sewer at waste level. As soon as they are attacked by said water serpent and pulled under, they are instantly in about 15ft or more of water? What happened to the floor? Why is it he needed a thief again? It appeared as though the entire purpose of the thief was to be dragged around by the serpent.Probably the biggest blunder of the movie was the villain. The villain wants to complete his mask in order to summon his dead wife, who happens to be a bad ass necromancer? OK, if you're a bad guy... this is a major goal? The villain let's Conan live as a boy. He defeats Conan and then just pushes him around while shouting insults at him at the half-way point. At the end, he also defeats Conan and toys with him for a few minutes before Conan is able to reverse his fortune and kick the guys ass. In short, right from the get-go, we figure Conan is never in any real danger and the goal may not be as important as we initially think. Why wouldn't the villain just kill Conan and get on with it? Instead, he just toys with Conan...So, in summary... the movie sucked! It pains me that 5 really good movies could have been produced on this budget. Instead, we had to sit through this dreadful movie and terrible writing!",Conan the Barbarian
127,derektrotteresq,So bad it hurts!,2,22 September 2013,"I haven't seen the original so I had no expectations when I watched this movie. The movie stinks, it stinks worse than an indoor fish market, if all of the proprietors were gunned down and the fish in said market were left out for a week with the heating on. No words can describe exactly how eye gougingly naff this movie really is! There is nothing redeemable about it at all, NOTHING! When I've finished writing this review, I'm going to look up the director, so I know who's movies to avoid in future. He has done what Joel Shumacher did with 'Batman and Robin', except exceeded it....this is worse! It's sooooo bad, i'm not sure that i'll ever get over the anger I feel having sat through it all! There's no story, very little dialogue, pathetic action scenes, not one likable character...I could go on! This film is pointless and should be used only as a torture device to show to people that you hate. I'm not sure it's possible to post a spoiler about this film as i've literally only just finished watching it and I remember nothing about it, it's that memorable. To spoil a movie, it needs a plot to spoil!",Conan the Barbarian
128,nightstalker-7,Not that bad as 15K claim I would say...,7,13 November 2011,"Well, in general I'm not this master for writing reviews or anything else. But in general, I do agree with 95% of IMDb ratings, besides some special cases. And this is one of them.Seriously, if we put away the old Conan the Barbarian Movie with Arnie. This movie offers You ""A grade"" quality of picture, ""A- grade"" quality of camera angles ""B grade"" quality of story composition ""B grade"" quality of actor performance and ""A- grade"" of sound/music quality. It's not that bad as a movie for DVD/BD @ your home, right? And frankly, many TV movies have much, much higher vote rating as Conan.For me, I really enjoyed some fights in the movie, I liked how actors were masked up, also enjoyed Conan as a kid and as an adult. As I say, these guys didn't put out any blockbuster performance to Your screen but seriously, it wasn't that bad [5/10] all in all. It really deserves solid 6/10 from a random viewer and from a fan of medieval times and fantasy good 7/10.Though, this is only my opinion and I fully respect the opinions of whole IMDb community...",Conan the Barbarian
129,madpigmadpig,"Not Really a Conan Movie, Not Worth Watching Either",2,30 May 2014,"Although this movie is essentially a moderately tweaked remake of the basic story from 80s version, the plot is actually fairly different. Some of the fight sequences in the movie were relatively interesting, but overall this movie exhibited very poor writing, acting, casting, and surprisingly even mise en scène. First let's get the most obvious, and possibly the least important, complaint out of the way. Conan is so thoroughly described in the books as a proto-Celtic guy with jet-black hair, cobalt-blue eyes, and many battle scars, that is stronger (and almost always, but not necessarily always, taller) than any other man he meets. Momoa is a Hawaiian guy with brown hair and brown eyes who (despite a height of 6'4"") appears to be shorter and much weaker than several of the other characters in the movie. Secondly, the primary things that make Conan a great barbarian character is his utter lack of angst and philosophical complexity, his strategic mind for infiltration in battle, and his quickness to act. Conversely, the Conan in this movie spends the entire film metaphorically rending garments, takes something like 20 years to exact revenge, and virtually stumbles through the entire story without any sense of forethought. I'm not really bothered by all the naked people (okay, naked women) in the film, as people were generally not that concerned with wearing clothing during the (albeit fictional) time period represented in the film, but I would argue that spending so much time on the long, extremely boring uber-pornographic sex scene was totally unnecessary and added nothing worthwhile to the movie. Finally, the villain proclaimed that barbarians like Conan don't pray or have any kind of religion. To that, I say ""Oh, Please!"" Conan had his butt saved deux ex machina style several times by his god, and prayed at least once that I read of. I have other complaints as well, but I'm going to stop here so it doesn't get overlong.I'd recommend the movie for Anyone having trouble with figuring out how not to make a good action movie, and skeezy guys who are afraid to be seen renting 'official' porno.Content notes: Most, but not all, of the swearing is replaced by Conanisms like (by Crom!). However, a few regular swear words illogically pop up sometimes too. It's mostly not really that gross of a movie either, except for some extremely grotty stuff at the beginning, like the C-section. It is pretty violent though.To save you from having to actually suffer through this tripe, movie is basically this: After suffering a wound in battle, Conan's mom gets an impromptu Caesarian section with a sword and dies. Years later, when Conan is an adolescent, his father commits suicide in order to prevent Conan from brainlessly dying in an attempt to save him from a trap set up by a crazy warlord. Instead of immediately hunting down and killing the warlord, like the literary version of the character probably would have, Conan spends his adult life angstily searching the earth for the warlord while occasionally running into large groups of slutty, naked slave girls until finally tracking him down, initially getting bi#$%-slapped in a fight with him, and finally defeating him while acquiring a snarky girlfriend in the process.",Conan the Barbarian
130,ttaskmaster,Hollywood fails yet again...,3,11 January 2012,"I've always been a big fan of the John Millius and Arnold films, so I was both afraid of seeing what newfangled nonsense had done to the story, yet eager to see what people were claiming was even better... Even my favourite reviewer, Catherine Reitman, gave it some favourable comments... just some, though. The first act of the movie was cool. Heavily over-gory, but appropriately so and without being oversensational about it (ie, like 300). The storyline is rich and the environment bursting with detail. True, the plot is somewhat OTT, but this is a tale of high adventure. Given the legend, I can well believe a kid like Conan achieving what he does. For me, a character's appearance is usually representative of the whole film's cinematography and style. Conan is tall and panther-like, never Arnie's bricks-in-a-pillow muscley look. Jason Momoa has that down well, along with the dark hair and some vague semblance of Oriental/Eastern Steppes sort of look.... But he still has too much Hawaiian to be fully convincing, for me. He is also a touch too boyish and pretty for my eyes and the stereotypical plastered-on scar (down through the eyeline, but subtle enough not to spoil his beauty) only adds to the cartoony Xena feel. I always saw Xena as being about barbarians who shower and exfoliate every day, with at least one stylist on hand, spray-on sweat and grime applied Mary Poppins style (from a make-up compact). In short, he is NOT Conan... he is The Scorpion King all over again, but without even the snappy dialogue. And he looks like he learned to act solely by copying three expressions from Karl Urban. Conan films should be dark, dirty, bloody, filthy and have almost NO characters that we would consider 'Hollywood beautiful', unless they are princesses or gods (Sandahl Bergman as a Valkyrie :) ). But regardless, the first half of the film is good - Slightly cheesy plot and nothing that's not been thought of before, but convincing enough that you go with it and executed with enough unique moments to be thoroughly entertaining. Then, all of a sudden, everything falls flat... The sets start getting over-detailed and like they're only there to look visually impressive to a 3-D audience. Conversely, the acting got worse and all the characters magically became one-dimensional. It's like the filmmakers just got bored and did 'whatever' just to finish the project and collect a paycheque. We meet the female co-star - She's gorgeous, pretty, shiny and a former model... totally unsuited to a Conan flick. The plot gets lazy and starts sounding like a generic, cheap fantasy film. The swordplay gets all spinny and everyone suddenly starts fighting like Eastern martial artists. The stunts get all Jackie Chan and the only thing missing is heavy wire-work with people flying around. As a swordsman myself, the moves in the original Conan are flawed and over-staged but still work and are realistic enough to entertain. The stuff in this new film is just pure show and no-one after the first third of the film ever looks like they have even picked up a sword before. There was only one move in the whole film that grabbed my attention. 2 mere seconds of footage throughout the whole thing!Chuck in a random big sea monster to complete the circle and you have your massive Hollywood crowd-pleaser... even though I've been more entertained by a $2000 B-Movie. I was not a fan of the casting either, for the most part. Ron Perlman does a fantastic job of Conan's father... Not quite as legendary or with as epic a feel as William Smith, but he is easily the best actor in the cast. He has real presence, proper depth and, as with his lower budget films, is the only reason this film is worth watching. Jason Momoa may have a good look, but he's too pretty and not once did I get the impression that his Conan was a deep thinker, or in any way the wise, quietly contemplative man I know him to be. He's just a mindless, violent thug with pretty looks and a bit of muscle. He even looked like his entire acting repertoire consists solely of 3 facial expressions stolen from Karl Urban. He is eye candy with a sword, but nothing more. For all his faults, Arnold actually brought his Conan to life. Momoa's portrayal will be quickly forgotten. Samuel L Jackson??!! Why is he even here? He has what I call Morgan Freeman syndrome, since Morgan also crops up in a lot of similar roles. Yes, he has a good narrative voice, but there is no mystical quality and he doesn't even sound like a chronicler... He just sounds like Samuel L Jackson, sat down the pub, telling us about a film he watched the other day. He might as well have just said, ""Back in 5000BC, the following happened:"". Stephen Lang... OK, he was a decent bad guy in Avatar... But now Hollywood are casting him in all their bad guy roles and the same trick does not work everywhere. There was almost no difference in his performance between here and Avatar. In fact, he wasn't even scary in this. Absolutely no presence at all. That's why James Earl Jones is still The Man!The rest of the cast, the plot, the film in general is just chalked up as 'another film I saw, once'.",Conan the Barbarian
131,nigel-18854,Conan goes metro...,4,17 June 2017,"In truth this flick is not a complete pile of something you'd rather not stepped in. It is a teensy bit crap in places, there's an iffy cgi monster, a few crummy props and stunts that look as though they belong in a 1980's TV sword and sorcery series but those are kind of forgivable. What really wrecks this flick, is that it's Conan played gay, forget Rose McGowan's recommendation for Jason Momoa's arse, that's not even the worse part, it's the fact that Momoa comes over about as hard as a sherry trifle, wobbling on tea trolley with three wheels. I mean it's like he's looking for the mirror all the time, he even gives the camera a hair toss on more than one occasion, what is this, a Cadbury's flake ad? When you consider the legacy of the 1980's Conan, a film that broke all the rules, that caused the blue rinses in the press to wet their knickers and that still stands today as a mold breaking epic, it's all such a terrible shame. This flick puts the state of the art back to things like: The Beastmaster and The Sword and the Sorcerer.",Conan the Barbarian
132,jayce2279,"It's actually not bad, but I recommend watching it in 2D",7,20 March 2017,"I first watched this version in a movie theater in 2011 which only played it in 3D. I remember at the time I thought they had focused too much on digital effects and that the film was over the top. But since I am a Conan the Barbarian buff and I like Jason Momoa as an actor, I eventually decided to give it another chance and see it on DVD, this time in 2D. It was almost like I was watching a different movie and I can't for the life of me understand why I disliked it so much the first time I saw it. I remembered it being a clean, kid- friendly reboot with lots of over the top action scenes, sort of along the lines of the Marvel superhero movies, but the production design is actually very similar to the John Milius version and it's not far behind on violence and nudity. Of course, it does make use of digital effects, but by far not as often as I got the impression it did when I watched the 3D version and most of the action scenes are actually along the lines of those in the 1982 version or other more traditional sword fighting movies. Maybe I just wanted them to make a sequel to the Schwarzenegger films so badly I never gave this version a fair chance. I still think the original Conan the Barbarian is the superior movie, but now that I have watched it again without any expectations or prejudices (and in 2D), I have to admit this reboot is actually not bad at all and definitely better than the 1984 sequel they did make to the first film.",Conan the Barbarian
133,kenhe,Another excellent rendition of the Conan legend,9,2 July 2012,"To me there is no such thing as a bad or even mediocre Conan movie, they are all great because as an adventurer/hero there is no one to hold a candle to Conan! Conan is the archetype, the Gold standard if you will, against which all mythical heroes are measured. Of course, my acquaintance with Conan began when I was a teenager back in the 1960's and I had occasion to actually read the Robert E. Howard Conan stories. No movie, version, or modern rendition of Conan can ever measure up to the Conan vision I enjoyed as a kid in my mind's eye, but Conan is such a powerful, charismatic, and decisive hero that no matter who portrays him or what avenue he appears in, Conan always stands head and shoulders above the rest. Try not to over think Conan or attempt to make him into something he is not, Conan is a direct action problem solver, usually using the point of his sword or poniard.",Conan the Barbarian
134,hsimpleton,Nope,1,15 September 2018,"Jason Mamoa is fine af, but he still can't act his way out of a paper bag. Don't waste your time. people.It sucked. You're welcome.",Conan the Barbarian
135,jviramontez,Robert E Howared would be proud...,9,13 January 2012,"I started reading Conan stories (and comics) in the early 70's. I saw the Arnold movies, but just couldn't see Arnold as Conan (came across as far too nice). I was somewhat surprised to see so many reviews stating how great the Arnold movies were as compared to this most recent release, and somewhat concerned I'd be wasting my money...Again, this proves you can't always trust what you read, or the frame of reference of the critic(s). In my opinion, this was a great movie and I think Mr. Howard would have thought this story and portrayal much more along the lines of his original imagination.Don't pay attention to the skeptics, if you like the Conan stories by Robert E Howard, you'd be hard pressed not to at least enjoy the ride...Myself, I'm looking forward to the next story, and hope there will be many more on the way towards Conan the King!!!",Conan the Barbarian
136,jfwhelan,I was entertained,6,6 November 2011,"I am not going to spend time discussing what is or is not a good film; in other reviews, I have owned that, on the face of it, a less than perfect film can prove very entertaining and that some acknowledgedly good films can prove a chore to watch. It's a wet Sunday afternoon: which would you rather crack a beer and watch, 'The English Patient' or 'Gold Finger'?This film entertained me; the time passed and I found that for the scales weighing enjoyment against annoyance, enjoyment had won out.Yes, the first twenty-five minutes were in a different class to the rest of the film and it is a pity that this good start was not carried through to the end. There were things wrong with this film. Script, emotion and tight direction were often lacking, yet there was generally good pacing and cinematography.At the end the main redeeming feature was that there was some coherence to the story and that it did follow from beginning to end. The use of the sword as link throughout the film was under used and at times almost forgotten, yet it still helped maintain a story line with basic closure. I have no real problem with the absence of dialogue; there are many ways to tell a story and the visual method can work well. That it was not wholly successful here is down to the lack of emotion and atmosphere that was needed to colour the picture in the absence of the vocal interplay.What this film needed was more finish, better thematic and emotional pacing and an overall 'style'. It is not sufficient for just the scenes and the story to be set in some age; life has to be breathed into that age; one needs to feel that one is watching a Cimerian and that his land and culture are real. This is, I believe, where this film failed and the root cause for the disappointment and poor reviews. We often fail to notice how good or bad something really is, when our first though is that it is not as good as we had hoped!",Conan the Barbarian
137,KilRydLoad,"Waaaaaaaaaaay better than the original...but man, is it violent!",10,22 May 2012,"Of course, we all love watching the originals and the remakes of movies immediately after. I did so...the original Conan with Arnold is a bit slow-paced. This one doesn't mess around...it gets right into the action right away, is very fast-paced, and God Almighty, is it gory! There were parts that scarred me for life, it was so gory! It is entertaining, though...you will definitely get your money's worth, and I certainly hope they do a sequel. A perfect 10 out of 10 for me! Just be warned, it's bloody and violent! VERY bloody and violent! Lots of female nudity, too, which I certainly can't complain about! It's just NOT a family flick, so be warned!",Conan the Barbarian
138,ymsyctai,Great Rental if you want action and bloooood,8,27 December 2011,"The best way to see a good movie is to go into it knowing as little about it as you can so I try not to include details about the movies in my reviews. If the movie sucks then I'm not shy about including details and/or spoilers.This is really a 7/10 movie but I had to give it an 8 just because so many people are hating on it. Why do people want excellent acting from a movie that is made to be an action movie? Come on people! This is about blood and guts and action and.. that's about it. What I like about this movie other than the action is that it doesn't try to remake the 80s Conan movie. It is a different storyline and a different Conan. Sure this movie does drag like for 5 minutes somewhere in the middle but other than that it is all action and a ton of it. It is just a pure action movie that was made to be.. let's say it together now.. an action movie! Come on people, enjoy the popcorn flicks for what they are and don't get all film school on a movie that is just about giving you bloody entertainment.",Conan the Barbarian
139,scorp76,Xena The Cimmerian,1,6 November 2011,"Marcus Nispel woke up one day and thought, ""Shit, I want to make a Conan Remake!"" He planned the project along the lines, ""We'll do it like Xena! It will be Xena but Conan. The script we can write in hour! And do the rewrites as we film each scene. Everyone must have a balloon of blood so when a feather touches them... splat!!! Brilliant eh? Acting?""Just tell the actors to read the lines and show a little emotion in it. People come to see the balloon blood not the acting. The action sequences will be shot with a shaky documentary style. It will be cool. And in post we'll add in some special effects. No more than 100 grand. Can't look too extravagant! Music? Get a couple of monkeys on violins. This will be the best Xena episode ever! Ah, I mean Conan Movie.""Marcus Nispel, F U. Only other movie worse than this is Avatar: The Last Air Bender live action. Even Dragonball was more entertaining value that this piece of crap encrusted crap.Better spend the afternoon watching the original Conan again. Hell, even Destroyer. Which is tons better production-wise and more is entertaining.",Conan the Barbarian
