,User_name,Review title,Review Rating,Review date,Review_body,Movie_name
231,carolineohagan,An insult to the original,1,15 November 2020,"**Spoilers sorry**
No story line whatsoever. No explanation of how Mulder (why on earth would he take this gig!!) found Lily's mum, knew she had powers and then coaxed them to live with him so he could steal it. No character development... I didn't care about anyone at all. It ended and I was like.. What that's it? Surely it's not finished. Horrible movie and frankly, insulting to the actual legacy that is The Craft, which inspired a whole generation of young witches, the world over.
They threw in some random lines from the first movie in a thinly veiled attempt at connecting them.
The first The Craft gave us characters we liked, identified with, friendships to envy and then the sadness when those friendships break down. There was mental illness, young love, and of course witchcraft, albeit a fantasised version of.
This poor knock off had none of that. A random massive period leakage at the begining, which was completely unnecessary and the small occurrences after could have been brought fourth in so many other, less degrading ways.
The actual witchcraft part was almost nonexistant, except for some strange montages with cgi trickery.
It was rubbish. Don't waste your time.",The Craft - Legacy
232,max-defaria,A CW pilot from a new spin off,4,14 November 2020,"Wanted so much to like, but I am very dissapointed (and embarassed). The CGI efects makes the film cheap and dumb. The Duchovnys acting ia soooo bad. The new coven is likeable, but the story is hush.
Waited ansious to see Fairuza, when she appears the movie Just ends. Dissapointing.",The Craft - Legacy
233,solemnity-94-243287,Both clunky and unnecessary,4,22 March 2021,"This movie is the button-fly jeans of movies. A new take on a classic that nobody asked for and which is noticeably worse. It's the sort of innocuous movie that's perfect for the waiting room of a dentist's office. It's watchable, but mostly as a way of passing time. Even David Duchovny is bored",The Craft - Legacy
234,tenishadotson,No🚫🚫,3,21 April 2021,"Boring, no substance and shouldn't be tied to the original which I loved... and how.. like umm.... it's almost been 30 years since ""The Craft"" nope!🚫",The Craft - Legacy
235,tor_azf,Good enough.,8,17 November 2020,"The craft is one of my favorite movies, so much so my mother actually had to held a intervention and stop me from renting de VHS (because I rented every single time I would go to a blockbuster).
The sequel was good enough. Good enough that didn't stained the original or a possibility for more.
I only had two issues:
1- the original movie was centered on a group of girls. which I loved because was the first time I saw a movie that treated the mais cast as equals. This one in the other hand regrest to the boring ideia that one needs to be the center of the story.
2- the scrip and story line was awesome but it feels that wasn't explored enough.I liked it, I rewatched and hope for more. But a better one.",The Craft - Legacy
236,anjkrunal,Grade C1,1,10 June 2021,Hadn't expected a Grade 'C' movie under SONY banner.,The Craft - Legacy
237,sako_211,Not as bad as people think or say,10,30 October 2020,"Though upon watching the preview you'd think it's not original and recreating the original film but I watched with an open mind and gave it a chance being a big witch fan and a huge Blumhouse fan as well glad I bought the double feature of this on VUDU.
Once a Weirdo, Forever a Weirdo!",The Craft - Legacy
238,khjacks,Couldn't see anything in the night scenes,2,1 November 2020,The nights scenes (which were many) I could not see anything. Couldn't see the ending. Yes adjusted my tv. I should get my money back because of the bad lighting.,The Craft - Legacy
239,namarie-31456,Decent follow up!,8,26 December 2020,"I really enjoyed this, not sure why it gets so much hate, it wasn't trying to be the first one, so not getting the big deal. No it wasn't as dark, as the first but that doesn't mean it wasn't a good one. Plus the ending, are you kidding that could open more stuff possibilities.",The Craft - Legacy
240,rynobro-83345,It's alright...,6,29 October 2020,"Honestly, this film is... okay. A ""5,"" but the people giving a ""1"" because of their political bull**** tanking the number made me rate it on the higher end. Not unlike Mad Max: Fury Road, or Captain Marvel, there are a bunch of triggered viewers out there seeking to tank the numbers, simply because they see it as some sort of personal attack that the film aims to appeal to an audience outside of their demographic. It's not bad... Not nearly as good as the original, but many of the poor reviews are undoubtedly unfair. It's mediocre, for sure, but not unwatchable, or even altogether unenjoyable. It has its moments of actually standing on its own... though it never manages to be anything other than a sequel which is only really for fans of the original... and, obviously, not all of them. Overall, the film is watchable as straight to streaming sequels go, but that's about as high of an endorsement as I can give it... that said... its shortcomings are not due to its ""wokeness"" or its political statements... it's just lacking in creativity or originality.",The Craft - Legacy
241,sjamiehough,Eeek.... never have I ever...,1,13 November 2020,"Never have I ever seen such a bad movie. Horrible from beginning to end. Some movies were clearly a waste of money, this is one of them.",The Craft - Legacy
242,sarahsphoenix,Truly wanted to like it but don't waste your money,2,30 October 2020,"It's been years since I saw the original so I can honestly say I don't remember enough about the first one for it to impact my opinion of this 2.0 makeover.
So, judging #2 on its own merit alone...it's awful. Zero character development, choppy, incomplete storyline, poor acting....the list goes on. Don't waste your money on the early access. Wait until the discount price at Redbox.",The Craft - Legacy
243,renniedean,You do harm to yourself if you watch this.,1,16 July 2021,"Had so much potential, but fail in every aspect. Waste of time you will never get back. Started out like it was going to be a remake, but it wasn't. It wasn't anything. It was a movie of complete nothingness.",The Craft - Legacy
244,apt-49131,Great Movie,10,26 November 2020,I was really skeptic at first but I really enjoyed it! Thought it was a great story line and great adaptation to the first. Bit of a teen dramas thriller but on the hole I really enjoyed it. Gave me Sabina vibes.,The Craft - Legacy
245,petelacy,Just awful,2,22 August 2021,"It was like watching an early episode of Buffy 20+ years ago but with less appeal, plot and special effects.Not enjoyable.Definitely made for tv but don't tarnish your set by subjecting it to this.",The Craft - Legacy
246,gxeq,Good movie but (SPOILERS),5,17 January 2021,"Not as good as the first movie, which is still a classic. Felt a bit rushed at times and hard to connect to the characters.We weren't sure whose kids belonged to who at first as wasn't explained.Was a bit disappointed when Captain Planet didn't show up though, that was a bit of a let down...",The Craft - Legacy
247,xevuvkdti,I am embarrassed to have seen this,1,12 November 2020,"Imagine if your old friend called you to catch up & then a 13 year old Instagram influencer showed up. This was such a waste of money, electricity, resources.... my brain. Did Danny Duchovny lose a bet?You're telling me these 3 girls have waited so long to find their 4th and their reaction is... to squeak at her in the bathroom? Then say you'll see her later, what.There was NO.MAGIC. There were music montages with cute fairy spells. It's just so bad.The flow is awful. The acting is cringe. The character are so one-noted. I never want to think about this movie again. That ending ended up being such an insult to the returning viewers that I'm surprised she agreed to it. She must have also lost a bet.",The Craft - Legacy
248,rod_mmc,Pilot,3,10 November 2020,"This movie is wrong in so many ways that I don't even know where to begin. First it's a movie about witches, directed by a woman and yet the most interesting and multilayers characters are males. Second, the movie focus in everything that is wrong leaving so many loose ends that it looks like an pilot episode from a tv show... and finaly the last act is so anticlimatic that you are sured to be watching an episode from Charmed. I feel that they lost a huge oportunity here",The Craft - Legacy
249,theelephantsolutions,Not sure why the terrible reviews?,6,31 October 2020,"Ok so i too am a fan of the original, but this one wasn't that bad it is true they could have done a better job detailing certain parts but all in all it was an enjoyable movie worth a watch. Its not move of the century but it is a solid 6 I'd say",The Craft - Legacy
250,abenton-19742,"Not the best, Not the worst.",6,31 October 2020,"The result is an entertaining and insightful mashup of tropes, both respectful of what came before and willing to try new tricks. Being a weirdo, it seems, has never gone out of fashion, but now it has a different kind of future to conjure up.",The Craft - Legacy
251,deftonesqueen,No no no no no,1,31 October 2020,"So this was supposed to be a sequel yet they recycle some dialogue(we are the weirdos, Mister) and very specific events(light as a feather, the butterfly when they call the corners)that make the movie seem like a remake of sorts. You know NOTHING about the characters just that they're witches. The ONLY interesting part about this movie was the reveal that Lily is the spawn of Nancy and Chris while Nancy had the power of Manon. It's pretty obvious early on so it wasn't a shocker. I grew up watching this movie countless times and will still watch it at 39 years-old for nostalgia. It's the movie that has always stayed with me from my teens. Don't waste your time watching this if you love the original.",The Craft - Legacy
252,drake-76446,Great Idea Poor Execution,5,1 November 2020,"It seems the writer wanted this movie ro show the coven in unity as opposed to fractured as its predecessor. That was a great idea. There wasn't enough character development. We only know a little about the main character. The other three elementals are never really developed. The climax of the movie is the hill in my back yard, not Mount Fuji. The powers exhibited also fall short of the first movie. All in all, in comparison to the first movie this one fell very short.",The Craft - Legacy
253,estrallaq-11864,Complete disappointment,1,6 December 2020,"They had the right intention for a re make the original or carry on. But, this is a completely different story. It doesn't follow anything of the original except a Love spell. Alot of confusing turns and then certain things pop up and your like what is this? I'm glad I didn't waste my time or money seeing this in theaters. Such a waste.",The Craft - Legacy
254,scsullivan-26891,Needs a different Director..good storyline.,9,12 January 2021,"Love the story line....but edited horibly, the actors were good and related to current events....threw alot of touchy subjects in for convo pieces...I hope there is a 3rd...with a different director.",The Craft - Legacy
255,tureangirl,Had potential but failed..,4,28 October 2021,The bare bones sorry had potential but was ruined by a cringey/cheesy script. The characters were very hollow/shallow with little to no back stories to connect with. The magic was so over the top & a cliché. Someone else said that it felt more like a sequel to The Covenant than The Craft & I can see why. It's definitely not worth the watch unless you have a morbid curiosity & nothing better to do.,The Craft - Legacy
256,janis7777777,I enjoyed this more then I thought I would.,9,14 November 2020,I enjoyed this more then I thought I would. I'm glad the didn't make a remake and make this movie a different story.,The Craft - Legacy
257,mm-90932,Weak,1,20 March 2021,Weak stupid movie doesn't worth to waste your time watching it,The Craft - Legacy
258,thepixi,Wanted to like it but couldn't,2,31 July 2021,"I was so disappointed by this film. Disappointed, but not surprised, since I'd read the reviews before watching. But it was SO bad I felt I had to come and leave my own thoughts on why.First of all, no-one changes, learns or grows. With the exception of Timmy, who gets a magic personality transplant, comes out as bi, then gets killed. (#buryyourgays) No-one has to struggle, fail, and learn to come back stronger.The magic is ridiculous. Stupid glitter effects, and way over powered. And just like above, they don't have to work for it at all. Glowing auras and they can throw fire balls, and there are levels that mean different abilities, like talking telepathically, and shapeshifting? What the eff?The internal logic is faulty. Fourth girl turns up and suddenly they can all do crazy magic, including pausing time? Somehow? In the cafeteria? And breaking into Timmy's house for the aforementioned personality spell. And knocking some mean girl's head into a wall? But Lily does a love spell on Timmy and that's crossing a line and the other three refuse to talk to her, and decide to take away all of their powers. Not only that, but they refuse to talk to her when she is trying to say something isn't right about Timmy's death... priorities?!Everything seems unconnected. The stuff the girls do is just glitz and glamour but doesn't go anywhere, there are scenes with the three sons that are just random - sleep-walking Isiah? Lily chatting outside with Abe? Adam is obviously not a good guy, but the ""shocking"" discovery that he's a warlock and wants to steal Lily's powers didn't really have anything leading up to it. And how did he know she HAS powers? Did her adopted Mom know?Nothing has any repercussions! Including the girls burning Adam alive in the middle of the forest, and then next thing adopted-Mom is picking Lily up to go visit her bio-Mom. The one who made her adoption dependent on Lily never being told she's adopted. What about the fact that this famous dude is now missing with no body to be found?! What happened to his boys? Not that we care at all about them, cause they have no personality, but still.And yes, Nancy is Lily's (Lilith's) bio-Mom - shock reveal! Except there was literally nothing leading up to this also. Okay, so Lily finds out she's adopted, but couldn't there have been some other hints that it's Nancy? Couldn't there have been powers she manifested as a kid? Some reference to Sarah perhaps - Robin Tunney's character from the original film, who presumably is still out there and powered up.I think the film would have been so much better if they kept it simpler and closer to the original. Don't get me wrong, I support the inclusivity, but I think so much of the stuff with Timmy should have been ditched, all the stuff with Adam's men's groups should have gone, and we should have had Lily having some faint, can't emphasize enough very weak, powers since she was little, maybe weird dreams and not understanding them, Adam somehow finding out she's Nancy's daughter and setting up his whole thing with adopted-Mom just to get close to her, and where we see Adam learning about Nancy, we the audience get drip fed hints that it is Nancy as well as about his own powers / agenda.They should also have picked one or two magic abilities and gradually ramped them up, like in the original film they start off a glamour with Sarah changing her hair to blonde, and at the finale she's taunting Nancy with the glamoured-snake-hands. So Lily meets the girls in school and they introduce her to witchcraft and suddenly things in her past are making more sense, AND all their powers can start that ramp up. Then she could find her adoption certificate AND the other stuff Adam has about Nancy, Sarah etc and she could confront her Mom who would not have known Adam knew anything about Nancy. Mom confronts Adam, gets tied up, and cue the final show-down in the forest.",The Craft - Legacy
259,MzMonzi,Time killer,3,20 January 2021,I think the film had a good start and then was just so rushed. Plots were not explained and there was no sense or reason as to what happened actually happened. Such a pity.,The Craft - Legacy
260,wolfnightmare,Great sequel!!,10,22 January 2021,"Don't be mislead by bad ratings, the movie is a real gem, a modern and fresh take on an old premise, with really nice turns of the plot, superb acting and ok special effects. If you liked the 1996 flick this one won't dissapoint.",The Craft - Legacy
261,mrhatcher2003,Weak,1,2 November 2020,"Horrible, only part that was good was the ending when she found out who her real mom was",The Craft - Legacy
262,AlexxAmadeo,Just sad,2,9 January 2021,"I LOVED Zoe Lister-Jones in ""Life in Pieces"" and thought she was so good at playing this smart, witty character. Learning that she wrote and directed this piece of garbage makes me really sad. It's not as bad as, say, ""Thanatomorphose"", but still, I could only watch this for about 30 minutes before I simply had to give up.",The Craft - Legacy
263,arohrmayr,Massive dissapointment,1,21 October 2021,They spent too much time ensuring this was a woke movie when they should have invested in a good scriptwriter. There was so much potential. If you had a solid story they would not have needed to be so blunt about begging woke. It would speak for itself. Very weak sorry and so many plot holes it isn't funny.,The Craft - Legacy
264,dustinleslie,"I bind you Blumhouse, from making movies.",4,29 October 2020,"For a Blumhouse film, it's awful. No element of horror. The characters are rushed with no back story. I can understand the main character, Lily, having such strong powers if Nancy conceived her while having all the power of Manon. Like at the party with Chris before she pushed him out the window. But that doesn't explain why all of the girls have such powerful magic without any explanation. Don't even get me started on the random male witch guy. Also, what happened to his son's after they kill him?",The Craft - Legacy
265,AdamJasper,Awful,1,31 October 2020,Was expecting more especially for a Blumhouse film. It was a waste of time bad acting and you can tell exactly what is going to happen.,The Craft - Legacy
266,Siona_Duncan,This was Directed by a woman,5,11 April 2021,"Im shocked, that school scene surprised me that a woman let that fly.",The Craft - Legacy
267,whitfielddalton13,Not Very Good,1,5 January 2021,"Hank Moody was fun to see in this, that's the only bright spot in this disaster.",The Craft - Legacy
268,calanit-penker,"Another older man, really younger wife movie",1,29 August 2021,"I hate it when the man can be old and wrinkled and the woman is beautiful and so much younger (16 years difference in this movie actors)
Also it such silly the witches just gave up the powers, no one gives up power.",The Craft - Legacy
269,jeni-murray,What?...,1,22 August 2021,"Turned it off after 30 minutes, I just couldn't handle the terrible acting from the one that had telepathic abilities. If you're a fan of the original, don't ruin it with this one. I couldn't even stand to watch it past the scene where they find out she's the fourth. Sorry Blumhouse...you got this one wrong, very very wrong!!!",The Craft - Legacy
270,evalovesdisco-168-399894,Disappointing,4,15 March 2021,"The dialogue made me cringe on more than one occasion. No time spent on character development. Tons of plot holes and moments that made no sense without context. Some of this could have been bad editing but the script was not great either.
There were so many times when characters did things and it just made no sense. Just watch the original.",The Craft - Legacy
271,duckiethegr,not really as bad as people are saying,6,25 January 2021,"I actually enjoyed it. i really didn't think it was a bad as the other reviews say. it certainly wasn't as good as the craft (1996), but it also wasn't the worst film i've seen recently either. i wish it would have had an R rating more than anything. a little more violence and language would have been good. it did have a pretty solid ending, and the acting wasn't bad. it was also good to see David Duchovny is getting some work. i would definitely watch it again.",The Craft - Legacy
272,dbz_bebo,What on earth was that?,1,1 August 2021,Did the writers just pick random ideas out of a hat and tried to smoosh them together? This could have been so awesome if it had a decent plot.,The Craft - Legacy
273,wdaz-70454,Not bad,6,28 October 2020,"After watching first one then on to second one, was not as dark as first, but seen quite a few films with these actresses, and over all I enjoyed it..I'll not spoil it for anyone, but watch and judge for yourself..",The Craft - Legacy
274,strawberry81087,Such a disappointment,2,4 June 2021,There were definitely good parts to this movie but so many holes and dead ends.,The Craft - Legacy
275,jcoghlan-42991,Mm what now?,1,6 August 2021,"I guess it's my own fault for being curious enough to watch this in the first place. Poor character development, hazy plot, I was mildly confused the whole time.",The Craft - Legacy
276,zeronull-25716,Delete - Redo,1,1 November 2020,"The Craft is far better than this ""sequel"". Believe you me, it's not
at all worth watching whatsoever.",The Craft - Legacy
277,ch-25635,Love it,10,31 October 2020,Such a good movie! I have never seen the original and I don't need to. Just watch it!,The Craft - Legacy
278,zelinskiwoodworks,AWFUL,1,1 November 2020,"""If I was as pathetic as this movie, I would have killed myself ages ago."" This is just awful. Does not make any sense in comparison to the original movie. No character development AT ALL. No understanding of how the girls ALL have strong power. I do not understand what I just watched. Just plain miserable.",The Craft - Legacy
279,thomasgrierson,Killed A Movie,2,17 December 2020,"I am so disappointed at this movie. This director is old enough to know better at 38 years old; she must have watched the original! The writer should hang their head in shame. The original was amazing , a bit dark, like sabrina, the order etc. You missed a trick here with this movie that was worthy of more than anything on facebook. The only resemblance was a photo of nancy and the cross earing that swapped ears?? Watch the original, amazing.",The Craft - Legacy
280,frozenfroge,Molten Garbage,1,19 June 2021,"Terrible casting
Terrible screenplay
Terrible direction
Makes me sad for Duchovny & Monaghan....",The Craft - Legacy
281,keithsheppard-27428,Blah,1,20 November 2020,"Oddly enough I have to give this one star......the story sucked, the acting sucked, the music, lighting; the blah blah blah; this just sucked.Just to make me happy I'm now watching the original.",The Craft - Legacy
282,niall-maguire,Half a film,2,30 October 2020,Just watched this film at the cinema. Must have been missing a real of film from the projector because this film's 3rd act is literally 3 minutes long.It was a fun first half and then the film ended wtf. I have a feeling filming got shut down early due to covid and blumhouse decided to stitch what they had together and just release the film as is to generate a bit of cash flow during this dry spell.Also sleepwalking Isah served no purpose other than the tamest and almost of jumpscares.,The Craft - Legacy
283,ba-45009,SMH,1,26 March 2021,"So, a teenaged witch joins an established coven of teenaged witches and every spell is finished with uncontrolled screams. Right...",The Craft - Legacy
284,fitzpadryk,"A Fun, enthralling film that is sure to delight fans of The Craft",10,29 October 2020,"The Craft came out when I was young and has always been my favorite movie, and I could really relate to some of the themes. (Being an outcast, a two-spirit, and a lineage Witch in catholic school)
the Craft Legacy shows a modern version of a working coven with some fantastical entertaining pieces of magic as well as important spells. The diversity and and whole message of the movie becomes clear when we find that Lily's soon-to-be step-dad is a professional misogynist.The entrance of a male practitioner, a Warlock that steals witches powers, sealed the deal with David Duchovny playing the role of the dark side of the Craft, which resides in the Witch's heart and intentions, not the magic.
The meat of the films plot line is revealed towards the end and it will blow your mind away that Nancy Downs, played by Fairuza Balk AGAIN, is in the films ending asking lily ""what she wants"", and lily replying ""I'm your daughter""... was so awesome!! The ending was fulfilling and also hints at the possibility of another film! Let's pray to The Goddess it happens!!",The Craft - Legacy
285,bilgealp,what did i just watch,6,28 October 2020,Honestly this was such a disappointment to see. This movie contains more like a cliche teen high school movie elements instead of thriller/horror. I personally can't see any horror items in it. I hate how they never mentioned main characters' backstories or their daily lives. And there were SO many plotholes that i can't catch up while watching. Literally I'm so disappointed rn just go and watch the original one and don't waste ur time watching this. In the end I'd like these characters so much if writers wrote them better. But with that many unanswered questions in the plot and zero backstory on main characters... a no from me,The Craft - Legacy
286,cmason-60061,Better than expected,10,12 November 2021,"I'd heard such bad things about this film however I thoroughly enjoyed it. So much so that it printed me to come here to write a review. What totally sold it for me was the ending and how it ties with the original film, this isn't a remake, more of a sequel.",The Craft - Legacy
