,User_name,Review title,Review Rating,Review date,Review_body,Movie_name
47,Milo-Jeeder,"Subpar sequel to a classic, but not nearly as bad as people make it out to be.",5,14 November 2020,"I get it, the movie errs on the side of being too preachy and ""woke"", which is something that was likely to get a lot of criticism, especially considering that this flick was bound to attract a lot of attention from fans of the first movie (mostly people in their thirties, like myself). Drawing a comparison is somewhat inevitable, given that ""The Craft"" (1996) is widely regarded as a cult flick, but, as a standalone movie, ""Legacy"" works in its own way and, while I can understand why so many people were dissatisfied with it, I would say that it doesn't deserve all these 1/10 scores that it got on IMDb or other websites. This sequel is mostly aimed at a younger audience with a more social justice warrior mindset, for the lack of a more fitting description. While I pretty much tend to roll my eyes at any kind of preachiness, I didn't find it impossible to sit through this flick, like I experienced with other ""woke"" movies.While in the original film we get a group of girls who were mostly miserable and dark, because of their inner conflicts and the fact that they were mostly ostracized by their peers, ""Legacy"" gives us four girls who are pretty much sparkly and happy. Actually, I would say that, at some point, I found them annoyingly loud and enthusiastic, especially about their magic, which they mostly use to play silly tricks and whatnot.
While the 1996 film dwells into the lives of each of the four girls, allowing us to know them and empathize with them, ""Legacy"" mostly focuses on Lily, the main character. As a matter of fact, the other girls' lives are never even explored, which is something that bothered me a lot, because it felt alienating and rushed. Who are ""the three others""? Lourdes, a transgender latina; Tabby, who we never really get to know and Frankie, a ditzy and likeable girl who, at some point, receives a snarky comment from a popular girl, who makes fun of her for being allegedly unattractive.
I think one of the biggest problems with ""Legacy"" is, precisely, that we don't really get to know who these girls are, while the original was a character-driven type of film. Seriously, these four girls are mostly likeable, they don't harm anyone and they just enjoy their powers, but we don't really get to know them and many of their personality treats seem to have a cookie cutter approach. These four girls aren't particularly memorable. So, they're woke social justice warriors... big deal. Don't we get enough of these types of characters these days? Apparently, not. These girls just don't stand out in any way.In ""The Craft: Legacy"" the main antagonist is none other than... patriarchy itself (surprise!). David Duchovny basically plays a lazily written character that could be described as ""the very, very bad man that thinks women are weak and they need to submit to the greatness of the male"". Seriously, how stereotypical and predictable is that? So, while in the original film, the girls have a falling out and are pit against each other, in this sequel, they also have a falling out, but eventually team up to fight a greater evil: men. But, to be fair, not all men in this movie are absolute trash... only 93.5% of them are. In spite of this, ""The Craft: Legacy"" is not really an anti-men statement, but more like a half-assed essay on the negative effects of male chauvinism. In doing so, the movie offers a bunch of contrived situations and artificial characters, like the school bully turned into a social justice warrior, after the girls put a spell on him. Though, clearly, they are the good ones, the girls are not portrayed as absolute angels who can do no wrong, either. As a matter of fact, at some point, they acknowledge that they have abused their powers and force themselves to quit magic altogether, which was refreshing.""The Craft: Legacy"" is definitely not a masterpiece and it will never gain cult status, like the original film, but it's not the unwatchable mess that people make it out to be. It should be mentioned that, while the 1996 flick had a few horror moments, ""Legacy"" doesn't even bother going there, and it ends up being more, like, a teen drama with a few sparkly stars here and there and a shape-shifting antagonist.",The Craft - Legacy
48,cristinalinderman,A bland-messy film.,2,29 October 2020,"* There is no end credit scene *The director Zoe Lister-Jones and crew brought a bland-messy film. The first film The Craft (1996) had its flaws but it was still a good film and this sequel could never be on the same level. I wasn't excited about this movie because the trailer didn't catch my interest but I was hoping to be at least a good watch and it wasn't, not even a little bit. There was no character development and the plot was all over the place, everything was happening very superficially. The magic looked so cheesy like watching a Disney movie about witches and there isn't anything wrong with that but this type of movie wasn't supposed to go in that direction. I did like the turn of events of the witches using magic for fun and for good, it was a different take on it from the previous one.The antagonist could have been better handled, the character might have probably saved the movie but since there was no character development it all kept falling flat, such a shame it was a great missed opportunity. If only they showed more background on the antagonist this story could have a sense of horror or a more serious tone, but if they thought of not doing it just to leave the character as a surprise well they were wrong because it was obvious from the very beginning. The ending twist was predictable from the moment they revealed the secret that was kept from her and it was so clear who it was going to be. This movie is rated PG-13 but I felt like it was rated PG.The composer Heather Christian brought beautiful music and it sets a magical atmosphere. Her music was great, but sometimes it felt too much or didn't quite sync and I blame the film. This music could have been better enjoyed with a more solid script.There was nothing wrong with the cast but it was hard to appreciate their performance when there was no build up in the characters and nothing to grasp with but there was one exception. I did like the performance of the mother of the lead witch, Michelle Monaghan. I like the way she bonded with her daughter though it didn't last long because it was another thing that disappeared while the story was rushed to the end.",The Craft - Legacy
49,igl-55560,Actually enjoyable !,5,15 November 2020,"In spite of all the progressist pseudofeminist agenda, I actually enjoyed the movie. It goes to show that one can actually include these themes with some talent. Teenagers are indeed going through different phases as they grow up and sometimes the father figure can be seen as some kind of pressure on their lives.
There is not much you can expect about a witch coven apart from girls' solidarity.",The Craft - Legacy
50,cruzarts-73946,The first EPISODE. Where's the rest?,3,1 November 2020,"In a nutshell, this movie comes on like a plate bearing tasty morsels, that are pushed off behind your back. The plate is placed in front of you with the announcement: ""Come again, there will be more.""My response, ""I'm still hungry.""
This film leaves you starving. After the initial sights and smells, there is nothing. Not one bite.THE CRAFT: LEGACY spends a lot of time building up interest in characters who ultimately go nowhere. They simply stop. Not once does the plot circle back to sew up holes. It just plods forward.Excellent youth cast. Four young witches I was amped to get to know, but nothing. Three brothers who are very intriguing and whose characters ultimately go nowhere. Then there's ""Timmy,"" played by the sublime Nicholas Galatzine, whose character undergoes spectacular development, but whose fate plays out in the wings... off-stage... and it's never even addressed in flashback or ""strange visions"" whose mystery is revealed later.THE CRAFT: LEGACY is cursed by lazy plot construction.Then there's David Duchovny, who has become the creep from Central Casting, and this film takes him in expected directions. He is boring in a bland role. The reports of addiction and alcoholism have played out on Duchovny's face, which is heavily creased and puffy, like a Shar Pei dog.I endured the end-credits, thinking there must be more.",The Craft - Legacy
51,macbell2012,What?,2,26 January 2021,"Don't waste your money.
Acting was below normal and really a C movie!
No plot like the original",The Craft - Legacy
52,edgarkaz,"Great cast, no build up or character story's",2,30 October 2020,This had a lot of potential. It fell short because they didn't do any telling of the characters backstories. It came off rushed and unpolished.,The Craft - Legacy
53,matt_hew,The Craft of Rehashing,2,29 August 2021,This is basically an undeveloped rehash of the original except they changed up the ending which makes no sense to the rest of the movie and feels like an afterthought - in the same way as shoehorning Fairuza Balk in at the end.,The Craft - Legacy
54,aucottjohn,Literally the most annoying cast ever,1,22 November 2020,Totally ruined another great film.Sack your casting agents. And writers.,The Craft - Legacy
55,alexkzapf,Should have been better,5,28 October 2020,"I enjoyed the first one. After all these years, I thought this should be okay. Don't get me wrong. I know what I was getting into when I watched this. But. Even at those expectations. It failed to deliver. I saw the twist from the word go. It is as if a lot of things were missing from the story. For lack of a better explanation. Again just thought it was going to be better. Acting was serviceable for the dialogue and the scenes. I believe the actors did their best with what they were given.",The Craft - Legacy
56,Larsii90,Better than the new Charmed series,7,3 January 2021,"Far from the original, but it was watchable. They made some very interesting turns in the story that separated it from the original, while it kept some nods and clear ties to it.The practical magic is pretty cool and fresh, but wish there was more use of it. I liked the characters, thought there was close to zero character development on most of them. Especially the stepdad and everything he was doing (many unanswered questions there). Overall some cool nods and it kept me interested, but it doesn't live up to the original, is slightly forgettable and a lot of wasted potential. Gave it a 6 to boost the ranking, as I would give it more than the current one.I am a huge fan of every movie or show focusing on withces, so I've waited for this film for years. In that regard it dissappointed, but by far not as much as the reboot show of my favorite show ever, Charmed. So that's something. I'd honestly prefer a tv show version of this Craft movie instead of Charmed. This film gave me tv show vibes too, especially the films poster",The Craft - Legacy
57,popsalicious,"Boring, predictiable and amatuer",2,30 October 2020,"Not worth the watch tbh. Unfortunately i didnt come to imdb to read the reviews before watching this nonsense, as i usually do. This time around, i thought it should be good and boy was i wrong! I have a lot more to say but would rather go make tea and spend my time wisely!",The Craft - Legacy
58,amine-2010,From a huge fan of original,6,28 October 2020,"Why low rating?yes classic is dark epic film but this one is like hes baby right ?Let's be honest I thought I'm going to hate this movie but what I found was pretty smart film,I love it the new elements of witchcraft ,good period time 2000s,(No-spoilers) oh connection from orginal film was a damn great,ending was suprising and touching,
Overall smart entertaining witchery time film.",The Craft - Legacy
59,sasham-86608,"great,funny,relax",7,15 November 2020,"It doesnt have much to do whit original title,but it was interesting to watch. it feel likes its too short and it would be just begibibg of good series . very relaxyng to watch .Nice one !",The Craft - Legacy
60,tavismelvin,Here's a true honest review not biased at all.,10,29 October 2020,"Don't listen to these 1 star reviews. It was so much fun to watch. Not terrible at all.It was a pleasant surprise. You know the phrase haters are going to hate no matter what. Please
do yourself a favor and watch this movie. It deserves so much more credit than these 1 stars. I promise you won't be disappointed. We loved it.",The Craft - Legacy
61,iainmcleod_800,Literally a proper review,8,22 August 2021,"Ok, so, i sometimes feel reviews are one sided - either people part of the movie or their friends/family, or the opposite!Well, i am neither (see my other reviews) and i actually really enjoyed it.What r people expecting? All the characters from the first movie to cameo?!They got the best one, so calm down.People saying it's woke? I am the most anti-woke person ever, this is not woke. The original focused on 4 women, and nobody complained, so this is not got an agenda. Yes they make the boy go crazy, but they show the consequences. Can i just say, his acting was amazing.So, if u actually just go into this film with no expectations, u'll enjoy it.",The Craft - Legacy
62,Grimsonia,Zero Build Up to shallow insta witches with Harry Potter magic,2,14 January 2021,"So, the girls meet and with zero effort are instantly ultra powerful magic users?
Worse than Rey being a full fledged Jedi as soon as she gets a hold of a light saber.The girls themselves have no synergy together. We don't get any back story on their lives or personalities. They are shallow paper dolls flitting around the screen performing Harry Potter like amazing feats.And then there's a warlock which I actually thought was a nice addition if the story itself had some meat on it, which it didn't.Shallow disjointed mess and everyone who had a hand in bringing this to production should be publicly flogged.The only really cool part was seeing Faruza Balk and the end.",The Craft - Legacy
63,rs-89619,Agree to Disagree,7,6 November 2020,Even though this version was a mediocre version of the OG. The only thing was the structure & foundation of the character development of how the girls became witches. It was very entertaining. The surprise ending wasn't predictable it was coming. I rated this one a 7 for research development & minor add one that were made to make this movie what it is. Mediocrity.,The Craft - Legacy
64,Molly_flower,Just dont bother. Watch the original.,3,6 February 2021,"It lacked the 90s angst and attitude, likable characters etc. The original, as usual, is much better. There, I saved you 90 minutes of your life. You're welcome.",The Craft - Legacy
65,ryanlion-38514,A truly aweful experience.,1,9 November 2020,"If you are gonna slap a movie title as big as this on it at least show some effort. It lacks plot, character development, coherency, backstory and oh yeah like one user said Magic! I mean like magic as in a feel of a good movie and it was an Epic fail. I barely made it to the end. I wish I hadn't.",The Craft - Legacy
66,df4205,No magic and no heart,3,1 November 2020,"A hot mess of a film that doesn't know if it wants to be a sequel or a remake. Oh, where to begin? Firstly--weren't there supposed to be four girls? Like the Rocky Horror before it, one of the main reasons the original worked was the characters. The original became a cult (no joke intended) classic because it spoke to the often maligned groups of young girls/women that weren't often portrayed in film.Whether you identified with Nancy as the poor trash girl who is surrounded by the affluent who looked down on you, or it was Bonnie and her scars that reminded you of that physical defect that made you unpopular: There was a character to relate to. Here--there is none of that. From the first moment we see the girls on screen, we're struck with just how ""normal"" they are. My first thought was: ""I think you've forgotten your target audience here."" The original spent a good deal of time making us identify with and understand why each girl was a reject from 'normal' society. Here, they're all pretty and seem of reasonable means when compared to their peers. Heck, the one girl lives in a house that you can literally run down its halls!So, our MAIN character (I put that in caps because she is literally the only character we get to know) and her mother are moving in with mom's boyfriend and My Three Sons. Well, evidently nobody bought this girl the book ""Are You There God? It's Me, Margaret"" because she has an unfortunate accident in school. Then Carrie uses her supernatural telekinetic powers to take revenge on all those who laughed at her! What? That's a different movie? Oh. Well, you can understand my confusion. Anyway, she meets the other girls and...you're a wizard, Harry. She of course takes this news with little muss and fuss and is soon casting spells. Naturally they teach her THE CRAFT by instructing her how they ALWAYS form a circle of salt when they cast spells...and by ALWAYS--we mean just this one time and then it is never spoken of again. There's an odd moment of ""What's your lineage? You have to get it from somewhere."" Um, what? Wasn't Sarah's whole deal in the original was that she was a 'Natural Witch'? (Yes, I know she got it from her mother, but it does imply that witches can be born with the power.) Given the ending (that was completely ruined by the trailer) this lineage thing leads to some serious questions. (SPOILER ALERT!) Nancy didn't have any magical lineage that I'm aware of--so no--not sure what your talking about. Well, anyway, they stop time, move things with their minds, and levitate...this sounds like something Spelling would write...oh wait.Anyway, the movie takes a serious left turn into Soap Opera land when the girls cast a spell on a mean guy to make him a nice guy. Umm...sweetie...I don't think you read that spell book. I'm pretty sure any practicing witch would tell you your instruments to be cleansed (and possibly sacred)...I'm not sure a bong counts. Well, now he's just one of the gals! There's an endless and agonizing scene where he confesses that he has bisexual leanings. Being an outcast herself--no wait--no she isn't--whatever. Our heroine decides to screw with his already confused sexuality by casting a love spell on him....our hero ladies and gentlemen! Am I missing something here? Look, I'm all for you playing to the LGBT crowd that love and support the original...but wasn't that the point of including a Trans character? You remember? The one you made such a big fuss about including? Shouldn't you...I don't know...give her some focus! Well, look--we're right back to forgetting our other three girls exist.Now we hit the point that really veers away from the original's message. The original had the very strong message about power corrupting. We understood why each girl let the power go to their head...but it was still a big part of the plot. Now--the other three almost immediately realize they've abused their power and take steps to limit themselves. There is one vague moment where you think there might be some repercussions happening...but it turns out the brother sleepwalks. Huh? Wow. That was the worst fake-out I've seen in a long while. I'm glad it was never mentioned before and then never spoken of again. Well, this time around the message is girls are good and down with the sexist male regime! Yes, only men can be corrupt evil pig-swine who want nothing more than to take a woman's power away. Yes, it turns out the stepdad is an evil manwhich (thank you Xander from Buffy). Of course, for those of us that remember our Thundercats, this moment was spoiled at seeing his family crest. Well, girl power to the rescue!Well, its finally over...and none of us have to go to jail for murder. Too bad about my bisexual friend though...oh well. Too bad about my stepdad's sons too. I mean, they didn't really do anything...oh well. Time to go find my birth mother...yes, I was adopted. (Spoiler Alert again!) Well, turns out its Nancy....dun dun dun! How? Good question. The movie takes great pains to avoid answering who my father is. Now we all know it couldn't have been Chris; considering he and Nancy broke up months before the first movie started...and she didn't seem pregnant. Has she been in the asylum this whole time? Was the janitor my father? So--how does this make any sense?A manwhich did it.Final Thoughts: Who are these people? That seems to be the massive lumbering dinosaur in the room. We spend WAY too much time with the Main girl; to the complete detriment of the others. I don't know them and therefore can't identify with them. There is absolutely no characterization or development here to make you care one whit about any of the other three girls. Which maligned group are these girls supposed to represent? Part of the charm of the original characters was that they appealed to several underrepresented social groups. Here--they all sound like Valley girls that just want to 'dish' about boys at the mall. And look--I'm really not trying to downplay the bisexual guy's story. I really appreciated the comment about how everyone just assumes he's ""GAY"" because he happens to like both. It's just too bad there wasn't some other character on the sexuality rainbow that could have made us feel for her struggle with non-conformity and gender identity. Someone in the Pans or Trans spectrum perhaps. Oh...if only that character had existed and had received more than two throwaway lines about her difficulties.",The Craft - Legacy
67,nch-35770,Average,5,3 November 2020,"This wasn't as bad as people are describing it to be, but it wasn't memorable. A lot of bits that are started and not finished. The villain? Laughable. Did they blindfold someone to pick it?",The Craft - Legacy
68,bianca-423-52002,Okay for a new generation (I think),7,21 November 2020,"I don't thing 4.2 is fair for this movie, but admittedly, it does not have the same charm and sass as the original - but honestly, it's not the worst thing to watch",The Craft - Legacy
69,miinty,Those who saw and loved The Craft when it first came out will LOVE this remake/sequel...,2,30 October 2020,"...because you will be so GRATEFUL with the selection of movies we/you grew up with.
Full disclosure, I was totally with the movie for the first 15 minutes, and then, I don't know what happened.. she caught her step bro and then the movie just turned into scenes with no story.
I feel like the tension was leading one way and the ""story"" was just like ""Look over there!"" There was NO character development. None. The three other witches were just there for what? For a fantastical Peter Pan discovering magic scene - full on with Tinkerbell's fairy dust.I do feel like up until Timmy's confession it could've been pretty good, it really felt like it was going somewhere, but then, detour.Also, people calling the final battle CW/Charmed-esque, aren't over exaggerating.2/10 for the first 15 minutes.",The Craft - Legacy
70,D31an,It should not have been made.,3,31 October 2020,"It lacks the spark the original had. The ""fight"" they had at the end could be barely called a ""fight"". And David really played badly the bad guy/""demon"". All in all, nothing much. Story is surficial, it does not have the deep side the original had. Badly done.",The Craft - Legacy
71,lewismusgrove88,Disappointing,4,28 October 2020,"The movie was much more tender, drama like and ""woke"" than I cared for to be honest. There was literally zero character build-up and whilst the acting was good, the storyline was pretty basic overall. I would've liked a darker tone with another nutter (Nancy style) who takes stuff too far and walks on water so I was kinda disappointed with this high school TV movie offering. The twist was pretty predicable too but whatever, I've come to the realization that remakes are never as good as the originals.",The Craft - Legacy
72,RanDizzle1198,Ether than I thought but not great,5,10 December 2020,"It was an interesting watch and if you tried not to compare it to the original it could have been enjoyable, However, there were many holes I. The story line that should have been filled. A lot of confusing spots that you had to figure out how things were playing out. Sad because the actors and actresses did very well and deserved a better story line. I will watch the film again to see if I can find a better storyline that I missed the first time around. As a Witch myself, I am saddened to see certain things in the film that do not truly happen however very happy to see that the girls bound themselves when they realised that they were using manipulative magic. That is a very big no no among Witches. True witches know that using manipulative magic is against the rules I know it was nice to see how the film really showed that side of witchcraft.I'm going to give this film a second watch and perhaps I will see something new that I didn't see the first time around at least I hope that how this plays out. Go into watching this film with an open mind and maybe you will find some enjoyment out of it but if you go into watching this film expecting an exact replica of the original you will be sadly disappointed.",The Craft - Legacy
73,tonytangney,Strictly Teen Girl Territory,1,4 May 2021,Blumhouse has never been top drawer but at least it was a little scary once upon a time. The Craft wouldn't scare your hamster. Aimed at a specific demographic and even they might not appreciate this. Social issue boxes geting ticked and girls smash some patriarchy and that's about it. Really poor.,The Craft - Legacy
