,User_name,Review title,Review Rating,Review date,Review_body,Movie_name
113,jaeelbooks,"Few Good Points, Many Bad Ones",3,29 November 2020,"'The Craft: Legacy' was a rather mediocre addition into what is sure to become 'The Craft' franchise. When I heard Fairuza Balk was making an appearance in it, I became eager to see it. When I then saw that her screen time was cut to less than a minute, I was ultimately disappointed. Putting her very brief appearance aside, 'The Craft: Legacy' seems more like a toned-down reboot than an actual sequel to the stunning original film. 'The Craft' - original - was exciting, dark, creepy, had a killer soundtrack, and a solid plot. It was not short on the scares. 'The Craft: Legacy' has a killer soundtrack, a bland and disappointing plot, too many 'look, we're having so much fun and isn't it pretty' bright parts, and zero scary moments or true homage to forms of witchcraft that could even be relatively possible. Of the cast, transgender actress Zoey Luna gave the only real stand-out performance, and there was a decent attempt by Lovie Simone, given the unimpressive dialogue she was tasked to work with. Cailee Spaeny's 'Lily' seems too much like a Robin Tunney wannabe but without the edge and bravery. Of the cast's four main witches, Lily might have the strongest powers, but she's the weakest in all other aspects. David Duchovny appears as the wicked stepfather-to-be, and seems to run some kind of macho, male-empowerment cult that we learn far too little about to care. Michelle Monaghan does a decent job as Helen, Lily's 'mother,' given that her character is also rather weak and very undefined. Aside from Fairuza's split-second appearance, the film manages to pay homage to a few traits of the first movie - the calling of the elements and directions, the appearance of snakes (although briefly and not fully utilized), and the fact that the girls pair up while in school. What the film truly lacked, aside from it's way too politically correct script, was scares. I found it to be Blumhouse's most disappointing film in recent years. For a company that set a new foundation for horror in their earlier years, they fell way short with 'The Craft: Legacy.' They had an opportunity to make this film something truly great for this new generation, and they failed. Kudos to Nicholas Galitzine, who plays Timmy, for somehow managing to pull off a somewhat emotionally split and unbalanced role with a script that would have had me gouging my eyes out and praying to be recast, had I been him. Two rather fine actors Charles Vandervaart and Donald MacLean Jr. are so incredibly underused in this film that it makes their characters barely worth mentioning. If Blumhouse were to decide to make another movie in this franchise, they need to sit down, review the first one again, see where they went wrong, and give us something new and different. Otherwise, they needn't bother. If you haven't yet seen 'The Craft: Legacy,' it is available for $20 on pay-per-view and streaming services. Save your money. Wait until it's free one day. Then, you won't be cursing yourself as I was after blowing the money on it.",The Craft - Legacy
114,tj_viper12,The original was better,8,3 November 2021,The original was better but this one had some plot twists that I wouldn't even have thought of and the the ending was a head Turner I still don't get that one you'll have to watch it to find out.,The Craft - Legacy
115,orgrabbit,Skip it,3,23 March 2021,This feels like only half of a movie. A pointless and unnecessary waste of talent. Go and rewatch The Craft instead of wasting your time on this.,The Craft - Legacy
116,tomasctinoco,Not bad but definitely not good.,4,16 January 2021,"The movie is entertaining enough but it's slow, and not like a slow burn type of slow, just slow. There's no clear narrative, the writing is bad, the editing is really bad, and the ""climax"" in the film is weak and flat.",The Craft - Legacy
117,henriquemmd,Where is the spell to make this movie better!,1,29 October 2020,"This one was hard to see! Everything was so superficial and forgettable and the acting was very poor from everyone. The script was all over the place and full of high-school clichés. There is no connection between the girl the her stepbrothers and the way the story is told it feels like they treat witchcraft, supposedly something dark and evil, like a game. Not for Halloween. Just some dumb teen movie
Sorry but bad",The Craft - Legacy
118,shaista-28673,No soul !!!,2,29 August 2021,The actors are good looking ! The girls are suitably casted to include all diversity. But just give it a miss is my advice 😱,The Craft - Legacy
119,chrisgilmer,"Okay, so it was bad... but,",4,30 October 2020,"How many new movies have you seen lately that are good? I mean, seriously, I can't believe this was a Blumhouse picture, because most of their stuff is reasonably well produced.
And yes, this was dripping with wokeness. I also didn't think David Duchovny should have played the love interest of Lily's mom. He's looking a little long in the tooth for that part these days.
I gave it a 4 because I'm lowering the bar on tripping across a good movie these days. If you have some time to kill with your teenage daughter, she'll probably love it.",The Craft - Legacy
120,eggrolljr,Zero character development,3,30 October 2020,"What a misfire this movie was. The plot made zero sense, the new characters were entirely without nuance or development, and the visual effects looked like a bad Instagram filter.It felt like the writer was so concerned with making the central cast come across as perfectly moralistic do-gooders, that they forgot they where writing teenagers. When a male (Timmy) is the most interesting and fleshed out character in a Craft sequel, you've done something horribly wrong.You'll see quite a few moments in the trailer that never showed up in the actual film, which leads me to think that the heavy hand of an editor was involved in this one. I knew this movie was seriously in trouble when the central conflict wasn't even introduced until the last twenty minutes.This feels like the Nickelodeon version of The Craft, with all of the original film's edges systematically filed down to smooth nubs that won't injure anyone if they accidentally bump up against it.",The Craft - Legacy
121,angeliquedecock,It was ok I guess,5,10 September 2021,"I laughed a lot because it was so terrible at times. The plot? What the hell was that.It was on its level entertaining and had a few chuckles. I also think that it wasn't meant to be funny but it was so bad it was funny.I still have a lot of questions. Very messy. Bad acting. And the role of the mothers boyfriend ?What ? Why ? And ow why ? Her legacy ? Need more information.No character development whatsoever. The powers where like poef. They have powers. No illusions, no thrill.The boys ? Why where they even there ? It was like They where only there for eyecandy for teenage girls.",The Craft - Legacy
122,fefekekewwf,Wasn't as good as the first one😐,5,31 August 2021,It wasn't that bad and it was not as good as the first one...I liked some moments in this movie and I kinda liked the plot twist in the end but the things I didn't liked in this movie is the characters and especially the main character and in the middle of the movie I felt bored...I don't Think they're going to make a sequel but if they did i'll watch it.,The Craft - Legacy
123,Mr_Opinion-74537,The Film That Veered Left...,1,31 October 2020,"Adults - This is not ""The Craft"" sequel that your looking for, pass by on this one!
Teens - May be able to relate to the characters, might be worth a watch!
Kids - Probably shouldn't be allowed to watch this film!No, Would Not Recommend This Movie!",The Craft - Legacy
124,starlit-3,"Has a more ""Charmed"" Influence",6,10 November 2020,"Its was pretty good, although the they could of spent more time on how they attained their powers.
Rather then all of a sudden they had them.
It was like watching an episode of demon fighting in ""Charmed"".
I did like the ending, although I would have more believed her to be Sarah's child and not psycho Nancy's.
I hope it becomes a trilogy with the third being the best of the three.",The Craft - Legacy
125,nazthegreat1,All the mid 40s dudes here need to grow up.,10,9 November 2020,"This movie was great. It took The Craft to a new level. Instead of catty teenage girls who can't handle the magic and use it to punish each other, we get girl power. Don't get me wrong, I'm a MAJOR fan of the original and watched it so many times in my 30 something years on this earth... But we're seeking a new narrative here. Welcome to the age of feminism.",The Craft - Legacy
126,richardlindseycsc-94678,Eh...,3,25 December 2020,"Okay, not even close to the original. At best, they could have given it a different title. But at worst, they left viewers expecting great things. I will admit it wasn't a total waste. Sorry for the weak review, I put as much effort into it as they did to the movie.",The Craft - Legacy
127,mcleaver-41776,I actually enjoyed the movie👍🏾,9,29 October 2020,"I enjoyed it, it was optimistic everyone seems so miserable right now and I think it was a PG-13 movie for today. I loved the original Craft, and I really enjoyed this one too. Plus it's nice to have new options to watch during Halloween.",The Craft - Legacy
128,NicholasMCG,Full of plagiarism from indie horror movies,1,15 November 2020,I fully expect that Blumhouse Studios will be sued. This movie sucks and even the scenes they stole from some great indie horrors realeased in the last few years weren't as good. Don't bother. Blumhouse must be too busy in his hot tub or on a yacht to be checking for plagiarism from his lazy untalented writers.,The Craft - Legacy
129,leejjones-92486,Bad,2,30 October 2020,A bad film with undeveloped characters plot holes and weird choices they will show a girl on her period but not a full condom give it a miss,The Craft - Legacy
130,beybladewithus,Terrible movie,4,27 July 2021,Terrible movie there trying to hard and trying to hard to be adult like. But they failed.,The Craft - Legacy
131,Tayyasqueen,Not a Bad Sequel,10,28 October 2020,"This movie was better than I anticipated it being. It is not the original and not near as dark. But it is a good watch. Great acting, casting and execution. Witchy and I enjoyed it! The very last scene is pretty cool and connects to the previous film. Gave me goosebumps!",The Craft - Legacy
132,deni_sway,What the.. ?,1,31 October 2020,"I really don't know what I just watched! I saw The first movie when it came out and was really excited for this sequel.. but what the hell just happened here? Zero character development, the story.. there is no story besides the fact she somehow is connected to one of the first movie characters and probably that was the only thing that made me watch this disaster till the end.. to see Nancy again.. for about 2 seconds.. in the whole movie.. yeah..So many holes.. how was Helen connected to Nancy? Who or what was that Adam guy? He has a family crest with a snake and a knife.. cool.. and that's about it, all you get to know about this guy.. oh and he has 3 sons that are like just there.. adding zero to the movie (that scene where one of them is apparently sleep walking in Lily's room.. ???) What's the background on the other girls (I cant even remember their characters names, that's how good it was)? They were supposed to be the main characters.. When I saw ""legacies"" I was expecting that the girls were connected to the originals.. in some way.. but no, not even a tiny mention of them. Aaaand how did Nancy got pregnant if she was locked up in an asilum all this years?!I just can't.. I'm sorry guys, but this one shouldn't exist.. :(",The Craft - Legacy
133,jeremiahxacosta,Pretty good but.....,7,8 November 2020,I like everything but then the ending I love the characters and interesting first two halves but then the ending went full cringe on me,The Craft - Legacy
134,collin_nuke,Better then I even expected but I want a darker 3rd film,8,29 October 2020,"I absolutely love The Craft. I know this originally was planned as a remake - which I would've enjoyed seeing just because I love seeing films be remade during new ages. But they decided to make this a sequel and it was actually really fun to watch. The acting isn't bad at all, and if there was a lack of seriousness, David might be the only part of the film that could've used a bit more ""mppphh"". I saw the ending coming- still loved it though. The cast was believable, like able and what not but I would have enjoyed more bulk to the story. More character development. It like seemed too ""normal"" that these girls were just witches lol. I would love to see a 3rd film... but I want more magic, more nasty boys who deserve to be thrown out windows, more evil, more darkness... maybe these girls will go off to college Together. I want to see the magic consume them like in the original. It felt a bit too ""PG"" at times... still really enjoyed it... but I would enjoy a darker 3rd.",The Craft - Legacy
135,sidlone,Sad,5,14 March 2021,"For a movie about personal power this movie was sorely lacking. Cast chemistry, story and character development are the differences between the original and this one. The overall chemistry of the teen characters just wasn't there or was destroyed by lack of writing, directing, or just rushing the whole story. The plot was obvious and the whole storyline rushed. The main character played by Cailee, had tremendous potential to live up to the original but whether the story ended up on the cutting room floor or was never written, I don't know. i was really looking forward to this but unfortunately, all-in-all,I'm disappointed. If cut, then they should release a director's cut. So much potential just wasted.",The Craft - Legacy
136,xtidusxyunax,How is this a film?,2,5 November 2020,One of those films where things just happen and has a non existing story structure.,The Craft - Legacy
137,jessica-13899,Much better then many are say,8,23 February 2021,"Did it have its faults, yes and in my opinion the biggest one was the climax was a little rush but I think some of the negative reviews don't like that it's a bit more progressive and it's not women attacking women.I would like so more back story on the bad guy and a little bit more back story on the girls but it was enjoyable and made more sense then the original to be honest",The Craft - Legacy
138,vowhite,Gen Z Cheesy and just not worth it,4,28 March 2021,"I've never made a review until now...
I'm a HUGE fan of the first since it came out when I was a younger kid. Still remains one of the best movies from my childhood.So while I had small expectations from the trailer but I still had an open mind going into it.The cons definitely outweigh the pros.Cons: There was ALOT of unanswered questions, lots of things were thrown at your randomly, the scenes were rushed, the effects were boring/very cheesy af, and the majority of the actors mostly the girls and parents were very cringy. And the way the humor and comedic relief was thrown in just wasn't it. And It just felt so underwhelming. And it is def built around a Gen Z audience instead of the older audience who loved the original and made it a cult classic
Pros: it had some potential, the main actress who played Lily was ok. The actor who played Tommy was better and the best of the cast. Probably because of the actual and only character development and was very well played. Not to sound harsh but that's about it.In the end this whole plotline seems like something a high school teenager would've wrote for a English creative writing story.Very disappointed but not surprised.",The Craft - Legacy
139,danielthompsonfp,"Not sure what ""legacy"" this leaves behind..",4,23 April 2021,"I've never seen the lead actress in another film before, but let me start out by saying that I hope she doesn't stop with this film. She is one talented actress, and I hope she's able to use her gift in more reputable and respected films in the future.I'm not going to bash this movie, because I don't want to sound like that 30 year old that can't let go of the decade he grew up in. However, I will say that if you grew up watching the original film, odds are you won't care for this one.This version is very generationally focused, they hit every mark when it comes to inclusion, there's a bunch of weird magic effects, the plot was very all over the place - it just didn't sit right with me.In closing, I do want to mention again that the lead actress was great! If I enjoyed anything about this film, it was her. I really do hope to see her in more!",The Craft - Legacy
140,melissamariekrall,mama this is garbage,3,11 November 2020,"Yeah it's just terrible. Love the original but this...this is taking trash to a whole new level. Some pretty bad acting, some truly awful visual effects, and just a general lack of plot. Also, where the magic at???? I'm pretty woke myself but good lordt do they bash you over the head with it. Big oof energy.",The Craft - Legacy
141,timithious,Haha,1,31 October 2020,Quit making horror movies family friendly! Literally a bunch of garbage compared to the original. I'd skip it if I were you. Might be scary for a 6 year old.,The Craft - Legacy
142,samwillis-86658,Just ok,6,28 January 2021,"The acting was pretty good in the film. But, the storyline really fell short. It was rushed with a few missing pieces in it. The original was much better with it's thrilling storyline and plot.",The Craft - Legacy
143,joeblack-23831,Why all the hate?,8,30 October 2020,"I mean were you hanging onto an 80's flick expecting the same new experience? It was pretty good. Not great, but definitely worth the watch.",The Craft - Legacy
144,spock-billy-spike,None of The Roughness that Made the First so Original/Entertaining/Worth Watching,2,1 November 2020,"Not a bad movie in its own right but it for sure isn't at all related to the Craft. It's an ok coming of age story but it's just 120% too much at times. Everything lines up perfectly so that the characters can have sassy lines and the story progresses at the right pace. I love what they're going for but then once you get a sense of the script then you can predict the character choices all throughout the film. Also... let's talk about how it's all about being woke and consent (which is great) but the Lily clearly puts a LOVE SPELL on a boy. Which, I don't know about you but looks like something akin to drugging someone. Lily takes advantage of that boy, he is not making his own choices and that is sexual assault. It's not okay because he's a boy and maybe he liked her before and whatever excuse you have... he didn't kiss her until she put a spell on him. A rough comparison but Lily is basically the bad guy in Jessica Jones. Just boil it down to: human manipulates/drugs other human so they can use them as a sexual puppet. One line by one of the characters about it not being consensual (after earlier in the movie they talk about consent in the school like the screenwriter wants to make it clear that it's not being taken seriously in society) does not equal this movie taking it seriously.Cliche, totally hypocritical, moments that would be individually cool do not make up for the other 99.9%.Just.... don't even try it",The Craft - Legacy
145,curtismenne,I'm glad I didn't trust the reviews. A solid modern sequel.,8,30 October 2020,"So I am going to go out on a limb and say that clearly a lot of the negative reviews are I am sure from people who didn't like the movie but were definitely not the target audience.I will do my best to avoid any spoilers.Let me preface this review with the statement that I did enjoy the film and like it a great deal. Kudos to all those that were involved in the project on doing your best to capture the magick that made the first film great. :)The movie was well made, well acted, and captured the spirit of the original while making it fresh with a modern perspective. Also it was nice to see Wiccans shown in a more realistic light as in that it's about positivity and not about Satan or hurting people. Witchcraft has nothing to do with the devil people, that is Christianity! There is no devil in our religion. The one thing I do not like is that it felt heavy handed with women good, men bad. A film representing Paganism of all things should be about balance and equality so the sexism is pretty misguided. I mean where in the $@&* was the male witch representation in this film? For trying to be modern and diverse they should have had a male witch somewhere in the film or at least referenced. I am sorry but being male and Pagan who grew up in the 90's when the original came out I understood that male witches were too tough a concept for people to grasp back then but it's 2020 so don't make Paganism into some sexist gender war. The movie felt like it's messaging was that if you were male you had to be LGBTQ to not be evil and that kind of sucks. It's bad enough that Witchcraft gets demonized and mocked by those who don't understand it but to have The Craft sequel in 2020 still give us no love well that is just a damn shame.
Now that my rant is over, once again you guys did a great job and I look forward to more films from the crew involved. The actors in the film did an awesome job and I hope they all have bright futures ahead of them!Blessed Be!",The Craft - Legacy
146,anilakygt,Worth the watch!,10,29 October 2020,I never write reviews for anything. While nothing every compares to the originals...the ending of this alone is worth the watch. Perfect ending for the fans of original.,The Craft - Legacy
147,krissa75,Stop remaking things. Just stop.,2,1 November 2020,"I do hope none of the tween girls to which this movie seems to be geared wants to see the original because they will be in for a shock (and possibly counselling).The best, most honest, moment of this movie is in the opening scene and it goes downhill very quickly after that.Zoe Lister-Jones might have had a very clear idea in which direction she wanted this movie to go but it was the opposite direction of the original. The original was dark and broody. This is bubblegum ""horror"" at its worst.The story is similar to the original movie with every bit of atmosphere and controversy sucked out of it. The acting is wooden with a special mention to Duchovny who clearly couldn't be bothered, the set-up is trying way too hard to be ""woke"" up to the point you could devise a drinking game to it and be on your way to the hospital by the end titles. To contradict the being woke part most of the characters are one-dimensional clichés (Ooh let's use magic to do our make-up!!!) with no character development.I do hope this doesn't get a sequel because Fairuza Balk deserves better than this.",The Craft - Legacy
148,paulroberts-53775,A Witch of a good time,8,30 October 2020,"Firstly let me say that I enjoyed the craft legacy and yes it did have some issues but overall a decent sequel to the first craft.
The only criticism that I have it could of been a little longer to flesh out the characters more, but all in all a good movie with lots going for it.
So check it out and you won't be disappointed.",The Craft - Legacy
149,freeboarder,Good sequel to the original with a modern twist,6,17 March 2021,I loved the original I would give that a 10/10. I thought the main actress in the new one was very good. The story was similar to the original but had a lot of added ideas which made it interesting. The beginning and middle were very good. The ending is only ok except for the very end which was excellent. Overall a well deserved 7/10,The Craft - Legacy
150,marianadulantob,Absolutely nothing compared like the original,3,9 November 2021,"This movie has many flaws: the cast, the direction, the script... the flow, the engagement. The focus goes from one to another subject and it doesn't give you one interesting part of the plot to get you engaged. At all really. It is messy, bland, uninteresting, slow. The craft legacy is a production without charisma. I knew it was going to be impossible to match the craft 1996, obviously, that cast was true magic. However, there are many actresses who could have filled the shoes of their predecessors better. This movie seems like the giggly ""girly"", maybe even light and sugar/gluten free version of the 90s movies. It had no flavour, no intensity, no passion, no sense.",The Craft - Legacy
151,iamkeiran-381-350454,Makes less sense the more you think on it,2,11 November 2020,"This was like a really long episode of charmed. But, a bad episode. One you never want to see again. Plus, the more I think on it, the more it makes less sense and makes me appreciate the firSt film... And charmed.",The Craft - Legacy
152,sirgarrykay,Ok this movie is not bad at all!,8,4 November 2020,I'm a huge fan of the original let me start off. This movie has so many elements of the first. A ton of homages and similar elements. But this one actually has like a story intertwined within the story of The Craft. It does use more magic in the sense of powers whereas the original Craft didn't use special effects. This one lines more in the department of Charmed meets the Craft in that aspect but I really enjoyed it and the connection to the original character was awesome to see. I can totally see a sequel occurring. You'll like it. It's not a remake. Don't judge it like it's trying to replace the original. It's a good movie!,The Craft - Legacy
153,stevelivesey-37183,Unwatchable,1,22 August 2021,"Total waste of time. The original was at least passable but this is badly written, acted and directed. Avoid.",The Craft - Legacy
