,User_name,Review title,Review Rating,Review date,Review_body,Movie_name
357,Lawrence-20,Best Western,9,29 December 2000,"I can watch this movie again and again. It is the best western ever made. My favorite part about this movie is the fact that there are no heros. little bill and william munny are very similiar, both have a ruthless streak. The only thing that separates them is the fact that Little Bill happens to be a law man and the fact that Eastwood's character is a step more evil than little bill.  Little Bill is more evil than the duke of death and eastwood's character raises it up a notch from there. When he grabs the whiskey bottle, you know that he has just snapped. I can find few flaws with this film and can find something new to appreciate ever time I watch it, although the morality of the kid realizing killing is a bad thing was laid on a little thick. The entire film builds up to the last 10 minutes. During that last 10 minutes you will see the most purely evil, dangerous and frightful cowboy ever put to film. On a scale of one to ten on the evil/dangerous index: duck of death : 6  Little Bill: 8  William Munny: 11",Unforgiven
358,Dave_Violence,A Good Movie About Bad People Doing Bad Things for Bad Reasons,9,20 November 2008,"I finally got around to seeing this after a self-imposed boycott of CE's movies, starting right after Firefox. Unforgiven is a good western and a good movie. I don't see it as ""Great,"" though. But... who am I? No body.With that out of the way...With the climax, when Will clearly - and perhaps more in control of who he used to be - states that he will kill any man who shots at him, then the man's family and subsequently will burn down the man's house, the title of my comment flashed through my mind.None of the characters has any good in them whatsoever. How's the movie start? Rough sex in a whore house. Next scene, violence against a woman consisting of a knife to the face... and so on.Nevertheless, the film is all about this event and what it drives people - BAD people - to do. BAD people set out to assassinate them boys what cut up that whore - for money, because the whore's friends (also whores) put up the reward.What makes this a good movie, for me, is that none of the characters show any goodness: they stick to how bad they are, how weak they may be, and how afraid of death, in fact, they are, too. Courage is gained through hard liquor, money is gained through murder for hire. No one apologizes.What puzzled me was Morgan Freeman's character. Perhaps this is one of the ""redeeming"" things about this ""anti-violence"" movie (it is not, no matter what anyone says - it is a move about violent people and the violence of their lives)... See: there is no racial angle at all to the story. Yet the Civil War is not such a distant memory and it's not at all unreasonable that some of the characters would be veterans of either side. A black man in the 1880's, with property, married to an Indian (let's call her that for continuity with the genre) would raise a lot of racist eyebrows - yet this doesn't occur at all and built around Freeman's character is a total color-blindness. It didn't wash with me - not that I want to see racists in film, but maybe it took away from what was otherwise a very real picture.Again, as an older fan of Clint Eastwood's, I'm glad I saw ""Unforgiven"" but I see the credit it's been given as hyperbolic: ""High Plains Drifter"" is superior (and my favorite) - but that's a movie about bad people who did bad things to a good man who came back to do bad things to a bad town for good reasons. And Sergio Leone and Don Seigel both make it into that film - in name - too.",Unforgiven
359,Gabriel_Kuntze,I wanted to love it,6,14 September 2020,"Man, this movie was a disappointment. I'm not much into westerns, but nevertheless I recently decided to watch the ""dollars trilogy"", and boy did I loved it. So coming into this modern take on the genre, and with a cast like that, I was expecting a great movie, but sadly it was quite the boring drama which did nothing for me.First, the direction. I usually love Clint Eastwood's movies, but this one was rather bland. Everything was too clean and polished for such a harsh time, if you watch the Sergio Leone movies, everyone was dirty, sweaty, and had bad teeth. The shooting scenes are few, short, and nonsensical, extremely far away from the awesomeness of the movies of old - how the hell did Little Bill didn't shoot Munny after he took down the bartender, I will never know.
It has too many rainy scenes, which are dark and murky. It's cool to have action scenes in the rain (as unoriginal they are), but this one goes too far. It takes two hours to get to the last and pretty much only fight, but by that time I was almost snoring. I know there's at least two more shootouts, but they're not between two sides, more from one to another and then running away. I was expecting a cool duel like the times of old, but the movie was trying to steer away from the epicness of those scenes, because killing is bad or something about that.Now, the script. I understand that they were trying to take on the cowboys as more real human beings, with their own problems and weights in their souls, but this one is simply lame. It's like everyone's Mother Teresa or something. Most of the characters are huge cliches: prostitutes with hearths of gold, a hot-shot kid who lie about how many men he killed to impress others, a ruthless sheriff, and so on. The town was hilarious because not only was compossed by a couple of houses, but it seemed to have more security than actual people living in it. At the end I couldn't care much about anyone, not even Munny, because his dialog was always the same: ""oh woe is me, I did bad things in the past"", ""my wife straigthened me up"", ""ain't gonna drink or kill anyone else"", then proceeds to get drunk and kill everyone because his friend died.Overall, it's not a bad movie. I understand what they were trying to do, but sadly I felt bored and couldn't care about anyone. Perhaps I needed to be in a different state of mind, right now I want closeups of squinting eyes and hands reaching for guns.",Unforgiven
360,Gudhjem,A great western,10,27 May 1999,Unforgiven is the best western ever since the John Ford - John Wayne trilogy. A fantastic cast headed by Eastwood and Hackman gives us a story which crawls under the skin. It really shows us what can happen if you are unable to escape your past. It is a must see for all western lovers and even for my generation for whom westerns are just another kind of action movies like the Young Guns films.,Unforgiven
361,oh madeline,A misguided career achievement award,4,16 August 2000,"Many better anti-westerns have hit the screen than this lumbering, unnecessarily violent film.  But, it apparently was time to give Clint his career achievement award.  The acting is uniformly good, some classic scenes, but mostly one-note: ugly and depressing.  I lost interest after awhile.",Unforgiven
362,Homogeek,Cinematic Torture,1,24 April 2007,"A friend of mine explained Science Fiction films as torture. He wants to be grounded in reality not dreaming in the clouds. To some torture is a Foreign Language film. For me it is a Western, no other cinema is more painful. So why did I rent Unforgiven? Two reasons, one I am watching all of the Oscar Best Picture winners. Unforgiven was a noticeable hole in list of films in the past 20 years. Secondly maybe I have seen all bad Westerns and if I gave a good Western a chance I would enjoy it. Well that is a big 'no'. I had to fast forward at the half way point, the only reason I did not just turn it off was to see the credits and who have gone on to become stars in the 14 years that have past. No real break outs, Clint Eastwood continues to get accolades for acting and directing as Morgan Freeman continues to get nominated for the next ten years until Million Dollar Baby where he wins for best supporting. Saul Rubinek, a TV actor, most notably goes on to 3 years of 'Fraser' as Daphne Moon's fiancé. Richard Harris does Albus Dumbledore in the Harry Potter series among other roles. Gene Hackman continues a successful career. Frances Fisher goes on to a supporting part in Titanic. Unforginven is the story of Big Whiskey Wyoming. A cattle hand loose it when a green prostitute lets out a little giggles at his manhood's lack of presence. He cuts up her face with a handy knife. The owner of the saloon/ bordello, Skinney Dubios (Anthony James, who quits acting to become an artist after this film) complains to the Sheriff, Little Bill Daggett (Gene Hackman) about the monetary lost he will incur because 'no one will want to sleep with a cut up whore'. Little Bill decides to fine the cattle hand and his partner (I am not sure why the partner was ever brought in to this he never touched the girl and actually tried to stop his lunatic friend) in horses to be given to Skinney. The women of the brothel are outraged at the lack of substance in the justice. They end up pulling together one thousand dollars for a reward to who ever kills both the cattle hands. This brings all sorts of undesirable characters to Big Whiskey: English Bob (Richard Harris), a gunman that feels obliged to tell everyone that the fault of the U.S. is it's lack of a monarch. Wild Bill Munny (Clint Eastwood), Ned Logan (Morgan Freeman) and The Scholfield Kid (Jaimz Woolvett). All have a problem with Big Whiskey's ordinance of 'no fire arms in town'. Little Bill beats up every one who challenges the ordinance.",Unforgiven
363,eyeache,An Essay on Killing,7,7 September 2009,"This film is not too bad, but it's not really that good either. It reminded me of Lawman, made 20 years earlier, in 1971. Both films are heavy on what it takes to kill a man, in what you might call the everyday run of things, that is, outside a national war situation. Eastwood looks good, but he has only one persona, one expression, one tone of voice; hard, laconic, matter-of-fact. Both films focus on the killer instinct, the man who doesn't think twice about ending another man's life. Lancaster's lawman kills because it's his legitimate job; Munny kills for money, and for revenge. Lancaster ends up with nothing, but Munny ends up prospering in dry goods. Both films make you think. However, Lawman is the better film, with a better plot and script; and Lancaster is the better actor. My feeling is that Unforgiven's ratings will drop over time, whereas Lawman's will rise. See them back to back.Thinking about Unforgiven (what does the title mean?) again, I realise I've given it at least two too many stars.",Unforgiven
364,cuppa_tetleys,Why I'm not a fan of westerns,4,11 April 2011,"I don't like western films as they remind me of history in secondary school, which I hated. However I decided to give them a chance after watching the more recent '3:10 to Yuma' and thoroughly enjoying it. I'm a younger audience member so my film knowledge goes to around the late 90's onwards, so I thought I'd broaden my horizons. And I have come to the conclusion that if you're not a fan of westerns, then you won't like this film. Unforgiven is paced so slowly that it takes over half the film to get the main plot. There are hardly any action sequences, and when there are they evoke no excitement in me - they just take their time, which is perhaps more realistic, but I watch films that help me escape reality not mirror it. Which leaves you with a slow plot that offers very little substance, and the characters. The character are good, however, with Morgan Freeman, Gene Hackman and Jaimz Woolvet providing convincing performances. My problem, however, is with Clint Eastwood's acting. It's clear that he has thought about his character, but he only has one expression. This is the first film I've seen him in, and his face stays the same the whole time, as far as I could tell. His voice portrays grief and regret well, but even when he gets angry, his face stays the same as before making him impossible to read. That may be just his style of acting - not everyone has to be extremely expressive, but even his body language didn't convey anything to me, and it just irritated me throughout the whole film.Overall, I can't determine how good this film is, because I know it's intended as a tribute to westerns; for fans of the genre and as such I'm a poor judge because of my dislike for it. I gave it 4/10, based on what I felt as guy who has seen one other western in his life.",Unforgiven
365,michaelplewa,Perfection,10,16 January 2007,"Much is made of this film's ending. All praise it is due. However, the film is a sumptuous feast of larger-than-life tragedy by one of cinema's all time masters; Mr. Clint Eastwood. He's earned his spot in the Director's Hall of Fame since, but few films will ever achieve the perfection displayed on-screen in UNFORGIVEN. Reviewers, critics and fans describe the film as haunting and it certainly is. Eastwood and Broyles have crafted a Western that might have officially ended the genre, but if only by so masterfully stating its purpose.As the years have gone by since I've seen this film and appreciated it more and more, I have increasingly grown aware of its timeless significance. Plainly put; it is due all the hyperbole in the English language. You'll wonder, perhaps, whether any film can be that good. This one is.",Unforgiven
366,Sickfrog,The Last Great Western,10,14 August 1998,"In what has been hailed as the last great Western that will ever be made (though I recommend the recent ""Tombstone"" as well), Clint Eastwood proved that he is capable of creating a masterpiece. The amazing script, which slowly turns from what looks like any other decent western into an intricate study of morality and mortality and eventually, a message arises of the horrors of violence. Yet, it is Eastwood who truly does take this film up to the next level and then up several levels more. His bold, stylish camera work makes this film pristine and conveys every mood he wants to convey in every scene so that you could watch it with the sound turned off and still feel every emotion intended with every scene. Also, in front of the camera, Eastwood's performance is his greatest to date. He embodies William Munny perfectly. You see that he is a good man, a reformed and repented man. You sense the good that his former wife did him. And at the same time, you can almost feel those demons that used to rule him. The carries with him a brooding presence and you just know that this man has seen evil... he has been a part of it. The greatest struggle in this film, the suppression of carnal instincts, occurs within this man. And you watch that happen throughout the entire film, occurring all within him. Also, stellar performances by Gene Hackman (for which he won an Oscar), Morgan Freeman and Richard Harris maintain this films excellence. Also, Jaimz Woolvett delivers an emotionally dynamic performance as a naive young man, trying to prove his self-worth and maturity by trying to become the kind of killer Munny used to be, though the message is eventually delivered... what William Munny used to be is the opposite of self-worth and maturity. It was an animalistic and berserk nature that everyone harbors, and it is only through determination and courage that they can be overcome.",Unforgiven
367,jefvannijlen,Best Eastwood western. Unforgettable,10,8 February 2021,"One of my favorite movies of all time, and I am not really a western genre fan. Not only is this the best Eastwood western, it might just be the best western movie ever. And maybe the best Eastwood movie as well. I am not kidding, that is how good this movie is. It completely turns the genre upside down and feels very realistic and believable. The cinematography, story, atmosphere, cast, action and drama is just superb. I can't think of anything that is wrong with this movie. Clint, Gene Hackman and Richard Harris are unforgettable, so good! A true gem of a movie.",Unforgiven
368,badlieutenent,One of the last good Western movies,10,10 March 2019,"This movie it isn't like the classical American Western,is the pure spaghetti Western (made by American people): violence, whiskey and girls. 4 academy awards , and they're all merited. Eastwood is a real dude and an honest man. Dedicated to Sergio and Don (Leone & Siegel , who introduced Eastwood in films)",Unforgiven
369,stellaarwennicolina,Best western ever made!!!!!!!!!,10,11 October 2018,"I had to pursue my father for a long time, till he allowed me to watch that movie...
When I at least saw it, it was just great!
The story features Clint Eastwood in his best role! An old, leached out, past bounty hunter, who is living alone with his two children because his wife died.
When he gets the offer for another job, he at first wants to reject it. But when he later sees, he needs the money, he takes the offer.The movie also features Morgan Freeman and Gene Hackmann. The leading cast is perfectly chosen and it works together very fine.It's just great to see the 'man with no name', the 'high plains drifter' with a very touching background story and a heart. As a vulnerable man with strong fealings.
Clint's acting apearence shows, what he can be. Not only 'Dirty Harry' but a common man, with other problems than missing bullets.'Unforgiven' made me love Clint Eastwood even more.",Unforgiven
370,GlennDavidTaylor,An Incredible Masterpice of Film-making,9,10 May 2006,"I have always enjoyed a good western, and have enjoyed most of Clint Eastwood's work, but this is truly exceptional. Gene Hackman also gives one of the best performances of his marvelous career. What I loved most about this film was the way the story was told, and how it made me FEEL something. Many things. It is gritty, and hard, and pure, and deep, and at the same time, it is basic and simple. I believe that this is an important film, a truly great movie, and perhaps the best western movie of all time. I love this movie every time I see it. It scores 9 out of 10. EXCELLENT Movie!Desert-Buddha",Unforgiven
371,spencersb,Last (?) of the old westerns,7,7 May 2001,"Hard movie to figure out.  The bad guys are good (then bad again) and the good guys are worse.  Eastwood is trying to make a statement about the morality of gunplay, sends conflicting messages, but maybe that's what he intended.  Made AFI's top 100 list (98). Eastwood's character is likeable, but...well, I won't spoil it for you. I will say I felt like the PG-13 rating was a little too lenient.",Unforgiven
372,alli_katz,For guys only,1,1 June 2001,"This is strictly for guys, and for people who don't believe in God. Everybody is nasty all the time, and the only good people in the movie are prostitutes. And Eastwood as a director is even more annoying than he is as a non-actor in this.  All he wants to do is focus on blood and people in outhouse and houses of ill-repute, and show everything as dark and as nasty as he possibly can.  This is the kind of movie that movie critics and Hollywood smart guys love because they get to ""shock"" everyone.  Well, my only shock is that they made so much money with this nasty movie.",Unforgiven
373,wyattap,I just can't see what all the fuss is about,5,16 April 2021,"Firstly. I admit I couldn't watch all of this two hour feature, I had to stop with about 30 mins left.I found this slow, stilted and the story just wasn't making sense.The sound quality was poor. The acting was like watching cardboard cut outs. And the plot was stuck together with glue.... loosly.Maybe it's because I'm not an overall western fan... But I am a fan of a story. Something gripping. Something with humour or pace. Unfortunately this was being sold with none of this.Goes to show you can't always judge a film by its rating.",Unforgiven
374,pierrefonds_athlete101,Eastwood has the right script for a cowboy who wants to end his career killing spree,10,3 June 2006,"This film is Clint Eastwood's best I find. My Dad likes 'Pale Rider' and does not think highly of this one. I find 'Unforgiven' has such moving appeal and force that I cannot think that any other movie that Clint Eastwood would make will be better than this one.Eastwood is in fine character as a remorsed William Munny, a notorious killer who returns for one last job from an offer by the Schofield Kid (Jaimz Woolvett) so he can provide money for his poor family who seemed to have lost hope after there Mother died two years back. Will finds his old partner Ned Logan (Morgan Freeman) along the road to Wyoming and asks him to join his hunt for two men who cut up a woman. Along the way Will and Ned go, they discuss a few past situations as a result of what may happen when they go on this hunt. When they reach there location, there only big trouble to be dealt with as well will be the sheriff Little Bill Daggett (Gene Hackman).This film is worth it if you like something that is moving. The film won four academy awards for Best Picture, Best Director, Best Supporting Actor (Hackman), and Best Editing. Good selection academy! Best one I have ever seen from you guys.",Unforgiven
375,GM4177,Probably the best western ever filmed,10,20 July 2002,"I just finished watching this movie AGAIN and it reminded me just how good it is. This week, I watched Once upon a time in the west, the wild bunch, hang'em high, and the magnificent seven. I gues I was on a western kick. Then I watched Unforgiven and it is so high above these movies. The only reason I'm making this post is because of the people who discredit this movie because of the so-called ""Hollywood Ending"". This movie ended perfectly!!! Those of you who think otherwise have missed something HUGE about this movie and possibly many other westerns. The end is about the myth, the stigma, the aura, and the legend of a notorious cowboy/gunslinger who reverted back to the drink and to his old ways to slay the men who killed his friend. He is supposed to come away unscathed!!!!! The whole movie talks about how he was and how his wife cured him of his old ways, etc.. Then there is a reason for him to SHOW us who he was. It's not like they just threw in the ending for the hell of it.......................those who criticize this need to re-think their point-of-view. 10/10",Unforgiven
376,cynharm,One of the 5 best westerns ever made.,10,24 September 2002,"Many say that film was in it's golden age when we had a new Western coming out every other weekend.  The Western genre allowed so much for filmmakers to explore: the battle between good and evil, the choice between what's right and wrong, the teaching of strong morals, ethics, and values.  It was a canvas for a modern American mythology.  But once Peckinpah created his savage western to end all westerns (preceded by Sergio Leone's anti-westerns), there wasn't much more to say on the subject.  There wasn't any room for the classic western of yesteryear.  Until a skinny actor named Clint decided to take all he had learned on the subject over his thirty year career and make the most self aware and intelligent western ever.  Superbly acted, sublimely written and photographed, UNFORGIVEN is Eastwood's master work as a director and actor.",Unforgiven
377,callahan-patrick,One of my all-time favorites,10,16 June 2009,"Just to get something out of the way, I am a Clint fan-boy. From a young age I've thoroughly enjoyed his films (even the films made before I was born like the Good, the Bad, and the Ugly and Dirty Harry), however, this I hope will not sound biased because I have watched this film dozens of times. In my opinion, it stands only second to ""A Clockwork Orange,"" my all-time favorite film. Even now, I'm in still awe about it. The incredible cast(Eastwood himself, Gene Hackman, Morgan Freeman, etc.)mixed with an amazingly simple story and yet still have an in-depth look on the consequences of violence as well as the spreading of legends (both exaggerating and desecrating them) makes one heck of a story. The ""character with regrettable past"" is also put into play (as with other Clint classics like Mystic River and Gran Torino). Clint presents us with unforgettable characters that the cast helps portray (particularly Hackman, who makes a very intriguing character). Whatever I say does not give this film even remotely enough justice. For those who haven't seen it, go out and rent it right now, for few will be disappointed. Some of the only films that are to come close are: Braveheart, No Country for Old Men, The Shawshank Redemption and few others. These movies don't quite beat it though. Never will a movie will like this be made again, which almost saddens me. As a final statement, go give this movie a shot for, again, those who haven't seen it and those who saw it, but didn't like it. You may find something you may cherish that you didn't notice before.",Unforgiven
