,User_name,Review title,Review Rating,Review date,Review_body,Movie_name
106,hnt_dnl,Very flawed Eastwood film,5,29 August 2010,"I'm a huge fan of ""early"" Clint Eastwood (you can see by some of my other reviews) and have seen UNFORGIVEN (1992) several times, but I just can't completely get into this film and don't think it's a masterpiece, as with several of his other films that he has starred in and/or directed (A FISTFUL OF DOLLARS, DIRTY HARRY, HIGH PLAINS DRIFTER, and the criminally underrated elegiac A PERFECT WORLD). Also, there are several other ""lesser"" other Eastwood works that I'd pop into the DVD player before this one, ones that I find to be provocative, immensely entertaining, or re-watchable or all of the above (HANG EM HIGH, THE GAUNTLET, THE ENFORCER, SUDDEN IMPACT, TIGHTROPE).With UNFORGIVEN, I think a recurring word I find when I watch it is ""monotony"". At the end of the day, I think everything is too one-dimensional. On repeated viewings, I find nothing really deep or provocative about this film. I don't pick up on anything. It's a well-made, professional film with decent-to-good acting, but that's about it. The only 2 characters that I find to be interesting are the ones played by Gene Hackman (Little Bill Daggett) and Richard Harris (English Bob). Everyone else just is kind of ""there"". Not to mention that virtually all the characters seem like the SAME person! There is no uniqueness about any of them.Save for Daggett and Little Bill, they all have the same mannerisms, mood, and tone. I've seen many so-called ""lesser"" films with better developed, written, and performed characters that allowed me to latch onto the film the more and more I watched it. With UNFORGIVEN, these characters (and there are tons of them) fall way too flat. Examples: The scene where Munny, the Kid (played by Jamie Woolvett), and the (totally unnecessary!) Morgan Freeman character track down the first of the 2 men they are to kill is totally devoid of real emotion and resonance. I feel nothing when watching this scene. The acting by all involved is strangely similar (Freeman ironically being the weakest link in this scene). Eastwood did Freeman no favors by casting him in this film. Seems like stunt, friendship casting as far as I'm concerned.Eastwood (as former vicious killer, but now reformed family man William Munny) strangely evokes very little as the lead. It is hard to buy that this man was once a vicious killer simply because Eastwood gives himself the same singular tone as most of the rest of the cast. Then all of a sudden at the end he is a badass again. I think the intent was right, but the execution (pardon the pun!) is rather unbelievable. This ending scene is in it's own right pretty spectacular as it demystifies the mythology of gunslinging that so many films before (ironiclly including many early Eastwood Westerns) had glamourized and I find it (and the Daggett-English Bob scenes) to be the only good ones.At the end of the day, a great film ought to draw you in, not push you away. UNFORGIVEN, sadly, does the latter.",Unforgiven
107,thekarmicnomad,The Definitive Anti-Western,7,17 March 2009,"This is an excellent film that seeks to dispel the myth of the Hollywood Western. The lightning fast shootouts, bar room brawls and sleeping under the stars are portrayed in a more realistic way. The film isn't that harsh for violence (we are not talking Hostel here) but the hard life of the frontier is shown in a more gritty way than a traditional Western. An outstanding film, an excellent performance from Gene Hackman who I usually detest. The storyline is simple but its simplicity adds to the realism, the danger feels very real. The characters are well developed, especially Eastwood's. I would recommend this even if you hate Westerns. There has been a lot of hype about this movie that has been re-ignited with Eastwood's new movie, but it is all well deserved.",Unforgiven
108,sharky_55,I was building a house.,10,4 October 2015,"Unforgiven personifies the end of the Old West, and specifically in Eastwood's Will Munny as well as himself, a relic of Leone's Spaghetti trilogy. That Eastwood went under several aliases but was always calm, collected, deadly with the draw and ruggedly handsome. Here he is ragged and elderly; he tends to pigs, not to bounties, misfires from a few paces on a still tin can, and can barely mount his horse without a decent struggle. That vehicle in itself is becoming obsolete - the crowded and lively steam engine train a sign of the old world being mechanised. I am reminded of the opening of Red Dead Redemption, and that climatic monologue. So, in a changing age where digital effects were increasingly improving and wowing audiences, Eastwood's love letter and eulogy digs deeps for those Western roots. The camera-work emphasises this; dollying as we ride through a perfect replica of every small Western town, swivelling and soaking up the wooden signage, the dusty buildings and streets, the curious stares of whores and strangers. Later this is used to slowly reveal the fate of Ned in his coffin and that savage warning. The harsh sounds of his whipping reverberate throughout the settlement, and we get reactions from every concerned citizen of the community. DoP Green frames gunslingers and their steeds in solitary one-shots, in sepia seeped palettes, in silhouetted two-shots at golden hour sunset, enveloped by the dusty western plains and grasslands of infinite stretch. And the opening and closing scrawls best emanate nostalgia and longing, of a thief and murderer that cannot survive that way any longer. We get a sense of the wider community in the warping of the story, of whispers and gossip travelling between taverns and banks and ears all across the state. A few slashes of the face becomes whole body mutilation. Eastwood demands each of his characters to excel within the drained weary sets. The self-named Schofield kid is cocky and brags of his gunslinging prowess, yet these words fall on the deaf ears of two veterans. Later, after being presented with the easiest first kill of any man in the West, he drinks vigorously and laughs nervously, revealing his more modest persona beneath that confident Western renegade. Another life and career awaits him. Ned also comes to the same conclusion, at first eager to revisit his old life but after firing the first shot clearly unable to commit those same crimes. The pair speak with weariness and regret of those old days, and do not want to be thrust back in. Hackman's Little Bill recalls the humorous elements of the past, and displays his power, tenacity and technique even in his old age. But he is a man who does not want the bloodshed and violence in his town, he actively stamps it out, and would rather spend the rest of his days adding to his leaky shambles of a hut. Long gone are the days of sleeping in caves along the camp-fire. David Webb Peoples subverts all the old tropes with every step of his screenplay. Harris' English Bob is eloquent and dismissive, mustering his intimidating persona in ignoring the sheriff's rules, before being brutally taken down, not even being able to retaliate when given the opportunity. For all the talk of old rivalry, the classic showdown would have been inappropriate. Guns are hesitantly drawn and held in that final 'showdown'. Murky moralities and perspectives are displayed instead of a duel between the heroic gunslinger and villain. Strawberry goes far in seeking revenge, while Delilah stands aside meekly, even touched by the offering of the finest pony. She is shaped in the mould of the dear departed Claudia who cured these violent, bloodthirsty men. They are of the past. The recurring motif of story and recording is key. The bustling little writer Beauchamp is almost comical - he provides one of the funniest moments when he suggests to a stoney-faced Bill to ""shoot the carpenter"". More importantly, he follows power and legend, from the theatrical tales of English Bob, to the humorous reminiscing of Little Bill, looking for writing material and figures to immortalise. There is a quick shot in that climatic shooutout where I almost see a slight hint of glee in his face. He has struck gold, and will mythologise Munny for these deeds. It might not be captured quite the same way it went down, but it will make for a better book than the Duke of Death.",Unforgiven
109,CharltonBoy,Eastwood back doing what he does best.,8,2 April 2002,I'm not sure what i was expecting from Unforgiven but i dont think i was expecting an old fashioned traditional western. That is exactly what Unforgiven is. A story of a fabled gun fighter who rides into town to carry out a revenge (all abeit for money) against two cowboys who cut up a prostitute. What makes this a little different is the hero is old and fairly frail and is well past his sell by date. Clint Eastwood is superb as is Morgan Freeman and Gene Hackman and they all contribute to a highly entertaining movie which can be compared to most of the great westerns. There is something quite sad about the movie too because we can see that this was always going to be Hollywood greatest Cowboy's last western. 8 out of 10.,Unforgiven
110,TOMASBBloodhound,What Heaven's Gate was supposed to be.,10,30 October 2006,"The Western will hopefully never die out, but Unforgiven was Clint Eastwood's last go around with it. The film took home four Oscars, but that hardly seems enough. Unforgiven is a film that shows us a different perspective of the Old West. In this film, good and bad are not easy to pick out. The characters we identify with the most have done every bit as much wrong in their lives as those they find themselves shooting at. This film may take a different perspective, but it still allows the genre to maintain its dignity. That is the mark of great film-making. That is the mark of Clint Eastwood.Eastwood plays a retired gunfighter named Will Munny. It has been 11 years, he tells us, since the last time he shot at a man. His departed wife apparently tried to make a decent enough man out of him that he doesn't drink, cuss, or have any reason to resort to violence any more. He runs a tiny pig farm in Kansas, but his reputation is still known as far away as Texas, from what we are told. One day, a cocky young man rides up to Munny and tries to recruit him for a bounty hunting job in Wyoming. It seems two ornery cowboys have cut up the face of a prostitute, and her fellow whores are offering $1000 for anyone who would kill them. Munny tells the kid he doesn't do that kind of thing any more, but he badly needs the cash. After briefly deliberating on the matter, Munny recruits an old partner (Morgan Freeman) and the two of them ride off with the kid to collect that reward. Trouble is, the town where they're headed has a nasty sheriff (Gene Hackman), and he knows there will be assassins coming for the reward. He wants no part of bounty hunters riding through his turf. The conflict between the sheriff and Munny is unavoidable. For most of the film, Munny and his pals hardly seem up to the task, until the sheriff takes things a bit too far.The film is absolutely astounding in its narrative and cinematography. The story gives us one gut-wrenching scene after another with the beautiful backdrop of Western North America behind them. We learn just how difficult it really is for supposedly tough men to draw their pistols and accurately fire at someone else. We wonder about the motivation behind Eastwood and Freeman's characters. Do they really need the cash that bad, or do they really still have murder in their souls after all these years? We find out just who does and who doesn't as the action unfolds. Not only are the lead performances great, but so are the supporting roles. Gene Hackman won as Oscar for his turn as Little Bill Dagget. He's just as good as he always is, but it's great to see the Academy finally reward talented people like that. The late Richard Harris, at Eastwood's request, also turns in a very memorable performance. No film since Barry Lyndon has had better cinematography.Toward the end, when Eastwood stares down an entire saloon of would-be toughs with a double-barrel shotgun, we get perhaps the scene he will be remembered for more than any other. The glint in his eyes peering out from under that hat... the glow from the torches outside... the tone in his voice... Absolutely haunting.This film is not to be missed.10 of 10 stars from the Hound.",Unforgiven
111,khanbaliq2,"Clint Eastwood's Oscar-winner examines the mythic violence of the Western, taking on the ghosts of his own star past.",10,18 June 2010,"A hired gunman (Clint Eastwood), now eking out a living as a farmer, is tempted back for one last job - to collect a reward for the thugs who carved up a prostitute. The film was inducted into the United States National Film Registry in 2004.Unforgiven is one of the all-time great Westerns, a film aware of the historical tradition in which it operates, and one that finds something new to say within its genre. Eastwood is superb as William Munny, weary of life and especially weary of violence. He is buttressed by a wonderful supporting cast, notably Gene Hackman as a callous sheriff and Morgan Freeman as his former partner. At a point when it was widely assumed Westerns were film-making history, Eastwood proved them spectacularly wrong.",Unforgiven
112,jluis1984,Masterpiece,10,19 February 2007,"Ford, Hawks, Leone, Peckinpah, all of them big names who have defined the Western genre in one way or another across the history of cinema, transforming what started as low-budget action films into an art itself where the American Old West served as setting for tales of mythical heroism, classic tragedies, and legendary adventures. Actor and Director Clint Eastwood is probably one of the most knowledgeable artists about the Western genre, as his acting career began as the legendary ""Man With No Name"" in the Sergio Leone's Spaghetti Westerns of the 60s. As a director, he somewhat continued this legacy through movies like ""High Plains Drifter"" and ""Pale Rider"", but finally in 1992, Eastwood released what many consider his final ode to the Western, and his ultimate masterpiece of the genre: ""Unforgiven"", an epic saga about the deconstruction of the Western myths.Clint Eastwood himself plays William Munny, a former gunslinger who is now living a peaceful life as a farmer with his two children. However, life is very difficult for Munny's family, as since the death of his wife the family has been facing financial problems. One day a young man calling himself ""The Schofield Kid"" (Jaimz Woolvett) appears looking for Munny. The Kid tells Munny about a bounty offered in the town of Big Whisky, and offers him the chance to join him as hired gun and split the reward between them. While Munny's days as a murderer are in the past, he decides to join him after thinking about the farm's problems, but not without calling his old friend Ned Logan (Morgan Freeman) to join them. However, Munny's past as a notorious thief and murderer will return to haunt him in this last mission, as the Kid shows a true and honest admiration for Munny's fame as a gunslinger, even when Munny himself considers his past as villainous.While better known for his work in science fiction, David Webb Peoples' screenplay proves to be a very accurate description of life in the American west, particularly concerning the aspects of the uses and abuses of violence in that era. It is in fact the use of violence what comes as the main theme of the story, as Munny is escaping from his past's violence while the Kid is eagerly awaiting the next chance to prove his masculinity by the use of violence. The duality between man and myth is explored not only via the relationship between the Kid and Munny, but also in the shape of a character who writes novels about the wild west, and sees the figure of the gunslinger as an idolized modern hero. Peoples' screenplay is remarkably well written, as the many characters and their relationships are exhaustively explored, resulting in a character driven revisionism of the western, that in many ways criticizes the genre's origins as violent ""Shoot 'em up"" films.Peoples' script is definitely the movie's backbone, but it is Eastwood's masterful direction what transforms this meditation of violence into a unique revision of the Western. With a gritty and realistic approach very in tone with the script, Eastwood portraits the Wild West without romanticism and leaving out the mythic aspects of the genre, taking the revisionism of the Western one step beyond. Using Peoples' script, Eastwood takes a critic view on the figure of the ""hero"" in Westerns, focusing on the image of the gunslinger and the use of violence to solve problems. Visually, Eastwood has crafted his most impressive movie since ""Bird"", with an extensive use of shadows and light in the excellent work of cinematography by Jack N. Green. Eastwood's style, originated by the influence of Sergio Leone and Don Siegel, and developed through many stages seems to finally have spawned its masterpiece in this film.As William Munny, Clint Eastwood is simply perfect in what at first sight looks like an extension of his earlier ""Man with no name"" persona. William Munny has a name, and a past he wants to escape from, and Estwood captures the image of guilt and regret to the letter. This is easily one of his best roles to date. Morgan Freeman is also very good as Ned Logan, although like Jaimz Woolvett (who plays The Schofield Kid), gets easily overshadowed by Gene Hackman's powerful performance as Little Bill Daggett. Hackman completely owns every scene he is in, showcasing his enormous talent in a very dramatic role. The legendary Richard Harris has a small appearance as another aging gunslinger, English Bob, in very memorable scenes where he demonstrates why he is considered one of the best actors of his generation.After starting his career playing a mythical hero in Leone's ""Dollars"" trilogy, it is actually fitting that is Eastwood who explores the figure of hero in his many movies. Ever since his first directed western, Eastwood showed an interest in the duality of the hero, taking a special interest in the archetype of hero portrayed in the classic 1953 Western, ""Shane"". Eastwood has explored this theme in many ways in the past: first as a true antihero (""High Plains Drifter""), then as a man becoming legend (""The Outlaw Josey Wales"") and later as a true mythic hero (""Pale Rider""); all this culminates in ""Unforgiven"" as the ultimate demythologization of the concept, and his final ode to the Western genre. While the movie indeed feels a bit ""preachy"" at times, the story is devised in such a way that it never feels too heavy handed, as it unfolds nicely as a classic epic tale of the West.Personally, I can't praise this movie enough, as it is easily one of the best Westerns done since Peckinpah's ""The Wild Bunch"", and required viewing not only for fans of the genre. While some consider it an ""anti-Western"", I think that with this movie, Eastwood's name can proudly stand along those of Ford, Hawks, Leone and Peckinpah as a master of the Western. ""Unforgiven"" is definitely Clint's masterpiece. 10/10",Unforgiven
113,stamper,Mature western,8,4 September 2003,"I had watched this film before, back when I was 17 or so, expecting a gunslinging, foul mouthed, cool, action-filled western similar to A fistful of Dollars, For a Few Dollars More or The Good the Bad and the Ugly. Of course I was disappointed back then when I saw the product. There just was not anything I had expected there to be. No cool Clint slingin' guns and shootin' off worse guys than himself from the first minute to the last. No cool music by Ennio Morricone. No duels. No abundance of one-liners. So understandably I didn't like the film that much. But now, I'm six years and since I like Clint Eastwood I thought I'd give this film a second chance. On top of that can over twenty-thousand people visiting IMDB and giving this film a 8.0 be wrong? Well I found out that they are not. Unforgiven is a good western, but only for those out there who are prepared for a bit of storytelling. If you're looking for action and one-liners pick up one of Clint's films that I mentioned earlier or their 1990's equivalent: Desperado. You could try to convince yourself to watch this because it has won 4 Academy Awards, but if you're looking for fun and action, do you really care about artistic quality in Directing or acting. I know I didn't and I know most other folks just want to see a lot of shooting as well. This does not mean that there is no action here, or no shooting, it's just that it is not the focal point of the movie. The focal point are the characters here. The professional gunslingers, the starting gunslingers and the retired gunslingers. Good, mature western, made by a matured Clint Eastwood and although I enjoyed it I thought that there was something missing. I know I searched, but I could not find it. Maybe it was because the intro and the text in the end of the film were scrolled onto the screen in dutch. I really hated that!
7,5 out of 10",Unforgiven
