,User_name,Review title,Review Rating,Review date,Review_body,Movie_name
233,gottogorunning,Clint Eastwood has created an iconic masterpiece!,10,16 August 2005,"I've seen this movie several times and each time the detail and depth of the plot and characterizations grows richer. In revisiting the movie the reality of human drama grows in the context of American values and how we have come to the type of society (America) we have created.Clint Eastwood has created an iconic masterpiece that over time may become more appreciated in the same way that Casablanca and other iconic films have become. The film is a definitive moral summary of all American western films from the value set of today's society.The plot, centers around the uniquely American response (in the character of Clint Eastwood) to the injustice and dictatorial slavery of a sheriff (Gene Hackman) in a small town in 1880 Wyoming. The story builds from a small offense in a brothel (literally an insulting giggle by a small town prostitute) to the climatic finish of a bar room shootout on a dark and stormy night. Good and evil is contrasted in switched roles where the sheriff becomes the villain and the criminal the hero.I highly recommend serious film lovers to revisit the movie several times. The iconic nature of the movie may well characterize it as the best western ever made. Unforgiven is as good as Clint Eastwood's other film, 'The Good, The Bad and The Ugly'. The difference between the two however shows up over time. Like an event that happens in your life that you think of over and over again, this western reminds us of why we are the way we are (as Americans).",Unforgiven
234,fastmike,The Once and Future Eastwood,8,31 March 2003,"At first viewing, your Hollywood conditioned mind will most likely try to see this as an 'stock-off-the-shelf' western. You might even think it is 'unremarkable'.Well, it just plain ain't. Clint Eastwood paints himself, (exceeding well at that) as a reformed, but still cold and conscienceless gunslinger, who seems to be in a struggle, keeping his evil side suppressed. You might even wonder, who the real William Munny is : The sober reformed farmer, or the kill-for-money gunslinger. Eastwood makes this Jekyll-and-Hyde transformation with absolute brilliance!Morgan Freeman (Ned Logan) plays his former partner and reluctant, unwitting tempter whose conscience is not so 'unbothered' by his past.Jaimz Wollvett is the Scholfield Kid, a determined wannabe gunslinger, of whom, Eastwood and Freeman are 'unfooled'. Freeman's performance in his instrument-of-the-devil role, equals the performance by Eastwood, in his role and pairs perfectly.Clint Eastwood directed this 'Brothers Kamarazov' like trio to perfection. The interaction between the three will draw your thinking in, with the mind set of the two experienced killers, and the naive, 'kid' whom they use. Gene Hackman earned his Academy for supporting role as the ruthless sheriff of a small Wyoming town, now on the lookout for hired killers coming to 'make good' on a contract. Paired off with a (terrific) Richard Harris performance ('English Bob'), with (Saul Rubinek) his personal, sidekick-western-romance-writer, whose comic-book type novel parallels the dialog of the film, forcing you to see how well this all star cast brings this western fiction to a living, breathing, heart pounding life of its' own.Unforgiven may be taken on the surface as a great Clint Eastwood western, if you let it. But see it more than once, and you'll see Clint Eastwood, the Academy Award winning director.",Unforgiven
235,kneiss1,Fiery and disturbing,10,2 December 2010,"I am more and more impressed by the capabilities of Eastwoods directing. This movie is on a very high level of perfection. I barely have anything to complain about. The pretty much only gripe for me has been the ending. It seemed a bit exaggerated. But that only made the whole thing even more fiery and disturbing. It is one of the rare movies that makes you think. The script was quite smart. I rarely saw a movie that had so well drawn characters. Actors fit perfectly. Especially Clint and Gene Hackman impressed me. Seeing those two in their role, i am absolutely sure, that no one could have substituted them. They fit perfectly into their roles.",Unforgiven
236,sixhoos,Excellent,9,8 April 2020,Top notch thinking man's western drama. Great story great action great casting and directing.,Unforgiven
237,Figgiedan,"The best western, hands down - like a book-end...",10,6 December 1998,'nuff said - 10 out of 10 --,Unforgiven
238,malcolmjohnston,Clint's most perfect movie,10,10 February 2021,"In a career such as Eastwoods spanning so many years this stands out as his crowning glory
With a cast that carries the film along in perfect harmony.
I don't know if little bill is what a small town sheriff was like back in the Wild West but his epic incident with English Bob on a muddy street in front of the towns folk is just how I imagine the time of the cowboys to be.
Just a stunning cast with a truly awe inspiring back drop
It is an epic you can watch again and again",Unforgiven
239,ethlaid,Gritty Eastwood Masterpiece,10,25 April 2021,"Visual perfection a true my mesmerising film. Phenomenal performances all around. A deep and meaningful, yet heart-braking, plot. Guaranteed to hook in the viewer and create a constant build up of tension. One of many Eastwood Western Masterpiece's.",Unforgiven
240,Mike_Yike,Very Good But Not Great,7,29 October 2021,"I have seen Unforgiven three or four times. I've always rated it the same, good but not great. The most recent time I watched the film, a few days ago, I finally figured out why I don't rate it higher, I also decided to write an IMDb review.There are just a few blips in the movie that seem flawed to me. One is Munny's problem mounting a horse. It looks like it might have been thrown in for comedic effect. Whether that was the motive or not, it seemed misplaced. Perhaps the bigger complaint is of all scenes, the finale in the saloon, specifically Eastwood himself. I am reminded of all the other shoot-outs he had over the preceding two decades, in movies such as High Plains Drifter and Joe Kidd. It appears to be the same Eastwood playing much the same character there in that saloon. God strike me dead for saying this, I wonder if the William Munny character could have been played better by someone else. Not just in the finale, but really, someone else throughout the movie. There, I've said it.Anyway, a good movie but not great. If I had to recommend a western, one western from American cinema, it would probably be Shane over Unforgiven. As for Eastwood's westerns, I might even be so bold as to suggest The Outlaw Josey Wales rather than Unforgiven.",Unforgiven
241,stebird,"Horses, cowboys and Clint Eastwood",10,26 January 2018,"One of the most deserved best picture winners I think there has ever been, ""Unforgiven"" could've and probably should've revived the Western genre, it was certainly good enough to. I could rant for hours on end and type a thesis about the film ""Unforgiven"" but what's left to be said that hasn't already been typed? Instead I will keep this review short and sweet, ""Unforgiven"" is a masterpiece of film making and one of the best westerns ever, a cast of Eastwood, Hackman and Freeman is something you can only dream about as a kid.""Unforgiven"" was released at I'd say the perfect time, when film making was advanced enough to make the final product look sleek and realistic, but before the widespread use of CGI and advanced technology took a grip of Hollywood, 1992, what a year!Any 'real' film fan needs to add ""Unforgiven"" to their collection, it's pretty much essential viewing.",Unforgiven
242,Mitch-25,Eastwood masterpiece,10,17 August 2001,"So many of these reviews for these great movies miss the point.  Violence is not a bad thing in movies IF it is used properly.  Unforgiven is a character study of how the wild west truly was.  It was a very brutal and violent world.  In Unforgiven, EVERY act of violence has consequences, and that is the key.  The movie doesn't use violence just to use it.  It uses violence to make a point.  This is without a doubt Clint's best movie.  The DVD version of it is really good too.  It has both a widescreen and a regular tv screen sized version. It is most certainly worth a purchase.",Unforgiven
243,howdymax,Unforgiven for What?,8,2 June 2002,"I usually reserve my reviews for less well known movies.  I feel that they are the orphans of the industry and deserve some recognition.  But after seeing this movie, I was moved to comment on it.Clint Eastwood the director, seems to have a knack for finding those little quirks in an otherwise routine plot that nudges his movies up the respectability ladder a step or two (and making it big at the box office as a result).  This movie is no exception.He plays an over the hill gunslinger who is seduced out of retirement with the promise of money and a just cause.  His wife has died and he has two young kids to raise.  His hogs are dying and he needs the money.  He is hired by a couple of hookers to kill a couple of cowpokes who cut up one of their own.  He hooks up with an old pal (Morgan Freeman) and a young wannabe gunslinger - none of whom, including Clint, could shoot worth a damn.  This mission takes on a life of it's own.  They manage to track down the culprits but must face a showdown with the local Marshall played with sadistic relish by Gene Hackman.  I am reminded of his performance in ""Prime Cut"".  The final shoot out is not to be missed.What's quirky about this movie is the total ineptitude of the gunmen.  Clint can't hit what he shoots at, Morgan Freeman is afraid to kill, and the kid is all bluster and no guts.  Still they take on the mission and all three come into their own one way or another.  Something else.  Clint's history is never revealed until the very end of the movie and I was shocked to hear who he really was.  He also shows true compassion for the ""whores"" despite his obvious discomfort.These are the kind of things that make Clint Eastwood movies a cut above the routine.  It is not one of his better known efforts, but I urge you to see it.  You won't be disappointed.",Unforgiven
244,kellyadmirer,"""'Deserve's Got Nothing To Do With It""",10,12 February 2012,"I saw this on it its first run. It came out during a unique period in American history, right after the fall of the USSR and the First Gulf War but during a painful Recession. In some ways the US was riding high, but at the same time it was the captive of its own painful vulnerabilities and imperfections. That is the story of ""Unforgiven,"" transmuted to the Old West.A tough man and his companions embark on a journey to right some wrongs. Along the way, we learn something about the man, but we don't get his full measure until the very end. What we learn turns everything upside down and leads to a very satisfying conclusion. This simple tale fits into the pure-Americana mold of ""True Grit"" and ""The Searchers."" If you haven't seen those two films, you should before you see this one. ""Unforgiven"" unmistakably walks in their giant footprints.The key to this film, I believe, is to learn exactly what Clint Eastwood's character, Bill Munny, stands for. At first we don't know what is special about him, or why anyone would approach him for help. He is just a simple farmer, and not a very successful one at that. But he is taken by a story of a prostitute who was unnecessarily and cruelly disfigured in a town called 'Big Whiskey.' While a bounty is involved, it's as insignificant to the quest as the payment in ""True Grit."" There are much larger issues at stake. There is an underlying air of chivalry that comes straight out of ""True Grit"": a wronged woman demands justice, vengeance is required, and the worthiness of those involved is irrelevant. Munny thus hooks up with an inexperienced young partner (an obvious commentary on the Glen Campbell role in ""True Grit"") and his reliable old comrade Ned (Morgan Freeman) and off they go.Gene Hackman is ""Little Bill,"" a pompous windbag of a sheriff who rules Big Whiskey with the proverbial iron fist. He is riding high, and delights in not just beating his victims, but degrading them. Richard Harris (""English Bob""), a phony dime store novel hero, unwisely ventures into town accompanied, improbably, by his very own biographer (Saul Rubinek). Little Bill finds him fascinating but brings English Bob down to earth quickly. It is the rough and tumble old West where only raw power counts, and Little Bill has it.Perceptive and clever despite his own faults, Little Bill knows there are hired guns out to kill him. He captures and interrogates Ned, then kills him. When Munny is told this, he at first appears to simply accept it as something that happens in their line of work. Watch, however, his reaction change when he is told that Little Bill put Ned's corpse on display with a big sign saying ""This is What Happens to Assassins Around Here."" That reaction, one of the most dramatic in any Clint role, sets in motion the climax of the film. We also learn at this point that Munny himself is not, can never be, and cannot consider himself better than anyone else. That fact is important because it shows the source of his humbleness, the demons that haunt him and why he is driven to drink. His character is not the issue here, though, only what it impels him to do.Right after the 2001 terrorist attacks, I was riding in an airport van back to a hotel after being grounded. Rumors were rife, but everyone knew the world trade center was gone. Nobody knew what to say, but a fellow in the back said simply, ""Someone's gonna pay for this."" Exactly.It is not giving anything away to say that when Munny and Little Bill finally meet, there is a brief but epic exchange. ""I don't deserve to die like this,"" Little Bill says. ""'Deserve's got nothing to do with it,"" Munny replies. The whole meaning of the Munny character and, indeed, the film is encapsulated in that one line, in the same way that, say, ""A Few Good Men"" comes down to ""You can't handle the truth."" Little Bill is pleading his case, as a member in good standing of the community. He thinks his entire life's work should be taken into account before he is sentenced for what both of them know are unpardonable crimes. Munny unhesitatingly rejects that defense out of hand while acknowledging his own fallibility. Little Bill unfortunately had broken a tacit code of tough men: you may kill people that you must, but you don't take pleasure in their humiliation. A whore must not be deprived of the only thing she could be proud of, a harmless visitor should not be unnecessarily disgraced, a dead but honorable foe should not be publicly mocked. There shall be no mitigating factors whatsoever when you cross that line.So, you have America, with all its flaws and weaknesses, finally kicking Saddam Hussein out of his intended conquest, Kuwait, and Gorbachev finally tearing down that wall as Reagan demanded. Bill Munny, vile murderer and failure, rights some simple wrongs, and that is all anyone can do. As he rides out of town, you feel as if something greater than a man is present. It is not Munny riding that horse, but the eternal Avenger of honor and decency in the most humble of human forms. His final words temporarily bring the world back into simple balance. And, in this vale of tears, sometimes that's the best you can hope for.",Unforgiven
245,Manthorpe,Yeah.,10,13 July 2004,"Although I don't typically describe myself as a fan of Western flicks, mostly due to the fact that I simply haven't seen most of the greats yet, I truly loved and enjoyed this film. Clint Eastwood plays William Munny, the baddest and meanest son of a bitch ever to walk the Earth...and killer of women and children. It's simply amazing that Eastwood not only starred in this, but also directed and produced it. One of the few examples of this that can be given. Mel Gibson also did a decent job in his Braveheart. I think that if you have seen all of the Western Eastwood classics that this movie might even be more enjoyable for you, as it's rumored that Munny is simply an extension of some character he's played in the past. After finally getting around to seeing this one, I will most definitely go out and educate myself in this genre.Let's face it, Eastwood is William Munny...he just is. It's hard to even fathom anyone else in this part simply because Eastwood is so damn convincing and undoubtedly helped by the immense experience he's gained over the years playing similar parts. The audience needs no convincing of his character. Although simple, a very powerful performance from an actor that holds enormous screen presence. Gene Hackman and Morgan Freeman also deserve recognition for their performances. Overall, a great cast.The true strength in the film, besides Eastwood's character and acting, is the story. Quite simple, it is, but also extremely effective. A old, bad man comes out of the woodwork to do one last job to help his kids get a good start by snatching some much needed cash. And haunted by the memory of his late wife, Munny questions his actions, knowing all too well that his wife would not approve if she were still alive. His deeds from the past have come back to haunt him, as he hears his reputation is still quite alive and well and is the entire reason he gets involved in the job in the first place. I loved hearing the stories of the man he used to be, giving glimpses of what we may get to see later in the film as his character progresses. It is also particularly humorous that Munny's memory of the past isn't all that great either, even though some of the events seem unforgettable. All because he was a drunk badass. As the story progresses towards it's climax, we get more and more hints that the satanically bad man Munny used to be is still somewhere under the surface, and is undoubtedly going to rise like a phoenix straight out of the ashes of Hell if he's pushed too far. And while the film progresses like the journey itself, slowly moving along establishing it's themes and characters, it all leads up to one hell of a climax. One for the history books. When it finally was all about to go down, chills literally went down my spine. But I don't want to spoil it for anyone.As a fellow reviewer previously mentioned, Unforgiven succeeds as a film and story because it does not try to preach a message or convey one about morality. The characters are who they are, and do things for their own reasons and ask no forgiveness. Whether it's right or wrong ain't got nothing to do with it, just like deserve ain't got nothing to do with it.Very highly recommended. A truly great film worthy of it's recognition. Bravo, Mr. Munny...errr Eastwood.",Unforgiven
246,teejayniles2345,Is this a story about Avenging a Wrong or about Murder as an Addictive Behavior?,8,27 July 2013,"I agree that this is a great Western movie of the 20th Century -- it is certainly not typical with the reason for the Action and Conflict being the aggrieved women themselves. The cast of characters as developed by David Webb Peoples and director/producer Clint Eastwood are a sordid bunch. We see the earthy and grim parts of a lot of the ""Wild West"" and learn that Gun Control is not just a measure of the contemporary U.S. political groupings. I don't quite think that the main character is an anti-hero but he does seem a bit like a reformed addict pushed to the breaking point. It is not for the young and over-sensitive. UNFORGIVEN (1992) is a good example of a two-hour feature that doesn't need the big tech-effects to keep us thrilled and on the edges of our seats. It does reflect a kind of critique of gun violence while showing that guns can provide a kind of means of revenge where the ""bad"" people get their comeuppance. I rate it an ""8"" *",Unforgiven
247,vikasjoshi-99705,A real gem by Clint Eastwood,10,12 September 2018,"I am speechless how to praise Clint Eastwood for this ultimate masterpiece. Such a top notch direction & performance is rarely seen 
Gene Hackman won the hearts by real hard hitting performance. Top class cinematography , editing , screenplay ,original score ,sound , made it a must watch one of the greatest western flick...Standing ovation for Clint Eastwood plz ..",Unforgiven
248,eklavya-cwk,unforgiven in its true sense .... but yet ..... easily forgettable .,7,7 May 2014,"Sergio Leon will not like this. This film is a true reflection of amateurs work and his useless attempt to modify a western genre. Still a amazing and enjoyable movie but it fails for me to be any great attempt. Just a nice movie i will rate it 7/10. I don't think anyone can adapt western genre in movies ever with his brain except Sergio Leon, Ramesh Sippy and Kevin Costner. Unforgiven moves through a nice path of events sometimes feeling bit too uselessly stretched. There are few moments which will make a fool think this movie as provoking about life's worth and the thoughts of man with regrettable past, but if one avoids to get entangled in such ideas of unforgiven, he can certainly enjoy a nice drama.This movie is good but yet it is easily forgettable. Nothing as enriched as rest other movies in this genre. Those who want to get any so called message in this movie for their lives i can recommend you a lot of other great movies.",Unforgiven
249,johnny-burgundy,This is a shining example of Eastwood's abilities as a filmmaker.,9,24 October 2017,"Unforgiven (1992)This is modern western produced and directed by Clint Eastwood. The story is about an aging outlaw and killer who takes on one more job years after he had turned to farming. It stars Eastwood in the lead role, with Gene Hackman and Morgan Freeman. The film won four Academy Awards: Best Picture and Best Director, Best Supporting Actor for Gene Hackman, and Best Film Editing. This is a shining example of Eastwood's abilities as a filmmaker. It's more than a western, it's a movie about redemption. This is an excellent fit and paved the way for the modern western as an art form.",Unforgiven
250,Primtime,"A good movie, however not great",7,2 December 1998,"Unforgiven is a good movie. Clint Eastwood did a tremendous job in acting and directing this film which had a great supporting cast as well. However, I don't believe that this film is worthy of a Best Picture award or making it on to the AFI's top 100 list.I believe that this movie is an effort by Eastwood to say to everyone that he is finished acting in westerns. The story, just like real life, tells the story a man who has been out of the game for a few years and is making one last triumphant return to his old stompin' grounds. His character, William Munny, is basically a culmination of all the tough guys he has played in other westerns and the Dirty Harry films. Eastwood plays this role to the best of his slightly diminished ability and is perhaps only believable based on what we know of him in his previous films. This film is unlike many other westerns in the fact that it doesn't glorify violence. Rather, it shows its dark side and the after effects that it has on people and their emotions. When Morgan Freeman cannot bear to shoot a man, when the Schofield Kid claims that he will never shoot another after he had killed his first and the reality behind the scene when Eastwood kills the first cowboy all go towards the de-glorification of violence.This film has a great performance from Gene Hackman which isn't because of the character he plays, rather what he did with the character he got. All other supporting cast roles are satisfactory, but even Freeman's performance was somewhat lacking. Eastwood himself did a decent job, but doesn't match any of his earlier western performances. He seems uninterested in this film and it shows.The movement of the film was above average and the film went by quite quickly. I feel that if this element of the film wasn't there, the movie would have been a real dud. The cinematography and locations of the film didn't really add much either. I always got the impression that the surroundings were very cold and this really didn't suit the film that well.I gave this film such a high mark because I felt the story really worked, Hackman's fine performance and the pace and movement of the film were perfect for a western. However, this film ranks low among those I gave a 7.7/10 stars.",Unforgiven
