,User_name,Review title,Review Rating,Review date,Review_body,Movie_name
71,highwaytourist,OK romantic thriller with some good scenes,6,19 February 2012,"For the most part, this is a passable love story with thriller elements thrown in. It's easy to watch. What's odd is that Whiteney Houston, who is not an experienced actress, gives a more believable performance than veteran actor Kevin Costner. Costner has done well in other movies but was wooden here. He's trying to do a Steve McQueen cooler-than-cool turn, but he seems like a wind-up toy soldier. Also worthy of censure is Costner's haircut, which was rightly criticized at the time. Houston is convincing enough, but it's because she's essentially playing herself. They have a love scene, which was also OK but nothing memorable. There is the supporting cast, which is good enough but nothing memorable. The screenplay is occasionally exciting but usually routine and not always believable. Costner's character probably wouldn't have been in the secret service to begin with if he's traumatized by a shooting that took place when he was off duty at a funeral. The soundtrack is the real star and this film features some great songs. Also praiseworthy is the ending, which was one of the few parts to avoid romantic clichés. It's very easy watching and will appeal to fervent fans of Whiteney Houston and romantic drama.",The Bodyguard
72,gws-2,A Less That Mediocre Thriller,5,2 March 2002,"Usually one can count on high production values to make even a bad Kevin Costner movie interesting.  Alas, despite having high production values, ""The Bodyguard"" was a bore.  Let me count the ways:  slow plot, preposterous story, and bad acting -- particularly by Whitney Houston.  In fairness, I should say that the completely unbelievable conduct of Houston's character does serve to make her performance seem even worse than it was.  Costner does not a bad faux Steve McQueen as the existential and dour (depressed?) athletic pretty boy, Frank Farmer.  But his performance does not save the film.  Indeed, I doubt that De Niro could have saved it.  Spend two hours and ten minutes elsewhere; not recommended; 5 out of 10.",The Bodyguard
73,el7,Romantic thriller to watch on the couch.,7,15 February 2021,"This story of a bodyguard tasked with keeping a pop diva safe from an obsessed stalker has some definite flavors of cheese, but it's elevated by the performances of its two leads. Kevin Costner could have played the bodyguard character as just a remote badass with supernaturally good instincts, but he layered some emotional complexity into his portrayal of Frank. Whitney Houston gave her character Rachel vulnerability, strength of will and sheer star power. Together, they give us this great 'ships passing closely in the night' romance, kind of like Casablanca meets the Lifetime movie of the week.The story starts by introducing us to Frank, a former Secret Service agent turned elite bodyguard, but he won't sign a long term contract. At first he lets the viewer believe it's because he's afraid he'd get too complacent and comfortable and lose his edge; but as the story progresses it becomes more obvious that he's afraid he'll become emotionally attached and lose his objectivity, which would cause him to start making mistakes, and indeed that nearly does happen. The backstory behind why he feels this way and left the Secret Services does not serve this character development at all, which is just one of the ways the story gets a little melodramatic. However, it's still incredibly enjoyable to watch.Anyway, one of his rules is that he doesn't guard celebrities. This is because they come with entourages who demand access which he wants to restrict, and that proves to be the case with Rachel Marron, a singer/actress who has been receiving threatening letters which have escalated to the point where her chauffeur nearly loses a hand from a booby-trapped gift. Frank reluctantly takes on the job, and then discovers that the threat is not as straightforward as it first appeared. Rachel's manager has not advised her of exactly how much danger she's in, afraid that it will result in her cancelling appearances, and also whoever it is might have insider access to her.Frank lays down the law for how he thinks Rachel should be guarded. Rachel is not thrilled with her movements being curtailed. Sparks fly. Drama happens. Things get heated. Some of the scenes are downright silly, but the leads have enough chemistry to overcome it. The threat actually turns out to be three-fold, which I won't spoil for anyone who hasn't already heard about the plot twist. It's a pretty good one. It results in a consequence that gets glossed over awfully fast, though.Overall, the movie is great if you enjoy a thriller with a good love story and don't mind if the couple's status is ambiguous at the end. If you're wondering whether that scene in the poster actually happens in the movie: yes it does.",The Bodyguard
74,pswanson00,chicks only need apply,2,27 October 2006,"Too long, tedious, boring, mind-numbing, poorly-written, gag-me-with-an-adolescent- fantasy piece of crap. I love many movies which are commonly referred to as Chick Flicks, but this hunk of junk is too much for me. The soundtrack is pretty good. I don't know how I can stretch my comments to 10 lines. I did read that Kevin Costner's part was originally written for Steve McQueen, and he may've been able to pull it off. Note that K.C. has Steve's haircut. This is a demonstration that celebrity in one area doesn't necessarily to talent in another area. The film needs a female lead who can act, and ol' Whitney ain't the gal for the job.",The Bodyguard
75,Ghenghy,"""I don't want to have this conversation again!""",9,2 August 2002,"Costner makes a great modern day badass. Worth watching alone for his portrayal of a retired Secret Service agent hired to protect superstar Whitney Houston. As far as romantic thrillers go, this is one of the best. Highly watchable, you'll forgive the glitz if you're a fan of the genre. The soundtrack is awesome and Whitney demonstrates her awesome talent on stage, so what if she can't act. 8/10",The Bodyguard
76,tkarlmann,The Critics got this wrong!,8,12 April 2019,This is a fine film -- perhaps Critics were waiting for Aliens to land or something. This is a fine film -- with fine performances by all and Great Sounds from Whitney! Enjoy!!!,The Bodyguard
77,alahmed-55673,Nice film. Needs slight changes to be perfect,7,5 July 2020,"I like me a badass tough smart main character.The Main character is badass. And Smart and tough. knows how to do his job.Reasons its not an amazing film
1- After they slept together(frank and Rachel) frank behavior changed cuz he broke one of his rules which is to never date a client. And he told her they can't be together. Which i think is so stupid. He could've just put a pause on the relationship until he killes the guy pursuing her.2- The ending could've been better why would they end The relationship.",The Bodyguard
78,metalrox_2000,Worse the waterworld,1,3 October 2005,"Yeah, I got roped into seeing this cheesy 90s chick flick cause of the girl I was dating at the time. Hollywood couldn't find away to make truly good movies in the 1990's, and many times through together movies like this, roped some big time actors into doing in in order to get people in the theaters, only to see the flicks quickly disappear when the audiences quit showing up. What we have in a contrived, rather implausible little story that never gets the viewer interested, and can't even get the viewer to care about their respective fates. Whitney Houston, providing scant actor ability, has zero chemistry with Kevin Costner, who should be more happy to include Waterwold, or the 1970's drive in flick Sizzle Beach USA on his resume then this fluff. Shoddy direction, implausible ending, and more or less, a script that seems like it was written on the fly. I remember being so bored out of my mind, that I was actually reading the box my popcorn came in. Even the girl was completely bored. We left as the movie was ending, as did the friends we came with. We all agreed that we could have spent the money better by tossing it in the toilet, and flushing. One of the worst films from the decade of sub standard music, and a down period for Hollywood flicks. Absolutely zero grade, and only should be watched if you don't get the lifetime network on your local cable system. Useless fluff.",The Bodyguard
79,paidinfull13,Inspiring because unique,7,25 November 2018,"Many things make this film unique, even as I am watching it in 2018, more then 25 years after it was released.
It was easy to be absorbed in the story and to follow along...
Not perfect, a little long perhaps but the suspense is very real and the romance very believable.
Overall a great film to watch with a date or just to be inspired if you think of playing the role of a bodyguard in a woman's life.",The Bodyguard
80,daviddaphneredding,one of those touching films adhesive to the mind,10,5 August 2013,"In this Mick Jackson-directed film from Warner Brothers, which was produced by Lawrence Kasden, Jim Wilson, and one of the two main stars...Kevin Costner..., the issue of interracial relationships is addressed; while that is a matter now tolerated but not totally accepted, even though it is much more frequent than it used to be, this movie presents it as a situation which can be warm, so much so that the sometimes-negative attitude toward it does not ""stick out like a sore thumb"", to employ a favorite cliché. Kevin Costner is in one of his best roles as the secret service agent, Frank Farmer, who is hired to protect Rachel Marron (played by Whitney Houston in her movie-acting debut), but neither has any idea that there will be love between them. In the movie Farmer does not beg Rachel Marron to be protected by him when the independent Marron is often hostile toward him, but that changes and then, again, love develops between them. Bill Cobbs and Ralph Waite do well in their supporting roles. The color is beautiful, so much so that the northern part of this country, with its snow-capped mountains is, in turn, beautiful and refreshing, and the ocean bordering Miami Beach is drawing and refreshing. There is plenty of exciting action, a bit of mystery, and, obviously, warm romance. Whitney Houston is her beautiful self as she portrays her consummate singing ability through such songs as ""If I Don't Have You"", as well as a signature song ""I Will Always Love You"". Because of all its trappings, the movie is one that could never be easily forgotten.",The Bodyguard
81,RJBrez,"Classic Costner, prime Whitney, not perfect but entertaining",7,15 March 2021,"I recently had the chance to watch The Bodyguard for the first time in years. Now that I'm older, I actually appreciated the storytelling much more than I did when I was younger. I love this era. No internet, or social media, or selfies, or any of that b.s. Obviously it has some flaws but I'd rather focus on the positives.Costner. I've come to appreciate KC's work much more the last few years. I think this role was perfect for him. His demeanor/actions always seem believable. My favorite scene is when Rachel's other bodyguard tries to fight him in the kitchen. No words are spoken during the fight as Costner makes a fool out of the man, and at the very end he simply says "" Now I don't want to talk about this again"". Pure gold.-Whitney. This movie really makes me sad for how WH's life went downhill after this movie. She was a star. Beautiful and talented. Her acting is far outmatched by Costner, but that happens to most people in the same position. I thought she was great.The soundtrack. This is obviously what most people remember and they should. It's simply incredible, and to this date, is still the bestselling soundtrack of all time. I'll leave it at that.I won't spoil the big reveal on here, but I do think it is what made some people dislike the movie. I loved the ending however with both of them going their separate ways after his job was done. You get the beautiful voice of Whitney and you get to see Costner in his new role, fade to black. Perfect, simple, storytelling. If this was made in 2021 it would have to end with the hopes of a sequel or a combined universe. Or it simply wouldn't be made. So if you do get a chance to watch it, please do. And enjoy it, you don't get to watch this type of movie that much anymore.",The Bodyguard
82,teejayniles2345,Why it's nowhere near CASABLANCA,9,5 July 2002,"This fairly well-constructed movie/music collage is rather dated as my wife and I watched it again July 2002.  The 10-year gap wherein some of the plot deficiencies would be unbelievable nowadays makes this seem ""long ago in a legendary land.""  The ""Mine"" club scene especially seems like a 1930's kind of gag since passing a grown woman in a kind of ""mosh"" setting would never really happen with such a harmless, happy ending.  Being stranded at the remote family hideaway with no lines of communication or emergency back-up plan also seems pre-World War II. To enjoy this movie one must enjoy the pop sound of Ms. Houston as well as tolerate the country (light) music of ""I will always love you.""  It is admittedly wacky when it dissects the Oscar/Academy Awards facade; after all, nobody ever really muffs their lines when the television audience is 2 billion viewers, really (??). This movie should never get serious consideration for telling its viewers that much about ""LOVE"" as does a much better but still ""dated"" movie: Casablanca (director Michael Kurtiz).  I believe that BODYGUARD is alluding to it in its choice for an airport penultimate scene; neither principle actor in the 1992 casting approaches the sensuality and romantic extremes of Bergman and Bogart.  Who is the ""third"" side of the LOVE Triangle in this subtextual riff?  Probably the Bodyguard's own sublimated Father-figure aspect with the Diva's son.  That kid is left adrift in more ways than one in the course of the movie -- whether he can swim and just what the ""name"" of the Diva's nominated movie is seem to be not very solid at different points of the screenplay.  For its strengths of music and comedy (sometimes inadvertent), I give it an ""8"" out of 10 star rating.",The Bodyguard
83,annmason1,Flat Champagne,5,20 January 2011,"The problem with this film is the total lack of chemistry between the two lead characters; or rather, between the actors who play them. That attraction is supposed to fuel the movie and drive it forward, but it's water in the gas tank; this clunker only rolls a few feet.Whitney Houston is so talented and beautiful, but exudes no sex appeal. In that respect she is like Julie Andrews of old; very talented, lovely, but, as one critic wrote of Andrews, ""Has all the sex appeal of a very efficient dietitian."" I would rather have seen, oh...Halle Berry or some actress with real dynamism (and dubbed voice) getting mixed up with Kevin Costner.Kevin Costner is a fine actor who was absolutely doing his best Steve McQueen impression. Women love to see a powerful, internally sensual man succumb to a woman so sensual or otherwise desirable that the poor guy's helpless. Costner is a powerful actor and few female actresses have that presence...Angelina Joli? Costner even was too powerful for Susan Sarandan in Bull Durham. I agree that, second to the flat interaction of the main characters, the story made little sense. If Frank Farmer had such a fragile ego that he could not come to terms with a tragic event he had nothing to do with, he would not have been selected by the Secret Service in the first place.And what was the plan with taking the entourage to the lake? Were they going to live there indefinitely? Papa Walton, by the way, was miscast as Frank's father. He seemed to be ready to break into a smile at any moment; or perhaps the corners of his mouth got caught on his dentures.The sister and son were very good. I liked the acting ability of both; Fletcher was very subtle and sensitive in a film that wasn't.The Oscar scenes were funny. Anyone who saw Naked Gun 33 1/3 keeps expecting Mary Lou Retton to come flipping and bouncing down the aisle. Rachel's (joking) reason for risking her life in attending was ludicrous...you gotta cheer when Frank's stoic chastity appropriately caved; if she was a Darwin award candidate, her days were numbered anyway, so why not? Actually, I thought Whitney Houston's acting was fine; she downplayed the role, seemed rather shy, and perhaps if there were more chemistry with the male lead, she would have received less criticism. I would like to have seen Diana Ross and Steve McQueen; they were equally matched dynamic folks.Oh well, there are worse movies. Just because this one lacked chemistry, motivation, and sense, doesn't make it half as bad as the remake of Lost Horizon...my overall standard of rotten films.And hey, I thought Frank's haircut was sexy.",The Bodyguard
84,fajarsantoso,Nostalgia,8,17 October 2018,"In 1992, the Bodyguard was a real box office hit. Although one might rate it low as it is a movie shot 16 years ago and one can easily compare it with today's quality of box office hits, I still rated it an 8, only for Whitney Houston, one of the best soul singers the world has known. May she rest in peace.",The Bodyguard
85,kira02bit,A real bore,1,16 September 2019,"Critically ravaged action/mystery/romance has a cult following among viewers of little discernment, but it is difficult to see why. Stoic bodyguard Kevin Costner is hired to overhaul the security for pop star/actress Whitney Houston in light of some death threats. Naturally the two clash and then fall in love. Yawn.The clunky screenplay had been growing mold around Hollywood since the days of Steve McQueen, who was the first star sought for the title role. Costner is oddly made up to resemble McQueen here. Costner's bodyguard, who is described as the best in the business, holds himself personally responsible as he was assigned to Reagan's detail but had a day off when the attempted assassination by Hinckley occurred. Thus ends the character development.Naturally, since Houston is being threatened and Costner is there to make sure she remains out of harm's way, she will be cooperative...NOT. Truly there would be no movie if Houston's character reacted in any credible manner to anything that goes on around her. She talks tough to Costner in a few scenes and tries to order people around, but she reveals herself to be such a clueless ninny that she cannot even finesse an overly exuberant crowd during one of her concert shows - and she has purportedly been in the business for quite some time. In short, she exists solely to place herself in some form of conspired danger at every opportunity and then wilt.Truthfully, the film is unsuccessful at whatever it tries its hand at. The mystery elements are half-hearted and even snoozing viewers will pinpoint the person behind the threats. Then again, Houston receives so many threats throughout the film - from audiences, from nuts, from people close to her - that it becomes difficult to keep track of who or what has her in their sights at any given moment.The action scenes are a bust. Everything unfolds in such a plodding manner that even the most obvious and clumsy of scenes are related as though they are of monumental importance and dripping with relevance. Houston never seems to be seriously in any danger, the assassin seems almost foolishly clumsy, and there is zero sense of urgency to anything that unfolds.The romance is deadly. To say that there is a lack of chemistry between Costner and Houston would be an understatement of colossal proportions. I can imagine frozen cadavers generating more heat. Costner is devoid of personality here and every line reading is flat. His pulse never seems to rise above resting. A bit of humor would have helped, but other than a mid-movie quip to an unwanted pass from a female partygoer, Costner remains a glum and uninvolving performer.Houston is every bit his equal on this front. Playing a pop star diva/actress should not be much of a stretch for her, but the woman has no energy or life onscreen. Even her concert moments are lifeless. There is no warmth or excitement to her - even her attempts to be diva-esque are pitifully weak. The conclusion set at the Oscars is unintentionally hilarious because it is impossible to imagine Houston being seriously considered for any acting awards given her emotionless line readings herein. And listening to her relentlessly wail ""I Will Always You Love,"" which quickly became grating after endless plays on the radio is no selling point either.Costner and Houston are singularly bad, but casting them as a couple on which to hang a film their combined effect is a virtual primer on how never to cast a romance. They are the antithesis of chemistry.So we have a romance populated by leads that have no chemistry, an action film with no action and a mystery with no surprises. To say this is a huge failure would be kind. It does not even have a camp element to make it unintentionally fun. In short, it honestly has nothing to recommend it.",The Bodyguard
86,msudude22,Razzies,8,13 March 2021,"I think six Razzie nominations is a bit hard, it wasn't that bad of a movie. I've seen a lot worse. If anything the only Razzie worthy performance was by DeVaughn Nixon (Rachel's son). I know he's a little kid, but his acting was bad.",The Bodyguard
87,NewDivide1701,"Meant to be heard, not watched",2,1 February 2006,"One of the greatest soundtracks of all time linked to one of the lamest movies of all time.The entire premise of the movie is a bodyguard, played by Kevin Costner, out to protect a rock singer, played by Whitney Houston, and the 2 fall in love. But outside of that, there is no story. No plot. Nothing to make it watchable.However, its soundtrack is still one of the best soundtracks to date. Especially with one of the best love songs of all time, ""I will always love you."" In fact without the soundtrack, the movie would have died on its first weekend. The song is the whole premise of the movie ""The Bodyguard,"" while the movie itself is 2 hours of aimless garbage.Without the soundtrack, the Bodyguard is at best zero out of ten. But even with the soundtrack, it still rounds out to a disappointing 2 out of 10.",The Bodyguard
88,kittiwake-1,it can't get any worse,1,21 August 2006,"Hopefully, you won't be left in the dark about the ending of this one. Very predictable, poorly acted, poorly conceived. If this is meant to have suspense in it, I'll be surprised. That's the only surprise about this movie. Watch the first five minutes. You'll know the plot, the ""twists"" and all. Then fall asleep like I did. Watch the last five minutes to confirm what you already know to be true. You'll have a great nap and know you solved a ""twisted"" plot with no effort whatsoever. If you can handle watching old Kevin Costner and Whitney Houston's lack of chemistry which is supposed to be so much a part of her motivations (and his), try to watch it all the way through. Like I said, at least you'll get a good nap out of it.",The Bodyguard
89,jubilee77,Looked to be promising at first.,6,6 January 2008,"Whatever films I comment on this site, The Bodyguard was a movie that was quite promising at first when it was premiered in 1992 and this was due to the number of commercials it received like TV adverts and movie posters displayed at shop windows or lit-up bus stop shelters but then several film critics in the media actually painted a different picture and sometimes gave it an average rating. It was clearly a movie that saw Kevin Costner's film career start to wane through highs and lows where to this day, he makes frequent appearances in second rated films despite some previous film successes like Dances With Wolves or JFK.
I did watch The Bodyguard a couple of years later on the living room box after reading the usually average ratings in the press. The film
turned out to be quite dull for a number of reasons with the plot about a bodyguard assigned to protect a celebrity singer played by one Whitney Houston, fictitious or not! It was even Whitney Houston's first attempts in making movies with Kevin Costner being the minder as he has to deal with Houston's sometimes annoying ""off-stage"" part as if she cared less about her own safety from a mob of deranged fans and behaves like a spoilt child that can sometimes become a cause for discomfort. I remember the adverts for this film very well and considering that, it okay.",The Bodyguard
90,BeccaGudd,"A great film, underrated in my opinion",8,6 February 2017,"I don't know why The Bodyguard hasn't got a higher rating than 6 stars?! I think that this film maybe only appeals to a certain audience. Whitney Houston plays the part of Rachel Marron a singing superstar who has recently became the victim of an obsessed stalker. Kevin Costner plays the part of her newly appointed bodyguard, Frank Farmer. Without going too much into it, Rachel and Frank end up falling for each other. However because Frank is hired to be her bodyguard, the lines get blurred as Rachel wants more. The music in the film in my opinion play a big role. As most of the songs were hits of Whitney Houston and the soundtrack was very successful. I didn't like the albino stalker guy in it, he was very creepy. Overall I love this film, it may not be for everyone but I've seen a lot worse.",The Bodyguard
91,nagyovamonika,The bestest,10,4 May 2018,"6.2??? Really? Wel , 16 years later, this is my favorite movie so i thought il contribute to the ratings . Amazing whitney with gorgeous kevin, deadly combination . Its nice triller with hint of a romance, LOVE IT",The Bodyguard
