,User_name,Review title,Review Rating,Review date,Review_body,Movie_name
49,PredragReviews,"""Reagan got shot! - Not on my shift!""",8,25 May 2016,"This movie has a dark atmosphere, which is something I love about it. It's not like most love stories. This movie is so different from a typical romance film. It doesn't just focus on the romance, it focuses on Rachel's career, the stalker, Frank's resistance to grow close to his client. That's what makes this movie so special. ""The Bodyguard"" is one of Whitney's best performances. You can tell she is in her prime with her career. She and Kevin Costner are outstanding in their performances. I love the performances throughout the movie most..Kevin Costner portrays Frank Farmer, a no-nonsense bodyguard hired by the singers associates that struggles with Marron's devotion to her career and her own deluded view that she is invincible. Houston plays a character that parallels her real life, an accomplished actress and singer who is being stalked by an obsessive fan. Bodyguard was to be the big vehicle to launch Houston into a mega film career. Although Houston's performance is commendable for her first film effort, her shining moments in the film are when she showcases the soundtrack, which is incredible. Costner is strong in his stern, powerful role. If you like a who-done-it film, amazing music, watching Kevin Costner, as well as just the right mix of romance and damsel in distress, you've got to get The Bodyguard (and get the soundtrack while you're at it).Overall rating: 8 out of 10.",The Bodyguard
50,LeonardKniffel,Worth It Just for the Singing,6,2 May 2020,"Whitney Houston became a movie star in this film, which offers a lot of insight into the level of talent and appeal she had some 20 years before her untimely death in 2012. Although this is not a musical per se (more of a romantic thriller), Houston plays a pop singer and performs, among other songs, her signature tune, ""I Will Always Love You,"" which was written by country legend Dolly Parton. ---from Musicals on the Silver Screen, American Library Association, 2013",The Bodyguard
51,mjw2305,I quite enjoyed it,7,25 December 2006,"The Bodyguard is fundamentally a love story between two contrasting characters with their own idiosyncrasies. The plot is intriguing enough to carry the film through and the romance between Costner and Houston builds steadily and realistically.With some decent action scenes, a decent cast and a great soundtrack, i found the Bodyguard to be an enjoyable movie.Clearly this film is not for everyone, it doesn't have enough action to satisfy the action fans, it isn't thrilling enough to be a thriller and as a pure romance film it is fairly weak; but i have to admit it does balance between these 3 genres quite well without excelling in any one of them.7/10",The Bodyguard
52,Howlin Wolf,He's got her covered.,7,9 August 2007,"Two professionals of different kinds. One who has to cultivate an outgoing and accessible air because that's how she makes her living, and one who keeps his emotions in and tries wherever possible to stay in the background as part of his. Mutual attraction will place limits on both of their lives - if they manage to stay safe for long enough, that is...Costner is well-suited to playing the stoic and intense action man, and casting Whitney Houston as a singer allows her a fairly comfortable start in the movies. They make an appealing enough couple and their chemistry together is of the simmering type. Some have criticised the leading female, but I believe her underplaying works well enough that we can glimpse a vulnerable dimension to her character.The whole thing seems content to serve as a glossy potboiler for the shameless romantic - and help to shift millions of soundtrack units along the way, of course. It's something of an easy sell, I suppose, but I'm still left admiring how it's packaged. A triple handkerchief affair for some females, no doubt, but it's flashy enough in certain spots to be of moderate interest to the guys too. Cross-gender appeal is what Hollywood strives for, and they hit upon a smooth and stylish blend here.",The Bodyguard
53,jromanbaker,Underrated film,10,20 November 2020,"Inter-racial relationships in a mainstream Hollywood film were rare back in 1992 and this was quite a revolutionary film, as it showed how normal it looked and not really questioned, and yet the poster of the time did a lot to underplay that. And Whitney Houston could really act, fragile and tough at the same time. I have reservations about Kevin Costner as an actor, but somehow he is right in this film and apparently wanted to act with Houston a lot. The plot is simple, but exciting to watch and the electricity between Costner and Huston is erotic, beautiful to see and the tender love scene with what looked like a samurai sword between them riveting to watch. Caught this on a UK channel. and it is rarely showed. A fine film that should be seen and shown on television more often in the UK than it is. I liked it back in 1992 and I like it even better now. A lot of details like the fund raising event for AIDS showed how exactly the film was aware of its time. Dramatic, tender and well worth re-evaluation.",The Bodyguard
54,mattymatt4ever,"The soundtrack is outdated, but the movie's still good",7,23 September 2002,"I saw this movie when it was first released and didn't really care for it. Well, basically I was still in grade school and didn't care for anything that wasn't loaded with action or comedy.  I gave this movie another try when it came on Cinemax and recorded it on tape.  It's a very impressive film that's both suspenseful and romantic, without being over-the-top.  The only thing that really bugged me was the soundtrack.  My cousins upstairs bought the soundtrack and would listen to it constantly, so I'm pretty much tired of hearing every single one of those songs.  Kevin Costner gives an engaging, charismatic performance.  Whitney Houston is not a terrific actress, but she can pull of a dramatic line without making me burst into laughter.  So I gotta give her a little bit of credit, being that this was her first performance.  I've seen much worse.  And it's nice to see Whitney looking very pretty, as opposed to now where she's destroying herself with drugs.  And though the relationship was between a white man and a black woman, the film didn't get preachy about it. 
I just think Lawrence Kasdan (who wrote the script) should've just made Whitney's character a singer, since we never see her act in this film.  We never see clips of her films.  All we see her do is sing.  So why not make her a singer and have the climax at the Grammy Awards?  Nevertheless, I really enjoyed the film.  It works well as both a love story and a thriller. And unlike most romantic films, the two characters don't constantly jump into bed together and the sex is left to the imagination.  We actually feel some real chemistry, through dialogue and character development.     
My score:  7 (out of 10)",The Bodyguard
55,one9eighty,and IIIIIIIIIIIIIIIIIIIIIIII-E-IIIIIII.... don't really like this over rated film,4,27 July 2018,"Starring Whitney Houston and Kevin Costner, who were both at the height of their star power this film is about a diva singer and her bodyguard. When Rachel (Houston) Marron's life is threatened, Frank Farmer (Costner) is hired to defender her. He is ex-secret service and she's a world famous pop tartlet. To co-exist they and survive they develop a special bond. This film looks at the relationship and all the drama along the way, as well as following the murder plot to take Rachel down and how Costner plans to thwart it. I have to admit, I wasn't really a fan, maybe it's because it's a blatant chick flick - or maybe it's the soundtrack song by Whitney Houston that makes me shudder every time I hear it - putting me off the film. The plot isn't that complex and there isn't really any sexual tension or chemistry between the two stars - which is a surprise as the whole premises is the whole 'will they/wont they', 'do they/ don't they' between the two potential lovers. They aren't that engaging as characters and I didn't care less what happened to them throughout the film. Where Houston and Costner are authentic is in their individual persona delivery - Costner is supposed to be fairly dull and bland - which I believe; and Houston is supposed to be a bratty diva - which I could also have believed. This felt more like a vehicle for Houston's vocal talent than a real attempt at a film. Overrated and not my cup of tea. I can't say it's a terrible film as some production value has gone into it and at least it's got a linear enough narrative to follow. 4 out of 10 from me.",The Bodyguard
56,stephenchase-63504,This is Whitney Houston's greatest movie!!,10,8 February 2021,"The best part of this classic drama is when the 2 main characters throw snowballs at each other!! Whitney, rest in peace!!",The Bodyguard
57,tonypeacock-1,"A good example of critical hatred, loved by audiences",6,28 March 2021,"Here is a classic example of a film seemingly hated by the critic fraternity but compounded by audience aggregate ratings, myself amongst them.Kevin Costner plays the bodyguard to pop star diva Rachel Marron (Whitney Houston). Costner as Frank Farmer is haunted throughout the film about failing to stop President Reagan being shot in 1981 even though he wasn't on duty for g
honest reasons at the time. Now he protects private individuals and for the first time a high flying spoilt pop star who doesn't realise just how much danger she is in.Costner was riding a career high at this stage of his career before it came to a shudder with Waterworld (1995).Houston displays her immense singing abilities and her debut acting performance before her untimely death isn't bad either.I could just imagine this being a perfect vehicle for an actor like Steve McQueen in his pomp and that was before I learned the film was originally slated for him years before!Costner in my opinion improves on his dire performance in Robin Hood: Prince of Thieves (1991) where he played Robin with a Hollywood accent.Look out for annoying character called Sy Spector (Gary Kemp) of brothers Spandau Ballet fame and also The Krays (1990).Also look out for another interesting casting choice Ralph Waite as Frank's father, Herb Farmer. Older viewers will recognise him from the role of John Walton Sr. On television show The Waltons.The chemistry between Costner and Houston is what makes the movie a success. It looks like they really did enjoy each others company. Like their characters?The plot may be generic in that ex-secret service agent Farmer goes Private Sector and gets a healthy salary in the process! However the story is gripping and is interesting.Not a high end piece of artistry but damn good entertainment value none the less. Sometimes that's all you want?",The Bodyguard
58,Beejerman,CHEER! - (9 stars out of 10),9,8 January 2019,"The stage curtains open ...I just finished watching and reviewing the documentary released this year simply titled, ""Whitney"" - so I thought I would revisit ""The Bodyguard"" since it has literally been years since the last time I saw it. Most movies, as they get older, become dated and not as viable as they once were. Not so with this film. In fact, it just seems to get better over time, like a fine, aged wine. Some of the little things that used to get under my skin with this movie (ie: Kevin Costner's hair style, Whitney's choppy debut acting performance, some of the mistakes they made in regard to how a trained secret service agent would really act in certain situations, some of the bad camera work at the end of the movie) - these things just don't bother me anymore.The power and the strength of this film is the music, the chemistry between Costner and Houston, and the strong characters. Of course, maybe it is just the age I'm at now that makes the difference. It has been over 25 years since it came out and the first time I saw it. Maybe, the movie has always been this good and I'm just now starting to realize it. In any case, it has grown to be a personal favorite of mine. I won't bore you with a synopsis of the plot, since this one is so well known already. But, I will say that with the passing of Whitney Houston, this one can be a bitter pill to take now. I did feel my heartstrings being pulled a bit more and the sadness creep in. Despite this, however, I still love this movie. It is a must-see in my opinion, and a high recommend to any of those who have yet to watch it for the first time.",The Bodyguard
59,saadanathan,good romance movie but that's pretty much it 6\10,6,2 May 2020,"This is a good movie but there is nothing much else to say about the bodyguard. I mean this is a simple story: an ex secret service agent is tasked with protecting an R&B singer from threats on her life, and that's pretty much it with the plot. kevin costner delivers a good performance and I really agree with his decisions in the film and what he does. whitney houston is probebly one of the most annoying characters I have recently seen in cinema history. her character is so annoying I had high hopes she would die in the movie.",The Bodyguard
60,frosty-44431,Amazing artistry!,8,13 February 2021,"For a massive talent in singing this was a really good film, I do feel the soundtrack made an impact on the score.",The Bodyguard
61,sunznc,At times lurid but enthralling,8,2 August 2009,"I was hesitant to watch this film. A friend had rented it and ask me to watch it. The acting here is good by most everyone. It is also interesting how you get to see 'behind the scenes' of a person who is a mega-star. You get a little peek into the private life that you might not see otherwise.At times the film feels lurid and soapy. But other times it is fascinating. Kevin Costner did a very good job here and looks so handsome. He really gave his character life here. Whitney Houston also does a good job and it wasn't any stretch at all to believe her portrayal of the big star singer. Probably a film that women would enjoy more than men but despite the flaws, I did enjoy it. I don't think it ever became too sappy. I think the reason for the attacks on the star are probably the weakest point of the film.",The Bodyguard
62,frankfob,"Overblown, overheated, overrated",3,7 August 2004,"Annoyingly stupid movie, meant to launch Whitney Houston's acting career and, apparently, Kevin Costner's fallback career as a model for terrible haircuts. Houston is, of course, gorgeous and sings like an angel, but her acting ""talent"" is nowhere to be seen, and her ineptness brings down the whole movie--not that it had a lot going for it in the first place. After Houston, playing a pop diva, starts getting death threats from an obsessed and obviously crazed fan, Costner--a former Secret Service agent--is hired to protect her. Instead of showing appreciation for his efforts to save the lives of her and her family, however, Houston proceeds to fight him at every turn, insulting him, mocking his attempts to turn her house into a secure area and generally making a complete ass of herself, and her attitude spreads to her entourage and hangers-on, all of whom turn on Costner. In the real world Costner's character would have told her to screw off after the first day and dumped her, but--in a plot ""twist"" you can see coming a mile away--they proceed to fall in love. Yeah, right.Anyway, like I said, Houston is great to look at, her voice is divine, and Costner tries hard, but overall this movie is not much more than an extended episode of ""General Hospital"" or some other equally brainless soap opera, and is just as predictable and badly acted. Houston's fans will like it, Costner's fans might like it, but anyone else is strongly advised to avoid it.",The Bodyguard
63,henrycoles9,Bad story,6,25 June 2020,"Probably like everyone else I watched this movie because it was the movie where Whitney Houston sang the otherworldly song ""I Will Always Love You."" Someone once asked why all the good songs came from bad movies. I can see Kevin Costner and Whitney tried their best, but there just wasn't any tangible chemistry, never mind the dull, incoherent story.",The Bodyguard
64,Brian-272,Average movie that produced a great soundtrack it's average due to the mediocre performances of Houston and Kevin Costner.,4,18 January 2001,"This modern story of a knight in shining armor just didn't do it for me the acting and story is just to childish. And I must mention that Kevin Costner disappoints again folks this guy just doesn't impress me. Whitney Houston's hit songs on the soundtrack ""I Will Always Love You"" and ""I Have Nothing"" are great but I must say Whitney your acting is much to be desired. The, Bodyguard is a movie to watch but this film is more known for the music it helped make popular.",The Bodyguard
65,rollernerd,I Have Nothing,6,13 August 2021,"Welcome back to another edition of Adam's Reviews!! **queue in intro music**What was supposed to be action packed Friday night ended up as a romantic flick - so tonight's movie review is The Bodyguard (1992) which stars the likeable Kevin Costner who plays Frank Farmer a bodyguard who is assigned to protect pop singer Rachel playing by Whitney Houston. We have here is a few suspense moments and a melodrama of the romantic link between these two characters. The movie does have an interesting twist at the end and the overall acting isn't bad in the movie. What the movie lacks is cliched dialogue and the chemistry between the two leads feels forced and cartonny - like are you serious with the samurai sword scene?? If you are a 80's and 90's pop fan, then you will love the soundtrack in this movie. The movie could have gone more in the stalker suspense but instead gave away the reveal plus there was an interesting aspect of the expectations of fans with their idols. We could of also seen Frank's obsession with security and changed the script around his reasons on becoming a security guard however once again we were given a bland backstory. I did enjoy Costner's performance as a cold and detached guy however hides his emotions under the surface around guilt of a prior presidential assassination attempt. Again the soundtrack really works in this film especially with Houston's beautiful voice which can be demonstrated with her belting ""I Will Always Love You"" and ""I Have Nothing"", awesome ballads but again the overall story is just bland and too slow-moving - 6/10.",The Bodyguard
66,axlrhodes,An easy target for critics.,7,23 March 2018,"The willingness to sacrifice oneself to save the life of another person is inherently romantic, which is the idea at the centre of The Bodyguard, a two-worlds-collide drama-thriller starring two of the hottest tickets of 1992's film and music scene, Kevin Costner and Whitney Houston. While it might make an easy target for critics, The Bodyguard is a film that connected well with audiences upon release. Much of that comes down to the perfect storm of three elements; Lawrence Kasdan's script (it rattled around Hollywood for years), Kevin Costner's leading man status and Whitney Houston's incredible vocal performance - particularly the mighty power-ballad 'I Will Always Love You', which ate up the pop charts. These three elements are competently stitched together by British director, Mick Jackson, who captures enough chemistry between the leads to paper over the gaping cracks that emerge. Costner carries his brand of quiet man chivalry, which gives Houston room to find her character in their scenes, which are always engaging. You can only guess, but it doesn't seem a stretch to imagine the similarities between her character and what her life was like. The writing tries to examine what it's like to live in the cocoon of celebrity, but the direction of the narrative becomes increasingly about the thriller aspect of the story, leaving some, but not much to chew over. When the finale comes, it's a messy combination of awkward positioning and bad logistics, culminating in a predictable, mostly underwhelming conclusion. That said, given the right mood, The Bodyguard is entertaining mainstream cinema, held aloft by its star credentials.",The Bodyguard
67,NewEnglandPat,A lightweight melodrama,3,24 May 2009,"Whitney Houston's screen debut is a lavish urban thriller that takes itself quite seriously but never gets going. The film stumbles from one scene to another and never has any semblance of a coherent, believable story. The production values are top notch all around but the plot is utterly senseless. Houston does well in her role as a temperamental diva, is talented, pretty, bitchy and vulnerable. She fares much better than star Kevin Costner, who plays the title role. Costner seems unsure of himself and comes across as tentative and hopelessly wooden, although he and Houston do seem to have a bit of chemistry between them. Ralph Waite is fine as the bodyguard's father but the rest of the cast overacts to the point of silliness.",The Bodyguard
68,jakebrann,That's not how you kiss!,9,9 April 2020,"Anyone else notice that their kissing appeared to be hot and dramatic but if you look closely, neither of them once opened their mouths! They both just smashed their closed lips together and the film crew did the rest circling around them. Pretty lame actually... I'm assuming Bobby Brown wasn't ok with her kissing someone else!?Anywho, I'm not sure why the reviews for this movie aren't a whole lot higher than they are. This was such an all-around good movie with pretty good acting and great singing. It's been pretty clear that Kevin Costner and Whitney Houston really did have a connection and as the years have gone on it's obvious that he really cared about her. This really is a nice love story. WH was so all around talented. Gone too soon.Watch it! Pay no attention to the haters...",The Bodyguard
69,The_Orenda,Not as bad as the voters think.,7,15 February 2005,"You know, I was looking at IMDb's database on romance and was pretty stricken to see that not only 'Vertigo' was rated a romance(!), but five of the top twenty were written around and before fifty decades ago. Ghost? Nope! Dirty Dancing? Ha! Try 5.3. Titanic? 9100 votes gave it a 1. Ever After? Female votes have scraped it up to a 7! Wedding Singer, Pretty Woman, GREASE of all movies. Modern romance has been beaten to a pulp, but even though the same conventions of romance movies exist in The Bodyguard, I'm not one of those people who hated it.After missing out on Reagan's assassination attempt, bodyguard Frank Farmer is now working for-hire. When a singer hires him after she gets death threats, conflicts begin but feelings follow.The Bodyguard plays out your basic romance and resists the urge to jerk any tears. I don't think the actors could pull it off though. There's a point in the movie, when they realize their romance, when their reactions don't make any sense, but afterward everything about the movie plays out like it should and it's well made! Although I believe people are rating the movie on what has happened to Whitney Houston in recent years, they should judge it for the performances themselves and that means it's not bad.",The Bodyguard
70,imbluzclooby,A successful and bad movie!,5,14 December 2005,"Why was the ""Bodyguard"" so successful at the box office? I know the reasons. Does it mean that it's a good movie? That all depends on who you ask. The Bodyguard is a story that only appeals to one's emotions and never intellect or depth. This movie has a very weak script. The plot is just elongated with the spirit of your typical love story formula. And it touches on all the essential romantic buttons to have girls flocking to the theater. No it will never be heralded as a masterpiece and it even lacks the depth of movies like, ""Love Story"" and ""The way we were"". First off, the pairing of Houston and Costner was unique and somehow drew you in. Houston plays herself pretty much; the spoiled, talented and exceptionally beautiful pop star. Costner plays the dry, uptight and boorish professional bodyguard. They are both opposites, but that is what makes the love story intriguing. Costner has been bashed for his boringness, dullness and lack of charisma. He never really qualified as a leading man in my opinion. But here it somehow works, because Houston's beauty was more revealing as a foil to his bland as goat milk persona. And Whitney Houston was at the height of her career and beauty in 1992, and Costner was at his prime as well. Intellectuals and film critics are more likely to be annoyed by this sappy and overblown love tale. But there are those that just can't help but be immersed in the romance intrigue of it. This is your rare and typical successful bad movie that ranks up there in the same phenomenon as ""Rambo"", ""Terminator 2"", etc. Brainless films that just appeal to our senses and emotions.",The Bodyguard
