,User_name,Review title,Review Rating,Review date,Review_body,Movie_name
51,chris_gaskin123,Welcome to Dante's Peak,10,18 July 2006,"Dante's Peak is one of the best of the 1990's disaster movies.Harry Dalton is a Volcanologist sent to Dante's Peak to have a look at the volcano overlooking the town after some readings suggest it is about to blow its top. It has been dormant for thousands of years. The first sign of things to come is when a couple are killed bathing in s spring when a tremor strikes. Dalton teams up with the mayoress of Dante's Peak but despite continuous warnings, nobody believes him of the predicted eruption. They do when the volcano finally erupts and the town is evacuated. Dalton and the mayoress then go to her ex mother-in-law's home to rescue her two children. The mother-in-law is killed and they only just make it to safety in one of the children's hideouts. They are then rescued and have also fallen in love through all of this.Dante's Peak has excellent special effects, especially the eruption scenes.A good cast too, lead by Pierce Brosnon (in between making Bond movies) and Linda Hamilton.If you like disaster movies, Dante's Peak is strongly recommended. Fantastic.Rating: 5 stars out of 5.",Dante's Peak
52,dunmore_ego,Goldeneye meets Thunderball.,6,17 August 2011,"If VOLCANO was the fun fun fun volcano movie of 1997, DANTE'S PEAK was its serious big brother. That doesn't stop it being unintentionally funny.Geological mystery abounds on whether the mountain shadowing bucolic tourist town Dante's Peak will erupt or not. Yuh think? Yet Pierce Brosnan wastes his overqualified suaveté as geologist Harry Dalton, sniffing for sulphur and prospective explosions, whilst himself trying to sniff and explode in the man-pants of ugly town mayor Linda Hamilton. (Is it just me or did her muscles in TERMINATOR 2 alleviate the weird face?) Pre-empting VOLCANO by a mere two months, there is more science, more drama, more romance here than in Tommy Lee Jones's bombastic vehicle. And in place of the leathered shoe-face of Jones, more Pierce - yes please! Of COURSE the mountain explodes (did I ruin it for anyone?), and all boredom breaks loose. Running and Screaming with the usual tropes: the grandmother who won't leave her mountain home, then ends up sacrificing herself for her grandkids (when she hops out of a boat into supposedly boiling water to help steer it to shore, yet looks like she's just stepped into a pool that's not heated quite right at the old folks home); Harry's geologist boss (Charles Hallahan) who disagrees with him, who is proved wrong and dies, his crew watching his van being swept away like they're watching a physics lecture; there's even a dog leaping to safety. I hate that. I hate that so much.And don't forget the spindly, delicate robot surveyor that can't even walk steadily on flat ground, sent down the 60-degree slope of the caldera, which it descends at a rate of We'll-Be-Here-Till-Christmas. Of COURSE it malfunctions halfway down, precipitating a decidedly reckless doughy geologist going ill-advisedly off-rope to fix the useless piece of crap. Of COURSE he breaks his leg during a tremor that rattles everyone's eruption nerves except their boss's, who promptly doesn't put the town on alert.His death in the van is pretty humorous, but Grandma wins the Funniest Death award here.",Dante's Peak
53,MadamWarden,DON'T PEEK AT REASON,6,21 September 2021,"Yes, a good old disaster extravaganza with completely over the top action and ridiculous plot but a fair old Covid lockdown distraction.",Dante's Peak
54,ProjectAnomaly,Dante's Peak,2,1 October 2019,"In terms of action/awesomeness, this film really tried too hard. My science teacher actually put this on to see if his class could point out the scientific errors.",Dante's Peak
55,vip_ebriega,Great special effects + Average writing = Good movie.,6,13 May 2008,"My Take: Special effects and eminent destruction salvage the disposable writing.After the success of Jan De Bont's Big-budget disaster epic TWISTER, Universal green-lit its own disaster spectacular DANTE'S PEAK, which is practically the same movie that TWISTER was, only this time, it's a dormant volcano that goes berserk, and the people are not studying the tornadoes, they study volcanoes. Not much of a differences now isn't it? DANTE'S PEAK is what it is, a big-budget summer offering, where the money is heavily spent on special effects, and the script is either out of focus or uninteresting. DANTE'S PEAK could fall to the guilty pleasures list along with all those dated 70's disaster movies, but I did like it more than a guilty pleasure. It's still average at best for sure, but it's got some fun moments with its special effects, and that's pretty good enough to recommend.Let's run through the disaster movie checklist shall we? 1.) Is there the scientist who predicts the danger and ends up being neglected at first, but ends up being the ultimate hero in the end? Yes there is, and he's played by Pierce Brosnan. The character's Harry Dalton, a vulcanologist joining his crew studying the ""extinct"" volcano at Dante's Peak. Brosnan's a good actor and pulls off the role easily, but the character's not very interesting enough. At the end of the film, you'll end asking ""Who was he again... Harry who?"" 2.) Is there the guy who doubts the leads warnings? You betcha! He's Paul Dreyfus (Charles Hallahan), Dalton's boss, who thinks Harry's just nuts! Besides the fact that he does learn his mistake in the end, there's nothing more this character does. 3.) Are there the supporting characters including the leading lady, the annoying kid(s) and of course the dog? Why shouldn't there be? The movie's got two kids, and a dog. There's also the grandmother and experts. Linda Hamilton who gave women the ultimate credibility in TERMINATOR 2 plays a rather feeble character here as Mayor Rachel Wando, mayor and love interest, overall a disposable summer movie character.Oh lets face it! The writing here isn't very good, but it's still a lot of fun nonetheless. Even if we don't care about these cookie-cutter characters, those action scenes (including the one where they're chased by the cascading lava flows) are pretty exciting. It's forgettable summer fare, but it does it's job. Better enjoy it for what it is.Rating: *** out of 5.",Dante's Peak
56,tbills2,"Dante's Peak, a Blast from the Past!",6,24 July 2013,"Dante's Peak is a little unknown, very fine film. Pierce Brosnan is Dr. Harry Dalton, a volcanologist with the U.S. Geological Survey, who's sent to the small town in Washington within the Northern Cascades named Dante's Peak, the second most desirable place to live in the United States population under 20,000, to check on a long time dormant volcano that's about to erupt. Linda Hamilton is Rachel Wando, the mayor of Dante's Peak, who's taken with Dr. Dalton and keeps close by. Hamilton and Brosnan have very interesting, very authentic chemistry that makes Dante's Peak more than worth while. Brosnan and Hamilton is the movie's main sight, while the volcano of Dante's Peak is the movie's main attraction. The ever-present brewing volcano provides the ominous backdrop to the storyline implanting constant tension. There's no action or effects until the volcano erupts, but when it does, there's loads of it. Dante's Peak turns into an all out action-adventure with great set effects for large scale destruction. The presentation of the special effects is very well done. The movie is good before the volcano erupts still, by having a nice, hang around vibe and pace, good not to rush things. Dante's Peak's prolonged pace is difficult to achieve, but it is executed well. The film does a solid job of incorporating the characters onto the viewing. Dante's Peak has good camera direction from the start up and through to the action-packed finish that makes for an overall great visual experience. It's a well-framed story. I don't know what all else to say other than this is a really liked film without too many complaints. I give Dante's Peak a 6 for it being so greatly appealing and such fine, family fun. I can enjoy this movie dearly again and again every so many years. I like Volcano more, from the same year, but Dante's Peak is a better movie.",Dante's Peak
57,BroadswordCallinDannyBoy,Hell hath no fury...,8,29 January 2009,"If ""Dante's Peak"" demonstrates anything, it is that a very simple idea CAN be done well if it is done right. Everything you needed to know about this movie is in the trailers and that is briefly summed up in the following: a volcano next to a small town erupts. Then in seeing the film you can see that the promise of destruction is fulfilled as the volcano does, in fact, erupt. All the usual clichés are here: the lead scientist has had a loss in life, is driven by it to insist on the volcano erupting, people in his team doubt him, there is slowly mounting tension and ominous evidence, etc... but in the end he ends up being more than right as the volcano erupts and, oh boy, does it ever! The result is some of the most enjoyable scenes of sheer terror and destruction to ever rampage across a movie screen.The movie takes place in one town yet the production must have been massive as the 100 million dollar plus budget suggests. Since everything is pretty much destroyed via glorious classic practical effects; buildings, cars, helicopters, trucks, bridges... in fact the volcano unleashes such a hellish fury that it's name, Dante's Peak, is very appropriate and much more thoughtful than say, ""Volcano.""The thing that usually kills a movie like this is the overdoing of effects and overdoing of plot. Depsite harrowing catastrophic destruction the effects are just enough for a movie like this, meaning when it's over no one will be disappointed or asking for seconds too quickly. Then the acting is too pretty much just right and straight to the point. Corny subplots are left out and the film, though ridiculously simple, is very focused on what it sets out to do. That is what makes it enjoyable. --- 8/10BsCDb Classification: 13+ --- terror/violence",Dante's Peak
58,rebeljenn,Ugh! Another thriller about volcanoes! Disaster!,2,13 November 2005,"'Dante's Peak' was one of the volcano disaster films that emerged in the mid/late-1990s. It's just what you would expect out of the typical thriller movie. You're introduced to the characters: typically a male and female lead who will probably get together by the end of the film, a brewing disaster usually followed through with some sort of science lesson, and a fast-paced and action-packed scenario typically involving something natural like killer snakes or dinosaurs or terrorists or volcanoes or aliens or snowstorms or tornadoes... You can pretty much make a generated storyline based on the genre. Enter number of characters, at least one male and one female. Enter natural disaster. Hit submit to get your plot.Dante's Peak is no exception to the rule. You can pretty much guess the conclusion here. Hey, if you like thrillers, see this film. If you don't like them, then don't bother. I wish I hadn't been dragged off to the cinema to see this. Talk about a waste of a few dollars...",Dante's Peak
59,tonypeacock-1,Disaster movie cliche's are all here!,6,14 November 2019,"The late 1990s was a sort of renaissance for the disaster movie. This entry in the genre focuses on an explosive volcano thought dormant near the town of Dantes Peak. An affluent U.S. town.The film from 1997 stars Pierce Brosnan fresh from his success in his debut James Bond film Goldeneye. Brosnan plays a volcanologist who suspects the imminent disaster about to befall the town when trees die from elevated sulphur levels in the soil, poor water quality and burned alive bodies in a local spring. I've never been keen on Pierce Brosnan as an actor at the best of times. To me he is still a B-list TV star from Remington Steele in the 1980s. The film also stars Linda Hamilton as the town mayor Rachel Wando. Hamilton was best known as Sarah Connor in the Terminator franchise. She does an admirable job despite some poor lines and delivery from Brosnan.The film has several classic elements from the disaster film. The relationship between Brosnan's volcanologist expert Harry Dalton and Wando forms a side-story to the main disaster to follow. Of course Wando has two cute kids and a pet dog oh and a stubborn old mother who lives further up the peak and nearer the epicentre of the ensuing eruption.The dog runs into danger and leaves the audience in suspense at it's survival chances. I wonder (sorry I know) what happens to the dog. It happens in these films all the time! As the volcano erupts the town has to rapidly evacuate. The scientists early in the film tell us how quickly the volcano erupts. Wouldn't they all die anyway? Which brings me onto another cliche of such films. The town meeting with officials where there is scepticism to the dangers!I had to laugh at some of the set pieces such as Dalton driving through molten lava in a 4x4. Wando's elderly mother sacrificing her own life. Ash falling down on the residents like snow. Wouldn't it be hot and cause lung injuries? The CGI is plausible for the period and is used to good effect. A time passer but hardly a classic. However better than fellow 1997 volcano film Volcano starring Tommy Lee Jones.",Dante's Peak
60,jessegehrig,Do you ever wonder why they make movies?,2,21 March 2015,"This stuff happens in this movie: Big old cloud of smoke! People get burned up at some natural spring! There is a volcano! Grandma f*cking dies! I don't think the people knew the volcano was coming until too late! Linda Hamilton is a woman! A lady! Pierce Brosnan's character is not James Bond in this movie! Don't get confused! I think Pierce Brosnan's character is a geologist! They think about rocks, professionally! Do you f*cking think about rocks professionally, I bet you don't! Plate-tectonics is why volcanoes happen, that or because of supernatural causes, you decide! Pierce Brosnan's character does not die at the end, they make it seem like he might be dead, but he's not!",Dante's Peak
61,Movie-12,One of the worst disaster films ever created in the history of film. 1/2* out of ****.,1,28 December 1999,"DANTE'S PEAK (1996) 1/2*Starring: Pierce Brosnan, Linda Hamilton, Jamie Renee Smith, Jeremy Foley and Elizabeth Hoffman Director: Roger Donaldson   Running Time: 112 minutes   Rated PG-13 (for disaster violence and gore)By Blake French:	""Dante's Peak"" is a disaster of a disaster flick. That is a cheap joke, but the movie sure wasn't cheap to make. Massive pyrotechnics, state of the art special effects, some of the biggest names in the movie business, all contribute to one big fat number to the production cost. It is a movie with such little intelligence and emotional significance it is hard to sit through the film's overly long running time without laughing at its stupidity. This is one of the worst films I have seen in quite sometime.
	Instead of the story, lets skip right to the chase. How about starting with the flawed characters. Take for instance the grandmother, Ruth. Her character is all but a puppet of the plot. Ask yourself these questions and notice the answers are only present to place the other characters in more tension rising jeopardy: Why would Ruth refuse to leave her cottage when the town is being destroyed by volcanic material? To provide the characters with a reason to travel up the mountain to save her and put themselves in more danger. Unfortunately, the film is so stupid it cant even capture a rescue correctly. Ruth's grandchildren (10-12 years old,) take their parents vehicle, drive through the volcanic soot, and somehow manage to find their way to the cottage, yet they cant turn on the windshield wipers in the car. And lets not forget to mention the two main characters, Harry Dalton and Rachel Wando, whose personalities are instantly obvious. We know who is going to die from the beginning just judging from difficulties in personalities.	This entire production is held together by pure foolishness. Just look at the film's extreme stupidity--here are a few examples of how dumb and or desperate the writers actually get: · Harry drives his truck directly through a moderately deep river due to an overcrowding of traffic, and makes it across with few difficulties.
· The family's dog, Ruffy, disappears near the start of the volcanic eruption and somehow manages to appear out of nowhere for his heroic family rescue sequence. · Harry and crew drive through a platform of molten lava.
· The concept of the characters waiting till there's a river of red hot lava flowing through the living room of their cottage before they decide its time to run. 	""Dante's Peak""  is so bad it doesn't even offer any surprise when the volcano finally does blow its top. The film foreshadows the eruption with so many elements it is almost hard not to ask yourself why they even bothered with the production in the first place. Here are some examples of elements foreshadowing a Volcanic disaster · First of all, why would anyone make a movie about a volcano about to erupt if it wasn't going to erupt in an all out action finale filed with special effects? · Animals are dying everywhere on the mountain for unnatural reasons.· While swimming in the mountain's springs, two lovers are killed when the water dramatically heats up.· We see water boiling in the mountain.· The mountain shows strange activities while a man just so happens to be testing its activity levels.· Sulfur dioxide is found in the city's water supply.Now here is some dialogue foreshadowing the volcano's explosion:· ""This mountain means business.""· ""98% of these are false alarms.""· ""When is this mountain ready to blow."" · ""If the volcano did blow it would reach here within a minute""Of course the filmmakers couldn't resist but to throw in a romantic subplot. The following actions and or conversations all attempt to develop romantic chemistry between Brosnan and Hamilton:· Harry's and Hamilton's characters sit down in the evening and nonchalantly discuss romance in their past.· The two take a peaceful walk together in the evening while one asks the other if they can stay longer.The special effects in this picture are also quite lame. The erupting volcano looks like a still photo of something out of national geographic. We do get to see buildings fall apart and fires start, but that isn't as exciting as the scene in which Harry outruns a cloud of volcanic smoke speeding towards him-not. This may be the worst disaster film ever made, but at lest it still contains decent performances.Brought to you by Universal Pictures.",Dante's Peak
62,maccas-56367,One of the best 90s disaster films,8,1 February 2021,"I had forgot how epic and entertaining 90s disaster flicks were. Somehow my first time watching this in its entirety, I was entertained and engaged throughout.It requires the suspension of disbelief in heavy doses, but it does what you need a disaster film to do. The special effects were quite impressive for the 90s and looked great at times in high-def.Pierce Brosnan was in top-form and really carried the film with Linda Hamilton. Some of the ""deaths"" were a bit laughable, but I think it's to be expected in films of this type. It adds to the (dare I say) fun that disaster films often are.It makes me want to visit the town of Wallace, Idaho. A lot of beautiful scenery to see when it isn't being blown up or covered in ash.Recommend for those into disaster films, Pierce Brosnan or those needing a 1990s escape.",Dante's Peak
63,rossrobinson,What a thrilling movie,10,31 October 2003,Dante's Peak: This was a fantastic movie. Pierce Brosnan and Linda Hamlton are fantastic actors. Pierce Brosnan plays a fantastic part as playing James Bond in the Bond Movies and Linda Hamlton is great of starring in both Terminator movies. I give Dante's peak a great score 10 out 10.,Dante's Peak
64,jhaggardjr,A blast!,8,5 November 2000,"""Dante's Peak"" is a very entertaining disaster film about a volcano erupting in a small town in the Pacific Northwest. Pierce Brosnan stars as a volcanologist who goes to the town to investigate the current rumblings going on around the mountain. He gets help from Linda Hamilton who plays the town mayor. The first half of ""Dante's Peak"" is only moderately entertaining with Brosnan trying to convince his dumb-as-nails boss that this mountain means business. But the real excitement comes at the halfway mark when the volcano explodes and the special effects take over. The visual effects are very impressive in ""Dante's Peak"", which puts the terrible effects in Irwin Allen's awful 1980 flick ""When Time Ran Out"" to shame. Brosnan and Hamilton turn in very good performances here, as do the two kids who play Hamilton's children. There are a few weaknesses in ""Dante's Peak"" which keeps it from being a great movie. It's too bad not everyone turns in a good performance in this film. Charles Hallahan and Elizabeth Hoffman have the most laughable parts in the film as Brosnan's boss and Hamilton's ex-mother-in-law, respectably. They provide the dumbest dialogue in the film. And it would have been better if the eruption had happened a little earlier instead of the mid-point of the movie. A couple of scenes in the first half are a little boring. Nevertheless, there is enough good stuff in ""Dante's Peak"" (especially in the second half) that I ended up liking it in the end. It's one of the better disaster movies. *** (out of four)",Dante's Peak
65,chrisbrown6453,"If a loud special-effects display gets your heart pounding and your blood pulsing, then Dante's Peak may be just what you need.",6,21 May 2002,"Others beware. Yes, the effects (including earthquakes, floods, explosions, flaming lava flows and ashen downpours) look expensive and are generally impressive, except for some bogus miniature work, that is. The rest of Dante's Peak is the pits. Tired clichés dominate. The cookie-cutter characters are beyond dull, and the predictable plot devices are ""borrowed"" from Jaws and countless other, better disaster flicks. Dante's Peak is a picture postcard-pretty town in the Pacific Northwest that has just been voted by Money magazine the second-best place in America to live. Cash and business should come pouring in, and the citizens will be happy. Obviously, when the votes were counted, nobody mentioned the dormant volcano next door that's about to blow its top. So much for being #1 next year. Soon the locals are fleeing for their lives, and the town's big potential investor is heading south toward San Diego. This 1997 version has Pierce Brosnan (who wishes he were back in his James Bond tux, no doubt) and Linda Hamilton (who wishes she were in Terminator 3, no doubt). That's it for Dante's star sizzle. Who cares about watching anonymous actors being parboiled while skinny-dipping or having their legs eaten away by a lake turned to sulfuric acid? Wouldn't it have been more fun to watch Drew Barrymore and Matthew Perry dive into boiling water? I'm sure disaster vets like Borgnine, George Kennedy, Linda Blair, Roddy McDowall, Stella Stevens, etc. would have been thrilled to play Dante's Peakians.  At least Twister had a flying cow, and The Poseidon Adventure had Shelley Winters.",Dante's Peak
66,acedj,Great movie,8,29 October 2019,"I am a disaster movie fan. I am pretty sure I have watched them all at least once, many of them multiple times. Sure, the science is always bad, but that does not take away from the fun of the viewing experience. I have watched this movie at least 30 times, it is that good. Will the plot blow you away? Well, no. Will the acting be Oscar worthy? Again, no. Know full well what you are signing up for when watching these movies, shut off your brain and enjoy.",Dante's Peak
67,domino1003,"Better Than ""Volcano.""",8,18 January 2004,"I like this, not because I am a fan of Pierce Brosnan (GOD HE IS SOOOOOOOO CUTE!),or Linda Hamilton, but because it IS the better of the 2 volcano movies out at the time. ******SPOILER ALERT!!!!!******The best part of the film is when Hamilton's 2 damn kids decided to drive up to their Grandmother's house (She lives up in the mountains), when the volcano erupts. Of course, Brosnan and Hamilton have to go up to rescue the kids. They encounter lava, ash and water that had turn into acid. The later becomes a problem when they have to cross a river in a metal boat. When the volcano finally goes and they are racing the cloud,it is awesome! Part of you is screaming RUN!!!!8 OUT OF 10 STARS! I deducted 2 stars, because the kids just got on my ever loving nerves!",Dante's Peak
68,joelwatchesmovies,Solid disaster-action thriller with a few minor flaws,7,25 August 2020,"Flaws include bad CGI, a generic romance, and having both a Terry and a Harry character (that one crater scene where they keep yelling at each other while a guy on the walkie-talkie is yelling at both of them is comically chaotic). It's good otherwise: the pre-explosion tension builds nicely, the disaster action afterwards is gritty and great (ashy drives, acidic boat rides, and claustrophobic underground treks all have real weighty suspense), and the practical effects hold up really well.",Dante's Peak
69,aab874,Rachel (Linda Hamilton),10,6 August 2020,"Favorite scene withRachel (Linda Hamilton) - Apologizing to a dying Ruth, and learning how Ruth really feels about her.",Dante's Peak
