,User_name,Review title,Review Rating,Review date,Review_body,Movie_name
185,extrememan_3,Dante's Peak might be worth a second look to find whats behind the scenes,6,23 October 2006,"Dante's Peak is based on the 1980 eruption of Mt St Helens, basically the same setting, people who live on the foot of a dormant volcano don't know it's dormant, don't believe scientists until it's too late. In movies, there are always heroes who alway survives conditions in the movie that will actually kill without doubt. I personally think that Dante's Peak is one of the best volcano films I've seen. Some facts sacrificed for our entertainment and action, there are some examples of where the movie changed the facts for us to enjoy like: - Glass lake couldn't have turned that acidic that quickly. (the bit where the Grandma's legs are nearly melted off) - The pyroclastic flow should have smashed the green jeep into pieces before it even got close to the underground hideout, seriously what affordable land vehicle can exceed 800kmph? - Too many people escaped the volcano's wrath while people would normally have a few minutes. - The noise of the eruption shouldn't have been heard by anyone in a 60mile radius. - The actual lava was too runny for a composite volcano of that size, the lava should have been slow and thick. - The tyres didn't melt in the extremely hot lava when it got stuck.Overall, I think that the movie itself was too concentrated on the relationship of Harry and Rachel not the actual eruption itself. I suggest a second look for people who have already watched it.",Dante's Peak
186,scrooge-15,most impressive,10,16 December 2006,"Dante's peak is MOST impressive. It is MORE realistic than ""Volcano"" I would highly recommend this movie to anyone who likes intense action all the way right to the end.I have seen it quite a number of times & I NEVER tire of it. It is SO exciting. This movie is the most impressive Volcano type I have seen. I currently have Volcano (DVD), Volcano : Fire on the Mountain (VHS) I also have Journey to the Centre of the Earth (1993)I just cannot stress enough how well ""Dante's Peak"" was made. There is not much more I can say here since 10 lines is a LOT. I ONLY wanted to say just a few words BUT the system won't let me say less than 10 lines.You guys at IMOB should remedy this so that people can say any amount of lines they want. 10 lines is WAY too much.",Dante's Peak
187,Tramajunky911,Great Movie but Almost a Remake,7,27 October 2019,"While this movie was great for some of it's character development, and special effects, the storyline itself is almost identical to the 1981 film St Helens starring Art Carney. A volcanologist goes to a sleepy town and predicts the volcano will erupt, and is shut down by his superior as being an alarmist, yet the scientist is proven correct and along the way falls in love with a local girl, and there's that one stubborn person living by the lake at the base of the mountain refuses to leave. Only difference is this movie is fiction, while St Helens is based on actual events. Don't get me wrong, I still enjoyed this movie a lot, but as far as originality, it isn't a new story.",Dante's Peak
188,kellah83,THIS MOVIE WAS HORRIBLE,1,5 November 2001,"This was one of the worst movies I have ever seen in my life.  Someone should tell Pierce Brosnan that not only is not James Bond anymore, but he wasn't even a very good James Bond in the first place.  Linda Hamilton's only other REAL credit is the Terminator, need I say more?  The Grandmother jumps into an acid lake.  WHAT KIND OF LOGIC IS THAT?  The 10-year-old kid can drive a standard, but can't figure out how to turn on the windshield wipers.  Do NOT watch this movie unless you are fully prepared to be completly turn off at the first moment.",Dante's Peak
189,nichloscharles,Nostalgic for me. Classic corny 90's Hollywood,7,28 October 2021,"I don't mind when people say this movie is terrible. I love it! Some really scary parts for kids, like the hot spring and acidic lake scenes. I love the films that were produced during my childhood, they don't make them like this anymore. Pierce Brosnan is a boss.",Dante's Peak
190,filmdjango,Wasted opportunity,3,20 January 2003,"This could so easily have been much better. It's obvious that a large fraction of the budget was spent on the effects, but realistic destruction scenes do not make a good film. Had some of that effects budget gone into storyline and screenplay, it could have worked out much better. As it is, this film could appear in the dictionary under ""formulaic"".You can't really fault the cinematography or the acting - it's just all badly let down by the script.",Dante's Peak
191,aquarius2123,"Decently Entertaining, Could be Better",6,14 February 2005,"The movie is actually fairly accurate according to my geology professor, who showed parts of it in lecture to illustrate his point. It's just such a large eruption, which really hasn't been witnessed in our lifetime so people think it's overdone. It really isn't. It gets pretty cheesy at times though, the dialogue could be better. The part of this movie that's unbelievable is how everything that could possibly go wrong does, but somehow the characters always have a way out (as usual). Driving across scorching lava without the gas tank exploding? Come on. Most people faced with this situation would have no chance in hell of surviving but this is Hollywood folks.",Dante's Peak
192,Alloftheolives,This movie changed my life B,10,27 January 2012,"That movie ""Volcano"" can suck my D, that split was whack son! DP4LYFE! Caint F's wit it. Peirce Bros is my BOI cousin! Lava, fire and ship, Split was crazy! Eh remember that first scene where that hot broad was all up in the hot Spring? She got cooked wit her BOI son. White people soup FO real! It's a good thing volcano's don't exist.Go see this.Pierce Bros done done it again. Remember that scene in contact when Jodie Foster was meditating on that Satellite dish B?",Dante's Peak
193,Alex_the_Gr8,One of the last practical effect disaster movies,10,20 June 2018,This film is favorite of mine. Simple story line with likeable characters and possibly some of the best pratical visual effects Hollywood has ever done. It was only a few years later until nearly every movie was overflowing with CGI. Compare this film to one like 2012 and you'll agree that cgi is no substitute.,Dante's Peak
194,gramccrossan,Good effects that show good volcanology,5,18 April 2013,I thought that the effects for the volcano were impressive at the time and that they were very realistic in how the volcano erupted and that scenes such as the beginning were impressive at the time.There were some parts that were silly such as when Rachael's kids Graham and Lauren driving Rachael's truck to their grandmother's house and that the romance between Harry and Rachael's romance was forced at times. I also think that Pierce Brosnan and Linda Hamilton were a bit out of place and that they didn't need to be in the movie. I also thought that the scene when Harry and Rachael's family drives a car over hardened lava which was just unrealistic as the car would have melted and kill them. If you're interested in volcanology you might like this movie.,Dante's Peak
195,elliottforbes-662-447949,"Strengths, weakness and overall review",7,18 April 2013,"I thought the movie was good in some areas. these areas were the special effects like when the volcano go's of. The movie was also very accurate in terms of the volcano's but it wasn't very accurate with realism for example when they drove through the lava near the end was very unrealistic because the lava would have been 1000+ degrees so the car would have melted and the fuel tank would have went up in flames and blew the car up. the story line it's self was good and very original and i have never seen a movie like it. The movie is very griping from the start there is action and it makes you want to keep watching.The things i didn't like about it was there wasn,t enough emotion in the movie i always felt like they were going to make it out alive. Another thing that i noticed was that at the start a pyroclstic bomb came down on Harry's girlfriend and the bomb would have drove the car straight into the ground taking harry with it.One thing i would have changed was one of the children getting killed to make it a bit more sad. so at the end about a year later they could have been putting flowers on the child's crave so it wasn't such a happy ending.I would recommend this to students aged 12~14 that is interested in Geography but overall i would say it is a good movie but not the most realistic.",Dante's Peak
196,thomasmayne99,Not Bad,5,18 April 2013,"It Was a alright movie overall.The things that i liked in Donte's Peak would have been the special affects in the movie for example how the mud-slides and lava were presented. Most of the movie would have a lot of tension when you were watching it because you didn't know when the volcano was going to go off. The C.G.I was well disguised like when the volcano went of and how the some cloud smoke would have been there. Some of the things that i thought were ""unrealistic"" would have been when the jeep went through the river because the whole of the jeep except the roof was under water so that would have flooded the engine and the engine bay so jeep would have cut out. Also the movie went to quick because one minute one thing was happening and then the next minute something else was happening. Last of all the movie could have contained more humor because the movie wasn't really that funny. To improve the movie i would have took more time to explain things more and added more humor. I would not recommend this movie to someone who liked to watch movies but i would recommend it to someone who studies or has an interest volcanoes and things to do with geography.",Dante's Peak
197,rhiannn-663-62554,Very entertaining movie:-),8,18 April 2013,"My class and I watched this last week as we are in the middle of learning about volcanoes so I thought this movie was very entertaining and helpful with teaching me and out volcanoes:-) some strengths that made the movie good were the technology and the graphics that they used good because it made them seem more realistic. I also thought the love story was good. Some weaknesses of the movie are when they are in he truck and he has to drive over the lava, it is quite unrealistic because the lave would have been 1000c so the tires wouldn't have just went on fire they would have completely melted.it also could have had a bit more humor in it as it was a bit too lovey dovey for me. I think at the end they should have ended it better by showing you the children and Harry and Rachel all going fishing like he promised them in the cave or even they could have ended it by showing you Harry and Rachel getting married which they probably will in the future. I would definitely recommend this movie to others especially anyone who is learning about volcanoes as it shows good images and describes the eruption of a volcano very well:-) Good movie to watch!x",Dante's Peak
198,sassydoo,Great movie! Could be improved.,8,18 April 2013,"I liked the movie because I enjoyed the effects and the build up to the eruption. The events leading up to the eruption were very dramatic as accidents happened that were disturbing. I also liked how there was a love story in the film to give it a twist. I didn't like the parts that involved really disturbing scenes that involved lots of blood etc. At times, I found it quite annoying how the love story interrupted some of the larger activities that were happening with the volcano and it's eruption. I was also uncomfortable during parts of the movie, this is because I felt I couldn't look at the screen due to some of the unrealistic events e.g. the boat melting and the dog making it through the eruption whilst the granny didn't. I think the movie could have been made better by making some scenes more realistic. I also think making the eruption more dramatic and not having such a happy ending would making it better. I think this because it is unrealistic for everyone except the granny to make it out alive. I recommend this film to those with a strong stomach for the special effects. Overall, I thoroughly enjoyed the film.",Dante's Peak
199,ExtremeICcream,Good Movie but unrealistic at parts,7,18 April 2013,Good Movie with good effects for the time the movie was made. As soon as the movie starts you are already watching an erupting volcano as it destroys a village. Sadly Harry's(Pierce Brosnan) girlfriend gets killed by a pyroclastic bomb as it falls through the cars roof as they were getting away.The movies itself could be more realistic as when they drove the car through lava it would have melted and blown up as it was so hot. The movie also could have contained more humour as it was serious at most parts and it contained quite a bit of gore such as harry breaking his arm. They also survived when they really shouldn't have because they would have been blown up in the car and the pyroclastic flow would have killed them as it moved way too fast for them.I would recommend it to people wanting to see volcanoes but if you don't like gore it really isn't for you also there was a bit too much love story in the movie and most of the time there wasn't much volcano scenes.,Dante's Peak
200,ltmcauley,Dante's Peak Review,6,23 April 2013,"Dante's Peak is a typical movie with both strengths, weaknesses and a good plot. This movie has strengths when coming to the volcanic effects e.g. the pyroclastic cloud and the unique eruption of the volcano. These fiery effects are realistic and believable. The plot of this film was intriguing but also had its downsides. A rewarding part of Dante's Peak was the tension that was gradually progressing throughout the movie. This was just enough to keep the viewer engaged and want to see the ending.Things that let this movie down were, when Pierce Brosnan drove over the flow of lava which just about melted his tyres, but somehow was unable to set the fuel tank on fire. Another, is when their dog made it across the lava and acidic river which easily could of killed the dog both times,these were unbelievable parts and didn't help the movie in anyway. Throughout this movie parts were skipped and there wasn't much time to familiarise yourself with the characters and their background lives.If re-making this movie I would change the story line and make it more educational and humorous. For me this movie lacked in humor and they must of found it difficult to disguise what was going to happen as you could clearly tell the volcano was going to erupt with one glance at it releasing its smoke. Dante's Peak could have been better but the effects and realistic plot is what made this movie stand out on educational purposes. For me I believe that this movie is good to show in schools as it lets you see just how villages,towns etc. react when under pressure and close to a major volcanic eruption.",Dante's Peak
201,nickbenrobbie-davis35,A review on Dant's Peak,7,21 April 2013,"I thought the movie was good in most of the the main areas. One of the areas were it was good was the plot,the plot had the right amount of of action and tension. Also the special effect were good when the pyroclastic flow wiped out the town. The CGI was used well because you would need a lot of it in a film like this. There were a few weaknesses like it was quiet unrealistic when the car drove over the lava flow, also how the dog got over the lava flow and finally their was not much humour in the film, it was all doom and gloom. What i would change in the film to make it better would be to make it more realistic also to add in some humour to keep the viewer engaged in the film also to add in a better ending with a bit more action in it.I would recommend it to people as it is a good film overall.",Dante's Peak
202,jamesmalcomson,make believe,4,18 April 2013,"Strengths: 1.I enjoyed the dog surviving numerous of times when it jumped into the jeep with only one chance it would have of surviving and also it coming out of the mine still living. 2.When Harry, Rachel the granny and the kids went to the hot spring and found the dead naked bodies, I thought this is a really good way of teaching the people watching this movie how hot the water really is. 3.I also enjoyed the scene when the granny died due to her acid burns which she got when she jumped into the river to save her grandchildren.Weaknesses: 1.The most unrealistic scene in my opinion was when a lava bomb hit Harry Dalton's a vulcanologist girlfriend on the head but didn't go straight through her and pass through the jeep floor at the start of the movie, this seem very strange that the lava bomb sat in her body. 2.That Harry Dalton ""vulcanologist"" could tell how long ago did Danté's Peak volcano explode by examining a rock on the mountain. 3.When the boat on the river as they where traveling downstream was melting due to the acid in the water, why is because acid does not dissolve metal that quickly that is scientifically proved. Opportunities: 1.This movie had also a romantic genre in it involving Harry Dalton ""vulcanologist"" with Rachel Wando ""Town Mayor"" that didn't lead to anywhere Harry only said at the end of the movie that Rachel, the children Lauren and Graham and himself would do and do things when the volcano settled down but the movie didn't show it. 2.When the experienced team that Harry worked for looked up at the volcano it somehow seemed much far away than when Rachel looked up at it from Harry's jeep window when it had exploded. 3.It was kind of obvious that the volcano was going to explode with all the tension before it explode but sill Paul the experienced teams boss still denied when Harry pleaded with him to put the town on alert, he wouldn't because he did not believe Harry that the volcano was going to explode. Threats: 1.If I was the director of this film i would make the ash cloud more realistic because it looked very similar to to another movie's black smoke effects. 2.Danté's Peak is boring for most of the film, is because it's poorly written and simply because I knew the kind of build-up because i've experienced it countless times before. There's not much to get excited about when you can figure out what's coming next without particularly engaging your brain. 3.I would most certainly change where they where in the mine because the mine collapsed, but did not kill Harry while he sat there in one position for at least two days said one of his workmates",Dante's Peak
203,hollymal11,My Dantes Peak review for DHS,8,18 April 2013,The strengths of the movie: The tension and Thrill in the plot was good. Had a lot of Cliffhangers. Good cast and some good acting. Educational to viewers who are learning about Volcanic Activity and Volcanos in general. Some of the effects in the movie are great for the time.The weaknesses of the movie: To many characters to remember and not many have really much of a background story or really mentioned through out the movie. Only when they are seen on the screen. They also didn't explain fully the effects of volcanic eruptions. They just expected you to know everything. Also depending on the budget and the time the movie was made the CGI effects could have been better. Some parts of the movie were a bit rushed and skipped.Bloopers and My opinion: It could have less characters . To many to remember for my liking. Be more educational instead of a love story.. Be more correct and realistic eg. The car tyres would have just melted by the heat of lava before even going on it.To others: I would recommend it but not for educational purposes but the thrill of the plot and the volcano. This was Holly reviewing Dantes Peak. Bye.,Dante's Peak
204,matthew-mcdade22,"Impressive, but unrealistic.",7,23 April 2013,"My friends had reviewed most of the movie up until he part i saw at the end. The last few scenes were very tense when the characters were trapped in the underground caverns and this made them really come together. The computer generated imaging was very impressive when th great Pierce Brosnan's elbow broke when he was nearly crushed by falling boulders. I found hat the special effects for the volcano were brilliant with the destructive with the destructive ash cloud and pyroclastic bombs hurtling down to earth. I found that the pickup truck driving over a 1000 degree lava flow with just the tyres bursting was kind of unrealistic, he whole car would have melted! When the dog had to make a jump to the car from the nearby rock it was sitting there like it was fine but the heat rising from the lava flow would have made it lose its hair and burn it, I found this unrealistic. I would recommend ti film to other year 10 pupils studying volcanology. I rate it 7",Dante's Peak
205,entrixclan,Nothing special...,7,22 April 2013,"The movie was a good movie, there was not much to it though. the story did focus a lot on the love of the two main characters and it should of been more focused on the volcanic activity and not interrupted the movie with an absurd love story during a volcanic eruption!!! to me it seams highly illogical. If you were consider viewing this particular film i would rent it and not buy it. The story of the film is based around a vulcanologist who goes to a small town and tests a volcano for activity and there appears there is activity and it could end up in a volcanic explosion... i will say no more as it is a massive spoiler if i do tell you anymore.this film was quite enjoyable and i would recommend it to a geology student and i would also say that it had good special effects in it for its time.7/10 volcanoes :)",Dante's Peak
206,amygray424,A Review of Dante's Peak.,7,22 April 2013,It was a very good movie. It was of use to me because I was learning about Plate Tectonics and Volcanology. The plot was good because of the tension and build up. I liked the special effects and how it was done. I liked the happy ending. I thought that it was a bit unrealistic because of when the car was driving over the lava the wheels would have burned and some of the car too. It was horrible when two people were found dead in the Hot Springs and when the Granny's legs were all blood from the acid in the lake. I would have liked to see if Harry done things with Rachael and the kids Lauren and Graham. However the movie didn't show anything after everything was OK. There was a little to much love story between Harry and Rachael. I would recommend this to other Year 10 students or people learning about Volcanoes as it is a useful movie to watch.,Dante's Peak
207,clingan1,Dante's Peak and my opinion of the film,8,22 April 2013,"I liked Dante's Peak because it was in good detail and it showed me how they measure and record the activity happening in the Volcano. I am also a year 10 student and it has helped me understand clearly how you know if a volcano is going to erupt and what makes it erupt and the damage it causes. It was good and exciting when Pierce Brosnan took risks to get out of town alive. Although I think there were some unrealistic scenes like driving over the lava,when they were in the boat in the acidic lake and it started to melt away, I think it melted to quickly and the pyroclastic bomb at the start which hit the car I thought would have done more damaged .They could have made the movie better by adding some more drama with the volcano at the start of the film. This film should be watched by others as I recommend it.",Dante's Peak
208,callum896,A very enjoyable movie!,7,23 April 2013,"I really enjoyed watching this movie, my class and I watched it last week in school as we were studying volcanoes. The movie had good special effects that looked realistic, and the volcano and ash cloud looked very good. It started off in the midst of an eruption of a volcano so it was tense and had you hooked from the start. I enjoyed the love story between the two main characters Harry(Pierce Brosnan) and Rachel(Linda Hamilton). I thought that it added a bit of life to it so it wasn't all a disaster movie. There were some moments that I found unrealistic such as the scene where the family are in the car during the eruption and they have to cross the lava flow, the temperature would have been at least 1000 degrees or possible more, the extreme heat would have done more than melt the tires, it would have lit the car on fire, and blown the fuel tank causing the car to explode! Also how did the dog survive through the eruption? It managed to find the family and was found perched on a rock surrounded by the lava flow. Being that close to it would have done damage to the dog and it being unharmed was slightly unrealistic. There was some sad moments in the film such as when the Grandma(Ruth) sacrificed herself to save the family. I thought it had a happy ending as well with Harry and Rachel becoming a couple and taking the kids to Florida to go fishing. I would definitely recommend this movie to people, it was also helpful if you are studying volcanoes. Overall a very enjoyable movie!!! :)",Dante's Peak
