,User_name,Review title,Review Rating,Review date,Review_body,Movie_name
113,Die Hard-3,Not great,6,17 October 1998,"This film was OK, but not as good as 'Volcano'.  The special effects are good, but it seems that the lava did very little.  I think that lava should be a major part of any film about volcanoes (like 'Volcano', when lava is pretty much all there is. At least Dante's Peak has a variety, I guess.) The lava was largely overshadowed by acidic rivers, earthquakes, floods, and so on.  I think that the beginning section could have been much better and that Pierce Brosnan and Linda Hamilton are wasted in this film.  I had high expectations but I was a bit disappointed.",Dante's Peak
114,rorymacveigh-66661,Not as bad as all that!,7,30 March 2015,"For some odd reason we really got stuck with natural disaster movies in the late 90's didn't we? And while this film was released in 1997, at pretty much the exact same time Volcano was getting booted out as well. Out of the two though, this is by far the better movie, largely because it's a much more believable situation with believable characters and scenarios (for the most part, but I'll get to the jarring one's later).So what's the cabbage? Harry Dolton is a Volcanologist working for the US Geological Survey, and is sent to the small town of Dante's Peak in the Cascade Mountains after reports of strange anomalies regarding its local namesake mountain. Upon arrival, he meets with the town's Mayor and moonlighting coffee shop owner Rachel Wando. Although Harry is convinced that the dormant volcano is starting to reawaken, no one else believes him, and he has to try and convince the town and his superiors at the USGS that this mountain is big, bad and ready to blow!Now, the bad parts? This film really is too predictable for words. You know the mountain is going to blow at some point, and you know that the peaceful little town they try to show off as being all beautiful and lovely in the beginning is going to be wiped out. You know Pierce Brosnan is right and everyone else is wrong.Also there are a few very silly scenes that will make you scratch your head in confusion. Firstly, why did the three choose to drive their boat right across the middle of the acid lake rather than sticking to the shore? Why didn't Dreyfus get out of his car on the bridge rather than attempting the impossible? And, most obviously, you can't drive a pickup truck across molten lava and expect to come out okay! Nor can a pickup truck outrun a Pyroclastic Cloud travelling at 200mph! As someone who graduated in Geography, I may have a bit of an advantage, but I'm sure anyone will know that these things really don't happen! Also as a Geography student I was quick to point out the numerous flaws in the geographical accuracy of this eruption, but I won't bore you to death with that!As well as that, there's a few scenes which are simply played for action's sake. One example being in the wood cabin and the Lava bursts through the wall at our heroes. You can't seriously tell me that they didn't notice the fact that things were getting a little hot in there, especially since 1,000 degree lava is literally on the other side of a thin log wall!But there are many good points to this film as well. The story, although predictable, is still quite gripping. The buildup to the volcanic eruption is played quite well and suspenseful, even though you find the other characters stupid for not taking Harry up on his advice even though every single bit of evidence points to him being right!The CGI is also very impressive in places, though perhaps a little choppy in others. The practical effects are good though, especially with the destruction of the town and buildings crumbling. The acting is fairly robust, although many characters have confusing motivations and you wonder why they're thinking what they're thinking, none of the performances are awful per say.Overall, the film is quite gripping though predictable, and even a touch suspenseful in the first half, but doesn't really go down hill in the second half, so much as becomes the standard action movie of running away from the horrible danger with a crescendo of CGI and explosions to top it all off. Not the greatest film ever made and does indeed have many silly moments that do take you out of it somewhat, but it's fairly solid. For a rainy Saturday afternoon movie you can turn your brain off to, this is definitely a contender.",Dante's Peak
115,tonytangney,Twister but with volcanoes instead of tornadoes,6,29 May 2021,Standard natural disaster movie but enjoyable. The CGI looks a little dated now but not terrible by any means. Some of it is very good. The lava and car scene was a bit ridiculous but otherwise it was fairly believable. Family friendly fare.,Dante's Peak
116,adshiel,Loved it in 97...Loved it in 2019,8,16 May 2019,"I think in between those years i have watched it numerous times.CGI has got better but to the point where it seems a little unreal, this doesn't.Daft plot points (we still get plenty of them) but generally a really watchable disaster movie.",Dante's Peak
117,kitfox30,As Action movies go.,9,29 November 2020,I saw this in theatres and enjoyed it so much I talked about it for awhile and got several people to go see it. Now it's on TV often and can watch it over and over and never get tired of it. Today was an afternoon movie day and I suggested this to our rec staff as it was on TV and spent the day upstairs watching it. Still totally love this movie.,Dante's Peak
118,baseballfanjm,Good Entertainment,7,26 October 2001,"Dante's Peak isn't great, but it's still worth your time. The acting is decent, the special effects pretty good, and the plot nothing new. However, all in all it is very entertaining and enjoyable. 7/10",Dante's Peak
119,jamesjchapman-37903,You had to see this on the Big Screen....,9,14 July 2021,"All these years later, I still find Dante's Peak an edge of your seat ride; even on the small screen. But I remember quite vividly watching this on opening day in the cinema and loving every minute of it.Yes, critics will pan the Hollywood theatrics for being over-the-top and or unrealistic. But this movie is all about building volcanic intensity and making you feel like you're trapped in the town with those now desperate to escape. And for that alone I'd nearly rate it a 10 out of 10.There are some very real and tangible elements to what is happening with the volcano. Don't forget you only have less than 2 hours to establish credible characters, a believable plot in a realistic enough town to make this volcano flick unfold at the right time - and pace. Not an easy feat in itself. This movie ticks the boxes.Brosnan and Hamilton carry the movie really well with their key character performances, given that we'd like to see them get the opportunity to indulge some romance. But the big bag bast**d in the background is set to explode and ruin everyone's day - and make ours at the cinema!I love the way this film tickled your nerves in the cinema. There are lots of anxious moments. There are some really REALLY brilliant special effects; remember is was released all the way back in 1997. But all the time you can imagine how terrifying it would be to experience being caught in an event like this. And THAT is precisely what Dante's Peak succeeds at because you feel like you're there, living that moment. That's what good movie-making is about.It's a film about survival that keeps building as our escapees go from one traumatic challenge to the next. But after you watch the movie, you'd definitely think twice about living too close to a volcano - dormant or not. And if you read a little bit about volcanoes, you'll appreciate some of the details in the film just that bit more, too.",Dante's Peak
120,votesmall,James Bond from GoldenEye and Sarah Connor from Terminator team up and to stop a gigantic volcano,7,10 February 2012,"Okay,tell me, that just by reading that brief summary, that you INSTANTLY want to see that movie. I know I did. It all started when I saw The Poseidon Adventure. Then I saw the Towering Inferno. On that disc was a copy of Volcano. I watched it and thought it was fantastic. Tommy Lee Jones was cool and the special effects were pretty great. So, I bought this used for half off and it completely blew (ha ha ha) Volcano out of the water. Here's why. First off, Dante's Peak skillfully builds up tension and interest by slowly introducing the characters. Dante's Peak has been criticized for being too ""slow"", although there is a volcanic eruption in the first scene.Basically, there's this geologist (Pierce Brosnan) who travels to fictional Dante's Peak, Washington to oversee the local ""dormant"" volcano. The mayor (Linda Hamilton) is happy since the town has recently been named one of the most desirable places to live in America. This hot spring is turned into acid because of the volano (No joke, that's possible) and the geologist saves the mayor's kid. The mayor is grateful, and the geologist slowly bonds with the family. However, when the geolosist realizes that the mountain is giving off sulfur dioxide and that it is a ticking bomb, ready to explode. The geologist and the mayor both order an evacuation, but not everyone's exactly too eager to leave, as there is no proof that the volano is ready to blow. But it does, and it creates lahars (mudslides), tephra (airborne rocks the size of semi trucks), pyroclastic flows (gigantic clouds of heavy, superheated, pressurized gases), and ash (little shards of glass). Can they escape Dante's Peak, before the volcano buries them all? Okay, there are a few pros about this film. One, the special effects are awesome. There isn't too much lava, so it looks completely realistic, the tephra looks like it is coming at me, and the pyroclastic flows actually look like they are leaping off the screen. The acting is superb, not over-done, not under-done. Pierce Brosnan gets the perfect amount of root, sympathy, and depth. Hamilton gets the same. The problem is the kids. They are so whiny, stupid, and idiotic that they make me laugh. But other than that, the acting is superb. The plot is something we've all seen before, the ""unexpected"" romance, but this film, unlike Twister or Speed, actually makes it work. They actually build up to it, they seem perfect together, and they are pretty realistic characters.Okay, sure it may not be everyone's cup of tea, but I loved it.Worth a watch.",Dante's Peak
121,GeorgeC,Pointless action flick,5,10 January 1999,"Pierce Brosnan leads an otherwise unremarkable cast in a volcano thriller that never really grabbed me.  Linda Hamilton proves her limited acting range, and although there are some breathtaking special effects, they never integrate into the plot effectively.  A predictable script, except for an uncharacteristically realistic twist, followed by an even more uncharacteristically fantastic last scene, never moves away from its linear path into anything approaching interesting.",Dante's Peak
122,Thulemanden,Nightmare is in your living room,1,8 May 2000,Loodicris collection of movie clichés with a special effects department gone berserk in what is today routine ingredients.The movie is a strange hybrid - something between a naive Lassie movie and a science fiction alien invader movie from the 50's with few opportunities for the characters to make an impression and use their talent for character building.Whatever urged Bosnan and Hamilton to waste their talent on this is beyond comprehension.I still don't know what the staff wanted to tell us with this epic.The moviegoer's nightmare during this trial surely surpasses by far that of the unlucky citizens of Dantes' Peak.I give it minus 1 out of 5.,Dante's Peak
123,jpave2000,Yes!,6,28 March 2018,"This is essentially the same plot as Jaws, but with a volcano standing in for the shark. Stupid town officials don't listen to the warnings of a scientist and boy will they regret it!",Dante's Peak
124,Chronus,Dante´s vision of calamity falling upon us should resemble this...,7,20 December 1999,"There´s an analogy, told by Brosnan´s character, that defines this great movie. If you drop a frog in scalding water, he´ll try to jump, to get away from it. But when you boil the water, slowly, with the frog already in it, the frog will dye, and that´s how the story, this story, goes.  Wonderful movie. Fine suspense, good plot (although not astonishingly original), good and well developed characters, good acting and believable special effects. And a fine soundtrack.  Pierce Brosnan is the man of the moment, no doubt about it. He is, by far, one of the best irish actors to appear on celluloid...and no one has yet seen his true potential. And this man knows his choices - he has the eye for detecting good scripts and good movies - from The Lawnmower Man, to Thomas Crown Affair.  Dante´s Peak is a movie about family. It portrays a small town where almost everybody would like to live in - cozy, small, nice, friendly. The delivering of a prize to the mayor of this town is a proof of that.  But before settling the viewer´s attention on Dante´s Peak, the director tells us what happenned to Brosnan's companion when a volcano somewhere in Colombia (?!) erupted. This introduces to the real undertone of the movie - it´s a tragic story, deep down.  Brosnan´s character (a vulcanologist - no kin to mr. Spock, he points out) warns the inhabitants of this town that something may be brewing beneath the earth. As usual, people do not believe him, as happens with every man or woman who tries to reveal new things or break news. This sets the tone for the rest of the movie...until, at last, something tragic happens.   The director showed a firm hand while shooting this story. It´s clear that he showed us and told us things exactly the way he wanted them to be showed or told. Ok, there is no surprise (at least not a big surprise) in the outcome of the story but there´s no need  for it. The sheer intensity of the events, the realism - all this is enough to grip the viewer from beginning to end. The menace to everyday normal life is tremendous, andfamilies must act accordingly or perish. The town perishes, some lives are lost - all due to lack of care and planning. So Dante´s Peak becomes, like Deep Impact, a warning. Pierce Brosnan is great, Linda Hamilton is good enough, and the kids, the grandmother and the colleagues of Brosnan´s character are excellent.
  The science behind the movie´s plot is accurate enough ""a la Hollywood"", naturally.  When I saw this movie, I felt I was in front of a fine work. Money spent on this movie is well spent, as it teaches us many lessons - besides being a pure piece of entertainment.  I recommend it, I loved it. I wish there more movies like this one and Deep Impact -  very well crafted catastrophe movies, not to everyone´s liking, but good examples of how sucessfull a story like this can be when is well told.",Dante's Peak
125,lllama,"Better than ""Volcano""",7,1 August 2000,"Though ""Dante's Peak"" had its share of faults, we (husband and wife) found it enjoyable, particularly the special effects and the small-town character. Having slugged our way through ""Volcano,"" we were not thrilled to be sucked into another volcano movie, but we decided to give it an optimistic try. Without Tommy Lee Jones, ""Volcano"" would have been completely intolerable. We felt sorry for Jones for having been roped into such a stupid movie. What made ""Dante's Peak"" more engrossing for us was the ""it could happen here"" feeling and the fairly smooth flow of plotline.  ""Volcano"" made us angry because the characters' behaviors seemed beyond stupid, in light of the circumstances.  It was as if someone asked them ""what's the worst, stupidest thing you could possibly do in this situation,"" and then told them to do it.  ""Volcano"" seemed so deliberately contrived, and it went on and on forever with contrivance after contrivance.  On the other hand, ""Dante's Peak"" moved along in a fairly logical order, allowing for some realistic human errors, such as the grandmother refusing to move, the children attempting to rescue her, and the boss who didn't want to unnecessarily upset the town.  Granted, if the acid in a lake can eat through a metal boat, it's gonna make quick work of a grandmother--so the grandmother/boat scene was foolish.  Also, a small truck cannot drive across molten lava and it is unlikely that a pickup can navigate a river.  If the director wanted us to believe in the truck's water ability, we should have been given a better reason for its having been equipped for water travel.  However, I don't know how he could have worked the ""driving over lava"" scene to make it more credible.  Perhaps a jump over a lava-filled crevasse or something.In spite of these flaws, the special effects were still convincing enough to keep us engaged.  The only time we began to get fidgety was during the tunnel scene in which Brosnan, attempting to make it to the truck, kept being pelted by falling rocks.  Either the rocks should have fallen at a somewhat constant pace or they should have fallen quickly once or twice. Unfortunately, the rockfalls kept recurring after every few steps taken by Brosnan, and every few moments after he entered the truck.  This repetition got lame awfully quick. Also, as the truck roof was caving in, it's elasticity cheapened the effect.  It was easy to picture a special effects employee leaning on the rubber roof over Brosnan's head.In spite of those things, we felt that the film portrayed a more realistic idea of what would occur if a dormant volcano near a small town became active.  With a few exceptions, the special effects were extremely well-done.  The acting was convincing, as well.  Linda Hamilton's coffee shop mayor reminded me of one of our local state representatives, who runs a small, popular nearby restaurant and nightclub.  Hamilton's character was friendly, helpful, and very likeable, much like our local rep, who's cheery smile and good work keep us voting for her.  Brosnan didn't appear to overexert himself, but he comfortably portrayed his usual charming, intellectual character.  The kids did a great job, and the volcanology crew was convincing.Because I usually find disaster movies somewhat trite, I didn't go out of my way to see this one, but now that I've watched it, I consider it one of the better ones.",Dante's Peak
126,kyle_is_awesome,Great action-thriller Movie,8,21 August 2003,BOOOOOOOOOOM! Explosions. Chaos. Blood. Good Movie.,Dante's Peak
127,jmjcunningham,Best volcano movie,9,23 August 2020,Probably the best volcano movie I have watched with a good storyline and great list of actors,Dante's Peak
128,Rhino-1,There's more to Brosnan than Bond,9,29 October 2002,"The plot is fairly a straightforward adaptation of Ibsen's fine play Enemy Of The People, which sees one man trying to persuade the rest of his townsfolk that a disaster is pending. Jaws is a pretty good example of how one man is forced to put his principles on hold before something eventually proves him right; with Dante's Peak, it's Geologist Pierce Brosnan predicting the eruption of a long-dormant volcanoNow Brosnan, while unlikely to ever play Othello or King Lear, is a fine actor in my opinion. He does exactly what it says on the tin, and here he plays the ""man against the world"" very well. He's supported very nicely by Linda ""Terminator"" Hamilton and some pretty impressive child actors, but none of them can hold a candle to the special effects. I'm a sucker for authentic or well designed effects, and the earthquake and eruption scenes here are the best I've ever seen. It doesn't matter that the story is a pretty lame attempt to do for volcanoes what Twister did for tornados; the brooding shots of the mountain that cut into most of the scenes are enough to keep you trying to guess not if, but *when* the whole damn thing is going to explodeThere's a very surreal scene where Pierce and fellow escapees are caught in a powerless boat on a lake that has been made toxic by lava flow; singing Row Row Your Boat while floating on an acidic deathbed - a nicely observed momentWith a neat score by John Frizzel and solid direction by Roger ""Cocktail"" and ""Species"" Donaldson, you could do a hell of a lot worse than spend a couple of hours with Dante's Peak",Dante's Peak
129,jessemangiardi,A geologist fights the public and the forces of nature.,5,20 February 2021,"Acting wasn't great, and the writing was very cheesy / cliché. Plot progresses very slowly until halfway through, and then the second half is constant suspense. Graphics were decent for the most part and there were only a couple times a scene seemed unrealistic or inaccurate. Good suspense, but I didn't care much about the characters. Random kiss at the end - why? One critic said the movie ""works when it's on fire"" but lamented everything else; that seems accurate to me.",Dante's Peak
130,horseygurlz,Truly Awful - but sort of entertaining,4,25 June 2011,"Now this is a truly awful film. The plot is bad, the characters are worse, and not even a cast off fairly well-known actors can save this film.I actually cannot believe that some people review this better than Volcano. At least Volcano is entertaining, has good characters and a decent plot, and doesn't get on your nerves. This film does. I'm not even going to go into how unrealistic it is - most disaster films are and that's okay, but this one is so much less realistic than any other disaster film I've watched that you can't avoid noticing it - if I started talking about that this film would get a rating zero. As it is, I'm going to give it a four - only because it's so stupidly awful that you keep watching it so that you have a film to moan about afterwards, and a film that you can compare to any other film and say ""compared to this, that movie was brilliant!""",Dante's Peak
131,danjross29,This movie does NOT deserve a medium rating it deserves 100,10,18 February 2015,This should deserve a 100 For critics seriously why do some critics hate this movie?? OK sure it's got SOME silly moments but this movie is just great!! The movie has great intense parts and the pyroclastic cloud AWESOME CGI!! Also luckily roughy survived cause I thought he burned to death(and I would be angry if he died). Pierce Brosnan as Harry Dalton was a good choice. The kids were great And the bit with the dead charred squirrels and the acid fish in the boat part EWW!! I felt like vomiting after those bits. And also the kids weren't tools for Pierce Brosnan and Lynda Hamilton to save. The acting was surprisingly incredible and the cgi was used correctly and the sets were good and the pyroclastic cloud is unforgettable when you've seen this movie and the mine sequences were probably painful for Harry cause he got smashed by rocks and smashed by the trucks parts and so what do I think of this film?? Definitely A 100000000000000 :),Dante's Peak
132,einezcrespo,Better then that other Volcano flick.,7,29 January 2006,"Living in a geologically active area it's easy to see why Hollywood decided to make disaster flicks. Instead of earthquakes we get volcanoes. If any volcanologist would watch both Dante's Peak and Volcano starring Tommy Lee Jones, they would preferred the former than the latter. I also liked the fact that they did bother to explain a little bit about the science of volcanology in a manner that could be simple. I also approve of the location since the Cascade region does have a fair share of volcanoes. Pierce Brosnan is credible as Harry Dalton and Linda Hamilton is attractive as mayor Rachel Dando are ably supported by a good cast especially Charles Hallahan as Harry's boss Dr. Paul Dreyfuss and Elizabeth Hoffman as Ruth. The chaos during the eruption scenes was maybe a little too far fetched but that's Hollywood for you. Oh and yes it is possible to outrun a pyroclastic cloud though it depends on the distance and vicinity. It happened to a group of reporters during the Mt Pinatubo eruption it can happen in Dante's Peak.",Dante's Peak
133,Sean Kerr,Tense Stuff!,8,5 March 1999,"This type of flick always gets varied reviews.  Personally, I can't quite follow why so many people slated it with so much venom.  In my opinion, Dante's Peak scores for effects, has excellent sound and builds up an intimacy with the main characters, unlike many other disasters movies.  Some of the scenes are just TENSE!  I would give this 8 out of 10.  Not a masterpiece but I'd certainly watch it again.",Dante's Peak
134,emmytaylorbrown,What science is this?,4,30 December 2020,"It was good enough until the special effects were needed... and then it stopped feeling real and I stopped caring. If you also paid attention to the volcano exhibit on your school field trip to the natural history museum, then you might want to give it a miss.",Dante's Peak
