,User_name,Review title,Review Rating,Review date,Review_body,Movie_name
209,pappujasani,Excellent Comedy,9,5 July 2013,"Two old men, working as sales reps, find out that the company that they are working for has closed and are out of a job. Determined not to be a part of not to become obsolete and a figure in the unemployed figure, one of them finds a job with a multinational IT company and also manages to persuade his sales partner to join him along with some college students.Starring Vince Vaughan, Owen Wilson, Rose Byrne, Aasif Mandvi, Dylan O'Brien, Tiya Sircar, Tobit Raphael, Max Minghella and Josh Brener. The movie is Directed by Shaun Levy and is written by Vince Vaughan and Jarred Stern.Once again, Vince Vaughan and Owen Wilson, whose love interest in this movie is Rose Byrne a top executive, are at their best – providing some excellent comedy and are nicely supported by the other cast – Dylan O' Brien, Tiya Sircar and the others. There are some scenes that need to be watched out for as they are quite hilarious and may even remind the viewers of a certain ""Mr Bean"" and one in particular scene is that of being in a certain strip club. It also, does have its seriousness under all the comedy, of one is to see it from another point of view as the movie does, somewhat, portray, what it is like working fir such a well known, multinational IT company. But more than that, its the comedy that makes it worth to watch this movie.Those hoping to have good laughs, through and through, however, may be a bit disappointed – that is if they compare this to the other movies that starred Vince Vaughan and Owen Wilson as they may find that some jokes and dialogues aren't upto it. But overall, it is a complete entertainment from the beginning till the end and is definitely worth watching – in particular if you like watching comedy and Vince Vaughan and Owen Wilson.",The Internship
210,wisegreenlocket,Cheesy Comedy Gold,8,29 July 2013,"I don't understand the lack of love for this movie. Yes it is extremely clichéd in what happens and it follows the guidelines of every over 'cheesy comedy'. Winning the competition and getting the girl is entirely expected from when those elements enter.But it still was extremely funny. I watched it with low expectations, due to seeing previous reviews, but was happily surprised at how much I and everyone in the cinema laughed whole-heartedly; there are even moments that require more than clipped laughs. My only criticism is I would not want to watch again - would wait a while until forgot most of the events - as the humour loses its touch when used more than once. Also i fear the ending tried too hard to fit to ending on a high note, especially by 'pairing' of too many couples, some of which i felt had displayed no chemistry whatsoever beforehand.",The Internship
211,ashman-8,An egregiously bad movie,3,5 October 2013,"As a computer science student, I went to see The Internship excited to watch a movie about an internship at Google. And it's a comedy too, I thought. Great!Well, once the movie truly begins (after rushing through introductions for a few characters that are discarded for the rest of the movie), we are met with the Googleplex, Google's office. Google's driver-less car along with the Space Ship One at the entrance makes the movie look more like an ad for Google (the rest of the movie makes you feel that this is not necessarily a bad thing).But, filled with poor writing it quickly degrades in quality with some very poor characters taking up most of the screen-time. The characters are so gimmicky and caricatured that the movie loses any sense of realism it held. While Vince Vaughn and Owen Wilson try hard, there really is not much in the way of funny dialogue or a plot for them to work with. None of the characters have any depth, and the script is pretty shoddy. I would give this a miss.",The Internship
212,wingstephanie,"wedding Crashers, meets Google infomercial, disappoint waste of time",2,2 November 2013,"I have never written a review before, but I was so disappointed by the script, the plot and the performance of Vince and Owen, I had to contribute my two cents worth. Simply stated, because I don't need to say much after having read the others they truly sum up the issues I had with this movie as well, is that it was a waste, not even worth renting on video. Vaughn's character rambled on, and on, in the way he did in ""wedding crashers"", trying to bamboozle with his bullshit. At times i wanted to literally punch vaughn in the face for his annoying ramblings, which I found to be totally unrealistic in this plot, in a company such as google. But... what do i know... to each his own.",The Internship
213,michael-j-ashton,Funny Humanity vs. Technology Comedy,8,10 November 2013,"I enjoyed this film, rated it 8 of 10, and I'll probably buy it when it comes out on DVD so that I can watch it again. As a thirty-something aged viewer I could relate to the comedy that consistently poked fun at the twenty-something mindset. I liked the underlying conflict of humanity vs. technology, and the subplot of this conflict's implications on modern culture was used as a vehicle for establishing a connection to the audience and creating some amusing situations. Vince Vaughn and Owen Wilson were both funny and likable in this film and they left you with a warm and hopeful feeling at the conclusion. I feel that this is an amusing and encouraging 'art imitating life' film that is best appreciated if you can understand the film's many 1980's references.",The Internship
214,starrj93,Predictable cookie cutter comedy movie,4,19 December 2013,"Watched this movie On-Demand at home with my parents... needless to say we didn't even finish it. The storyline was quite predictable, a little unrealistic and lacked good punchlines. Owen Wilson and Vince Vaughn are great actors but this wasn't their best work. I felt like the likelihood of grown men receiving an internship with a bunch of college aged students at Google was a bit far-fetched. I understand that it's Hollywood and anything can happen in movies but personally, I thought that was a bit out there, even for a high budget Hollywood film. The freshman actors seemed like they did pretty well but again lacked in comedy. Overall, it was decent if you wanted to watch something but if you're looking for a good comedy, this is not it.",The Internship
215,imdb-15118,Google Infomercial.....I would rather watch Vince Offer slap chop....,1,22 October 2013,"These guys just keep doing the same characters while changing the backdrops.This one was terrible....Clichés throughout the whole thing.I wonder how much Google paid for this Infomercial.....it appears to have been a loss and rightly so.Getting so tired of hearing Vince Vaughn babble on like he does in all these movies.Wedding Crashers, funny. This one awful.Pass on it.One guy said he would have gone jogging instead of finishing the movie, but he was on a plane! Maybe that is the way they are going to get people to watch this, show it on planes....captive audiences!",The Internship
216,mr-sobot,For a first time i was able to sit through whole movie!!!,9,8 October 2013,"I think this is amazing movie to be honest. And i don't get why its rated so low. For a first time i was able to sit through whole movie without looking at my phone or looking around or try to find other things to think or do while i watching movie. I had few really good laughs while watching this. Maybe i wasn't laughing all time but it was just the right amount for this kind of comedy. And its true it has classical plot with some complication near end and then every one lives happily ever after but i have a feeling that its done in a bit different way so that complication its not boring. At first your going to go like ""really this again"" but you will see after few minutes that its not like that it has some humor in it. But at the end you will say that it was really good movie and you will like it i can promise you that.",The Internship
217,iapetus33,We're all glad this creep fest lost money.,1,5 October 2013,"This movie is worse than awful. Not only is it boring, it's also unwatchable. Wilson creeps you out the entire time; his character is more like a yawn than a human. His partner, whats his face, is also a bore. Do these guys have a range beyond this, their typical movie persona? Everything in this movie is predictable. The troubles and successes, the bad guys, the good guys... The only thing I didn't expect is how much the main characters in the film would creep me out, the ones on Wilson's and what's his face's team, the actors themselves actually made me feel uncomfortable. Quite unnatural performances from weirdos that never be cast in anything. Ever. Ferrel also fails miserably in this. You can actually tell he doesn't give a crap. All in all I stopped using Google. Thanks for the 2 hour long commercial, D bags. It's clear that the scenes with all the titties were added late in production... ""Hey guys, this movies blows... we better add a lot of tits."" I'm all for mammary glands but those scenes seem SO out of place. I strongly suggest avoiding this excrement. This movie should not be paid for... for any reason.",The Internship
218,justin-smilie,Open Minded Movie Reviews - The Internship,6,9 June 2013,"What do you get when you mix old school comedians with new school technology? You get ""The Internship"" starring Vince Vaughn as Billy McMahon and Owen Wilson as Nick Campbell.No plot summary is truly necessary for this movie. It is as advertised. ""The Internship"" follows two old school salesmen, Billy McMahon (Vaughn) and Nick Campbell (Wilson) as they go from selling high-end watches in bulk to retail stores, to trying to fit in among twenty-something interns at Google headquarters. As per usual with underdog comedies, the two are grouped with interns whom are considered to be the misfits of the crop, and then do their best using their salesmen skills to bring to group to cohesiveness. Along the way, Nick becomes attracted to an executive already with Google, and Billy has to learn to cope with his inability to learn new age technology.This is a funny movie, not unlike ""Wedding Crashers,"" except that in ""The Internship"" the plot certainly has room for improvement. One thing is clear however. Whether it takes a movie like ""The Internship"" or one like ""Anchorman"" (a bit more crude), Vaughn and Wilson are still able to brings laughs on to the big screen, no matter how cheap they might be. C+",The Internship
219,khans-shabbir041,This one is definitely going up on my Blog!,7,2 November 2013,"Comedy? Yes, but to a limit. But I will say that it actually is a really good movie for those people who do not have an idea of the future. Lost people. Those who think that they fail at every task! I am an 18 year old girl, and I shouldn't be confused about my future at this moment because I have my whole life ahead, but this movie has actually motivated me, that if I take up a task, even though its an internship anywhere and not only on Google, anything could happen! No idea where this can lead to, a team manager? A motivational speaker? Adviser? You have no idea. For this motivation and team spirit TWO BIG THUMBS UP!",The Internship
220,Sachaa_Thornton,This is NOT the Wedding Crashers!!!,8,29 January 2014,"I loved this movie. Totally! I kept putting off watching it after reading the reviews here, but then I saw that Dylan O'Brien is in it and decided to give it a try. It's sad that most people haven't appreciated this movie for what it is. They instead keep trying to compare it with what it's not. Just because it has Owen Wilson and Vince Vaughn it does not mean that this movie is gonna be like the Wedding Crashers. In my opinion The Internship is a way different and a way better movie than the Wedding Crashers. This is a feel good movie with humor, which has a message. It is for the teenagers who have no idea what to do with their lives, it's for the people in their twenties who are are wondering if they are in the right path, it's for the people in their thirties and forties who feel like the world is evolving and their lives to getting out of their hands. It is basically a movie for everyone who wants to feel good and light, not just laugh at mindless jokes. Okay, I might have made it sound like a serious film. It's not. It's one of those movies that will make you laugh and lift you up, when you're feeling down. One of my favorites, for sure!",The Internship
221,zerkoto,Very nice and funny movie,9,30 June 2013,"I really enjoyed watching it. It's a very nice comedy with two of my favorite actors :D. i also loved the many link-ups with other movies, books, etc (especially at the end with game of thrones :D). Excellent story, background and characters. The whole action and the movie as a whole was simply awesome with very nice details. One of the funniest comedies this year. Relaxing and motivating movie which may really cheer you up after having a bad day and actually be good enough to motivate you with either your job or ambitions. Shows that nothing is impossible if you try hard enough to succeed. A thing that i didn't like very much was the ""geek"" references because i think that someone could get offended in some way but they were not so direct, so i guess that's not even a negative point about the movie. Actually I really can't think of anything negative about the movie at all. It was a pleasure watching it and i highly recommend it to everybody who likes good now-a-days comedies.",The Internship
222,wolfrainrules,OK but insults the people working at Google,3,21 June 2013,When I first heard of the movie I thought that of how funny this movie could be. I was a bit disappointed on how much this movie didn't made fun of their own audience. Spoiler: The two main characters used old stories to get the buyers to get their products at the interview for the job. Once they are at Google the internet company decides to spit up everyone into small teams in order to see their strengths and weaknesses and how they can make the company better. The two main characters decide to give their so call team a horrible time by ruining three challenges (Oh by the way there is only 5 challenges. The team manage to win one challenge and at the last minute got the last challenge. The Google company decides that instead of picking the winning team (that had three challenges won) they choose the team that literately goofed off and give them the full time job with Google. In the end I didn't liked the fact that it just made fun of the audience by telling them that even though the true hard working citizens apply to a job then it would most likely be given to the jerks who are acting like Homer Simpson. I recommend to not go and see this movie.,The Internship
223,Yellolo,Easy Watch,6,4 November 2013,"I watched this film on a rainy Sunday afternoon and I'm fairly glad I did. This is an easy watch; light hearted with some good jokes here and there but by no means the film you want to watch if you're looking for something more complex. The good points were a lot of the supporting cast like Josh Brener who played Lyle, Dylan O' Brien as Stuart and Tiya Sircar as Neha and the running jokes like 'on the line' however this did get a little predictable towards the end and seemed to fall into the trap that all Owen Wilson and Vince Vaughn films seem to fall in; the oh so cheesy ending. Other things that I didn't like was the side story of Nick(Owen Wilson) and Dana which again was so predictable and I knew from the first moment that they were gonna get together (also Owen Wilson's cringey flirting) and Max Minghella as Graham who was really unconvincing and stereotypical in his portrayal of the character.",The Internship
224,Noel68,Almost turned it off....,9,13 April 2014,"My husband was bored with in the first 10 minutes of the movie but I told him ""wait this is the Google movie"" and then he went ""OH""...he knew from the previews who was in this and that it had to get better... Well, it did. We really enjoyed it as it was funny, thought provoking and just good writing after it got going.It's a good guy flick, taking you along the story of 2 guys that get fired and want to re-start over (they do this a lot we get from other characters)...they help some kids realize there is more 'out there' than being a brains with your nose stuck in books/computer/phone.. a become their life coaches lol....",The Internship
225,mogwuy,"Light hearted, feel good movie",7,22 December 2013,"Watched this last night. I laughed pretty frequently throughout this movie, though did have to turn away during some of the painfully awkward moments. The movie has a good message and it was fun seeing the Google campus.Most the cast did a pretty good job. Though the one kid was kind of annoying. Though that may have been the point. It was interesting seeing there characters grow as wellThe film does feel like a big commercial for Google (it manages to like advertise all of there software) and makes it seem like campus is full of a bunch of stuck up snobbish people, but none the less I enjoyed the movie.",The Internship
226,xtinamae76,Hilarious,9,8 March 2014,"Owen Wilson and Vince Vaughn are one of the best comedic duos ever. Actually, when I was going through the Redbox selection and saw it had Owen Wilson and Vince Vaughn in it, I picked it immediately and didn't even read the plot summary. It was reminiscent of Wedding Crashers but a little more up to date and with funnier scenes. I laughed out loud throughout a lot of it. I think the funniest aspect was Wilson and Vaughn's characters relation to technology. As to be expected, product placement was prominent but it is worth it since it was filmed in the U.S. and not overseas. Definitely a great comedy overall, in my opinion, although more scenes with Will Ferrell in it would have made it perfect. :)",The Internship
227,bryanh2585,Wedding Crasher Sequel?,9,6 June 2013,"The movie was great from beginning to end. I laughed harder than I have in any recent comedy I've seen in the theater. I saw an advanced screening in Chicago a couple weeks ago and the entire audience was cracking up the entire time. Even the romantic scenes are funny in this movie, and thats kind of rare. Also I'm sick of people giving it negative reviews just because it's at Google, or it's a Google commercial. As if Google is really hungry for people to come do their internships. Obviously they're getting the best minds in the whole world to come there already. I'm sure everybody knows what the heck Google is.Go see it, it's worth the price of admission. Vaughn and Wilson are great together...feels like a Wedding Crashers sequel of sorts with the way the two characters interact with each other...and of course a perfect cameo early on was hilarious.",The Internship
228,giulio-abramo,One disgusting detail sums up the whole movie,1,10 October 2021,All you need to know: apparently getting groped while shopping for a mattress is funny. I feel I can stop here.,The Internship
229,rust_brittany,Just a girl who watched a movie.,10,2 July 2018,"I'm not someone who needs to dissect movies and I frequently wish there were more Comedies and/or 'Feel Good'ness. It's simple. Did I enjoy it? Did it make me smile? Who cares if Google was portrayed in a positive light? I liked it. I like Google. I thank The Gods for Google. Sooo, anyway. It's a great, enjoyable, makes your heart happy and your face crack to show off your teeth kinda movie. If you need dark, plot twisty, overthinking, and critically analyzing... Then don't watch and subsequently leave an underserved bad review. Maybe hit up some Handmaiden Tale or The OA? For happy heart peeps... Run to your nearest Blockbuster and rent this right meow. ;)",The Internship
230,stitchy4,Great wee film,9,26 June 2013,"I went to see a special screening of the internship last night I was very surprised in going too see the internship i was expecting a generic comedy. It was very funny but what it had going for it was heart.its a great feel good film it is well worth seeing if u want a film to brighten your mood.Vince Vaughn steals the show here Owen Wilson preforms a solid role as well, there is also good performances by some of the back up cast.its reminds me of a mix between old school and role models. After watching the film u really want to visit google it would be the best place in the world to work. So if u want a funny feel good film too see this film is right up your street.",The Internship
231,harendrasingh-65762,Awesome Movie !,9,2 June 2018,"Giving it a 9 only because it wasn't like a life changing movie for me or something(10 reserved for those kind of movies only(Nolan gets them ;))) !Awesome movie ! Just finished watching it ! 
I could connect really well to all the things so I just loved it ! And the credits at the end ! Just amazing ! Loved the credits very much ! It had had so much ""GOOOGLINESS"" in it !Overall an awesome movie ! Though I see why people didn't like the movie because
it over hypes Google the company but that's why I love this ! This is very real life , it is love ! This is what people aspire to do, atleast what I do !So for me this was a great great movie ! Well made and well written out !",The Internship
232,woj101,Vaughn and Wilson could raise the Titanic!,8,20 November 2013,"Disclosure: if I was playing Fantasy Frat League, Vince Vaughn and Owen Wilson would be the first two names on the team sheet.Vince Vaughn and Owen Wilson are irrepressible and elevate a mediocre film to a feel-good party.Tiya Sircar is fit as ****.That's all you got to know.VV has story and screenplay credit for the film and it's not his best work, but he did what he had to do to get it green-lit and I know he is capable of greater things with the right backing. Being a Google film he must have been quite restricted in the stylistic choices, can't wait to see what's next when hopefully the reins are a little looser, and I only hope he and Owen Wilson continue to pair up for many more films to come.",The Internship
233,pynchme,This movie surprised me.,9,16 February 2014,"I only watched it because it had Vince Vaughn in it and he is usually entertaining. However, what a lovely surprise. I know the plot is a bit of a soft version of fish out of water but the characterizations themselves and interest in Google happenings was enough to hold it together. One thing I found a bit puzzling was that during orientation, the interns are told that they aren't allowed to date other employees. Next thing Owen Wilson is hitting on his love interest who is positioned as an experienced Google employee. Maybe I missed something there; but I'll pay closer attention next time I watch it to see if I misunderstood something there. I didn't find the love match convincing but it was such a small side line in the movie that it didn't matter. One other little issue for me was the incredible ageism. In fact, it was a bit of a stretch of believability that a couple of blokes in their 30s or 40s wouldn't be tech savvy nowadays. However, to the ageism - is that fair dink? Does Google really not understand it's demographic? - ageing populations everywhere people! Being youthful doesn't automatically equate to the best ideas or social knowledge. Well having said that, I would say that Google really doesn't understand the public it serves. It's a great search service but otherwise it demolishes the usability of everything else it touches. Maybe Google really should hire more mature aged people. Anyway, I thought it was great. It's really nice to watch something that is borderline wholesome at least! Fun and funny movie - interesting as well, which is a bonus.",The Internship
234,gemmagassi,A feels good movie if you are in the blender,10,12 October 2013,"This is a very funny and feel good (at the end) movie. I wish there are more such movies. Also the main actors are like contemporary Walter Matthew and Jack Lemmon. The dialogs are very smart, crisp and up to point, with lot of side references from different generations (depending who is using them). Also the short episodes by Will Farrell and John Goodman are brilliant. The story is working and it is actually making fun of the ""american dream"" but by over-exaggerating it. A double sarcasm so to say. All the characters are clichés, but the perfect ones. Fine tuned comedy at its best. The movie just flows and the time in cinema is flying by. It just feels good to have fun and a good laugh. And you know that especially if you are currently in the blender (or just came out).",The Internship
235,jennychort,It made me laugh,8,28 July 2013,"It was a funny simple comedy. Feel good vibes and great chemistry between Owen and Vince. If you're looking for an Oscar contender go elsewhere. If you are looking to laugh and escape, Go see this this movie. A good time was had by all. I don't understand all he bad reviews. That's like saying Caddy shack or Home Alone wasn't deep enough so 5 stars. Sometime the movie is just fun and light. And that's alright. Also, saying that this movie is just product placement for Google is stupid. I got to this website using Google. I looked up movie times using Google and I will make a new pancake recipe in the morning having used Google. It's embedded in our lives and part of our daily culture. They don't need product placement. Any who, funny movie.",The Internship
