,User_name,Review title,Review Rating,Review date,Review_body,Movie_name
0,SnoopyStyle,Guys still lovable goofs but this is too awkward,5,29 May 2014,"Billy McMahon (Vince Vaughn) and Nick Campbell (Owen Wilson) are manufacturer reps for a watch company. The company goes out of business. They're somewhat obsolete. Billy loses his girlfriend and his house is in foreclosure. Nick takes a bad mattress sales job. Then Billy looking for sales jobs on Google comes up with an idea. He's able to convince Nick to take a big swing.This is awkward and not always funny. The guys have always had good chemistry. That hasn't change in this movie, but it doesn't mean that you can drop them anywhere doing whatever Vince Vaughn comes up with. At least, the guys are still the same lovable goofs. Sometimes their stupidity is funny. Other times, it's just stupid. Then there are the times when it gets real awkward. Part of that is that this is a 2 hour commercial for Google. I know product placement is everywhere nowadays, but this product is all over the place... man!",The Internship
1,Hitchcoc,Saw It on a Plane,5,3 January 2014,"I don't mean to be cruel. I like Vince Vaughan and Owen Wilson. This, however, offers absolutely no surprises as it reprises every underdog movie ever done. Nothing wrong with underdog movies if there is a unique spark. Not to be. The character are mere caricatures. Since Revenge of the Nerds we have been treated (sorry, bad use of the word) to sports films, sexual discovery films, and so on, which titillate and hope to gain the attention of those of us who are not handsome or beautiful or rich or whatever. Of course, they are the people that all these guys would choose to be if they could. So we have the usual nose-pickers, shy, frightened, socially inept cases of arrested development, hidden geniuses, and then the old guys who somehow found their ways into the Google infrastructure. This is no work of art so lets not criticize it as if it were Citizen Kane. Its a silly, haphazard, unbelievable series of events. It's like eating too much dessert. It tasted good, but you don't feel all that good.",The Internship
2,Prismark10,Yahoo!,5,24 July 2014,"The Internship AKA a corporate ad for Google. Owen Wilson and Vince Vaughn team up again as two out of work salesmen who end up competing for a job at Google but they have to compete with younger and more IT literate geeks in the internship program at Googleplex. The duo are regarded as figures of fun and over the hill and end up teaming up with other misfits as no one else wants them.In the film Google is a hip place to work, it might be true, all I know is that they do indeed have a free café for food.Vaughn who also co-wrote the film has an easy way with Wilson, so they should given the number of films they have made together. Will Ferrell pops up in a cameo. Max Mingehella plays their rival who will stop at nothing for his team to win. Aasif Mandvi is the Head of Internship Program who seems to be antagonistic towards our duo.The film is rather predictable. You have the less tech savvy Wilson and Vaughn trying to bond with their team, their trump card is that they have real life experiences. Eventually they start giving Minghella's team a run for the shot at winning the internship but there are ups and down as well as a romance side plot. At the same time there are various digs at Google as a slightly eccentric place to work for.The film is sporadically funny, just about charming but a tad too cosy and predictable. There are few surprises, in fact its more Windows than Apple!",The Internship
3,claudio_carvalho,Terrible Propaganda,3,1 November 2014,"The watches' salesmen Billy ""Billy"" McMahon (Vince Vaughn) and Nick Campbell (Owen Wilson) lose their jobs when the company where they work is sold for losing market for the cellular. Billy and Nick do not have skills but Billy fills the application for a summer internship at Google. The candidates are divided into groups and Billy and Nick join the team of outcast. Now they need to win the tough competition against brilliant college students to be definitely hired by the company. ""The Internship"" is a terrible propaganda of Google, with a lame story that uses clichés. Vince Vaughn and Owen Wilson are great comedians but this wrong marketing is too silly, absurd, long, illogic and annoying. My vote is three.Title (Brazil): ""Os Estagiários"" (""The Interns"")",The Internship
4,nogodnomasters,THE FUTURE DOESN'T KNOW LATER,8,2 August 2018,"Two dinosaur salesmen (Vince Vaughn/ Owen Wilson) find themselves as interns at Google. They are fish out of water as they have to deal with the youth and terminology of the tech world. They are divided into teams with our duo on the misfit team which leads to formulaic results.This is a fun film which doesn't offend. The humor is not overwhelmingly laugh out loud, by rather tritely funny. That is not to say it is bad, but simply lacks originality.Worth a view. Makes for a good rental.Parental Guide rated version: 2 f-bombs, No sex or nudity. Strip club scene.",The Internship
5,kosmasp,By the numbers,6,13 October 2013,"Internship is funny and it might work better or worse for you depending if you like the main actors or not. It has some very funny scenes and even the construction itself does work, even though you do know where it all is going to (predictable would be the word you're looking for in that case).Vince Vaughn and Owen Wilson have a great chemistry, they do exactly what you'd expect them to do (actually Vince hasn't surprised anyone in years, either amused or annoyed the viewers). Some of the supporting cast is really nice though. We have one guy who is a regular at the Today Show (with Jon Stewart), who has only a few scenes, but is funny as hell (as expected, too), but the rest of the bunch does have their fair share of moment to shine too. If you can sit through the obvious, you'll have fun",The Internship
6,lee_eisenberg,interns of the future,5,14 December 2013,"""The Internship"" is an unpretentiously silly story of some friends who intern at Google. Like many flicks starring Owen Wilson, Vince Vaughn and company, it's mainly an excuse for gags. The rest of the cast includes ""The Daily Show"" correspondent Aasif Mandvi as the supervisor who gives the teams the job of developing an app.We could be cynical and say that much of the movie is the same stuff that we saw in ""Wedding Crashers"". I beg to differ. While there is a lot of the same stuff, ""The Internship"" really does its own stuff. A lot of the humor derives from the age difference between Wilson's and Vaughn's characters, and the rest of the employees. Funny stuff. I enjoyed the movie, and you probably will too.I guess that it would be a little ironic if a person Googled this movie.",The Internship
7,paul_haakonsen,You on the line...?,5,5 October 2013,"I can't really claim to be much fan of neither Wilson nor Vaughn, but still their movies tend to be alright, and as such, then I sat down to watch ""The Internship"".For a comedy, then the laughs were really, really far apart. Don't get me wrong here, I am not saying that the movie is boring or bad, not at all, but it is definitely not the kind of comedy that will have you laughing yourself to tears. The story was nice enough, but what really carried the movie was the characters and the acting.The story in ""The Internship"" is about Billy McMahon (played by Vince Vaughn) and Nick Campbell (played by Owen Wilson), two salesmen who find themselves without a job. And find themselves bustling hard to get through an internship at Google, banded together with a group of younger and more technical-minded people.I will say that I found the characters tremendously well portrayed, and they were were full of dimension and personalities. And as such, it really helped the movie along quite nicely. And the chemistry between everyone was just great.If you find yourself without something to do for about 119 minutes, then ""The Internship"" could be a good enough way to pass the time. I am rating ""The Internship"" a 5 out of 10 rating. This mediocre rating comes from a lack of comedy in the entire movie, and what kept the movie afloat was the characters and the people portraying these characters.",The Internship
8,tavm,"The Internship is an okay comedy, just don't expect non-stop laughs",5,17 June 2013,"Let me state right off the bat that I like both Vince Vaughn and Owen Wilson. I loved them both in Wedding Crashers. That was a very funny movie. This one, not so much, and because it's rated PG-13 and not R, there isn't as much raunch as in WC. Actually, this one is supposed to be even more of a nice vibe between comedy and sweetness than WC and I actually liked that. But I'd be lying if I didn't say that I didn't find much that was funny during many of the beginning scenes. It did pick up much near the end and overall, The Internship wasn't too bad. Part of me wouldn't even mind seeing it again if asked. Just don't expect a non-stop laugh-getter is all I'm sayin'...",The Internship
9,edwagreen,***,7,12 August 2014,"Comical film dealing with sudden out of work salesmen who embark on a new career by becoming interns for Google in an attempt to gain employment with this internet provider.Owen Wilson and Vince Vaughn were great salesmen but realize that they must come to grips with today's society and use of computers to gain attention.They employ unconventional methods to attain their goals along with a group of young people they are grouped with when no one wants to work with them.This is basically a story of perseverance and doing unconventional things in a conventional world.Of course, there is the usual romance and attempts by others to sabotage their efforts. There is a head leader who seems to be determined to make sure that the guys never achieve their goals.",The Internship
10,sunwarrior13,A Google Advertisement,8,14 April 2014,"The Internship is a comedy that stars Vince Vaughn and Owen Wilson.It tells a story about two men who lost their jobs as a salesmen and were hired as interns at Google.The film was shot at real-life headquarters of Google at Mountain View,California. Billy McMahon and Nick Campbell seek employment after being laid off from their positions.They apply for an internship at Google and they were surprisingly accepted due to their unexpected answers that pleased the job interviewer.Unfortunately,they are the only interns that are not of College age.They join with other interns that are considered rejects such as Stuart,Yo-Yo and Neha.They form a team that will compete for guaranteed jobs with the company.During the competition against other tech-savvy groups,both Vaughn and Wilson work on their comedic skills and charm to elicit laughter to the viewers.Then guess what?In the end,every viewer knows who among the groups will be will get the coveted job at Google.Obviously,the film is predictable and generic.Too bad that both Vaughn and Wilson do not generate that much interest to the viewer especially when most of their comedic scenes fall short of laughter unlike in their previous movie entitled,The Wedding Crashers.Also,it drags a lot and I considered it overlong.Overall,it just served as a 120-minute Google commercial and nothing more.But if you are a fan of both actors,this film is definitely for you.",The Internship
11,bevo-13678,Google it,10,3 April 2020,I like the bit how nobody has watches anymore.even old people,The Internship
12,utgard14,Formula comedy is amusing at times,5,3 November 2013,"This is a formula ""back to school"" type of comedy with lots of product placement and two aging stars going through the motions. Vince Vaughn and Owen Wilson play the same roles they've played for most of the last decade -- themselves. If you are a big fan of them you can add a point or two to my score because they're the whole show here. The rest of the cast is made up of mostly unknowns playing various stereotypes that are familiar to anybody who has seen a high school or college comedy. They do fine and there are no standouts, good or bad, among them. John Goodman appears in a thankless supporting role. Will Ferrell does one of his usual cameos he does in the movies of his friends. He's worth a chuckle or two. Like I said, the movie is formulaic and predictable but it has a very pleasant upbeat tone throughout and quite a few amusing moments but nothing that will have you bowled over in laughter. There's a ton of product placement for Google. Literally the whole movie. So if that sort of thing bothers you, you might want to skip this one and save yourself the righteous indignation.",The Internship
13,zardoz-13,"Not A Tenth As Good As ""The Wedding Crashers""",5,17 June 2013,"The Vince Vaughn & Owen Wilson generation gap comedy ""The Internship"" is essentially crap. This lame-brained comedy isn't a tenth as hilarious as their first movie together ""Wedding Crashers."" Indeed, this lowest common denominator laffer about two desperate 'old school' clock salesmen who don't even know their own company has folded is nothing special. Vaughn relies on his obnoxious motor-mouth skills to generate humor, while Wilson deploys his blonde, surfer dude good looks to hook women. ""Date Night"" director Shaun Levy doesn't get much mileage out of anything in this predictable but harmless farce about diversity in the workplace. The surprises and revelations in ""The Internship"" qualify as few and far between, and the outcome isn't quite as tantalizing as it could have been. Vaughn penned the screenplay with the help of Jared Stern from his own story. Nothing in ""The Internship"" stands out, except for the grueling efforts that our protagonists go to so they can rejuvenate their careers. The jokes, the gags, and the dialogue are rather bland, and our heroes achieve their objective without too many problems. Neither Vaughn nor Levy are willing to buck the clichés and try for something a bit more interesting and relevant for contemporary audiences.",The Internship
14,grantss,Quickly becomes formulaic,5,5 May 2014,"So-so comedy. Had potential but quickly became formulaic. The original idea was a good one - 40-somethings having to find their way in a 20-somethings industry - and the dialogue was initially quite funny and fresh. However, from a point the movie ran out of original ideas and just retreaded the same IT jokes. (Unfortunately, that point was sooner, rather than later, in the movie). Worse than that, it adopted a stock- standard, done-a-thousand-times-before, comedy plot. Very predictable and unoriginal, ultimately.Other irritating thing is that it seems like one huge advertisement for Google. They could at least have invented a fictitious IT company.Performances are nothing to write home about. Vince Vaughn and Owen Wilson do their best but are constrained by the script. Rose Byrne deserves a whole lot better kind of movie than this.",The Internship
15,neil-476,"Pleasing, if insubstantial",8,5 July 2013,"40-somethings Billy and Nick are brilliant salesmen, but that counts for nothing when their employer shuts down. Needing to find what to do next, they try out for the intern program at Google, where they end up applying their life skills and experiences as part of a team of misfits.My experience has been that both Vince Vaughan and Owen Wilson are lazy actors - they play the same parts and give the same performances in every film, and The Internship does not overturn that formula. However, they also have an easy and likable chemistry as we saw in the Wedding Crashers, and this works well for them here. This is a gentle, likable comedy, where most of the characters are pleasant company, the chuckles are frequent and the smiles constant, the moral statements worth making and fairly subtly delivered, and the romance (Wilson and Rose Byrne) nicely played.By no means a classic, neither is it in any way offensive (apart from a single unwelcome F-bomb). I positively enjoyed it.",The Internship
16,anaconda-40658,A Bad Internship.,4,24 June 2015,"Internship (2013): Dir: Shawn Levy / Cast: Vince Vaughn, Owen Wilson, Rose Byrne, Max Minghella, Josh Gad: Wedding Crashers is one of the best comedies of the 2000's. How unfortunate that it is followed up with this boring laughless tripe about connection. While Vince Vaughn and Owen Wilson were witty and hysterical in the previous film, here they are bland. They play a couple of salesmen who sell watches until they are let go when it is figured that the I-Phone has replaced watches. On a fluke they decide to apply as interns at Google. While the premise has potential it is followed up with formula writing and characters who make up every stereotype and moron that they could conjure up. Rose Byrne catches Wilson's eye and immediately comes off as a tight ass with a stick wedged up her crack until he predictably breaks the barrier. Max Minghella plays an over the top bully competitor who desires the job prospects of Google and will sabotage when opportunity presents itself. It is unfortunate that he went from The Social Network to this. Vaughn and Wilson are placed in a group with imbeciles. We have the uptight jerk whom they try to befriend. We have the virgin female. We have Lyle who talks in the third person because he is an irritating peon. A scene at a strip club where he gets the stripper is embarrassing with its idiotic bar fight. The biggest idiot discusses his abusive mother and pulls his eye brows out. After being part of this travesty, he will likely be pulling his hair out. The theme of technology and age is strong but the screenplay is so pathetic that it is enough to make viewers pull their eye brows out. Score: 4 / 10",The Internship
17,FlashCallahan,On the line.....,6,13 October 2013,"Billy and Nick are old school salesmen. They find themselves out of a job when the company they work for closes. They try to find jobs but because of their age, it's not easy. Billy gets them a chance to work at Google but they first have to undergo a long internship and find themselves teamed with others who are younger than them. They compete against other teams, and only one team will be hired. But there is always that English lad with thick eyebrows who tries to ruin it for the 2004 stars.....Its easy, if you can tolerate Vince Vaughn, the fact that its just one Ad campaign for Google, and the gaping audacity of it all, its watchable. Its easier for me, because I wasn't a fan of the wedding crashers. In fact, that's one of the most overrated movies I've ever seen, so my expectations were lowered for this, and it got everything I expected to get from this movie.Ageism, other interns hating the two stars, bonding, one standout awful person, the two giving others life lessons, something going wrong, a love sub-plot, and obviously the feel good ending.Its one of those films you can put on and just let happen, because it displays every known trope these kind of films have to offer.It's not funny, I didn't laugh once, but with Vaughn and Wilson, you know what your going to get.Not brilliant, but never dull.",The Internship
18,phd_travel,Funnier than expected - not painful or goofy,8,2 September 2013,"This film could easily have been painful or goofy but it wasn't. In fact the dialog is laugh out loud funny in many parts. Two laid off slightly advanced salesmen take on an internship in Google. As expected the pairing of Owen and Vince works again. Somehow the mixed bag of Asian and other nerds is endearing. It's fun to see the lovely Rose Byrne using her Aussie accent and Max Minghella his British accent. Surprising to see Jessica Szhor as the hot dancer. Nice shooting in the Bay area.Vince did a good job with the writing and aside from the generational jokes, the X Men joke and the ""awful"" date are quite hilarious. It shows you don't need to resort to excessive crudeness to get a laugh these days. Nice change from the Hangover type comedies.Definitely worth a watch.",The Internship
19,mm-39,Worhting watching!,7,11 June 2013,"Worth Watching! Vince and Owen are at it again. This time as two unemployed salesmen having an Internship at Google. The x generation meets the modern cyber adults of today. 1980s' old school fish out of water character are pitted against the cyber intellectual bullies of today's modern world. When I went back to school I had a similar experience. What makes the Internship work is comic themes of dealing with free food, ethics of drinking with your boss, and a silly love interest. The Internship is a coming together movie. Where real life is tested against cyber life. E Q vs I Q. People taking chances in life. I liked the internship. If you liked movie like Old School The Internship is for you. I give Vince a seven out of ten.",The Internship
20,namashi_1,Good Fun!,7,16 March 2014,"'The Internship' is Good Fun! An entertaining, feel-good film, that doesn't tax your brain. Its a smooth watch!'The Internship' Synopsis: Two salesmen whose careers have been torpedoed by the digital age find their way into a coveted internship at Google, where they must compete with a group of young, tech-savvy geniuses for a shot at employment.'The Internship' has a few clichéd moments, but other-wise, this recent comedy, doesn't have any massive flaw going against it. Its interesting to see its aging protagonists having fun & emerging victorious against the youngsters. The characters work & so does the narrative.Vince Vaughn & Jared Stern's Screenplay surrenders to clichés at times, but is well-done otherwise. Shawn Levy's Direction is appropriate. Cinematography & Editing, are average. Performance-Wise: Vince Vaughn & Owen Wilson are very good. Also, they share a wonderful chemistry on-screen, just like they did years back in Wedding Crashers. Max Minghella is convincing in a menacing part. Rose Byrne looks gorgeous & delivers a restrained performance. Aasif Mandvi is impressive. John Goodman & Will Ferrell are terrific in cameos. On the whole, 'The Internship' works.",The Internship
