,User_name,Review title,Review Rating,Review date,Review_body,Movie_name
121,Westeire,Watched the movie and I changed my browser search engine to Bing...,1,22 November 2013,"This infomercial-sudomovie is awful to the extreme. There did they dream this thing up.. What do I say about this movie. Its shallow, predictable, boring, pathetic, not funny, lacks a screen writer, lacks a director. Its just plain awful. and the sad thing I actually paid to rent it.... kidding myself for doing that.. Hoping this review saves people from the train wreck which is this movie. How in Gods name did they make this movie, I can only imagine it was paid by Google itself. At least when the made the Facebook movie it had a little bit of acting, this thing has nothing its just a waste of space. No redeeming factors at all to the movie. Sad thing is that 14 year olds will see the movie and think the job market is like this,,, it isn't .. Owen Wilson and Vince Vaughn reuniting almost a full decade after their raunch-filled ""Wedding Crashers.""Here, their humor is much tamer -- if not particularly wiser -- with the aging frat boys actually playing father figures to a group of genius outcasts trying to win work at tech-giant Google. Seriously I would rather watch the twilight sage on a loop with needles in my eyes.",The Internship
122,KingMushCharva,Second time watching,10,16 August 2019,"Enjoyable film, previously watched it back in 2015 and it was actually better than I remembered.Probably one of my favourite films and I wish the both of them would get back together to make another movie.",The Internship
123,zzyzx000-124-271558,This screenwriter could ever get a job at Google,2,29 December 2013,"I tried to like this movie. I'm a old computer geek from the 70's. I wrote code for Atari. I'm a big fan of Google and of the 'campus' lifestyle for adults. This movie has been done so many times in other settings. I'm really surprised Google went along. Did they get a free ad, or did they have to pay to be in the movie? I gave it a 2 because I've seen worse this year. It's just either totally predictable or just dumb. How about the real life Quidditch match? Running around with one hand on a broomstick between your legs while playing hand soccer with the free hand?Or the evening getting wasted at the Titty bar? We get to see dozens of silicone tits in Silicone Valley while the wannabe Google interns do lap dances and shots to help guide them onward to winning their competition. Or Owen Wilson's date with the prude and he does everything possible to p*ss her off and she likes all of it? I'm starting to bore myself. Enough said.",The Internship
124,youngman44,Super Enjoyable,8,10 June 2013,"I go to the movies to be entertained - not to find ways to criticize. But, if a movie is bad or mediocre, it's bad or mediocre and I'm happy to say so. This movie, however, was neither bad nor mediocre. It was just a very enjoyable film. Not a spectacular-fall-out-of-your-chair-laughing-hysterically comedy. But, a really good story and one that had plenty of solid humor, joy, entertainment and a few poignant moments. It simply worked. What's wrong with that? Vince Vaughn was his classic self. He has his own unique humor niche carved out and he had several of his classic, near stream-of-consciousness riffs for which he has become iconic. He also carries a humorous sarcastic-warmth to him that reminds me (in his own comedic way) of some other warm comedic greats who had a similar ability to be quite funny but generate some warmth in his films (John Candy comes to mind). As the story writer Vaughn had a great little plot and very good idea. I'm very happy he wrote a generally good story. There are a couple of explicitly humorous scenes - some comedy is a bit over-the-top gross here or there - but otherwise it is pretty ""feel good.""Owen Wilson is solid though not spectacular. But the Wilson-Vaughn combo is a great one. Not to the comedic level of Wedding-Crashers in this one, but still very good. The bottom line is the movie entertains and while it may not appease the snobbery of many critics, it is an enjoyable film and I hope it does well. Worth seeing for sure.",The Internship
125,realvedmak,What is working at Google like ?,10,14 October 2013,"Was this movie funded in any part by Google? I did not bother to look it up. Parts of it play like it was propaganda piece for Google. However, since I like Google if it was their idea it was great, if not, its great anyway.At its core this is a stupid comedy. Template-y. Think typical college humour movie, but set at Google internship facility instead of college/university.I find it little bit hard to believe that there could be two people in 40's completely ignorant of internet, even harder to believe that Google would seriously accept two such people as interns, but story is not really any more unbelievable than rest of films I saw in this category.I would probably get kicked out from internship like this one as I would be dating coworkers, bringing food back home, winning at Quidditch by any means needed, and my unique perspective on solving problems that might not really be politically correct, but I would still have loved to try it anyway.If you have no idea who X-Men are, or what is Google or Cosplay, you might not find humour appealing.Otherwise this is perfect movie to watch with bunch of friends.",The Internship
126,CSHaviland,"Cute, fun, a little tedious",6,9 June 2013,"With Bathroom Humor Comedies (Adam Sandler movies, The Hangover, etc) and RomComs being the usual comedic fair at the box office these days, it's refreshing to find a comedy that stands outside of that tiresome trend.The Internship was a cute movie that certainly has its chuckles. Google is actually a very odd work environment, and the movie makes good points about the depressed state of our modern employment climate for young and old alike. I think the movie tried a little TOO hard to polarize a traditional salesman with the high tech digital age, and some of the Vince Vaughn joke sequences seemed to get a bit tedious. But he played it so seriously that the overall effect was still amusing.The Vaughn / Wilson pair were VERY sufficiently embarrassing with their overzealous attempts at being team players in projects they didn't understand, and as I have worked deep in the internet business since 1996 I cringed harder than the Google interns who tried to cope with them. I was already a Director level manager in the internet when Google was just being founded, so I've watched the company grow from the ground up, and eventually sponge up the mega-companies that produced my primary worktools (such as Doubleclick). Having been interviewed for management level jobs at Google I can vouch that they can crawl up your ying-yang about your academic record, even if it's from the 80's and you have over a decade of real quality experience to replace it. I've been interviewed by Facebook, Yahoo and Amazon too, and only Facebook can take after Google in this way. It creates the perception of being the Mensa Society of the digital world - pretentious, exclusive, and only for IQ's higher than 170.That is not really the case, strictly speaking, but there is a culture there of self-importance that the movie bounced our heroes off of, and it worked for some laughs.All in all it was an enjoyable matinée break, but I probably won't be getting it on Blu-ray.",The Internship
127,ArtandJoyofMovies,Yawn!,5,27 June 2013,"A few laughs, slightly cute and little more. Owen Wilson and Vince Vaughn can do this bit with no script and half asleep. I am pretty sure they did. This movie has few ad placements other than the usual Apple Mac computer promo spots. The fact is, this movie IS a paid advertisement for GOOGLE, by GOOGLE and certainly paid for by GOOGLE, with a few dollars thrown in by the University of Phoenix. I hope this is not a road map of crappy, cheap comedies to come.Boneheaded, forty-something watch salesmen Nick (Wilson) and Billy (Billy) lose their jobs and apply for a competitive internship competition at GOOGLE with a flocks of 20 year old super nerds. Back to School (1986) with Rodney Dangerfield this movie is not. I believe the set up but I don't believe that Owen Wilson and Vince Vaughn have not a single gray hair at their ages. Both need to start taking parts their own age.This film portrays GOOGLE as the breeding ground for world class nerds and lost romantics. Okay, at least it is truthful. One philosophy I found most provocative is that on the GOOGLE campus, all the food and lunches are free. However, it is a major violation at GOOGLE to take any food home. In other words, you only get food if, and while, you are working. For a bunch of bleeding heart liberals from California, this message seems about as anti-immigrant, anti- welfare as one can get. On the other hand, perhaps it is a message of communism–work for us and do as we say and we shall feed you. Stray and you shall starve. It seems strange because GOOGLE is the poster child of capitalism in America. Come up with a cool idea and make a few hundred billion dollars. But then the masses must kiss your ring and bow art your door. Worse, if you want to work there you are forced to engage in many circus like stunts and court jester antics—hardly a self esteem building exercise for the low esteem ""Noogles."" There are lots of mixed messages in between the all too rare guffaws in this film.I suggest googling ""laughs"" and see what turns up instead.",The Internship
128,arnavgoswami,nice cast + good tracks + poop plot = total waste,4,4 October 2013,"watched THE INTERNSHIP ...I didn't really get this thing ""Why did they make it(the movie)?"" & was it even a movie or an advertisement for Google? but they faked it as a movie(so people don't change the ch/or even better pay to see an ad) come to which they just dropped in some characters n a lousy plot to make it look like one? ...the film has only one joke..okay two, which can make you giggle BUT one of them is out in the form of its trailer already..& there..it has nothing else except for useless scenes to get it going for 2hours..you don't even have to guess/predict of how its gona end you just happens to know it..n THE END you were right..It'd be better if they had just made a documentary on Google instead of glorifying its ""noble cause"" in this sh!t movie ..it was waste of time n money for the makers n will be for you too(if you'll watch it) so I say _DO NOT WATCH",The Internship
129,user-142-632625,Internship - brief,6,29 October 2014,"Light comedy of two middle aged stumblers who apply for jobs with Google, going the intern route. Applicants break off into teams and competition begins. Enjoyed this more than I thought as the two older males do not condescend to younger members, nor do they try to take advantage of them. They do not hustle their team mates, or behave as know-it-alls. Both Vaughn and Wilson walk a narrow line between ignorance and earnestness, but carry that off. Internship is overlong at 2.00+ hours, yet never seemed to lose momentum. One cannot help but observe both Vaughn and Wilson seem on the cusp of being too old for these roles.",The Internship
130,Mars-3038,A joyful movie,8,2 September 2021,I really enjoyed this movie- it made me laugh a few times. I recommend giving it a watch.,The Internship
131,faisal_khatib,Brilliant chemistry between the leads along with wonderful supporting actors,7,8 June 2013,"With the premise of an internship at Google; you get the whole deal with product placements. Luckily ""The Internship"" manages to stay afloat as a two hour enjoyable and rather funny Google advert.The film begins with Billy (Vince Vaughn) and Nick (Owen Wilson) losing their jobs as fast talking watch salesmen facing an uncertain future thanks to the digital age. Managing to talk their way into an internship (against all odds) at Google, they find themselves facing off against smart and tech-savvy college kids aka ""a mental Hunger Games"" for jobs at the on-the-line search giant. Ending up with a team of out casts and facing mostly unreasoned challenges (Read: Quidditch match), Billy and Nick manage to turn the odds on its head for the perfect (and predictable) ""Lived happily ever after"" ending.With previous individual failures Vince Vaughn and Owen Wilson come together once more to share their amazing chemistry on screen. Vince Vaughen plays the exact same role he has played in every possible film you've seen of him lately. Since he's co-written the film; I guess he likes to feel right at home. The same may apply to Owen Wilson who's landed himself in a similar rut. It does make the whole process rather familiar but there is no denying that the chemistry both these lead actors share gives the films premise a new pair of legs every time it starts lagging a little. Both these actors clearly know their limitations and have managed to work around it well this time. Also since this was a PG-13 rated film, some of the vulgarity that you might associate with these actors is kept to a bare minimum reducing what I feel are just distractions.Tobit Raphel as home-schooled Yo-Yo was a complete scene stealer as more often than not he'd have you laughing out loud with his crazy antics on screen. Dylan O'Brien on the other hand balanced it with his controlled cynical act of 'know it all' Stuart. Tiya Sircar as Neha was brilliant as you watch her character go through its curve. Josh Brener as the 23 year old Team leader Lile starts off brilliantly as he tries to portray himself as a cool dude but fades away as the love interest angle falls into place quite predictably.Max Minghella as the films main antagonist Graham is underused and left with one-liners that are too far and few. Rose Byrne as Wilson's love interest apart from a single scene comes across as a postscript. Aasif Mandvi as the internship programs head Mr. Chetty is stereotypically brilliant and the short chemistry he shares with Billy is entertaining to watch.Brilliant chemistry between the leads along with wonderful supporting actors makes you forget the flaws and plot holes blatantly staring at you. You just go along with that warm fuzzy feeling with a smile plastered on your face.",The Internship
132,Rebel_With_A_Cause_94,"Entertaining, but very Forgettable",6,28 November 2013,"I love Vince Vaughn and Owen Wilson and while I wasn't expecting Wedding Crashers, I was hoping The Internship would at least be another good comedy for the comedic duo. While it defiantly has some good moments here and there, this is a very predictable and forgettable comedy.As many have said, it is a bit hard to get past all of the Google product placement in the film. Vaughn and Wilson are good, but this really felt a the kind of comedy that should've been released in the 80's. The plot is predictable and cheesy. Also, there is no reason this film needed to be 2 hours. It was way too long and got boring after a while. Not really a good comedy even though it had some funny moments. The best parts were in the first 45 minutes.Not the worst. Not the best.",The Internship
133,taylor_king-890-815491,Can I Get My Money Back?,1,11 June 2013,"This was one of the worst, most boring, poorly scripted movies I've ever seen. Clearly Vince Vaughn and Owen Wilson are on the downhill slide as actors, and their attempt to revive the energy in ""Wedding Crashers"" was a dismal failure. There were so many contrivances to create laughs, and the film failed on every count. When we viewed, there were maybe 20 people in the theater, and not one chuckle or laugh was heard. There was one scene with Vince, Owen and Will Farrell that tried to revive ""Wedding Crashers"", but was so lacking in humor, it was truly grotesque, and completely mean-spirited. The writing on this film was below sophomoric level, and camera work, editing equally sub-par. If the producers were trying to portray a high tech company, like Google, they failed miserably. If they were trying to parody high tech culture, they also missed it by a mile! Thumbs down, my friends. This is a real dog.",The Internship
134,gatsby601,Google Commercial Disguised as Heartwarming Buddy Comedy,1,8 June 2013,"First off, like most of you, I loved Vince Vaughn and Luke Wilson in Wedding Crashers and like most of you, I went into The Internship hoping for more of the same.What I found was a very safe, very by the numbers 'under dog' story featuring two ageing salesman trying to start over in the tragically cool world of Google employment. Vince Vaughn and Luke Wilson are two veteran pitchmen who learn their current company has just gone out of business and, in a reality only Hollywood could create, there are no other sales jobs anywhere in the universe! We know this because Vince spends 3 minutes using Google (not Workopolis or Monster??) to find a new gig only to have a sudden and unexplained epiphany that the search engine he's using to find a job IS the job. Deep.What follows is a stock plot about the seniors taking on a group of outcast geek interns and teaching them to party, keep it real and - this is new - there is more to life than computers.The film, written by Vaughn, plays it very safe, heartwarming feel good lessons replace well, comedy.On the positive side, if you want to learn A LOT about the hipster, self absorbed world of Google this film is for you. Nowhere is the mega company joked about, ridiculed, parodied or in anyway presented as anything other than the ideal final destination for everyone on the planet who wants to ride silly colored bicycles and waste their lives typing code.Rent Dodgeball. A FUNNY Vaughn movie with the same plot.",The Internship
135,Alexander_Thomas_Wilson,Good But Could've Been Better,6,7 February 2014,I really love Owen Wilson & Vince Vaughn I think they're incredible as a duo . Loved their previous collaborations in Wedding Crashers and Starsky & Hutch . The third one together they had a great performance which is the main reason that I watched this movie but I don't know could've been better . There were some really funny parts but not to complete it into a great awesome movie . Maybe it was something with the script maybe I don't know just didn't fulfilled that great laugh that I had their previous films . Loved their performances though that's what made this movie good and I love to see them working again in another project . I give this movie 6.8/10 !,The Internship
136,ben06,I dunno what sucked worse the comedy or the storyline,1,11 January 2021,"This is an appalling movie.
The jokes are absolutely terrible, the story is absolutely whack.
2 talented salesmen lose their jobs, end up (by choice) at a Google internship with a chumped up bunch of little brats with zero social skills.
These once talented salespeople undergo a bunch of tests they're completely unqualified for! I mean it's just CRRIIIIINNNGGGGGEEEE!!!!!!",The Internship
137,hhenshiri,nice movie,6,3 October 2019,Very nice shows that nothing is impossible and anyone can be as he wants with a very beautiful comic template worth seeing,The Internship
138,samgreer-694-680740,I heard that one before,5,9 June 2013,"Let me preface this by saying I love Vince Vaughn. Its impossible for me to watch any of his comedies without laughing, and I think he's nothing short of a brilliant comic actor. That's why it pains me to write this review.This movie has funny parts. Nothing that will make you lose control of your bladder, and despite what some people have been writing, this AIN'T no Wedding Crashers. This movie is more like an e mail you got 4 years ago that was hilarious, and someone sent it to you again. You forgot about it, opened it, and remembered how funny it was, but no joke is as funny the second time around. Big lack of originality here and Will Ferrel's character was not remotely funny. Unlike Wedding Crashers ""Chaz"" this character was more like the Starsky and Hutch cameo. Wasn't impressed with that, wasn't impressed with this.When you get the same group of actors together for ANOTHER comedy, you better have some seriously different writing. This movie badly needs some situational / physical comedy. Charles Xavier and the antagonist punching people is weak and lazy writing.There was one Mr. Bean quality situational comic scene in the movie that was brilliant featuring one of the supporting interns at a strip club, and you'll instantly recognize it when you see it. Other than that it relies heavily on jokes in dialog - which aren't bad. They are witty, and Vaugh's delivery is great. It's just that I feel like I've been there and done that. Wilson's love interest felt totally scripted to me - I'm not buying any of that, not for a dime. Waaay too rushed into instant love - kind of like, but even worse than, Wedding Crashers.If you choose to see this in the theater, go to a matinée. It isn't worth full price. I'd definitely watch it once it hits RedBox or Netflix. Well worth a couple bucks - $30+ at a theater, not so much.",The Internship
139,votesmall,"It's not perfect, but it's an above-average buddy comedy",6,25 November 2013,"Know what I love to do that I haven't done in a while? That's right! I sense a rant coming on!Okay, so it isn't actually a rant per se. More of a review since I did have a soft spot for tonight's film, called ""The Internship"". Although it's quite possibly the most derivative comedy I've ever seen, it did keep my attention and the ending made up for its flaws. Even though it was predictable, drawn out, overly sappy and sub par in almost every way, there was a certain charm to the film that contained just enough jokes to keep you laughing and just enough moments to tug at the old heartstrings. My only two real complaints about this besides a stunning lack of originality is the random Flashdance references that were not entirely accurate and the random, out of place strip club scene. While I'm glad that I didn't see this one at the theater, I am glad that I saw it. It's certainly not the worst comedy I've ever seen (Jack and Jill) but it also isn't the best (The 'burbs or A Fish Called Wanda). At the very least, this film is adequate but if you can get past the fact that it's essentially just a two hour Google commercial, it's worth a watch and sure to get you some laughs, despite the fact that many jokes are tasteless and drawn out. It certainly is better than anything Sandler has done since Click (and sure as hell better than Grown Ups or Jack and Jill) so for that I will give it credit for not relying on gross-out gags and sickening ""morals"". At the very least, the Internship is a return to the basics. Some will call it a nostalgia trip, myself included, to a time when Sandler films were actually good and films, although predictable, left you feeling good. This film left me with mixed feelings, owing mainly to the repetitive plot, product placement and script bogged down with drawn out jokes and stereotypes (particularly the scumbag villain). But all that is forgivable because in the end it is a simple tale about friendship and the American Dream, largely benefiting between the chemistry of the two leads. There was a poignant scene where the kids talked about how they felt hopeless and after the film ended I realized that I may have been too harsh on the first half because the second half completed the story arc and proved that if you believe in yourself, anything can happen. This is essentially a subtle modern fable disguised as a sub-par comedy. Fables teach. Bravo, Vince Vaughn.",The Internship
140,Rage-Kage,Not the best but pretty good,7,9 June 2013,I saw the trailer for this movie for the first time like 2 weeks before seeing it and I thought it looked like it could be good. Well its not the best movie ever I was right to think it would be good. It was entertaining and just an overall good time.One of my favorite things about this movie were all of the nerdy references to things like Harry Potter and X-Men but also the more obscure 80's references that I admit I probably did not catch all of. Owen Wilson and Vince Vaghn were very good in this movie they both have really good chemistry with not only each other but the rest of the supporting cast. It was not the funniest movie I've ever seen but I was surprised out how sucked into the story I was.So overall not the best but an enjoyable ride I give The Internship a 7/10,The Internship
141,shivam-hora,Version 8.0,8,4 April 2014,"This movie was just the right amount of cool and fun. The movie kicks off with two unemployed middle aged men hoping to get a job in Google. Somehow they manage to get an internship in the billion dollar company. And then what they face there is a 'some kinda mind hunger games' , where they have to work with a team of other misfits. Somehow they are expected to out-show the other 95% interns and get a permanent job at the company.Vaughn and Wilson do a great job on screen , from sales to technology they are seen exploring every little challenge that comes their way as interns.Ferrel is seen in a guest appearance as in 'wedding crashers' , however this time he's a little more of a perv and badass..The story line plays very well as do the characters.Take it from me, this movie will show you a good time..",The Internship
