,User_name,Review title,Review Rating,Review date,Review_body,Movie_name
140,elliotte2,Tries to be a little of everything and fails,3,10 January 2020,"This was bad, really really bad. Movies steals, er borrows heavily from Aliens, The Descent, The Meg and never stays on point long enough to follow.1. First of all, Kirsten Stewart cannot act. We already knew that from the Twilight series, but figured with a different genre, writer and director maybe she could halfway manage(like Kneau Reeves in the Wick movies). Answer? No. From scared, depressed, death, excitement or curiosity, her face never changed or showed any visible emotion. Sadness.2. Director definitely took the Game of Thrones route of showing what you believe is action but in complete darkness, quick editing and shaking cam so that you have no idea what is going on. In several scences, you could not tell that someone was missing(nor did you care anymore).3. Yes, there has to be manufactured drama so a movie can exist, but a movie should not depend on manufactured drama from beginning to end. In movies where people are astronauts or divers, it takes years of training and psychological analysis to even be picked. Here all the of crew are SERIOUSLY mentally and/or emotionally incapacitated and this is quickly established in each character's initial statements.4. Science? Do not get me started.You are yelling at the screen and really have no sympathy of care for any of the characters, just a multi-million dollar waste.",Underwater
141,darkreignn,Kristen Stewart brings this movie from stunning to breathtaking,5,13 January 2020,"Wow. I thought Kristen Stewart was beautiful in ""Charlie's Angels,"" but ""Underwater"" takes it to a new level, and not just because the film takes place a billion miles under the ocean. For the last act of this film, Kristen Stewart romps around in just her underwear, and I found it increasingly hard to not pull a Pee-wee Herman in the theatre.""Underwater,"" directed by William Eubank, was apparently filmed in 2017 and is just now releasing to kick-off the new year, and the new decade. And what better way to kick it off then to see Kristen Stewart half naked and glistening from water for the majority of the film? In all seriousness, besides Kristen Stewart's incredible body, there is some other stuff to enjoy in this movie. For one, the direction and cinematography are pretty good. The movie has a distinct look, and it's clear the director had a vision for what he wanted to see. From the very beginning, the movie looks great, very crisp, clear, and eerie. When we finally see inside of the underwater vessel and get our first glimpse of a tantalizing Kristen Stewart, the camera pans slowly, allowing you to get a good view of not only her body, but also of the vessel itself; it almost reminded me of a Ridley Scott type shot, and it's evident that ""Underwater"" takes inspiration from Ridley Scott movies. And when things get going, they really get going. The movie has a kinetic pace that never lets up once it starts, and there is a lot of thrills to be had here, especially during the sequence when the vessel first starts to breakdown. Also, there is a third-act creature reveal that is, bada**, to say the least. Unfortunately, where ""Underwater"" shines the most is also where it fails; i.e., the pacing.Yes, we all love fast-paced films that keep you feeling a sense of tension throughout the entire running time (""Uncut Gems,"" for example). However, ""Underwater"" has pacing so incredibly quick that it makes the movie almost incomprehensible, and not just because of how dark and shaky it is. Seriously, this movie needed a brightness boost and a camera stabilizer because for the majority of the movie I could not tell what was happening and who it was happening to. At one point, one character gets dragged by a monster (or maybe an Octopus, I'm really not sure), and when they show who got dragged I was like, ""Oh, I thought it was someone else, I didn't realize it was this person being attacked."" Like, sure, in the beginning the shaky cam actually was effective, but only because it was used in a well-lit environment where everything was crystal clear. Use that same shaky cam in a dark, poorly lit environment, and suddenly you realize that shaky cam is never a good idea.Also, there is a notable lack of character development in this movie, again, because of the pacing. The movie kicks into high gear almost as soon as it starts, not leaving any room for meaningful characterization, which means you'll barely care about what's happening and who it's happening too. The only character I even remotely cared about was Norah, solely because she was played by Kristen Stewart. And that's a shame, because the cast and the acting were all fine, they just needed more to do other than run from one set piece to the next.""Underwater"" is an okay movie for quick thrills, and I'll probably buy it to add to my ever increasing Kirsten Stewart collection, but a lack of characterization coupled with the incomprehensible pacing keeps this from being a recommendation on my part.5/10",Underwater
142,chubarova,Film for one time.,6,6 April 2020,"This film is typical ""crash"" one. Main characters try to deal with unsuspecting crash of deep water station. Of, one of them is a leader, they have 2 persons in love, person, who jokes a lot, couple of men, who dies first and true hero. This film has all of them. Typically, this film has a question: what happened? The end of the film, of course, is positive with a little bit negative shade. Visual effects are good, the main beast looks like Ktulhu.
Do, this film is only for one watching.",Underwater
143,johnsmithjanuary-20081,underwater..alien movie,3,8 November 2021,"No killer sharks in these one but that didn't keep them from putting aliens in the depth of the sea, and from that point the movie becomes pretty generic and predictable. However if you like alien films maybe you'd find this entertaining.",Underwater
144,rehmankhilji,Poorly made,3,3 April 2020,"Yes, the movie is poorly made. First of all its just start, dont know why the maker just started the movie like that, a little lower pace would have been better. Further, as they are in sea with no light to see, so are the audience clueless as to what is going on.
This movie could have been made better in many many ways.
Waste of time for me.",Underwater
145,galahad58-1,Drowning,2,15 April 2020,"A bad remake of ""Deepstar Six"". Terrible acting - especially Stewart - who I do not understand how she stays in the acting business.",Underwater
146,brunovanael,Underwater Alien,5,18 August 2021,"An underwater version of Alien. Not all that bad, but only good a few times.",Underwater
147,tmccull52,Solid Effort,8,10 January 2020,"Before seeing this movie, I had read reviews (not on IMDB) that panned this film, and essentially called it garbage. Being a fan of sci-fi/horror films, I had made my mind up to see the film, despite the poor reviews. I don't know what movie those critics had watched, but I found myself liking to this movie very much.I am not a huge Kristen Stewart fan; actually, I think she's kind of a flake. She turns in a solid performance, and makes for a fairly decent action star. T.J. Miller plays his usual funny guy that dies character, much as he had done in ""Cloverfield"". Everyone played their parts well.The tension and suspense start fairly early in the movie, and pretty much maintain a taut edge until the final few moments. The film has elements of ""Alien"", ""The Abyss"", and ""Cloverfield"". The ending leaves room for a sequel and if a sequel is made, I will definitely go and see it.",Underwater
148,Nemesis42,Character development substituted with subwoofer boom.,5,24 February 2021,"Action without rapport with characters creates a forgettable viewing. I was bored through the majority of this. Lucky I'm too buggered from work to care. Most of the time it was difficult to tell who was where and what was happening. Spacial orientation for the viewers was bad when they were 'water-walking'.
And ye ol' subwoofer was running hot. Too much bass, too much of the time, which diminishes the moments where extra impact is really needed.The character chemistry which exists in say The Abyss was not present here. If the script lent more time to us so we could get to know them and their communal relationships, it would have booted the film. You could see the actors trying, but they were limited by the script, or badly directed or someone edited the crap out of them.If you are a fan of any actors in this you'll probably get something out of it.",Underwater
149,kevinxirau,An okay dive into the horrifying unknown.,6,25 May 2020,"What if you take the basic premise of ""Alien"" and set it in the deep sea? You get ""Underwater"", directed by William Eubank. It's one of the last films released by 20th Century Fox before Disney bought it, which led to it being released at an unfavorable time for cinema. This contributed to it being swept under the rug, which is kind of a shame since this film has a few merits.Plot: The story centers on a drilling crew (chief among them Kristen Stewart). The group were working at the Mariana Trench, the deepest part of the world. However, there are some places man was not meant to dig and, sure enough, they end up awakening something hidden in the dark depths. This forces the gang to risk venturing out to find a means of escape while being hunted by monstrous entities.A good method to sell horror is isolation and there are few places more terrifying than the deep sea; darkness, cold, intense pressure, and life forms too alien to describe. The cinematography is done well, bringing forth claustrophobia within the station's cramped halls and the characters' POV when they walk outside in diving suits in low visibility. The horrors plaguing the crew, while not scaring me much, are effectively creepy. Though obscured by the environment much of the time, the film shows just enough for the viewer to get an idea of their appearance. Further details sprinkled throughout indicate something out of Lovecraft's playbook. The characters are kind of meh. None are bad, in fact a couple I liked such as T.J. Miller, but none leave a big impression outside decent character moments and interactions. Kristen Stewart, while not a great actress, at least has more to do here than let sparkling vampires whisk her away. Part of the issue is that after the cool opening credit sequence establishing the setting, the chaos happens almost right away, leaving little room to familiarize with the crew members before their perilous journey. I will say I didn't quite expect the conclusion to play out the way it did (in a good way).""Underwater"" admittedly doesn't offer much that's Oscar worthy and even I wouldn't call it one of the great horror classics. That being said, the setting and presentation do make it stand out, resulting in a passable experience.",Underwater
150,dakjets,The idea was probably good,4,9 January 2021,"I like horror movies, and had some expectations for this one. Ok actors and basically is exciting enough. But if there are to be monsters, there is always a bad sign in such movies when we hardly see them. In addition, the script is not very inventive. Most have been stolen from Alien, but without the nerve and excitement. But there are more than enough doors that do not open, and closed escape routes. And low oxygen levels to the repetitive ... Without it helping anything. We've seen most things before, but maybe not in this environment. Not scary enough, and surprisingly few monsters. When they first show up, it's not very exciting. Below average this.",Underwater
151,yvesdemaria,Very good sci-fi action,8,30 March 2020,"Take the movie at face value, for the sci-fi action thriller it is, and for the atmosphere it pulls you in.Dont overthink it or try to use current technology and human knowledge to judge it, if you do that then using the same principle you simply cannot watch star wars, alien, terminator, etc..8/10",Underwater
152,tfminfl,A Monster at the Bottom of the Sea story,7,21 January 2020,"379. Underwater. A straight to the action, claustrophobic thriller. Story begins with scantily clad Norah getting ready to start her shift at the laboratory at the bottom of the ocean. And by the sudden alarms going off and the entire structure rocking back and forth, something went wrong. it's an earthquake, and its tearing the place apart. And so it's on to find others and to get to escape pods. Oh the earthquake also woke something up down there, and it's big. Who knows maybe its there just to say hi to the new neighbors, but it doesn't really look that way. Because the movie mainly focuses on action, we never really get to see Kristen Stewart make that awkward face, you know what I mean, so that was a plus. TJ Miller was in it, as some kind of odd man-baby scientist, so I thought that was pretty stupid. Overall it was a decent action sci fi flick. Just remember like a famous Jedi once said: ""There's always a bigger fish."" Filmbufftim on FB.",Underwater
153,Bertaut,"A well-made creature-feature; it may not be original, but it is entertaining",7,23 February 2020,"The last film distributed by 20th Century Fox before they were rebranded as 20th Century Studios by Disney, Underwater was shot in early 2017 for $50 million and then sat on a shelf for over two years. Now that it's finally seeing the light of day, there's a real sense of Disney just wanting to be rid of Fox's clutter, and they either didn't know how to promote it or didn't want to promote it, as the marketing campaign has been next to invisible (and the bland title certainly doesn't help), with the film grossing a paltry $7 million in its opening weekend. From Disney's perspective, of course, releasing it in the January release window makes sense, as it's a period traditionally dominated by duds and cast-offs - films the studios don't care about for one reason or another. A recent high-profile example is Blackhat (2015), Michael Mann's underrated cyber-terrorism drama, which was released with little to no advertising, grossing only $20 million at the North American box office against a $70 million budget. However, much like Blackhat, Underwater is considerably better than most January releases. Sure, it's clichéd and predictable, and it shamelessly borrows from a litany of superior genre films, but it's also a very entertaining and enjoyable aquatic creature-feature.At an unspecified point in the future, Tian Industries, the largest drilling company in the world, are attempting to drill into the ocean floor at the bottom of the Mariana Trench, almost seven miles down, with atmospheric pressure over 1,000 times that at sea-level, strong enough to crush a human body so completely that there aren't even any remains. As the film begins, Kepler Station, the crew quarters of Tian's massive drilling rig, is hit by a series of unexplained vibrations, causing a cascading pressure breach. Norah Price (Kristen Stewart) and Rodrigo Nagenda (Mamoudou Athie) are the only ones to escape, sealing off the area so as to slow, but not prevent the inevitable implosion of the whole rig. Heading first to the escape pod dock, they find no pods left, and in the control base, they're unable to contact the surface. Meanwhile, they encounter some other survivors - Cpt. Lucian (Vincent Cassel), Paul Abel (T.J. Miller), Liam Smith (John Gallagher Jr.), and Emily Havisham (Jessica Henwick). With their situation grim, Lucien says the only hope they have is to use pressurised suits to walk the one-mile distance to the Roebuck Drilling Station and use the escape pods located there. And so they descend to the dark ocean floor. However, as if their task wasn't daunting enough, they soon discover that they aren't alone.Written by Brian Duffield and Adam Cozad, and directed by William Eubank, Underwater walks a very fine line between rip-off and homage. The most obvious touchstones, both narratively and aesthetically, are Alien (1979) and The Abyss (1989), but one can also see the influence of films such as Leviathan (1989), Event Horizon (1997), Sphere (1998), and Sunshine (2007). I even detected a slight nod to The Descent (2005). In short, the set-up is your classic ""group of isolated people getting picked off one by one"". When someone as talented as Danny Boyle turns his hand to this template, the result is a near-masterpiece. And although Eubank is most certainly no Boyle, Underwater is a lot better than its lack of advertising, clichéd premise, bland title, and generic trailer suggest.Sure, it isn't really about much of anything. There's a vague ecological theme that's brought up a couple of times, with Emily talking about how humans have drilled ""too deep"" and are now suffering the consequences, but really, it never amounts to anything even half-way substantial. In all fairness though, who would be expecting thematic complexity anyway? You know what you're getting with a film like this, and the best you can hope for is that it looks good and is entertaining. And Underwater is both.Kicking into high-gear immediately, the film wastes no time whatsoever in getting to the action. The opening scene is the Kepler implosion, and it's a good five minutes before things calm down. Alien takes its time getting anywhere, introducing us to the aesthetic of the Nostromo, then the characters and their relationships and milieu before it all kicks off. In essence, Underwater is the inverse of that, with all hell breaking loose before we know much of anything about anyone. Indeed, the only character we even see, let alone get to know, before the implosion is Norah. I certainly wouldn't want every film to open this way, but it has an undeniable kineticism and appealing volatility, which Eubank does a decent job of maintaining throughout the next 95 minutes.Aesthetically, there's a lot to like here. Production design is absolutely paramount in films like this (think of how important design elements are in building tension and establishing tone in Alien or Event Horizon), and designer Naaman Marshall does a fine job, with the world feeling lived-in and authentic. Making especially good use of tunnels and low ceilings, there's a real sense of claustrophobia, which only lets up, ironically enough, when the characters are outside the safety of the rig and exposed to multiple dangers. This claustrophobia is aided immensely by Bojan Bazelli's cinematography. During scenes outside, Bazelli often shoots from within the characters' helmets, and even when the characters are inside, he often shoots in tight close-ups, simultaneously anchoring us to their perspectives and heightening the sense of enclosure and pressure (both literal and figurative). When outside, the film uses the limited visibility to its advantage in establishing a tone of ominous danger. Some will probably find these scenes too dark, but I'd argue that that is precisely the point; the characters can't see much of anything, and neither can we.Elsewhere, obviously inspired by H.P. Lovecraft, particularly Cthulhu, Abner Marín's creature design is suitably creepy and grotesque. The aesthetic element that really stood out for me, however, was Wayne Lemmer's sound design. The implosion scenes are accompanied with some bone-rattling LFE, whilst the ominous ambient sounds of the Kepler are a constant reminder that the station is on its last legs. The scenes outside are equally as impressive, with some excellent use of directional sound as the action shifts location on screen - it's a film that I would imagine will sound incredible on a 7.1.2 Atmos system.In terms of problems, there's a rather unjustified use of voiceover to bookend things, explaining the moral of the story; it's wholly unnecessary and has the effect of making the film feel like an episode of The Outer Limits (1995). There's also next to no characterisation. We learn bits and pieces about Norah and Lucien's backstories, but apart from that, the film is peopled by perfunctory cardboard cut-outs with no sense of interiority. Eubank also seems somewhat confused as to whether he's making a disaster movie or a monster movie, with certain scenes and elements suggesting one or the other. However, he never really finds a middle-ground, giving the film a slightly schizophrenic tone.Although Underwater never manages to rise anywhere near the heights of films such as Alien and Sunshine, it deserved better treatment than it received from Fox and Disney. Given the January release, the clichéd setup, the two-year limbo, and the bland title, I wasn't expecting much from this, but I was pleasantly surprised. It won't change your life, but it's an entertaining and well-made creature-feature.",Underwater
154,celt007,Not original,3,30 March 2020,"Alien but underwater creature and underwater station instead of space station . Near the end they have the protagonist running around in her 2 peace with some leggings ... nice body other than that the film is just ok .
I like Vincent Cassel he is good in this ... need to see him in more features .",Underwater
155,Lewis_Heather787,"Simple , Interesting and Entertaining !",6,18 January 2020,"Its nice once in a while to go in to watch a film just for some good popcorn fun / entertainment ! Its January, which is notorious for being a dumbing ground for film studios to put out the films they have absolutely no faith in whatsoever to be good. Now and then very rarely you do get a decent film in the month, I'm glad to say that ""Underwater"" surprised me a bit and ultimately deliver what I wanted. A simple/basic story, some interesting characters you can get behind, some nice CGI and maybe some nice scares/suspense along the way.So with that in mind I went in completely cold, didn't watch a trailer for the film....I hadn't even read the synopsis of the film. Maybe that affected my viewing of the film..........I had NO expectations !Its just all round good fun! Simple story, an underwater mining facility is mysteriously breaking apart/ being destroyed.........the group of survivors inside have to figure a way to get to safety and to the surface ! Bang ! Simple enough for anyone to follow, check ! Next some interesting characters to follow, you've the stereotype of everyone in this film. Kristen Stewart, the smart, brainy, quite one which the film centres around. Vincent Cassel, the leader of the base, old and wise. TJ Miller the comic relief, obviously ! Jessica Henwick, the doctor, I think ?? Who is terrified and screaming all the time and lastly John Gallagher Jr, the chilled pilot sort of guy!!! They are all stereotypes but they all do their job in this film very well, there is a good team dynamic throughout !! Great CGI of the base braking apart and the suits they walk in, also nice design of the creatures !! Lastly some decent scares...........and some really nice suspense driven scenes ( Well pretty much the last half of the film is pretty near the edge of your seat..........its not that good enough to be on the very edge of your seat, but close )Cliche deaths,Yes !(Surprisingly Gory) Cliche Ending, definitely Yes ! Do I care, No ! Not every film has to be overly complex, long, overbearing, emotionally driven and sad/depressing. You can just to watch a standard science fiction film and enjoy the ride, everything about and in this film is absolutely fine......its not going to change the world and it doesn't have to.Overall its 65% out of 100 its a decent/ ok film.............I wasn't expecting much or anything and actually enjoyed the experience..........Good directing, acting , script and definitely runtime !!! Oh what a great idea of making it 1 hour 30 mins.........the film gets you up to speed with whats going on quickly and it never really stops after that..........the film flies by. I'd recommend it, if you've never seen it or if you've got nothing else to watch............its decent all round !!!!",Underwater
156,elgrampo77,Actually quite ok,7,23 August 2020,"Sure it had some flaws, like crashing the helmet with a fire exstinguisher when 6 miles of water pressure could not break it, but still quite a decent movie with references to many classics.",Underwater
157,kenzibit,Reference audio material.,6,2 April 2020,Simple movie with a small cast with lots of jump scares and reference audio sounds to test you surround system. Not too bad of a movie.,Underwater
158,rochfordsimon,It's ok. But unfulfilling.,4,11 February 2020,"It's worth a watch if your into Sci-Fi.
It's a hybridization of a number of past genre movies.Very dark screen at times. I wanted to give them a push at times to hurry along and get over dragged out scenes.The voice over at the end ruins any finalistion the protagonist was building towards.",Underwater
159,Celewa,C+ (high 5). January 20' @AMC,6,22 February 2021,Dark scenes and muffled dialogue is frustrating. Solid performances but not much characterization. Good ideas here and decent atmosphere.,Underwater
