,User_name,Review title,Review Rating,Review date,Review_body,Movie_name
368,carinnalowther,This is different,7,7 May 2020,"This is not a typical Hollywood action, and it's not really a horror either. Nothing is explained in the beginning (unless you are paying attention during the credit parts). However, I think this lack of introduction is an interesting artistic choice. Because if you give it some time, each of the actors portray very different characters and they all have reasons to be loveable (yes even the stone faced Stewart). I also felt that the tone reflects the realistic feel of the emergency, which is shattered a little at the end with the sci-fi monster bit. Overall I was pleasantly surprised.
As unsupervised as I am that the Hollywoodgobbling masses did not eat this up, I am surprised the critics didn't read between the lines of this movies, because if your looking there are several interesting philosophical questions posed along with some social commentary.",Underwater
369,calivsey,Stream It,5,30 January 2020,"Underwater makes up for its derivative plot with satisfying action and impressive visuals, along with a charismatic performance from Kristen Stewart. Though the film is little more than a generic sci-fi thriller, fans of the genre could do much worse. Go in with reasonable expectations and enjoy the ride.",Underwater
370,curtinleslie56,Wonderful new horror movie,7,12 January 2020,A real surprise and kept me fully entertained from start to finish,Underwater
371,freshorange,Characters = ZERO,4,23 March 2021,"A film that could have been great if it had been more about the characters and their backstories. Kristen Stewarts performance is solid but the figures in general are drawn as flat as a sheet of paper and have no depth whatsoever. As a result, you remain completely unaffected whether someone injures or dies, which completely takes the tension off the film. Pity!",Underwater
372,tandeki,Horrible movie,2,26 April 2020,"Nothing makes sense here. There is no story, no character development and no suspense. You simply do not care if the main characters in this movie die or not, because no one tried to make them likable. And yes, Kirsten Stewart is the worst part because she simply has only one and a half facial expressions. And when she recites her lines, every sentence is mumbled in the same way. She should change to audio books because she is obviously way better when she narrates her character's thoughts. Also, the movie painfully does not care about the most simple laws of physics - or logic in general. But overall it is such a shame as the setting and the budget could allow gifted people to make a movie which is compelling and suspenseful. But unfortunately, Underwater is not that movie.",Underwater
373,kevin-ac,Meh,4,24 October 2020,"Watchable but we've seen this before and done better
The plot was too see how many times they could show Stewart in her undies only to blow herself up to destroy the Kraken and the deep sea Aliens (rip off)",Underwater
374,baracuda1974,"Pointless movie, but cool suites!",4,29 March 2020,"First off, why Boring Kristen Stewart for this movie? Even when you have to show some emotions l, like, being scared, she can't do this to save her ass! Secondly this is such a rip off from Aliens but make the alien bigger. Most of the movie you can't see  as the director did so it would hide the imperfections of the CG. So please skip this movie till it come out on HBO or you can watch it free.",Underwater
375,DontKnowMuchAboutFilms,Not a bad watch,7,16 January 2020,"Stewart and Miller do a great job in this movie. It all kicks off in a hurry and it just keeps going after that. Run of the mill action sci fi flick but it was enjoyable.
🎬",Underwater
376,bluenoseneil,Gripping! Don't listen to anyone rating this low!!,9,6 May 2021,"Amazing pace, dark and claustrophobic. Good special effects and tension maintained throughout. I'm giving nothing of the story away but YES it's been done before but this is good.",Underwater
377,lisah2020,A big disappointment,4,14 April 2020,From beginning to end it felt like I missed something. It started as if it was the middle of the movie. Who are these people? Why are they here? What was the point? Like really guys....... WHAT WAS THE REASON!?!?!?!,Underwater
378,anupn-79097,Just about ok,6,18 January 2020,"I went to watch the movie on the big screen expecting a decent underwater monster thriller movie. But was kind of disappointed, the movie had only a couple of scares, few claustrophobic sequences and didn't have the atmospheric thrills that one would associate with such films. The monsters were strange looking and couple of them are shown so gigantic that you wonder how they never surfaced and went undetected on earth so far. The ending is also a letdown.What works is Kirsten Stewart as the lead protagonist. She is excellent and Vincent Cassel supports in a brief role. There are few scary scenes and most of the underwater sequences are filmed very well.So, this is just another monster movie but without many thrills. Give it a miss.",Underwater
379,LansTaylor,Lame,5,9 April 2020,"I went into this movie only knowing that it was filmed in 2017 and finally being released in 2020. I know it's not the producers fault (studio changed licensing) but the fact that the movie took its sweet ole time to be released is a telltale sign that it's not going to be that good.
Anyways, on to the movie. First off, what's with the random lame slow motion? Just every once and a while they felt the need to include a slow mo shot. Second, the script was kinda meh. It didn't really flow too well, I know, I know, it's just a crew trying to get from one station to the next, how much dialogue could there possibly be? Well, if I was trapped underwater with little to no visibility, I would be communicating what I see, what's ahead, if everyone was alright, what's the plan etc etc. A lot of people are complaining about the color grading and I didn't really have too much of a problem with it. It's just a greenish hue, which kinda fits the deep underwater theme. Also, the guy who died at the beginning when his helmet cracked, why didn't he say something so they can organize another plan? I mean clearly the scientist chic was scared of going outside the station so she could've easily stayed behind and wait for the others to bring help back. I'm also curious to how much the pods can carry? Certainly two 110 lb girls can fit into one pod right? I'm sure they have plenty of workers down there that are bigger than both those girls combined. I get it, there has to be a big final sacrifice so we can have a hero.
With all that being said, I do have a few good things to say about Underwater. First off, when KStew was being eaten by that hydro predator thing, that was pretty cool how she was able to escape with the flare. I also like when she shot up the flare out into the abyss and we get a reveal of the Cthulhu. That was mega dope.
Overall, a somewhat okay film with okay action. I wouldn't recommend for people to really sit and watch but it's a good film to watch and it's airing on TNT and there's nothing else to do. Even with that, I'd still try to find something else to do.",Underwater
380,blondeblue1,"A giant steaming pile of crap. Really, really dark crap.",1,15 May 2020,"First of all, the positive reviews here have been bought and paid for. Or they are all written by the cast and crew under pseudonyms. There are not enough words in the English language to adequately describe the putridness of this movie.The plot summary is this: a group of unattractive, unlikeable, unappealing environmental criminals slosh around unintelligibly in complete darkness for an hour and a half, until the credits mercifully roll and the torture is at an end.",Underwater
381,busaman,"40,000,000 In The Wind Should Be The Title",1,27 March 2020,"Not every word written by man should be turned into a movie. 80,000,000 budget? Come on, no way.By looking at my review history you would think I would just stop watching movies. By the look of it eventually I will not have a choice. Good movies do not need my help to succeed so there is no point to review them. Wasting this type of money on something like this film though should be a crime. That is why I review these carp movies.People should get fed up and start boycotting this drivel. I guarantee there are still good original scripts. There is a trend of corporations now being scarred to offend these trash and cave in to these weird failure movies.Eventually the money will dry up, hopefully.",Underwater
382,chatwithmichaelmac,Pathetic,1,21 December 2020,"Lots of hysterical girl screaming - because clearly the Director thinks that what girls do in a 'scary' film.
Lots of ripping off of other films, especially Alien. This is so bad I don't know where to begin.
At least they cast a real-life comedian to deliver the bad jokes before...well, I won't give it away.
It's hilarious when you finally see the 'monster'. I mean seriously? Was their budget like ten bucks? The only decent thing. about this mess was Kristen Stewart's acting, She more or less holds this disaster together. Until...well I won't spoil it.
It's almost as big a mess as the Trump presidency...but nothing will ever be that bad.
Most of the film is closeups of faces in underwater suits. Riveting stuff.
Finally though, a film where you're rooting for the monster. It's just unfortunate the killing didn't extend to the technical crew, the writer and the director. Now that would have been a fun ending!
B A D D D D.
It's as if they took the worst bits that ended up on the cutting room floor out of Poltergeist, Alien 1-4 or how many they made, Sharknado (pick one), The Babysitter, Godzilla, The Exorcist Part 3, Saturday Night Live, Godzilla, The Lego Movie, and Hooters-the Movie and stuck them together randomly.
You know a movie is bad when one of the the last lines is...
""You know what we're sitting on? A lot of energy with nowhere to go"".
Wow. Profound. Wonder how long they workshopped that baby.
It's a total meltdown. Literally. They could at least have put a hot Gay guy in to make it worthy. But nada. Though you do get Kristen in a bikini. Close, but no banana.
I'd give it one squid. But only because I'm not a spoiler.",Underwater
383,lagunaedm,Decent movie,7,29 March 2020,"This movie isn't terrible, it's definitely something to pass the time.I understand people's complaints that it has no character development, and the ending wasn't my favorite. Yes technically it was not a good movie, but it is watchable.I don't think anyone will see this movie as a hit or a miss, just something in the middle that's not terrible to watch.",Underwater
384,robert-62387-55435,Could have been a lot better,5,22 November 2020,"This film could have a lot better if the started out with a 20 minute intro into the cast. So the film would have been close to a 2 hours movie where we are at least slightly familiar with the cast. Instead of going right into disaster of the earthquake that traps the cast in the underwater facility. Moreover, the cinematography is weak which makes it difficult to follow the under water scenes. They could have saved T.J. Millers character instead of killing him off pretty quickly into the movie. He was the most entertaining character in this movie. Also, the science was inaccurate, the smaller creatures would not be able to go between pressurizations of the inside water and outside water without exploding due to the extensive pressure of 7 miles deep under the ocean. If they had added introduction and better cinematography and corrected the science this film could have been a 7-7.5 rating overall.",Underwater
385,lmathc,A Quality Sci-Fi Thriller That Alien Would Be Proud Of,8,11 January 2020,"I love sci-fi horror movies. Alien, The Thing, Predator, and Terminator are all examples of timeless 80's classics that continue to captivate audiences. Sadly, today's movie theaters rarely see an entry in this category. That's why when I saw the trailer for Underwater, I was very interested.Underwater follows suit of its predecessors in being set in a very quiet, isolated, and claustrophobic environment. It's not the first of its kind to be set in the depths of the sea (see LEVIATHAN, THE ABYSS, etc.) but it does very well in giving the film a dark and otherworldy vibe. The musical score is phenomenal and is perfectly matched to the setting in its hauntingly beautiful chords.The cast is one of the best parts of the movie. Kristen Stewart shines as a very likeable and relatable protagonist. She's not indestructible or fearless but instead presents a realistic underdog reacting to terrifying circumstances. Her co-stars play off each other well in a way that is genuine and avoids horror movie cliches.This movie works best building tension and mystery. True, there are a few predictable jump scares here and there, but there is greatness in how Underwater chooses to not reveal everything instantly. Less is always more in these situations. The creature effects are cool and the sounds effects are intense.At the end of the day, Underwater might not be quite the monumental achievement its ancestors from decades past are, but it is intriguing, moving, and and captivating in its own right. The fact that a great sci-fi thriller like this can be made in 2020 gives me much hope for the future.",Underwater
386,artabuneta,When you ...,3,28 May 2020,"... actually wish for one or the survivors' speedy demise because your ears are bleeding from the nonsense they spout, things are probably seriously amiss in a survival horror movie.Underwater is essentially The Descent with stupid dialogues. The scientific impossibility of the underwater walks at a depth of over 8 km makes the whole venture as plausible and credible as a Spring Break movie set on Mars. Jesus!",Underwater
387,talatshah,Underrated movie. It's actually quite awesome.,8,14 December 2020,"Actors are great. Good thrills even scares at times. A fine Sci-fi touch in a subtle way. Mix of fast and slow pace with a good balance. Have to say kristen stewart is perfectly suited for the role.
Giving it a 8 to balance out the overall scores. It's a good thriller, scary movie that will keep you on your toes right till the end..!",Underwater
388,frankie142622,Ok Popcorn Flick,6,11 January 2020,"The movie wasted no time getting right to it. Action from the very beginning to the very end.Too many people go in to the movies expecting to be taught science, an education from actors in an action flick. When you walk into a theater with those expectations you're guaranteed for a let down. Or you're the group that believes and base their lives on ""actors."" Unless the movie is literally based on facts and true events, just enjoy it for what it is, a movie.This movie has good action, good suspense, and decent acting. It really uses the slow motion at the perfect times to be effective.With that said, they spend zero character building in the lead up. They try to fit in some back story of some of the characters right in the middle of all the action. A lot of movies spend too much time on this, this movie doesn't spend enough. If they did, it may have been slightly better.",Underwater
389,keith-w8888,Forgettable that's what you are...,4,19 January 2020,"Interesting to read that this movie languished for three years before being released, it would have been hard to justify it's continued existence. This contributes virtually nothing to the entertainment industry. Since underwater movies are a rarity one immediately compares it to The Abyss which had much more excitement, suspense, interest, charm, flair and mystery. Underwater has none of those things, shallow characters, little in the way of plot, awful CGI, nothing new under the sun. How many stupid clingy, bangy scenarios do we have to wade through in order to reach the end? The main character was well cast and played by Kristin Stewart, who puts in a solid performance but nothing can prevent this lack lustre clunker from sinking to the bottom of the ocean and remaining there forever. To describe this film as average does a disservice to average, forgettable, instantly forgettable.",Underwater
390,toddpchilds,"I went in optimistically, I really did...",4,31 January 2020,"I thought it MIGHT be exciting, which, some parts were, and I looked up reviews on IMDb and YouTube, and I thought I'd give it a go.As mentioned, some parts were exciting, but a lot of it wasn't. Poor character stories that did not work well with the plot, a lot was unexplained, the recording of the sound/voice track was terrible - I could barely hear the conversations that were happening and they were not whispering.I'll admit, I jumped on occasion, and I was a bit tense in some scenes, but it was a poor movie, and a lot just did not make sense.",Underwater
391,frequenzangriff,literally breathtaking,9,29 March 2020,"What is wrong with people, bashing this movie and giving it such low ratings?
Really a shame a movie like this noit getting the praise it deserves.It may lack originality, but it makes up with excelent execution.
First of it is made by newcomer filmakers, and one must give credit when its due.
Its faced paced, leaves the spectator anxious and at the edge of the seat from start to finish.Maybe people nowadays are just too used to the movies explaining everything?Also its awesome that they don't waste time on BS as everything is blowing up
right from the start (instead of wasting at least an hour of the movie before the everything goes to hell)
The effects are excelent, especially the ones underwater in the darkness, the suits are really cool and convincing (the actors used air tight suits that weight 63kg each), the station design is really interesting.And a fantastic surprise at the end whe it is revealed what actaully is attacking the station.As an avid sci-fi fan for the past 40 years, i loved this movie and i put it together with the tension and excitement i felt watching the 1st alien movie (to give just one example of many)",Underwater
392,treborquest,Research much?,3,23 April 2020,"So much is wrong with this movie, that I just tried to forget about everything and tried to enjoy it. For a second I thought I was watching a Cloverfield movie, but apparently it only has a few links to that franchise. IMO this is lazy filmmaking and wasted dollars. I only managed to finish it, knowing it was under 90 minutes without credits. If you wanna watch a movie, just go find something better than this. I'm gentle with the 3 stars I've given it.",Underwater
393,fred-pentagone,Alien underwater,4,25 May 2020,"Well ... I preferred Alien 🤣
It's just another catastrophy movie under the see 😒",Underwater
394,tro-76260,Zzzzzzzzz,5,3 July 2020,Wasn't expecting much got even less don't know why I rated it so high,Underwater
395,somcat,"Could be a good creepy one, but not",4,4 May 2020,"Starting the story seems to be a good one ,but spend most time with nothings clear No relationships in the team, what's wrong with the base .Just scream , running in the dark and die by pressure . No story or anything in her thinking. Kristen is good in another bad ones.",Underwater
396,thejeta,Holy Hair Clips!,3,3 April 2020,"When one of the main characters sports 3 silver hair clips in his fringe and talks to his little toy bunny, you know you're in trouble. Like his character, Underwater is equally nonsensical and poorly developed.",Underwater
397,A_winters_wolf,Alien clone (underwater),8,20 October 2020,"This film wasn't what I was expecting, in a good way. The film is clearly inspired by James Cameron's alien, you see a lot off similarities with the films. Set in a hostile unbreathable environment check. Female protagonist will be in just underwear and t-shirt for part of the film check. Crew have to escape exploding facility/ship check. Unknown hostile being hunting and killing them check. I enjoyed the film, I thought it was a lot better the I was thinking it was going to be. Clearly it isn't as good as alien because what is? But it still a decent film, I'm not sure why it has so many negative reviews I'm going to assume it's because it stars Kristen Stewart that poor girl gets a lot of hate. I thought her and the rest of the crew did a good job. From the opening scene this film starts with a fast frantic pace and keeps That going for the rest of the film. I wasn't tempted for a moment to pick up my phone and that's the best praise I can give a film these days the only negative I can say about the film is the creatures weren't the best CGI Your going to see. The film released in 2020 you would think the CGI would be much better. Other then that I thought it was good. I would say the atmosphere was the best part of the film. If you enjoy alien and are stuck for something to watch I say give it ago. But of course don't expect it to be on the same level.",Underwater
398,jayaxelhickey,Loved it.,9,28 July 2021,I loved this movie. A real hidden gem. I don't understand the low ratings. It's like aliens but underwater.,Underwater
399,lauren0531,Identity Crisis,3,16 May 2020,"What is this movie? Is it attempting to feel like ""Life,"" which was quite good, or maybe the older movie ""Sphere,"" which had an awesome cast, is it trying to be even the Lifetime low-budget movie ""The Core?"" ""Armageddon,"" any of the new ""predator"" movies... it didn't know what it wants to be. Bottom line: it's so much worse than any of those movies.The screenplay is ok, the development is zero, the clarity is blurred and skewed, the acting is... fine... I guess. Kristen Stewart acted very well in the first of the Twilight Trilogy movies, but has since shown very little versatility and has become so incredibly annoying with her nervous stutter and exact same facial expressions and tone. She does well in this movie.Not interesting, hard to follow, difficult to see anything at all, inability to understand the goal and how-to of saving themselves... so they use our inability to see clearly to throw in a ton of LOUD noise and cheap jump scares. Not scary. Not good. Not horror. Not thriller. Not worth watching at all. Watch ""the core"" instead or ""the abyss,"" or watch a Lifetime movie.",Underwater
400,daphleung,Human have to pay for being part of the destruction to a natural ecosystem.,6,20 January 2020,"Kristen Stewart (Norah Price) stars in movie as a mechanical engineer. Attracted by her icy-blond buzz cut, she intended to shave and dye her hair because with respect to (Alien)Can't u see the monster in poster? The answer s NO. It's attractive that shows mysteriously with a big bloody mouth. If you expect to see this monster, you may be disappointed, unlike other Science fiction movies, (The Meg, 2018) & (Life, 2017) the creatures doesn't show up usually. But with a dark, quiet scene, it's little terrifying when they suddenly attack the crewMany large and mysterious creatures are common subjects in movies, like Megalodon, Space creatures, Anaconda, Are they really exist. Since we only discover around 10% of the ocean, under the thermocline (between warmer n cooler water), temp decreases sharply and water is oxygen-rich, so giant creatures can be existing",Underwater
401,a_badwy,"Underwater"" remains a huge missed opportunity.",5,31 May 2020,"Not every word written by man should be turned into a movie
It's a man vs. nature film that asks if humankind has overstepped their position
The plot is crap and is full of holes",Underwater
402,mikeferguson,A Murky Mess,3,10 January 2020,"What went wrong:1. The movie starts at what should've been about the halfway point; we're thrust into the story just when all hell breaks loose, with no background for the characters or the narrative. We're given no chance to become invested in either the situation or to connect with the players.2. Roughly half the film is impossible to comprehend visually, both because of the murky, muddy scenes, and because of the rapid edits. Murky also relates to the sound, where a great deal of the dialogue, especially when they're in their underwater space suits, is unintelligible.3. The antagonists are ridiculous, given that at this depth, they too would be crushed by the pressure; and The Big Boy baddie is just completely unbelievable.Kristin Stewart is clearly making a conscious move back to mainstream films, as opposed to the arty but rarely seen films she'd recently focused on, but she needs to choose better projects if her plan's going to work.",Underwater
403,dannyloeper,Unnecessary hate.,7,17 January 2021,"I get that this movie is easy to meme on and it does have some glary problems, but I actually think this movie has quite a good atmosphere, and i felt myself feeling quite anxious throughout the whole film. I find it difficult to make a convincing movie that deals with not being on the surface and right from the start this movie delivered and just never stopped with the action. I also think Kristen Stewart did a phenomenal job with this role and overall I think this movie gets more hate than it really deserves.The main gripes for this movie come from the pretty one dimensional story followed by the obvious paths of the movie plot. I do think that the overall suspense and presence of the creatures makes it better, but its too easy to predict what would happen next. The ending did have somewhat of a ""twist"" but I think we all know that the big creature would appear at some point and either get destroyed or take people with it.Again, this movie does not shine from a plot point, but the overall atmosphere and approach to the design gives it some much needed points.",Underwater
