,User_name,Review title,Review Rating,Review date,Review_body,Movie_name
663,syrous-zarezadeh,Is this for real?,2,6 April 2020,"I am wondering why Hollywood wast that much money to make movie that you have no clue about it. There is no begging and no story who is who, just some dude do something to prove to make some money.",Underwater
664,damocles128,"Not a classic, but very entertaining",7,8 August 2020,"Obviously this flick is not going to win any oscars, but it is a highly entertaining bit of sci-fi escapism. T.J Miller is funny, Vincent Cassel is awesome, Kirsten Stewart looks great in her underwear. Something that obviously did not escape the directors attention, if all the lingering closeups are anything to go by. Its a fun/scary film, Citizen Kane it isn't. Favorite line from the film ""You sweet flat-chested Elven creature..."".
I gave it a solid 7/10",Underwater
665,kk-yanakiev,"Dead space in water x SOMA, count me in!",8,3 April 2020,"So, I had this on my radar. Didn't really know much, perhaps a quick review in the Tube from Chris Stuckman. Not even that, just checked the score. That said....I had a blast! I mean, yes they could've done more and yes the cheesy parts are there, but I can't remember the last time I didn't have to check my watch when watching a movie. It sucks you in the first 5 minutes of the events and goes on and on until the third act when it actually slowed down a bit. In my book, that's a colossal win. Choose a night, turn off the lights and do take your plasma cutter, 'couse you gonna need it. Ohh boy, you wish you did take it!
Apparently this was completed in 2017, but somehow released January 2019!? I have no idea why it sat in the drawer for 2 years, but it is one thrill of a ride. I wouldn't mind a second part somehow.",Underwater
666,humanfranci,Terrible,1,31 March 2020,"Everyone should just accept that Kristen Stewart, after all this time, still can't act. I suppose that's why the skimpy outfits. Nothing else seems to be working. The acting is terrible, The story line is terrible. The movie is terrible. From about five minutes in, I hope the main character die. Violently. It might match the pained and semi breathless expression. Remember the one face acting from Twilight?. Same thing, just less clothes. This is no relief for lock-down boredom. Rather watch grass grow.",Underwater
667,pillay-vishen,Boring and predictable,1,30 March 2020,This movie is so unoriginal and boring. Big hype for no reason. Watch it have nothing else to during the lockdown.,Underwater
668,stephaniechristopher,Prequel to Pacific Rim Kindof,7,21 June 2020,"Cheesy but decent. Borrows from Alien, Avatar, every other movie about some audacious human effort messing with nature and failing spectacularly",Underwater
669,gordon_sharpe,I am considering washing my eyes out with bleach.,1,28 March 2020,Total junk. I've seen less wooden acting at a puppet show.,Underwater
670,annabeack,Alien meets Predator meets Deep Blue Sea,5,29 April 2020,"Rented the Blu-ray version and it was potato quality. You could hardly see anything that was in the underwater scenes. The ""creatures"" are hardly scary because of this and really only the jump scares give it some sort of a horror feel. What you could see was wisp, something floating in the dark corners, and monster things in holes. I think.The storyline was full of information that lacked details and the characters weren't relatable. TJ Miller was a great distraction from some of the more disappointing parts but he was taken way too soon. Overall, it was a subpar film. I thoroughly enjoy underwater creature features and this cured an afternoon of quarantine.",Underwater
671,Keallach,Aliens Under the Sea ft. Cthulhu,4,20 December 2020,"Expectations were LOW, but a disappointing knockoff nonetheless - essentially Aliens Under the Sea with the usual formulaic action-disaster characters and special guest appearance by Cthulhu. Yawn.I guess there was some intention of upping the ""girl power"" factor, but Kristen Stewart is just sooo flat - one more iteration of the same alternating mouth open / lips pursed perpetual consternation as always. Yawn.Visually uncompelling as well. Yes, the ocean floor is dark and murky, and the probable intention/hope was that would create tensions... but it didn't. Frustrating watch, even on a ginormous screen.If your pandemic watchlist is getting sparse, and it's available for free... kill some time, I guess. Otherwise, PASS.",Underwater
672,tonysanders-43228,I want to see the creature !!,4,14 January 2020,Why would you make a movie and not allow the audience a chance to see the FREAKING CREATURE !! I'm not going to complain about the plot which is WEAK !! But I get pissed when you show images of something you (the audience) can't figure out and then poof it's gone !! I get your at the bottom of the ocean and it's DARK but dam I think the audience should be able to see what is attacking who and what happened to the character exactly !! I found myself getting frustrated with this movie because I could NEVER figure out what exactly was going on and NEVER getting a clear look at what was tormenting the crew !! I WANTED TO LIKE THIS MOVIE SO BAD !!!!,Underwater
673,kathryncampe,"No buy in, no originality, just no",2,5 June 2020,"I love sci-fi, horror, action, survival... this film touch on it all but failed so bad to get me engaged. Firstly the action happened straight away, there was no character introduction or development, no chemistry between the cast. I genuinely did not care if they all died - that's a big problem. A forgettable movie with uninspiring monsters and uninteresting characters.",Underwater
674,tonymchoquette,Mixed bag,7,16 February 2021,"Without giving anything away, it was scary in parts, but a lot of times you couldn't tell what was happening, very merky some of filming here. Felt like I was watching cloverfield underwater",Underwater
675,antrosg-95523,Ok..,6,12 April 2020,Don't expect a masterpiece.. it's an ok movie better than expected.,Underwater
676,tomholland-57494,Not for horror fans,3,13 December 2020,"This was slow and boring and hard to watch ! No character development and most scenes are in the dark underwater so it was hard to tell who was who ! The creatures only make an appearance an hour into the film and only kill one person , and all you saw was them being dragged under water ! All the other deaths are just water related ?? Aliens that live under water that you barely see and we just get to listen to Kristen Stewart heavy breathing in the dark ! Then it just ends ! Literally watch anything else",Underwater
677,aqeelahmednz,Ignore the negative remarks,10,29 March 2020,This one is one absolute hell of a ride.. A must watch...!!,Underwater
678,oussamasama-77177,"Incredibly boring, awful cliche storywriting and no character development.",2,31 March 2020,"After 30minutes I was skipping through the movie. I just wanted to finish it. It's just NOISE, DESTRUCTION and SHAKY camera. This film makes you fed up! One of the worst movies I've watched. Even the rating of 6.0 is very generous for this film. In my opinion I would rate this much lower.",Underwater
679,njerry-55467,Fantastic monster movie.....,10,11 April 2020,"Watched this film hoping it would be good.... Didn't disdopoint.... Great monster movie.... One of the best I've seen in quite a while..... Very atmospheric and chlosterphobic.... Lots of tense moments and it doesn't let up at all for the entire 95 minutes..... Highly recommended, more like this please.... Hope it gets a 4k release one day.... Enjoy....",Underwater
680,jerrychan-73787,One where you root for the villian.,2,20 June 2021,"I'll be honest.I don't like Kristen Stewart, or anything that she's done.That aside.I can't help but feel the science is...off.I know pressure is a real danger in diving--but people literally explode as if they had C4 strapped to their suits--their 140lb deep diving suit literally disintegrates.Well, wouldn't be a real action(?) movie without an explosion or two.Also, half the movie looks like it was shot using a selfie stick.Should've just made it a Riddick movie.",Underwater
681,ndjuraeva,Poor direction.,1,29 March 2020,She touches creature without gloves. Lol How is that even possible?,Underwater
682,commsin,A great blend of Lovecraft-esque horror.,8,12 January 2020,"With low expectations, this flick was a pleasant surprise. The characters were all flawed individuals, with little hope for survival. Kristen Stewart was deadpan as always (which works here), and the almost textbook TJ Miller character injected the proper amount of humor and laughs without wanting to cringe at what is normally forced jokes. If you can look past the scientific flaws and want to have a quality 90 minutes in front of a screen, this may be the movie for you. Oh yeah, the monsters are pretty cool too.",Underwater
683,dnnymitc,"Confused plot, cinematography and ridiculous science.",1,13 December 2020,"This was really terrible, just terrible. So 8 miles down there are creatures that can swim as fast as birds can fly. They move through the water as if it wasn't there. And people can RUN under 8 miles of water pressure. The pressure is so great that single crack in your face mask makes you IMPLODE. But you can outrun a swimming as fast as a bird creature.In addition, they goal was convoluted and confusing. At one point, they just appeared running on the sea floor, they didn't even have to get out of an airlock, they transported themselves.Did you care for any single character? The only with any humor was killed immediately.And I loved the super strong females in their underwear dragging the wuss guy to safety, precious.Also you couldn't make out 2/3rds of what was going on because of the cinematography.Just horrible.",Underwater
684,samapholt,Silly and dumb,4,16 February 2020,First 30-40 minutes of the movie are pretty strong with some spooky moments. Once you've seen the monsters once though it gets really old really quick and there are a bunch of stupid character decisions. The acting is fine and TJ Miller had a couple of lines that actually made me laugh. Other than that the films takes itself far too seriously and just reminded me of a slightly worse underwater version of the movie Life.,Underwater
685,yehiahashem-53659,I don't know,4,7 May 2020,"It wasn't great movie
the monster shape wasn't scary",Underwater
686,Lightman42,A Welcome Addition To Ocean Horror,8,18 January 2020,"While the film doesn't bring a ton of new ideas to the underwater horror subgenre (with the exception of a visual scale we haven't seen before) there is a lot to love about this movie if only for its clear affinity for the titles that came before it; chiefly Deep Star Six, Leviathan, and The Rift (all of which were made around 1989). Kristen Stewart really shines in the title role, and the creature stuff is awesome with strong Lovecraftian influence. This however is where you crave more imagination as the film only grazes the surface of what's possible. At the same time, it can be seen as a strength, inspiring the imagination to greater depths. If you haven't seen Stuart Gordon's Dagon, I highly recommend it. A little more meat on the bone for those who want to go a little deeper.Unfortunately the film's less than stellar performance at the box office could be attributed to the fact that the 80s are gone, and the masses are more interested in Dr. Pimple Popper online, or whichever million different rabbit holes of content we're overwhelmed with these days. I would also say the film's marketing made an error in burying the fact that it was a monster flick. Monster fans will love this thing, yet it's sold like it's another bland sci-fi snooze fest.Definitely worth a look for genre fans. See it on the big screen while you can.",Underwater
687,bellbell15,PURE ENTRAINMENT!!!,10,15 April 2020,"This movie had me on the edge of my seat from the beginning to end. This was pure entertainment at its finest! Hats off to the director & the cast. You guys killed it! I would advise the viewer sit back, turn the lights off and enjoy this blessing during these trying times.",Underwater
688,mizsuz,Development Happens in Secondary Character,7,11 April 2020,"I'm thinking 6.5 rounded up to 7 for this one. It was a mixed bag for me, one that I enjoyed more than expected but failed in a couple of spots.I largely can't disagree with suggestions that there was no character development with one exception, Jessica Henwick's Emily character. For the first half of the movie I wished this cliche'd damsel in hysterical distress would just die and be put out of my misery. But by the end of the movie she was found to be tenacious and resilient.It's true that many people find Stewart's acting wooden, but when I see it mentioned I often wonder if these people also find Bronson, Eastwood, Brenner, and Wayne wooden. All of these people made careers on resting-b***h-face and I don't see why it's unacceptable for a woman. That said, Stewart's character didn't really have far to grow in this one. She started out as a stoic, intelligent, self-sacrificing bad-a** and pretty much maintained that throughout. I do want to give her a nod for that final scene. Her expression in that scene seemed to me to encompass the entirety of what character growth happened for the character in the entire movie, and Stewart delivered it with subtle grace.I would have liked to have seen the monsters a little more clearly and because I couldn't I find myself wanting to agree that the cinematography was lazy. I don't really know enough about movie production to make that call, but the extreme lack of clarity in the water scenes throughout the movie was more frustrating than suspenseful.Props to the nod to Lovecraft in the final quarter to one-third of the movie. I was kind of delighted to see it, actually.",Underwater
689,mikew83,"Excellent flick, for a very specific viewer.",8,6 June 2020,"I thought this would have been a near-perfect movie for me, had I known absolutely nothing about the ending. For the one type of viewer that will love this, knowing even a single percent of facts going in will ruin it. Knowing even a clue about the end made it a decent, but unspectacular view for me. So basically, for most interested viewers, it's decent. For a few, it's great, if you know absolutely nothing going in. Keep the expectations low and you'll be fine, either way.",Underwater
690,donmoore444,"Underwater - If you fill up a tub with water and hold your head underwater for 30 seconds, it would be more pleasurable than watching this movie",5,1 December 2020,The scariest part of the movie was there were women trapped with TJ Miller 7 miles underwater. What's down there on the ocean floor? Is that an alien? That's a lazy foxhole that alien fish was laying in.,Underwater
691,jbell7,Complete mess,3,30 March 2020,"Honestly I like the premise of this film. The execution was just brutal. Absolutely zero character development, I didn't really care about them at all. We have little to no idea why there were no other people down there other than our heroes. Jumping from scene to scene with little to no explanation or conclusion from that last. Camera work was all over the place. Sorry but this movie missed the mark big time.",Underwater
692,rashid-km,Horrendous,1,28 March 2020,"The worst movie I've seen this year.
No acting, no story, no logic.",Underwater
693,buster_up,My shortest review ever.,1,1 April 2020,"Unless you're in isolation for the next couple weeks, and you've absolutely exhausted all forms of entertainment, then by all means, waste 95 minutes watching Underwater.",Underwater
694,pjpapad,Trash movie,3,7 April 2020,"Godzilla like movie, and I am not talking about the good old Godzilla movies, I am talking about the ugly recent ones. The movie is supposed to scare you with some very cliche scenes. No anticipation, no story at all, destruction starts in the first 5 minutes. And the science behind everything, it is very very stupid.",Underwater
695,sha_darim-540-387521,You've got to understand the content but it's great!,9,19 December 2020,"The people who complained that this movie doesn't explain the monster, why it's there, what it's doing have missed the entirety of the plot and are rating an excellent movie down.
Need to know your Lovecraft.
He is the Dreamer. They woke him up and he was pissed.
Great creature feature, fantastic special effects and the dark underwater scenes enforce the claustrophobic fear. Sad to have missed it on the big screen. Would watch again.",Underwater
696,shallon4000,Good Horror,10,15 January 2020,"Didn't have high expectations but was surprised. The cast did a good job and the monsters were pretty cool. Can't say that it is as good as Aliens or many of the other classics, but for all the bad horrors that I've watched recently I was happy that this one was done wellDefinitely worth checking out.",Underwater
697,repassybalint,Alien and The Life have a baby👍🏻,8,9 June 2020,Very nice movie I loved at till the end . Get bit claustrophobic,Underwater
698,Robertt1997,Watch it! It's a good movie.,7,19 July 2020,"It's a good movie, I don't understand why it gets all the hate. It's not an horror movie at all, and I like it, since I'm not a fan of horror genre. It has a few jump scares.",Underwater
699,Linus_N,I appreciate the attempt.,6,12 September 2020,"Going into this I was expecting a more slow paced sequence of events along the lines of The Abyss. The plot however exploded into gear right from the start. The very first scene. During Kristen Stewart's narration I thought my hopes of a slow burn would come true. I hoped it so much much that the incident seemed like a dream sequence. It wasn't, it just kept going.The movie isn't great, some of the action is shot and edited poorly making it confusing at times. The plot is predictable and trite. The emotional scenes are sappy and eye rolling. Despite all these things I didn't hate it. It didn't make me miserable. The atmosphere and visuals are very good. The scares are almost exclusively cheap jump scares.Certain aspects of the ending ALMOST made it all worth it. I wished they kept going with IT, but no they bungled that too.In conclusion. Not great not terrible. I applaud it for being mildly unique and for trying really hard. Existential horror underwater isn't easy.",Underwater
700,wraggj-09324,A master class in bad filmmaking,2,13 January 2020,"The positives: acting was good by Kristen Stewart, and especially T.J. Miller. Everything else was drudgery, muted, dark, mumbled, technically inane, and absurd. My group of three all felt the same about it. For the money they could have made a good movie in this genre.The aspect that irritated me the most, which is not unique to this film, but a hallmark of bad ones, is action scenes that are flashing sequences of 1 second shots, edited into a semblance of continuity, but failing horribly. They went another level lower even, by having it dark and murky, so the incomprehensible staccato action isn't visible anyway, rather it is a suggestion of action, stifled and dimmed by molasses.",Underwater
701,jacksnackfan,Not Bad!,7,27 January 2020,"I was so hesitant of this movie. But it rocks. It rocks hard. For a PG-13 horror movie, there's quite a bit of gory scenes. So I loved that. The monster designs were amazing, especially the massive Kaiju at the very end. The way it builds suspense is unbelievably fantastic.Give it a watch.",Underwater
702,lloyd-44419,Terrible.,3,3 April 2020,Complete anti climax. Terrible film terrible under water aliens woukd have preferred a gigantic squid or something along those lines.,Underwater
703,ddt_eagleeye,Watch it when you want to see Stewart in her undies - stay away otherwise,3,3 April 2020,"This movie is a wreck. It tries to unify the best elements of Alien, The Abyss and Life into one movie, but fails to do any of these aspects right.
The film doesn't take any time to set up the characters and environment, it just throws you in and off you go. This can be a good thing if done right, but the filmmakers show us impressively, how it's done wrong. All the right ingredients did not blend at all.
Stewart does what she can with the given script, and again shows that she is an interesting and good-looking woman, but not a particularly good actor. The rest of the crew is pretty forgettable with a standard assortment of wannabe-badasses acting extra stupid. Yes. They basically make the crew of Alien Covenant look like geniuses.
The cinematography is all over the place. Some shots are really good, but then others are just dark and damp, where you can't tell whatsoever what you're looking at. The sound design hits every horror cliche and the music is a hodgepodge of a hundred scores you've heard before.If you're an avid Kristin Stewart fan, you might get some enjoyment out of it, but if you want to see a good horror scifi movie, you'd best stay away from it.",Underwater
704,saimahmadu,Sci fi thriller where the mystery keeps on growing,7,3 April 2020,One of the best sci fi thrillers which i have seen recently. This movie is in layers where when each layer unravels new mystery unfolds.Movie is action packed right from the start. Fast paced and gripping. Kristen Stewart with her blank face and i am always sad look is ideal to play this role.I like movies where everything is shown and not left on the audience to work things over and this is one such movie.Highly recommended.,Underwater
705,rchearnley,"Dont go by the reviews this got, it's a very solid movie",8,11 February 2021,"I was pleasantly surprised with this movie pretty good story line, not too many cliches which to me is always a bonus. What I really like about this was that there was no slow beginning it got straight into the story no need to do a full backstory before the movie starts, which to me shows decent writing.I'd recommend for those who enjoy syfy/suspense type movies",Underwater
706,ericpurcell-72099,A surprising sci fi horror film,7,22 April 2020,"This film surprised me in a positive way. I wasn't sure if I'd like it. The rating is quite low. I think it's too low. The characters are okay. They're pretty good considering there's not really a break in the action at any point. This is the opposite of a slow film. The pacing is lightning quick.Some of the character motivations and the realism of certain scenes did stir some skepticism in me. These suits they wear must be incredibly tough; far tougher than even the best space age technology because characters are dragged at high velocity over the ocean floor and yet there's never a rip or a break in these characters suits. That seemed to me to be a little oversight.Despite everything else, this film does one thing very well. Something incredibly important for horror films. This movie has a very strong sense of atmosphere. The set design is stellar. The CG and effects are exceptional. The monster element is a slow burn.A visceral sci-fi horror movie with obvious inspiration from alien and other space horror films featuring okay characters, decent performances, awesome CGI and atmosphere.",Underwater
707,crazyivanlupi,DON'T WASTE YOUR TIME WATCHING THIS,2,11 April 2020,"We all know that from the titles we can understand how good or bad a movie is yes? Well, if you are able to get over the titles you'll come across an underwater station with a tiled bathroom. A TILED BATHROOM, YES! And if this was not enough for you to try to understand HOW THE HELL they keep writing stuff like this and mostly finance it, you'll get awful acting, bad editing, jump scares which are not scary and the most obvious plot.
Do not watch this.",Underwater
708,admiraladama,Underwear.,4,11 February 2020,Just barely worth watching for the close-ups of Kristen Stewart's bare feet as she runs around in her Underwear (which would have been a better title). She does have nice feet.,Underwater
709,kaigrzegorzyk,"Its kind of like ""the Meg"", but way better",8,24 April 2020,"Very nice deep sea thriller, actually a good one, unlike ""the Meg"". I expected nothing, cause i normally don't enjoy Stewart's acting, but was pleasantly surprised! Strong, suspenseful and beautiful at times...hold your breath",Underwater
710,Paulo Alegria,Lazy production.,5,27 March 2020,"A potentially satisfying movie ruined by a terrible cinematography and an absolutely pathetic and messed up digital colour grade. What a shame! I miss this theme a lot and I really wanted to enjoy it, but it's all lazy and there's very little to appreciate. I guess that The Abyss is still ahead of time, even in its most basic technical aspects of image capture.",Underwater
711,smithdana-26441,Modern and solid retelling of Leviathan and Deepstar Six,6,31 March 2021,"The action starts just minutes into the film, and from there it's one long action sequence till the very end. There is no time for character building, but here it is OK, because all characters are likeable. Kristen Stewart's acting is subdued as usual, but the viewer can see that she is used to carrying a film by herself - and this is what she is doing here successfully. The story is straight out of the underwater monster movies from the end 80s and would have worked just as well as a thriller without interference from the outside. Unfortunately the twist at the end is an unnecessary overkill that drags the story to the edge of (even more) ridicule. The underwater shots, especially their duration, are quite impressive. All in all a solid but not outstanding little horror film.",Underwater
