,User_name,Review title,Review Rating,Review date,Review_body,Movie_name
158,firefox-45945,Expected another Mamoa action movie..got so much more,10,28 June 2018,"I'll admit, I waited to watch this movie until I just didn't have anything else to watch. I thought it was just going to be another Jason Mamoa badass action movie and honestly, from the trailers, it was made to look that way. 
Right from the start I was proven wrong. Jason Mamoa was obviously in his element in this movie. I have never seen his acting so natural and fluid. Drop the super hero badass, the big bad badass, this guy can really act! I was continually impressed with even the change in his voice. So much more natural. And he was not a badass in this movie. He takes a lot of hits. He was a man of the wilderness who used his knowledge and ingrained need to protect his family to overcome the odds. Something that anyone with those skills could do. 
I liked him SOOO much better in this movie and I hope he continues to do more. I know people like his big bad roles, and may not appreciate roles like these, but Jason, there are people who think you can be more than a deep voiced bad boy! This was awesome!",Braven
159,teoandreea-07655,Deliverd as expected: action; more than expected: acting,9,19 January 2020,"Before I decided to watch this movie on Netflix, I read through some of the low score reviews. So I was expecting not a bad movie, but a ridiculous bad movie.
Now that I've seen it I am actually surprised of the low reviews from some viewers.
The action scenes are as expected from action movies. Actually, I would give these 10/10 as, for a low budget movie, they are rather original and well filmed. To actually have a consensus amongst unhappy viewers that they are ridiculous is just as ridiculous in itself. This way ALL action movies are bad as, news flash for some: they exagerate for entertainment purposes :) Please don't try this at home.
Acting wise: a little better than expected. The script is not done in order to highlight acting skills but, I must say I was a little prejudiced before watching Braved due some previous Mamoa films. So I am pleased to see maybe more meaningful lines and surprisingly, a good balance of character roughness but not crossing into the lone, though, monosilabic mountain Rambo hero. Well done. For this type of movie I would give 8/10.
I loved how they filmed the scenery, the details of the falling snow and even action scenes. 10/10
Script: oh well, I do agree, it's quite weak. Does make you raise an eyebrow at times and has a slow build-up. But then again, I think the rest of the movie compensates and it doesn't alter the viewing experience too much. I believe the ""rushing through"" gaps are sort of natural considering it's an action movie, so it doesn't do very well on some character building or small dialogues. 6/10
My opinion: good movie. I recommend to watch this movie unbiased; if you like Saturday evening action and popcorn movies you would be satisfied.",Braven
160,taryndeanms,Beautiful location,8,14 December 2018,"Suspenseful film with the best location to shoot it at! Jason Momoa
does what he does best and made this a stand out action film.",Braven
161,clairejbonny,Action with heart,10,12 March 2021,Great action film with Jason Momoa at his best. I loved that he was just a normal guy protecting his family not a superhero or warrior. And I loved the family story. There was a lot of heart and tenderness in this film and Jason Momoa got to show more of his range. He does emotion and upset very well and I hope he gets more roles in the future that showcase that,Braven
162,30Review,I don't like the plot,3,2 December 2020,They could've just taken the drugs and go on with their lives. The acting is pretty bad. But the nature and videography are great. Overall 3 stars.,Braven
163,jimintheatl,Love Jason Momoa,6,22 November 2019,"Jason Momoa and Stephen Lang are compelling. But the criminal ""mastermind"" is one of the dumbest bad guys ever, so the plot falls apart if you think about it for five seconds. If he had half a brain (even though he's supposed to be clever) the movie would have ended in 20 minutes without violence.",Braven
164,tfletcha258,MO MOMOA!,10,31 July 2018,"Damn this was good! Momoa showed his skills, and he can act too! Great storyline, setting, and choice of actors. 
Enjoyed everything about it..",Braven
165,assunluis,Don't be fool by the reviews.,3,1 January 2019,"This is a REALLY BAD movie. The score is only because of Mamoa fans. Bad script, bad action, really bad storytelling... Everthing is bad! DON'T WASTE YOUR TIME!",Braven
166,grantlong2004,Worst film in years.,2,21 December 2019,Oh my days. Bad is an understatement. the very worst film I have watched in years. Terrible acting. It's actually laughable how bad it is. Really don't bother.,Braven
167,lkayc5,Good movie to watch,10,26 February 2018,My husband and I saw this movie; it is a good one to see. Way to go Jason Momoa.,Braven
168,MiikaMadjar95,Complete crap! Sry that is just my honest opinion.,4,24 August 2018,"C'mon seriously!? Was hoping to get some real good action for what it's worth, but this was just lazy writing seriously. Ok there was one part that I enjoyed also - the father-son relationship part. But now for the disliking arguments:
As I mentioned before, waaaaay to lazy writing for a movie (don't mean the dialogue part mainly, but just the culmination of events happening)Since when are drug runners like spec ops forces dudes? or sharp shooters? sry for me doesn't make any sense.After half the movie when Momoa starts killing the goons - why couldn't he carry/use the bow more? His wife in the movie was the real bow master? :D Why not kill the guy when you are running away from the bad guy and he is clearly wounded - she should know these woods there? (Assuming from the story) And does it really take this long to reload a sport bow? And as a logger/lumberjack? why couldn't he own more of those axes/hatcets, since you own a cabin in the mountains? Just adding some arguments here :DLastly the final action sequence between Momoa and Dillahunt. Why couldn't he use any stick of wood to fight him off instead of jumping to the bear trap himself. WHERE WAS HIS BOW? USE THE FRIGGIN BOW!There I think I've said it all now. These were the things that bugged me during the movie! That's why a score of 4. But if you liked it then good for you! (Y)",Braven
169,iamnaresh,"Jason Momoa stars in Braven, an axe-throwing action thriller that gets a little stuck in the snow.",7,22 March 2018,"Jason Momoa seems made for action movie stardom, and Braven is one of the smaller projects that should help Khal Drogo fans while away the time between Justice League and Aquaman. Braven is directed by Lin Oeding, whose work as a stunt coordinator certainly helped him give the movie some inventively brutal energy at key moments, and the simplicity of its premise serve it well once things get going.But Braven sure does take a while to get going. Its problems primarily lie in an unwillingness to follow the potential of its premise to a logical crescendo of ludicrous action movie serenity. Instead, there's a brutally dull and far too sincere first act, introducing us to Momoa's Joe Braven and his home life, while giving us the thinnest of setups for why such an upstanding guy would ever cross paths with the villains in the first place. That slow burn opening doesn't really fit with the brutality we get later in the movie, and Jason Momoa does a fine job with the more sensitive than you might expect tough guy Joe Braven, supervisor at a lumber yard, devoted husband, and father to a young girl. Aside from their modest family home, Joe maintains a getaway cabin up in the mountains. The problem is that his father (Stephen Lang) is suffering from symptoms that resemble early-onset Alzheimer's, and since he's still very much capable of getting himself down to the bar and blundering into trouble, that's complicating things. While you might think it would be difficult to buy Momoa's magnetic screen presence as an everyman, he's surprisingly convincing. He and Lang work well together, too, even before the bullets and axes start flying But what complicates things even further is that one of Joe's co-workers at the lumber yard is running a side business, using his rig to help run drugs for a dealer (Zahn McClarnon) who is in league with, of course, a much bigger drug kingpin (Garrett Dillahunt). When his truck runs off the road in icy conditions, he opts to store the drugs at Joe's supposedly empty cabin until they can be delivered to the big man. As you might expect, there's some confusion when Dillahunt's villain shows up to collect and finds Joe Braven, his father, and his daughter there in possession of his drugs. As you might expect, he isn't thrilled.And that's when the promised axe-throwing action begins. It takes nearly half the movie's 90 minute runtime for us to get to the action, and while there are moments of great fun, it's tough to reconcile it with so much of what came before. Dillahunt makes for a fun (if woefully underdeveloped) villain, a throwback to the kind of vintage action baddie who appears reasonable one moment while shooting one of his underlings to make a point the next. He's able to deliver lines like ""Aw, Joe, what the fuck is your problem, man?"" to amusing effect, too.But Braven never truly goes for it. Its devotion to that far too slow build early on makes you think that the violent payoff we're always waiting for is going to be more over the top than it actually is. There are some fun, creative kills (Stephen Lang's elder Braven gets in on the action with those, too), but it's never as completely bonkers as you probably expect it to be. On the other hand, there is satisfaction to be had in axes and tongs getting heated in a fireplace before they're deployed on assorted scumbags. There's some beautiful photography to be had in the snow covered mountains of Braven's Newfoundland locations, but this is no Cliffhanger. And we do indeed get to see Momoa's Joe Braven whup some serious ass in defense of his tween daughter, but this is no Commando. Momoa devotees will likely find reason to enjoy Braven, and there are certainly worse ways you can spend an hour and a half at this time of year, but this often feels like 45 minutes of story stretched to its breaking point at 90. Momoa proved with his Aquaman performance in Justice League that he can elevate a thin story with his charismatic presence, but this particular working class superhero deserves a little more to work with.",Braven
170,paolomolino,cheap on th snow pseudo thriller,2,29 August 2018,"Same plot: good handsome guy (he's very hot). Family man (that's cute). Bad guys. The good guy turns out to be a tough cookie. Some shootings. The good guy wins. Thus no plot at all, acting ok, again on the snow and icy grounds like windriver. Must be the new frontier of action movies having run out of any other ideas. Frankly cheap, watch it home.",Braven
171,jjstetch,spolied brat reviewers,9,22 July 2018,"I'm a very picky movie watcher and often turn off a movie 10-20 minutes in. I don't understand the bad reviews above. It kept my attention every minute, the characters were all highly distinct from one another, I loved the acting, and I really felt the cold and the space as though I was right there. I also thought it was pretty original to have a cabin scene with deciduous trees not far from rocky cliffs by the ocean.",Braven
172,thomashaasum,Worst movie i saw so far in 2018.,3,19 February 2018,"Seemed ok the first half of the movie, but then they went to a cabin, and the movie just crashed from there, poor acting, thin thin story, and the action seemed to be from a 1980's B movie... dont waste your time on it.",Braven
173,jhalloran-23192,Solid Action Film,8,9 February 2019,"I wasn't expecting that much going into this flick. It's a typical action film and that's not a bad thing. Jason Mamoa kicks ass of course and I like how other characters got a chance to shine too (his dad and wife in the movie both can hold their own). I like how alot of the bad guys are taken out, all are pretty unique and clever and it's not just a regular stab
to the neck or gunshot. Each is fairly creative to some degree. There were a couple of moments in the movie that seem to have just been in to advance the plot, mostly with how the bad guy knew certain things just by assuming it seemed to move the film along. That being said it's a solid action flick, good a night in and with some popcorn and sodie pop at the ready. If you're looking for a good action film with some touching and sensitive moments, this is for you. I watched it on amazon prime, it's free if you have it.",Braven
174,thejhuy-85386,Don't waste your time on this,3,18 October 2019,"Seriously, this movie has so many glitches that makes it look pathetic. Before the last ""fight"" over the top of the montain, Joe Braven would clearly have at max 5 seconds of advantage to set up a trap that would take at least 2 minutes to be set in that spot, but he still does it right on time. HA! Right after, when the cops and his daughter/wife were looking after him, guess who was leading the way? Right, the little girl named Charlotte. The cops are painted as completely stupid guys in this movie. And then they easily find Joe in a search that would take at least a couple of hours in matter of a minute, then they all hug each other and that's all. Movie is over in the blink of an eye... Pathetic, a REAL waste of time.",Braven
175,paradiseislandus,Watched only because of Jill Wagner,6,7 September 2020,"I don't get it. The drugs have already made it to someplace with a lot of snow and mountains. Assuming the drugs have already made it all the way from Mexico, how much more do you need to hide the stuff!? Jill Wagner is soooo hot!",Braven
176,xaydin-22295,"Well, thats one way of fixing the dad problem",6,30 April 2021,"Like the main jist of the reviews, pretty bad script. Gave up on the cb radio pretty quick, even though they heard him and everything. Maybe couldve spent more than half a minute on it. But i will say, the killing got funny and amusing, especially mr.stabbed, axed and arrowed.",Braven
177,lestatdsr,Hard to enjoy,2,7 March 2018,"It starts off strong, but then basic common sense calls it a day. Jason sets up a lot of interesting ways to kill everyone, only he often gets ensnared in his own trap - literally and figuratively. Keep saying why isn't he picking up their assault rifles after he starts picking them off? He really likes to hurt himself I suppose. Overall it's a Pyrrhic victory. Lot's needless self-inflicted pain. I blame Jason for just about everything bad that happened to his family and himself. Could have been a great movie, but it's too frustrating to enjoy. I can't see myself wanting to watch",Braven
178,info-132-946582,Trash,1,20 April 2019,"I ate 10 bags of chips from frustration to give this movie 1 star. Please be wise and go for a walk, spend 1,5 hour for example watching your washing machine how it cleans your dirty clothes, but don't waste your time with this bad script...it can cause permanent injury to your brains",Braven
179,ericfosterolp,Not always what you'd expect but falls FAR short of being decent.,2,24 June 2018,"After seeing the trailer for ""Braven"" it didn't inspire me to want to check it out. After seeing the ratings starting to climb on Amazon Prime Video (it was at 4 stars when I viewed the movie last week and has since dropped to 3.5) and then seeing an, at the time of my viewing, score of 6.6 on IMDB I decided to give it a fair chance. As the movie began I started to see a very tired overdone plot beginning to unfold. The, 'oh no, we need to stash our drug haul somewhere and come back for it later' routine. And of course, they stash it in what they are led to believe is a cabin that won't be in use. But, as usual, the cabin does become occupied hours later and it becomes a battle between the drug lord and his gang to get their stash back from the cabin owners.Early on we are introduced to our potential ""hero"", Joe Braven (a lack-luster, Jason Momoa whose acting leaves MUCH to be desired), and his wife, young daughter and aging father who seems to be having the onset of dementia. Now, if you are a fan of action movies of this sort you would immediately figure that at some point in the movie one of the four of them will eventually die (there's almost always a sacrifice of some sort in these tired plots to ""beef up"" our hero's rage for revenge), or possibly a hostage will be taken to start the rage. Now, I will say that I was happy to see that not all of what I was expecting to unfold did. There were a few pleasant surprises. However, those did not out-weigh the ridiculousness of the overall poor movie.THE GOOD POINTS = 
 The female lead, Braven's wife, Stephanie (Jill Wagner) and
Braven's father, Linden (Stephen Lang) gave good performances. The score was alright.THE BAD POINTS =
 Jason Momoa's acting. The unexplained reasoning for a drug lord to smuggle drugs from a mountaintop in the first place. The poorly run drug gang who could have ended everything in the blink of an eye. But of course that would have made for a very short movie. The stupidity of some of the decisions of the police and the mother towards the end of the movie. (Yeah, let's run through the mountain range with our young daughter in open view to possibly be taken out instead of keeping her in the safety of the police SUV) The mind boggling time frame edits. (how is it that two men are chasing each other at one moment within VERY close distance of one-another and then seconds later one of them reaches an area with enough time to stop, devise a plan, carry it out and then turn around to wait for the other one to catch up?)  And then, the ending confrontation. I'm not going to go into how unbelievably stupid the final ten minutes or so of this movie was because I would have to give everything away but let's just say it defies logic on SO many levels. Seeing as how this movie only mustered up a grand total $ 312,116 at the theatrical box office, and let me add that ALL of that income came from the international market, absolutely ZERO came domestically, we will, more than likely, never see a ""Braven 2"", at least let's hope not!",Braven
180,jdaniels-237-950159,What am I doing watching this tosh?,4,21 December 2019,"What is it with American movies and 'Baby'
The daughter is called baby
The wife is called baby
Even the husband is called baby.
Don't get me started on the actual movie.
A straight to video job.",Braven
181,mjohnston88-590-373881,Great ACTION movie,8,18 November 2018,"I watched out of boredom and ended up loving this movie. It's a damn action movie. People giving low rating need to realize this and stop expecting it to be a Oscar worthy Scorcese film. It had me on the edge of my seat and I really connected with the characters. Sure there were some over the top scenes, unrealistic scenes but that's an action film for you. If you go in just expecting a movie that'll keep your attention, then you won't be disappointed",Braven
182,omartrujillo-555,Bad bad bad,1,12 November 2018,"Don't waste your time. Bad acting, bad plot. Nothing credible.",Braven
183,aliirfanashraf-160-961194,Good watch,7,4 February 2018,"Despite some unnatural actions and very lame role of police, this movie is interesting to watch. Enjoyed it.",Braven
184,ashiwalli,An insult to my intelligent,5,16 July 2018,"I always thought that stupid decisions was a horror flick genre cliché.. never in my life wud i ave ever thought to encounter such sub par scripting in a action film... but then again as horrific as this movie was mayb it cud jus as easily find its place in the former. 
On seeing a movie headlined by the Game of Thrones Badboy; Jason Momoa, i thought ""definite must see"".. boy was i wrong. Though i wont negate the entertainment value of the movie i did not think all its other components were strung together intelligently enough to make a full movie.. The characters are moronic to say the very least.. every.. single.. one of them... everyone.. absolute imbeciles.. and its funny and sort of ironic how they had the main antagonist poised as such a tactical maestro but hiself was just as dumb given that this whole sequence of events (and movie at large) could ave been avoided with better judgement. I gave it a 5 for if anything i was captivated enough to want to see wat stupid move would they make next.",Braven
185,yehezkelrotem,Worst movie i had ever seen,1,27 March 2019,"I rarely bother commenting or reviewing bot this is the worst movie i had ever watched.
Badd acting
No plot
Nothing makes sense
Waste of your time. Just don't",Braven
186,stevemurray-15092,So badly made,1,1 September 2018,"Poor action, unimaginative storyline and illogical plot aside, I couldn't handle the awful camera work, it never stays still. Two people standing talking and the camera is bobbing up and down like a child is holding the camera.",Braven
187,AbdullahOT,10,10,29 July 2020,"A movie worth seeing, the story is great, everyone's representation was excellent, the music was very sad",Braven
188,jtlavelle,Indie movies can be action packed,7,26 November 2019,"Enjoyed this entertaining movie. Mamoa is cast as caring father - Joe Brazen - of his precious family. When through no fault of their own they are under threat from well armed drug dealers, he goes to super human efforts to protect them. Strong cast and good pace. Dillahunt good as lead bad guy. Nice work (as usual) from Stephen Lang as Braven's ailing father.",Braven
189,kingdavid-74583,Ridiculous!!!,1,2 July 2018,"This is the most implausible, ridiculous, stupid freaking movie I have ever seen! You know how it gets frustrating when people do in movies the most moronic things in dangerous situations that they'd NEVER do in real life? Well multiply that by infinity, then add 10. No one makes a sane decision in this movie. I can't believe I wasted 90+ minutes of my life watching this. Do you know why I watched it? Because out of almost 16,000 people that rated this movie on here, it averaged more than a 6 out 10. This is why I'm against the legalization of weed. GET OFF THE DOPE, DOPES! Do yourself a favor and instead of watching this movie, stab yourself in the eye with a hot poker -- you'll thank me for it being less painful.",Braven
190,lej_privat,"Just, Canadian",2,8 July 2021,"Quite simply one of the most bad play, terrible plot and horrible screenplay movies I've ever seen. It's so dumb that it actually becomes funny in moments where it definitely wasn't supposed to be funny.",Braven
191,chuckyvee,Thrilling for sure,9,14 April 2018,If you want to watch a good action movie -- this is it! I had fun watching it and was on the edge of my sofa many times during the middle and end especially.,Braven
192,nstoebe,Shallow food for the week,5,2 January 2020,"Ok for a sprinkler during the week. A wooden main actor who is not an action actor for me cannot really convince. An aging Liam Neeson would have been the much better line-up here. Pretty shallow and predictable story, somehow seen it all X times. In addition, the cops in this film are given the predicate ""rarely stupid"" by the director. The end is ok and turns the oar around a bit. Logic gaps not too short and all in all the strip cannot convince.",Braven
193,gummyworm-59648,Solid movie,7,20 November 2019,"So many negative reviews because the action is unrealistic. Guys...its a movie! Is it spectacular? Aside from Jason Moma's abs, no. But who doesn't want to see a little exaggerated action sequences? Don't be so boring! Lighten up and enjoy the movie for what it is. If your expectations aren't through the roof then you won't be disappointed. A solid movie all around",Braven
194,luckymike-44410,Who writes this stuff?,4,6 September 2021,"I watched it because:
I've liked Mr. Momoa's performances in the past.It was 99 cents on Apple Movies. Hey, I'm being honest.This movie makes me believe that the writers pulled together a summary of past action flicks involving a family guy fighting bad guys and added just about every stupid cliche they could find.It just got dumber as it went along. In one scene, Joe needs a weapon so instead of grabbing the dead bad guy's loaded shotgun with ammo attached to the side, he picks up an axe with a broken handle to use against another bad guy with a gun. Much of the movie went like that. Dumb.I gave it four stars because the problems of the movie are not the fault of the actors. Just the dumb writers.",Braven
195,heftychef,Are you joking?,1,18 March 2018,"Cliche after cliche after cliche. Did a high school kid with a big allowance make this movie? Actors are ok but the writing and directing are a joke. Music, cinematography and editing all good but the writing and directing just sucks. Cue the Sarah Magloclan music and save the animals. The end is a steaming turd.",Braven
196,trevgregory,OK,6,12 June 2018,"Not bad, not great. Worth a watch when there's nothing else to watch",Braven
