,User_name,Review title,Review Rating,Review date,Review_body,Movie_name
0,Leofwine_draca,Does all it needs to,8,29 October 2020,"BRAVEN is a low budget action thriller that reminded me a little of the similarly good AGGRESSION SCALE: small-scale set-up, imposing villains, a resourceful hero, some HOME ALONE-inspired bits of creativity and defence. This time around the setting is an effectively chilly Canadian north, where logger Jason Mamora balances family life with caring for his dementia-suffering father (a sensitive turn from Stephen Lang). After the usual character-based build-up, they're thrown into a plot involving Garret Dillahunt and his drug gang, and a desperate fight for survival takes place. There's some decent action going on here with impressive little touches, and Mamora acquits himself better to this role than he did, say, as Conan. The lack of budget is evident in a couple of stunt shots, but otherwise this is a film that does all it needs to.",Braven
1,SnoopyStyle,slow start gets better,6,3 August 2018,"Joe Braven (Jason Momoa) has his family and his logging company. His father Linden (Stephen Lang) suffers from dementia. After a bar fight, pressure builds to put his Pops into a home. He resists and takes Pops out to his cabin. Unbeknownst to him, one of his log truck drivers, Weston, is transporting drugs with Hallett. They crash on a snowy road and rush to hide the drug stash in Joe's shack. The incompetent pair's drug boss Kassen (Garret Dillahunt) leads the gang to recover his drugs the next day and it becomes a deadly cat and mouse game.The first half is a bit slow. It spends too much time with the family. Introducing Joe as a family man should not take this much screen time. His father's dementia feels like a side plot point. It could have come in handy to instigate the standoff but the ignition is more problematic than that. There are different ways for Joe to ignite the confrontation. Splitting the drug stash in half is one of the inferior options. He should probably try to give it all to Kassen hoping that he would leave on his own accord. I doubt Kassen could ever leave the cabin without securing all of his drugs. Joe's plan is an unlikely pipe dream. His father's dementia could have been used as a catalyst for everything. The daughter's jacket is too bright purple. A smart man would turn it inside out for better camouflage. Joe ends up using too many special weapons. It's a little too Home Alone. I do like Momoa, Dillahunt, and Lang. They fit the setting and the manhunt plot. The cabin is probably too nice and the production couldn't afford to do much damage. They would probably be better off with a rundown shack where the bad guys can shoot the hell up. They could burn it down for real rather than the obvious fake fires. The second half does have some cat and mouse fun. This is good enough.",Braven
2,nogodnomasters,Do you remember what you did last night?,6,16 February 2018,"Joe Braven (Jason Momoa) works in the lumber industry in Canada. Circumstances causes his crooked driver to hide his drugs at Joe's remote unoccupied cabin. When armed bad guys come for the drugs, Joe and family are there closing it down for the season. The crime/action film is fairly straight forward. The conversation is dry for the most part. Interesting ending. Nothing spectacular. Watch it and forget it. Guide: F-word. No sex or nudity.",Braven
3,kosmasp,Fighter,6,2 December 2020,"Jason Momoa can fight - ok so that may not be news to anyone. And maybe it is only true in movies. But he does have the physique that suggests that. Now how do you put that in a movie? And how do you incorporate his father (film father) Stephen Lang? Who may be more famous to most as the bad guy in Avatar. Here we have a different bad guy - who really does a great job in portraying his evilness.Having said that, logic flies out of the window in many scenes. Like in a diner scene, where you can just murder someone without repurcussions! With at least a dozen of witnesses. Yes I know this is to establish the madness of the bad guy. I'm just saying don't expect this to make sense. If you come around accepting that, you can have some fun with the movie",Braven
4,zardoz-13,Sluggish Potboiler About Narcotics Wastes A Gifted Cast,5,27 April 2018,"Stunt man turned director Lin Oeding's debut as a director in the Jason Momoa's actioneer ""Braven"" qualifies as a formulaic outdoors thriller. Joe Braven (Jason Momoa of ""Justice League"") has his hands full with a logging firm that he owns, a wife and daughter, and a father who suffers from dementia. One of his truckers has thrown in with a drug smuggling gang and decides to haul narcotics concealed in huge logs. Trouble enters paradise when the idiotic driver flips his truck, and his partner and he stash the drugs temporarily at a mountain cabin that his boss owns. Meanwhile, Braven's father Linden (Stephen Lang of ""Avatar"") gets into a messy bar fight when he mistakenly believes that his dead wife is one of the female patrons. Braven bursts into the bar as two guys are working him over and defends his dad. Fortunately, the guys that Linden tangled with refuse to press charges because one of them is on probation. The county sheriff knows about Linden's woes and warns Braven that he will be arrested along with his father the next time something like this occurs. Braven and his wife Stephanie (Jill Wagner of ""Splinter"") abhor the idea of confining Linden to a facility, so Stephanie suggests that Linden have input into their decision. Braven and his father head off into the mountains to his cabin to discuss his future. When they arrive at the cabin, they discover that somebody has been broken into it. They find a bag of drugs. No sooner have they made their discovery than Braven's young daughter surprises them with her presence. She sneaked into the back of their truck and rode with them against the wishes of her mother. Not long afterward, the villains show up with enough firepower to start a small war. You know several things are not going to happen in this tolerable but predictable melodrama. Neither Stephanie nor her daughter Charlotte (Sasha Rossof of ""Thinking Speed"") are going to be seriously injured. None of the obnoxious villain are going to survive, and each will die in some savage fashion. One takes an ax in the head. Another thug (Garret Dillahunt of ""Wheelman"") plunges off a cliff into an icy sea. When Stephanie learns that Charlotte has left with Linden and Joe, she picks out her bow and arrow and careens off to save her daughter. The Canadian scenery will give you more chills that the prefabricated heroics. Jason Momoa plays a considerate, sympathetic son on the horns of a dilemma about his father. Of course, you know that Linden isn't going to make it off the mountain. Sadly, a gifted actor like Stephen Lang is squandered in the role of the father. Nothing genuinely surprising happens in the fair but forgettable ""Braven.""",Braven
5,Wizard-8,Competent take on an old formula,6,25 November 2018,"As I indicated in my subject line, ""Braven"" takes its basic plot from a whole bunch of films that have used it before (kind of a variation of ""The Most Dangerous Game""). But there is nothing wrong with a movie using an old formula as long as the execution is done well, and the filmmakers this time around did things fairly well. Now, I will admit the movie is far from perfect. It takes about half of the running time for the movie to really kick into gear and get going. Also, some of the character actions are unbelievable and/or silly. Those flaws did lower my rating by one of two points. But there is still enough good stuff here to satisfy action fans. The winter wilderness scenery is beautiful and adds a fresh backdrop. The movie does click forward at a good pace so that there aren't any boring bits. And there are some exciting action sequences. If you don't mind seeing this basic formula once again, and you are prepared to accept some less than desirable plotting, most likely you will find this movie an acceptable retread.",Braven
6,Wuchakk,Fighting drug runners in the snowy wilds with Jason Momoa,6,27 December 2020,"A logger in Washington State (Jason Momoa) is forced to defend his family against a group of violent drug runners in the wintry woods. Stephen Lang and Jill Wagner play the father and wife while Garret Dillahunt and Zahn McClarnon play heavies.""Braven"" (2018) is an action/thriller that takes place in the snowy sticks in the mold of ""Sugar Mountain"" (2016), ""Hold the Dark"" (2018), ""The Edge"" (1997) and maybe ""Cliffhanger"" (1993). While it's the least of these, it's not bad and has its points of interest. There's a one-man-army element akin to Rambo. What holds the movie back is a couple unbelievable action sequences, like the protagonist's rope strategy at the end. Why Sure!But the locations and cast are good, as well as the superlative score. A little bit of ""The Last of the Mohicans"" (1992) is thrown into the mix. Regrettably, the flick scores weakly on the feminine front.The film runs 1 hour, 34 minutes, and was shot in Newfoundland, Canada, with establishing shots of the Great Northwest and some CGI mountains in the background.GRADE: B-/C+",Braven
7,Hellmant,"A lot of fun, if you like traditional 'tough guy' action movies.",7,27 April 2018,"'BRAVEN': Three and a Half Stars (Out of Five)An action-thriller starring Jason Momoa as a logging company owner, and family man, who has to deal with some hostile drug dealers that are looking for their stashed loot. It costars Stephen Lang, Garret Dillahunt, Jill Wagner, Zahn McClarnon and Brendan Fletcher. The film was directed by veteran stuntman turned first time feature filmmaker Lin Oeding, and it was written by first time screenwriters Mike Nilon and Thomas Pa'a Sibbett. The movie has received mostly positive reviews from critics, and it's now available for rent on video and VOD. I enjoyed it. Joe Braven (Momoa) is a logging company owner, as well as a husband and father. When Joe's father, Linden (Lang), gets in a bar fight, due to his dementia, Joe decides to take their whole family out to the family log cabin, deep in the woods, for a break. Once there though, Joe and his family are greeted by ruthless drug dealers, that are looking for drugs that have been stashed at the cabin. Knowing that they'll all be killed once the men get their drugs, Joe turns to his survival instincts to protect his family.The movie is a surprisingly well made action flick. It's not overly cheesy, and some of the action scenes are actually pretty clever and fun. Momoa makes a cool action hero leading man, and Dillahunt is a great villain too (I also love Stephen Lang, in everything he does). The film is definitely a lot of fun, if you like traditional 'tough guy' action movies.",Braven
8,Robert_duder,A solid action thriller with a hint of old school,8,28 November 2018,"Steven Segal stars as....just kidding. Dwayne Johnson stars as... no no. Jason Mamoa stars as our hero but this is the type of film that Segal could have done back in the day or Johnson could do now. Some would say it's predictable and formulaic and maybe that's true but it's still a very good action thriller that hits all the points it needs to and turns in an entertaining easy watching experience. It's not Die Hard by any means but it fits the bill. It's about protecting family and being in the wrong place at the wrong time and the cast is very good. It definitely is a throw back to the 80's and 90's type ""one man survival"" movies like Die Hard but it has a lot of heart too and intense moments. It moves at a fast pace and doesn't really try to be what it's not.
Jason Mamoa leads the film flawlessly. He's a logger and a family man and a strong sensitive guy who kills to save his family. Part of me wanted to see him more like an unstoppable killing machine like Rambo but the role he plays is more realistic than that because he's not a ""former Navy Seal."" He's just a logger who has to protect his family. Garret Dillahunt is a brilliant villain. He's the old school 80's villains we loved to hate. He's this tough as nails blood thirsty drug dealer and he plays the role well. He's the perfect adversary because he has no sympathy for anyone. Stephen Lang is terrific as Mamoa's father who is suffering from early stages of dementia. The two of them have great chemistry and he adds a level of depth to the story. Jill Wagner and Sasha Rossof are also decent in small roles as Mamoa's wife and daughter.
Throughout the film, although I enjoyed it a lot, I kept feeling like it was missing something or wasn't hitting the mark in every way. This is the first full length feature for director Lin Oeding but he comes from a background of stunts and directing television and I think that's what I noticed with this is it feels like a television episode and doesn't quite hit the mark of a feature length film as well as it could. That's not to say it's not worth the watch, it absolutely is but at the end of the day it's mostly forgettable but for the hour and a half you're watching it, you will truly enjoy yourself. 8/10",Braven
9,851222,A by the numbers flick,6,6 February 2018,"Greetings from Lithuania.""Braven"" (2018) is the kind of movie which you have already seen many, many times. This is by the numbers action flick, which only great thing is locations - they are more then gorgeous. Everything else here although not bad for a boring evening stuff, but have been seen many times.Overall, ""Braven"" is a disappointing flick because it plays safely and you can see everything miles before it happens. Its not a bad flick to seeing it once on a very boring evening, but nothing more.",Braven
10,eddie_baggins,A solid attempt by Momoa,5,1 October 2018,"Setting out to prove his more than just Khal Drogo from Game of Thrones and Aquaman from the DC universe, muscle-clad actor Jason Mamoa produces and stars as timberyard worker turned thug killer Joe Braven in this gritty, if rather familiar thriller, that showcases the hulking screen presence can indeed carry a film in his own right, no trident or dragon eggs needed.Clearly a low-budget affair but one that attracted a solid cast of character actors such as Stephen Lang as Joe's dementia suffering dad Linden and Garret Dillahunt as chief big-bad Kassen, director Lin Oeding, who makes his directional debut here, slowly builds up Braven to eventually unleash an almost hour long battle for survival as Joe and Linden take matters into their own hands after a bunch of drug dealing thugs arrive at their secluded hunting cabin to claim a stash of dope that is hidden there without their knowledge.Proficiently handling the action without ever allowing proceedings to get too bloody or brutal, Oeding shows us all that he can handle the action stakes well but Braven isn't ever as thrilling or captivating as it should be, especially when this high-concept idea requires us to spend so much time in small area with a small cast.It's a wise move that Braven takes so long to get into the thick of the action as once the first bullets are fired there's frightfully little character development that happens from there on and while we don't exactly need that in film's of this ilk and we definitely don't expect it, Braven makes it relatively hard to care to much for what's going on as Joe seems to be a more than capable one man army, even more so with Linden watching his back with a rifle in hand.Great action film's set in small spaces or confined areas such as brilliant Indonesian action film The Raid or classics like Assault on Precinct 13 keep things ticking a long with a careful balance of white knuckle tension and action and enough character development to keep us invested outside of the carnage and Braven doesn't quite have that even if it makes perfect sense for the film to be your next choice for a Saturday night pizza and movie night.Final Say - Braven is loud, brash and dumb but its delivered in a manner that makes it highly watchable, without ever becoming highly recommendable. Lead by a committed Momoa, Braven is the ideal movie for when you want to switch your brain off and a solid attempt by its leading man to be more than his been pigeonholed to be as an actor so far.2 ½ father and son bar fights out of 5",Braven
11,pmtelefon,Solid action flick,8,26 December 2020,"I started watching ""Braven"" with a slight chip on my shoulder. I only have room for one ponytail wearing action star and his name is Steven Seagal. So, shame on me, I was going to make Jason Momoa earn his keep in this movie. And you know what? He does and in a major way. ""Braven"" hits the ground running and never lets go. Jason Momoa is a strong lead and the rest of the cast is also very good, especially Garret Dillahunt. Dillahunt is excellent as the villain. This movie has a good story and terrific location photography. I was on board every step of the way with ""Braven"" and plan on watching it again real soon.",Braven
12,kirbylee70-599-526179,MAMOA IN THE MOUNTAINS,9,2 May 2018,"While he had roles in a few TV series, STARGATE among them, it wasn't until 2011 that actor Jason Mamoa broke out and caught the eye of fans around the world. That was the year that he starred in the retelling of Conan as well as his role in the HBO series GAME OF THRONES. This past year he took on the role of Aquaman in JUSTICE LEAGUE and will have a solo movie as the character next year. The nice thing is that in the time he spent as a bit player up till his starring roles you can watch the journey he's taken towards leading man status. This week we have him as the main star in BRAVEN.Mamoa is Joe Braven, the current head of a family owned logging business. He lives in town with his wife Stephanie (Jill Wagner), young daughter Charlotte (Sasha Rossof) and his father Linden (Stephen Lang). A dedicated family man he and his wife work opposite shifts not just to have two incomes but so that one of them can be there to keep their eye on his father. This strong man who once ran the business Joe handles now is suffering from dementia, enhanced when he crashed a helicopter the year before.The dementia is bad enough that one night Linden walks out of the house to a nearby bar asking a young woman to leave with him thinking she's his wife. The girl's date take offense and he and his friends begin beating on Linden before Joe, called in by the bar's owner, gets there to take them on himself. When the police show they find the group handled by Joe but don't press charges against him or his father. The doctor suggest they get full time help for him.As all of this is going on Weston (Brendan Fletcher), a driver for the Braven business, is taking a load of freshly cut trees to a nearby town. To make extra money he's agreed to pick up extra logs containing drugs, working with a low level dealer named Hallett (Zahn McClarnon). A blow out sends the truck and the logs off the road and the pair pack the drugs up in duffle bags before the police can get there. Weston knows that the Bravens have a cabin nearby and suggest they store the drugs there. Hallett calls into the man he works for, Kassen (Garrett Dillahunt), who gathers his men and heads to their location.Joe and his wife have discussed the situation with his father and while she stays home with Charlotte the pair head to the cabin to shut it up for the season. In reality Joe wants time alone with his father to talk about his condition and to make the difficult decision of what to do about his failing mental capabilities. Once they get there they find that Charlotte has stowed away wanting to go along on the trip. They also find the drugs left in the cabin.Heading into town it happens to be just as Kassen and his men have shown up and shut down the road heading to the cabin where they show demanding the drugs. Knowing that once they have them they'll be killed, Joe and Linden must do what they can to survive and to protect Charlotte. The siege is on and the battle for their lives begins.The plot of the movie is simple in structure and has been done before. What makes it different here is the added complication of Linden's fall into dementia. He's there at times but drifts off at others. And yet Joe must count on him and his skills with a rifle to help him if they want to survive. Another difference between most films of this sort is the arrival of Stephanie who helps take on the bad guys from the outside. So instead of the stalwart hero we're used to we now have an elderly man and an empowered woman in the mix. And it works excellently.While all of these characters play their part there are three main roles that it all circles around. Mamoa shows that he's been working on his acting ability. He handles the physical aspects well and is certain to enjoy a successful career as an action star. Lang could have drawn all attention to himself in his performance here but instead shows he's a giving actor providing a fantastic supporting role to Mamoa. Dillahunt's performance as Kassan is subtle and brutal, from his smashing in the face of a dealer who works for him when we first see him to the military like precision he commands those under him as they attempt to take the cabin.There are plenty of action films that come and go, too many to count. Most of them offer a decent night's entertainment but few offer an actor whose star is on the cusp of rising like Mamao's is. Watching this film in addition to his other offerings shows he has the potential to become a top star. Couple that with his humble behavior on talk shows he's visited and one can only wish him well. BRAVEN is a step in the right direction and for action fans a movie to enjoy right now.",Braven
13,peterp-450-298716,Momoa looking impressive in a not so impressive movie.,5,20 March 2018,"""You know if you give the other half,
we're as good as dead.""I've read an article somewhere titled: ""10 Reasons why you should watch Braven"". I agreed with a few points. You could say the movie is a retrospective of action films from the 90s. But there are reasons enough to simply skip this mediocre action film (for you to discover these reasons while reading). It's not because Jason Momoa became known to the wider public as ""Aquaman"" that you can call this film successful. Personally, I thought he was superb in ""The Bad Batch"". And even in the ridiculously bad movie ""Wolves"" he was the one who impressed me the most. Most probably because of his impressive muscles and those special colored eyes. But even those hypnotic eyes can't really improve a movie like ""Braven"".In ""Braven"" Momoa plays the robust owner of a logging company, Joe Braven. And with that, the title of this film is explained allready. Joe is a good-hearted man who's concerned about the welfare of his employees. He's a true family man who truly loves his wife Stephanie (Jill Wagner) and adores his daughter Charlotte (Sasha Rossof). And then there's his father Linden (Stephen ""The monkey's paw"" Lang) who shows signs of Alzheimer's so he doesn't find the Christmas lights and thinks strange women are his dead wife. And that's the source of misery. The moment Joe decides to go to their isolated mountain cabin with his father to discuss possible options, he doesn't realize that some obscure drug gang is using this hut as a storage for a significant amount of drugs.One thing certainly isn't missing in ""Braven"". And that's the aspect of predictability. The fact that Joe and his father are present the moment this drug gang tries to recover their goods, isn't exactly a surprise. Also Joe's daughter Charlotte belonging to that group of stubborn teenage daughters, is something you could expect. And that stubbornness also kicks in at the least favorable moment, so Charlotte is also present during the confrontation. Not problematic enough yet? Trust me, Joe's wife Stephanie also has a membership card from the club ""wifes-who-always-show-up-at-the-wrong-time"". Fortunately, Stephanie excells in the Olympic discipline of archery.There are also a lot of what-the-hell moments. Father Braven suffers from delusions and forgets a lot, but appears to function well when he's under pressure. Fortunately he wasn't delirious during the confrontation and started to think that one of the gang members was his son. That would be rather problematic. I also found the fact that a hair band gave Kassen immediate insight, rather impressive. And then there was that nonchalant thrown down knife. Hold on tight. Although this was an immense forest, the one who it was intended for actually found it. Rather ridiculous. Especially when you see the same guy bumping into a tree just before that. After which he looks at it in a surprised way, thinking ""What's this tree doing here in this forest ..."". Hilarious.""Braven"" isn't really bad. But you won't be blown away by this clichéd action movie either. Even the use of an axe on fire, won't get you ecstatic. Ultimately, you can only conclude that thousands of such films have already been made. To finish on a positive note. Garret Dillahunt can join the group of most intriguing badguys in film history. A cruel person who smashes someone's head and looks at everyone with an apathetic gaze. Indeed a psychopathic figure. But just like the rest of the film, not really innovative and far from intelligent.",Braven
14,pachara87,"Not one of Momoa's better B-movies, but hopefully one of his last",3,17 February 2020,"Engaging at times, giving Momoa a chance to play a normal guy for a change, but the picture is caught between two tonal extremes, lacking a master plan to mix drama and woodsy mayhem.",Braven
