,User_name,Review title,Review Rating,Review date,Review_body,Movie_name
300,olliemankz,Falling outside of the cracks,5,14 March 2014,"Event Horizon put me in mind of two other movies, Alien, of course, and Forbidden Planet. You have a crew made up of people who are clearly British as well as American so things are pretty international by the year 2047. Either that, or the redoubtable Jason Isaacs and the adorable Sean Pertwee are incapable of doing American accents; somehow I think it's the former. They all board a ship that has been missing for seven years and so naturally we're wondering what kind of Alien-like surprise they're going to get.The movie was wonderful and on the brink of terrifying up to the halfway mark. I was asking myself why I had barely ever heard of it until the second half when we get into the Forbidden Planet version of things. I'm not sure if I can say this is completely Forbidden Planet as what lurks within may come not just from man's own delusions but whence those spring. But somehow this movie does not deliver on that side. I was enjoying some reviews on the platform on which I saw the movie, Netflix, and there as well as in places here people discussed how terrified they were by the movie's dark implications particularly when young; one person said Event Horizon ""destroyed my childhood."" Possibly then its ultimate theme speaks best to the beautifully naive among us where the truth touches a core.I will say, Forbidden Planet destroyed my childhood, or at least my walks to school. Trying not to give anything away, but somehow the symbol of evil in that one transmogrified to huge dinosaurs dogging my every step; I kept turning around expecting a tyrannosaurus rex rearing up on the horizon. I was also terrified of brontosauri but was told they were only herbivores, although I suppose being stepped on by one would not be fun either. Anyway, I think Forbidden Planet was a far more effective film than Event Horizon -- and to those who love Forbidden Planet, please forgive me if I am way off in comparing the two -- and that is why so few of us know about Event Horizon. As many have said here it could essentially be classified as a horror film, with comparisons, say, to even The Shining and others. I know there is a film I have seen recently which garnered the same reception of, ""It's really scary when you think of the deeper implications."" I think that may have been the David Caruso cult classic Session 9; oh, another one you hadn't heard of before either? It's worth checking out. I would half, er, have to leave my recommendation on Event Horizon at the halfway mark. It's worth a check out if only for its place in sci-fi or quasi history. Grab your partner and your popcorn because you're in for a ride. But you'll probably have no trouble sleeping.By the way ... Jason Isaacs is adorable, too. But it wasn't until I caught him in Sweetwater on Netflix that I began to look for he-of-the-impossibly-clear-eyes elsewhere and thus came to Event Horizon. Now there's someone about whom I have to ask ... why I had I never heard of him before?",Event Horizon
301,resetzero,"""...this movie needs a damn sequel""",10,6 May 2017,"This movie is the red diamond in a sea of white diamonds. It is beautiful. The sets, the cinematography, the story, the acting, and especially, the art style. I know this movie has so many ties and influences by other movies, such as Hellraiser, The Shining, The Amittyville Horror and more, but they have been combined and utilised perfectly.Laurence Fishburne and Sam Neill are cast so well, and the way Sam's character progresses is so haunting. I love the way Laurence never cracks a smile in the whole movie, and is always the voice of wrath. It makes it that much better that he deals with the voice of chaos, that is Sam Neill. The scene between them, when Weir is explaining to Miller about how Hell is just a word is possibly my favourite scene, and leaves it wide open to the possibility of these two becoming arch enemies in future movies. Because, lets face it, this movie needs a damn sequel.I'm really annoyed to hear that this movie was cut short in its release. From the sounds of it, the movie could've been even better than what we know it as, had Paul Anderson got his way with the final cut. Either way, I'm happy with this version, and I definitely want to see Laurence Fishburne and Sam Neill reprise their roles in a sequel.",Event Horizon
302,brian531,Didn't age well,6,16 October 2021,"Like most movies from the 90s, this did not age well. I remember watching it as a kid and thinking it was great. Unfortunately that's not the case anymore.",Event Horizon
303,Odysseus-5,Hey - I liked it!,8,9 September 1998,"Finally!  A film that is more than just a splatterfest in space!  I think fans of classic horror (I'm thinking _The Haunting_ and other such) will enjoy this production.  It is a well-cast, solid, and intriguing haunted-house (or should that be spacecraft?) tale with an engaging plot where, refreshingly, most of the true horror occurs in the minds of the characters, rather than in the blood-soaked machete' of some mute killing machine or some wise-cracking psychopath.  I was a little let-down by the fact that they had to turn Sam Neill's character into the more-or-less typical antagonist, but otherwise, a solid horror film that will leave you thinking!",Event Horizon
304,aro-2,"Truly terrifying, but still entertaining...",8,24 December 1998,"Event Horizon starts out with much promise: in 2040, a deep space research vessel, the Event Horizon, is sent out on its maiden voyage and was believed to be destroyed. However, in 2047, it returns and is found in a decaying orbit around Neptune. A search and rescue ship, the Lewis and Clark, is sent out to investigate the Event Horizon's mysterious return. On board the Lewis and Clark, as well as the rest of the crew, is Sam Neill, the scientist who designed the Event Horizon. He explains to the crew what the Event Horizon was designed to do: travel faster than light. When they finally board the Event Horizon, they find nothing but the body of one crew member, and what appears to be the partial remains of the other six. From there, the film goes slowly downhill.If Anderson's only goal with this film is to make the audience jump out of their seats, then it's a masterpiece. However, there is very little suspense. It's a film where you're not wondering who dies next, but, rather, how that particular person will die. There is only one scene in the film that creates true suspense. It involves one of the crew being trapped in an airlock. To make matters worse, you don't really care about any of these people whose lives are in danger. The simplest of backgrounds are given to a few of the characters: Neill's dead wife; Quinlan's son. One thing they left out, though: before Neill cuts Pertwee open you can see a rather large scar on his chest. I wonder if an explanation was originally scripted.Out of the two previously mentioned backgrounds comes the source for the film's most terrifying scenes: the scene in the green tunnel; Quinlan's son appearing in Medical. With the best scenes now described I can get on with the films main strength: terror. Very few films can give you such a feeling of dread. It's a very psychological film(not in plot, but in atmosphere) that's bound to disturb even the most desensitized of Horror fans. The images you see are only a part of it; the lesser part. The psychological aspect is much too intense for words. It must be experienced. Event Horizon doesn't just contain those feelings of dread and terror, it leaves them with you long after the credits have finished rolling.The special effects are incredible. The model ships are so good that it's almost a shame to see them destroyed. The destruction of the Lewis and Clark is one of the most realistic and believable scenes in the film. The interior of the Event Horizon is also great. It's the most important contributor to the atmosphere. Actually, it's the only contributor. It allows Anderson to use all his tricks to make the audience jump in the setting they would work the best. This way he doesn't have to do quite as much work. That said, he's given his film a remarkable visual style.After all of its faults I must say that I found it to be very entertaining. I would strongly recommend seeing this while it is still in the theaters, but beware: it doesn't leave much to the imagination. You get to see bits and pieces of what happened to the crew of the Event Horizon, in very brief, but graphic, images. Also, you get to see what happens to the crew of the Lewis and Clark in not so brief, but just as graphic, images.",Event Horizon
305,decoyb4u-3,"Revolutionary sci-fi, with a bitter end.",8,27 May 1999,"Event horizon is one of those movies in time that changes the way you think about movies. Many movies today, aren't original at all. They don't have anything new to offer. Just the same story, with some add ons, and some back drops here and there.With Event Horizon, you get sci-fi horror so magnificantly unique, you'll have a hard time wondering what to expect. The movie Event Horizon focuses on timetravel, a technology I doubt will exist at all in the future.""Event Horizon"" is the first spaceship that can travel through time. At the launch of the ship, something goes terribly wrong. The ship vanishes without a trace. Decades later, returning, empty, and with no crew members. A group of people with different ethnical backgrounds, and personalities search out to explore Event Horizon, and maybe discover some clues as to what happened.Event Horizon is a must see. It is near quality of the suspence in Alien that really made the sci-fi versus horror theme. You'll also understand, that with only some movies, the end can destroy so much, even though the rest was excellent. So, if you see Event Horizon, think of an ending, and see what you didn't expect to happen. Believe me though. Event Horizon is exciting and crisp original. Enjoy.",Event Horizon
306,EdCurtis,Depressing ending kills this film.,4,1 June 1999,"A moderately suspenseful ""Alien"" knockoff, ""Event Horizon"" is done in by excessive ickiness and a real downer of an ending.  Only for the cynical.",Event Horizon
307,StarWarsDisco,Dumb and derivative,2,28 May 2018,"It seems that nerds love every sci-fi/fantasy movie ever made and have no standards. To read the reviews you would think this movie ranks right up there with Alien(s). It doesn't. It's crap. Surprisingly poor acting from a decent cast, I guess you can only do so much with a mediocre script and clumsy direction. I should have known from the IMDB rating that this would not be that good, but oh the reviewers. Shame on me for being fooled twice, three times, etc.",Event Horizon
308,jarkantt,People scared in space!,8,7 November 2003,"Director Anderson delivers a well made scifi-action movie straight to your home.Effects are great and when I hear them speaking latin, it makes me thrilled. Plot is quite good and so is acting too. The movie just has some sort of effect on me...",Event Horizon
309,pi4630,Waste of time,6,5 November 2002,"I don't know what happened here. Despite a strong cast, the story or better this movie goes nowhere. I was ""glued"" to the screen in order to see when this movie would ""take off"", but nothing happened. Laurence Fishburne and Sam Neill making me sleep, wow, I wonder why they ever accepted such a script. Now, I *am* a scifi fan of the genre, but please do stop making movies that haven't a good story behind. A movie is not made only of effects, but also of dialogues, structure and psychology. This one looks like having shred tons of scifi movies and pasted ""something new"" together. Forget this one.",Event Horizon
310,gonzalus,"Gore, blood and death ... in space",8,26 August 1999,"Yeah, this is a perfect gory movie. I believe is going to be a classic one day. Same kind as 'the evil death' or 'texas chainsaw massacre'. Lots of blood, crazy people, suspense and a couple of really surprising scenes. And the incredible claustrophobic feeling of 'Alien'. Horror detractors abstain, please.",Event Horizon
311,pharaoh-008,recommended for all horror fans,10,7 September 2001,"I can't imagine this movie scoring this little. If I listen to everybody around me, there isn't 1 person that said they didn't like the movie. Everybody is just crazy about it.The cool thing in this movie is the element of imagination of the viewer. The movie is not one horror special effects ride through the film, but surprises the viewer with flashes. It serves this movie well, because of the Science Fictive ambient they are in, which is done superbly.I just love Neil and Fishburne in thisone. The other actors make the movie complete, because of their appearances that followed in damn good pictures.So thisone I recommend to all horror fans.",Event Horizon
312,andymike-75725,Really fun and atmospheric movie,8,17 November 2018,"I have always been a sucker for this kind of movie. You know a movie where a group of people for whatever reason get stuck somewhere where something has gone bad and they need to figure out what is wrong to try to stay alive.The setting is excellent and the atmosphere is really thick, especially so in the beginning. For better or worse this is not the standard monster movie, at least that is the case before the ending where things start to move perhaps a bit too fast for it own good. With that said i found myself intrigued and interested throughout the entire movie even though it certainly had a different feeling to it in the end compared to the beginning.I think that the movie would have been even better if they made it a bit longer and explored Weirs motivation a bit more in depth. Then again there seems to be plenty of people who though that this too long and boring so perhaps they made the right call.With that said they really succeeded in bringing this setting to life and everything from the actors job to the sets were outstanding. The movie is well worth a watch if you are interested in this type of movie.",Event Horizon
313,Mansilla,"Well, it scared me",8,16 April 1999,"As other users have said this may not have been the greatest film ever shot, the acting may not be perfect, and I suspect a lot of what was originally shot ended up on the cutting room floor, making some of it difficult to follow, but this kept it to a manageable length, rather than having it ramble on for 2 1/2 hours, which far too many films do at the moment.The film had some stunning visuals, and while effects don't make a film they certainly help. It also succeeded in scaring me, which is rare. And for that alone it gets a good mark from me. Most 'Horror' now is appalling, it's all either very very tame (I know what you did last summer) or so tongue in cheek it becomes a comedy (Scream 1+2, Bad Taste), so it's refreshing to see something that went out of its way to make me jump.I gave it 8/10.",Event Horizon
314,has_no_pseudonym,Event Horizon is about the last movie you should ever watch,1,22 January 2002,"This movie is gory, violent, disturbing and sick beyond almost anything I have ever seen. The plot is convoluted and well, stupid when you get down to it. I don't know what they were thinking or taking when they came up with the script for this movie. This movie can be vaguely interesting, but it completely throws you off with its, let's be blunt here, boring plot and grotesque violence. The special effects are probably good, but all the visuals are so ugly, disturbing or stomach churning who really care about the special effects or the characters for that matter. Though you end up wanting some of them to survive to make all the things you had to watch them go through worth it. Another disappointment is that this movie has several good actors in it and it goes to show that some big names can't drag a movie out the quagmire the director and scriptwriter created.If you don't want to be seriously mentally disturbed for at least several months, avoid this movie at all costs. I give this a 1 out of ten.",Event Horizon
315,Fractalizer,Underrated Sci-Fi Horror,7,2 August 2001,"This one is not as bad as the rating here suggests. I was drawn into the atmosphere right from the beginning and immediately bonded with the characters. The increase of tension as the crew approaches and then enters the ship is very well paced. The way how hints that something very strange is going on become more frequent and less subtle kept me on the edge of the couch.As the nightmare unfolds there are some truly scary scenes to be savoured. There is a very personal component to this nightmare for every character, which adds depth and originality to many of the jump / gore scenes. This also creates interesting situations when the characters try to communicate their experiences to each other. It's all in your head, right?The whole thing becomes a little inane and over the top towards the end, but if you like this genre just the slightest bit you probably won't mind too much.There is a load of great special effects in this film (I especially liked the zero-g stuff), gorgeous set pieces and all kinds of neat little high-tech props. This combined with some Hellraiser style splatter and gore - a truly enjoyable experience!If you can get over the flaws that this film without doubt has (read other comments to find out what they are) my recommendation is: lights out, volume up and enjoy the ride!Rated 7/10",Event Horizon
316,Elliotdoesreviews,The greatest movie ever made,10,20 May 2021,"This is the greatest movie ever made.If you wish to argue with me on this I will meet you at a location of your choosing and engage you in a fistfight until you change your philistine mindset.Also Paul WS Anderson didn't put his talentless wife Mila Jovovich in this one, which instantly qualifies it as the best movie he's ever made.",Event Horizon
317,RJGodin2,confused rehash of Solaris ideas,3,31 July 2009,"Event Horizon is a horror exploitation of the concepts presented in Solaris. It takes horror cues from Alien and Don't Look Now and mashes them with Solaris and 2001 to make an ultimately unsatisfying film.It takes off from some real physics concepts (e.g. folding space) which were also already used in Dune and then amps up the gore. Many aspects of the story don't get fully developed and are left hanging.The set is elaborate and the computer effects extensive. It shows that much more time, money and effort were put into the stage craft than the story and character. Never a good ratio for movie making. It makes you wonder what the original script might have looked like.A rather derivative, disappointment.",Event Horizon
318,tnelson2-374-411051,This is the best sci fi horror film since alien.,10,18 September 2021,"This film is awesome. There I said it. There's a sizeable chunk of people who think this film is crap. I'm here to tell you they're wrong.The cast. All excellent. Fishbourne, isaacs, pertwee in particular are superb. Some really well timed humour hereixed with a sense of desperation. 'This ship is fucked' and 'We're leaving' - all the cast deliver with no weak links.The visual effects were slick as hell in 1997 and still hold up now for me. Some of the zero gravity and spaceship shots are still absolutely stunning.The set design. Oh my god, the set design. Just utterly fantastic. Witness the techno gothic bridge, or the swirling, cheese grater corridor to the gravity drive. The gravity drive itself, just a crazy spiky twirling room of doom. I'm struggling to think of many films that surpass event horizon in this area. It's creative yet still feels realistic.The cinematography - from the vertigo inducing pull back space shot to the creepily lit ship, the 'green corridor' scene, this film just looks GORGEOUS. Every single shot you could pause, make a poster out of it and put it on your wall. Not many films get that accolade from me.The sound design - wether it's the pounding score to the explosions or the jump scares. The sound on this is top notch.The gore and violence. Well, this film is still seriously messed up. There's some imagery in this that has seared itself into my memory. It's uncompromising in it's severity, and I love it for that. I would give one of my testicles to see the extended directors cut that we'll never get to see.And would the likes of the 'dead space' games have been the way they were without this film? I'd say absolutely not. The atmosphere in this film is just excellent. You've got Latin, hell, the works here, combined with the creepy feel of the the first two alien films and it's so, so good.Even though this film has influenced popular culture it was also influenced by the 'alien' films itself, but I'd say it's better than all those bar the first two, and secretly, I think this is as good as the first alien film. It's gone from box office bomb almost to the definition of one of the biggest 'cult classics' of the last 25 years - at least in the sci fi and horror category.That's how highly I rank this film. So here I am. This film is a masterpiece. Fight me.",Event Horizon
319,matrsowner,"Ignore all of the ""1"" reviews which this films attracts",9,24 July 2018,"Interesting reading through the reviews on this film. They're a mixture of sensible reviews from people who've watched the film and been happy to suspend some disbelief, and then all the conspiracy of ""1""s that come across as people ganging up on the film. Yes, it takes inspiration from greats of sci-fi and horror, and quite unashably in many ways, and the science and ship design are a bit flawed if you're interested in spacecraft construction, however look past that and it's a really entertaining film. Strong cast and a great feeling of claustrophobia created throughout.",Event Horizon
320,wtdk123,"Although flawed, ""Event Horizon"" is still entertaining with great production design.",6,4 March 2017,"The sum of its parts are better than the whole, but ""Event Horizon"" features terrific Producrion design, strong visual effects and performances that drive the film. The script by Phillip Eisner, has a great concept but the writing could be better (there was an uncredited rewrite by ""Se7en"" writer Andrew Kevin Walker) and, no doubt, Paul W.S. Anderson took a crack at it as well.The handsome production design always makes the film fun to look. Spoiler: There are some dumb sequences in the film such as the character of Peters (played by Kathleen Quinlan) chasing her son and then falling in the core to her death is pretty dumb. It also doesn't make sense as to why Weir (Sam Neill) doesn't mention the delusions he has on the ship (acting as if nothing is happening) doesn't share what is happening to him. Is he in denial? It might have been interesting to find out a bit more about that and what drove his wife to suicide. End of SpoilersThe deleted scenes (some of which exist in low quality video) would have helped the film providing us with more background info but, as is, it's still entertaining with a brisk pace.Although far from perfect, this is one of Paul W.S. Anderson's better films.",Event Horizon
321,tuomaspap-72674,An severely underated Sci-Fi Masterpiece,10,27 January 2019,"When rating a movie , one must take into account other similar movies and what they have scored . Only through comparisson can you trully appreciate the score you give a movie . The fact that Event Horizon has scored the same as the movie ""Pandorum"" is an insult and anyone who has seen both will agree .Event horizon takes scifi horror to a completely new level and is up there together with the same mystery horror and frantic beauty of the likes of Aliens.With a solid backstory and real science intertwined with the creation of the spaceships as well as the various mechanics of their ""jump drives"" work , Event horizon is nothing short of a scifi horror masterpiece that does not deserve the score it has been given on imdb . For those of you who have seen this movie and agree with me , i urge you to rate this title properly as to help its rating be equal to the quality movie that it is .
For those of you who havent , watch it , then watch the likes of pandorum and i think you will see anything less than 8 for Event Horizon is a disgrace.",Event Horizon
322,NJCondon,"Creepy, But Mindless",3,19 August 1998,"""Event Horizon"" could have been a really impressive movie.  The visuals are nice, and the film does have a couple of genuinely creepy and frightening moments, which is more than can be said for quite a few so-called horror films.  However, the movie is badly compromised by characters that move about as mindless slaves to the plot, as well as by some excruciatingly bad science.  Now, this is a science fiction movie, and as a longtime fan of science fiction, I am willing to concede such unlikelihoods as their faster -than-light drive and artificial gravity; however, the gross and unnecessary violations of well-understood physics (such as the fact that the ships seem to be both indside Neptune's atmosphere and motionless with respect to it and orbiting the planet at the same time; ask yourself why you don't see satellites ""orbiting"" in the atmosphere of Earth) and the ridiculously artificial technical complications completely destroy my willing suspension of disbelief.  For years, I have been waiting to see a space-opera-type science fiction movie come out of Hollywood that shows even close to the level of sceintific and technical knowledge shown by the great majority of successful hard science fiction writers.  I am still waiting.Overall Rating:  4 (out of 10), or 1 and 1/2 stars (out of 4)",Event Horizon
