,User_name,Review title,Review Rating,Review date,Review_body,Movie_name
504,rm-07254,Enjoyable plot with dated action,6,13 June 2016,"This is a movie that is full of practical effects when needed, and hindered by the poor CGI of the time. While the plot is fascinating and forces me to think deeper than just the bloody murders, the dated cheesy action that was the norm of the time, makes me chuckle and become emotionally detached.The film is hard to tear away from scene to scene and you'll find that the movie goes by too quickly to satisfy you. And while this movie is not for the ones who become dizzy at the sight of blood, it is a cult classic if i ever saw one. The plot of the movie is so spectacular in my eyes that i would wish to give it a better rating if it were not for the fact that almost all of the action, jump shots, and dialog are all very dated.I will watch this movie time and time again despite this. Because I simply love and adore this movie. And I will always be crossing my fingers for this movie to be remade in the same way that Evil Dead was. I recommend this movie to all horror enthusiasts, and to any who wish to think about a world much darker than our own.",Event Horizon
505,oliviamteller,Amityville Horror meets Hellraiser in Space,10,8 November 2021,"You know the line from the Alien posters... In space, no one can hear you scream.Well, this ship can. And it likes it.This is one of my all-time favorite science fiction/horror movies in space.I saw it when it released in the cinema, and as I walked out, somewhat dazed, I decided immediately to buy another ticket, then went back in and sat down for another viewing.Sure, a couple of the lines were a bit on the cheesy side, but only a couple. The acting and effects were spectacular, the environments were creepy as hell, and some of the visuals will stick with you.There's some gore in it, so be ready for that. If that bothers you.Lawrence Fishburne, Sam Neil, and a bunch of other actors you'll recognize lead a rescue mission, after a distress beacon is received from a research vessel that disappeared years before out near the planet Neptune. It was considered at the time of its disappearance to be the worst disaster in the history of space travel at that point.The ship, using an experimental form of travel, has gone beyond the boundaries of our known universe. Maybe to hell itself. And it came back alive.The premise may sound laughable, but this is space horror done right.(Think Amityville Horror meets Hellraiser in space)
Give it a chance, if you've somehow missed this one. Turn out the lights and get your popcorn ready. You won't be getting up until it's over.",Event Horizon
506,thejamespearsonmusic,Thoroughly enjoyed,7,13 October 2021,"This movie gave me the creeps! I just watched it for the first time ever, and I gotta say wow! 24 years later and it definitely still packs a punch. Obviously this movie is very 90s but that doesn't mean anything. It's well done, freaky, and has some good jump scares. I will definitely watch this movie again. This is easily one of my new favorite space/horror films, or old favorites, or whatever.",Event Horizon
507,Astro-3,I wanted more.,7,4 September 1998,"Top notch cast and stunning special effects couldn't save this movie. I loved the look of this movie, but in terms of the script it left me wanting more. Not much original here.  This movie could have been a great one, but sadly fell short. I'm hoping there's a directors cut out there somewhere with added gruesome footage.",Event Horizon
508,Friikki,Very frightening... Very gory... Very good...,8,6 September 1999,"I saw this film on video with my friend's place (yet again). The movie like a combination of Alien and Hellraiser, placed in a long lost spaceship called Event Horizon. There's something evil in this ship, and everybody in the crew starts to freak out. the beginning was kind of a ""clische"", with different illusions of the crew. But when when the movie continues, i felt like this was nothing i've seen before in my life!!! And it was more that i expected. The director of the movie, Paul Anderson, wasn't exactly my favourite director (after i saw Mortal Kombat, of course). But Paul got something in his sleeves, that looked like the Wachowski brothers, with this ""spinnig-camera-in-the-space"". That special effect alone was making my stomich mourning. The flick was a little bit of gory, with lots of blood and insides. I never were a gore-fan, but in this movie i watched with pleasure, never even saying ""F*CK!!'n YUCK"". Maybe it was my sadistic side, but the gore somehow fits in the movie well. Overall:Good movie, fun to watch, with nice special effects and camera angles. I you can get on the video, buy it!!! Or if it still runs in any cinema, go see it!!!",Event Horizon
509,deadpool-4,"They can keep the money, I just want my time back",1,4 October 2001,"How in blue hell did this movie get released?  There seems to be no point to it except for scenes of intense gore, violence, and torture.  Like everyone else says: it started with some promise, but shot after shot after shot of nothing but torture, dismemberment, maggots, and sharp spikey things made this movie unwatchable.  I like a good horror film as much as the next person.  But this has a LONG way to go before it's a bad horror film.",Event Horizon
510,progman,Utter rubbish,1,1 June 2000,This is without doubt one of the worst films I have ever seen. I cannot remember checking my watch quite so often during a film. The only redeeming feature was some nice effects. As for anything else....what a waste of time. I really didn't care about what happened to any of the characters and was overjoyed when it ended. The only reason I didn't leave before the end was curiosity to see if it could get any worse.Miss this one!,Event Horizon
511,jedo1,Redefines Awful,1,25 October 2002,"Isn't worth more than three sentences. Mediocre acting, derivative production design, shallow plot, and sloppy digital effects. Please skip over this one at Blockbuster and rent anything else...""Xanadu"" would do.",Event Horizon
512,B'Elanna,A poor excuse for a science fiction movie,1,30 May 1999,"Event Horizon has to be one of the poorest excuses for a science fiction or horror movie around. Previews made it seem as if it would be a Aliens type movie. A good mix of horror and science-fiction with a strong cast. What it turned out to be, however, was a bad movie with bad acting, bad script, bad concept and just plain bad everything. It makes Lost In Space look like a good movie. Sam Neill should stick to movies like Jurassic Park and series like Merlin where the sheer brilliance of everyone else lets us forgive him.",Event Horizon
513,marchy,5.3/10 just doesn't do it justice...,8,8 November 2000,"I could follow suit and summarise the plot once again - which, seemingly contrary to the beliefs of most who have seen it, does indeed exist - but it would be pointless. My main feeling on what makes Event Horizon a film of true quality is not only the excellent storyline, highly credible acting and superb special effects, but the impression it leaves on the brain for hours after viewing. If you truly understand what is going on, the film grips you in a vice lock for 90 minutes and, if the environment (i.e. a dark room, late at night!) is right, provides you with genuine shocks and thrills other quite-unquote 'horror movies' such as Scream can't manage. Certainly, there are some very unsettling moments - the subliminal flashes are pretty sickening - but they aren't just thrown at you for the sake of audience reaction, they contribute to the haunting image the film leaves you with, and believe me it does. This is surely displayed in the way that the gore involved in characters' deaths is mainly left to the imagination, that of DJ for example was all the more disturbing for me because of the focus on his facial expression and the sound he makes. The only real blood and guts is flashed up because of brief illumination or a second-long blast of images, which adds to the tremendous intensity. Of course it also has the old-fashioned make-you-jump moments which will seem all the more nerve-wracking if you were as absorbed as I was. And to cap it all, a film with an emotive soundtrack opening with a pounding Orbital track and leaving you with one final shock seconds before Funky S**t by the Prodigy kicks in has to be good.9/10Now I want that Special Edition on R2 DVD.",Event Horizon
514,lonecap-2,I'm a little ashamed to admit.,10,14 March 2001,"Believe it or not, this movie flat out terrifies me.  I have no idea what kind of primordial nerve this triggers in me, but I've never been able to watch the whole thing straight through because I know I'll never be able to sleep.One possible explanation is that I took Latin for four years in High School, and so hearing it is a more frightening for me than for most people. Doesn't matter.  Horror films usually startle me, but don't actually scare me.  This one does, so that means it did it's job admirably.The whole thing is beautifully designed and decorated.  The characterizations are good, and don't really provide any comfort.  Nothing about any of these people says ""Hero who will succeed and save the rest of the world,"" which just adds to the tension.It's not the smartest film I ever saw, but since I respect it's emotional impact, this film gets a ten from me.",Event Horizon
515,Joshua-44,one of the worst...,1,19 January 2001,"I have ever seen, this flick belong's alongside other crappy sci-fi horror fare such as Leviathan the plot is preposterous who ever wrote it should be fired on the spot you can see the ending coming a mile away.You have to be insane to know that it's one of those hell movies it just plain sucks. I can't think of any other movies that it belongs to on the crap heap but I know there are more, be warned view at your own risk.",Event Horizon
516,bobbyparsons,What did I just watch?,3,15 April 2006,"What in the world did I just watch? It seemed to be a jumbled up mess. I've had this movie for several years, but I had never watched it. I just popped it in, and was surprised how bad it was. Why did they cast Laurence Fishburne in this movie. He was terrible in it. He's a black man who acted White the entire movie. I've never seen a black man act so stuck up in a movie before. Sam Neill's character didn't even make sense to me. He's supposed to the bad guy, but what exactly made him go crazy? We never get to know. Things aren't explained how they should be. Event Horizon seemed to be a hacked mess. It kinda reminded me of a new outer limits episode. I wouldn't saw this movie is unwatchable, but it is very basic and nothing exactly original. Someone said let's make a Scifi movie, and put a Hellraiser spin on it.... I wouldn't recommend this film....",Event Horizon
517,mixmasterkev18,Not the best but certainly up there,9,8 June 2007,"I believe this film defines the phrase ""SCI-FI thriller"". A great story in its whole. Combining ideas of futuristic space travel/inventions shaken up with a bit of ""thriller/horror,"" the film doesn't necessarily keep you on the edge of your seat, rather you can stay in your seat and enjoy a well thought science fiction movie. The only fluke with the film is with Justin, he would have ""decompressed/incenerated"" instantly, but I guess that wasn't in the script. The movie, I believe can be thrown up on the wall with movies like The Fifth Element and the X-files movie. Overall, I think this was a great movie for sci-fi nerds and the other kind as well. Enjoy!",Event Horizon
518,mike_cla006,Great movie that is SEVERELY underrated!!,10,11 November 2002,"**May have slight spoiler(s)**Another movie on IMDb that for some reason everybody bashes. Can't figure you people out. This movie is excellent; well, at least those who prefer the genre(s)(horror and/or sci-fi). For all those who keep saying it is ""un-original"", how do you come to this assertion? I can think of no other ""ghost"" movie based in deep space on an ""abandoned"" ship. I basically think of it as a ""haunted house in outer space"". The ship itself was original enough - it creates a black hole within itself and travels through it. Not sure if astro-physics works that way, but who cares, it's a frickin' movie people!!!! The gore and scares are not too over the top and do enough to scare some. My only wish is that we got to see Paul Anderson's true cut of the film before the studio got involved. This movie and Alien 3 (another masterpiece!!) deserve to be re-released as full blown director's cuts. My suggestion: get some popcorn, plop yourself on the couch, and enjoy one of the best horror flicks to come around in the last 10 years. Rates 10/10 easily.",Event Horizon
519,ctoguy,An intelligent scary ride.,7,16 July 2006,"This is actually one of my favorite horror movies. It is smart, scary, and yes, even a little disturbing at times. While some of the ideas behind the science are absurd, that is why it's called science-""fiction"".The cast does a good job in their roles, and the setting for the movie is dark, creepy, and perfectly done.I have read several bad reviews in these comments, and I have seen basically two categories of such. One is that the science involved is ridiculous. This is a movie. A horror movie. A horror movie on a spaceship in the future. I think it's time to suspend your disbelief and enjoy the movie.The second complaint I have been reading is even worse. That the movie is too scary and disturbing! I don't think I have EVER sat down to watch a scary movie and been upset that it was...scary. Perhaps the movie was accidentally placed in the children's section.Regardless, the movie is fun and scary. Exactly what most people look for in a scary movie. I highly suggest renting this gem and enjoying it for what it is: One of the better horror movies of the late 90's.",Event Horizon
520,barak_pub,Way underrated,7,28 March 2002,"This is an OK movie, not astonishing, yet worth seeing. It's DEFINITELY scary. It's not packed with originality and overall it better qualifies as a thriller/horror, rather than a Sci-Fi.Film does quite a good job, until hell bullshit begins. Of all the spooky things space might bring, it brings hell?!  Looks as the author lost his muse or else wanted to get done with the script. Scientific justification to hell.. ha ha ha.. I'm sure the pope would love to hear about it.I'd give it 10/10 in an attempt to correct it's score. I think it deserves 6/10 or maybe even 7/10.",Event Horizon
521,zedul,Hellraiser in Space,1,25 September 2001,"This movie started with some nifty looking scenery and some provocative Sci-Fi ideas and ended in a horrific blood-spattering gore fest.  It wasn't so much frightening as it was disturbing in it's frantic attempts to make us feel afraid by having actors throw rubber eyeballs soaked in ketchup at the camera.  Sheesh, they could have at least dressed someone up in a rubber suit as an alien and had them throw the eyeballs.This is quite possibly the worst Sci-Fi movie of all time.  It's just so bad I considered mailing the movie studio and asking them for a refund on my matinee ticket.",Event Horizon
522,Zaki2,"A good twist on how we define bad, evil and all that is hell.",9,25 July 2002,"I like this movie - but this movie is not for everyone. The main idea of the story is that a team goes on board to rescue a ship. However, there is something very sinister onboard - but like all good dramas, this ""sinister"" being challenges our rescue team from the inside, and not just the outside. I really liked the idea on what this movie is based on... but like I said, this is not for everyone. On a final note, make sure you have someone to watch this movie with. Anyway either you end up hating this movie, or loving it... you'll never find out where you stand if you don't watch it :).",Event Horizon
523,spielhaug,Sci-Fi Horror,10,26 November 2002,"This is one of the most scary movies I have ever seen! It is a brilliant mixture of science-fiction and horror. And the best (or worst ;-) part, is that it really hit You psychologically. It warps Your mind. It's not so much the things You see, but the things You are thinking. If You dare, see this movie!",Event Horizon
524,steviehyper,Unbelievable score!,10,14 October 2013,"Purely out of interest I checked this on IMDb and was astounded by the 6.6 score, I've seen utter tripe get 7+! It's nothing short of a crime. This film for me is one of the scariest movies ever made, and I'm a 31 yr old man that's seen a lot of them. It sends a shiver down my spine just thinking about some of the scenes. The acting is superb, the atmosphere is really uncomfortable, it's well paced and some of the cuts are genuinely disturbing. And it manages all of this without an actual monster or alien as such. A complaint about this film is its lack of originality, but I feel it should be viewed as an excellent blend of different ideas that should be put together and with no doubt works. There's often a comparison with Alien but I prefer this as it leaves a lot more to the imagination, which can be a dark place. 10/10 for me, any bad reviews must be pretentious fools who decided they didn't want to like it before they even switched it on and let their nit picking ruin their enjoyment of a good little watch.",Event Horizon
525,davek22,Tute Me!,8,30 November 2005,"I find the criticism of this film in the mainstream media quite strange. I saw this film on release and it reminded me of the golden years of sci fi (late 70s early 80s), which is maybe why it failed on original release. What gets me most is that anyone I mention this film to says how scary it is. Is this the problem with mainstream success? Can a film hit the mark to much. I do think the atmosphere of the film is very old school. There are a lot of cribs from earlier films, but when its done this well who is to ague? I have recommended this film to many people and the word has spread. If you are tired of the self reverential or remake horrors going around at the moment give this film a try And remember ""tute me inferis""",Event Horizon
526,diggerjohn111,Futuristic Horror at Its Best,9,17 June 2008,"I am amongst the group of people who loves this film. I think that this was the kind of film that fits only a special genre of fans, ""the ultra-macabre"". Many film viewers see the future as being more akin to a Star Trek-like existence, with humanity achieving an almost Utopian society and venturing to the stars unified and harmoniously, and quite boringly. This film dares say, ""Not so fast. It is scary out there."" The concept of ""inferno ex Astra"" is a literary and cinematic road not taken as often as it should be. I took from this film the idea that humanity is still young and inexperienced, and playing dice with the greatest force of nature (singularities) could lead to horrors unimagined before. Far from a perfect film, Event Horizon should still be lauded for its daring as well as the brilliant performances of the heroic Fishbourne and the deliciously evil Neil. It may be far from unanimous, but I loved this film. Event Horizon, a classic of Futuristic Horror.",Event Horizon
527,rgerstne,Excellent Sci-Fi Horror,10,5 October 2016,"I remember watching this movie when it first came out. I must have been 15, but I was intrigued, horrified and at the edge of my seat the whole time. I was already pretty desensitized from watching scary movies since I was a young kid so I wasn't really scared or anything. If you like horror movies, you'll really like this one and if you like sci-fi too then you'll love it. I had my daughter watch it but it scared the crap out of her.All the negative reviews out there seem to be from people who thought it was just a sci-fi and not realizing it's really a horror movie set in space. Just keep that in mind before you watch this and you won't be disappointed.",Event Horizon
528,CrackDima,Does not hold up,4,18 February 2014,"When I first saw this in the theater, i left feeling let down. I love the genre and any plot where someone goes to find out what happened at an abandoned ship/planet/base is alright in my book...but this movie had me audibly saying ""what?"" over and over. The ship has seen things! ""What things?"" Terrible things! ""What terrible things?"" Blood dripping down the walls! ""Why?"" Soon you will see where the ship has been! ""No, no you will not"" I'm willing to go along with any plot as long as it creates rules to abide by. But this is space. Show us where the damn ship has been. Show us what the evil life form is. An evil spirit from hell is the worst idea ever! The rest of you who give this 10/10 should stop reviewing movies please",Event Horizon
529,tyler-minder,The original sci-fi horror masterpiece!,10,20 April 2019,"Everything about this film is done so well, the writing, the acting, the horror! Best film Anderson has ever made, hands down. Could not come more highly recommended!",Event Horizon
530,archmage333,Half-assed business project instead of an epic movie from an epic idea. Seems something went terribly wrong mid-production.,7,16 December 2014,"It has so much potential and some decent actors but you can just see that at some point they all just gave up on acting and said ""Let's just finish this crappy job since we're obliged by the contract."" For whatever reason at some point the whole thing goes to hell, even the script seems to take a slight turn towards half-assing it and getting the (expensive) project done. Still it's a fun movie and technically very well done. The idea itself is great just towards the end, the whole production turns into a disgrace.(SPOILERS AHEAD>>>) It borrows cheaply from Hellraiser, of all movies. As if you need to jam a trash-horror movie from the 80s into a modern SF flick. It could have so much of a smarter movie.Long story short, to summarize in a way, I wish it was less American? Can't bother trying to put this another way.",Event Horizon
531,kevl-453,Still awesome,8,8 August 2018,"Watched this when it was released, got it on bluray, watched it today.
Is it perfect, no.
Is it starting to show it's age, yup
Is it one of the best space horror films, yup.
Give it another go, it's awesome",Event Horizon
532,oscar-egb-93,"Good, but just that...",7,3 June 2014,"""Event Horizon"" is just one of the many different sci-fi movies there are. The idea of the film is unoriginal but entertaining. This movie helped me burn some time I had left to spare, but nothing more. The characters throughout the film didn't make me love nor hate them. It didn't create any kind of feelings for me at all.Overall, the acting was good. The special effects were good (considering this film was made in 1997). The plot was good. But therein lay the problem: everything was just good and nothing more. However, what did impress me was the amount of gore towards the end of the movie. I didn't expect to see someone gouge his eyes off. Neither did I imagine seeing a corpse hanging from the walls from hooks with his guts spilled over the floor. (It wasn't actually that bad, I was just not expecting this kind of violence.)Sometimes Paul Anderson went a little over the top with some scenes, but nothing worth mentioning. Don't get me wrong, ""Event Horizon"" is a good movie and it is worth watching, but it will never stand out, at least for me. With that said, I give this movie a 7/10 (even with all those cheesy lines).",Event Horizon
533,ronski68,Great premise..poor delivery!,6,15 May 2006,"I always think about H.P. Lovecraft whenever viewing movies mixing the genres of horror and sci-fi. I'm not saying that this movie is based on or directly influenced by a Loveraftian tale. However, I'm sure that H.P.L. would have been entertained. Event Horizon begins by offering a chilling and creative premise: A space ship capable of warping space returns after missing for several years and is adrift within the orbit of Neptune. A science team is sent to search for any survivors and investigate the situation of the ship's disappearance. The team discovers that the shipped warped into a dimension of pure evil and went insane; eventually killing themselves in the process. However, what the team is late in discovering is that the ship itself has become haunted (possessed) and is attempting to murder the rescue team members. Viewer questions arise: Has the ship become an sentient evil entity, or are the possessions and poltergeists caused by residual spiritual energies?This creative premise had me intrigued. The movie essentially becomes an orbiting haunted house. What a concept! Unfortunately, the promise of a great ghost story is lost on unoriginal elements. The spooky events used to convey the plot become tired and clichéd. Visual hallucinations, sudden sounds of slamming doors, and laughing ghost children (overused in most horror movies of the late 90's) are meant to convey the atmosphere of a haunting, but fall flat.A better directorial approach should have included each member of the team offering different arguments on the causes of the haunting, bringing in a science-verses-the-world-of-the-spiritual theme. A Lovecraftian blend of the spiritual and hard science would have made this movie more thought provoking and encourage intense conversations among the viewers. This movie is an example of how many of today's directors are incompetent in utilizing sound and visual imagery to convey a creepy atmosphere. A study of ""Legend of Hell House"", Kubrick's ""Shinning"", or Val Lewton's ""I Walked with a Zombie"" would have assisted the director in forming an appropriate atmosphere for this movie. In summary..Event Horizon offers a great horror premise, but the cinematic events fail to carry it through.",Event Horizon
