,User_name,Review title,Review Rating,Review date,Review_body,Movie_name
123,Siamois,An underrated gem...,7,1 April 2009,"Director Paul Anderson has let me down on a number of occasions but Event Horizon is not of of them. In fact, this entertaining adventure in space is his best film.The main reason Event Horizon is such a success is that it visits many genres, jumping nicely from one to the other. At its heart is ""horror in space"". Science-fiction with overtones of HP Lovecraft and Clive Barker. But the key to Event Horizon is that it always aims to entertain and never takes itself seriously. We don't dwell too much on the science, it's just made as evocative as possible for the story to work. The characters are sketched just enough for us to care about them, but Anderson is aware this isn't a character drama, so again doesn't lose too much time with sappy backstories. It helps that the cast absolutely rocks. The brilliant Sam Neill, Larry Fishburne, Joely Richardson, Kathleen Quinlan and the very underrated Jason Isaacs. Despite the high tension and graphic horror, Even Horizon even has well-placed humorous bits, thanks in great part to the character of Cooper (played hilariously by Richard T. Jones).The architecture and science behind the ship (called the Event Horizon) is simply beautiful and great and contributes to the thrill ride. The ship itself becomes a character. The direction itself is a little sloppy. Some scenes rather uninspired and the editing a bit sloppy. Anderson hints in interviews that the film needed to be rushed due to studio pressure and since a lot of footage has apparently been lost, no true ""director's cut"" will ever do it proper justice.What we are left with is a movie that is too entertaining to pass, especially for fans of horror and sci-fi. Repeated viewings show that the film has very few dull moments. A solid and unique entry that inspired subsequent films (such as Sunshine).Highly recommended if you do not take your sci-fi too seriously.",Event Horizon
124,andy-227,Scared the #@*% out of me!,6,4 February 1999,"""Event Horizon"" scared the livin'...  well you know what I mean.  The taglines say ""Infinite Space, Infinite Terror"".  It doesn't say much, and it gives you the wrong impression of what you will see in this film.  After the poster and the trailers, I wrote this one off.  Then I caught it on HBO, so decided to check it out.  I suffered from insomnia after that.  IT'S THAT SCARY!!!  It's not the ship or the characters that caught my attention.  I thought the characterization was very poor (it's hard to tell or care about who's who).  But what scared me was the movie's ""monster"".  There really isn't one.  Instead, it has a demonic spirit from hell!  Many people say that this borrowed from ""Hellraiser"", but I think this was pulled off better.  It's a bomb in characterization, but it's a masterpiece of horror. I can't remember the last time I was this scared.  I mean, it really scared me!  Plus, the problem with ""Hellraiser"" is that they show you too much of the ""Hell"" stuff.  ""Event Horizon"" blasts its hell in our faces, as quick and as fierce as a strobe-light flash.  It's mean!  And at the end of the film, instead of a resolution, we don't quite get an ending.  Nor an implication of a sequel.  We get the idea that the demon was never really defeated, that the crew was never really saved.  And with that, the intense buildup of fear that is at it's peak at the climax of the film, never really leaves us!  We can't leave the fear thrown at us after the movie is finished. ""I told you she won't let me leave, she won't let anyone leave."" I honestly believe, that when the film is finished, that notorious line is true!",Event Horizon
125,FKDZ,Engaging but with lack of depth and many flaws.,5,21 May 2021,"I've had this movie on my watchlist for a while I thought, why not. It's always a movie I'd wanted to watch but wow did I not expect it to turn out as it did.If anything the story and overall plot is the most interesting thing about the movie and it's wasn't a drag to watch. But it fails at any depth or character building. The plot allows the story to get away with a ton of stuff. Some fun, some just weird.The classic punching sound effects, weird casting choice and funky music just all feel either bad, or odd. And sure, it was made in a different time. But to me it seemed like what if you give a triple A budget to a horror slasher director with a cool plot idea.The horror, there is definilty enough, and to this day still has some crazy images and moments thanks to all the practical fx. That said this movie is also filled with VFX and they simply haven't aged well so it's something you need to look beyond.All in all this was an okay movie. For me it was a movie that hit it right in the middle, not outlandish, comedic and gory, but also not too safe and I would guess a great starting point for the early horror fans of the 90s. 5.5/10.",Event Horizon
126,Come-and-Review,Could have been developed much better,5,11 March 2017,"It's been a while since I've reviewed a film on IMDb, but on this one I felt the urge to do so. Event Horizon has a well-thought premise, which simply fails to become anything good. The ""starship in distress"" trope has been used in many films, and much better. One such film was Solaris.The fact is, I enjoyed Event Horizon's first half or so. It had some stupid jump scares, all right, but until then, the mystery was well executed. I believe the story started to get stupid and ridiculous when a certain video showed up.Who's seen Solaris (mind, the 1972 Tarkovskij film) might remember a similar plot: a Space station near a planet reports of certain anomalies that occur on board, as well as the breakdown of the scientists working on the station, and a Psichologist, Kris, is sent. When the Kris gets aboard, a long series of really unsettling and scary events and circumstances ignite to the viewer, and what's relevant, with almost no gore. Some might say Solaris is boring, but, damn it isn't. It's very scary, and also much deeper than many movies. Now, Solaris is also a masterpiece of cinema. Is it fair to confront this film and Solaris?The fact is, that the story of the two films is similar. Sam Neill's character is in this movie's first half in almost the same situation as Kevin, there's the theme of the unknown and the alien dealt with in a similar manner, the setting is almost entirely one space ship / station's corridors.So whats's the difference? The way the material was dealt with. Solaris is clever, unsettling, lets the viewer have deep thoughts but also freaks him out. Event Horizon is, on the other hand, full of Jumpscares (a quite cheap way of scaring the viewer), mentions superficially some aspects that might have been dealt more deeply (e.g. what happened to the ship), and destroys all the premises it built up in the last 30 minutes, letting go to a flow of endless gore (another cheap way of scaring the viewer). Even the ending wasn't satisfying. All the actors did the best they could, Sam Neil for example executed well his role, even in the final arc, even if I personally hated that part of the film. VFX and photography, for a 97 movie, were fine-ish, as well, also I remember that I appreciated some shots and even the set designs. The technical side of the film was well executed. What went wrong, terribly wrong, was the story, and the ultimate meaning of the film.The movie's first 20 minutes made me want to give it an 8/10, the next 30 minutes a 6/10. The final arc was worth a 3/10. Therefore, I feel right to give it a 4.75/10, approximated via IMDb rating system to 5/10.",Event Horizon
127,Beyondtherain,Was expecting something much more out of this world.,7,25 February 2021,"Good horror movie...but I feel the directors original cut was probably insane which makes this version we have seem slightly dull in my opinion... Jason X is more fun, oh well. Lol",Event Horizon
128,apjc,Good actors - bad film.,1,30 October 2017,"I sat through an hour of it and got bored with same old same old. I don't know if it turned into some blood gore fest, I really don't care. The story-line is leaden, the characters are uninteresting, I really hope they all died and the alien was worth waiting for. CGI, lighting, cinematography, NO I want a story that either grips me or draws me in, first 2 Aliens did that.",Event Horizon
129,welhof1,More horrory than sci-fiey,5,5 May 2020,"I was expecting a futuristic space traveling type movie but instead got some B rated horror movie. Lot of scary gruesome scenes. Lot of times things jumped out at you, which I hate.The 'funny comic relief black guy' stereotype was unnecessary but this was filmed over 20 years ago. I guess there was a lot of that then.Effects were decent though. Pretty good for late 90's I guess.Don't expect a lot of cool space travel scenes. Expect an 80's horror movie in space.",Event Horizon
130,ryangilmer007,"great look, terrible result",3,22 January 1999,"As a Science fiction movie this isn't great, but it's at least enjoyable. However, as a horror movie, this is straight out of Hellraizer territory. While some elements, like the upside-down cross design of the ship and ""gravity drive"" add to the ambiance of the movie, as soon as the ship is boarded all aspects of the movie go south.  Normally dependable actors are left with terrible writing as instead of acting with each other, they interact with the ghosts of their past.  Their worst fears come to life and consume them.  Eventually the ship from hell is destroyed, but not without the threat of a sequel.  OH MY!!!",Event Horizon
131,repojack,An underrated thriller in space,8,28 October 2020,"A fantastic ""horror in space"" thriller led by an excellent assemble cast (Laurence Fishburne, Sam Neil, Kathy Quinlann). Do we really want to know what can be found at the edge (event horizon) of a black hole?",Event Horizon
132,utahman1971,What is wrong with people?,10,2 January 2019,"This should be higher rating than 6.7, and Roger Ebert sucks big ones. This is one of my favorite horror movies of all time. Who would listen to him anyways? Jeez, people are dumb. People get paid to be dumb? Yeppers!!!!Once, you hear the mission, they in for it until the end. I would of loved a sequel of this movie but it is way so late and many years later, a remake would be done. I probably still love this one after a remake. I like some remakes, that people complain about on their own. I would love to see more movies like this one.Instead we are getting The Conjuring movies and spin offs that are not even scary, and people saying they are. Pffft! I laugh at those people. I could watch this one many, many times over again, and still have no issues of seeing it. People are nuts if they rate this low.",Event Horizon
133,stevelivesey67,Looks good,6,3 May 2021,"Spooky in places, looks good but makes no sense at all.There is 30 mins missing somewhere. Pray for the directors cut to Come out.",Event Horizon
134,moviecollector,an excellent sci-fi film,10,5 April 2000,"Ok, it might have been dumb 2 many people but I'm a sucker 4 these kinds of movies. this movie rocks, I loved the gore & blood. Its 1 HELL of a movie. I thought the cast did a pretty good job. Some scenes were taken from other movies, blood flowing out is from SHINING but who cares. As long as it entertains me, its alright with me. The final battle is great & the creepy ending is excellent. The song by Proginy in the end is so awesome. If u love horror/sci-fi films, rent this. its worth it.",Event Horizon
135,quinimdb,Event Horizon,3,20 October 2016,"""Event Horizon"" was apparently pitched as ""The Shining"" in space, and maybe that would've been a good movie, but that is not the one I watched. The film begins and it's other obvious influence of ""Alien"" (and ""Aliens"" for that matter) also shows, only these people don't feel like real, working class people like the ones in ""Alien"", they feel like movie characters, and this continues throughout the film. They pause during dramatic moments, they are sometimes seemingly unfazed by the chaos around them. The choppy editing, pointless Dutch camera angles and crash zooms, and the constant, cliché score take a lot of the tension out of the film, and each jumpscare is incredibly predictable and ineffective. Unlike its supposed influences, it does not create a sense of tension and dread through silence, but rather only uses silence for a few seconds before each jumpscare. Not to mention the incredibly cheesy special effects that attempted to use CGI, and failed horribly, looking far worse than ""Alien"", ""The Thing"", ""The Shining"", and it's many other much older influences.Paul W.S. Anderson wanted so badly for this to be like the movies he loved, but forgot entirely what made them so great.",Event Horizon
136,extravaluejotter,"""Solaris"" meets ""Hellraiser""",1,20 December 2005,"Despite a talented cast, great production design and some awesome special effect scenes (the opening shot of the space station in Earth orbit made my vertigo kick in!), this is a very disappointing film.Taken as a straightforward horror movie, it delivers some unsettling shocks to begin with but quickly moves into ""guessing who's gonna die next"" territory. Yawn. One character transforms into something resembling a ""Hellraiser"" Cenobite and the ending smacks of the ""Alien"" series of films. As a sci-fi film, it could have been so much more complex and involving, but the lazy ""All Black Holes lead to Hell"" premise slams the door on a more imaginative explanation of the original Event Horizon crew's bizarre behaviour and messy deaths. Less emphasis on gore and simple shock tactics might have swayed me more in the film's favour, but ultimately the screenplay cops out of asking questions. Instead the viewer has to strap in for a derivative ""thrill"" ride. I watched the film until the end - hoping that it would get better - but I reckon that most of the budget went on the wonderful production design and the wages for the talented cast.I'd be interested to see a Director's Cut (if Paul Anderson ever releases one) but it would have to be a lot more like ""Solaris"" or the first of the ""Hellraiser"" films for me to recommend it.",Event Horizon
137,MovieFan983,Highly Underrated,10,22 January 1999,"This film, if u watch it is very good. It's scary, and gory, and I could watch it over and over. Why do u guys not like it? The movie itself is very powerful in a way, only hardcore horror fans could see it as. It gets a 10! Rated R for strong sci-fi violence and gore, language, and some nudity.",Event Horizon
138,Cirene404,Event Horizon (Short Movie Review),7,1 June 2019,"Positives:
Most of the directingAtmosphereTone and pacingProduction valuesNegatives:
CharactersEditing",Event Horizon
139,1bilbo,Dreadful,1,16 April 2021,This movie just doesn't make sense.Over the top special effects do not make up for a lousey plot.I get the impresion that the director ran out of ideas after the first half an hour.I love sci-fi but this is just a weak exploitation and not worth your time.,Event Horizon
140,xbrad68,SCARY SCIENCE FICTION AT ITS BEST,10,20 June 2004,EVENT HORIZON is scary science fiction at its best. The sphere that thinks on board the ship the EVENT HORIZON is like a biomechanical computer that terrifies everyone it encounters. The ship went missing seven years earlier as it was testing faster than light travel. It picked up a sphere of unknown origin and then at faster than light speed was lost in a black hole. The rescue ship LEWIS AND CLARK arrives seven years later. Some reviewers have callously described the ship LEWIS AND CLARK as a salvage ship. Calling a ship LEWIS AND CLARK seems to imply a schism of the mind because it is multiple named and foreshadows the madness among the spacefarers that is to come caused by the sphere. The interaction between Laurence Fishburne as Captain Miller and Sam Neill as Dr William Weir is OK but two great actors seem to be limited by the words in the script. It is revealed that both men must have gone into the sphere and a real fear of faster than light travel begins to manifest itself. I gave EVENT HORIZON a 10 out of 10 mainly for its cutting edge special effects.,Event Horizon
141,MetalGeek,Underrated-As-Hell Sci Fi/Horror Hybrid,7,13 September 2010,"""Event Horizon"" came into theatres in 1997 without much fanfare and disappeared in about a week, but when I rented it on video (back in the VHS days) I found it to be a very enjoyable blend of science fiction and horror with great special effects and set design, creepy atmosphere to spare, and decent performances from veteran character actors like Sam Neill and Laurence Fishburne. Why wasn't this movie better promoted? Over the years it's slowly been developing a well deserved cult following, as more and more people discover this underrated gem. I just picked up the 2-DVD ""Collector's Edition"" of the film and after viewing it I am pleased to report that ""Event Horizon"" is still holding up well.""EH"" tends to get comparisons like ""The Shining in space"" or ""A combination of Alien and The Exorcist,"" none of which are entirely accurate, yet the influence of all of those films (plus many more) are definitely part of ""Event Horizon's"" DNA. The film I immediately think of is 1979's ""The Black Hole,"" which also revolved around a group of space explorers discovering the derelict hulk of a long-lost space ship, but once our intrepid crew is on board the title craft the film turns into something akin to ""Hellraiser"" more than anything else.Our story: it's 2047 and the mammoth space ship ""Event Horizon,"" which disappeared without a trace seven years earlier on a mission to the outer reaches of the Universe, has suddenly reappeared in an orbit around Neptune. A rescue crew is dispatched headed by Laurence Fishburne (whose Shakespearean voice can make even the most empty headed science-fiction techno-jargon dialogue sound deep and meaningful) and Sam Neill, the scientist who designed and built the Event Horizon. He's especially proud of its more-or-less-theoretical ""gravity drive,"" which supposedly can travel through dimensions via a ""gateway"" that had never been attempted before. It doesn't take a genius to figure out that traveling through this supposed ""gateway"" is going to be the core of the movie. Once on board the Event Horizon, they find no survivors, just a lot of blood splattered on the walls and an occasional frozen, mutilated corpse drifting past in zero-gravity. It quickly becomes obvious that something horrible happened to the Event Horizon when it left our universe, and as the crew explores the ship it also seems that the craft brought something back WITH them from that trip, which wants all of their souls. One by one the crewmen are plagued with visions of hellish torture, or of traumatic events from their own pasts, and several of them meet gory deaths until the survivors realize that they must get off this ship as quickly as possible, before the evil possessing it claims them all as victims.The real star of the movie is the set designer (whoever he or she was; fantastic job!), the ""Event Horizon"" resembles a hellish cathedral of some sort (even before the evil sets in) that will make the viewer uncomfortable from the get-go. Of the human cast, Sam Neill gets to have the most fun, as he is eventually taken over by the horror of his creation and goes all Interstellar Jack Torrance on the innocent salvage crew.Judging from the reviews on this site, ""Event Horizon"" is either a ""love it"" or ""hate it"" kind of film. You can count me as one who loved it, and I will definitely be watching it again in the future. Too bad director Paul Anderson has yet to live up to the promise he showed in this movie.",Event Horizon
142,Vigilante-407,A terrifying journey into space,9,29 June 2001,"I know a lot of folks don't like Event Horizon, but I found it to be one of the few truly chilling sci-fi horror films that I have seen in the past two decades.A rescue mission is sent out after a long-lost spaceship (the Event Horizon) reappears in orbit around Neptune.  The ship was actually the first attempt at faster-than-light travel, and used a unique method of bending space developed by Sam Neill's scientist...which inadvertantly sent the ship and its original crew outside the universe, and into a world of complete chaos that approximates Hell.  Unfortunately, the rescue party doesn't know this, and doesn't know that the ship wants to go back.Both Sam Neill and Lawrence Fishburne given outstanding performances.  Neill is excellent as the scientist who has given all (including his wife's life - by suicide) to create the Event Horizon, and gradually loses his mind to the haunted ship.  Fishburne is the commander of the rescue mission who refuses to leave any of his crew behind, and wants to destroy the ship before it takes them all back to the other dimension. His own dedication to that ideal rivals Neill's insane desire to go back with this ship.There are many similarities between this movie and other science fiction works (including Alien, 2001: A Space Odyssey, and particular Sphere, which came out years later), but I believe that Event Horizon stands on its own as a masterpiece of horror.",Event Horizon
143,DanLives1980,This is Techno Horror!,8,6 April 2012,"Event Horizon is a perfect ensemble collaboration of talent, which takes the basic elements of separate genre legends such as Aliens and The Shining. Essentially it's a clash of religion and science and I suppose what might have happened had they merged Aliens with The Shining.Director Paul W.S. Anderson (Resident Evil) and writer Philip Eisner (The Mutant Chronicles) made their finest ever film with Event Horizon, the story of a rescue and salvage ship crew employed by Dr Weir, the first scientist to create inter-dimensional space travel, whose titular spaceship sent out a distress call before disappearing into oblivion.The ship has returned and is floating dead in space just outside of Jupiter's atmosphere, its crew has vanished. Captain Miller (Lawrence Fishburne) and his crew, board the ship only to discover the remains of the doomed Event Horizon's crew and to begin salvaging disturbing evidence that the ship - which itself begins to show signs of life - may have traveled to someplace beyond just another dimension.Firstly, I was surprised over time to learn of the writer and director's separate careers. According to IMDb, Philip Eisner hasn't worked since The Mutant Chronicles and I'm not surprised. It was awful. I only watched it because I generally like Thomas Jane's films and it seemed like a good watch just by the trailer.The only other film I really liked from Anderson meanwhile was Death Race. I wish he'd just let Resident Evil die and not come back like the retarded zombies it's all about. Bullet to the head and bye-bye, baby!What makes their first effort work here is the minimalist attitude towards the horror element and the amount of work put into the element of suspense and character building. Otherwise it's down to the clean and safely used CGI and set-pieces and overall, the actors.Lawrence Fishburne who hadn't made a great film up until then since King of New York was a great choice for Captain Miller. He assumes control with ease and just gets the job done like every plain and ordinary working man's boss does, rather than try to shine.Sam Neill as Dr Weir takes the reins of the troubled genius like a true theatre legend, showing why he has been one of the industry's consistently best actors since his re-emergence as a mature actor in psycho thriller Dead Calm. Here he really busts out the dramatic and hams it up to good effect when necessary, making him very much the main event, which I suppose he was meant to be.The backing cast also consisted of some very admirable talent including fellow Brits Joely Richardson as the cold hearted and sensible Ripley-alike second in command, Jason Isaacs as the ship's medic and psychologist and genre legend Sean Pertwee as the typically English grease monkey mechanic. The Yanks gave us legend Kathleen Quinlan as the resident med tech and Richard T. Jones and Jack Noseworthy as the salvage crew. Far from retiring to their characters' stereotypes, the actors play on it well but still develop a good rapport with each other.As I remember one of the most impressive and surprising appearances was of the techno-punk band The Prodigy, who supplied the disturbed twisted metal connoting soundtrack. This served well in the film's overall theme and the filler tracks are suspenseful and heavily suggesting of just how crazy the film gets as it progresses.Since Event Horizon there have been a number of similar themed runaway successes from mainstream and B-Movies alike but rather than giving the opinion that Event Horizon had followed on where genre creator Alien had given it the inspiration, Event has managed to create a genre of its own. If you haven't seen it and you have a budding horror and sci-fi classics DVD collection, this needs to be a part of it!",Event Horizon
144,stefankrs,Good space horror,7,16 September 2021,"This movie is really underrated, but I can tell why. This movie isn't for everyone. This movie is about a lost space ship called ""Event Horizon"" and a rescue team responding to its radio transmission and investigating the ship. The ship the took a trip to hell and back and now inhabits peoples personal fears. It doesn't have the greatest plot and may sound dumb but it is very entertaining and visually pleasing.",Event Horizon
