,User_name,Review title,Review Rating,Review date,Review_body,Movie_name
34,edpd-1,Crappy story,1,24 November 2018,"Badly written. And story, to many biases and stereotypes telling. Bad dialigues between actors",Christmas Inheritance
35,tonybedford,Corny but...,6,13 November 2019,"There are many failings of this move. The character development is shallow, the action is lacklustre, the plot is fairly unbelievable, and yet this movie has a certain charm to it. I think the heroine is quite charming, and one can not help but notice her ""voluptuous curves"" which are front and centre in many scenes. If you've got it flaunt it I say...So with so many failings what gives this movie its charm? I think it is the sets and the lighting which I thought were very atmospheric. The charming Cafe, the wonderful guest house, the snowy streets were all very evocative of Christmas time.It was a pleasure to see Andie MacDowell - I'd not seen her in anything since Four Weddings and a Funeral and that was a looonngg time ago. Yes she has aged but then haven't we all!If you are wondering whether to watch this or not - go for it - just for the heartwarming Christmas atmosphere.",Christmas Inheritance
36,carrona,Poor Choice of 'Hunk' With a Heart.,3,19 December 2017,"Don't get me wrong. In many ways this movie ticks all the boxes when it comes to formulaic cheesiness. Is there an attractive, secretly wealthy boy/ or girl who's working undercover (to learn about themselves and/or learn how to take over the family's company or kingdom as part of an inheritance and/or experience the real world)? Yes!Does the action take place in a small, wholesome, cosy little town and/or palace in some East European-ovia country? Yes!Is the object of their attraction a pretty or handsome-yet-ordinary person with a heart of gold? Yes! Is one of them due to get married to/in a relationship with, someone they don't really love? Yes! Is there a late-in-the-day 'misunderstanding' between the romantic leads - which has to be resolved before they finally realize they're meant for each other? Yup.All's well and good in this movie, except for one thing. I'm sure the male lead is a lovely person in real life but he's mis-cast. For these type of movies to work, BOTH leads need to be attractive. Even attractive and quirky is okay.The girl is beautiful and adorable. Too bad the male lead in ""Christmas Inheritance"" ain't no HUNK. He's just downright goofy looking.......and not in a unconventional, fanciable way.For that reason alone, sadly it's a FAIL from me!",Christmas Inheritance
37,marymms1970,Cute but typical,4,27 November 2018,Just your typical Christmas movie. Would u recommend? Probably not. And the singing near the end (if you watch this you'll know what I mean) is terrible!!!,Christmas Inheritance
38,matra-murena,Exactly what I expected,10,21 December 2017,"This definately is what a christmas movie should be. The story is simple, a rich young engaged woman who has it all in her life and is about to inherrit her fathers company has to deliver christmas letters to her dad's old businesspartner in the small town she was born and her dad started his company. However, she can't say who whe really is and only gets 100 dollar to use. Soon she learns that richness isn't to take for granted and of course she meets a super nice guy and falls for him.The characters are easy to like and the story has a nice pace to it. The small town is very christmas-like and it just is the sort of film you can watch with the whole family. Ultimate family movie.",Christmas Inheritance
39,burkesavannah,Does what's expected,6,25 November 2018,"Average made-for-tv holiday movie. Charming, cheesy, cliche, and the acting wasn't the worst ever. It gets the job done for what's expected of the genre.",Christmas Inheritance
40,daydreammaggs,It's okay,2,14 December 2019,"I love watching cheesy romance Christmas movies around the holidays. They're simple, and provide something nice and festive in the background when I'm working on projects. This movie though... it's okay at best. It starts out with a fun concept and the chemistry is great at first. But I can't shake the feeling that the whole movie feels like 'countryside' propaganda. Small towns being cute, charitable, and nice where everyone gets along and no one ever fights. Seems a little too perfect, if you know what I mean? Though, I will note that if you watch this on Netflix, there is a Japanese dub. It makes it a bit more bearable.",Christmas Inheritance
41,semperfi1117,Wisconsin Cheese!,1,19 November 2019,"This is your typical cheesy ""Hallmark like"" Christmas drama. Script is horrible!",Christmas Inheritance
42,cherbear-98244,Jake seems a bit... aggressive,6,26 August 2018,"I liked the movie, HOWEVER.... did anyone else feel like Jake has violent and abusive tendencies? Kind of weird... Takes away from the movie a bit.",Christmas Inheritance
43,bsam-65331,Brilliant,10,6 November 2021,"Amazing action packed thriller, was on edge of seat through the whole movie. Also very emotional and a heartwarming romcom. The scene with Dwane Johnson's and Kevin heart was halarious. Definitely in my top 5 movies of all time great watch and would recommend to all.",Christmas Inheritance
44,poohbear9003,Cutest Romantic movie!,10,5 August 2018,I loved this movie so much that I watched it 3 times last December! Jake Kelly is such a cutie and a good actor! I can't wait to watch it again this year!,Christmas Inheritance
45,brianljanss,Cliche,2,22 November 2020,"My favorite part of the movie is that the main character is an heiress and dresses exclusively from the discount rack at k-mart. Also, the man who is supposed to be the mysterious brawny local loner doesn't look like he's done a single thing in his life except eat scrambled eggs and milk. I don't know what that means, but when you see his facial expressions you'll agree.",Christmas Inheritance
46,joyamartin,Pass the cheese please,4,19 November 2021,"I wanted to like this movie but it fell short. The worst part is the fundraising scene where a blond girl (that can not sing) sings, then to top it off Adie McDowell attempt to sing. Can you say "" nails on chalkboard "".",Christmas Inheritance
47,rspencerjones,Fun Christmas cheesy romance movie,10,30 December 2019,"My wife and I love it for what it is. Don't over analyze it. The acting is quality by the lead actors. We need light-hearted movies like this, especially Christmas movies.",Christmas Inheritance
48,swezey,"Cute story, but fake whipped snow....seriously!!!???!!",3,20 December 2017,This could have been an extremely cute movie but what is wrong with the Producer and Director. Several of the snow scenes have fake snow that is like whipped cream. Absolutely ridiculous. Do you think viewers that enjoy a cute Christmas viewers don't expect things to look real?? Ridiculous!!,Christmas Inheritance
49,kassiacrislayne,Nice one,8,17 December 2017,This movie has Ellie learning to be better by spending some time in her parents' little town. It was nice and worth watching. Eliza Taylor is always a treat to watch and I hope to see her in more works.,Christmas Inheritance
50,jimmyorlando-68027,Good acting but bad choice of actors.,4,24 December 2017,"The whole idea of sending a bitch who only cares about money and parties to a small town to learn about the true values of Christmas and being a nice person is great. 1. But the lead female character is not a bitch, doesn't look like a bitch. 
2. The lead male character is a bit too goofy and dorky. 
3. The pace of the movie is way too fast to make the script believable. The ""brat"" turns into a good girl WAY TOO FAST. It only takes 2 days......REALLY???!?!?A lot of plot holes.
1. cellphones don't work because it is supposed to be a small town..... but that have an Apple Store......
2. Lead female character is stuck in the town because of winter storm......no storm do we see..... Only a couple of centimeters snow. If that is supposed to be a major snowstorm....
3. Main characters are about to kiss......Does the lead female character hates her fiancee so much? It didn't look like it at the beginning of the movie though. In other words, unbelievable romance between bitch and goofy guy
4. Fiancee is supposed to be a jerk.....He is not. He drives through a "" snow storm"" to this small town to pick her up to go on a well deserved vacation. How can this guy be an asshole. He should be the one dumping HER IN THE END. 
5. Snow all around but lead female character keeps walking on very high heels all the time. No one does that. 
6. Goofy male main character reacts too angry when he finds out who the new girl really is. No one does that. And if you do, you will definitely stay single. I can go on for hours this way. To many plot holes. Too bad. But since I wanted to watch a Christmas movie and this is a Christmas movie in the end, I grand this movie a 4",Christmas Inheritance
51,merickson-63010,Stereotypical,2,24 November 2018,"Yikes! What a mess of a movie. Jake is the most judgmental person, and it's so off-putting, it's hard to believe anyone can fall for him. From their very first meeting at the bus stop, he was aggressive toward her. Also, living in a small town myself, I can guarantee if cell service was as awful as they portray, the town would be so abandoned, even 1 taxi wouldn't get business. Living in a city isn't always a bad thing, living in a small town isn't always preferrable, being rich doesn't always mean you're out of touch and need a lesson, and being from a small town doesn't mean you're all about community, etc. This stereotypical format is ridiculously overdone. Don't be boring as a writer! Be creative! I give it 2 stars because I like Andie McDowell.",Christmas Inheritance
52,shahdqutifan,Get over it.,7,15 November 2019,"It's a Christmas movie. I don't understand why people are taking it too seriously. It's sappy and snowy and predictable, defiantly not masterpiece material, but still a cozy romantic movie to watch during the holidays. I'd defiantly recommend it if, you're looking for that kind of warm movie.",Christmas Inheritance
53,neenamariemiller,Just watch and enjoy.,10,27 December 2019,"Loved the movie. It is what Christmas is really all about, helping others, sharing, caring. The movie was fun and fast moving. Just watch and enjoy.",Christmas Inheritance
54,bridget-mountford,Nice,10,4 November 2018,Was really good except for intense sex scene between ellie's dad and his secretary that comes out of nowhere!,Christmas Inheritance
55,scottsanguinito,Bad Writing...Good Scenery,6,7 December 2020,"I watched Christmas Inheritance last year. It had Plop from the Office I enjoy a hallmark movie ever now and then...But...There was one scene where a huge freeze storm was coming and the bed and breakfast took in a bunch of straded tourists and such...So Plop goes out to get firewood from the porch....the main chick remembers a homeless man she saw in town, so she sneaks out to go get him...walking past Plop without him seeing...The next scene he comes in with like 4 logs of wood and asks where she is....everyone looks around and can't fine her Then she walks in with the homeless guy This mother f ing chick braved a God damn winter storm to walk miles into town and back...all in the same amount if time it took to get 4 logs from a porch",Christmas Inheritance
56,ram-rahimi,Childish with a lot of plotholes and too predictable,1,27 December 2019,This is a movie for kids not adults with a lot of plotholes and too predictable,Christmas Inheritance
57,victoriafruensgaard,Nice break,9,12 November 2019,"The movie ""Christmas Inheritance"" is a great movie if you need a break and you just can realx and come in the christmas spirit. It's a cute movie, it's pretty predictable - but that doesn't have to be a bad thing.",Christmas Inheritance
58,eionobryant,Great Movie,10,18 December 2017,Christmas Inheritance was a very good movie! It would be a great family movie and would teach the kids something about Christmas. I love Eliza Taylor,Christmas Inheritance
59,qmaddie,This contains spoilers; I want your view,6,22 December 2017,Why did Ellie still like that small town boy after he was so hateful to her when he learned who she was? I otherwise sheepishly enjoyed this very bad Christmas movie.,Christmas Inheritance
60,gsn-06186,Fantastic movie,10,22 December 2017,I have seen Taylor in the show (The 100) I like her acting. She has done a great work in this movie too. I would like to see her in more shows like these.,Christmas Inheritance
61,sihammarte,The romance was subtle & the story was well written,10,27 December 2017,"The story was well written.
Of course it was low budget. However, the ending was magical. And really well put together. This movie didn't end like every other Christmas romcom, Regardless, have low expectations as one would do with a typical low budget film. I was kinda impressed",Christmas Inheritance
62,iambrittanychristian,"Good Start, Horrible Finish",1,5 January 2018,"I love a good old movie full of cheesy moments, and that's exactly what I was looking for in this.But, in my opinion, this movie is what is wrong with our society. Let me explain...*Spoiler Alert*First off, this woman was willing to vault a toy train in a dress at a freaking gala in order for a guy to quadruple a man's donation. And she's scolded for it and her morals are questioned because of it??? Are you freaking kidding me??? Gtfo. If I vault anything in a dress to quadruple a freaking donation, someone better be THANKING me, if anything. But if that's all there was, there wouldn't have been much of a plot so....Cue the trip to the small town. She's dating this a**hole of a guy. Extremely gorgeous, but a complete a**. He has to stay home because...reasons. She must go to this small town alone to learn a lesson about appreciating what truly matters in life. She meets an amazing guy who is tremendously sweet and kind-hearted. He shows her around town and treats her wonderfully. She begins to do nice things for him as well and starts to truly warm up to the town. You can tell she's starting to catch feelings, but wants to remain loyal to her fiancée.She's here under the guise of a different name, (Elle London, instead of Ellen Langford) so that she doesn't get special treatment for being an heiress. Makes sense. Her dad wants her to learn a lesson. But when this so-called knockoff 'prince charming' finds out that she has an extra letter at the end of her first name and is really the daughter of the owner of a huge toy business, he freaks out and throws a b*tch fit. Why?? WHYY???? TELL ME SOMEONE PLZ I DO NOT UNDERSTAND???? He looks her up on the internet and sees the media coverage of her VAULTING A TRAIN AT A FREAKING GALA TO RAISE MONEY FOR CHILDREN and decides she's a liar and not the same person she's been to him--which was, btw, a really nice human being. GTFO. Here's why this is a societal issue: Think of all of the movies, TV Shows, etc. where a well-to-do or famous guy pretends to be someone he's not and then the girl either finds out he's a superstar or millionaire or whatever else. She's thrilled. Ecstatic. Should consider herself lucky to be around him. But when the genders are reversed it's not the same??? Literally, gtfo. The writer of this garbage film has to have been a guy. Because no self-respecting woman would write this trash.So he throws his b*tch fit and continues to treat her like garbage, as if nothing had ever happened and she was now dirt beneath her feet for doing something to try to make her father happy. She apologizes a few times, still...nothing. He's mad. Why? I still don't f**king know. And then, after she has her happy moment with her uncle and dad and is elected the new CEO of the company, he comes around wanting to dance. Never even an apology. All is forgiven. And she's expected to be so grateful for him forgiving her (for what, exactly???). Just like that. She moved from one a**hole to the next. How wonderful. What a wonderful little Christmas movie.",Christmas Inheritance
63,drjudkinshome,Cute,7,23 November 2018,"Cute Christmas movie, about a woman who gets ""stuck"" in a small town but discovers what is really important to her as her dad makes her stay until she delivers a special letter😊",Christmas Inheritance
64,scottandtaralee,Chloe's friend,10,8 April 2019,"The genius of this film is its ability to mask its true depth behind a mask of cheesy, traditional holiday fare, a kind of reaction to the way Citizen Kane masks its shallowness in the dressings of fake brilliance. While Orson Wells so deftly mocks the conventional tropes of so-called film noir, the gleefully awful and pretension Art Film - capital AF - Christmas Inheritance serves as its polar opposite - not in quality, mind you, but its ability to present the human condition so nakedly exposed with all its imperfections and embarrassing details. Each character in this film, though presented superficially, and yes cheesily, represents - nay, embodies - much deeper themes and constructs of humanity. The characters, the film (and everything that goes with it - the writing, directing, acting) becomes a mirror held up to mankind. The film is, in effect, us. And we are the film. We are those deeply hidden embarrassments hiding under a veneer of superficiality. We pretend we are nothing, when in fact we are gods in hiding, just as the film portrays. As Shakespeare wrote, we are what we always were, and this is especially true in this film. It is a film about Christmas, which has become - at least in our western culture (now crumbling at its edges, and, to speak bluntly, its very core) a mockery of its true meaning. We see in our western version of Christmas what we see in ourselves: an abandonment of all things real and deeply personal, even painful (see Huxley) for the superficial, the vapid, the easy and pleasant. We've abandoned the reality of suffering for the latex falseness of modern life, leaving all meaning and true human experience behind and replacing it with an amusement park. This is the true genius of this film.",Christmas Inheritance
65,bennington-26958,Very cute,5,10 October 2019,"I enjoyed it,. It's sweet just like a Christmas movie should be.",Christmas Inheritance
66,thethbunny,Wonderful Movie! Definitely a must watch!,10,19 October 2018,"I loved this movie from beginning to end. I wasn't expecting to like it so much but it was incredibly sweet, the actors were easy to like and the plot was simple but nonetheless charming. It's a good Christmas/Romance movie that really sets a joyous holiday mood. Gives a very ""Hallmark"" vibe but really exceeded my expectations. You should watch this movie, believe me, you're missing out.",Christmas Inheritance
67,michellekula,Don't waste your time,2,8 December 2018,As an avid Christmas movie watcher I was incredibly disappointed in this feature. Considering there are a few known names in this movie I thought it had to be half decent...WRONG. Do not waste your time. I would have rather spent my night cleaning my bathroom than the 1 hour and 44 mins of my life I can't get back from watching this movie. Perhaps I will go for a classic next time.,Christmas Inheritance
