,User_name,Review title,Review Rating,Review date,Review_body,Movie_name
152,FairlyAnonymous,Very entertaining but it is hilariously bad,6,19 March 2013,"I've come here to chew bubblegum and write reviews. Don't get me wrong, I like this movie. It is entertaining. It is fun. But we all have to honest with ourselves here and admit that this movie is hilariously bad. Everything from its minuscule budget, lack of explanations from scene to scene, and overall bad choreography makes this movie pretty bad... and yet... it pulls it off somehow.This is one of those movies that is surprising because you would expect a bad movie to be boring and not interesting but this movie IS INTERESTING AND ISN'T BORING! The concept is around a guy who finds a pair of sunglasses that allow him to see the truth that Earth is actually populated by aliens that are controlling us. This is a neat concept and throughout the movie I was constantly interested about what was going to happen next. I can see why people really like this movie because it is entertaining and you can tell that it is purposely being cheesy... but...That isn't a full excuse. Just because it is entertaining that doesn't mean it isn't bad. Troll 2 is extremely entertaining and it is still a bad movie and deserves all of the hate it gets. One of the main problems with this movie is that it is way too short. Because the movie is so short (for an action film) it seems like a lot of scenes were rushed so there aren't a lot of explanations or any real character development. The action sequences are okay, though a couple of shootouts were cool. To me I thought it was just annoying how quickly the plot progressed because if it were fleshed out a bit more I think it could've been a much better movie. Let's not forget that the special effects are pretty merp and the aliens only placed one satellite dish apparently to cover their appearance.Overall ""They Live"" is an entertaining action movie. It is campy, has some nice one liners, low budget, and is overall enjoyable. I would suggest watching it and there isn't anything really inappropriate in it until the last 15 seconds of the movie. Go and watch it!",They Live
153,harrylosborne,Fun of the alien kind,6,4 April 2021,"John Carpenter built his reputation on the horror icons of the 70s and 80s: ""Halloween"", ""The Thing"" and ""The Fog"" are all his works, names now synonymous with the golden age of Hollywood slashers and the conception of brilliantly gory visual effects.""They Live"" is a slightly different beast, concerned less with visuals and more with the story. It's a shame that the acting is so horrendous and absurd that it doomed this movie to the B-list, because otherwise I really enjoyed this refreshingly well-executed tale.""They Live"" revolves around a special pair of sunglasses and a curious protagonist, messily played by former wrestler Roddy Piper. His strongest asset is his mullet; his weakest is his acting talent. Keith David isn't bad (a long-time collaborator of Carpenter's), but otherwise, the acting leaves a lot to be desired.Elsewhere, I actually loved this film's art design, a great mix of dystopian and menacing, all under the veil of a normal society. The 80s aesthetic is utilised by making the alien presence minimal but starkly contrasting, doing a damn sight better than nearly every other production of that era.Furthermore, 'their' willingness to blend in is a great mixture of amusing and potentially terrifying. It's infrequent that extraterrestrial films have a 'fun' element to them, so this should be appreciated,""They Live"" is a film that should be enjoyed light-heartedly, ignoring sci-fi stereotypes and forging its own, slightly askew, path. Some people might even enjoy the over-the-top acting, but otherwise, you're just getting a solid alien flick.",They Live
154,monkeysgalore,They Live is a Documentary,10,15 November 2018,"They Live is an excellent sci-fi action thriller film, and it still holds up today, as an action flick and as a culturally significant commentary on consumerism in society. Even though many consider this to be a horror film, I hesitate to categorize it as a horror film, as it's not exactly scary, and it's really more action science fiction than anything else. I absolutely love this movie, and it is never given enough credit. This film has garnered a worthy cult following, and rightfully so. As Roddy Piper said, ""They Live is a documentary"".You probably already know the plot, but it follows a drifter, John Nada (Roddy Piper), as he walks into town looking for work. He gets a job at a construction site, and befriends Frank Armitage (Keith David), another worker, and he takes Nada back to the community home for the homeless that he lives in. Over time, Nada notice some strange things,and eventually becomes aware of a sinister conspiracy, and takes matters into his own hands to put a stop to it.The film's plot is already pretty interesting, and John Carpenter is at the top of his game here, both directing, and scripting, and I was especially excited to see this after seeing ""Big Trouble in Little China"", which I thoroughly loved. The pacing is excellent, and the story is well-told, and I never lost interest in what was going on. I cared about what happened to the characters, and I was engaged in the story all the way up until the very end.Carpenter creates a bleak, engaging, often dark and gritty world, where poverty reigns among the lower-class, and the rich and affluent lead oblivious lives. Two very different worlds are shown, one of decay and hopelessness, and the other of money, power, and greed, and that, ultimately, is what the film is about; greed. The poor are shown to be the only ones who truly know what's going on, and they are not given a voice. Rather, they're stopped at every turn from sharing what they know with the world. The character of John Nada is a likable underdog, and all-round American tough guy. As soon as he realizes what's going on, he acts in one of the most rational moments in movie history; he grabs the nearest weapon and goes to town on the bad guys. Carpenter is an expert at satirizing, or at the very least, exaggerating, especially when it comes to action hero stereotypes. We already see much of this with Kurt Russell's character in the aforementioned ""Big Trouble in Little China"" here, but Carpenter establishes an even more capable, memorable action hero here that the viewer can root for. The gritty, bleak vibe is maintained right down to the very end, and Roddy Piper's positive, extreme, ready-for-action character fits perfectly into the story and becomes the hero that the world needs.The action, which I personally liked has been criticized by some, as cheap and not very well-made, but I found it to be hard-hitting, high-octane, and very enjoyable. A criticism of the film in general is that it's low-budget, cheesy, and overall of the 'B-movie' variety, but none of these facts, which may be true, stop it from telling a unique story. I personally found the action to be great, such as the bank shootout, the legendary alley fight scene, and the final shootout. The alley fight scene is honestly amazing; 5+ minutes of two guys beating the crap out of each other. It's actually one of my personal favorite fight scenes ever, it's just so brutal and over-the-top, it has to be seen to be believed. Just when you think it's about to end, it continues.Everybody's performances were good, especially Roddy Piper's, who is just fun to watch, as he, like most wrestlers, is larger-than-life. Keith David surprised me, and I didn't learn exactly how many movies he was in until after I saw this film, but I look for him now.Overall, an awesome movie, with plenty of action, one-liners, and thrills, as well as a scathing indictment of society in the 80s, which is still relevant today. 10/10, highly recommend it.",They Live
155,kingofdanerds,This film is just awesome,9,25 September 2020,"They Live is a 1988 sci fi/ horror/ and even action film that was directed by the amazing John Carpenter who also wrote the screenplay and composed the music for this film. The film was based off of a 1963 short story called ""Eight O'Clock in the Morning"". The film notably stars 80s wrestler Roddy Piper (of whom I know nothing about for the fact is is that I didn't grow up during the time when wrestling was a big deal). The film had a budget of $3 million and made back $13 million in box office. The film gained positive reviews and has even gained a cult following since its release.We meet our main character named Nada (or George Nada) who is a drifter and looking for work and a place to stay. He finds work at a construction site that sits across from a church. Nada becomes curious and sneaks in the church and discovers some weird things about the government and all of that. Nada finds a pair of sunglasses and when he puts them on, he sees subliminal messages and that some of the humans are actually aliens in disguise and that they have complete control over the whole government and even world. It is up to Nada and a group of people to fight against these aliens.This is one of those films where I have seen pictures and little clips of and I am like ""I need to watch this film"". The wait was worth it. Unlike Escape from New York (which underperfomed in my opinion), this film exceeded expectations. I know that there were some negative reviews of this film with a few criticisms and all that but I honestly do not see what it is all about. Sure, Roddy Piper might not be the best actor when it comes to line delivery (and it gets a little weird), but come on, he is a wrestler first. I don't expect anything better. But don't get me wrong, he is a major badass and his physicality works here as well. I love it! The other actors do an OK job for the most part and the characters are not bad either but obviously Roddy Piper steals the show here. There is one character that in my opinion did not work and that would be Meg Foster's character Holly. To me, she was somewhat pointless and where she could have worked (and there are some moments where it appears she can), she is forgotten and then brought back into the film and the same thing happens. I love the themes and symbolism here in this film that is somewhat relevant now (in 2020). I love how the glasses are used to see what the world is truly like and it is very clever. The social commentary is really good here (and strange enough is that it was critcized). There are some truly iconic scenes in this film including the sunglasses scene, a certain utterance of a line, and a nearly 6 minute long punchng fight which is a great fight in terms of choreography where all of the punches and hits are real. Is it drawn out? A little, but every punch hurt me as a viewer. So it must have been doing something right. The action elements in this film are pretty cool and badass. Lastly, the soundtrack is pretty cool as well. I love the theme and all of the other tracks as well.They Live is an amazing film of John Carpenter's. It is a really awesome film only brought down by Meg Foster's character here (and that makes me a little sad because without her character being pointless, this film would have been perfect.) I am so glad that I have watched this film because it was a treat to watch.",They Live
156,smellthecult-com-1,Paranoid sci-fi frights,10,25 September 2009,"I think this is my favourite Carpenter movie. Yes, I know Halloween is a masterpiece and, yes, yes, I think that The Thing is superb. What's that? The Fog? Yep, that's great too. What? Shut it! Whilst Carpenter's more 'straight' horror movies are, on the whole, excellent, this is the one that gets my pulse rate soaring. Blending horror and sci-fi with a rather healthy dose of utter paranoia, this is one of those films that has a 'Holy Christ' moment in it, which I won't elaborate on here for fear of spoiling. Seriously folks, this is one of those Sixth Sense scenes that just completely blind-sides you. 'Rowdy' Roddy Piper is more than proficient in the lead role, a role apparently written with Kurt Russell in mind, and you can tell. Stand out moments: The previously mentioned 'revelation' and the rib-tickling extended fight sequence between the two main characters.A masterful sci-fi horror combo",They Live
157,nkishudak,I am here to chew bubble gum and kick ass,10,25 October 2020,"And I am all out of bubble gum. Consume, marry and reproduce,obey! - 40 years since we heard these lines and more actual than ever.",They Live
158,nigelmacdonald-97173,Dated badly,3,8 July 2021,"Not sure why this rates so highly. Might be a nostalgia thing, but apart from that it's as dated as the leads haircut. From the clunky dialogue, repetitive background music and dreadful acting, its so bad its actually watchable.",They Live
159,axlrhodes,"They Live is happy to cheapen itself but has a lot going on under its surface,",6,11 October 2008,They Live will probably be considered an underrated piece by its hardcore fans which would be fair to say.Its a weird little film that almost loses your interest then takes a solid turn for the better after 30mins and becomes an entertaining action film with a lot to say about how we live our everyday lives in an oblivious state allowing advertising and popular culture to manipulate our daily habits. The main characters journey is to wake everyone up from said oblivious state however some people are happy to just go with the flow and aren't so keen on waking up.The film is happy to cheapen itself with overlong fight sequences and cheesy music.One particular fight scene in an alley between WWE star Roddy Piper and Keith David looks like one of Pipers wrestling sequences and his inclusion in the film points to this scene.So in summary They Live is hardly a masterpiece but has a lot to mull over quietly bubbling under its surface. 6/10,They Live
160,brian_r_wright,Libertarian cult classic or just not so good?,6,12 November 2009,"But back to the movie. I suppose that any collectivism vs. individualism movie—from Invasion of the Body Snatchers to 1984 or The Matrix —manifests similar qualities. The sad thing is that in reality, when collectivism rules, we have only (defective) humans to blame. Our collectivist rulers are aliens only symbolically; though I would not be surprised if the defect that afflicts them were biological and those who are addicted to power may someday be shown to have been a distinct subspecies of homo sapien.In the movies, for dramatic impact no doubt, the writers seem to need to posit alien creatures at some location in the ""collectivist-ruler"" political metaphor. So They Live comes along and shows the rulers to be ape-like humanoids who can only be seen in their true appearance by humans with a cheap pair of nerdy wraparound sunglasses. ...For my complete review of this movie and for other movie and book reviews, please visit my site TheCoffeeCoaster.com.Brian Wright Copyright 2009",They Live
161,CrassActionHero,"I've Come to Chew Bubble Gum and Kick Ass, and I'm all out of Bubble Gum!",7,9 October 2006,"They Live(1988) They Live is another nice feature from John Carpenter. They live among us. A drifter(Roddy Piper)is looking for a job and lands one in construction. He befriends a fellow worker(Keith David)and finds a place to stay. Our hero notices strange television frequencies and a nearby church that has some shady activity. After acquiring some odd sunglasses, he sees things that cannot be seen before. With the glasses sees the alter image of every thing. Things are not what they seem. Our hero now has the very fate of the world in his hands.Piper is an okay actor with limited dialog, Keith David is pretty good here. The story is original and interesting. One real treat here is a really downright awesome back alley brawl. That has to be the toughest fight scene ever.The look of the evil beings for 80's standards are pretty cool looking. Fiendish and grotesque. The movie also has some surprises as well. The ending is quite a surprise too. I personally liked it.The Last Word: Interesting. I'll agree that They Live is very underrated. Not a masterpiece, but I had fun watching. The original story is the main highlight. Piper is a likable hero, and the movie does not overstay it's welcome. I recommend They Live. Watch and enjoy.",They Live
162,Hang_All_Drunkdrivers,The Reptiles are coming,8,27 January 2005,"This film predates David Icke's famous books on the reptile conspiracy that rules the world, but that's what it's really about. The reptiles came here 400,000 years ago and have been covertly ruling the world since. Or so millions of people believe. In this movie the aliens true nature can be seen only by those with the special sunglasses. Otherwise they look like regular people. Roddy Piper finds out about this and with the aid of some friends tries to defeat them.A very interesting show. Not much in the way of special affects and not really a monster flik either. But it makes you think about how we are so manipulated by those in power. Wrestling star Piper does not play a strong super-hero type as you might expect. He's just a bum looking for work and does an amazing acting job.",They Live
163,blauregenbogen,Everybody put sunglasses on,10,17 November 2018,"My dad saw that movie and always love this movie. So when I check the cinema and the movie is on big screen. I have to see it. Good story and good action,brilliant . Am glad I can see on the big screen",They Live
164,chvylvr80,One of Carpenter's better efforts,6,14 January 2004,"Movies like They Live aren't made much anymore. Cheap and corny though it may be, They Live represents a dying breed. Good B-movie sci-fi. Back when John Carpenter was making good movies instead of slowly digging his own grave, They Live showed the viewer a filmmaker that always had a clear vision of what he was doing. They Live isn't meant to be taken too seriously on the surface. The biting social commentary that reveals itself when our heroes put on their special sunglasses is the real scary part of the movie, the alien masks don't shock unless you put yourself in Roddy Piper's shoes.
By far the best and most famous part of the film (besides the line ""I am here to chew bubblegum and kick ass, and I'm all out of bubblegum."") is the seemingly endless fight scene between Roddy Piper and Keith David. Long, brutal, and started for the stupidest reason, this scene is the blueprint for the cripple fight between Jimmy and Timmy in South Park.Bottom Line: They Live isn't the greatest movie ever or anything but it's worth checking out if you like John Carpenter or sci-fi. Rent before you buy.",They Live
165,metalrage666,This is how things really are!,8,4 November 2015,"I love this movie. I first saw this in the very early 90's, hired on VHS and I've loved this ever since. People always laughed at me when I said that life sucks because of aliens, and with They Live, I'm even more convinced.""Rowdy"" Roddy Piper - God rest his soul, plays a drifter who comes to town looking for work. He makes friends with Keith David who takes him to a shanty town for a meal and a place to stay. Piper then notices some odd activity along with late night choir singing at a nearby church and on investigating he finds boxes of cheap looking sunglasses, with the ""choir"" being nothing more than a speaker set-up. The next day he puts on the glasses and notices that everything turns black and white with all visible text revealing hidden messages. It seems that all signs, billboards, magazines and even cash has hidden messages which are only revealed through the sunglasses. The messages are all simple authoritarian commands such as ""obey"" ""marry and reproduce"" ""this is your god"" - referring to money, and so forth. All of this reaches the human mind subliminally in an effort to keep us all subdued and docile, while the aliens take up varying positions of power and control. So while our eyes see a billboard advertising a holiday our brains are actually being told to conform.Also revealed are the appearance of the aliens living amongst us. Basically most of those in positions of authority or those who are rich are all aliens. They're ugly, with mottled skin, big glassy eyes, no lips and a face full of ugly teeth. When Piper hilariously confronts some of these aliens in a supermarket they realise that ""they have one that can see"", and set about describing his appearance into their Dick Tracy style watches. He then kills two police officers, who are also aliens, and uses their guns to shoot up a nearby bank.With Piper now branded a wanted criminal he tracks down his friend and we're then given one of the most memorable fight sequences ever. After beating each other to a pulp and then finally managing to convince his friend to put on the sunglasses to see the real world for himself, they end up becoming part of a small band of resistance fighters who have been struggling to locate the source of the alien transmissions that have blocking their true identities to the rest of humanity.After a few setbacks and the human resistance almost completely wiped out, we find that some humans are persuaded to join the alien ranks by ratting out anyone who opposes them in lieu of huge bank accounts and a cushy lifestyle. Eventually the transmission device is destroyed and aliens identities suddenly appear on TV, casually sitting among us in bars, or even while enjoying human prostitutes. While They Live doesn't have great acting or memorable special effects, it works because it's an example of how a simple idea, with minimal budget can still gain a cult following and speak to a multitude of people. I'm sure a lot of people can relate to being constantly overlooked for promotion, or never winning the lottery, never being able to catch a break or always managing to be in the wrong place at the wrong time. And quite frankly if you're someone who's never experienced any of this, obviously you're an alien. There's just too many things in this movie that make a truckload of sense and have all the pieces of life's puzzle suddenly fall into place. Luckily this movie can be found almost anywhere like a cheap pair of sunglasses, so grab a copy, watch it several times and believe that ""they live"".",They Live
166,cosmorados,Don't remake that! Remake this!,7,12 July 2008,"Nada is on the scrapheap in a decade of disposable income and disposable people. The world is one that gives all its resources to those that have and increasingly little to those who don't. Something is wrong with the world but no-one can figure out quite what. That is until Nada discovers a pair of sunglasses that don't just darken the view but remove all the colour from the world. It's only when he wears these that he sees the subliminal messages that order to people to obey authority, consume as much as possible, reproduce and generally maintain the status quo. The sunglasses also reveal another secret that is all the more terrifying about the world that I'm not going to go into here.This had the potential to be the best John Carpenter film to date, however the lack of Kurt Russell in the lead role is a clear problem with Roddy Piper being an inadequate replacement for Kurt Russell. The script is pretty darn good and the idea a solid one that is well executed.The really sad thing about both this and ""Dark City"" for me is that both films really make one question the nature of the world we inhabit and invite us, the viewer, to ask questions about the world that also surrounds us, however both of these films, while good, failed at the box office, almost as if the audience where not ready to yet undertake such fundamental questions over existence. It was only when the Matrix was made that such films have started to become more acceptable to a mass audience, although the main thing to be taken from ""The Matrix"" being an overuse of wire martial arts where is is not needed.Not the best John Carpenter film he ever did, but with talk of a remake of ""The Thing"" in the pipeline I wish they would remake this one and allow it to be put together to its best potential.Still all right though.7 out of 10",They Live
