,User_name,Review title,Review Rating,Review date,Review_body,Movie_name
214,hudsonrailey,One of the best Disney animated films ever made.,9,28 January 2019,"This movie is an absolute blast from start to finish. It introduces us to great characters that you seriously care about throughout the plot of the film. It also has tons of fun and funny moments throughout that really make it a joy ride all the way through tollbooth the credits. But what's great about lilo and stitch isn't just the fun behind it, but the emotion. Yeah, it's a cartoon aimed at children, but the characters have so much they are dealing with that at the end when the film finally reaches its happy ending, you feel the pure happiness that many films created nowadays is lacking.Just for the record, I am an almost 19 year old guy and never watched this movie as a kid until just now, so I have no connection or nostalgia to it whatsoever. I cried at the end because of how happy I was, and I have only cried in 2 other movies besides this one. Definitely recommend it. Stitch is now my favorite Disney character ever. It's a perfect family movie!!",Lilo & Stitch
215,Merkal-2,this is dumbo/bambi quality,10,27 June 2002,"This movie could just have been made 60 years ago. It feels the same as Dumbo or Bambi. Simple animation, a couple of characters and a good story though the last is very different then the elepthant or deer. Animating on Elvis songs is wonderfully done. The Hawaiian music is a winner too.When I first read about Disney making a movie about an alien crashing down on earth and taken up in a human family I thought the bosses had lost their mind. No one will ever buy that from the company. I'm glad that I was wrong. A Disney Classic, but with a unexpected approach.Personally I never felt there was anything wrong with the modern, 90's classics where the hero and heroine fall in love defeating the badguy helped by talking parrots, fish, theapots or clocks. I hope that it doesn't take to long before Disney returns to such movies.  I would'nt mind seeing 5 more ""Lilo & Stitchs"" GO DISNEY! Traditional hand-drawn animation rulez forever!!",Lilo & Stitch
216,yasmincheyenne,"Authentic, heart-warming and bittersweet!",10,6 November 2020,"Lilo and Stitch is a unique Disney film and probably their most under-rated movie to date! It depicts the journey of a young orphan named Lilo, and her relation with an Alien species (Stitch). These two characters have fundamental similarities in that they are both misfits and somewhat outcasts in their communities, going through imminent struggles and are longing to find a feeling of belonging and acceptance. Throughout their journey they overcome challenges regarding familial instability, loss & grief, ridicule, judgement and some personality clashes. But nonetheless, the perseverance and genuity amongst everyone involved is what brings the characters together and makes them a unique family unit.Essentially, Lilo & Stitch illustrates acceptance, patience, resilience and forgiveness. And of course, there is the emphasis on Ohana (family). I believe it also encourages uniqueness and individuality, as we see that all characters in this movie not only have physical differences, but their personalities are distinct and very likeable! :)I think the writers and directors did a fantastic job in representing the Hawai'ian culture, which encompasses many of the traits mentioned above. As well as that, the animation in surfing/swimming scenes as well as during Hula are well put together for an animated film in 2002 lol! So kudos to them for the accuracy in representing this Polynesian culture! The soundtrack in this film is also good & fun-loving. This film is very genuine, heart-warming and bittersweet.",Lilo & Stitch
217,CrowServoNelson,Good fun for all,7,7 May 2003,"I was skeptical of the movie at first, but I actually found that it even I enjoy it, and I'm a 16 year old guy who mostly likes action movies and odd humor. This movie fits right in as it has a lot of good lines and actions that will make you burst out laughing.",Lilo & Stitch
218,Mloca7,Very un-disney-like!,9,23 June 2002,"I give major props to the makers of ""lilo and Stitch"". This movie is not what I expected which is a good thing since everything nowadays is so predictable! The characters in this film aren't fake blown out characters...they're real! Lilo and Nani's relationship as sisters resemble me and my sister's relationship so much I had to laugh at the resemblence! Stitch is a different and adorable character and when he speaks it's sooo cute! Combining alien beings and a lil' sci-fi action with a cute hawaiian family story is something I would never expect to see! To sum up this movie in one word it would have to be....DIFFERENT!! People need to get over the fact that its not computer animated because it doesn't matter. The story is great just how it is! One thing I don't get is critics! They said that Disney should of advertised the movie better! WHAT?? I thought it was perfect!! Putting Stitch in the classic Disney movies was hilarious and different and was my whole reason for going to see this film! The hawaiian music is great also! Lilo is not an ordinary innocent little girl and that's great. She's not perfect so we can relate to her more and frankly, watching her jam to Elvis is hilarious! Her family isn't perfect either and the villain in the story is also the hero. So you want to hate Stitch but you can't help loving him either! GO SEE LILO AND STITCH!!!! Disney is back in business!!! Forget all the bad things people say about it! They don't know what they're talking about!!!",Lilo & Stitch
219,MafiaSquirrel,Had me in 'Stitch'es,10,21 June 2002,"<rimshot> Sorry folks (minor spoilers)Despite my bad puns, Disney has a hit on it's hands, a break the mold masterpiece. 'Lilo and Stitch' had lively, spunky characters, fresher, hipper, self-aware humor, and was a surprisingly touching story. I'm a 23 yr old man's man and I cried, don't judge me folks.Lilo is a feisty, kickass little girl and the first scene at her dance class was terrific (""He controls the weather""). She's not as glossy and overdone as some of Disney's characters and heroines in particular. She really could be a kid, full of trouble, but you like her.High praise for the animators, they did an awesome job conveying emotion, behavior and thoughts in Stitch's expressions and motion. Better than I've ever seen in an animated feature before. ('Stallion', eat your heart out!) He's also one of the best Disney characters ever, a rugged little rebel. He, Thumper and Tito are going to form a gang and terrorize Disney studios.10/10 Here's hoping for 'Lilo and Stitch 2: Stitch Takes San Francisco'",Lilo & Stitch
220,pidective,I'm too old for this stuff!,8,19 July 2002,"I went to see this movie with very low expectations.  Normally I think of myself as too old for animated/disney movies.  In the opening sequence I was slightly bored, but when the story really started, I got into it.  The movie had comedy, drama, etc.  It is a lot different then many of the Disney movies that i have already seen.So all in all this is a pretty good movie.  My rating - 9/10",Lilo & Stitch
221,wafflemaker,surprisingly good,9,24 May 2003,"all i heard for months was how adorable lilo & stitch was.  time after time i have heard this about a movie, then come to find that the movie was far less than i expected.  so when i finally got around to seeing lilo & stitch i was more than surprised.  the film was not only adorable but was, for the most part, a very real and touching family tale.  while the opening and ending action is mostly for the kids, the central story of lilo, her sister, nani, and their unusual new pet, stitch is fun for all.  i couldn't help but laugh out loud at times, and yes, i even cried.  the characters and relationships are not only well-developed, but are also, generally believable for a story that deals with aliens.  fun and heartfelt, lilo & stitch is a near-perfect mixture of laughter and tears that balances the real with the outrageous and rides the wave of success clear in to shore.",Lilo & Stitch
222,rbbrfsh,"Inspirational, Touching story of family, Acceptance, and Friendship",8,3 January 2003,"Overall, a very good movie. Disney did a great job on this one. Interesting plot well fitting characters. This movie is great for any age group, not just kids. Some amusing scenes worth watching a second time.I give it an 8/10Not sure why, even though it was an excellect movie, it seemed like something was missing.",Lilo & Stitch
223,pupupupmf,Why I think it's the best Disney animation.,10,9 August 2015,"Which are the Disney undisputed all-time classics? Why The Lion King and Aladdin or course. sure, The Lion King is stellar and Aladdin has the genie... and uh... it has the genie. anyone will say that Disney's golden decade was the 90's which to me is the one where they all started singing for some reason to the point where I was relieved when Phil Collins would do the singing in Tarzan and Brother Bear. To me, the two golden decades of Disney was the 60's (101 dalmatians, The Sword in the Stone, The Jungle Book and The Aristocats) and the early 00's. yeah, sure, Atlantis: The Lost Empire and Brother Bear where kinda mediocre. But The Emperor's New Groove, Treasure Planet and Lilo & Stitch was Disney waking up from there 90's musical/princess/cheesefest trip. Emperor's New Groove was more self-aware and fourth-wall breaking than anything else, Treasure Planet was more ambitious and refreshing than anything else but Lilo & Stitch was just nothing like anything else in the Disney catalog. Then, drawn animation officially died in 2003 when Finding Nemo came out but let's not be resentful of the past, shall we. we're here to talk about Lilo & Stitch.The movie starts of in the extra-terrestrial world where Stitch (currently called experiment 626) and Dr. Jumba are both on trial. Jumba is accused of having created Stitch and Stitch is accused of being Stitch. From this very first scene, everything works beautifully, you feel engaged and sucked into this super cool setup and it's characters including the grand councilwoman (yes, that's her official name) and Captain Gantu. Then, Stitch escapes effortlessly, flies away with a ship and then crashes on our favorite little blue planet. The galactic government peeps decide to send their own version of Laurel & Hardy (Jumba & Pleakley) to Earth to destroy Stitch. Jumba, because he created Stitch and Pleakley, because he's the alien nerd who knows stuff about Earth. What's so great about Jumba and Pleakley is that they're not evil and stupid because they have to be as Disney antagonists. They're actually very likable and are carrying this mission because Stitch is actually a threat during the beginning of the movie. And the reason they keep failing to catch Stitch is not because they're stupid and clumsy but because Stitch is just impossible to catch, which makes it so brilliant.We then get to the good people of Kauai, introducing Lilo and her older sister, Nani. And that's where this wonderful little Disney feature get's very heavy and emotional. Lilo and Nani are orphaned sisters and Nani being the young adult, has to take care of Lilo all by herself, under the supervision of the harsh but fair social worker, Cobra Bubbles. They are all introduced in that first infamously heart-grabbing scene that some will remember having cried to back in the day and maybe still today. The wonderful yet heartbreaking connection that Lilo has with Stitch is that Lilo, too, acts like a strange and destructive alien and can't fit in with anyone due to the troma of having lost both her parents and only having her caring sister left as a parent figure who yet is patience-limited at times while going under the stress of her little sister's odd behavior and finding a job so that the social worker won't have to take Lilo away from her (yes, it's a Disney movie we're talking about). I don't think I have ever seen a film or animation that shows a truer and rawer depiction of sibling relationship, while struggling under the burden of living as a broken family.Eventually, Lilo meets and adopts Stitch in a dog adoption home, as he makes himself look like and act like a dog to stay undercover while trying to get Jumba and Pleakley off his tail. From the point Stitch comes in the picture with Lilo and Nina, he starts of acting destructive and careless while Lilo constantly finds an appeal to him and tries to tame him and soothe him all while Nina is very skeptical of Stitch.Why I think Lilo & Stitch is the best is because it's made for everyone and has the power to move anyone. Everything feels so true and organic, the attention to detail when it comes to timing, dialogue, comedy, little actions and mannerisms, character relations and personalities and the loyal attention to Kauai's culture when it comes to the dancing and the music makes Lilo & Stitch's quality the same level as an award-nominated live-action movie and if Lilo & Stitch was adapted perfectly as a live-action movie and it could be (even though, I don't want it to be), it would still be amazing but of course not as amazing as it's original form. go watch it.",Lilo & Stitch
224,baratheveggie,Lilo & Stitch is beautiful.,9,18 June 2013,"Personally, my favourite Disney films of all time just so happen to be 2 films that came out in 2002. Lilo & Stitch and Treasure Planet. Why you ask? It's because they're the only ones that feel a lot more mature than the rest of Disney films, and focusing now only on Lilo & Stitch, I have to say it is simply stunning and beautiful. Story tackles many real life problems like loneliness, acceptance, alienation, family, friends, and so on, and does so so remarkably well that I sometimes forget that this is a Disney film and not pixar's. The art is beautiful, this film always reminds me of summer and beach, and every credit goes to animation too. I'm not afraid to say that it reached my emotional peak during at least 5 scenes and made me shed a tear, first time it is sadness, other time it is happiness, and than another time it is plain beauty. Make yourself watch it, because Lilo & Stitch is beautiful.",Lilo & Stitch
225,bittervoidz,"My best childhood memories movie, amazing",10,17 November 2019,"I remember all the hype and merchandise and love from this movie as a kid, and it should still be loved. Even if it's old, it's still relevant today, perfectly. It's amazing and sweet and innocent. I love it.Best childhood movie anyone could've watched, and one of the best movies anyone could enjoy STILL to this day. Any age, any gender, any  orientation, any race, etc.This movie is for everyone.",Lilo & Stitch
226,Tremaine,"Great Job, Guys!",10,1 July 2002,"Next to ""Emperor's New Groove"", ""Lilo & Stitch"" is one of the funniest Disney films to come from the animation studio. Rated PG, this film is not really intended for small children and parents should be advised as on all films rated as such to view before taking their children to see the film.However, this film is much more for children than ""Hunchback of Notre Dame"" (1996) or ""Atlantis"" (2001). Stitch is an adorable alien with one thing on his mind, to destroy. Once that mission is completed, he needs to find a purpose in his existence.I could go on with the plot, but go see the film. It's fun, it's wonderfully drawn (as are all the Disney movies) and it's Surf's Up Dude!Enjoy!",Lilo & Stitch
227,vallax66,GENIUS!,10,24 June 2002,"This cartoon film in a word is Genius! Disney has finally stepped away from fantasy and cute fuzzy characters and made a cartoon about real people, real situations, and real reactions. The only farfetched aspectare the aliens.You have Lilo and Nani sisters trying to make it on their own after the loss of their Parents, This I have seen personally in my life and felt the emotional attachment to them. I felt bad when Nani was losing jobs and when Lilo was was being tormented by fellow students and acting out to gain attention, and having to deal with Social Workers whose main existence is to break up families. Even stitch Pleaded that ""My family is a bit broken, but still good""The scenes when Lilo and Stitch are searching for families are more emotional than any other disney feature I have ever seen. I do not understand why Critics like Ebert and Roper gave this film a bad write up, they must not watch Real Life tv shows very often.Now there is the lovable and evil character of Stich, who was made to be the ultimate weapon but learns what the meaning of family is and is taught to create and not destroy. His voice and his antics make him adored by moviegoers from the beginning, and when he suffers so do the fans. I don't believe I have ever seen a more emotional attachment to a movie characterall in all I give this Film a Ten... above episode 2 above spider man... see this movie this summer!",Lilo & Stitch
228,shotfilms,Another ordinary Disney,4,8 April 2020,"This cartoon undoubtedly belongs to the Disney Studio. In flattering reviews you find that this is a very unusual cartoon for Disney. However, this is an actual Disney movie. Here you will find all its usual components: far-fetched problems, American chauvinism, standard plot development, improbable and happy resolution of all issues. This cartoon is suitable for children from 3 to 8 years. Nothing new, but nothing repulsive about it. Another Disney cartoon.",Lilo & Stitch
229,mhhanson,Disney getting it right,8,2 July 2002,"Disney has alway gone through its learning and finding itself time and then getting it right.  After years of concentrating mostly on childrens stories and the like, Disney started breaking the mold with the Emperors New Groove, interesting but lacking in parts.  A good start but not it. Atlantis filled in some of the blanks, but by missing Disney's traditional market mas not it.Like Oliver and The Great Mouse Detective lead to the Little Mermaid, Beauty, and others.  The others have built into Lilo and Stitch an idea based story something fairly new to Disney, but they showed they learned and pulled it off.An enjoyable afternoon was spent by the family ages 3 and up.  The youngest for the first time was enjoying it enough to get off daddy's lap and sit in her own seat and laugh.  She even caught the family and no one was left behind, quoting it to her mother the next day.A little action, a message, and alot of imagination.  8/10",Lilo & Stitch
230,SabeAmidala,"Indeed, Disney has leaped from its deathbed in a fresh burst of life",9,7 December 2002,"I've always been a fan of animated Disney families.  But even my stubborn attachment has not blinded me from the harsh fact that the films have been going downhill for sometime now with only a very few pleasant surprises.When I first saw trailors for this movies, I wanted to see, despite the nagging voice in my head that said it might not be that great.  When it came out, I was met with plenty of great reviews.  Unfortunately, my little college town is not known for a plethera of movie theatres, so summer passed and so did this film from theatre to video/DVD.  When a friend purchased the DVD, only then did I get to see it.What a gem! This twisted and poignant little tale is truly worthy of the name of Disney.The story itself is surprisingly clever and original.  That imagination alone is enough to love this movie.  Then the makers go throw in a bunch of delightfully varying and quirky characters, plenty of humor, and more charm and heart than should be legal.  You are able to understand the characters, know them, and, most of all, love them.This isn't just quality entertainment.  There are several great messages on the importance of family, no matter the kind, and redemption. That's something Disney rarely shows: Most of its heros are heroic at the beginning.  Yeah, the learn something and grow a little bit, but not to the extent of Stitch, Lilo, and Nani.  Stitch begins the movie as an evil and chaotic little alien.  Lilo is a twisted little child who could have grown up to be the next Carrie.  Nani is hardly the typical Disney female with her temper, frustration, and disorganization.  But even as the characters learn and grow, you love them for exactly who they are.The animation is to be appreciated.  It's a tribute to classic Disney hand-drawn animation, with just a touch of computer to give it that nice edge and finish.  Add plenty of Hawian color, and you got a film that is just great to stare at.I don't know where Disney's been hiding for so long, but I'm glad it decided to crawl out and start actually working under its reputation.This movie is with Disney's finest.(I'm also happy to say that this film was not a one-time thing. I had the pleasant opportunity to see ""Treasure Planet"" last week. It's also top-notch.)",Lilo & Stitch
231,simian123,Thank the good lord Disney hit the Jackpot!!,9,9 October 2002,"This is by far one of the best Animated Disney films to date.  Asaid from the typical Disney ""family is where the home is"", this is very entertaining. In every Disney film there is always a character which is trying to be a cute little ball of fluff, and this is no exception.  Except fo the fact that the cute creature is a weapon of mass destruction with a blue car and a chain saw.  The plot is slow to get going but once it pick up you'll be fully engrosed in it.  Jokes in the movie are fresh and won't date with time.  Suffice to say, ""oh good, my dog found the chainsaw"" is one of the memerable parts of the film.  Strangly origonal with a hint of Disney magic that makes this film a must see for people of all ages, if you do not agree take what sense of humour you have and trade it in for Lilo and Stich.",Lilo & Stitch
232,Helto1,Simply Wonderful,10,4 December 2002,"This is one of the most original, cutest, funniest Disney movies I've ever seen.  It's such a great, refreshing movie from Disney.  It's not a fairy tale, not a sequel, not someone else's movie redone.  A very original cast, including the cutest non computer child (right with Boo from Monsters Inc.) and the nastiest little alien ever created.  Stitch is the most rotten little cartoon character you've ever seen.  Until Lilo gets a hold of him. It's amazing to watch this movie, and see the relationship unfold in front of you.  He goes from being that mean, evil little guy, to the most cuddly, lovable creature ever put on film.  The Elvis references, the lush Hawaiian scenery, the music, everything screams fun, and beauty.  If you would like to show a movie to your child about the values of friendship, or if you would just like to be entertained by one of the most quality cartoons ever created, this is exactly the movie for you.",Lilo & Stitch
233,DNDRKOWILLSAVEUS,Disney is going to Hell in a hand basket!,5,29 August 2002,"Disney needs to shape up and put some movies out that are worth watching. I think the last decent film they made was ""Mulan"".  This movie was way too sweet and sappy.  I really thought that my teeth were going to rot out of my head.  I usually like family fare, but this was pushing the sympathatic angle a little too much!  Although it was good to see them go back to water color!",Lilo & Stitch
234,BananaKidOfDoom,"This movie is so good, it's...really good.",9,11 April 2005,"Disney isn't exactly known for the same quality as they used to be. The biggest problem is how they've lost their originality, churning out sequels and based-on-blahdeeblah movies. However, Lilo & Stitch is not only original, it has the same charm and appeal that some of the best classics had.This movie is a master at manipulating your emotions. When I watched it, I laughed when it wanted me to laugh, I sat on the edge of my seat(nearly falling off), and nearly started sobbing. This movie will make you feel whatever the heck it wants you to, but they're all enjoyable.One part of it, where Lilo tries to teach Stitch to be an Elvis imitator, had me smiling constantly the entire way through. My cheeks seriously hurt when it ended.Stitch is perhaps the most lovable little monster you'll ever see in a movie, and this Lilo & Stitch is perhaps one of the most lovable movies you'll ever see. One of Disney's finest, let us move aside Cinderella and Aladdin to make room for a new classic.",Lilo & Stitch
235,madeline-18,The best movie ever!!!!!!!!,10,26 February 2006,"This movie was excellent it is one of my favourite movies because it shows how you have to have fun and how you have to work hard.This movie also shows sadnes happiness and aliens from outer space. Their are also lots of songs that soot the movie perfectly.I loved this movies surprising parts. It gets sad, but it ends well. This movie had the voices with a lot of expression for exampul lilo played by daveigh chase that is very expressive. when I saw this movie on tape I wanted to watch it over and over and over again I could not get enough of the music and great scenes. This movie was one of the best movies I have ever seen I do not know what you would give this movie, but I give it 10\10.",Lilo & Stitch
236,glammypearpuff,My all time favorite,10,30 September 2019,"Well.. I love this movie. It's sad, warm, entertaining and makes us all realize family is everything.",Lilo & Stitch
