,User_name,Review title,Review Rating,Review date,Review_body,Movie_name
148,BlackX,An ugly alien and a orphaned girl. Who knew it would be so good?,8,19 December 2002,"A tall blue alien is walking toward a podium, surrounded by a stadium of aliens. One chubby purple alien with a strange accent and 4 eyes stands in front of her on a high, floating platform. A giant alien is told to read the charges, and he announces that the chubby purple alien has been accused of experimentation on a genetic level. It is announced that they believe he had created something, and a covered floating platform rises a few feet to the chubby alien's side. It is revealed under the covering a blue, 2-armed alien with large blue eyes, huge ears, and a smirk on his face.
Lilo & Stitch follows the adventures of two beings who meet up. Lilo is a 6-year-old depressed Hawaiian girl who listens to Elvis. Indeed, after the action-oriented introductory first 10-minutes, we do feel more than a little heartbroken for a while. She has no parents, and her sister, although good at taking care of her, does have some bad luck with a certain day and a certain man sent to check in on them.Stitch is the experiment. Made to be destructive, he lands on Earth after a daring escape(or a lucky escape, whatever your look)and starts going through some tough times when he finds Hawaii has no large cities.After an hour, Stitch is in Lilo's care in a last ditch effort for Lilo to stop being depressed in front of the service man, named Cobra Bubbles. With nothing to destroy, Stitch must look for the next greatest meaning he can find. That, is the center of this story: family.Ohana means family. Family means no one gets left behind, or forgotten.Stitch turns to a very short version of The Ugly Duckling in a Nursury Rhymes book, and starts relating to the lost bird.Finally, many aliens sent to capture Stitch, or Experiment 626, meet up, in a grand explosion, a serious time, and a slightly confusing action battle.Stitch, who had brought in his alien features to slightly resemble a dog, does eventually grow on you, he's super cute by the end, and you're happy to know a second movie, more of a prequel, is being made probably featuring the little guy. And you gotta love his voice. It is forgotten in a 50 minute period of growling, but you won't not be able to hear it enough eventually.Lilo, though amusing, seems to be missing something, yet she is enough for one movie.The first exclusively water-colour background Disney movie since Dumbo looks amazing, if you are slightly put off by the cartoonish look. The emotion and story is far beyond anything expected, especially for a Disney movie. And, though some seems trailed, the actual execution of the plot is almost up to it's fullest, with a few tweaks here and there. And I do want to see Stitch again, if not Lilo.",Lilo & Stitch
149,kennethtownsend-97230,Lilo and Stitch,10,15 October 2015,"My analysis for the movie Lilo and stitch was a very funny and heart warming movie. It taught me that when you aren't looking for something it will always be there. I think that when stitch was all alone and he was looking for someone he is didn't realize that what he was looking for was a family. In the movie there're was a phrase family never gets left behind. I think that it was an extremely sweet when Stitch came back to save Lilo. When I watched this movie I had a lot of laughs, it may or may not seem like a funny movie, but if you watch the movie then you could really learn that family is everything and that they will always be there for you mono matter what. You may learn a different lesson, but the main point that the director is trying to get across, is that family everything. This movie was very funny and I think that the next Lilo and Stitch movie will be even funnier. To sum up what I've said is that the moral part of the movie is that family is every thing and no one gets left behind.",Lilo & Stitch
150,yolibarvueswag,A Great Experience To Wash Out Many Bad Tastes In My Mouth,10,14 February 2021,"This movie, was amazing. I think it's really underrated IMO. I had a incredibly fun time watching this movie, and while I wish they kept some deleted parts at the end, I still love it. It is far more deserving of attention compared to everything else I watched and despised, and I hope humanity learns from this.A movie that holds my attention, and I never get bored watching.",Lilo & Stitch
151,jtana1,The beautiful Stitch,6,1 March 2020,"One of my favorite characters I found here and is Stich, tender, bully, cunning and funny that together with his extraterrestrial colleagues know how to entertain and make us have a good time. The occurrences of these characters are very good, so the film is becoming enjoyable, life with Lilo and her sister is somewhat turbulent at the beginning until it becomes a bit exhausting, in addition to that it lacked something else. Sometimes I think that seeing more of Stich and his intergalactic world would have been better.Interesting.",Lilo & Stitch
152,alecblair-96768,A wonderful Classic,10,14 June 2020,"I love the movies and the series, absolutely wonderful!!",Lilo & Stitch
153,Ziman,7 of 10 stars. Another Disney non-musical.,7,13 July 2002,"When one thinks animated feature' (at least in the North American sense), one conjures up a musical rendition of an adapted fairy tale or legendary story.  Disney has been largely successful with that format in the past, and they seem to be diverging from it.  They brought us the hilarious antics in `The Emperor's New Groove' which was furthest from that format.  Now they bring us another break from the pack, `Lilo & Stitch'.Experiment 6-2-6' was designed by an alien race to be a super-soldier of sorts.  An artificial life deemed to be unsafe it is condemned to imprisonment.  However, it's clever enough to elude its captors, escapes, and crash-lands on Earth.  The landing target is, of all places, Hawaii where it is adopted by a young girl named Lilo (pronounced LEE-lo').  She is unaware of the creature's origins, mistakes it for a strange dog, and names him `Stitch'.  The story follows Lilo and Stitch (hence the title) as Lilo struggles with her broken family life (being raised by only her older sister), and Stitch adapts to life on Earth, while attempting to avoid capture by the society from which he escaped.  I found this film to be as entertaining to me, as the children in the theatre found it. The relationships in this movie are those that children can relate with.  Stitch's adapting to life in Hawaii is one that comes off quite comical, and routinely unexpected.  His social skills are lacking, and he reacts quickly, without thought, which is the source for the comedy.  I found myself laughing out loud at several of Stitch's antics, and his overall character behaviour really doesn't grow tiring.The movie does take an emotional side too as Lilo confronts her broken home and grows attached to Stitch, who ultimately is threatened with his own capture.  Although it could have gotten completely sappy at the end, it doesn't, which is refreshing.  Of course, it is a Disney feature, so a happy ending is always expected, but it's a light one complementing the light-hearted romp of this movie.Granted, it's not Disney's platinum achievements, nor is it an AMAZING story but given the low-key promotion this movie has had, it might slip by you un-detected.  My recommendation is that you do not let this happen. It's completely suitable to go to with children, or as a date flick, or even with a buddy.",Lilo & Stitch
154,humpback,a change from the pace,7,6 June 2002,"I had the chance to see Lilo and Stitch at a ""Surprise"" Sneak Preview ( without prior warning ) - and laughed my head off.This is NOT standard Disney ""sweeter-than-Cotton-candy"" fare - even more so than the surprisingly good ""the Emperor's New Groove"" it takes a rather anarchistic humour and comic hyperbole, stirs, shakes and twirls it to a new degree of potency and serves them with a flourish.As for the story - an escaped, genetically enhanced lifeform programmed for the wholesale destruction of cities and with a keen sense of survival and cute blue fur ) escapes from its creators, its jailors and the whole of the ""united-galactic-whatever"" and gets stranded in............. Hawaii. Here it gets adopted/picked up by child-terror Lilo, the bane of her older sister, her playmates and the general sanity of the pacific island. On its trail - the mad alien scientist and a fumbling galactic bureaucrat concerned with the safety of the local wildlife - humans and other ""sucky"" species...... A perfect setting for large scale chaos, groovy scenes ( in two words - ""Elvis lives"" ) and much less than expected emotional, family values scenes.As for the technical side - the animation is not especially outstanding, the backdrops at some times unbelievably ""kitschy"" and very little computer animation visible (though I do have some suspicions, they do not distract/jar with the conventional animation ), colours stay themed and the soundeffects are cool. Oh, did I mention, there was hardly any singing ? THERE IS HARDLY ANY SINGING ! Thanks Disney, you are finally getting the clue ! Now keep up the good work............There is little of the ""sweet and furry"" and ""perfect family"" stuff which used to be almost a Disney trademark , but when some ""touchy"" scenes come deep out of left field, they are even more poignant for it. Real life problems like broken families, unemployment and child care by single parents are presented in an unobstrusive and ""simplified for children"" way and add motivation to the characters without dominatiing the plot. Adults will get a series of laughs out of subtle (MIB, Godzilla, Star Trek etc.) and less than subtle ( Elvis ) references, with big orgies of comic destruction and some fun science fiction gadgets helping out. Basically everyone in the theater walked out with a big and wicked grin (although they were all adults due to it being a sneak preview, I do have a fair suspicion how my six year old nephew is gonna like this movie....). This is a family movie in the best ""take everyone, and have them enjoy themselves together"" sense , as well as flick that one can simply go and enjoy as an adult (ok, one with a sense of anarchistic humour ).",Lilo & Stitch
155,damion-891-180122,Kinda strange movie,6,27 October 2018,So the little girl is smart enough to know that she might be taken away from her sister and yet she makes her sister miserable because she doesn't want a mother but a sister and then the smart little girl believes the story that her sister was fired not because of Stitch. I mean this movie was suppose to be a hit but I can't see it. I think the best in this movie is that its rocking Presley. If you want a good for kids animation you can definitely find better.,Lilo & Stitch
156,JackBauerPowerHour,The Great Disney Company is Back.,10,22 November 2003,"Seeing this wonderful film, I was amazed with everything. The story is fresh and delightful, the animation is very beautiful and the characters are all entertaining especially Stitch. The relationship between Lilo and Nani is very powerful because there trying to become a family and also trying to take care of each other. Chris Sanders came up with the idea for this, I hope we see more of his writting and directing in the future of this company. Disney hits a big home run with this animated classic which they haven't done since The Lion King. No wonder this was acclaim and a Box-Office hit. There's nothing more I could say about this wonderful film. Kids and Parents should see this together. Is hard to say if this is gonna be remember like other great animated movies because I'm never gonna forget it.(A-).",Lilo & Stitch
157,Queen_of_Shadows,Great Movie,8,3 April 2005,"This was one of Disney's best classics.Stich was the alien experiment created to cause destruction by a mad scientist named Jumba.Stitch later escapes using a ship to get to Earth and lands on the island of Honolulu,Hawaii.Lilo is a young Hawaiian girl who doesn't exactly fit in with the other girls in her Hula dancing class.Lilo lives in a house with her sister Nani because their parents died in a car crash.Lilo just wants a friend who will accept her for who she is and Stitch just wants to fit in and find a family.This was one of the cutest movies I've seen since The Lion King.Lilo and Stitch are the cutest animated duo in Disney history.I rate this movie an 8/10 for humor,touching moments and a new discovery of friendship.",Lilo & Stitch
158,I_am_Jacks_Revenge,I love this movie.,10,11 August 2007,"This movie is one of the best Disney movies I've seen in a while. It's a part sad story if you think about it after watching it.Plot: Experiment 626 has been deemed dangerous and his creator has been sentenced to prison, but 626 escapes from the Intergalactic space jury or something like that. I forget what they are called. So, he hijacks a spaceship, and heads off into space, only to crash on our planet Earth. The creator has been assigned to retrieve 626 and bring him back to them.Meanwhile, on Earth (on one of the islands of Hawaii), there is a little girl named Lilo. She was just giving him a peanut butter sandwich. Apparently, the fish--his name is Pudge--controls the weather. She is like a social outcast because the other girls don't really like her. She lives with her sister Nani, who finds her sister listening to Heartbreak Hotel and the doors barred with wood and the door is locked (I like when she says in a depressed way, ""Leave me alone to die.""). A social worker named Cobra Bubbles has come to look over Nani and Lilo to see how their home is like. The problem is that if he's not satisfied, Lilo gets taken away from Nani. Nani gets one week. One of my favourite parts is when Cobra says, ""Let's talk about you. Are you happy?"" Lilo says, with Nani assisting behind Cobra's back, ""I'm adjusted. I eat 4 food groups and look both ways before crossing the street. And take long naps... and get disciplined...?"" ""Disciplined?"" ""Yeah, she disciplines me a lot. Sometimes 5 times a day. With bricks."" ""Bricks?"" ""Yeah, and a pillowcase..."" Nani butts in, ""Okay, that's enough sugar for you... little cutie.""When 626 lands on Earth, he doesn't know what will happen. He first gets hit by a truck. What a welcome, eh? He wakes up in a dog pound. Coincidentally, Lilo is there to get a dog. He has 6 legs, but he sucks in 2 to blend in. When she picks him, Nani and the store owner freak. ""Oh yes, all of our dogs are available...... EXCEPT THAT ONE!!!!!!!!"" ""What is that thing?!"" ""It's a dog.. I think. But it was dead this morning."" ""IT WAS DEAD THIS MORNING???!!!!"" ""We thought it was dead! It was hit by a truck!"" I love that part! Lilo calls him Stitch (which isn't a real name... in.... Iceland). Thus begins their adventures.A very cool part was when Stitch was told to build something. So he took a couple of books and other materials and made something. ""Wow, San Fransisco.""One of the sadder parts is when Lilo is talking to Stitch about her parents. ""It was rainy, and they went for a drive."" It was so...... sad. This was a really touching movie. I really liked it because of the funny parts and the sad parts. It really is about family and that they should always stick together. If you don't believe me, watch the movie and think about it.",Lilo & Stitch
159,Windwalkerz,Some pets shouldn't be paper trained,10,6 July 2002,"This was a wild ride. I loved it. I am glad I went to see this on the big screen. The music was beautiful. Dont jump up and leave the minute the credits start. There are ""family photos"" that are displayed as the credits roll.",Lilo & Stitch
160,nintendogs03,I really like this movie,8,1 October 2012,"I enjoy this film a lot. I really like Elvis Presley and I get a picture of surfing and Hawaii. What I really like about this movie is the theme of family. It's true that we can't leave them behind. No matter how much of a pain they are at times. Lilo and Nani's relationship is very similar to mine and my little sisters back in the day. She's the loudmouth, clumsy one and I'm the responsible one. We have a bond over Lilo and Stitch which makes us even closer than ever before. I'm grateful that the Disney Co. created this movie with Elvis music! This review is much shorter and less dense than my other reviews. Please watch this movie. It's enjoyable, relateable, sad, and cool at the same time!",Lilo & Stitch
161,Phenryss,Stitch Rules!,7,30 June 2002,"Okay so this is not ""The Little Mermaid"" or ""Beauty and the Beast"", but it is not too shabby either!  I liked the approach of the movie, to make it a little more intelligent than just strictly kid stuff. 
Lilo - Little girl with big heart...but likes to get in trouble.Stitch - Little alien with a big heart...but also likes to get in trouble!!Stitch made this a fun movie.  Seeing how he adapted to his surroundings and so on was fun.  I liked seeing it.The music was a little bit much...Elvis Pressley is an alien...ehehehe...sorry could not pass that up!  Would have been nice to have more of the Hawaiian music interspersed throughout. 
Voice casting was wonderful...as was the animation, although I wish they had not made everyone look like Muppets!!  Teeth people Teeth!!Overall a fun movie for all!",Lilo & Stitch
162,mrusty5,Ohana Means Family,10,1 September 2009,"What do you get if you cross an alien, Hawaii, Elvis Presley and the meaning of family? The almighty piece of artwork called Lilo and Stitch.The film is a delightful sci-fi family film created by the Walt Disney Company shortly before their descent into Dumbville, population them. The film focuses on two unique characters; Lilo, a young lonely Hawaiian girl who is living with her older sister Nani who in turn in struggling to cope being a guardian since their parents died offscreen (what is it with Disney and killing off parents); the second is Experiment 626, a maniacal genetically-created alien who escapes imprisonment and goes on the run, crashlanding in Hawaii but due to be run over by a three trucks, he ends up in a dog shelter and is adopted by Lilo as a dog named Stitch.Stitch at first uses Lilo as a shield to protect himself, but over time he learns the concept of ""Ohana"" - which means family, and family means that ""nobody gets left behind or forgotten"". Stitch turns from a destructive and cruel person into a courageous, caring and loyal figure. Lilo also changes to some extent. The film has a well-rounded amount of characters and each of them have a designated goal or desire and enough screen time. Lilo wants a friend, Stitch's motives change over time, Nani wants to be a good guardian towards Lilo, David wants to date Nani, the list goes on.In regards to the villains, well there are two interesting things: There are effectively six villains in the film, but none of them are proper Disney Villains and wish to conquer the world or harm someone: Mertle is a typical bullying and pompous little girl who picks on Lola out of fear; social worker Cobra Bubbles is just doing his job despite wanting what's best for Lilo and Nani; Jumba and Pleakley are hunting Stitch for personal reasons; Gantu is doing his job too and sees Stitch as a threat to the universe; and the Grand Councilwoman is also doing her job for the greater good and protection of the universe.There are many emotional and memorable moments throughout the film and reflects on the tale of the Ugly Duckling - Lilo, Stitch and other characters being outcasts and are brought together by Ohana and over such emotions. Each of the primary characters (Lilo, Stitch, Nani, Jumba and Pleakley) all have their own individual scenes alone or in the company of a close affiliated character.My favourite is when Jumba observes Stitch and comments to Pleakley that he never created Stitch for a greater purpose other than to destroy everything and questions what it must be like not to have any memories or anything else to remember. There's a charming scene seconds later of Stitch looking around for something to do, and starts reading books, coming across the Ugly Duckling book.There are many more great moments in the film, some comical (e.g. Stitch plays an Elvis song through his mouth) and musical numbers to enjoy. The last twenty moments goes into the traditional sci-fi wham-mo blammo, but the emotion is still there.Like many Disney films I've seen, I highly recommend you view this film.",Lilo & Stitch
163,ghostface18,The best Disney movie and the most unique one,10,31 January 2003,"If you haven't seen this movie, you are missing out. If you hated this movie, you obviously don't know what a good movie is.  This movie is top notch on every level, with the exception of acting, since it is an animated feature.  The animation is unbelievable, the cast is terrific, the humor is PERFECT, the story is great, and the runtime is good.  I read in the Boston Globe that Stitch was ugly. They said that he isn't even, ""so ugly he's cute, he's just altogether ugly.""  I couldn't disagree with this more. Stitch is the cutest character, in my opinion, ever to be put on screen, he is cool, and he has a funny voice.  The humor as well as the story and content is very adult-based and warning to parents, some kids may get scared.  Nevertheless, this movie is recommended to EVERY movie viewer.",Lilo & Stitch
164,Will_Scarlet,Suprisingly moving.,10,3 March 2004,"It's hard to say what this movie is: A crazy sci-fi story, or a serious family drama, or both? The trailers showed it as one, big, crazed sci-fi epic, but I was amazed at how much this movie touched me. Opening at an intergalactic tribunal overJumba Jookiba, an alien scientist jailed for creating a living weapon of mass destruction, and developing into a high-speed star-trek type chase as theexperiment escapes to Earth, the movie segues into the introduction of a little Hawaiian girl named Lilo, who is clearly not a typical five or six year old. She makes sacrifices to a fish she believes controls the weather, reads books about voodoo, posts pictures of obese tourists on her walls, and adores Elvis, and her older sister is clearly struggling to raise a child like her since the death of their parents. The relationship between the two sisters is handled remarkably well, and is a welcome change in a Disney movie. Having the writers drop ""Stitch,""the destructively deranged alien experiment into this family seems like too big of a risk. But the story's appeal does not come from the comedy of this familydealing with Stitch's antics, but from the effect the family has on Stitch. He is very much like the Frankenstein monster, knowing he is unnaturally created, andfeeling he lacks what the rest of the world has, and doubtful, knowing he is built to destroy, that he can fit in. His lonely night scene, in which he cries into the night ""I'm lost,"" is just as moving as any scene from Dumbo, Bambi, or MaryPoppins. Chris Sanders, writer and director for the movie, makes Stitch aremarkably sympathetic character, aside from the physical and verbal comedy,in which his voice is the joke as much as Donald Duck's. David Odgen Stiers,under Eastern European accent, does the honors for Jumba, while KevinMacDonald, imitating Jerry Lewis' vocal styles, is a hilarious Pleakley, the erratic expert on Earth. Also excellent is Ving Rhames as the Man-in-Black turnedSocial Worker, ""Cobra"" Bubbles, going back to his ""Pulp Fiction"" stylings. The real credit, however, goes to Daveigh Chase for her in depth, eccentricallyinnocent portrayal of Lilo. Finally, the film's Hawaiian setting is well done, helping to break away from the stereotypes that have existed for years. Therendition of ""Aloha Oe,"" which has become a hoaky Hawaiian stereotype foryears, reminds us that it is a song of goodbye. The watercolor backgrounds give the movie a delightful old-fashioned feel, contrasting almost comically with the new-age themes. Do the two stories mix well? Does the movie move too quicklyfrom scene to scene? Who cares! Don't think about that while you watch, andthis movie will capture your heart! Movies that do that don't have to make sense all the time.",Lilo & Stitch
165,schuhj,Stitch is a winner,9,22 June 2002,"I think that Disney has come up with a winning new character  in Stitch. The story line is not as good as it might be , but it starts off with a bang and keeps moving. The occasional frenzy ends  down often enough to make us care about the characters and it has plenty of comic touches. It seems to be a hit, so that will give a boost to two-dimensional cartoons.",Lilo & Stitch
